35707	CLV LVG VGA GAP APG PGY GYS YSS SSA SAS ASK SKI KII IIF	KLGGALQAK
708	CAA AAL ALW LWG WGW GWE WEL ELP LPT PTH THF	KLGGALQAK
34272	CIV IVR VRS RSW SWV WVF VFY FYN YNQ NQG QGG GGK GKL KLI LIF	KLGGALQAK
35958	CAV AVN VNG NGG GGT GTG TGR GRR RRA RAL ALT LTF	KLGGALQAK
35675	CIV IVR VRV RVA VAN AND NDM DMR MRF	KLGGALQAK
25925	CAA AAS ASE SEG EGA GAP APD PDK DKL KLI LIF	RAKFKQLL
2568	CAG AGH GHT HTG TGN GNQ NQF QFY FYF	IVTDFSVIK
26210	CAY AYR YRS RSP SPF PFG FGG GGN GNE NEK EKL KLT LTF	KLGGALQAK
34012	CAV AVR VRD RDN DNS NSG SGN GNT NTP TPL PLV LVF	KLGGALQAK
34265	CAL ALS LSE SEA EAI AIK IKA KAA AAG AGN GNK NKL KLT LTF	KLGGALQAK
5608	CAW AWS WSS SSN SNA NAG AGG GGT GTS TSY SYG YGK GKL KLT LTF	GILGFVFTL
22323	CAD ADS DSG SGG GGG GGA GAD ADG DGL GLT LTF	RAKFKQLL
10407	CVV VVY VYY YYG YGG GGK GKL KLI LIF	RAKFKQLL
35197	CAF AFP FPS PSG SGT GTY TYK YKY KYI YIF	KLGGALQAK
109	CAV AVR VRP RPD PDK DKL KLI LIF	ELAGIGILTV
24282	CAA AAS ASE SET ETS TSY SYD YDK DKV KVI VIF	RAKFKQLL
2756	CAD ADS DSG SGG GGG GGA GAD ADG DGL GLT LTF	IVTDFSVIK
23897	CAP APR PRE RET ETS TSY SYD YDK DKV KVI VIF	RAKFKQLL
34715	CAV AVP VPT PTS TSG SGT GTY TYK YKY KYI YIF	KLGGALQAK
28301	CAA AAS AST STN TNA NAR ARL RLM LMF	KLGGALQAK
30399	CAG AGP GPA PAE AEV EVS VSG SGG GGS GSQ SQG QGN GNL NLI LIF	GILGFVFTL
5287	CAV AVR VRY RYN YNT NTD TDK DKL KLI LIF	KLGGALQAK
17966	CAA AAT ATD TDN DNN NNA NAR ARL RLM LMF	KLGGALQAK
36067	CAL ALS LSE SEA EAF AFT FTG TGG GGG GGN GNK NKL KLT LTF	KLGGALQAK
28451	CAV AVG VGA GAD ADG DGG GGY GYN YNK NKL KLI LIF	KLGGALQAK
22309	CAD ADS DSG SGG GGG GGA GAD ADG DGL GLT LTF	RAKFKQLL
23006	CAW AWN WNP NPD PDN DNY NYG YGQ GQN QNF NFV FVF	KLGGALQAK
35648	CVV VVS VSL SLK LKT KTS TSY SYD YDK DKV KVI VIF	KLGGALQAK
5188	CAP APM PMD MDS DSN SNY NYQ YQL QLI LIW	KLGGALQAK
35467	CAM AMS MSV SVF VFY FYN YNQ NQG QGG GGK GKL KLI LIF	KLGGALQAK
34799	CAA AAS ASP SPF	KLGGALQAK
5163	CAG AGG GGG GGS GSQ SQG QGN GNL NLI LIF	GILGFVFTL
33930	CAF AFM FMK MKH KHG HGG GGG GGS GSE SEK EKL KLV LVF	KLGGALQAK
30401	CAL ALS LSE SEA EAG AGL GLY LYN YNF NFN FNK NKF KFY FYF	KLGGALQAK
247	CAG AGH GHT HTG TGN GNQ NQF QFY FYF	IVTDFSVIK
34761	CAV AVS VSG SGY GYS YST STL TLT LTF	KLGGALQAK
2290	CAA AAT ATY TYT YTG TGG GGF GFK FKT KTI TIF	KLGGALQAK
31267	CAS ASG SGG GGG GGS GSE SEK EKL KLV LVF	GILGFVFTL
35303	CAE AER ERS RSG SGG GGS GSY SYI YIP IPT PTF	KLGGALQAK
35161	CAL ALS LSD SDT DTS TSG SGN GNT NTP TPL PLV LVF	KLGGALQAK
5105	CAT ATD TDA DAG AGD GDT DTG TGR GRR RRA RAL ALT LTF	KLGGALQAK
25441	CAA AAS ASE SET ETS TSY SYD YDK DKV KVI VIF	RAKFKQLL
35734	CAA AAL ALS LSN SNF NFG FGN GNE NEK EKL KLT LTF	KLGGALQAK
14187	CAM AMR MRE REG EGQ GQG QGG GGG GGF GFK FKT KTI TIF	KLGGALQAK
36226	CAV AVS VSG SGN GNT NTP TPL PLV LVF	KLGGALQAK
27120	CAE AET ETH THS HSG SGG GGS GSN SNY NYK YKL KLT LTF	RAKFKQLL
5645	CAY AYG YGT GTN TNA NAG AGG GGT GTS TSY SYG YGK GKL KLT LTF	GILGFVFTL
34229	CAG AGQ GQS QSG SGN GNQ NQF QFY FYF	KLGGALQAK
34063	CVV VVT VTD TDR DRS RSN SND NDY DYK YKL KLS LSF	KLGGALQAK
34759	CLV LVG VGD GDS DSN SNA NAG AGN GNM NML MLT LTF	KLGGALQAK
36021	CAG AGA GAG AGY GYW YWG WGQ GQN QNF NFV FVF	KLGGALQAK
22993	CAV AVR VRG RGS GSQ SQG QGN GNL NLI LIF	KLGGALQAK
34933	CAV AVR VRN RNS NSG SGN GNT NTP TPL PLV LVF	KLGGALQAK
25384	CAA AAS ASA SAA AAA AAG AGG GGG GGA GAD ADG DGL GLT LTF	KLGGALQAK
35311	CAV AVR VRG RGG GGN GNQ NQF QFY FYF	KLGGALQAK
28363	CAM AMR MRE REG EGR GRD RDP DPN PND NDM DMR MRF	KLGGALQAK
7313	CAG AGG GGG GGD GDG DGG GGS GSQ SQG QGN GNL NLI LIF	GILGFVFTL
34246	CAV AVT VTG TGN GNN NNA NAR ARL RLM LMF	KLGGALQAK
2284	CAV AVG VGG GGL GLV LVF VFG FGN GNE NEK EKL KLT LTF	KLGGALQAK
35719	CAT ATE TEG EGG GGL GLY LYN YNF NFN FNK NKF KFY FYF	KLGGALQAK
31359	CAE AER ERQ RQN QNF NFV FVF	GILGFVFTL
24428	CAT ATD TDA DAS ASG SGG GGS GSN SNY NYK YKL KLT LTF	RAKFKQLL
34417	CAY AYS YSN SNF NFA FAG AGN GNN NNR NRK RKL KLI LIW	KLGGALQAK
23244	CAV AVN VNT NTG TGF GFQ FQK QKL KLV LVF	ELAGIGILTV
2421	CAL ALS LSD SDV DVE VEY EYG YGN GNK NKL KLV LVF	KLGGALQAK
35898	CAE AET ETP TPG PGS GSS SSN SNT NTG TGK GKL KLI LIF	KLGGALQAK
171	CAV AVS VSQ SQG QGG GGA GAD ADG DGL GLT LTF	ELAGIGILTV
24360	CAA AAS ASG SGG GGG GGS GSQ SQG QGN GNL NLI LIF	RAKFKQLL
53	CAV AVG VGG GGL GLV LVF VFG FGN GNE NEK EKL KLT LTF	RAKFKQLL
2572	CAV AVS VSD SDP DPP PPS PSG SGN GNT NTP TPL PLV LVF	IVTDFSVIK
35953	CAE AER ERV RVY VYN YNQ NQG QGG GGK GKL KLI LIF	KLGGALQAK
5554	CAA AAR ARV RVR VRG RGF GFG FGN GNV NVL VLH LHC	AVFDRKSDAK
24671	CAA AAR ARE RED EDQ DQT QTG TGA GAN ANN NNL NLF LFF	RAKFKQLL
35728	CAG AGQ GQS QSY SYG YGN GNK NKL KLV LVF	KLGGALQAK
30524	CAG AGS GSG SGS GSQ SQG QGN GNL NLI LIF	GILGFVFTL
35621	CAM AMS MSD SDS DSN SNY NYQ YQL QLI LIW	KLGGALQAK
34394	CAM AMR MRE REM EMM MMT MTT TTD TDS DSW SWG WGK GKL KLQ LQF	KLGGALQAK
23974	CIL ILR LRE RET ETS TSY SYD YDK DKV KVI VIF	RAKFKQLL
5522	CAP APP PPS PSF	ELAGIGILTV
31630	CAG AGA GAG AGG GGG GGS GSQ SQG QGN GNL NLI LIF	GILGFVFTL
28728	CAV AVM VMD MDS DSS SSY SYK YKL KLI LIF	KLGGALQAK
25075	CGT GTE TEY EYP YPN PND NDY DYK YKL KLS LSF	GLCTLVAML
208	CAE AES ESE SEG EGP GPT PTY TYT YTD TDK DKL KLI LIF	RAKFKQLL
17577	CAA AAS ASE SET ETS TSY SYD YDK DKV KVI VIF	GLCTLVAML
35607	CAA AAS ASQ SQG QGA GAQ AQK QKL KLV LVF	KLGGALQAK
34321	CAM AMR MRG RGP GPI PIS ISG SGG GGY GYN YNK NKL KLI LIF	KLGGALQAK
193	CAG AGH GHT HTG TGN GNQ NQF QFY FYF	IVTDFSVIK
23238	CAA AAT ATP TPD PDG DGQ GQK QKL KLL LLF	KLGGALQAK
36284	CAV AVD VDL DLM LMK MKT KTS TSY SYD YDK DKV KVI VIF	IVTDFSVIK
29893	CAA AAS ASG SGY GYD YDY DYK YKL KLS LSF	GILGFVFTL
26150	CAY AYR YRV RVD VDD DDM DMR MRF	RAKFKQLL
4973	CVV VVE VEG EGG GGS GSY SYI YIP IPT PTF	KLGGALQAK
35876	CAD ADN DNY NYG YGG GGS GSQ SQG QGN GNL NLI LIF	KLGGALQAK
17003	CTS TSV SVL VLC LCI CIT ITP TPT PTS TSS SSS SSL	GLCTLVAML
31081	CAF AFM FMV MVG VGA GAG AGG GGT GTS TSY SYG YGK GKL KLT LTF	GILGFVFTL
85	CAV AVV VVP VPR PRG RGT GTS TSG SGS GSR SRL RLT LTF	KLGGALQAK
26125	CIL ILR LRD RDV DVR VRG RGQ GQN QNF NFV FVF	RAKFKQLL
2403	CAG AGI GIY IYS YSG SGA GAG AGS GSY SYQ YQL QLT LTF	KLGGALQAK
376	CAI AIG IGG GGS GSN SNY NYK YKL KLT LTF	KLGGALQAK
32602	CAM AMS MSG SGE GEG EGG GGS GSQ SQG QGN GNL NLI LIF	GILGFVFTL
34708	CAV AVE VEG EGT GTI TIQ IQG QGA GAQ AQK QKL KLV LVF	KLGGALQAK
30405	CAE AEV EVK VKG KGG GGG GGS GSQ SQG QGN GNL NLI LIF	GILGFVFTL
34519	CAV AVR VRV RVV VVT VTG TGT GTA TAS ASK SKL KLT LTF	KLGGALQAK
35853	CAV AVT VTP TPP PPG PGD GDM DMR MRF	KLGGALQAK
34300	CAV AVN VNP NPE PEG EGS GST STL TLT LTF	KLGGALQAK
10497	CGT GTA TAL ALA LAG AGG GGS GSQ SQG QGN GNL NLI LIF	GILGFVFTL
36198	CAA AAP APP PPF PFG FGN GNE NEK EKL KLT LTF	KLGGALQAK
170	CAV AVN VNG NGG GGN GNQ NQF QFY FYF	ELAGIGILTV
7353	CIL ILR LRD RDL DLN LNA NAG AGG GGT GTS TSY SYG YGK GKL KLT LTF	KLGGALQAK
35856	CAV AVD VDK DKS KSR SRS RSS SSG SGG GGS GSN SNY NYK YKL KLT LTF	KLGGALQAK
35100	CAV AVR VRD RDR DRV RVY VYN YNQ NQG QGG GGK GKL KLI LIF	KLGGALQAK
12252	CAG AGV GVG VGS GSW SWG WGK GKL KLQ LQF	RAKFKQLL
17155	CAA AAS ASE SET ETS TSY SYD YDK DKV KVI VIF	RAKFKQLL
28602	CIL ILR LRG RGD GDS DSG SGG GGG GGA GAD ADG DGL GLT LTF	KLGGALQAK
24306	CAE AEI EIF IFS FSG SGG GGG GGA GAD ADG DGL GLT LTF	GILGFVFTL
2291	CLS LSY SYS YSF SFQ FQK QKL KLV LVF	KLGGALQAK
32336	CAV AVI VIG IGA GAN ANS NSK SKL KLT LTF	GILGFVFTL
5156	CAG AGH GHT HTG TGN GNQ NQF QFY FYF	IVTDFSVIK
26240	CAE AEN ENP NPS PSS SSG SGG GGS GSY SYI YIP IPT PTF	KLGGALQAK
35732	CAG AGA GAR ARN RNN NNN NND NDM DMR MRF	KLGGALQAK
10554	CAA AAS ASV SVS VSI SIW IWT WTG TGT GTA TAS ASK SKL KLT LTF	RAKFKQLL
23227	CAG AGN GNS NSG SGN GNT NTG TGK GKL KLI LIF	GILGFVFTL
97	CVV VVS VSE SEG EGG GGG GGS GSY SYI YIP IPT PTF	KLGGALQAK
15086	CAV AVE VED EDL DLK LKT KTG TGA GAN ANN NNL NLF LFF	RAKFKQLL
35337	CAF AFN FNT NTG TGN GNQ NQF QFY FYF	KLGGALQAK
34962	CAT ATL TLD LDF DFG FGN GNE NEK EKL KLT LTF	KLGGALQAK
35191	CAG AGL GLG LGT GTR TRN RNL NLI LIG IGG GGG GGA GAD ADG DGL GLT LTF	KLGGALQAK
5047	CAV AVM VMD MDT DTG TGF GFQ FQK QKL KLV LVF	KLGGALQAK
27927	CVV VVN VNI NID IDN DNA NAR ARL RLM LMF	RAKFKQLL
17978	CAL ALS LSE SEA EAH AHG HGG GGN GNK NKL KLV LVF	KLGGALQAK
654	CAA AAR ARA RAL ALY LYS YSS SSA SAS ASK SKI KII IIF	KLGGALQAK
5506	CAV AVR VRE RET ETG TGA GAN ANN NNL NLF LFF	GILGFVFTL
34130	CAE AEH EHD HDN DNN NNA NAG AGN GNM NML MLT LTF	KLGGALQAK
34240	CVV VVL VLY LYN YNN NNN NND NDM DMR MRF	KLGGALQAK
2287	CAG AGF GFL FLI LIT ITG TGA GAG AGS GSY SYQ YQL QLT LTF	KLGGALQAK
33552	CAL ALD LDM DMG MGG GGG GGS GSQ SQG QGN GNL NLI LIF	GILGFVFTL
23019	CAL ALI LIR IRA RAG AGG GGQ GQN QNF NFV FVF	KLGGALQAK
2448	CAV AVG VGA GAG AGS GSA SAR ARQ RQL QLT LTF	ELAGIGILTV
30402	CAV AVE VEF EFL FLD LDR DRG RGS GST STL TLG LGR GRL RLY LYF	GILGFVFTL
2390	CRN RNA NAG AGG GGT GTS TSY SYG YGK GKL KLT LTF	GILGFVFTL
26395	CAE AED EDS DSN SNA NAR ARL RLM LMF	GLCTLVAML
33944	CIV IVM VMD MDD DDF DFQ FQK QKL KLV LVF	RAKFKQLL
34651	CAV AVY VYN YNF NFN FNK NKF KFY FYF	KLGGALQAK
2250	CAL ALP LPR PRS RSG SGN GNT NTG TGK GKL KLI LIF	KLGGALQAK
30427	CAG AGA GAG AGS GSQ SQG QGN GNL NLI LIF	GILGFVFTL
24310	CAL ALS LSE SEA EAG AGR GRS RSQ SQG QGN GNL NLI LIF	KLGGALQAK
25400	CAT ATF TFG FGN GNE NEK EKL KLT LTF	AVFDRKSDAK
7255	CAA AAS ASI SIG IGS GSG SGY GYS YST STL TLT LTF	KLGGALQAK
34611	CAV AVD VDS DSN SNY NYQ YQL QLI LIW	KLGGALQAK
34234	CAH AHQ HQG QGD GDS DSN SNY NYQ YQL QLI LIW	KLGGALQAK
34827	CAV AVS VSP SPT PTG TGN GNQ NQF QFY FYF	KLGGALQAK
35843	CAA AAT ATT TTY TYN YNN NNN NND NDM DMR MRF	KLGGALQAK
22365	CAV AVM VMN MNS NSG SGG GGY GYQ YQK QKV KVT VTF	RAKFKQLL
34607	CAE AER ERT RTR TRN RNN NNN NNA NAR ARL RLM LMF	KLGGALQAK
26012	CAY AYL YLQ LQG QGA GAQ AQK QKL KLV LVF	RAKFKQLL
35899	CAG AGT GTD TDY DYK YKL KLS LSF	KLGGALQAK
35669	CAV AVR VRS RSS SSL SLI LIQ IQG QGA GAQ AQK QKL KLV LVF	KLGGALQAK
25763	CAF AFM FMI MIS ISA SAG AGG GGT GTS TSY SYG YGK GKL KLT LTF	GILGFVFTL
35665	CAV AVL VLP LPG PGG GGG GGN GNK NKL KLT LTF	KLGGALQAK
35256	CAA AAS ASK SKA KAG AGF GFK FKT KTI TIF	KLGGALQAK
6238	CAL ALG LGE GET ETS TSG SGG GGT GTS TSY SYG YGK GKL KLT LTF	GILGFVFTL
34809	CAA AAS ASW SWG WGT GTG TGN GNQ NQF QFY FYF	KLGGALQAK
16941	CAF AFM FMK MKG KGA GAG AGG GGT GTS TSY SYG YGK GKL KLT LTF	GILGFVFTL
34148	CVV VVS VSV SVG VGE GEE EEY EYG YGN GNK NKL KLV LVF	KLGGALQAK
37320	CAY AYL YLD LDP DPR PRD RDD DDK DKI KII IIF	IVTDFSVIK
35254	CAL ALS LSD SDS DSG SGG GGS GSY SYI YIP IPT PTF	AVFDRKSDAK
4930	CAV AVQ VQA QAL ALM LMY MYS YSG SGG GGG GGA GAD ADG DGL GLT LTF	IVTDFSVIK
35059	CGT GTK TKT KTS TSG SGA GAG AGS GSY SYQ YQL QLT LTF	KLGGALQAK
100	CAE AEV EVY VYS YSG SGA GAG AGS GSY SYQ YQL QLT LTF	KLGGALQAK
6548	CAL ALA LAN ANT NTG TGG GGT GTS TSY SYG YGK GKL KLT LTF	KLGGALQAK
28037	CAL ALS LSE SEA EAN ANT NTG TGG GGF GFK FKT KTI TIF	RAKFKQLL
36238	CAV AVD VDL DLM LMK MKT KTS TSY SYD YDK DKV KVI VIF	IVTDFSVIK
29968	CAS ASW SWG WGP GPY PYN YNA NAG AGN GNM NML MLT LTF	KLGGALQAK
98	CAL ALG LGS GSS SSN SNT NTG TGK GKL KLI LIF	KLGGALQAK
24317	CAL ALS LSE SEN ENG NGR GRS RSQ SQG QGN GNL NLI LIF	KLGGALQAK
18220	CAA AAS ASE SET ETS TSY SYD YDK DKV KVI VIF	RAKFKQLL
34021	CVV VVS VSL SLN LNQ NQA QAG AGT GTA TAL ALI LIF	KLGGALQAK
5288	CAV AVF VFL FLY LYG YGN GNN NNR NRL RLA LAF	KLGGALQAK
89	CAL ALA LAH AHG HGN GNK NKL KLV LVF	AVFDRKSDAK
35238	CAV AVT VTH THG HGG GGR GRK RKT KTT TTD TDS DSW SWG WGK GKF KFQ FQF	KLGGALQAK
177	CAV AVR VRD RDR DRG RGS GST STL TLG LGR GRL RLY LYF	KLGGALQAK
35008	CAG AGQ GQL QLG LGQ GQG QGA GAQ AQK QKL KLV LVF	KLGGALQAK
38434	CAV AVK VKD KDS DSN SNY NYQ YQL QLI LIW	KLGGALQAK
28707	CAL ALS LSG SGY GYY YYG YGG GGS GSQ SQG QGN GNL NLI LIF	GILGFVFTL
27722	CAM AMS MSN SNS NSG SGG GGS GSN SNY NYK YKL KLT LTF	RAKFKQLL
16965	CAV AVR VRD RDS DSA SAG AGI GIA IAL ALI LIF	KLGGALQAK
34279	CAV AVR VRA RAG AGN GNQ NQF QFY FYF	AVFDRKSDAK
34602	CAM AMR MRE RER ERE REA EAS ASG SGG GGS GSN SNY NYK YKL KLT LTF	KLGGALQAK
33368	CAA AAS ASI SIG IGG GGG GGS GSQ SQG QGN GNL NLI LIF	GILGFVFTL
35370	CAA AAS ASL SLT LTY TYN YNF NFN FNK NKF KFY FYF	KLGGALQAK
36214	CAV AVN VNW NWE WEE EEQ EQG QGG GGS GSY SYI YIP IPT PTF	KLGGALQAK
25302	CAE AEM EME MEG EGG GGS GSY SYI YIP IPT PTF	RAKFKQLL
5507	CAV AVN VNK NKD KDF DFN FNK NKF KFY FYF	ELAGIGILTV
379	CAV AVD VDF DFR FRD RDN DNY NYG YGQ GQN QNF NFV FVF	IVTDFSVIK
7442	CAE AET ETQ TQD QDS DSN SNY NYQ YQL QLI LIW	RAKFKQLL
30778	CAE AEN ENK NKR KRE REA EAG AGN GNT NTP TPL PLV LVF	GILGFVFTL
28611	CAF AFM FMK MKG KGA GAG AGG GGT GTS TSY SYG YGK GKL KLT LTF	GILGFVFTL
26535	CGT GTE TEI EIN IND NDY DYK YKL KLS LSF	GLCTLVAML
34834	CAS ASI SIN IND NDY DYK YKL KLS LSF	KLGGALQAK
5656	CAV AVS VSE SES ESN SNT NTG TGK GKL KLI LIF	GILGFVFTL
13821	CAG AGG GGE GET ETS TSY SYD YDK DKV KVI VIF	RAKFKQLL
34360	CAA AAR ARR RRG RGF GFQ FQK QKL KLV LVF	KLGGALQAK
23204	CVA VAE AEN ENT NTG TGG GGF GFK FKT KTI TIF	KLGGALQAK
7079	CAG AGH GHQ HQG QGN GNN NNA NAG AGN GNM NML MLT LTF	KLGGALQAK
35725	CAP APR PRN RNN NNN NNA NAR ARL RLM LMF	KLGGALQAK
23222	CAV AVL VLG LGG GGS GSA SAR ARQ RQL QLT LTF	KLGGALQAK
32595	CAE AEN ENN NNG NGG GGG GGS GSQ SQG QGN GNL NLI LIF	GILGFVFTL
4967	CLL LLE LEP EPY PYS YSG SGG GGG GGA GAD ADG DGL GLT LTF	KLGGALQAK
38423	CAV AVK VKG KGI GIT ITG TGG GGG GGN GNK NKL KLT LTF	KLGGALQAK
15702	CAY AYR YRS RSD SDS DSG SGT GTY TYK YKY KYI YIF	RAKFKQLL
27070	CVV VVN VNI NID IDN DNA NAR ARL RLM LMF	RAKFKQLL
593	CAM AMS MSS SSA SAD ADR DRG RGS GST STL TLG LGR GRL RLY LYF	KLGGALQAK
35992	CAI AIG IGP GPG PGN GNM NML MLT LTF	KLGGALQAK
34248	CAA AAY AYS YSG SGG GGG GGA GAD ADG DGL GLT LTF	KLGGALQAK
35181	CAV AVG VGA GAY AYS YSG SGA GAG AGS GSY SYQ YQL QLT LTF	KLGGALQAK
25401	CAA AAL ALD LDS DSN SNY NYQ YQL QLI LIW	IVTDFSVIK
29944	CAT ATD TDG DGG GGG GGG GGS GSQ SQG QGN GNL NLI LIF	GILGFVFTL
34574	CAA AAR ARG RGP GPN PNF NFG FGN GNE NEK EKL KLT LTF	AVFDRKSDAK
35019	CAF AFM FMS MSL SLI LIQ IQG QGA GAQ AQK QKL KLV LVF	KLGGALQAK
32547	CAG AGS GSG SGS GSQ SQG QGN GNL NLI LIF	GILGFVFTL
24309	CAV AVN VNA NAV AVD VDN DNY NYG YGQ GQN QNF NFV FVF	KLGGALQAK
35410	CVV VVL VLY LYN YNF NFN FNK NKF KFY FYF	KLGGALQAK
27086	CAP APS PSS SSG SGG GGN GNT NTP TPL PLV LVF	KLGGALQAK
25437	CAA AAS ASE SET ETS TSY SYD YDK DKV KVI VIF	RAKFKQLL
14842	CAG AGG GGG GGS GSQ SQG QGN GNL NLI LIF	GILGFVFTL
35844	CVV VVN VNI NIA IAG AGN GNR NRD RDD DDK DKI KII IIF	KLGGALQAK
34049	CAV AVL VLA LAN AND NDY DYK YKL KLS LSF	KLGGALQAK
3846	CAM AMR MRE REG EGS GSG SGG GGS GSN SNY NYK YKL KLT LTF	IVTDFSVIK
35603	CAV AVG VGS GSG SGN GNT NTG TGK GKL KLI LIF	KLGGALQAK
15618	CAM AMR MRR RRP RPN PNA NAG AGG GGT GTS TSY SYG YGK GKL KLT LTF	RAKFKQLL
18246	CAA AAL ALM LMN MNR NRD RDD DDK DKI KII IIF	RAKFKQLL
5180	CAL ALR LRD RDD DDK DKI KII IIF	KLGGALQAK
4931	CAV AVS VSS SSN SNS NSG SGG GGY GYQ YQK QKV KVT VTF	ELAGIGILTV
34810	CAA AAG AGR GRG RGT GTY TYK YKY KYI YIF	AVFDRKSDAK
34770	CAV AVR VRP RPP PPT PTD TDS DSW SWG WGK GKF KFQ FQF	KLGGALQAK
14673	CVV VVI VIL ILT LTT TTD TDS DSW SWG WGK GKF KFQ FQF	KLGGALQAK
38420	CAV AVD VDL DLM LMK MKT KTS TSY SYD YDK DKV KVI VIF	IVTDFSVIK
35676	CAG AGQ GQR QRY RYS YST STL TLT LTF	KLGGALQAK
35624	CAL ALS LSE SEA EAL ALG LGG GGR GRR RRA RAL ALT LTF	IVTDFSVIK
6706	CAL ALL LLR LRR RRN RNA NAG AGN GNM NML MLT LTF	GILGFVFTL
35350	CAV AVI VIN INA NAR ARL RLM LMF	KLGGALQAK
35263	CAM AMK MKK KKT KTS TSY SYD YDK DKV KVI VIF	KLGGALQAK
34196	CAW AWG WGG GGG GGK GKL KLI LIF	KLGGALQAK
34745	CAV AVS VSD SDQ DQG QGG GGS GSE SEK EKL KLV LVF	KLGGALQAK
17052	CAA AAS ASA SAA AAG AGN GNQ NQF QFY FYF	KLGGALQAK
34470	CLL LLR LRT RTG TGS GSY SYQ YQL QLT LTF	KLGGALQAK
2392	CAA AAP APN PNT NTD TDK DKL KLI LIF	KLGGALQAK
34110	CAV AVN VNW NWG WGG GGS GSE SEK EKL KLV LVF	KLGGALQAK
36247	CAV AVN VNR NRN RNG NGG GGG GGN GNK NKL KLT LTF	KLGGALQAK
33498	CAY AYS YSY SYG YGG GGS GSQ SQG QGN GNL NLI LIF	GILGFVFTL
32399	CAY AYM YMA MAN ANA NAG AGG GGT GTS TSY SYG YGK GKL KLT LTF	GILGFVFTL
25069	CAA AAS ASD SDG DGF GFG FGN GNV NVL VLH LHC	KLGGALQAK
14897	CAT ATD TDR DRA RAG AGS GSA SAR ARQ RQL QLT LTF	RAKFKQLL
35491	CAI AIG IGP GPG PGN GNM NML MLT LTF	KLGGALQAK
34192	CAT ATD TDA DAS ASQ SQA QAG AGT GTA TAL ALI LIF	KLGGALQAK
5061	CAW AWF WFP FPM PMN MNS NSG SGY GYS YST STL TLT LTF	KLGGALQAK
18059	CVV VVT VTY TYN YND NDM DMR MRF	KLGGALQAK
7034	CAV AVS VSG SGS GSQ SQG QGN GNL NLI LIF	GILGFVFTL
35723	CAV AVA VAD ADS DSN SNY NYQ YQL QLI LIW	KLGGALQAK
5055	CAL ALS LSG SGT GTY TYT YTG TGG GGF GFK FKT KTI TIF	KLGGALQAK
25218	CAE AER ERG RGG GGG GGS GST STL TLG LGR GRL RLY LYF	KLGGALQAK
35328	CVV VVN VNS NSR SRL RLS LSG SGA GAG AGS GSY SYQ YQL QLT LTF	KLGGALQAK
35758	CAV AVR VRE REP EPG PGF GFQ FQK QKL KLV LVF	KLGGALQAK
15582	CAV AVS VSA SAA AAS ASG SGG GGS GSY SYI YIP IPT PTF	RAKFKQLL
13895	CAG AGG GGG GGS GSQ SQG QGN GNL NLI LIF	GILGFVFTL
29776	CAE AEM EME MEG EGG GGS GSY SYI YIP IPT PTF	GILGFVFTL
695	CVV VVN VNP NPN PNN NNA NAG AGN GNM NML MLT LTF	KLGGALQAK
25799	CAG AGG GGG GGS GSS SSN SNT NTG TGK GKL KLI LIF	RAKFKQLL
6245	CAT ATV TVP VPS PSN SNT NTG TGK GKL KLI LIF	GILGFVFTL
14838	CAV AVQ VQA QAN ANT NTD TDK DKL KLI LIF	KLGGALQAK
35457	CVA VAY AYS YSS SSA SAS ASK SKI KII IIF	KLGGALQAK
29933	CAV AVQ VQA QAN ANN NNA NAR ARL RLM LMF	GILGFVFTL
34488	CAL ALT LTL TLD LDN DNT NTD TDK DKL KLI LIF	KLGGALQAK
36222	CAV AVL VLS LSG SGT GTA TAS ASK SKL KLT LTF	IVTDFSVIK
32390	CAY AYG YGG GGS GSQ SQG QGN GNL NLI LIF	GILGFVFTL
33892	CAF AFM FMT MTN TNA NAG AGG GGT GTS TSY SYG YGK GKL KLT LTF	GILGFVFTL
34576	CAL ALT LTV TVE VEG EGG GGS GSY SYI YIP IPT PTF	KLGGALQAK
3646	CAG AGG GGN GNT NTG TGK GKL KLI LIF	IVTDFSVIK
34830	CVA VAT ATE TEY EYG YGN GNK NKL KLV LVF	KLGGALQAK
31903	CAL ALK LKN KNN NND NDM DMR MRF	GILGFVFTL
5132	CAL ALK LKL KLI LIK IKA KAA AAG AGN GNK NKL KLT LTF	KLGGALQAK
26555	CAE AET ETH THS HSG SGG GGS GSN SNY NYK YKL KLT LTF	RAKFKQLL
25769	CAA AAS ASE SET ETS TSY SYD YDK DKV KVI VIF	RAKFKQLL
18532	CAG AGA GAS ASG SGS GSS SSN SNT NTG TGK GKL KLI LIF	RAKFKQLL
35975	CAV AVG VGP GPN PNN NNN NND NDM DMR MRF	KLGGALQAK
6361	CAE AEN ENM NMG MGG GGG GGS GSQ SQG QGN GNL NLI LIF	GILGFVFTL
15942	CAM AMR MRE REG EGS GSR SRR RRR RRD RDD DDK DKI KII IIF	RAKFKQLL
24221	CAE AER ERE RET ETS TSY SYD YDK DKV KVI VIF	RAKFKQLL
6626	CAY AYR YRT RTK TKE KET ETS TSG SGS GSR SRL RLT LTF	GILGFVFTL
235	CIL ILR LRG RGS GSG SGA GAG AGS GSY SYQ YQL QLT LTF	KLGGALQAK
24358	CAL ALT LTL TLN LNT NTG TGG GGF GFK FKT KTI TIF	KLGGALQAK
29938	CSS SSE SET ETP TPS PSS SSV SVI VIQ IQP QPP PPM PME MED EDD DDK DKI KII IIF	GILGFVFTL
35712	CAV AVR VRD RDI DIE IEN END NDY DYK YKL KLS LSF	KLGGALQAK
34777	CAM AMG MGI GIP IPP PPP PPS PST STG TGA GAN ANN NNL NLF LFF	KLGGALQAK
34098	CAV AVT VTG TGV GVN VNN NNA NAG AGN GNM NML MLT LTF	KLGGALQAK
35399	CIL ILS LSK SKI KIT ITG TGN GNQ NQF QFY FYF	KLGGALQAK
6661	CAF AFM FMV MVN VNA NAG AGG GGT GTS TSY SYG YGK GKL KLT LTF	GILGFVFTL
6365	CAG AGG GGG GGS GSS SSN SNT NTG TGK GKL KLI LIF	GILGFVFTL
9474	CAV AVR VRF	RAKFKQLL
14848	CAL ALS LSG SGW GWV WVT VTG TGG GGG GGN GNK NKL KLT LTF	KLGGALQAK
26626	CAA AAS ASI SIW IWE WEQ EQQ QQT QTR TRF	RAKFKQLL
24338	CAD ADS DSG SGG GGG GGA GAD ADG DGL GLT LTF	RAKFKQLL
24633	CAA AAL ALN LND NDY DYK YKL KLS LSF	GILGFVFTL
7969	CAV AVN VNM NMY MYG YGD GDS DSS SSY SYK YKL KLI LIF	RAKFKQLL
33909	CAG AGA GAV AVG VGS GSS SSN SNT NTG TGK GKL KLI LIF	GILGFVFTL
35064	CAT ATD TDR DRG RGN GNS NSG SGY GYA YAL ALN LNF	KLGGALQAK
2313	CAV AVR VRD RDY DYW YWD WDD DDK DKI KII IIF	KLGGALQAK
5284	CAV AVE VED EDG DGG GGF GFQ FQK QKL KLV LVF	KLGGALQAK
33596	CAY AYP YPV PVY VYN YNF NFN FNK NKF KFY FYF	KLGGALQAK
28446	CGP GPM PMD MDS DSN SNY NYQ YQL QLI LIW	KLGGALQAK
14960	CAA AAS ASE SET ETS TSY SYD YDK DKV KVI VIF	RAKFKQLL
35901	CGT GTE TEW EWA WAN ANN NNN NND NDM DMR MRF	KLGGALQAK
35966	CVV VVS VSD SDL DLV LVD VDF DFN FNK NKF KFY FYF	KLGGALQAK
29967	CAG AGA GAG AGG GGT GTA TAS ASK SKL KLT LTF	GILGFVFTL
2336	CAA AAS ASP SPF PFS FSY SYN YNT NTD TDK DKL KLI LIF	KLGGALQAK
34262	CAV AVG VGA GAA AAG AGN GNK NKL KLT LTF	KLGGALQAK
14648	CVV VVN VNG NGG GGD GDS DSS SSY SYK YKL KLI LIF	GLCTLVAML
35362	CAM AMR MRE REG EGD GDI DIG IGN GNQ NQF QFY FYF	KLGGALQAK
19789	CAV AVI VIR IRW RWG WGD GDM DMR MRF	RAKFKQLL
34127	CAV AVS VSG SGG GGN GNQ NQG QGG GGK GKL KLI LIF	KLGGALQAK
34419	CAF AFI FII IIT ITG TGN GNQ NQF QFY FYF	KLGGALQAK
31619	CAE AED EDY DYG YGG GGS GSQ SQG QGN GNL NLI LIF	GILGFVFTL
34957	CAG AGN GNS NSG SGT GTY TYK YKY KYI YIF	KLGGALQAK
34392	CAM AMG MGN GNN NNA NAR ARL RLM LMF	KLGGALQAK
34121	CAM AMR MRG RGV GVK VKG KGN GNN NNR NRL RLA LAF	KLGGALQAK
35608	CAV AVI VIV IVG VGA GAN ANS NSK SKL KLT LTF	KLGGALQAK
21337	CAV AVN VNT NTD TDS DSW SWG WGK GKL KLQ LQF	RAKFKQLL
15117	CVV VVS VSG SGE GEG EGW GWA WAA AAG AGT GTA TAL ALI LIF	RAKFKQLL
36249	CAS ASG SGL GLF LFG FGN GNE NEK EKL KLT LTF	KLGGALQAK
32518	CAM AMS MSG SGD GDG DGG GGS GSQ SQG QGN GNL NLI LIF	GILGFVFTL
29911	CAY AYM YMT MTN TNA NAG AGG GGT GTS TSY SYG YGK GKL KLT LTF	GILGFVFTL
17998	CVA VAF AFF FFD FDY DYK YKL KLS LSF	KLGGALQAK
26560	CAA AAT ATE TET ETS TSY SYD YDK DKV KVI VIF	RAKFKQLL
15990	CLV LVG VGD GDD DDY DYK YKL KLS LSF	KLGGALQAK
34287	CAV AVN VNA NAQ AQV QVS VSW SWG WGK GKL KLQ LQF	KLGGALQAK
23893	CAA AAS ASM SMD MDS DSN SNY NYQ YQL QLI LIW	KLGGALQAK
14426	CIL ILR LRE RET ETS TSY SYD YDK DKV KVI VIF	RAKFKQLL
28470	CAV AVM VMP MPD PDP DPN PNA NAG AGG GGT GTS TSY SYG YGK GKL KLT LTF	KLGGALQAK
6253	CAA AAR ARV RVR VRG RGF GFG FGN GNV NVL VLH LHC	AVFDRKSDAK
35274	CAL ALS LSD SDL DLI LIS ISD SDG DGQ GQK QKL KLL LLF	KLGGALQAK
32616	CAG AGH GHT HTG TGN GNQ NQF QFY FYF	GILGFVFTL
34103	CVV VVS VSP SPH PHG HGS GSS SSN SNT NTG TGK GKL KLI LIF	KLGGALQAK
36126	CAM AMR MRE REE EEF EFG FGG GGT GTG TGA GAN ANS NSK SKL KLT LTF	KLGGALQAK
14258	CGT GTE TEY EYP YPN PND NDY DYK YKL KLS LSF	GLCTLVAML
35981	CAL ALK LKA KAA AAG AGN GNK NKL KLT LTF	KLGGALQAK
18072	CAL ALR LRE RET ETS TSY SYD YDK DKV KVI VIF	RAKFKQLL
4976	CAA AAY AYK YKL KLS LSF	RAKFKQLL
24302	CAY AYS YSP SPA PAA AAG AGG GGT GTS TSY SYG YGK GKL KLT LTF	GILGFVFTL
31607	CAV AVE VEE EEA EAG AGA GAN ANN NNL NLF LFF	RAKFKQLL
2246	CAH AHL HLQ LQG QGA GAQ AQK QKL KLV LVF	IVTDFSVIK
7339	CAA AAL ALE LEE EET ETN TNA NAG AGK GKS KST STF	GILGFVFTL
15297	CAA AAS ASE SES ESS SSN SND NDY DYK YKL KLS LSF	RAKFKQLL
26220	CAL ALS LSE SEP EPN PNS NSG SGG GGG GGA GAD ADG DGL GLT LTF	GLCTLVAML
2288	CAV AVD VDK DKI KID IDY DYK YKL KLS LSF	KLGGALQAK
23370	CAD ADS DSG SGG GGG GGA GAD ADG DGL GLT LTF	RAKFKQLL
25995	CAM AMR MRE RED EDN DNA NAG AGN GNM NML MLT LTF	GILGFVFTL
31663	CAA AAP APK PKG KGA GAN ANN NNL NLF LFF	GILGFVFTL
25796	CAA AAS ASM SMG MGG GGG GGS GSQ SQG QGN GNL NLI LIF	GILGFVFTL
24909	CAR ARD RDR DRG RGS GSG SGG GGS GSN SNY NYK YKL KLT LTF	GLCTLVAML
36221	CAV AVK VKG KGG GGG GGK GKL KLI LIF	ELAGIGILTV
34215	CVV VVS VSG SGY GYK YKY KYI YIF	KLGGALQAK
5136	CAA AAD ADD DDG DGR GRL RLM LMF	RAKFKQLL
31068	CAG AGG GGG GGS GSQ SQE QEN ENL NLI LIF	GILGFVFTL
9790	CAV AVG VGD GDN DNF NFN FNK NKS KSY SYF	RAKFKQLL
30984	CAE AER ERP RPP PPN PNQ NQE QET ETS TSG SGS GSR SRL RLT LTF	GILGFVFTL
31798	CVG VGY GYT YTN TNA NAG AGK GKS KST STF	GILGFVFTL
34595	CAM AMR MRE REP EPA PAN ANM NMN MNY NYG YGG GGS GSQ SQG QGN GNL NLI LIF	KLGGALQAK
5512	CAV AVR VRL RLP LPN PND NDY DYK YKL KLS LSF	KLGGALQAK
26837	CAD ADS DSG SGG GGG GGA GAD ADG DGL GLT LTF	RAKFKQLL
7689	CAA AAG AGE GET ETS TSY SYD YDK DKV KVI VIF	RAKFKQLL
35573	CAV AVT VTG TGG GGN GND NDY DYK YKL KLS LSF	KLGGALQAK
25399	CAV AVL VLN LNY NYG YGG GGS GSQ SQG QGN GNL NLI LIF	KLGGALQAK
35447	CAL ALL LLD LDS DSW SWG WGK GKL KLQ LQF	KLGGALQAK
34756	CAL ALS LSE SEL ELD LDN DNF NFN FNK NKF KFY FYF	KLGGALQAK
27084	CAV AVR VRD RDR DRT RTG TGG GGF GFK FKT KTI TIF	KLGGALQAK
33480	CIV IVR VRT RTA TAG AGN GNN NNR NRK RKL KLI LIW	KLGGALQAK
2327	CAL ALS LSA SAL ALD LDG DGQ GQK QKL KLL LLF	KLGGALQAK
5265	CAV AVY VYS YSL SLG LGQ GQF QFY FYF	KLGGALQAK
35458	CAT ATA TAR ARY RYN YNQ NQG QGG GGK GKL KLI LIF	KLGGALQAK
6325	CAF AFM FMT MTN TNA NAG AGG GGT GTS TSY SYG YGK GKL KLT LTF	GILGFVFTL
31892	CAL ALN LNY NYG YGG GGS GSQ SQG QGN GNL NLI LIF	GILGFVFTL
18061	CAA AAS ASE SET ETS TSY SYD YDK DKV KVI VIF	RAKFKQLL
29964	CAF AFM FMK MKG KGA GAG AGG GGT GTS TSY SYG YGK GKL KLT LTF	GILGFVFTL
27063	CAA AAV AVD VDN DNY NYG YGQ GQN QNF NFV FVF	RAKFKQLL
34387	CAV AVG VGT GTP TPN PNS NSG SGG GGS GSN SNY NYK YKL KLT LTF	KLGGALQAK
7261	CAV AVN VNT NTG TGG GGF GFK FKT KTI TIF	KLGGALQAK
35090	CAV AVR VRD RDN DNG NGN GNQ NQF QFY FYF	KLGGALQAK
624	CAM AMS MSG SGH GHN HNQ NQG QGG GGK GKL KLI LIF	KLGGALQAK
23820	CAY AYR YRD RDE DEG EGN GNK NKL KLV LVF	RAKFKQLL
635	CAM AMR MRE REP EPN PNY NYG YGQ GQN QNF NFV FVF	RAKFKQLL
16175	CAA AAS ASE SEE EEY EYG YGN GNK NKL KLV LVF	RAKFKQLL
35839	CAE AEN END NDN DNY NYG YGQ GQN QNF NFV FVF	KLGGALQAK
34056	CAA AAS ASG SGK GKN KNN NNY NYG YGQ GQN QNF NFV FVF	KLGGALQAK
7330	CAV AVL VLD LDS DSN SNY NYQ YQL QLI LIW	KLGGALQAK
125	CAM AMN MNR NRY RYS YST STL TLT LTF	RAKFKQLL
666	CAN ANM NMD MDS DSN SNY NYQ YQL QLI LIW	KLGGALQAK
33900	CAV AVA VAK AKD KDL DLQ LQN QNS NSG SGG GGG GGA GAD ADG DGL GLT LTF	GILGFVFTL
7256	CAV AVG VGG GGQ GQL QLT LTF	KLGGALQAK
31375	CAP APH PHK HKA KAA AAG AGN GNK NKL KLT LTF	GILGFVFTL
34131	CAE AET ETT TTP TPG PGN GNT NTG TGF GFQ FQK QKL KLV LVF	KLGGALQAK
28935	CAV AVN VNT NTP TPP PPG PGD GDS DSN SNY NYQ YQL QLI LIW	GILGFVFTL
17865	CAV AVR VRD RDA DAH AHN HNN NNA NAG AGN GNM NML MLT LTF	KLGGALQAK
32040	CAF AFS FSP SPK PKS KSS SSA SAS ASK SKI KII IIF	GILGFVFTL
2	CAE AEN ENM NMG MGG GGG GGS GSQ SQG QGN GNL NLI LIF	GILGFVFTL
35444	CAI AIG IGP GPG PGN GNM NML MLT LTF	KLGGALQAK
34542	CAV AVY VYP YPG PGA GAN ANN NNL NLF LFF	KLGGALQAK
32671	CAE AER ERI RIP IPN PNF NFG FGN GNE NEK EKL KLT LTF	GILGFVFTL
6366	CAG AGA GAD ADG DGS GSG SGN GNT NTG TGK GKL KLI LIF	GILGFVFTL
35925	CAV AVS VSP SPY PYG YGG GGA GAT ATN TNK NKL KLI LIF	KLGGALQAK
34654	CAV AVL VLS LSG SGA GAG AGS GSY SYQ YQL QLT LTF	KLGGALQAK
703	CAM AMR MRE REG EGG GGS GSG SGG GGY GYN YNK NKL KLI LIF	IVTDFSVIK
35107	CAI AIL ILN LNY NYG YGQ GQN QNF NFV FVF	KLGGALQAK
7669	CAL ALS LSE SET ETS TSY SYD YDK DKV KVI VIF	RAKFKQLL
25385	CAR ARG RGG GGG GGF GFK FKT KTI TIF	RAKFKQLL
5285	CAV AVE VEV EVE VEY EYG YGN GNK NKL KLV LVF	KLGGALQAK
36187	CAA AAI AIN INT NTG TGT GTA TAS ASK SKL KLT LTF	KLGGALQAK
13	CAV AVH VHL HLI LIW IWE WEG EGG GGG GGA GAT ATN TNK NKL KLI LIF	GILGFVFTL
4932	CAV AVR VRD RDV DVV VVS VSG SGS GSA SAR ARQ RQL QLT LTF	KLGGALQAK
