35231	CAV AVR VRP RPP PPM PMD MDS DSS SSY SYK YKL KLI LIF	KLGGALQAK
6687	CAL ALT LTG TGG GGG GGS GSQ SQG QGN GNL NLI LIF	GILGFVFTL
35631	CAF AFM FMT MTG TGE GEQ EQG QGG GGS GSE SEK EKL KLV LVF	KLGGALQAK
35149	CAV AVR VRD RDP DPS PSG SGG GGS GSY SYI YIP IPT PTF	KLGGALQAK
23218	CAG AGP GPR PRY RYA YAQ AQG QGA GAQ AQK QKL KLV LVF	ELAGIGILTV
31902	CAE AEN ENT NTG TGG GGG GGS GSQ SQG QGN GNL NLI LIF	GILGFVFTL
33911	CAA AAM AME MET ETS TSY SYD YDK DKV KVI VIF	RAKFKQLL
25298	CAE AEG EGE GET ETS TSY SYD YDK DKV KVI VIF	RAKFKQLL
22324	CAL ALD LDG DGP GPG PGN GNT NTD TDK DKL KLI LIF	KLGGALQAK
2504	CAG AGP GPD PDS DSW SWG WGK GKL KLQ LQF	KLGGALQAK
14242	CAV AVP VPP PPK PKA KAN ANN NNL NLF LFF	RAKFKQLL
35640	CAR ARP RPS PSD SDY DYK YKL KLS LSF	KLGGALQAK
2471	CAV AVG VGD GDN DNF NFN FNK NKF KFY FYF	AVFDRKSDAK
35667	CAA AAS ASA SAD ADA DAR ARL RLM LMF	KLGGALQAK
52	CAA AAS ASE SET ETS TSY SYD YDK DKV KVI VIF	AVFDRKSDAK
34549	CAL ALW LWG WGE GET ETS TSG SGS GSR SRL RLT LTF	KLGGALQAK
35141	CAA AAS ASA SAR ARN RNS NSG SGT GTY TYK YKY KYI YIF	KLGGALQAK
34675	CAM AMK MKP KPA PAT ATG TGG GGF GFK FKT KTI TIF	KLGGALQAK
30361	CAM AMS MSR SRG RGI GID IDR DRG RGS GST STL TLG LGR GRL RLY LYF	GILGFVFTL
17890	CAA AAK AKE KEG EGY GYS YST STL TLT LTF	KLGGALQAK
6322	CAG AGN GNY NYG YGG GGS GSQ SQG QGN GNL NLI LIF	GILGFVFTL
15317	CAL ALS LSR SRP RPV PVD VDS DSN SNY NYQ YQL QLI LIW	KLGGALQAK
28678	CAV AVR VRD RDS DSN SNY NYQ YQL QLI LIW	KLGGALQAK
7691	CAL ALS LSE SET ETS TSY SYD YDK DKV KVI VIF	RAKFKQLL
34971	CAR ARE REG EGG GGD GDD DDK DKI KII IIF	KLGGALQAK
34541	CAF AFA FAG AGT GTA TAS ASK SKL KLT LTF	KLGGALQAK
35806	CGT GTF TFD FDR DRG RGS GST STL TLG LGR GRL RLY LYF	KLGGALQAK
34219	CAA AAS ASV SVS VSN SNY NYG YGQ GQN QNF NFV FVF	KLGGALQAK
31365	CAG AGA GAV AVG VGG GGF GFG FGN GNV NVL VLH LHC	GILGFVFTL
34539	CAS ASY SYT YTG TGA GAN ANS NSK SKL KLT LTF	KLGGALQAK
36177	CAL ALV LVS VSG SGG GGY GYN YNK NKL KLI LIF	KLGGALQAK
22313	CAL ALD LDG DGA GAG AGN GNT NTD TDK DKL KLI LIF	KLGGALQAK
23278	CAE AEN ENS NSK SKG KGH GHD HDN DND NDM DMR MRF	RAKFKQLL
34104	CAV AVQ VQS QSY SYG YGQ GQN QNF NFV FVF	KLGGALQAK
25273	CAE AET ETE TET ETS TSY SYD YDK DKV KVI VIF	RAKFKQLL
28861	CVG VGY GYT YTN TNA NAG AGK GKS KST STF	KLGGALQAK
168	CAV AVE VEA EAA AAG AGN GNK NKL KLT LTF	AVFDRKSDAK
34113	CAY AYR YRA RAP APR PRG RGN GNE NEK EKL KLT LTF	KLGGALQAK
36086	CAV AVS VSG SGG GGG GGA GAD ADG DGL GLT LTF	ELAGIGILTV
35743	CAV AVR VRR RRS RSN SND NDY DYK YKL KLS LSF	KLGGALQAK
17895	CAA AAS ASG SGG GGT GTY TYK YKY KYI YIF	GLCTLVAML
6686	CAG AGN GNY NYG YGG GGS GSQ SQG QGN GNL NLI LIF	GILGFVFTL
25297	CAD ADP DPG PGN GNM NML MLT LTF	RAKFKQLL
6048	CAV AVN VNT NTN TNG NGG GGS GSQ SQG QGN GNL NLI LIF	GILGFVFTL
16302	CAA AAT ATD TDN DNN NNA NAR ARL RLM LMF	RAKFKQLL
15313	CAD ADS DSG SGG GGG GGA GAD ADG DGL GLT LTF	RAKFKQLL
23001	CAG AGL GLN LND NDY DYK YKL KLS LSF	KLGGALQAK
2282	CAA AAA AAE AET ETS TSY SYD YDK DKV KVI VIF	RAKFKQLL
36044	CAV AVR VRD RDK DKD KDG DGG GGA GAT ATN TNK NKL KLI LIF	KLGGALQAK
35259	CIL ILR LRG RGG GGI GIY IYN YNN NNN NND NDM DMR MRF	KLGGALQAK
33898	CIV IVN VND NDA DAG AGT GTS TSY SYG YGK GKL KLT LTF	KLGGALQAK
34168	CAV AVR VRG RGG GGA GAD ADG DGL GLT LTF	KLGGALQAK
29782	CAS ASV SVG VGM GMD MDS DSS SSY SYK YKL KLI LIF	GILGFVFTL
30991	CAL ALS LSE SEP EPY PYS YSG SGN GNT NTP TPL PLV LVF	GILGFVFTL
29941	CAV AVN VNL NLT LTN TNN NNA NAG AGN GNM NML MLT LTF	GILGFVFTL
14334	CAG AGY GYN YNN NNN NND NDM DMR MRF	GILGFVFTL
5486	CAV AVG VGG GGP GPR PRS RSD SDS DSW SWG WGK GKL KLQ LQF	KLGGALQAK
25806	CAA AAM AME MET ETS TSY SYD YDK DKV KVI VIF	RAKFKQLL
13393	CAA AAS ASA SAS ASG SGG GGQ GQF QFY FYF	RAKFKQLL
5460	CAG AGH GHT HTG TGN GNQ NQF QFY FYF	IVTDFSVIK
23816	CAV AVA VAK AKD KDL DLQ LQN QNS NSG SGG GGG GGA GAD ADG DGL GLT LTF	GILGFVFTL
5050	CAV AVS VSD SDD DDK DKI KII IIF	RAKFKQLL
13932	CIV IVR VRE REG EGD GDR DRD RDD DDK DKI KII IIF	RAKFKQLL
34133	CAV AVP VPN PNF NFG FGN GNE NEK EKL KLT LTF	KLGGALQAK
5258	CAV AVN VNY NYG YGN GNK NKL KLV LVF	ELAGIGILTV
35967	CAA AAW AWN WNQ NQG QGG GGK GKL KLI LIF	GILGFVFTL
33520	CAA AAS ASV SVY VYR YRG RGY GYN YNN NNN NND NDM DMR MRF	GILGFVFTL
24849	CAE AED EDS DSG SGN GNL NLI LIF	GLCTLVAML
28448	CAV AVK VKN KNS NSN SNY NYQ YQL QLI LIW	KLGGALQAK
36325	CAV AVM VMH MHG HGA GAR ARL RLM LMF	KLGGALQAK
6685	CAG AGA GAN ANG NGS GSS SSN SNT NTG TGK GKL KLI LIF	GILGFVFTL
33854	CAG AGT GTH THG HGG GGS GSQ SQG QGN GNL NLI LIF	GILGFVFTL
205	CVV VVS VSS SSI SIS ISG SGG GGG GGA GAD ADG DGL GLT LTF	KLGGALQAK
35326	CAV AVR VRP RPS PSM SMD MDS DSS SSY SYK YKL KLI LIF	KLGGALQAK
2462	CAL ALS LSE SEA EAG AGN GNY NYG YGQ GQN QNF NFV FVF	KLGGALQAK
4929	CVV VVS VSA SAN ANN NNA NAG AGN GNM NML MLT LTF	KLGGALQAK
7200	CAG AGA GAA AAG AGS GSS SSN SNT NTG TGK GKL KLI LIF	GILGFVFTL
31363	CAG AGT GTI TIA IAG AGG GGS GSQ SQG QGN GNL NLI LIF	GILGFVFTL
8379	CAG AGG GGG GGS GSQ SQG QGN GNL NLI LIF	GILGFVFTL
27964	CAE AEN ENG NGG GGG GGG GGA GAD ADG DGL GLT LTF	GLCTLVAML
29940	CAG AGN GNY NYG YGG GGS GSQ SQG QGN GNL NLI LIF	GILGFVFTL
28457	CAF AFM FMK MKG KGA GAG AGG GGT GTS TSY SYG YGK GKL KLT LTF	GILGFVFTL
34112	CAL ALS LSV SVA VAA AAG AGN GNK NKL KLT LTF	KLGGALQAK
34544	CAL ALS LSG SGA GAP APS PSG SGT GTY TYK YKY KYI YIF	KLGGALQAK
3582	CAV AVG VGA GAG AGT GTA TAL ALI LIF	IVTDFSVIK
28958	CGT GTE TEF EFG FGP GPN PNS NSG SGN GNT NTP TPL PLV LVF	KLGGALQAK
6762	CAG AGA GAK AKG KGG GGG GGS GSQ SQG QGN GNL NLI LIF	GILGFVFTL
17956	CAE AEW EWG WGS GSG SGN GNT NTG TGK GKL KLI LIF	KLGGALQAK
33500	CAG AGQ GQL QLG LGG GGG GGS GSQ SQG QGN GNL NLI LIF	GILGFVFTL
34908	CAA AAP APG PGN GNT NTP TPL PLV LVF	KLGGALQAK
31627	CAG AGQ GQS QSE SEE EEA EAN ANY NYG YGG GGS GSQ SQG QGN GNL NLI LIF	GILGFVFTL
35443	CAV AVN VNG NGG GGS GSQ SQG QGN GNL NLI LIF	KLGGALQAK
2494	CAL ALG LGF GFY FYT YTY TYS YSG SGA GAG AGS GSY SYQ YQL QLT LTF	KLGGALQAK
35163	CAV AVS VSV SVE VEG EGS GSQ SQG QGN GNL NLI LIF	KLGGALQAK
6605	CAF AFI FIG IGN GNT NTG TGK GKL KLI LIF	GILGFVFTL
35139	CAV AVP VPD PDS DSN SNY NYQ YQL QLI LIW	KLGGALQAK
28830	CAG AGV GVM VMD MDS DSN SNY NYQ YQL QLI LIW	KLGGALQAK
24347	CGT GTD TDK DKG KGG GGG GGS GSQ SQG QGN GNL NLI LIF	GILGFVFTL
34757	CLL LLG LGE GES ESE SEA EAA AAG AGN GNK NKL KLT LTF	KLGGALQAK
270	CAT ATE TEL ELY LYG YGA GAN ANS NSK SKL KLT LTF	KLGGALQAK
2317	CGT GTE TEY EYP YPN PND NDY DYK YKL KLS LSF	GLCTLVAML
6996	CAV AVS VSK SKT KTG TGN GNK NKL KLV LVF	GILGFVFTL
36078	CAE AES EST STT TTD TDK DKL KLI LIF	IVTDFSVIK
17298	CAA AAK AKE KEG EGY GYS YST STL TLT LTF	GLCTLVAML
35571	CLV LVA VAL ALS LSG SGG GGS GSY SYI YIP IPT PTF	KLGGALQAK
2411	CAA AAS ASP SPF PFS FSG SGA GAG AGS GSY SYQ YQL QLT LTF	KLGGALQAK
34222	CVV VVV VVS VSG SGN GNT NTP TPL PLV LVF	KLGGALQAK
24685	CAV AVR VRD RDV DVW VWG WGK GKL KLQ LQF	GLCTLVAML
34987	CAL ALS LSE SEG EGL GLT LTF	KLGGALQAK
18109	CAD ADS DSG SGG GGG GGA GAD ADG DGL GLT LTF	RAKFKQLL
27953	CAM AMR MRV RVN VNS NSG SGT GTY TYK YKY KYI YIF	GLCTLVAML
34167	CIL ILR LRL RLS LSY SYN YNT NTD TDK DKL KLI LIF	KLGGALQAK
14680	CAG AGH GHT HTG TGN GNQ NQF QFY FYF	RAKFKQLL
34351	CAV AVR VRF RFT FTS TSG SGT GTY TYK YKY KYI YIF	KLGGALQAK
99	CAL ALD LDE DEA EAG AGT GTA TAS ASK SKL KLT LTF	KLGGALQAK
13891	CAA AAS ASE SET ETS TSY SYD YDK DKV KVI VIF	RAKFKQLL
532	CAA AAT ATN TNS NSN SNS NSG SGY GYA YAL ALN LNF	IVTDFSVIK
35233	CAL ALR LRF RFI FIS ISN SNF NFG FGN GNE NEK EKL KLT LTF	KLGGALQAK
25274	CAV AVR VRG RGQ GQA QAG AGT GTA TAL ALI LIF	KLGGALQAK
32358	CAE AES ESG SGP GPD PDS DSW SWG WGK GKF KFQ FQF	GILGFVFTL
35904	CIA IAR ARS RSG SGT GTY TYK YKY KYI YIF	KLGGALQAK
5984	CAA AAR ARV RVR VRG RGF GFG FGN GNV NVL VLH LHC	GILGFVFTL
6550	CAV AVR VRS RSM SMD MDS DSN SNY NYQ YQL QLI LIW	KLGGALQAK
88	CAV AVQ VQP QPF PFS FSG SGG GGY GYN YNK NKL KLI LIF	KLGGALQAK
13988	CAA AAS ASE SET ETS TSY SYD YDK DKV KVI VIF	RAKFKQLL
32248	CAE AEN ENM NMG MGG GGG GGS GSQ SQG QGN GNL NLI LIF	GILGFVFTL
5173	CAV AVS VSE SEN ENR NRD RDD DDK DKI KII IIF	GLCTLVAML
25722	CIL ILR LRE RET ETS TSY SYD YDK DKV KVI VIF	GILGFVFTL
90	CAV AVN VNA NAR ARG RGA GAQ AQK QKL KLV LVF	KLGGALQAK
34896	CVV VVS VSA SAG AGY GYS YSG SGN GNT NTP TPL PLV LVF	KLGGALQAK
13269	CAV AVH VHG HGY GYG YGQ GQN QNF NFV FVF	RAKFKQLL
34027	CLV LVG VGE GES ESV SVG VGN GNN NNN NND NDM DMR MRF	KLGGALQAK
2625	CAV AVR VRT RTT TTG TGT GTA TAS ASK SKL KLT LTF	IVTDFSVIK
7693	CAT ATD TDS DSY SYG YGQ GQN QNF NFV FVF	KLGGALQAK
18070	CAA AAS ASE SET ETS TSY SYD YDK DKV KVI VIF	RAKFKQLL
35823	CVR VRR RRA RAG AGG GGS GSY SYI YIP IPT PTF	ELAGIGILTV
155	CAV AVN VNG NGN GNQ NQF QFY FYF	ELAGIGILTV
34105	CAV AVY VYS YSG SGG GGG GGA GAD ADG DGL GLT LTF	KLGGALQAK
673	CAV AVG VGH GHS HSG SGN GNT NTP TPL PLV LVF	KLGGALQAK
34812	CAV AVD VDP DPL PLS LSS SSG SGS GSA SAR ARQ RQL QLT LTF	KLGGALQAK
36288	CAV AVR VRV RVR VRR RRQ RQL QLT LTF	KLGGALQAK
36069	CAT ATD TDS DSG SGT GTY TYK YKY KYI YIF	KLGGALQAK
5078	CAV AVG VGD GDN DNF NFN FNK NKF KFY FYF	AVFDRKSDAK
24985	CAT ATD TDR DRA RAG AGS GSA SAR ARQ RQL QLI LIF	KLGGALQAK
31368	CAM AMR MRG RGD GDA DAG AGG GGT GTS TSY SYG YGK GKL KLT LTF	GILGFVFTL
26019	CAG AGA GAQ AQG QGG GGG GGS GSQ SQG QGN GNL NLI LIF	GILGFVFTL
34095	CAV AVR VRD RDE DEY EYG YGG GGS GSQ SQG QGN GNL NLI LIF	KLGGALQAK
35411	CAV AVI VIS ISG SGG GGS GSY SYI YIP IPT PTF	KLGGALQAK
17957	CAA AAM AME MET ETS TSY SYD YDK DKV KVI VIF	RAKFKQLL
14678	CAV AVN VNL NLG LGG GGG GGS GSQ SQG QGN GNL NLI LIF	GILGFVFTL
28714	CAV AVL VLD LDS DSN SNY NYQ YQL QLI LIW	KLGGALQAK
29649	CAV AVR VRA RAL ALN LND NDY DYK YKL KLS LSF	GILGFVFTL
24349	CAA AAS ASM SMD MDS DSN SNY NYQ YQL QLI LIW	IVTDFSVIK
35791	CAL ALA LAP APT PTT TTD TDS DSW SWG WGK GKF KFQ FQF	KLGGALQAK
5374	CAV AVR VRD RDP DPY PYQ YQT QTG TGG GGY GYN YNK NKL KLI LIF	KLGGALQAK
23245	CAA AAK AKE KEG EGG GGS GSE SEK EKL KLV LVF	RAKFKQLL
5462	CAV AVN VNT NTG TGD GDM DMR MRF	ELAGIGILTV
33482	CAV AVG VGT GTA TAR ARL RLM LMF	RAKFKQLL
25241	CAG AGS GSN SNS NSG SGA GAG AGS GSY SYQ YQL QLT LTF	GLCTLVAML
34340	CAV AVY VYG YGA GAG AGG GGT GTS TSY SYG YGK GKL KLT LTF	KLGGALQAK
2493	CAF AFG FGS GSS SSS SSA SAS ASK SKI KII IIF	KLGGALQAK
280	CYS YST STW TWR WRL RLS LSC SCL CLL LLL LLC LCR CRD RDS DSA SAG AGA GAG AGS GSY SYQ YQL QLT LTF	KLGGALQAK
35625	CAL ALS LSE SEA EAL ALG LGG GGR GRR RRA RAL ALT LTF	KLGGALQAK
23002	CVV VVR VRL RLS LSG SGA GAG AGS GSY SYQ YQL QLT LTF	KLGGALQAK
5233	CLV LVG VGD GDS DSW SWG WGK GKL KLQ LQF	KLGGALQAK
28368	CAV AVD VDE DEG EGG GGG GGS GSQ SQG QGN GNL NLI LIF	GILGFVFTL
34677	CAG AGS GSG SGT GTG TGF GFQ FQK QKL KLV LVF	KLGGALQAK
35822	CAV AVG VGG GGY GYN YNK NKL KLI LIF	KLGGALQAK
35567	CAV AVR VRD RDS DSA SAS ASG SGT GTY TYK YKY KYI YIF	KLGGALQAK
23231	CIL ILM LMR MRG RGA GAQ AQK QKL KLV LVF	KLGGALQAK
6559	CAE AER ERV RVE VED EDG DGQ GQK QKL KLL LLF	AVFDRKSDAK
5443	CAV AVT VTE TEE EEK EKG KGA GAQ AQK QKL KLV LVF	KLGGALQAK
25718	CAL ALL LLS LSQ SQG QGP GPG PGP GPG PGR GRK RKA KAY AYL YLR LRT	RAKFKQLL
31633	CAS ASF SFT FTG TGG GGG GGN GNK NKL KLT LTF	GILGFVFTL
2861	CAL ALR LRK RKT KTQ TQG QGA GAQ AQK QKL KLV LVF	IVTDFSVIK
24322	CAA AAK AKE KEG EGY GYS YST STL TLT LTF	RAKFKQLL
25907	CAV AVK VKT KTS TSY SYD YDK DKV KVI VIF	KLGGALQAK
221	CAV AVE VED EDD DDT DTG TGR GRR RRA RAL ALT LTF	KLGGALQAK
6664	CAF AFM FMI MIN INA NAG AGG GGT GTS TSY SYG YGK GKL KLT LTF	GILGFVFTL
26492	CAE AED EDS DSN SNA NAR ARL RLM LMF	GLCTLVAML
2577	CIL ILQ LQE QET ETS TSG SGS GSR SRL RLT LTF	KLGGALQAK
13825	CAA AAS ASE SET ETS TSY SYD YDK DKV KVI VIF	RAKFKQLL
34998	CAM AMS MSA SAN ANA NAG AGG GGT GTS TSY SYG YGK GKL KLT LTF	KLGGALQAK
77	CAV AVN VNQ NQG QGG GGK GKL KLI LIF	ELAGIGILTV
34913	CAT ATD TDR DRG RGG GGK GKL KLT LTF	KLGGALQAK
30422	CAA AAR ARM RMI MIK IKA KAA AAG AGN GNK NKL KLT LTF	GILGFVFTL
35821	CAV AVS VSP SPP PPN PNF NFG FGN GNE NEK EKL KLT LTF	KLGGALQAK
35119	CAL ALG LGV GVT VTP TPT PTM TMD MDS DSN SNY NYQ YQL QLI LIW	KLGGALQAK
33206	CAE AEM EME MEG EGG GGS GSY SYI YIP IPT PTF	RAKFKQLL
35217	CAV AVM VMR MRN RNT NTG TGF GFQ FQK QKL KLV LVF	KLGGALQAK
24642	CVV VVS VSD SDG DGG GGG GGA GAD ADG DGL GLT LTF	KLGGALQAK
34391	CAV AVR VRN RND NDY DYK YKL KLS LSF	KLGGALQAK
269	CAA AAL ALE LEL ELN LNY NYG YGQ GQN QNF NFV FVF	GILGFVFTL
35082	CAL ALS LSE SEN ENN NNN NNA NAG AGN GNM NML MLT LTF	KLGGALQAK
26563	CAA AAA AAR ARM RMD MDS DSS SSY SYK YKL KLI LIF	RAKFKQLL
31970	CAL ALG LGF GFA FAA AAD ADG DGQ GQK QKL KLL LLF	GILGFVFTL
33923	CAG AGT GTD TDS DSN SNY NYQ YQL QLI LIW	KLGGALQAK
34472	CAA AAR ARQ RQA QAS ASQ SQG QGN GNL NLI LIF	KLGGALQAK
24998	CAA AAM AME MET ETS TSY SYD YDK DKV KVI VIF	RAKFKQLL
5537	CAV AVS VSD SDQ DQG QGA GAN ANN NNL NLF LFF	KLGGALQAK
25924	CAY AYR YRS RSF SFV FVW VWS WSN SNN NND NDM DMR MRF	GILGFVFTL
2410	CAL ALP LPA PAG AGG GGR GRR RRA RAL ALT LTF	KLGGALQAK
35562	CAV AVS VSP SPV PVS VSS SSG SGS GSA SAR ARQ RQL QLT LTF	KLGGALQAK
24567	CAL ALQ LQR QRG RGT GTY TYK YKY KYI YIF	RAKFKQLL
35635	CAV AVW VWY WYM YMR MRF	KLGGALQAK
36006	CVV VVS VSL SLV LVN VNT NTD TDK DKL KLI LIF	KLGGALQAK
5803	CAA AAT ATG TGS GSQ SQG QGN GNL NLI LIF	GILGFVFTL
5	CAG AGG GGG GGS GSQ SQG QGN GNL NLI LIF	GILGFVFTL
4952	CLV LVA VAP APG PGG GGY GYN YNK NKL KLI LIF	IVTDFSVIK
22312	CAI AIN ING NGG GGA GAT ATN TNK NKL KLI LIF	AVFDRKSDAK
6568	CAA AAR ARQ RQD QDS DSG SGY GYS YST STL TLT LTF	KLGGALQAK
34345	CAV AVS VSG SGT GTT TTG TGG GGG GGN GNK NKL KLT LTF	KLGGALQAK
35268	CAV AVQ VQA QAG AGG GGY GYQ YQK QKV KVT VTF	KLGGALQAK
36244	CAL ALE LEG EGF GFP FPN PNY NYK YKY KYI YIF	AVFDRKSDAK
69	CAV AVS VSE SEK EKN KNR NRD RDD DDK DKI KII IIF	KLGGALQAK
17879	CAL ALN LNQ NQA QAG AGT GTA TAL ALI LIF	RAKFKQLL
31679	CAM AMS MSG SGE GEG EGG GGS GSQ SQG QGN GNL NLI LIF	GILGFVFTL
263	CAA AAS ASG SGR GRV RVS VSG SGG GGS GSN SNY NYK YKL KLT LTF	KLGGALQAK
34055	CAV AVR VRP RPR PRA RAD ADG DGG GGA GAT ATN TNK NKL KLI LIF	KLGGALQAK
27521	CAF AFL FLG LGG GGA GAN ANN NNL NLF LFF	RAKFKQLL
23833	CAT ATD TDD DDP DPR PRA RAA AAG AGG GGS GSY SYI YIP IPT PTF	KLGGALQAK
7666	CAL ALS LSE SEA EAG AGP GPD PDK DKL KLI LIF	RAKFKQLL
23209	CAA AAS ASE SET ETS TSY SYD YDK DKV KVI VIF	RAKFKQLL
34142	CVV VVI VIT ITG TGR GRR RRA RAL ALT LTF	KLGGALQAK
2407	CAV AVQ VQG QGG GGK GKL KLI LIF	KLGGALQAK
23478	CAD ADS DSG SGG GGG GGA GAD ADG DGL GLT LTF	RAKFKQLL
35777	CAV AVA VAP APT PTG TGG GGF GFK FKT KTI TIF	KLGGALQAK
35300	CAE AEI EIA IAA AAN ANS NSN SNS NSG SGY GYA YAL ALN LNF	KLGGALQAK
36267	CAT ATD TDR DRD RDD DDK DKI KII IIF	KLGGALQAK
34855	CAQ AQT QTG TGA GAN ANN NNL NLF LFF	KLGGALQAK
36070	CAY AYR YRM RMY MYS YSG SGG GGG GGA GAD ADG DGL GLT LTF	KLGGALQAK
5409	CAV AVD VDS DSG SGG GGG GGA GAD ADG DGL GLT LTF	ELAGIGILTV
31493	CAY AYS YSP SPA PAA AAG AGG GGT GTS TSY SYG YGK GKL KLT LTF	GILGFVFTL
33476	CAL ALL LLS LST STG TGN GNQ NQF QFY FYF	KLGGALQAK
36134	CAV AVD VDL DLM LMK MKT KTS TSY SYD YDK DKV KVI VIF	IVTDFSVIK
5241	CAL ALG LGE GEQ EQI QIP IPR PRR RRN RNN NNA NAR ARL RLM LMF	ELAGIGILTV
7	CAF AFM FMK MKG KGA GAG AGG GGT GTS TSY SYG YGK GKL KLT LTF	GILGFVFTL
35056	CAG AGH GHD HDG DGN GND NDY DYK YKL KLS LSF	KLGGALQAK
37	CAG AGG GGG GGS GSQ SQG QGN GNL NLI LIF	GILGFVFTL
2562	CAA AAS ASE SET ETG TGR GRR RRA RAL ALT LTF	KLGGALQAK
34949	CAA AAI AIR IRH RHG HGN GNQ NQF QFY FYF	KLGGALQAK
5017	CAV AVA VAV AVI VIQ IQG QGA GAQ AQK QKL KLV LVF	KLGGALQAK
24235	CAA AAS ASE SET ETS TSY SYD YDK DKV KVI VIF	RAKFKQLL
5093	CAV AVH VHG HGY GYG YGQ GQN QNF NFV FVF	KLGGALQAK
14320	CVP VPY PYS YSG SGG GGG GGA GAD ADG DGL GLT LTF	KLGGALQAK
5125	CAV AVN VNV NVR VRG RGK GKL KLI LIF	ELAGIGILTV
25706	CAA AAS ASL SLT LTG TGY GYS YSS SSA SAS ASK SKI KII IIF	KLGGALQAK
34698	CAV AVR VRE RES ESN SNY NYG YGQ GQN QNF NFV FVF	KLGGALQAK
28283	CAM AMT MTG TGS GSG SGG GGS GSN SNY NYK YKL KLT LTF	RAKFKQLL
31938	CAT ATD TDA DAG AGG GGG GGS GSQ SQG QGN GNL NLI LIF	GILGFVFTL
34160	CIL ILR LRD RDG DGG GGG GGA GAD ADG DGL GLT LTF	KLGGALQAK
32363	CAY AYS YSV SVN VNA NAG AGG GGT GTS TSY SYG YGK GKL KLT LTF	GILGFVFTL
34149	CAL ALS LSE SEA EAA AAG AGA GAN ANS NSK SKL KLT LTF	KLGGALQAK
27061	CAA AAS AST STN TNA NAR ARL RLM LMF	KLGGALQAK
14625	CAV AVI VIS ISN SNS NSG SGY GYA YAL ALN LNF	GLCTLVAML
25994	CAV AVN VNA NAG AGF GFQ FQK QKL KLV LVF	ELAGIGILTV
2402	CAV AVR VRD RDS DSS SSS SSA SAS ASK SKI KII IIF	KLGGALQAK
4164	CAV AVD VDF DFR FRD RDN DNY NYG YGQ GQN QNF NFV FVF	IVTDFSVIK
4960	CAF AFM FMN MNV NVD VDD DDK DKI KII IIF	KLGGALQAK
5500	CAT ATG TGA GAG AGG GGA GAD ADG DGL GLT LTF	ELAGIGILTV
28828	CAV AVY VYA YAP APP PPN PNA NAG AGG GGT GTS TSY SYG YGK GKL KLT LTF	RAKFKQLL
35816	CAV AVR VRD RDP DPQ PQA QAI AIS ISN SNF NFG FGN GNE NEK EKL KLT LTF	KLGGALQAK
26018	CGT GTE TEP EPK PKR KRG RGG GGA GAD ADG DGL GLT LTF	KLGGALQAK
3312	CAM AMR MRE REP EPL PLT LTQ TQG QGG GGS GSE SEK EKL KLV LVF	IVTDFSVIK
9813	CAE AEG EGP GPR PRG RGG GGA GAD ADG DGL GLT LTF	RAKFKQLL
24219	CAI AII IIT ITG TGG GGG GGN GNK NKL KLT LTF	RAKFKQLL
33931	CAA AAE AEV EVM VMG MGD GDY DYK YKL KLS LSF	RAKFKQLL
36175	CSG SGL GLS LSG SGG GGG GGA GAD ADG DGL GLT LTF	IVTDFSVIK
14679	CLV LVG VGD GDT DTG TGT GTA TAS ASK SKL KLT LTF	KLGGALQAK
38404	CAM AMR MRE REG EGE GED EDS DSS SSY SYK YKL KLI LIF	IVTDFSVIK
31899	CAG AGV GVE VEY EYG YGG GGS GSQ SQG QGN GNL NLI LIF	GILGFVFTL
6	CIV IVR VRV RVA VAN ANT NTD TDK DKL KLI LIF	GILGFVFTL
35176	CIL ILR LRD RDS DSG SGT GTY TYK YKY KYI YIF	KLGGALQAK
24996	CAV AVN VNG NGN GNN NNR NRL RLA LAF	RAKFKQLL
35165	CAL ALD LDG DGN GNA NAR ARL RLM LMF	KLGGALQAK
29953	CAV AVP VPS PSG SGG GGY GYN YNK NKL KLI LIF	GILGFVFTL
17044	CVA VAR ARG RGV GVN VNS NSG SGG GGG GGA GAD ADG DGL GLT LTF	KLGGALQAK
35283	CAV AVK VKF KFL FLA LAG AGG GGT GTS TSY SYG YGK GKL KLT LTF	KLGGALQAK
34857	CAL ALR LRD RDN DNN NNA NAG AGN GNM NML MLT LTF	KLGGALQAK
5234	CAL ALS LSE SEA EAS ASG SGT GTY TYK YKY KYI YIF	KLGGALQAK
34515	CIV IVR VRV RVE VEG EGF GFH FHS HSG SGG GGG GGA GAD ADG DGL GLT LTF	KLGGALQAK
591	CAV AVG VGG GGG GGG GGA GAD ADG DGL GLT LTF	ELAGIGILTV
190	CAV AVK VKS KSQ SQG QGG GGK GKL KLI LIF	KLGGALQAK
7074	CAG AGG GGG GGQ GQG QGG GGS GSQ SQG QGN GNL NLI LIF	GILGFVFTL
5065	CAM AMR MRE REA EAT ATS TSG SGA GAG AGS GSY SYQ YQL QLT LTF	KLGGALQAK
7355	CAD ADS DSG SGG GGG GGA GAD ADG DGL GLT LTF	RAKFKQLL
2451	CAV AVE VES ESR SRG RGG GGF GFK FKT KTI TIF	KLGGALQAK
34893	CAV AVR VRG RGG GGS GSY SYI YIP IPT PTF	KLGGALQAK
28453	CAV AVS VSK SKD KDS DSS SSN SNT NTG TGK GKL KLI LIF	KLGGALQAK
34960	CAE AES ESK SKH KHN HNQ NQG QGG GGK GKL KLI LIF	KLGGALQAK
5432	CAV AVA VAS ASD SDS DSN SNY NYQ YQL QLI LIW	KLGGALQAK
15980	CAF AFM FMI MIN INA NAG AGG GGT GTS TSY SYG YGK GKL KLT LTF	RAKFKQLL
28886	CAG AGG GGG GGS GSQ SQG QGN GNL NLI LIF	GILGFVFTL
35175	CAF AFI FIG IGD GDA DAG AGG GGT GTS TSY SYG YGK GKL KLT LTF	KLGGALQAK
14333	CAA AAM AME MET ETS TSY SYD YDK DKV KVI VIF	RAKFKQLL
26525	CAE AEP EPK PKG KGG GGT GTY TYK YKY KYI YIF	GLCTLVAML
2480	CAV AVP VPS PSN SND NDY DYK YKL KLS LSF	KLGGALQAK
37689	CAT ATA TAS ASS SST STD TDS DSW SWG WGK GKL KLQ LQF	IVTDFSVIK
2457	CAV AVR VRL RLY LYN YNT NTD TDK DKL KLI LIF	KLGGALQAK
35984	CAM AMN MNT NTG TGF GFQ FQK QKL KLV LVF	KLGGALQAK
35063	CAM AMR MRE REG EGP GPL PLY LYS YSA SAR ARQ RQL QLT LTF	KLGGALQAK
7083	CAV AVN VNE NEG EGG GGG GGS GSQ SQG QGN GNL NLI LIF	GILGFVFTL
34696	CAV AVN VNG NGF GFG FGN GNV NVL VLH LHC	KLGGALQAK
35131	CAV AVE VEK EKD KDS DSN SNY NYQ YQL QLI LIW	KLGGALQAK
2239	CVG VGK GKD KDG DGQ GQK QKL KLL LLF	KLGGALQAK
7328	CAF AFM FMK MKH KHV HVS VSS SSG SGG GGS GSN SNY NYK YKL KLT LTF	KLGGALQAK
36280	CAV AVN VNW NWE WEE EEQ EQG QGG GGS GSY SYI YIP IPT PTF	KLGGALQAK
33993	CAV AVD VDN DNP NPL PLW LWD WDD DDK DKI KII IIF	KLGGALQAK
35601	CAM AMS MSA SAV AVV VVK VKT KTS TSY SYD YDK DKV KVI VIF	KLGGALQAK
28	CAA AAS ASE SET ETS TSY SYD YDK DKV KVI VIF	RAKFKQLL
14240	CIL ILR LRE RET ETS TSY SYD YDK DKV KVI VIF	RAKFKQLL
26152	CAV AVN VNQ NQA QAG AGT GTA TAL ALI LIF	KLGGALQAK
34860	CAV AVT VTY TYY YYG YGQ GQN QNF NFV FVF	KLGGALQAK
25045	CAV AVR VRV RVS VSL	RAKFKQLL
623	CAV AVD VDI DIN INN NND NDM DMR MRF	KLGGALQAK
25899	CAD ADS DSG SGG GGG GGA GAD ADG DGL GLT LTF	RAKFKQLL
34307	CAV AVQ VQA QAD ADD DDY DYK YKL KLS LSF	KLGGALQAK
35260	CVV VVN VNS NSN SNS NSG SGY GYA YAL ALN LNF	KLGGALQAK
34039	CAA AAT ATA TAS ASN SNA NAR ARL RLM LMF	KLGGALQAK
21860	CAA AAK AKE KEG EGY GYS YST STL TLT LTF	RAKFKQLL
148	CAA AAS ASD SDL DLA LAR ARL RLM LMF	KLGGALQAK
26498	CAM AMR MRA RAI AIK IKA KAA AAG AGN GNK NKL KLT LTF	KLGGALQAK
32609	CAM AMN MNY NYG YGG GGS GSQ SQG QGN GNL NLI LIF	GILGFVFTL
31933	CAG AGN GNY NYG YGG GGS GSQ SQG QGN GNL NLI LIF	GILGFVFTL
6093	CAG AGN GNY NYG YGG GGS GSQ SQG QGN GNL NLI LIF	GILGFVFTL
17970	CAA AAS ASE SET ETS TSY SYD YDK DKV KVI VIF	RAKFKQLL
6254	CAA AAS ASA SAS ASN SNN NNN NND NDM DMR MRF	GILGFVFTL
34785	CAT ATD TDP DPF PFQ FQG QGA GAQ AQK QKL KLV LVF	KLGGALQAK
25102	CVV VVR VRF RFT FTG TGG GGG GGN GNK NKL KLT LTF	GLCTLVAML
79	CAL ALS LSG SGP GPY PYS YSS SSA SAS ASK SKI KII IIF	RAKFKQLL
26546	CAV AVN VNQ NQA QAG AGT GTA TAL ALI LIF	KLGGALQAK
8151	CVG VGY GYT YTN TNA NAG AGK GKS KST STF	RAKFKQLL
15288	CAL ALS LSE SEA EAK AKD KDE DEG EGS GSE SEK EKL KLV LVF	KLGGALQAK
34958	CAM AMR MRE REI EIV IVW VWT WTG TGG GGF GFK FKT KTI TIF	KLGGALQAK
34431	CAV AVR VRD RDL DLD LDS DSN SNY NYQ YQL QLI LIW	KLGGALQAK
5660	CAV AVN VNA NAG AGG GGG GGS GSQ SQG QGN GNL NLI LIF	GILGFVFTL
33755	CAV AVN VNE NEV EVE VEG EGG GGK GKL KLI LIF	GILGFVFTL
14955	CAW AWM WMD MDS DSS SSY SYK YKL KLI LIF	RAKFKQLL
149	CAV AVP VPK PKV KVD VDS DSN SNY NYQ YQL QLI LIW	KLGGALQAK
30539	CIV IVR VRA RAY AYN YNN NNN NND NDM DMR MRF	GILGFVFTL
34354	CAL ALS LSG SGG GGE GER ERS RSN SND NDY DYK YKL KLS LSF	KLGGALQAK
33841	CAG AGN GNY NYG YGG GGS GSQ SQG QGN GNL NLI LIF	GILGFVFTL
8170	CAY AYS YSP SPA PAA AAG AGG GGT GTS TSY SYG YGK GKL KLT LTF	RAKFKQLL
5149	CAA AAA AAR ARM RMD MDS DSS SSY SYK YKL KLI LIF	RAKFKQLL
15308	CAY AYI YIG IGQ GQG QGG GGS GSE SEK EKL KLV LVF	GILGFVFTL
35805	CAV AVR VRD RDI DIL ILG LGQ GQN QNF NFV FVF	KLGGALQAK
7060	CAF AFS FSM SMG MGG GGG GGS GSQ SQG QGN GNL NLI LIF	GILGFVFTL
34126	CAL ALG LGE GEL ELK LKS KSA SAA AAN ANA NAG AGG GGT GTS TSY SYG YGK GKL KLT LTF	KLGGALQAK
15296	CAV AVK VKT KTD TDS DSW SWG WGK GKL KLQ LQF	ELAGIGILTV
25393	CAG AGH GHT HTG TGN GNQ NQF QFY FYF	IVTDFSVIK
0	CAF AFM FMI MIN INA NAG AGG GGT GTS TSY SYG YGK GKL KLT LTF	GILGFVFTL
35464	CAV AVT VTL TLS LSP SPH PHG HGG GGA GAT ATN TNK NKL KLI LIF	KLGGALQAK
27968	CAT ATD TDA DAS ASG SGG GGS GSN SNY NYK YKL KLT LTF	RAKFKQLL
26037	CAA AAS ASG SGG GGK GKL KLI LIF	KLGGALQAK
36123	CAV AVK VKD KDY DYG YGQ GQN QNF NFV FVF	KLGGALQAK
4464	CAP APG PGN GNQ NQF QFY FYF	IVTDFSVIK
26139	CAA AAA AAE AET ETS TSY SYD YDK DKV KVI VIF	RAKFKQLL
25101	CAY AYS YSP SPA PAA AAG AGG GGT GTS TSY SYG YGK GKL KLT LTF	GILGFVFTL
15048	CVV VVN VNI NIP IPF PFN FNP NPG PGK GKL KLI LIF	RAKFKQLL
34138	CAL ALG LGV GVY VYN YNT NTD TDK DKL KLI LIF	KLGGALQAK
2460	CAV AVD VDD DDS DSD SDK DKL KLI LIF	KLGGALQAK
226	CAF AFM FMI MIN INA NAG AGG GGT GTS TSY SYG YGK GKL KLT LTF	GILGFVFTL
35162	CIL ILG LGE GEK EKT KTS TSY SYD YDK DKV KVI VIF	KLGGALQAK
5184	CAD ADD DDN DNN NNA NAR ARL RLM LMF	GLCTLVAML
35470	CAV AVL VLG LGG GGG GGA GAD ADG DGL GLT LTF	KLGGALQAK
35138	CAM AMR MRL RLP LPG PGG GGK GKL KLI LIF	KLGGALQAK
24123	CAV AVK VKA KAA AAG AGN GNK NKL KLT LTF	RAKFKQLL
74	CAG AGQ GQL QLV LVF VFD FDT DTD TDK DKL KLI LIF	RAKFKQLL
24363	CAV AVT VTP TPG PGG GGG GGA GAD ADG DGL GLT LTF	KLGGALQAK
696	CAE AES ESK SKN KNN NNN NNA NAR ARL RLM LMF	KLGGALQAK
24308	CAS ASP SPS PSG SGN GNT NTP TPL PLV LVF	ELAGIGILTV
34862	CIL ILR LRD RDS DSL SLT LTG TGN GNQ NQF QFY FYF	KLGGALQAK
2322	CAV AVR VRS RSS SSG SGG GGS GSY SYI YIP IPT PTF	AVFDRKSDAK
21072	CGA GAD ADR DRG RGG GGA GAN ANN NNL NLF LFF	RAKFKQLL
26559	CAA AAS ASE SEG EGG GGF GFK FKT KTI TIF	RAKFKQLL
25455	CAL ALS LSI SIN INT NTG TGT GTA TAS ASK SKL KLT LTF	KLGGALQAK
4937	CAA AAT ATP TPS PSG SGG GGG GGA GAD ADG DGL GLT LTF	KLGGALQAK
7167	CAG AGA GAL ALG LGS GSS SSN SNT NTG TGK GKL KLI LIF	GILGFVFTL
34969	CAV AVR VRG RGY GYG YGQ GQN QNF NFV FVF	KLGGALQAK
34878	CAV AVL VLP LPS PSS SSG SGS GSA SAR ARQ RQL QLT LTF	KLGGALQAK
35857	CAA AAS ASG SGR GRD RDS DSN SNY NYQ YQL QLI LIW	KLGGALQAK
35155	CAG AGL GLG LGS GSY SYQ YQL QLT LTF	KLGGALQAK
35186	CAE AEN ENR NRS RSG SGA GAG AGS GSY SYQ YQL QLT LTF	KLGGALQAK
34462	CAL ALQ LQL QLD LDT DTG TGR GRR RRA RAL ALT LTF	KLGGALQAK
34347	CAE AEN ENM NMY MYN YNA NAG AGN GNM NML MLT LTF	KLGGALQAK
31553	CAA AAI AIS ISV SVG VGG GGS GSN SNY NYK YKL KLT LTF	GILGFVFTL
34007	CVV VVS VSD SDR DRG RGG GGT GTD TDK DKL KLI LIF	KLGGALQAK
35786	CAA AAL ALA LAD ADN DNQ NQG QGG GGK GKL KLI LIF	KLGGALQAK
5503	CAD ADN DNA NAG AGN GNM NML MLT LTF	KLGGALQAK
35827	CIV IVR VRV RVA VAS ASA SAS ASG SGT GTY TYK YKY KYI YIF	KLGGALQAK
18055	CAE AEM EME MEG EGG GGS GSY SYI YIP IPT PTF	GLCTLVAML
35118	CVV VVS VSF SFN FNA NAG AGN GNN NNR NRK RKL KLI LIW	KLGGALQAK
2580	CAG AGH GHT HTG TGN GNQ NQF QFY FYF	IVTDFSVIK
31406	CAA AAS ASG SGG GGG GGS GSQ SQG QGN GNL NLI LIF	GILGFVFTL
30496	CAG AGQ GQL QLG LGG GGG GGS GSQ SQG QGN GNL NLI LIF	GILGFVFTL
5731	CAG AGA GAD ADG DGS GSS SSN SNT NTG TGK GKL KLI LIF	GILGFVFTL
35965	CAS ASS SSG SGS GSR SRL RLT LTF	KLGGALQAK
27088	CIV IVR VRE REV EVG VGD GDK DKL KLI LIF	RAKFKQLL
34994	CAV AVG VGE GEY EYL YLD LDS DSW SWG WGK GKL KLQ LQF	KLGGALQAK
17983	CAV AVR VRD RDY DYG YGG GGN GNT NTP TPL PLV LVF	KLGGALQAK
17050	CAV AVI VIV IVA VAR ARL RLM LMF	KLGGALQAK
8437	CAY AYG YGG GGS GSQ SQG QGN GNL NLI LIF	RAKFKQLL
28415	CGT GTG TGF GFT FTQ TQG QGG GGS GSE SEK EKL KLV LVF	KLGGALQAK
32699	CAG AGA GAG AGN GNI NIG IGK GKL KLI LIF	GILGFVFTL
27302	CAA AAM AME MET ETS TSY SYD YDK DKV KVI VIF	RAKFKQLL
33483	CAA AAW AWS WSP SPE PEY EYS YST STL TLT LTF	GILGFVFTL
11413	CAA AAP APL PLD LDD DDK DKI KII IIF	RAKFKQLL
28840	CAE AEN ENL NLG LGG GGG GGS GSQ SQG QGN GNL NLI LIF	GILGFVFTL
2341	CAV AVS VSI	ELAGIGILTV
7671	CAA AAT ATE TET ETS TSY SYD YDK DKV KVI VIF	RAKFKQLL
35918	CAG AGF GFL FLR LRN RNR NRD RDD DDK DKI KII IIF	KLGGALQAK
34271	CAM AMS MSR SRL RLE LEG EGD GDK DKL KLI LIF	KLGGALQAK
31840	CAL ALS LSE SEP EPP PPG PGK GKS KSS SSA SAS ASK SKI KII IIF	GILGFVFTL
16951	CAG AGG GGG GGS GSQ SQG QGN GNL NLI LIF	GILGFVFTL
31332	CAG AGK GKG KGG GGG GGS GSQ SQG QGN GNL NLI LIF	GILGFVFTL
26059	CVV VVQ VQG QGG GGA GAD ADG DGL GLT LTF	KLGGALQAK
32334	CAP APR PRT RTS TSG SGT GTY TYK YKY KYI YIF	GILGFVFTL
2389	CAM AMR MRG RGW GWL WLN LNQ NQG QGG GGK GKL KLI LIF	KLGGALQAK
32001	CAV AVN VNQ NQG QGG GGG GGS GSQ SQG QGN GNL NLI LIF	GILGFVFTL
