34213	CAL ALS LSG SGR GRQ RQA QAG AGT GTA TAL ALI LIF	KLGGALQAK
25108	CAE AES ESE SEG EGP GPT PTY TYT YTD TDK DKL KLI LIF	RAKFKQLL
14190	CAE AET ETQ TQD QDS DSN SNY NYQ YQL QLI LIW	RAKFKQLL
34456	CAL ALK LKS KSS SSW SWG WGK GKL KLQ LQF	KLGGALQAK
34478	CAE AEN ENS NSV SVG VGR GRR RRA RAL ALT LTF	KLGGALQAK
26046	CAV AVS VSR SRG RGQ GQA QAG AGT GTA TAL ALI LIF	KLGGALQAK
28455	CAV AVL VLD LDS DSN SNY NYQ YQL QLI LIW	KLGGALQAK
25084	CAG AGA GAS ASG SGG GGG GGS GSQ SQG QGN GNL NLI LIF	GILGFVFTL
15289	CAD ADE DEG EGE GEG EGG GGG GGA GAD ADG DGL GLT LTF	RAKFKQLL
34402	CAP APP PPQ PQT QTG TGA GAN ANN NNL NLF LFF	KLGGALQAK
35033	CAF AFM FMN MNN NNN NNA NAR ARL RLM LMF	KLGGALQAK
28737	CVV VVN VNT NTG TGA GAS ASK SKI KII IIF	KLGGALQAK
26702	CAV AVN VNI NIG IGT GTS TSG SGA GAG AGS GSY SYQ YQL QLT LTF	RAKFKQLL
33843	CAV AVG VGG GGS GSQ SQG QGN GNL NLI LIF	GILGFVFTL
32342	CVV VVS VSA SAG AGL GLG LGK GKT KTS TSY SYD YDK DKV KVI VIF	GILGFVFTL
35569	CAL ALS LSE SEG EGA GAG AGG GGT GTS TSY SYG YGK GKL KLT LTF	KLGGALQAK
153	CAV AVE VEE EEK EKA KAD ADY DYK YKL KLS LSF	KLGGALQAK
34458	CAD ADE DEL ELV LVF	KLGGALQAK
5077	CAV AVE VES ESS SSD SDM DMR MRF	KLGGALQAK
13822	CAA AAS ASE SET ETS TSY SYD YDK DKV KVI VIF	RAKFKQLL
25452	CAA AAI AIQ IQD QDF DFN FNY NYQ YQL QLI LIW	KLGGALQAK
29830	CAM AMS MSG SGD GDG DGG GGS GSQ SQG QGN GNL NLI LIF	GILGFVFTL
31932	CAY AYM YMS MSN SNA NAG AGG GGT GTS TSY SYG YGK GKL KLT LTF	GILGFVFTL
34534	CAL ALS LSE SEG EGA GAR ARD RDD DDK DKI KII IIF	KLGGALQAK
34917	CAE AEL ELN LNA NAG AGN GNN NNR NRK RKL KLI LIW	KLGGALQAK
17892	CAY AYR YRS RSQ SQQ QQG QGG GGS GSE SEK EKL KLV LVF	GILGFVFTL
34530	CAV AVD VDL DLN LNT NTG TGN GNQ NQF QFY FYF	KLGGALQAK
7072	CAL ALS LSE SEA EAY AYA YAG AGN GNN NNR NRK RKL KLI LIW	KLGGALQAK
10378	CAR ARG RGG GGG GGF GFK FKT KTI TIF	RAKFKQLL
16957	CVV VVT VTE TET ETS TSY SYD YDK DKV KVI VIF	RAKFKQLL
11294	CPQ PQG QGA GAQ AQK QKL KLV LVF	RAKFKQLL
14626	CAL ALS LSE SEA EAP APG PGA GAP APD PDG DGL GLT LTF	RAKFKQLL
35759	CAM AMR MRE REG EGF GFN FNN NNA NAG AGN GNM NML MLT LTF	KLGGALQAK
25267	CAV AVI VID IDQ DQG QGG GGK GKL KLI LIF	KLGGALQAK
34520	CAL ALS LSV SVL VLR LRD RDT DTG TGR GRR RRA RAL ALT LTF	KLGGALQAK
34169	CAT ATV TVD VDM DMN MNR NRD RDD DDK DKI KII IIF	KLGGALQAK
28867	CAV AVS VSS SSG SGP GPG PGK GKS KST STF	GILGFVFTL
34474	CAE AEI EIP IPH PHH HHH HHG HGS GSG SGN GNT NTG TGK GKL KLI LIF	KLGGALQAK
5407	CVV VVR VRG RGG GGR GRA RAG AGG GGT GTS TSY SYG YGK GKL KLT LTF	KLGGALQAK
34813	CAM AMR MRE REE EEH EHG HGR GRL RLA LAF	KLGGALQAK
35067	CAA AAS ASS SSG SGT GTY TYK YKY KYI YIF	KLGGALQAK
13910	CAV AVR VRM RMD MDS DSN SNY NYQ YQL QLI LIW	RAKFKQLL
5565	CAY AYM YMS MSN SNA NAG AGG GGT GTS TSY SYG YGK GKL KLT LTF	GILGFVFTL
35001	CAP APY PYS YSG SGA GAN ANS NSK SKL KLT LTF	KLGGALQAK
34923	CAF AFP FPN PNM NMN MNT NTG TGF GFQ FQK QKL KLV LVF	KLGGALQAK
26556	CIV IVR VRE REG EGD GDR DRD RDD DDK DKI KII IIF	RAKFKQLL
137	CAA AAR ARF RFY FYD YDS DSS SSN SNT NTG TGK GKL KLI LIF	KLGGALQAK
35368	CAV AVG VGL GLL LLD LDT DTD TDK DKL KLI LIF	KLGGALQAK
32772	CAT ATE TEG EGA GAY AYS YSG SGA GAG AGS GSY SYQ YQL QLT LTF	GILGFVFTL
25810	CAA AAS ASE SET ETS TSY SYD YDK DKV KVI VIF	RAKFKQLL
34480	CAA AAM AME MEE EET ETS TSG SGS GSR SRL RLT LTF	KLGGALQAK
24636	CAA AAM AMD MDV DVG VGS GSN SNY NYK YKL KLT LTF	KLGGALQAK
35127	CAE AEA EAA AAA AAG AGN GNK NKL KLT LTF	KLGGALQAK
6239	CAL ALD LDP DPD PDT DTD TDK DKL KLI LIF	GILGFVFTL
4966	CAL ALN LNT NTG TGN GNQ NQF QFY FYF	KLGGALQAK
7257	CAM AMS MSP SPS PSN SNF NFG FGN GNE NEK EKL KLT LTF	ELAGIGILTV
34601	CAM AMS MSV SVG VGY GYT YTG TGG GGF GFK FKT KTI TIF	KLGGALQAK
33828	CAG AGH GHW HWD WDL DLG LGN GNN NNA NAR ARL RLM LMF	GILGFVFTL
25080	CAE AEK EKP KPG PGS GSG SGY GYA YAL ALN LNF	KLGGALQAK
25019	CVV VVN VNE NEN ENA NAG AGN GNM NML MLT LTF	KLGGALQAK
15320	CIV IVR VRV RVW VWG WGQ GQA QAG AGT GTA TAL ALI LIF	KLGGALQAK
24382	CAD ADS DSG SGG GGG GGA GAD ADG DGL GLT LTF	RAKFKQLL
15407	CAL ALS LSE SEA EAS ASG SGT GTY TYK YKY KYI YIF	RAKFKQLL
34944	CAA AAS ASL SLF LFG FGN GNE NEK EKL KLT LTF	KLGGALQAK
34688	CAV AVR VRI RIQ IQG QGA GAQ AQK QKL KLV LVF	KLGGALQAK
377	CAV AVR VRR RRG RGG GGR GRN RNT NTG TGT GTA TAS ASK SKL KLT LTF	KLGGALQAK
5445	CAL ALR LRT RTT TTD TDS DSW SWG WGK GKL KLQ LQF	KLGGALQAK
18039	CIL ILW LWV WVA VAA AAG AGN GNK NKL KLT LTF	AVFDRKSDAK
34164	CAA AAS ASA SAG AGN GNQ NQF QFY FYF	KLGGALQAK
5151	CAV AVR VRD RDM DMS MSG SGA GAR ARG RGA GAG AGS GSY SYQ YQL QLT LTF	KLGGALQAK
17010	CAA AAL ALE LET ETS TSY SYD YDK DKV KVI VIF	RAKFKQLL
22985	CIL ILK LKI KIT ITG TGN GNQ NQF QFY FYF	KLGGALQAK
27082	CAA AAT ATE TET ETS TSY SYD YDK DKV KVI VIF	RAKFKQLL
35692	CAM AMR MRE REG EGV GVD VDT DTG TGR GRR RRA RAL ALT LTF	KLGGALQAK
35071	CAG AGV GVY VYA YAG AGG GGT GTS TSY SYG YGK GKL KLT LTF	KLGGALQAK
32884	CAV AVS VSE SEG EGG GGG GGS GSQ SQG QGN GNL NLI LIF	GILGFVFTL
34301	CAE AES ESM SMY MYS YSG SGG GGG GGA GAD ADG DGL GLT LTF	KLGGALQAK
6552	CAT ATD TDG DGG GGG GGG GGS GSQ SQG QGN GNL NLI LIF	GILGFVFTL
14176	CVV VVS VSA SAG AGL GLG LGK GKT KTS TSY SYD YDK DKV KVI VIF	RAKFKQLL
35715	CVV VVS VSF SFL FLN LNG NGS GSG SGN GNT NTG TGK GKL KLI LIF	KLGGALQAK
28771	CAE AET ETF TFN FNA NAR ARL RLM LMF	RAKFKQLL
35026	CAA AAS ASG SGG GGY GYN YNK NKL KLI LIF	KLGGALQAK
31	CAA AAT ATG TGG GGF GFK FKT KTI TIF	KLGGALQAK
5060	CET ETF TFG FGN GNE NEK EKL KLT LTF	KLGGALQAK
26472	CAA AAS ASE SET ETS TSY SYD YDK DKV KVI VIF	RAKFKQLL
35835	CAV AVT VTS TSL SLG LGA GAN ANS NSK SKL KLT LTF	KLGGALQAK
28729	CAD ADS DSG SGG GGG GGA GAD ADG DGL GLT LTF	RAKFKQLL
34047	CAL ALS LSE SEE EEF EFN FND NDY DYK YKL KLS LSF	KLGGALQAK
5028	CAV AVR VRG RGF GFG FGN GNV NVL VLH LHC	KLGGALQAK
7206	CAG AGG GGY GYA YAL ALN LNF	GILGFVFTL
6669	CAM AMR MRE REG EGS GSN SND NDM DMR MRF	KLGGALQAK
31376	CAA AAS ASG SGG GGG GGS GSQ SQG QGN GNL NLI LIF	GILGFVFTL
15304	CAV AVR VRD RDS DSE SEG EGD GDS DSS SSY SYK YKL KLI LIF	RAKFKQLL
7685	CAV AVN VNR NRD RDN DNA NAR ARL RLM LMF	RAKFKQLL
28574	CVV VVS VSD SDL DLA LAK AKE KEY EYG YGN GNK NKL KLV LVF	KLGGALQAK
34395	CAA AAS ASA SAR ARY RYG YGG GGS GSQ SQG QGN GNL NLI LIF	KLGGALQAK
18113	CVV VVS VSR SRG RGK GKS KSS SSG SGD GDK DKL KLT LTF	KLGGALQAK
277	CVV VVK VKR KRS RSS SSN SNT NTG TGK GKL KLI LIF	IVTDFSVIK
15828	CAL ALK LKL KLI LIK IKA KAA AAG AGN GNK NKL KLT LTF	RAKFKQLL
35697	CVV VVN VNH NHN HNT NTG TGN GNQ NQF QFY FYF	KLGGALQAK
15293	CAS ASQ SQP QPF PFQ FQG QGA GAQ AQK QKL KLV LVF	RAKFKQLL
24353	CAA AAS ASE SET ETS TSY SYD YDK DKV KVI VIF	RAKFKQLL
4260	CAM AMR MRE REG EGQ GQA QAG AGS GSA SAR ARQ RQL QLT LTF	IVTDFSVIK
2373	CAM AMR MRT RTG TGE GET ETS TSG SGS GSR SRL RLT LTF	KLGGALQAK
373	CVL VLS LSG SGG GGS GSY SYI YIP IPT PTF	KLGGALQAK
26017	CAG AGG GGG GGS GSQ SQG QGN GNL NLI LIF	GILGFVFTL
16952	CAL ALL LLN LNR NRD RDD DDK DKI KII IIF	KLGGALQAK
5175	CAV AVN VNV NVN VNQ NQA QAG AGT GTA TAL ALI LIF	KLGGALQAK
35847	CAE AES EST STL TLD LDT DTG TGG GGF GFK FKT KTI TIF	KLGGALQAK
28876	CVV VVT VTE TET ETS TSY SYD YDK DKV KVI VIF	RAKFKQLL
31124	CAV AVN VNR NRN RNA NAG AGN GNM NML MLT LTF	GILGFVFTL
5252	CAA AAS ASA SAT ATG TGG GGF GFK FKT KTI TIF	KLGGALQAK
24350	CAV AVR VRE RER ERG RGN GNN NNR NRL RLA LAF	KLGGALQAK
32601	CAG AGH GHT HTG TGN GNQ NQF QFY FYF	GILGFVFTL
34897	CAE AET ETD TDQ DQR QRM RMD MDT DTG TGR GRR RRA RAL ALT LTF	KLGGALQAK
35982	CAG AGN GNT NTN TNA NAG AGK GKS KST STF	KLGGALQAK
7239	CAV AVI VID IDK DKL KLI LIF	ELAGIGILTV
35911	CVG VGR GRK RKG KGS GSA SAR ARQ RQL QLT LTF	KLGGALQAK
5071	CAV AVR VRG RGL GLS LSN SNS NSN SNS NSG SGY GYA YAL ALN LNF	RAKFKQLL
34369	CAR ARV RVS VSY SYS YSG SGA GAG AGS GSY SYQ YQL QLT LTF	KLGGALQAK
35888	CAV AVH VHI HIH IHD HDT DTN TNA NAG AGK GKS KST STF	KLGGALQAK
7077	CVV VVS VSR SRM RMD MDS DSS SSY SYK YKL KLI LIF	KLGGALQAK
34177	CAS ASL SLN LNS NSG SGG GGS GSN SNY NYK YKL KLT LTF	KLGGALQAK
34553	CAV AVR VRA RAH AHM HMD MDS DSN SNY NYQ YQL QLI LIW	KLGGALQAK
2490	CAE AES ESI SIT ITG TGK GKL KLI LIF	IVTDFSVIK
15993	CAV AVG VGE GEG EGT GTP TPL PLV LVF	RAKFKQLL
6771	CAV AVT VTS TSD SDP DPN PNQ NQG QGG GGK GKL KLI LIF	GILGFVFTL
27092	CAV AVP VPL PLT LTQ TQG QGL GLT LTF	KLGGALQAK
34412	CAE AET ETN TNS NSG SGT GTY TYK YKY KYI YIF	KLGGALQAK
26015	CAV AVG VGA GAL ALY LYS YSG SGA GAG AGS GSY SYQ YQL QLT LTF	KLGGALQAK
35098	CVV VVR VRS RSG SGG GGY GYN YNK NKL KLI LIF	KLGGALQAK
28718	CAG AGP GPG PGS GSN SND NDY DYK YKL KLS LSF	KLGGALQAK
31618	CVV VVK VKA KAY AYG YGQ GQN QNF NFV FVF	GILGFVFTL
2422	CAV AVN VNP NPE PEG EGA GAS ASK SKI KII IIF	KLGGALQAK
23177	CAA AAS ASE SET ETS TSY SYD YDK DKV KVI VIF	RAKFKQLL
29954	CAG AGG GGG GGD GDG DGG GGS GSQ SQG QGN GNL NLI LIF	GILGFVFTL
4951	CAI AIG IGF GFG FGG GGY GYN YNK NKL KLI LIF	KLGGALQAK
34266	CVV VVS VSA SAI AIE IED EDN DND NDM DMR MRF	KLGGALQAK
34481	CAE AET ETY TYQ YQA QAG AGT GTA TAL ALI LIF	KLGGALQAK
36138	CAE AEI EIP IPS PSG SGA GAG AGS GSY SYQ YQL QLT LTF	KLGGALQAK
33499	CAS ASN SNY NYG YGG GGS GSQ SQG QGN GNL NLI LIF	GILGFVFTL
33547	CAG AGG GGL GLE LEN ENA NAG AGG GGT GTS TSY SYG YGK GKL KLT LTF	GILGFVFTL
23813	CAA AAS ASE SET ETS TSY SYD YDK DKV KVI VIF	RAKFKQLL
28476	CAV AVR VRY RYG YGN GNN NNR NRL RLA LAF	IVTDFSVIK
4980	CAV AVN VNI NIG IGG GGG GGS GSQ SQG QGN GNL NLI LIF	GILGFVFTL
34635	CAG AGN GNT NTP TPL PLV LVF	ELAGIGILTV
23374	CAR ARG RGF GFQ FQK QKL KLV LVF	KLGGALQAK
34225	CAE AEA EAG AGG GGG GGA GAD ADG DGL GLT LTF	KLGGALQAK
35972	CAE AES ESP SPI PIS ISG SGS GSA SAR ARQ RQL QLT LTF	KLGGALQAK
15723	CAF AFM FMK MKD KDA DAG AGG GGT GTS TSY SYG YGK GKL KLT LTF	GILGFVFTL
2527	CAV AVN VNA NAW AWD WDD DDK DKI KII IIF	KLGGALQAK
5551	CAA AAL ALD LDS DSW SWG WGK GKF KFQ FQF	GILGFVFTL
18075	CAA AAK AKE KEG EGY GYS YST STL TLT LTF	AVFDRKSDAK
30409	CAV AVD VDA DAD ADY DYG YGG GGS GSQ SQG QGN GNL NLI LIF	GILGFVFTL
5640	CAF AFM FMV MVN VNA NAG AGG GGT GTS TSY SYG YGK GKL KLT LTF	GILGFVFTL
34383	CIL ILA LAQ AQK QKL KLV LVF	KLGGALQAK
36323	CAG AGA GAK AKN KNR NRD RDD DDK DKI KII IIF	KLGGALQAK
35014	CAG AGR GRG RGS GSN SNY NYK YKL KLT LTF	KLGGALQAK
16091	CAL ALS LSE SES ESD SDG DGQ GQK QKL KLL LLF	RAKFKQLL
26521	CAM AMS MSG SGK GKT KTS TSG SGT GTY TYK YKY KYI YIF	KLGGALQAK
34765	CAV AVK VKA KAA AAG AGN GNK NKL KLT LTF	KLGGALQAK
23241	CAG AGG GGG GGS GSQ SQG QGN GNL NLI LIF	GILGFVFTL
34184	CGT GTE TEE EEG EGP GPG PGA GAQ AQK QKL KLV LVF	KLGGALQAK
661	CAV AVN VNI NIE IET ETG TGA GAN ANN NNL NLF LFF	ELAGIGILTV
27099	CIT ITG TGT GTY TYK YKY KYI YIF	KLGGALQAK
35850	CAL ALS LSE SEA EAG AGT GTY TYK YKY KYI YIF	KLGGALQAK
23205	CAG AGA GAK AKS KST STS TSG SGT GTY TYK YKY KYI YIF	KLGGALQAK
34220	CAV AVN VNA NAE AEG EGS GSG SGN GNT NTG TGK GKL KLI LIF	KLGGALQAK
15794	CAA AAS ASE SET ETS TSY SYD YDK DKV KVI VIF	RAKFKQLL
11	CAM AMR MRT RTP TPN PNN NNA NAG AGN GNM NML MLT LTF	KLGGALQAK
24803	CAG AGG GGG GGQ GQG QGG GGS GSQ SQG QGN GNL NLI LIF	GILGFVFTL
5124	CAL ALS LSE SEA EAY AYA YAG AGG GGT GTS TSY SYG YGK GKL KLT LTF	KLGGALQAK
32594	CAA AAR ARE REE EEG EGD GDA DAR ARL RLM LMF	GILGFVFTL
32002	CAV AVD VDM DMA MAG AGG GGS GSQ SQG QGN GNL NLI LIF	GILGFVFTL
262	CAV AVT VTP TPY PYT YTG TGG GGF GFK FKT KTI TIF	RAKFKQLL
6234	CAV AVS VSG SGS GSQ SQG QGN GNL NLI LIF	GILGFVFTL
14645	CVV VVN VNL NLL LLN LNY NYQ YQL QLI LIW	KLGGALQAK
35829	CVV VVS VSH SHT HTT TTG TGG GGG GGN GNK NKL KLT LTF	KLGGALQAK
242	CAV AVR VRS RSN SNY NYQ YQL QLI LIW	KLGGALQAK
144	CAA AAT ATN TNQ NQA QAG AGT GTA TAL ALI LIF	KLGGALQAK
6855	CAS ASG SGG GGS GSQ SQG QGN GNL NLI LIF	GILGFVFTL
34524	CAE AEP EPY PYN YNF NFN FNK NKF KFY FYF	KLGGALQAK
31861	CAV AVG VGG GGS GSG SGG GGS GSQ SQG QGN GNL NLI LIF	GILGFVFTL
27110	CVV VVN VNI NID IDN DNA NAR ARL RLM LMF	RAKFKQLL
18064	CGT GTE TEY EYP YPN PND NDY DYK YKL KLS LSF	GLCTLVAML
34959	CAA AAG AGA GAQ AQK QKL KLV LVF	KLGGALQAK
24304	CAV AVS VSE SED EDS DSS SSY SYK YKL KLI LIF	KLGGALQAK
5816	CAG AGP GPG PGS GSQ SQG QGN GNL NLI LIF	GILGFVFTL
23663	CVP VPR PRN RNF NFG FGN GNE NEK EKL KLT LTF	RAKFKQLL
5021	CAL ALG LGD GDL DLI LIS ISG SGG GGG GGA GAD ADG DGL GLT LTF	KLGGALQAK
12702	CAM AMR MRE RET ETN TNQ NQA QAG AGT GTA TAL ALI LIF	RAKFKQLL
7996	CAE AEM EME MEG EGG GGS GSY SYI YIP IPT PTF	RAKFKQLL
34982	CAL ALS LSG SGG GGS GSY SYI YIP IPT PTF	KLGGALQAK
36212	CAV AVD VDL DLM LMK MKT KTS TSY SYD YDK DKV KVI VIF	IVTDFSVIK
6259	CAG AGS GSS SSG SGG GGS GSQ SQG QGN GNL NLI LIF	GILGFVFTL
36179	CAA AAS ASK SKG KGN GNN NNA NAR ARL RLM LMF	KLGGALQAK
34764	CAR ART RTG TGG GGS GSR SRL RLT LTF	KLGGALQAK
16000	CAV AVL VLD LDS DSN SNY NYQ YQL QLI LIW	KLGGALQAK
36311	CIV IVR VRV RVA VAG AGG GGG GGG GGN GNK NKL KLT LTF	KLGGALQAK
17881	CLV LVG VGD GDK DKG KGD GDD DDK DKI KII IIF	KLGGALQAK
28306	CAV AVR VRG RGN GNY NYG YGQ GQN QNF NFV FVF	KLGGALQAK
31928	CGT GTG TGV GVV VVS VSG SGG GGG GGA GAD ADG DGL GLT LTF	GILGFVFTL
24381	CAE AEN ENK NKR KRE REA EAG AGN GNT NTP TPL PLV LVF	RAKFKQLL
34425	CAV AVG VGG GGR GRA RAG AGS GSY SYQ YQL QLT LTF	KLGGALQAK
14263	CAV AVR VRP RPT PTS TSG SGT GTY TYK YKY KYI YIF	KLGGALQAK
6230	CAG AGN GNY NYG YGG GGS GSQ SQG QGN GNL NLI LIF	GILGFVFTL
35452	CAP APG PGP GPD PDS DSS SSY SYK YKL KLI LIF	KLGGALQAK
122	CAV AVG VGD GDN DNF NFN FNK NKF KFY FYF	AVFDRKSDAK
6635	CAF AFM FMI MIG IGA GAG AGG GGT GTS TSY SYG YGK GKL KLT LTF	GILGFVFTL
3041	CGA GAG AGR GRV RVD VDD DDM DMR MRF	IVTDFSVIK
2364	CAV AVI VIR IRY RYG YGQ GQN QNF NFV FVF	RAKFKQLL
191	CAV AVT VTY TYG YGG GGS GSQ SQG QGN GNL NLI LIF	KLGGALQAK
32667	CAG AGQ GQG QGS GSQ SQG QGN GNL NLI LIF	GILGFVFTL
2418	CAL ALG LGP GPR PRA RAG AGA GAA AAG AGN GNK NKL KLT LTF	KLGGALQAK
23876	CAG AGG GGG GGS GSQ SQG QGN GNL NLI LIF	KLGGALQAK
34294	CAL ALN LNM NMS MSS SSP SPP PPR PRA RAG AGN GNN NNR NRK RKL KLI LIW	KLGGALQAK
35323	CAV AVR VRS RSN SND NDY DYK YKL KLS LSF	KLGGALQAK
6569	CAG AGH GHS HSG SGG GGG GGA GAD ADG DGL GLT LTF	KLGGALQAK
34457	CAV AVR VRD RDS DSN SNY NYQ YQL QLI LIW	KLGGALQAK
25887	CAV AVR VRD RDH DHS HSG SGN GNT NTP TPL PLV LVF	KLGGALQAK
34683	CAV AVR VRD RDS DSH SHG HGS GSG SGN GNT NTG TGK GKL KLI LIF	KLGGALQAK
34498	CAA AAR ARG RGG GGS GSQ SQG QGN GNL NLI LIF	KLGGALQAK
18086	CAV AVG VGS GSS SSA SAS ASK SKI KII IIF	KLGGALQAK
24290	CAV AVV VVG VGT GTG TGN GNQ NQF QFY FYF	GLCTLVAML
5033	CAG AGA GAE AEY EYG YGQ GQN QNF NFV FVF	KLGGALQAK
30429	CAV AVG VGG GGS GSQ SQG QGN GNL NLI LIF	GILGFVFTL
33453	CAV AVD VDP DPM PMD MDT DTG TGR GRR RRA RAL ALT LTF	GILGFVFTL
35343	CAV AVR VRS RSD SDT DTG TGT GTA TAS ASK SKL KLT LTF	KLGGALQAK
31936	CAG AGA GAG AGS GSQ SQG QGN GNL NLI LIF	GILGFVFTL
16949	CAF AFM FMK MKL KLA LAG AGA GAN ANS NSK SKL KLT LTF	KLGGALQAK
36286	CAV AVF VFP FPM PMG MGG GGY GYN YNK NKL KLI LIF	KLGGALQAK
6944	CAF AFM FMI MIN INA NAG AGG GGT GTS TSY SYG YGK GKL KLT LTF	GILGFVFTL
5514	CAV AVP VPA PAG AGG GGT GTS TSY SYG YGK GKL KLT LTF	ELAGIGILTV
34766	CAG AGR GRT RTN TND NDY DYK YKL KLS LSF	KLGGALQAK
17965	CAV AVG VGD GDN DNF NFN FNK NKF KFY FYF	AVFDRKSDAK
24987	CAT ATD TDF DFS FSG SGN GNT NTG TGK GKL KLI LIF	KLGGALQAK
24995	CAA AAY AYG YGQ GQN QNF NFV FVF	KLGGALQAK
14644	CIL ILY LYN YNT NTD TDK DKL KLI LIF	KLGGALQAK
35959	CVV VVN VNT NTM TMN MNT NTG TGF GFQ FQK QKL KLV LVF	KLGGALQAK
1168	CAA AAM AMD MDS DSN SNY NYQ YQL QLI LIW	AVFDRKSDAK
5655	CAV AVG VGE GES ESS SSA SAS ASK SKI KII IIF	GILGFVFTL
35022	CAV AVS VSD SDL DLY LYG YGG GGS GSQ SQG QGN GNL NLI LIF	KLGGALQAK
34951	CAA AAS ASP SPE PEG EGA GAG AGS GSY SYQ YQL QLT LTF	KLGGALQAK
35693	CAM AMR MRG RGP GPY PYS YSS SSN SNT NTG TGK GKL KLI LIF	KLGGALQAK
35135	CAY AYR YRS RSL SLN LNT NTD TDK DKL KLI LIF	IVTDFSVIK
16003	CAE AEM EME MEG EGG GGS GSY SYI YIP IPT PTF	RAKFKQLL
13820	CAA AAS ASE SET ETS TSY SYD YDK DKV KVI VIF	RAKFKQLL
25023	CAM AMS MSW SWG WGR GRD RDD DDK DKI KII IIF	KLGGALQAK
2365	CAG AGS GSH SHP HPD PDT DTG TGT GTA TAS ASK SKL KLT LTF	KLGGALQAK
34726	CAR ARG RGN GNA NAG AGN GNM NML MLT LTF	KLGGALQAK
28731	CAA AAS ASG SGN GNH NHD HDM DMR MRL	RAKFKQLL
26501	CAE AEL ELK LKE KEK EKL KLI LIF	GLCTLVAML
35907	CAL ALS LSE SEA EAF AFS FSG SGN GNT NTP TPL PLV LVF	KLGGALQAK
35694	CAY AYG YGD GDS DSN SNY NYQ YQL QLI LIW	KLGGALQAK
28376	CAL ALR LRA RAG AGN GNQ NQF QFY FYF	KLGGALQAK
5408	CAV AVL VLN LNA NAR ARL RLM LMF	ELAGIGILTV
2384	CAV AVN VNL NLA LAG AGG GGT GTS TSY SYG YGK GKL KLT LTF	ELAGIGILTV
35088	CAV AVR VRD RDL DLG LGY GYQ YQL QLT LTF	KLGGALQAK
28862	CVV VVF VFM FMD MDT DTG TGR GRR RRA RAL ALT LTF	KLGGALQAK
35559	CAE AET ETH THS HSG SGG GGG GGA GAD ADG DGL GLT LTF	KLGGALQAK
18105	CAD ADS DSG SGG GGG GGA GAD ADG DGL GLT LTF	RAKFKQLL
28356	CAV AVS VSG SGS GSG SGG GGS GSN SNY NYK YKL KLT LTF	RAKFKQLL
34453	CAV AVT VTS TSR SRS RSG SGG GGY GYQ YQK QKV KVT VTF	KLGGALQAK
16186	CAV AVV VVP VPG PGN GNT NTG TGK GKL KLI LIF	RAKFKQLL
15156	CAV AVA VAL ALY LYG YGG GGS GSQ SQG QGN GNL NLI LIF	RAKFKQLL
4943	CAY AYW YWT WTN TNR NRD RDD DDK DKI KII IIF	IVTDFSVIK
35957	CAV AVF VFD FDG DGG GGS GSQ SQG QGN GNL NLI LIF	KLGGALQAK
5058	CAA AAP APY PYT YTP TPG PGG GGA GAT ATN TNK NKL KLI LIF	KLGGALQAK
35129	CAV AVK VKD KDR DRG RGS GST STL TLG LGR GRL RLY LYF	KLGGALQAK
35252	CAL ALS LSE SEA EAP APY PYG YGG GGS GSQ SQG QGN GNL NLI LIF	KLGGALQAK
34390	CAM AMS MSY SYA YAT ATD TDS DSW SWG WGK GKL KLQ LQF	KLGGALQAK
22102	CAL ALG LGE GEP EPS PSY SYN YNN NNN NND NDM DMR MRF	RAKFKQLL
34632	CAM AMR MRE REH EHP HPF	KLGGALQAK
5598	CAG AGA GAY AYG YGG GGS GSQ SQG QGN GNL NLI LIF	GILGFVFTL
28827	CAV AVQ VQD QDE DEF EFS FSG SGN GNT NTP TPL PLV LVF	KLGGALQAK
25798	CAA AAM AMD MDS DSN SNY NYQ YQL QLI LIW	RAKFKQLL
25698	CVV VVN VNS NSF SFS FSG SGA GAG AGS GSY SYQ YQL QLT LTF	KLGGALQAK
6705	CAM AMS MSG SGG GGG GGR GRE RET ETS TSG SGS GSR SRL RLT LTF	GILGFVFTL
35229	CAV AVE VEQ EQF QFT FTT TTS TSG SGT GTY TYK YKY KYI YIF	KLGGALQAK
34989	CAA AAS ASS SSN SNS NSG SGG GGS GSN SNY NYK YKL KLT LTF	KLGGALQAK
36115	CAV AVN VNS NSF SFY FYN YNQ NQG QGG GGK GKL KLI LIF	KLGGALQAK
7159	CAE AEN ENM NMR MRN RNT NTD TDK DKL KLI LIF	GILGFVFTL
5270	CAV AVN VNR NRG RGY GYS YST STL TLT LTF	KLGGALQAK
2292	CAV AVE VEG EGP GPT PTD TDS DSW SWG WGK GKF KFQ FQF	KLGGALQAK
24569	CGT GTV TVL VLE LEG EGG GGS GSQ SQG QGN GNL NLI LIF	GILGFVFTL
34725	CAV AVS VSE SEG EGL GLT LTG TGG GGG GGN GNK NKL KLT LTF	KLGGALQAK
28879	CAE AES ESE SEG EGP GPT PTY TYT YTD TDK DKL KLI LIF	RAKFKQLL
34270	CAA AAG AGA GAQ AQK QKL KLV LVF	KLGGALQAK
5022	CAM AMS MSA SAS ASN SNF NFG FGN GNE NEK EKL KLT LTF	GILGFVFTL
34905	CAV AVG VGP GPS PSY SYN YNT NTD TDK DKL KLI LIF	KLGGALQAK
5465	CAV AVT VTN TNY NYG YGG GGA GAT ATN TNK NKL KLI LIF	GILGFVFTL
5264	CAM AMS MSG SGD GDG DGG GGS GSQ SQG QGN GNL NLI LIF	GILGFVFTL
35404	CAL ALG LGE GEL ELG LGA GAA AAG AGN GNK NKL KLT LTF	KLGGALQAK
17063	CAA AAA AAE AET ETS TSY SYD YDK DKV KVI VIF	RAKFKQLL
2236	CAV AVN VNF NFI FIT ITG TGN GNQ NQF QFY FYF	KLGGALQAK
31403	CAG AGA GAP APG PGG GGG GGS GSQ SQG QGN GNL NLI LIF	GILGFVFTL
5070	CIL ILA LAE AET ETS TSY SYD YDK DKV KVI VIF	RAKFKQLL
19401	CAV AVG VGS GSI SIY IYN YNQ NQG QGG GGK GKL KLI LIF	RAKFKQLL
35305	CAT ATD TDA DAD ADY DYG YGQ GQN QNF NFV FVF	KLGGALQAK
35865	CAA AAS ASR SRE REK EKL KLT LTF	KLGGALQAK
34416	CAF AFM FMK MKH KHL HLN LNY NYG YGQ GQN QNF NFV FVF	KLGGALQAK
5228	CAY AYM YMS MSN SNA NAG AGG GGT GTS TSY SYG YGK GKL KLT LTF	GILGFVFTL
594	CAF AFM FMK MKP KPG PGN GNN NND NDM DMR MRF	KLGGALQAK
28456	CAV AVR VRT RTG TGK GKS KST STF	KLGGALQAK
34872	CLV LVS VSQ SQG QGG GGK GKL KLI LIF	KLGGALQAK
17869	CAL ALS LSK SKG KGA GAA AAG AGN GNK NKL KLT LTF	KLGGALQAK
34775	CAV AVR VRD RDN DNT NTG TGK GKL KLI LIF	KLGGALQAK
5249	CEI EIV IVN VNY NYG YGG GGA GAT ATN TNK NKL KLI LIF	KLGGALQAK
869	CAA AAR ARA RAR ARG RGF GFG FGN GNV NVL VLH LHC	AVFDRKSDAK
25073	CAL ALR LRL RLE LEG EGG GGS GSG SGT GTY TYK YKY KYI YIF	GILGFVFTL
34285	CAF AFI FIG IGD GDA DAG AGG GGT GTS TSY SYG YGK GKL KLT LTF	KLGGALQAK
34689	CAS ASS SSS SSG SGG GGG GGA GAD ADG DGL GLT LTF	KLGGALQAK
34577	CAA AAS ASS SST STN TNA NAG AGG GGT GTS TSY SYG YGK GKL KLT LTF	KLGGALQAK
35917	CAV AVV VVP VPR PRH RHT HTS TSG SGT GTY TYK YKY KYI YIF	KLGGALQAK
35971	CAA AAS ASL SLR LRD RDD DDK DKI KII IIF	KLGGALQAK
15215	CAG AGA GAG AGS GSQ SQG QGN GNL NLI LIF	RAKFKQLL
32635	CAV AVP VPL PLT LTG TGG GGG GGN GNK NKL KLT LTF	GILGFVFTL
5404	CAG AGV GVG VGT GTG TGA GAN ANN NNL NLF LFF	RAKFKQLL
17178	CAV AVP VPY PYS YSG SGA GAG AGS GSY SYQ YQL QLT LTF	KLGGALQAK
30425	CAP APF PFT FTG TGY GYQ YQK QKV KVT VTF	GILGFVFTL
5177	CAV AVS VSL SLA LAN ANS NSG SGG GGY GYQ YQK QKV KVT VTF	KLGGALQAK
36245	CAL ALG LGN GNN NNR NRL RLA LAF	KLGGALQAK
6792	CAF AFS FSR SRG RGH GHY HYG YGG GGS GSQ SQG QGN GNL NLI LIF	GILGFVFTL
34784	CAM AMA MAY AYS YSN SNF NFG FGN GNE NEK EKL KLT LTF	ELAGIGILTV
142	CAA AAP APR PRG RGG GGQ GQN QNF NFV FVF	KLGGALQAK
34026	CAV AVD VDR DRY RYN YNN NNN NND NDM DMR MRF	KLGGALQAK
34033	CAY AYG YGT GTS TSY SYD YDK DKV KVI VIF	KLGGALQAK
33961	CVG VGY GYT YTN TNA NAG AGK GKS KST STF	RAKFKQLL
35989	CAV AVG VGA GAN ANA NAG AGG GGT GTS TSY SYG YGK GKL KLT LTF	KLGGALQAK
26548	CAV AVN VNQ NQA QAG AGT GTA TAL ALI LIF	KLGGALQAK
6959	CAV AVN VNT NTP TPP PPF PFY FYF	ELAGIGILTV
34350	CIP IPE PER ERL RLG LGN GNN NNN NNA NAG AGN GNM NML MLT LTF	KLGGALQAK
33986	CAV AVR VRR RRV RVG VGF GFG FGN GNV NVL VLH LHC	KLGGALQAK
34882	CAI AIG IGP GPG PGN GNM NML MLT LTF	KLGGALQAK
34752	CAT ATP TPY PYR YRT RTA TAA AAG AGN GNK NKL KLT LTF	KLGGALQAK
24	CIL ILR LRE RET ETS TSY SYD YDK DKV KVI VIF	GILGFVFTL
24463	CAV AVH VHG HGY GYG YGQ GQN QNF NFV FVF	RAKFKQLL
23829	CAG AGQ GQT QTS TSD SDS DSW SWG WGK GKL KLQ LQF	KLGGALQAK
27068	CVG VGY GYT YTN TNA NAG AGK GKS KST STF	RAKFKQLL
34584	CAV AVS VSG SGG GGG GGA GAD ADG DGL GLT LTF	KLGGALQAK
283	CAA AAY AYS YSG SGG GGG GGA GAD ADG DGL GLT LTF	KLGGALQAK
14126	CAV AVG VGG GGG GGG GGG GGS GSQ SQG QGN GNL NLI LIF	GILGFVFTL
16932	CAV AVE VEH EHM HMD MDS DSN SNY NYQ YQL QLI LIW	RAKFKQLL
15384	CAE AES ESL SLW LWD WDD DDK DKI KII IIF	RAKFKQLL
36314	CAV AVM VMD MDS DSS SSY SYK YKL KLI LIF	KLGGALQAK
35577	CAG AGH GHP HPE PES ESG SGK GKS KST STF	KLGGALQAK
18	CVV VVN VNR NRA RAG AGN GNN NNR NRK RKL KLI LIW	KLGGALQAK
5543	CAV AVG VGG GGT GTG TGK GKL KLI LIF	ELAGIGILTV
258	CAA AAK AKS KSI SIS IST STD TDS DSW SWG WGK GKL KLQ LQF	KLGGALQAK
35887	CIL ILR LRE REK EKS KSG SGG GGS GSN SNY NYK YKL KLT LTF	RAKFKQLL
34975	CAL ALS LSE SEA EAL ALV LVG VGN GNE NEK EKL KLT LTF	KLGGALQAK
25105	CAE AES ESE SEG EGP GPT PTY TYT YTD TDK DKL KLI LIF	RAKFKQLL
29962	CAV AVG VGV GVE VEE EET ETS TSG SGS GSR SRL RLT LTF	GILGFVFTL
5283	CAV AVQ VQA QAR ARG RGN GNK NKL KLV LVF	IVTDFSVIK
2999	CAM AMG MGP GPS PSG SGG GGS GSY SYI YIP IPT PTF	IVTDFSVIK
2487	CAV AVN VNT NTG TGF GFQ FQK QKL KLV LVF	KLGGALQAK
25068	CAL ALK LKP KPN PNA NAG AGN GNM NML MLT LTF	KLGGALQAK
7212	CAG AGQ GQV QVN VNG NGG GGS GSQ SQG QGN GNL NLI LIF	GILGFVFTL
10000	CAV AVG VGP GPT PTD TDP DPG PGY GYS YST STL TLT LTF	RAKFKQLL
35709	CAV AVI VIY IYS YSG SGY GYA YAL ALN LNF	KLGGALQAK
34180	CVV VVN VNT NTG TGS GSS SSN SNT NTG TGK GKL KLI LIF	KLGGALQAK
34312	CAV AVD VDI DIP IPS PSG SGG GGG GGA GAD ADG DGL GLT LTF	KLGGALQAK
23224	CAV AVK VKG KGI GIQ IQG QGA GAQ AQK QKL KLV LVF	KLGGALQAK
5024	CAV AVR VRR RRG RGA GAA AAG AGN GNK NKL KLT LTF	KLGGALQAK
86	CVV VVL VLG LGV GVM VMD MDS DSN SNY NYQ YQL QLI LIW	GILGFVFTL
34076	CVL VLA LAT ATG TGK GKL KLI LIF	KLGGALQAK
23018	CAG AGE GEG EGG GGG GGS GSQ SQG QGN GNL NLI LIF	GILGFVFTL
25408	CVV VVN VNL NLE LEV EVF VFA FAY AYY YYG YGN GNN NNR NRL RLA LAF	GILGFVFTL
5064	CAE AED EDA DAG AGN GNN NNR NRK RKL KLI LIW	RAKFKQLL
34825	CAV AVS VSG SGG GGF GFG FGG GGA GAT ATN TNK NKL KLI LIF	KLGGALQAK
34973	CAM AMR MRG RGP GPF PFS FSS SSN SNT NTG TGK GKL KLI LIF	KLGGALQAK
36075	CAM AMI MIL ILS LSG SGG GGY GYQ YQK QKV KVT VTF	KLGGALQAK
35831	CAE AEK EKT KTS TSY SYD YDK DKV KVI VIF	KLGGALQAK
25721	CAY AYG YGG GGS GSQ SQG QGN GNL NLI LIF	GILGFVFTL
4984	CAV AVS VSS SSG SGY GYS YST STL TLT LTF	KLGGALQAK
6602	CAV AVN VNL NLG LGG GGG GGS GSQ SQG QGN GNL NLI LIF	GILGFVFTL
23214	CAV AVS VSD SDY DYI YII IIQ IQG QGA GAQ AQK QKL KLV LVF	KLGGALQAK
21	CAP APY PYS YSG SGN GNT NTP TPL PLV LVF	ELAGIGILTV
10987	CAA AAS ASN SNT NTG TGK GKL KLI LIF	RAKFKQLL
23127	CAV AVN VNA NAG AGN GNM NML MLT LTF	ELAGIGILTV
6351	CAV AVN VNA NAG AGG GGG GGS GSQ SQG QGN GNL NLI LIF	GILGFVFTL
25394	CAG AGG GGG GGS GSQ SQG QGN GNL NLI LIF	GILGFVFTL
5548	CAD ADS DSG SGG GGG GGA GAD ADG DGL GLT LTF	RAKFKQLL
15581	CAE AEM EME MEG EGG GGS GSY SYI YIP IPT PTF	RAKFKQLL
34955	CIV IVR VRG RGA GAD ADQ DQG QGA GAQ AQK QKL KLV LVF	KLGGALQAK
34758	CVV VVN VNR NRR RRY RYP YPG PGN GNQ NQF QFY FYF	KLGGALQAK
18590	CAL ALS LSE SEN ENG NGR GRS RSQ SQG QGN GNL NLI LIF	RAKFKQLL
5155	CAV AVR VRD RDS DSN SNY NYQ YQL QLI LIW	KLGGALQAK
26040	CAV AVQ VQA QAE AEG EGS GSY SYG YGG GGA GAT ATN TNK NKL KLI LIF	GILGFVFTL
23234	CAT ATG TGL GLT LTG TGG GGG GGN GNK NKL KLT LTF	KLGGALQAK
25222	CGA GAD ADS DSA SAS ASG SGT GTY TYK YKY KYI YIF	RAKFKQLL
5030	CVV VVN VNG NGG GGQ GQA QAG AGT GTA TAL ALI LIF	IVTDFSVIK
28704	CAA AAS ASE SET ETS TSY SYD YDK DKV KVI VIF	RAKFKQLL
34096	CAM AMS MSP SPS PSN SNF NFG FGN GNE NEK EKL KLT LTF	ELAGIGILTV
5018	CAG AGV GVS VSG SGG GGS GSY SYI YIP IPT PTF	KLGGALQAK
35810	CVV VVE VEG EGG GGS GSN SNY NYK YKL KLT LTF	KLGGALQAK
35351	CAV AVS VSL SLR LRG RGD GDM DMR MRF	KLGGALQAK
34616	CAM AMR MRE REG EGL GLQ LQG QGA GAQ AQK QKL KLV LVF	KLGGALQAK
5189	CLV LVG VGD GDG DGW GWE WEY EYG YGN GNK NKL KLV LVF	KLGGALQAK
3040	CAL ALS LSE SEA EAG AGG GGF GFK FKT KTI TIF	IVTDFSVIK
5048	CAV AVN VNG NGV GVK VKT KTS TSY SYD YDK DKV KVI VIF	KLGGALQAK
28823	CAV AVV VVW VWG WGG GGS GSR SRL RLT LTF	GILGFVFTL
31266	CAG AGS GSG SGG GGG GGS GSQ SQG QGN GNL NLI LIF	GILGFVFTL
23118	CAV AVS VSN SNT NTG TGN GNQ NQF QFY FYF	GILGFVFTL
24509	CAV AVG VGA GAR ARD RDY DYG YGQ GQN QNF NFV FVF	RAKFKQLL
34963	CAL ALG LGE GEL ELD LDS DSW SWG WGK GKL KLQ LQF	KLGGALQAK
18066	CAT ATD TDA DAS ASG SGG GGS GSN SNY NYK YKL KLT LTF	RAKFKQLL
34030	CLC LCG CGD GDS DSN SNY NYQ YQL QLI LIW	KLGGALQAK
30648	CAA AAT ATE TET ETS TSY SYD YDK DKV KVI VIF	GILGFVFTL
583	CAV AVP VPN PNS NSG SGG GGG GGA GAD ADG DGL GLT LTF	ELAGIGILTV
10574	CAM AMR MRD RDD DDD DDN DNY NYG YGQ GQN QNF NFV FVF	RAKFKQLL
35003	CAM AMR MRR RRP RPI PIS ISS SSG SGS GSA SAR ARQ RQL QLT LTF	KLGGALQAK
15572	CAA AAS ASE SED EDG DGG GGF GFK FKT KTI TIF	RAKFKQLL
17878	CAD ADS DSG SGG GGG GGA GAD ADG DGL GLT LTF	RAKFKQLL
7068	CAE AEN ENN NNG NGG GGG GGS GSQ SQG QGN GNL NLI LIF	GILGFVFTL
26036	CAT ATD TDP DPG PGS GSN SNY NYK YKL KLT LTF	KLGGALQAK
35845	CIL ILR LRD RDV DVG VGG GGG GGT GTS TSY SYG YGK GKL KLT LTF	KLGGALQAK
