34594	CVV VVS VSD SDF DFQ FQW QWM WMD MDS DSS SSY SYK YKL KLI LIF	KLGGALQAK
212	CAM AMR MRD RDS DSP SPS PSG SGG GGS GSY SYI YIP IPT PTF	RAKFKQLL
5074	CAV AVR VRS RSG SGG GGY GYN YNK NKL KLI LIF	KLGGALQAK
16975	CAE AEM EME MEG EGG GGS GSY SYI YIP IPT PTF	RAKFKQLL
35058	CAV AVD VDV DVT VTG TGA GAG AGS GSY SYQ YQL QLT LTF	KLGGALQAK
246	CAV AVN VNA NAP APG PGS GSS SSG SGD GDK DKL KLT LTF	ELAGIGILTV
35103	CGS GSG SGD GDY DYK YKL KLS LSF	ELAGIGILTV
16937	CAE AEM EME MEG EGG GGS GSY SYI YIP IPT PTF	RAKFKQLL
31856	CAP APR PRA RAL ALS LSG SGA GAQ AQK QKL KLV LVF	GILGFVFTL
26137	CAV AVR VRD RDG DGV GVS VSY SYN YNT NTD TDK DKL KLI LIF	KLGGALQAK
28613	CAL ALS LSE SEP EPT PTR TRD RDD DDK DKI KII IIF	KLGGALQAK
7158	CAR ARA RAT ATN TND NDY DYK YKL KLS LSF	GILGFVFTL
24913	CAG AGL GLN LNN NNN NND NDM DMR MRF	GLCTLVAML
34015	CAV AVR VRP RPD PDG DGQ GQK QKL KLL LLF	KLGGALQAK
25752	CAY AYS YSP SPA PAA AAG AGG GGT GTS TSY SYG YGK GKL KLT LTF	GILGFVFTL
35612	CAM AMR MRE REG EGG GGR GRY RYD YDY DYK YKL KLS LSF	KLGGALQAK
35890	CAA AAT ATA TAT ATN TNF NFG FGN GNE NEK EKL KLT LTF	KLGGALQAK
33598	CAM AMS MSG SGD GDG DGG GGS GSQ SQG QGN GNL NLI LIF	GILGFVFTL
5079	CAM AMM MMN MNT NTG TGF GFQ FQK QKL KLV LVF	KLGGALQAK
2347	CAV AVS VST STG TGF GFQ FQK QKL KLV LVF	ELAGIGILTV
2309	CAG AGG GGI GIY IYG YGG GGS GSQ SQG QGN GNL NLI LIF	KLGGALQAK
25283	CAE AEM EME MET ETS TSY SYD YDK DKV KVI VIF	RAKFKQLL
23817	CAA AAS ASV SVV VVS VSG SGG GGS GSN SNY NYK YKL KLT LTF	KLGGALQAK
34906	CAA AAP APL PLD LDK DKL KLI LIF	KLGGALQAK
28307	CGA GAD ADG DGG GGG GGT GTY TYK YKY KYI YIF	RAKFKQLL
35124	CAA AAG AGP GPS PSG SGG GGY GYQ YQK QKV KVT VTF	KLGGALQAK
33989	CAV AVI VID IDS DSQ SQG QGN GNL NLI LIF	KLGGALQAK
684	CAV AVG VGD GDN DNF NFN FNK NKF KFY FYF	AVFDRKSDAK
2283	CAV AVR VRD RDI DIA IAS ASG SGT GTY TYK YKY KYI YIF	KLGGALQAK
25110	CAE AES ESE SEG EGP GPT PTY TYT YTD TDK DKL KLI LIF	RAKFKQLL
33998	CAG AGY GYN YNT NTD TDK DKL KLI LIF	KLGGALQAK
34363	CAG AGL GLL LLP LPN PNN NNN NND NDM DMR MRF	KLGGALQAK
14058	CAA AAS ASE SET ETS TSY SYD YDK DKV KVI VIF	RAKFKQLL
9154	CAT ATE TEL ELY LYG YGA GAN ANS NSK SKL KLT LTF	RAKFKQLL
33072	CAV AVG VGV GVG VGG GGS GSQ SQG QGN GNL NLI LIF	GILGFVFTL
36201	CAA AAS ASA SAR ARR RRD RDD DDK DKI KII IIF	KLGGALQAK
34774	CVV VVG VGA GAG AGT GTA TAL ALI LIF	KLGGALQAK
240	CAV AVN VNS NSG SGG GGY GYQ YQK QKV KVT VTF	RAKFKQLL
35572	CAV AVR VRD RDL DLG LGP GPG PGS GSG SGG GGY GYQ YQK QKV KVT VTF	KLGGALQAK
31971	CAE AED EDY DYG YGG GGS GSQ SQG QGN GNL NLI LIF	GILGFVFTL
4284	CAG AGH GHT HTG TGN GNQ NQS QSY SYF	IVTDFSVIK
14849	CAV AVG VGE GED EDK DKV KVI VIF	RAKFKQLL
35864	CAM AMR MRE REG EGA GAG AGY GYA YAL ALN LNF	KLGGALQAK
8544	CAV AVS VSI SIG IGA GAY AYG YGG GGS GSQ SQG QGN GNL NLI LIF	RAKFKQLL
35916	CAE AEN ENK NKG KGS GSG SGA GAG AGS GSY SYQ YQL QLT LTF	KLGGALQAK
2374	CAV AVR VRG RGL GLS LSG SGG GGY GYN YNK NKL KLI LIF	KLGGALQAK
2276	CAV AVS VSD SDG DGV GVN VNN NNN NND NDM DMR MRF	KLGGALQAK
31937	CAV AVR VRD RDG DGT GTG TGA GAN ANN NNL NLF LFF	GILGFVFTL
34790	CAT ATV TVD VDN DNS NSG SGG GGS GSN SNY NYK YKL KLT LTF	KLGGALQAK
5487	CAE AEN ENP NPN PNA NAG AGN GNM NML MLT LTF	KLGGALQAK
35950	CAV AVA VAR ARE RET ETS TSG SGS GSR SRL RLT LTF	KLGGALQAK
18230	CAD ADP DPG PGG GGG GGA GAD ADG DGL GLT LTF	RAKFKQLL
30413	CAL ALK LKA KAG AGT GTA TAL ALI LIF	GILGFVFTL
33908	CVV VVS VSA SAG AGY GYA YAL ALN LNF	KLGGALQAK
28458	CAA AAT ATI TIA IAR ARL RLM LMF	KLGGALQAK
28302	CAA AAS ASS SSN SNA NAR ARL RLM LMF	KLGGALQAK
7838	CAV AVS VSG SGS GSQ SQG QGN GNL NLI LIF	GILGFVFTL
630	CAV AVN VNK NKG KGG GGG GGS GSQ SQG QGN GNL NLI LIF	GILGFVFTL
35202	CAV AVW VWY WYM YMR MRF	KLGGALQAK
32019	CAM AMG MGG GGG GGG GGG GGS GSQ SQG QGN GNL NLI LIF	GILGFVFTL
25910	CAG AGA GAR ARE RET ETS TSY SYD YDK DKV KVI VIF	RAKFKQLL
34397	CAV AVT VTL TLN LNQ NQA QAG AGT GTA TAL ALI LIF	KLGGALQAK
30410	CAE AEL ELI LIY IYN YNQ NQG QGG GGK GKL KLI LIF	GILGFVFTL
34429	CAF AFD FDS DSG SGA GAG AGS GSY SYQ YQL QLT LTF	KLGGALQAK
36293	CAA AAP APN PNS NSG SGN GNT NTP TPL PLV LVF	IVTDFSVIK
11304	CAA AAS ASG SGN GNH NHD HDM DMR MRF	RAKFKQLL
34263	CAV AVE VED EDQ DQS QSG SGG GGY GYQ YQK QKV KVT VTF	KLGGALQAK
5421	CAV AVV VVL VLD LDG DGS GSS SSN SNT NTG TGK GKL KLI LIF	KLGGALQAK
18107	CAR ARR RRG RGG GGA GAD ADG DGL GLT LTF	ELAGIGILTV
25391	CPR PRG RGN GNA NAG AGN GNM NML MLT LTF	RAKFKQLL
35428	CAV AVR VRD RDG DGG GGM GMG MGS GSN SNT NTG TGK GKL KLI LIF	KLGGALQAK
7699	CVV VVT VTE TET ETS TSY SYD YDK DKV KVI VIF	RAKFKQLL
34308	CAA AAS ASV SVG VGS GSS SSN SNT NTG TGK GKL KLI LIF	KLGGALQAK
8178	CAA AAS ASK SKT KTS TSY SYD YDK DKV KVI VIF	RAKFKQLL
26262	CIL ILR LRD RDS DSN SND NDY DYK YKL KLS LSF	KLGGALQAK
35120	CAV AVG VGN GNQ NQA QAG AGT GTA TAL ALI LIF	KLGGALQAK
14401	CKA KAG AGT GTA TAS ASK SKL KLT LTF	RAKFKQLL
15569	CAV AVE VER ERS RSY SYS YSG SGG GGG GGA GAD ADG DGL GLT LTF	KLGGALQAK
17001	CAG AGH GHT HTG TGN GNQ NQF QFY FYF	IVTDFSVIK
5777	CAV AVV VVP VPG PGN GNT NTG TGK GKL KLI LIF	GILGFVFTL
36197	CAL ALD LDH DHG HGS GSS SSN SNT NTG TGK GKL KLI LIF	KLGGALQAK
34816	CAM AMS MSE SEG EGT GTG TGG GGF GFK FKT KTI TIF	KLGGALQAK
34362	CIL ILR LRD RDS DSS SSN SNT NTG TGK GKL KLI LIF	KLGGALQAK
24340	CAG AGA GAR ARG RGG GGS GSG SGA GAG AGS GSY SYQ YQL QLT LTF	KLGGALQAK
21712	CAE AEN ENS NSE SED EDT DTD TDK DKL KLI LIF	RAKFKQLL
5114	CAE AEI EID IDS DSW SWG WGK GKL KLQ LQF	AVFDRKSDAK
4322	CGE GEN ENQ NQG QGG GGK GKL KLI LIF	IVTDFSVIK
24695	CAV AVS VSG SGR GRK RKI KII IIF	KLGGALQAK
34190	CAT ATD TDA DAS ASG SGG GGF GFK FKT KTI TIF	KLGGALQAK
35866	CAV AVW VWR WRA RAD ADK DKL KLI LIF	KLGGALQAK
7240	CAV AVN VNK NKG KGT GTY TYK YKY KYI YIF	RAKFKQLL
28466	CAA AAI AIK IKG KGA GAQ AQK QKL KLV LVF	KLGGALQAK
28857	CGA GAA AAG AGN GNM NML MLT LTF	AVFDRKSDAK
34624	CAV AVM VMD MDS DSN SNY NYQ YQL QLI LIW	KLGGALQAK
2307	CAV AVR VRD RDW DWG WGS GSN SNF NFG FGN GNE NEK EKL KLT LTF	KLGGALQAK
18665	CVV VVD VDY DYT YTD TDK DKL KLI LIF	RAKFKQLL
5797	CAA AAS ASE SEG EGS GSS SSN SNT NTG TGK GKL KLI LIF	GILGFVFTL
23305	CAV AVR VRN RNY NYG YGG GGA GAT ATN TNK NKL KLI LIF	RAKFKQLL
2227	CAP APS PSG SGG GGG GGA GAD ADG DGL GLT LTF	ELAGIGILTV
2381	CAA AAT ATY TYS YSG SGA GAG AGS GSY SYQ YQL QLT LTF	ELAGIGILTV
35439	CAP APA PAA AAG AGG GGT GTS TSY SYG YGK GKL KLT LTF	KLGGALQAK
5534	CAL ALT LTL TLI LIT ITG TGR GRR RRA RAL ALT LTF	KLGGALQAK
7174	CAF AFM FMK MKG KGA GAG AGG GGT GTS TSY SYG YGK GKL KLT LTF	GILGFVFTL
36066	CLL LLR LRR RRF	KLGGALQAK
7686	CAA AAS ASE SET ETS TSY SYD YDK DKV KVI VIF	RAKFKQLL
35160	CAL ALS LSE SEA EAL ALG LGG GGR GRR RRA RAL ALT LTF	KLGGALQAK
25100	CAL ALS LSP SPY PYS YSG SGA GAG AGS GSY SYQ YQL QLT LTF	KLGGALQAK
6707	CAA AAS ASG SGG GGG GGS GSQ SQG QGN GNL NLI LIF	GILGFVFTL
34600	CAL ALS LSR SRL RLS LSG SGS GSA SAR ARQ RQL QLT LTF	KLGGALQAK
23028	CAA AAK AKE KEG EGY GYS YST STL TLT LTF	KLGGALQAK
35862	CAY AYR YRS RSA SAY AYG YGY GYG YGG GGS GSQ SQG QGN GNL NLI LIF	KLGGALQAK
5696	CAV AVN VNQ NQG QGG GGG GGS GSQ SQG QGN GNL NLI LIF	GILGFVFTL
35336	CAV AVG VGD GDS DSN SNY NYQ YQL QLI LIW	KLGGALQAK
35504	CAV AVS VSY SYS YSG SGG GGG GGA GAD ADG DGL GLT LTF	KLGGALQAK
25764	CAM AMR MRD RDP DPS PSG SGT GTY TYK YKY KYI YIF	KLGGALQAK
35153	CAL ALC LCL CLI LIQ IQG QGA GAQ AQK QKL KLV LVF	KLGGALQAK
35086	CAV AVS VSD SDW DWG WGS GSN SNY NYK YKL KLT LTF	KLGGALQAK
32414	CAM AMR MRD RDT DTN TNA NAG AGG GGT GTS TSY SYG YGK GKL KLT LTF	GILGFVFTL
30882	CAG AGA GAG AGA GAS ASN SNT NTG TGK GKL KLI LIF	GILGFVFTL
5226	CAT ATV TVS VSS SSM SMN MND NDY DYK YKL KLS LSF	RAKFKQLL
5029	CAV AVA VAV AVG VGV GVS VSG SGG GGG GGA GAD ADG DGL GLT LTF	GILGFVFTL
23907	CAA AAI AIS ISG SGA GAG AGS GSY SYQ YQL QLT LTF	RAKFKQLL
199	CAV AVA VAN ANG NGS GSQ SQG QGN GNL NLI LIF	KLGGALQAK
33509	CAI AIG IGG GGD GDG DGG GGS GSQ SQG QGN GNL NLI LIF	GILGFVFTL
36237	CAA AAI AIR IRS RSA SAS ASK SKI KII IIF	AVFDRKSDAK
35382	CVV VVS VSP SPG PGG GGN GNQ NQF QFY FYF	KLGGALQAK
26239	CAE AES ESL SLQ LQT QTG TGA GAN ANN NNL NLF LFF	KLGGALQAK
35352	CAV AVS VSY SYS YSG SGG GGY GYQ YQK QKV KVT VTF	KLGGALQAK
35776	CPK PKA KAA AAG AGN GNK NKL KLT LTF	KLGGALQAK
5441	CAL ALS LSE SEA EAQ AQY QYG YGG GGA GAT ATN TNK NKL KLI LIF	KLGGALQAK
5240	CAE AED EDN DNN NNA NAR ARL RLM LMF	GLCTLVAML
34995	CAP APT PTN TNT NTN TNA NAG AGK GKS KST STF	KLGGALQAK
36236	CAV AVD VDL DLM LMK MKT KTS TSY SYD YDK DKV KVI VIF	IVTDFSVIK
241	CAG AGT GTQ TQE QET ETS TSG SGS GSR SRL RLT LTF	KLGGALQAK
28730	CAG AGQ GQD QDS DSN SNY NYQ YQL QLI LIW	KLGGALQAK
112	CAL ALD LDS DSN SNY NYQ YQL QLI LIW	KLGGALQAK
23884	CVV VVS VSD SDV DVN VNT NTD TDK DKL KLI LIF	KLGGALQAK
35666	CAE AEG EGG GGF GFG FGN GNV NVL VLH LHC	AVFDRKSDAK
34314	CAL ALP LPT PTP TPT PTS TSD SDG DGQ GQK QKL KLL LLF	KLGGALQAK
5603	CAG AGD GDG DGG GGG GGG GGS GSQ SQG QGN GNL NLI LIF	GILGFVFTL
8079	CAA AAS ASE SET ETS TSY SYD YDK DKV KVI VIF	RAKFKQLL
36118	CAM AMR MRE REA EAN ANT NTG TGN GNQ NQF QFY FYF	KLGGALQAK
15988	CAG AGM GMN MNR NRD RDD DDK DKI KII IIF	RAKFKQLL
5466	CAT ATD TDS DSG SGT GTY TYK YKY KYI YIF	RAKFKQLL
17999	CAV AVE VES ESF SFN FNK NKF KFY FYF	RAKFKQLL
28445	CAV AVM VMD MDS DSS SSY SYK YKL KLI LIF	GILGFVFTL
16699	CAE AES ESM SMD MDN DNY NYG YGQ GQN QNF NFV FVF	RAKFKQLL
15583	CAY AYR YRS RSA SAR ARE RET ETG TGN GNQ NQF QFY FYF	RAKFKQLL
588	CVV VVN VNM NMD MDT DTG TGR GRR RRA RAL ALT LTF	GILGFVFTL
35445	CAM AMS MSD SDL DLS LSN SND NDY DYK YKL KLS LSF	KLGGALQAK
34598	CAM AMR MRR RRP RPI PIS ISS SSG SGS GSA SAR ARQ RQL QLT LTF	KLGGALQAK
16944	CAY AYR YRS RSA SAQ AQE QET ETS TSG SGS GSR SRL RLT LTF	ELAGIGILTV
35244	CAV AVL VLM LMD MDS DSS SSY SYK YKL KLI LIF	KLGGALQAK
196	CAV AVG VGD GDN DNF NFN FNK NKF KFY FYF	AVFDRKSDAK
28416	CAF AFM FMR MRP RPN PNN NNA NAR ARL RLM LMF	KLGGALQAK
36240	CAV AVD VDL DLM LMK MKT KTS TSY SYD YDK DKV KVI VIF	IVTDFSVIK
35159	CAA AAT ATG TGN GNQ NQF QFY FYF	KLGGALQAK
2334	CVV VVS VSA SAR ARD RDN DNF NFN FNK NKF KFY FYF	GILGFVFTL
33799	CAM AMN MNY NYG YGG GGS GSQ SQG QGN GNL NLI LIF	GILGFVFTL
32523	CAP APS PSC SCN CNA NAG AGN GNM NML MLT LTF	GILGFVFTL
7327	CAV AVS VSG SGG GGD GDS DSN SNY NYQ YQL QLI LIW	KLGGALQAK
32620	CAQ AQA QAG AGS GSQ SQG QGN GNL NLI LIF	GILGFVFTL
24686	CAI AIG IGD GDQ DQT QTG TGA GAN ANN NNL NLF LFF	KLGGALQAK
34435	CAY AYR YRS RSP SPL PLT LTG TGN GNQ NQF QFY FYF	KLGGALQAK
25002	CAA AAS ASE SET ETS TSY SYD YDK DKV KVI VIF	RAKFKQLL
26515	CAV AVR VRD RDS DSN SNY NYQ YQL QLI LIW	IVTDFSVIK
185	CAV AVR VRQ RQN QNF NFV FVF	ELAGIGILTV
7973	CAD ADS DSG SGG GGG GGA GAD ADG DGL GLT LTF	RAKFKQLL
28808	CAA AAS ASA SAM AMI MII IID IDY DYK YKL KLS LSF	RAKFKQLL
28721	CVV VVT VTE TET ETS TSY SYD YDK DKV KVI VIF	RAKFKQLL
5530	CAL ALP LPN PNT NTG TGN GNQ NQF QFY FYF	KLGGALQAK
5126	CAY AYR YRG RGS GSD SDS DSG SGN GNT NTP TPL PLV LVF	RAKFKQLL
13059	CAE AES ESL SLW LWD WDD DDK DKI KII IIF	RAKFKQLL
26491	CVV VVS VSD SDV DVN VNT NTD TDK DKL KLI LIF	GLCTLVAML
20062	CAV AVT VTR TRD RDD DDK DKI KII IIF	RAKFKQLL
13995	CAG AGG GGG GGS GSQ SQG QGN GNL NLI LIF	GILGFVFTL
219	CAA AAS ASA SAG AGT GTY TYK YKY KYI YIF	KLGGALQAK
5415	CAV AVS VSD SDR DRR RRS RSA SAS ASK SKI KII IIF	IVTDFSVIK
35193	CAV AVS VSG SGG GGG GGA GAD ADG DGL GLT LTF	KLGGALQAK
189	CAV AVK VKG KGD GDD DDK DKI KII IIF	ELAGIGILTV
257	CAV AVH VHD HDS DSW SWG WGK GKL KLQ LQF	KLGGALQAK
34207	CAV AVS VSQ SQI QIR IRT RTS TSG SGS GSR SRL RLT LTF	KLGGALQAK
35784	CAM AMR MRE REP EPR PRN RNT NTG TGN GNQ NQF QFY FYF	KLGGALQAK
5169	CAG AGG GGG GGS GSQ SQG QGN GNL NLI LIF	GILGFVFTL
35038	CAA AAP APY PYS YSS SSA SAS ASK SKI KII IIF	KLGGALQAK
32522	CAG AGA GAG AGG GGG GGS GSQ SQG QGN GNL NLI LIF	GILGFVFTL
16947	CAV AVT VTF TFL FLS LSG SGG GGY GYN YNK NKL KLI LIF	KLGGALQAK
2286	CAE AEI EII IIY IYG YGN GNN NNR NRL RLA LAF	KLGGALQAK
664	CAI AIP IPQ PQK QKA KAA AAG AGN GNK NKL KLT LTF	ELAGIGILTV
24292	CAA AAS ASA SAS ASG SGG GGQ GQF QFY FYF	KLGGALQAK
669	CAY AYR YRS RSS SSP SPW PWG WGT GTN TNA NAG AGK GKS KST STF	KLGGALQAK
34898	CVV VVT VTD TDY DYS YSS SSA SAS ASK SKI KII IIF	KLGGALQAK
34663	CAM AMR MRE REG EGW GWD WDQ DQT QTG TGA GAN ANN NNL NLF LFF	KLGGALQAK
35656	CAE AEN ENN NND NDM DMR MRF	KLGGALQAK
2335	CAL ALP LPS PSG SGG GGY GYN YNK NKL KLI LIF	GILGFVFTL
35451	CAV AVT VTI TIL ILY LYS YSG SGG GGG GGA GAD ADG DGL GLT LTF	KLGGALQAK
34993	CAA AAV AVP VPS PSG SGS GSA SAR ARQ RQL QLT LTF	KLGGALQAK
5411	CLV LVG VGD GDG DGS GSN SNY NYQ YQL QLI LIW	KLGGALQAK
5774	CGT GTA TAD ADG DGG GGS GSQ SQG QGN GNL NLI LIF	GILGFVFTL
14323	CAV AVS VSE SET ETS TSY SYD YDK DKV KVI VIF	RAKFKQLL
34143	CIL ILI LIY IYM YMN MNR NRD RDD DDK DKI KII IIF	KLGGALQAK
34788	CAV AVG VGS GSN SNA NAG AGG GGT GTS TSY SYG YGK GKL KLT LTF	KLGGALQAK
261	CAA AAS ASG SGG GGG GGA GAD ADG DGL GLT LTF	RAKFKQLL
34129	CAV AVG VGS GSL SLG LGA GAS ASG SGT GTY TYK YKY KYI YIF	KLGGALQAK
34454	CAA AAS ASV SVG VGG GGG GGA GAD ADG DGL GLT LTF	KLGGALQAK
4954	CAV AVR VRD RDG DGA GAR ARL RLM LMF	KLGGALQAK
14	CAM AMF MFG FGF GFQ FQK QKL KLV LVF	KLGGALQAK
17880	CVV VVS VSG SGG GGY GYN YNK NKL KLI LIF	RAKFKQLL
23902	CAY AYT YTG TGT GTS TSG SGT GTY TYK YKY KYI YIF	KLGGALQAK
35610	CAL ALA LAE AEG EGG GGI GIS ISN SNF NFG FGN GNE NEK EKL KLT LTF	KLGGALQAK
25696	CAA AAA AAR ARM RMD MDS DSS SSY SYK YKL KLI LIF	RAKFKQLL
32911	CAV AVT VTG TGD GDG DGG GGS GSQ SQG QGN GNL NLI LIF	GILGFVFTL
35762	CAV AVS VSY SYQ YQG QGG GGS GSE SEK EKL KLV LVF	KLGGALQAK
34918	CAV AVT VTS TSG SGT GTY TYK YKY KYI YIF	KLGGALQAK
34418	CAM AMR MRE REG EGP GPG PGG GGF GFK FKT KTI TIF	KLGGALQAK
2285	CSL SLN LNT NTG TGN GNQ NQF QFY FYF	KLGGALQAK
2226	CAT ATD TDA DAY AYN YNN NND NDM DMR MRF	RAKFKQLL
5959	CAG AGA GAG AGN GNT NTG TGK GKL KLI LIF	GILGFVFTL
28375	CAA AAS ASE SET ETS TSY SYD YDK DKV KVI VIF	RAKFKQLL
699	CAE AER ERL RLE LEY EYG YGN GNK NKL KLV LVF	KLGGALQAK
7690	CAL ALS LSE SET ETS TSY SYD YDK DKV KVI VIF	RAKFKQLL
36081	CAV AVD VDL DLM LMK MKT KTS TSY SYD YDK DKV KVI VIF	IVTDFSVIK
3038	CAG AGA GAT ATD TDS DSW SWG WGK GKL KLQ LQF	IVTDFSVIK
28870	CAM AMS MSS SSS SSF SFQ FQK QKL KLV LVF	KLGGALQAK
33600	CAG AGS GSN SNG NGG GGS GSQ SQG QGN GNL NLI LIF	GILGFVFTL
34048	CVV VVS VSL SLD LDN DNA NAG AGN GNM NML MLT LTF	KLGGALQAK
7662	CAP APP PPS PSS SSA SAS ASK SKI KII IIF	KLGGALQAK
59	CAV AVL VLP LPM PMD MDS DSN SNY NYQ YQL QLI LIW	RAKFKQLL
26146	CVL VLY LYS YSS SSA SAS ASK SKI KII IIF	KLGGALQAK
31857	CAA AAS ASG SGT GTN TNA NAG AGK GKS KST STF	GILGFVFTL
32349	CAV AVD VDF DFR FRD RDN DNY NYG YGQ GQN QNF NFV FVF	GILGFVFTL
31383	CAG AGI GIL ILY LYG YGG GGS GSQ SQG QGN GNL NLI LIF	GILGFVFTL
35034	CAV AVR VRD RDM DMD MDN DNA NAG AGN GNM NML MLT LTF	KLGGALQAK
25390	CAA AAS ASE SET ETS TSY SYD YDK DKV KVI VIF	RAKFKQLL
7091	CAV AVA VAV AVG VGV GVS VSG SGG GGG GGA GAD ADG DGL GLT LTF	GILGFVFTL
36100	CAV AVD VDL DLM LMK MKT KTS TSY SYD YDK DKV KVI VIF	IVTDFSVIK
16809	CAH AHL HLQ LQG QGA GAQ AQK QKL KLV LVF	RAKFKQLL
36230	CVV VVK VKV KVP VPL PLR LRN RNE NEK EKL KLT LTF	KLGGALQAK
13931	CAG AGP GPG PGD GDG DGG GGS GSQ SQG QGN GNL NLI LIF	GILGFVFTL
35807	CAE AES ESI SIA IAG AGN GNQ NQF QFY FYF	KLGGALQAK
35943	CAV AVA VAP APE PEG EGT GTY TYK YKY KYI YIF	KLGGALQAK
34491	CAL ALD LDG DGD GDA DAG AGN GNM NML MLT LTF	AVFDRKSDAK
34664	CAT ATR TRT RTN TNA NAG AGK GKS KST STF	KLGGALQAK
151	CAE AER ERV RVT VTG TGG GGG GGN GNK NKL KLT LTF	KLGGALQAK
2491	CAL ALS LSE SEN ENR NRG RGD GDY DYK YKL KLS LSF	KLGGALQAK
21046	CAE AET ETH THS HSG SGG GGS GSN SNY NYK YKL KLT LTF	RAKFKQLL
678	CAV AVN VNT NTG TGG GGF GFK FKT KTI TIF	ELAGIGILTV
35130	CAK AKY KYN YNF NFN FNK NKF KFY FYF	KLGGALQAK
36079	CAV AVR VRD RDT DTT TTK TKA KAA AAG AGN GNK NKL KLT LTF	AVFDRKSDAK
34029	CAV AVR VRD RDA DAF AFS FSG SGG GGY GYN YNK NKL KLI LIF	KLGGALQAK
7168	CAE AEN ENM NMG MGG GGG GGS GSQ SQG QGN GNL NLI LIF	GILGFVFTL
28818	CAA AAS ASG SGY GYD YDY DYK YKL KLS LSF	RAKFKQLL
5131	CAY AYK YKL KLS LSE SEK EKL KLV LVF	IVTDFSVIK
5178	CAV AVG VGS GSG SGA GAG AGS GSY SYQ YQL QLT LTF	RAKFKQLL
13853	CGS GSG SGT GTY TYK YKY KYI YIF	RAKFKQLL
3880	CAL ALS LSE SEA EAN ANT NTG TGG GGF GFK FKT KTI TIF	IVTDFSVIK
5135	CAD ADS DSG SGG GGG GGA GAD ADG DGL GLT LTF	RAKFKQLL
32297	CAG AGA GAG AGG GGG GGS GSQ SQG QGN GNL NLI LIF	GILGFVFTL
2423	CAV AVG VGA GAN ANS NSG SGY GYS YST STL TLT LTF	ELAGIGILTV
4968	CAG AGG GGN GNT NTG TGK GKL KLI LIF	KLGGALQAK
31340	CAV AVS VSP SPN PND NDY DYK YKL KLS LSF	GILGFVFTL
11138	CAV AVR VRD RDR DRY RYG YGY GYS YST STL TLT LTF	RAKFKQLL
15361	CAV AVR VRV RVT VTG TGN GNQ NQF QFY FYF	RAKFKQLL
5496	CAV AVN VNP NPR PRG RGS GSG SGY GYA YAL ALN LNF	ELAGIGILTV
28412	CAY AYR YRS RSL SLT LTS TSG SGT GTY TYK YKY KYI YIF	KLGGALQAK
25380	CAL ALS LSD SDR DRV RVI VIN INN NND NDM DMR MRF	KLGGALQAK
34374	CAG AGV GVV VVQ VQA QAG AGG GGT GTS TSY SYG YGK GKL KLT LTF	KLGGALQAK
5636	CLL LLG LGF GFT FTN TNT NTN TNA NAG AGK GKS KST STF	GILGFVFTL
24715	CAA AAS ASE SEG EGG GGF GFK FKT KTI TIF	RAKFKQLL
24846	CAV AVP VPL PLT LTG TGG GGG GGN GNK NKL KLT LTF	GLCTLVAML
161	CAV AVR VRG RGT GTY TYN YNT NTD TDK DKL KLI LIF	KLGGALQAK
33862	CAM AMS MSG SGD GDG DGG GGS GSQ SQG QGN GNL NLI LIF	GILGFVFTL
34451	CAL ALN LNG NGG GGS GSQ SQG QGN GNL NLI LIF	KLGGALQAK
28462	CAL ALS LSD SDR DRN RNT NTG TGN GNQ NQF QFY FYF	RAKFKQLL
156	CAE AEI EIA IAL ALQ LQN QNY NYG YGG GGS GSQ SQG QGN GNL NLI LIF	GILGFVFTL
5261	CAV AVR VRF RFN FNV NVR VRS RSN SND NDY DYK YKL KLS LSF	IVTDFSVIK
34368	CAI AIG IGP GPG PGN GNM NML MLT LTF	KLGGALQAK
15606	CAP API PIG IGG GGG GGN GNK NKL KLT LTF	RAKFKQLL
23843	CAV AVE VEA EAR ARE REG EGG GGS GSE SEK EKL KLV LVF	KLGGALQAK
17954	CAA AAM AME MET ETS TSY SYD YDK DKV KVI VIF	RAKFKQLL
34264	CAI AIG IGP GPG PGN GNM NML MLT LTF	KLGGALQAK
31901	CAA AAM AME MET ETS TSY SYD YDK DKV KVI VIF	RAKFKQLL
35672	CAY AYI YIN INT NTG TGA GAN ANS NSK SKL KLT LTF	KLGGALQAK
7238	CAV AVS VSA SAS ASG SGT GTY TYK YKY KYI YIF	KLGGALQAK
5253	CAV AVT VTT TTD TDS DSW SWG WGK GKL KLQ LQF	ELAGIGILTV
2531	CAA AAT ATP TPY PYN YNT NTD TDK DKL KLI LIF	KLGGALQAK
35748	CAV AVG VGV GVL VLR LRG RGQ GQA QAG AGT GTA TAL ALI LIF	KLGGALQAK
26140	CAV AVT VTL TLG LGG GGN GNQ NQF QFY FYF	KLGGALQAK
2400	CAV AVC VCR CRV RVQ VQG QGA GAQ AQK QKL KLV LVF	KLGGALQAK
6237	CAF AFM FMS MSN SNA NAG AGG GGT GTS TSY SYG YGK GKL KLT LTF	GILGFVFTL
33556	CAG AGA GAH AHQ HQG QGG GGK GKL KLI LIF	GILGFVFTL
2415	CAM AMS MSD SDL DLY LYS YSG SGA GAG AGS GSY SYQ YQL QLT LTF	KLGGALQAK
34684	CAG AGV GVE VES ESN SND NDY DYK YKL KLS LSF	KLGGALQAK
3185	CAA AAA AAS ASG SGG GGT GTS TSY SYG YGK GKL KLT LTF	IVTDFSVIK
3877	CAL ALS LSE SEP EPN PNT NTG TGN GNQ NQF QFY FYF	IVTDFSVIK
34158	CAV AVP VPR PRI RIQ IQR QRG RGG GGA GAD ADG DGL GLT LTF	KLGGALQAK
2268	CAV AVN VNM NMY MYG YGD GDS DSS SSY SYK YKL KLI LIF	KLGGALQAK
7063	CAG AGG GGD GDG DGG GGS GSQ SQG QGN GNL NLI LIF	GILGFVFTL
34197	CAT ATE TEA EAG AGN GNL NLF LFY FYF	KLGGALQAK
23285	CAV AVR VRG RGG GGF GFG FGN GNV NVL VLH LHC	RAKFKQLL
7069	CAV AVR VRG RGG GGV GVH VHG HGN GNN NNR NRL RLA LAF	KLGGALQAK
24682	CAA AAK AKE KEG EGY GYS YST STL TLT LTF	KLGGALQAK
36287	CAV AVQ VQD QDS DSN SNY NYQ YQL QLI LIW	KLGGALQAK
34754	CAV AVV VVM VMD MDS DSN SNY NYQ YQL QLI LIW	KLGGALQAK
25705	CIV IVR VRE REG EGN GNL NLD LDD DDM DMR MRF	RAKFKQLL
36208	CAL ALG LGP GPD PDM DMG MGS GSN SNY NYQ YQL QLI LIW	KLGGALQAK
5539	CRV RVG VGG GGG GGA GAD ADG DGL GLT LTF	ELAGIGILTV
26038	CAV AVS VSD SDS DSN SNY NYQ YQL QLI LIW	KLGGALQAK
5869	CAV AVG VGG GGS GSQ SQG QGN GNL NLI LIF	GILGFVFTL
34242	CAT ATD TDG DGW GWS WSS SSG SGY GYS YST STL TLT LTF	KLGGALQAK
2520	CAM AMR MRE REG EGG GGS GSG SGA GAT ATN TNK NKL KLI LIF	KLGGALQAK
34069	CAV AVR VRD RDH DHG HGT GTL TLY LYN YNF NFN FNK NKF KFY FYF	KLGGALQAK
34517	CIL ILR LRD RDV DVS VSS SSG SGT GTY TYK YKY KYI YIF	KLGGALQAK
7324	CAV AVA VAT ATM TMG MGS GSG SGG GGS GSN SNY NYK YKL KLT LTF	GILGFVFTL
2716	CAV AVN VNM NMY MYG YGD GDS DSS SSY SYK YKL KLI LIF	IVTDFSVIK
5657	CAE AER ERG RGG GGG GGG GGS GSQ SQG QGN GNL NLI LIF	GILGFVFTL
36017	CAM AMR MRE REH EHY HYG YGG GGS GSQ SQG QGN GNL NLI LIF	KLGGALQAK
35308	CAA AAP APD PDQ DQG QGG GGS GSE SEK EKL KLV LVF	KLGGALQAK
7084	CAV AVN VNP NPS PSN SNT NTG TGK GKL KLI LIF	GILGFVFTL
34052	CAM AMS MSE SEG EGY GYG YGN GNK NKL KLV LVF	KLGGALQAK
24708	CAV AVF VFV FVF VFD FDN DNA NAR ARL RLM LMF	RAKFKQLL
14844	CAD ADS DSG SGG GGG GGA GAD ADG DGL GLT LTF	RAKFKQLL
34807	CAL ALR LRI RIA IAP APD PDM DMR MRF	KLGGALQAK
6360	CAV AVS VSA SAG AGR GRG RGS GST STL TLG LGR GRL RLY LYF	IVTDFSVIK
35902	CAL ALT LTP TPL PLG LGG GGG GGA GAN ANS NSK SKL KLT LTF	KLGGALQAK
35011	CAV AVR VRS RSN SNF NFN FNK NKF KFY FYF	KLGGALQAK
34309	CLG LGS GSG SGA GAG AGS GSY SYQ YQL QLT LTF	KLGGALQAK
587	CAA AAY AYS YSG SGG GGG GGA GAD ADG DGL GLT LTF	ELAGIGILTV
25265	CIL ILT LTE TET ETS TSY SYD YDK DKV KVI VIF	RAKFKQLL
14270	CAV AVF VFL FLY LYG YGN GNN NNR NRL RLA LAF	RAKFKQLL
34381	CAY AYN YNN NNY NYG YGQ GQN QNF NFV FVF	KLGGALQAK
157	CAG AGA GAP APF PFF	KLGGALQAK
33515	CAF AFM FMK MKG KGA GAG AGG GGT GTS TSY SYG YGK GKL KLT LTF	GILGFVFTL
35923	CAV AVS VSD SDP DPS PSN SNY NYQ YQL QLI LIW	KLGGALQAK
34389	CAV AVQ VQA QAR ARN RNN NNA NAG AGN GNM NML MLT LTF	KLGGALQAK
34819	CAV AVR VRD RDS DSN SNS NSG SGY GYA YAL ALN LNF	KLGGALQAK
5576	CAT ATD TDG DGG GGG GGG GGS GSQ SQG QGN GNL NLI LIF	GILGFVFTL
23220	CAV AVN VNG NGA GAG AGG GGY GYN YNK NKL KLI LIF	KLGGALQAK
35065	CAG AGQ GQN QNS NSG SGG GGY GYQ YQK QKV KVT VTF	KLGGALQAK
28608	CAA AAS ASE SET ETS TSY SYD YDK DKV KVI VIF	RAKFKQLL
17002	CAA AAS ASS SSG SGG GGT GTS TSY SYG YGK GKL KLT LTF	KLGGALQAK
35216	CVV VVS VSD SDL DLG LGS GSQ SQG QGN GNL NLI LIF	KLGGALQAK
24332	CVV VVN VNP NPF PFY FYG YGG GGS GSQ SQG QGN GNL NLI LIF	KLGGALQAK
25801	CAV AVR VRG RGN GNY NYG YGQ GQN QNF NFV FVF	KLGGALQAK
11154	CAR ARE REH EHM HMD MDS DSN SNY NYQ YQL QLI LIW	RAKFKQLL
34252	CAF AFI FIG IGD GDA DAG AGG GGT GTS TSY SYG YGK GKL KLT LTF	KLGGALQAK
34894	CLV LVG VGD GDP DPV PVG VGT GTY TYK YKY KYI YIF	KLGGALQAK
35793	CAM AMR MRE REH EHN HNT NTD TDK DKL KLI LIF	KLGGALQAK
32606	CAE AEN ENK NKG KGG GGG GGS GSQ SQG QGN GNL NLI LIF	GILGFVFTL
34310	CAV AVT VTG TGY GYS YST STL TLT LTF	KLGGALQAK
11041	CAM AMR MRG RGD GDA DAG AGG GGT GTS TSY SYG YGK GKL KLT LTF	RAKFKQLL
5775	CAG AGG GGN GNY NYG YGG GGS GSQ SQG QGN GNL NLI LIF	GILGFVFTL
34011	CVV VVS VSD SDS DSS SSG SGY GYS YST STL TLT LTF	KLGGALQAK
35122	CAL ALG LGD GDP DPL PLT LTG TGG GGG GGN GNK NKL KLT LTF	KLGGALQAK
34295	CAE AED EDQ DQD QDT DTG TGF GFQ FQK QKL KLV LVF	KLGGALQAK
35454	CAV AVN VNS NSW SWN WNN NNN NNA NAR ARL RLM LMF	KLGGALQAK
22999	CAA AAT ATE TET ETS TSY SYD YDK DKV KVI VIF	RAKFKQLL
34531	CVV VVS VSA SAS ASG SGG GGY GYN YNK NKL KLI LIF	KLGGALQAK
24318	CAV AVG VGD GDN DNF NFN FNK NKF KFY FYF	AVFDRKSDAK
36061	CAM AMN MNN NNY NYG YGQ GQN QNF NFV FVF	KLGGALQAK
34838	CAA AAS ASA SAG AGM GMN MND NDM DMR MRF	KLGGALQAK
11838	CAG AGA GAE AET ETS TSY SYD YDK DKV KVI VIF	RAKFKQLL
35988	CAE AEI EIL ILM LMN MNR NRD RDD DDK DKI KII IIF	KLGGALQAK
34153	CAI AIG IGP GPG PGN GNM NML MLT LTF	KLGGALQAK
35935	CAG AGL GLN LNT NTG TGN GNQ NQF QFY FYF	KLGGALQAK
35478	CIL ILG LGV GVP VPN PNF NFG FGN GNE NEK EKL KLT LTF	KLGGALQAK
34376	CAV AVQ VQA QAT ATE TET ETS TSG SGS GSR SRL RLT LTF	KLGGALQAK
5383	CAV AVR VRD RDM DML MLG LGF GFN FNK NKF KFY FYF	GILGFVFTL
36087	CAV AVE VEP EPL PLY LYG YGN GNK NKL KLV LVF	KLGGALQAK
23011	CAV AVS VSG SGA GAG AGS GSY SYQ YQL QLT LTF	KLGGALQAK
36121	CAV AVG VGY GYN YNN NNN NND NDM DMR MRF	KLGGALQAK
6599	CAG AGA GAG AGG GGG GGS GSQ SQG QGN GNL NLI LIF	GILGFVFTL
35084	CAV AVD VDF DFG FGA GAG AGS GSY SYQ YQL QLT LTF	KLGGALQAK
35679	CAL ALG LGE GEP EPG PGA GAA AAG AGN GNK NKL KLT LTF	KLGGALQAK
35650	CAT ATG TGI GIL ILT LTG TGG GGG GGN GNK NKL KLT LTF	KLGGALQAK
32675	CAA AAK AKE KEG EGY GYS YST STL TLT LTF	GILGFVFTL
25443	CAA AAS ASE SET ETS TSY SYD YDK DKV KVI VIF	RAKFKQLL
31357	CAG AGG GGG GGG GGG GGS GSQ SQG QGN GNL NLI LIF	GILGFVFTL
23839	CAA AAS ASE SEG EGA GAP APD PDK DKL KLI LIF	RAKFKQLL
35002	CAD ADY DYT YTG TGN GNQ NQF QFY FYF	KLGGALQAK
34208	CAV AVR VRL RLA LAY AYN YNN NNN NND NDM DMR MRF	KLGGALQAK
10548	CAA AAS ASG SGS GSN SNQ NQF QFY FYF	RAKFKQLL
13925	CAV AVG VGG GGS GSQ SQG QGN GNL NLI LIF	GILGFVFTL
34713	CAL ALS LSE SEF EFL FLT LTG TGG GGF GFK FKT KTI TIF	KLGGALQAK
34661	CAV AVV VVG VGW GWE WEN ENT NTG TGF GFQ FQK QKL KLV LVF	KLGGALQAK
34555	CAV AVE VEI EIW IWL WLT LTG TGG GGG GGN GNK NKL KLT LTF	IVTDFSVIK
4956	CVV VVL VLN LNT NTD TDK DKL KLI LIF	GILGFVFTL
127	CAV AVS VSN SND NDY DYK YKL KLS LSF	KLGGALQAK
2532	CAR ART RTS TSY SYG YGK GKL KLT LTF	KLGGALQAK
35338	CAG AGA GAY AYG YGN GNQ NQF QFY FYF	KLGGALQAK
35854	CAM AMR MRG RGT GTK TKT KTS TSY SYD YDK DKV KVI VIF	KLGGALQAK
38424	CAV AVN VNT NTG TGG GGF GFK FKT KTI TIF	ELAGIGILTV
2371	CAL ALS LSD SDR DRG RGG GGN GNK NKL KLT LTF	KLGGALQAK
35365	CVV VVN VND NDP DPG PGG GGY GYQ YQK QKV KVT VTF	KLGGALQAK
23212	CAG AGS GSY SYG YGG GGS GSQ SQG QGN GNL NLI LIF	IVTDFSVIK
35652	CAT ATD TDR DRD RDS DSG SGY GYS YST STL TLT LTF	KLGGALQAK
34709	CAG AGP GPQ PQT QTL TLS LSG SGG GGY GYN YNK NKL KLI LIF	KLGGALQAK
14561	CAV AVT VTH THT HTG TGG GGF GFK FKT KTI TIF	RAKFKQLL
36250	CAV AVT VTF TFN FNN NNA NAG AGN GNM NML MLT LTF	KLGGALQAK
4933	CAL ALG LGN GNT NTD TDK DKL KLI LIF	ELAGIGILTV
25029	CIV IVM VMD MDD DDF DFQ FQK QKL KLV LVF	RAKFKQLL
33994	CAM AMS MSW SWY WYN YNN NNN NND NDM DMR MRF	KLGGALQAK
34984	CAV AVE VEG EGG GGG GGT GTS TSY SYG YGK GKL KLT LTF	KLGGALQAK
28841	CAA AAS ASE SET ETS TSY SYD YDK DKV KVI VIF	RAKFKQLL
5427	CVV VVS VSV SVY VYS YSG SGG GGG GGA GAD ADG DGL GLT LTF	IVTDFSVIK
35461	CAG AGD GDP DPN PNY NYG YGG GGS GSQ SQG QGN GNL NLI LIF	KLGGALQAK
35355	CAA AAT ATA TAG AGN GNT NTP TPL PLV LVF	KLGGALQAK
25249	CAV AVR VRF RFN FND NDY DYK YKL KLS LSF	GLCTLVAML
28465	CAM AMP MPG PGA GAN ANS NSK SKL KLT LTF	KLGGALQAK
35892	CAA AAT ATP TPL PLT LTT TTT TTD TDS DSW SWG WGK GKL KLQ LQF	KLGGALQAK
5229	CAV AVS VSA SAS ASG SGG GGY GYQ YQK QKV KVT VTF	KLGGALQAK
36133	CAV AVD VDL DLM LMK MKT KTS TSY SYD YDK DKV KVI VIF	IVTDFSVIK
33917	CAA AAS ASE SET ETS TSY SYD YDK DKV KVI VIF	RAKFKQLL
2469	CAM AMI MIL ILA LAS ASN SNY NYK YKL KLT LTF	KLGGALQAK
24341	CAV AVM VMD MDS DSN SNY NYQ YQL QLI LIW	KLGGALQAK
9	CAP APG PGG GGG GGG GGN GNK NKL KLT LTF	ELAGIGILTV
19210	CGT GTD TDK DKG KGG GGG GGY GYQ YQK QKV KVT VTF	RAKFKQLL
7266	CAE AEA EAG AGA GAN ANN NNL NLF LFF	GLCTLVAML
31066	CAA AAS ASI SIE IEG EGP GPG PGP GPN PNN NNN NND NDM DMR MRF	GILGFVFTL
34157	CAV AVD VDS DSG SGY GYS YST STL TLT LTF	KLGGALQAK
31347	CAV AVN VNY NYQ YQG QGG GGS GSE SEK EKL KLV LVF	GILGFVFTL
