1219	QQH QHD HDS DSS SSP SPY PYT	ASP SPY PYP YPN PND NDY DYN YND NDY DYA YAP APE PEE EEG EGM GMS MSW SWY WYF YFD FDL	0
170	QAR ARL RLL LLL LLP LPQ PQT	ARV RVA VAI AIG IGV GVS VSG SGF GFL FLN LNY NYY YYY YYY YYM YMD MDV	0
662	QQF QFE FEF	VRR RRG RGS GSC SCD CDY DYC YCG CGD GDF DFP FPW PWQ WQY	0
8675	QQS QSS SSS SSS SSL SLI LIT	ARG RGY GYY YYY YYT YTG TGL GLW LWY WYP YPY PYA YAM AMY MYE YEF EFG FGM GMD MDY	0
1539	QQA QAN ANS NSF SFF FFT	AAD ADP DPW PWE WEL ELN LNN NNV	0
1401	SSH SHT HTS TSR SRG RGT GTW TWV	ARD RDK DKV KVD VDD DDY DYG YGD GDY DYW YWF WFP FPT PTL TLW LWY WYF YFD FDY	0
999	QQY QYG YGG GGS GSP SPY PYT	ARG RGT GTD TDY DYT YTI TID IDD DDQ DQG QGI GIF IFY FYK YKG KGS GSG SGT GTF TFW FWY WYF YFD FDL	0
305	GTW TWD WDS DSS SSL SLS LST STG TGQ GQL	ATG TGG GGN GNY NYY YYN YNL NLW LWT WTG TGY GYY YYP YPL PLA LAY	0
694	QQS QSY SYS YST STP TPF PFT	ARQ RQN QNH NHY HYG YGS GSG SGS GSY SYF YFY FYR YRT RTA TAY AYY YYY YYA YAM AMD MDV	0
1343	QQY QYN YNN NNW NWP WPL PLT	VRD RDA DAY AYV YVS VSG SGS GSD SDY DYY YYY YYY YYG YGL GLD LDV	0
1392	QQL QLN LNT NTY TYP YPY PYT	ARG RGR GRY RYD YDY DYW YWS WSG SGY GYL YLS LSP	0
19637	QES ESY SYS YSS SSV SVP VPM PMY MYI	TAD ADE DEG EGA GAP API PIL ILR LRF RFF FFE FEW EWG WGY GYY YYN YNY NYY YYM YMD MDV	0
19848	QQY QYY YYN YNS NSP SPY PYT	ARV RVG VGR GRP RPS PSK SKG KGG GGW GWF WFD FDP	0
252	AAW AWD WDD DDS DSL SLS LSE SEF EFL	ARR RRS RSY SYD YDS DSS SSG SGY GYA YAG AGH GHF HFY FYS YSY SYM YMD MDV	0
1282	AAW AWD WDD DDS DSL SLS LSE SEF EFL	ARA RAS ASI SIA IAA AAA AAR ARV RVL VLD LDY	0
539	YST STD TDS DSS SSG SGN GNH NHR HRV	AKD KDS DSP SPR PRG RGE GEL ELP LPL PLN LNY	0
907	QEY EYS YSS SST STP TPY PYN	ARD RDG DGL GLG LGE GEV EVA VAP APD PDY DYR YRY RYG YGI GID IDV	0
1574	QHM HMS MSS SSY SYP YPL PLT	ARD RDK DKY KYY YYG YGN GNE NEA EAV AVG VGM GMD MDV	0
355	ATW TWD WDS DSG SGL GLS LSA SAD ADW DWV	TTD TDG DGF GFI FIM IMI MIR IRG RGV GVS VSE SED EDY DYY YYY YYY YYY YYM YMD MDV	0
19737	QQS QSY SYS YST STP TPP PPA	AGG GGS GST STG TGD GDR DRH RHY HYY YYY YYY YYG YGM GMD MDV	1
535	QQS QSY SYT YTT TTP TPP PPT	ART RTW TWL WLL LLR LRW RWV WVM VMD MDL	0
1374	QQG QGS GST STF TFP FPY PYT	VRN RNR NRV RVQ VQM QME MEV EVS VSP SPA PAT ATQ TQS QST STW TWY WYM YMD MDL	1
19634	QEA EAY AYS YSS SST STP TPT PTL TLT	TAD ADL DLG LGE GEP EPV PVV VVS VSR SRF RFF FFE FEW EWG WGS GSY SYY YYY YYY YYM YMD MDL	0
544	QQY QYD YDN DNL NLP LPI PIT	ARG RGI GIS ISG SGS GSY SYG YGW GWF WFD FDP	1
19800	HQY QYY YYS YSS SSP SPL PLT	ALL LLT LTV TVL VLT LTP TPD PDD DDA DAF AFD FDI	0
1034	QNY NYN YNS NSA SAP APL PLT	VRS RSD SDR DRG RGV GVA VAG AGL GLF LFD FDS	0
19630	QQS QSH SHS HSP SPP PPV PVT	ARE REQ EQR QRN RNK NKD KDY DYR YRY RYG YGQ GQE QEG EGF GFG FGY GYS YSY SYG YGM GMD MDV	0
876	SSY SYT YTS TSS SSS SST STR TRV	ARI RIK IKL KLG LGT GTV TVT VTT TTV TVD VDY	0
1314	QQH QHN HNE NEY EYP YPY PYT	ARM RMG MGS GSD SDY DYD YDV DVW VWF WFD FDY	0
302	QQS QSY SYN YNS NSP SPW PWT	ARD RDN DNG NGD GDY DYV YVG VGE GEK EKG KGF GFD FDI	0
936	AAW AWD WDD DDG DGL GLN LNG NGW GWV	ARD RDR DRG RGF GFD FDL DLL LLT LTG TGH GHY HYL YLG LGL GLD LDP	0
396	QAW AWD WDA DAS AST STG TGV	TRL RLY LYL YLF LFE FEG EGA GAQ AQS QSS SSN SNA NAF AFD FDL	0
986	QSY SYD YDS DSS SSL SLS LSG SGS GSQ SQV	ARA RAL ALL LLT LTT TTV TVT VTT TTF TFE FEY	1
938	QQY QYD YDK DKL KLP LPT	VRD RDR DRD RDD DDF DFW FWS WSG SGY GYY YYK YKH	0
534	QQH QHG HGP GPF PFY FYW YWL WLF LFT	ART RTV TVR VRG RGS GSK SKK KKP KPY PYF YFS FSG SGW GWA WAM AMD MDY	0
667	HIW IWD WDS DSR SRR RRP RPT PTN TNW NWV	ATT TTK TKH KHG HGR GRR RRI RIY IYG YGV GVV VVA VAF AFK FKE KEW EWF WFT FTY TYF YFY FYM YMD MDV	0
19784	QST STD TDS DSS SSG SGT GTS TSW SWV	ARD RDP DPI PIV IVG VGH GHT HTR TRD RDG DGL GLD LDV	0
359	QQH QHQ HQN QNV NVP VPL PLT LTT	ARD RDI DIG IGL GLK LKG KGE GEH EHY HYD YDI DIL ILT LTA TAY AYG YGP GPD PDY	0
361	QQY QYE YEF	TRG RGK GKN KNC NCD CDY DYN YNW NWD WDF DFE FEH	0
1365	SSY SYD YDD DDP DPN PNF NFQ FQV	ARY RYS YSY SYP YPF PFY FYS YSI SID IDY	0
889	QQY QYE YEF	VRK RKG KGP GPS PSC SCP CPH PHC HCG CGD GDF DFH FHW HWQ WQH	0
8704	YST STN TNS NSG SGG GGT GTF TFF FFV	AIL ILG LGF GFW FWG WGA GAN ANR NRG RGG GGG GGG GGM GMD MDV	0
19785	QQS QSY SYS YST STL TLT LTW TWT	ARS RSG SGF GFC FCS CSD SDD DDA DAC ACY CYR YRR RRG RGS GSW SWF WFD FDP	0
467	QQS QSN SNR NRA RAP APA PAT	AKW KWA WAW AWP WPA PAF AFD FDY	0
924	MQP QPL PLQ LQS QSY SYT	ARE REN ENA NAD ADY DYG YGS GSD SDY DYY YYF YFG FGM GMD MDV	0
19710	QHR HRD RDS DSW SWP WPP PPG PGA GAT	AKE KES ESD SDS DSC SCG CGG GGD GDC DCS CSR SRF RFA FAF AFD FDV	0
19708	QQY QYG YGT GTS TSP SPL PLT	ASR SRQ RQH QHH HHE HEY EYF YFQ FQE	0
393	ASW SWD WDS DSM SMT MTV TVD VDG DGV	ARY RYF YFD FDT DTY TYN YNN NNY NYG YGF GFA FAN	0
325	WSF SFA FAG AGS GSY SYY YYV	AGE GEL ELL LLP LPY PYY YYG YGM GMD MDV	0
193	QVW VWD WDS DSS SSS SSD SDH DHA HAV	AKT KTR TRS RSY SYV YVV VVA VAA AAE AEY EYY YYF YFH FHY	0
416	QVW VWD WDS DSS SSS SSD SDH DHV HVI	ARG RGG GGL GLE LEP EPR PRS RSV SVD VDY DYY YYY YYY YYG YGM GMD MDV	1
8695	STW TWD WDS DSS SSL SLS LSA SAV AVV	ARS RSP SPS PSY SYI YIC ICS CSG SGG GGT GTC TCV CVF VFD FDH	1
1549	QQS QSR SRT	ARS RSG SGH GHI HIT ITV TVF VFG FGV GVN VNV NVD VDA DAF AFD FDM	1
19551	ASA SAT ATL TLL LLD LDT DTY TYV	ARE REP EPD PDY DYY YYD YDS DSS SSG SGY GYY YYP YPI PID IDA DAF AFD FDI	0
1353	QAW AWD WDS DSS SSA SAL ALV	ARG RGP GPL PLS LSR SRG RGY GYY YYD YDY	0
19790	QQY QYE YEF	TRG RGK GKY KYC YCT CTA TAR ARD RDY DYY YYN YNW NWD WDF DFE FEH	0
19728	QHY HYN YNS NSY SYF YFV FVT	ARD RDG DGY GYS YSS SSS SSF SFF FFD FDF	0
367	QQF QFP FPT PTY TYL YLP LPT	ARG RGP GPF PFS FSP SPW PWV WVM VMD MDY	0
1409	ATW TWD WDG DGS GSL SLR LRT RTV	ARD RDF DFG FGE GEY EYH YHY HYD YDG DGR GRG RGF GFQ FQC QCE CEG EGF GFD FDL	0
501	AAW AWD WDD DDS DSL SLK LKG KGA GAV	ARH RHG HGN GNY NYY YYY YYY YYS YSG SGM GMD MDV	1
19595	QHY HYG YGV GVS VSP SPV PVI VIT	TRG RGV GVR VRE REV EVG VGA GAT ATG TGD GDD DDP DPF PFY FYY YYG YGM GMY MYV	1
19755	QQS QSQ SQW QWY WYP YPI PIT	ARS RSY SYS YST STK TKL KLA LAM AMD MDY	0
587	QQY QYE YEE EEW EWP WPR PRT	ARH RHR HRH RHH HHD HDV DVF VFM FML MLV LVP VPI PIA IAG AGW GWF WFD FDV	0
19753	QQD QDG DGW GWS WSL SLI LIT	ARG RGY GYG YGW GWA WAL ALD LDY	0
19820	CSY SYT YTH THN HNS NSG SGC GCV	AKG KGL GLL LLR LRD RDG DGS GSS SST STW TWL WLP LPY PYL	0
1225	QQY QYE YEF	ARG RGK GKY KYC YCT CTA TAS ASD SDY DYY YYN YNW NWD WDF DFE FEH	0
824	HMW MWD WDS DSR SRS RSG SGF GFS FSW SWS	ATA TAR ARR RRG RGQ GQR QRI RIY IYG YGV GVV VVS VSF SFG FGE GEF EFF FFY FYY YYY YYY YYM YMD MDV	0
998	HMW MWD WDS DSR SRS RSG SGF GFS FSW SWS	ARA RAQ AQQ QQG QGK GKR KRI RIY IYG YGM GMV MVS VSF SFG FGE GEF EFF FFY FYY YYY YYY YYM YMD MDV	0
19771	QSY SYD YDT DTS TSL SLS LSG SGP GPV PVV	ARQ RQR QRI RIV IVS VSG SGF GFV FVE VEW EWL WLS LSK SKF KFD FDY	0
1358	YSY SYA YAD ADG DGV GVA	ARE REM EMF MFD FDS DSS SSA SAD ADW DWS WSP SPW PWR WRG RGM GMV MVA	0
1021	QVW VWD WDD DDS DSI SIN INA NAY AYV	ARN RNF NFV FVR VRG RGF GFG FGW GWH WHF HFD FDL	0
1043	SSR SRD RDK DKS KSG SGS GSR SRL RLS LSV	ART RTG TGK GKY KYY YYD YDF DFW FWS WSG SGY GYP YPP PPG PGE GEE EEY EYF YFQ FQD	0
196	QQY QYA YAD ADS DSP SPI PIT	AST STL TLG LGL GLV LVL VLD LDA DAM AMD MDY	0
807	QQY QYE YEF	TRG RGK GKY KYC YCT CTA TAR ARD RDY DYY YYN YNW NWD WDF DFE FEH	0
19646	QVW VWD WDN DNY NYS YSD SDH DHV HVI	AVG VGL GLP LPV PVD VDY	0
19808	MQS QSL SLQ LQT QTP TPR PRL RLT	TRG RGG GGT GTL TLF LFD FDY	0
919	QQF QFK FKR KRQ RQK QKE KEP EPI PIT	ART RTW TWY WYY YYG YGF GFD FDY	0
19795	QQS QSY SYF YFN FNP NPI PIT	ARH RHY HYS YSA SAV AVA VAG AGL GLD LDY	0
1381	QVW VWD WDS DSR SRT RTD TDH DHW HWV	ARG RGR GRG RGF GFH FHY HYY YYY YYY YYG YGM GMD MDI	0
1306	AAW AWD WDD DDS DSL SLI LIG IGY GYV	AKD KDA DAR ARD RDC DCL CLL LLC LCA CAD ADW DWH WHF HFD FDL	0
208	QQA QAW AWA WAY AYL YLP LPT	ARE RED EDF DFR FRN RNR NRR RRR RRL RLW LWY WYV YVM VMD MDY	0
19761	QQA QAS ASL SLT LTA TAL ALL LLT	ARE REY EYH YHS HSY SYW YWS WSY SYS YSW SWW WWP WPR PRV RVG VGL GLD LDY	0
19573	QQS QSS SSD SDD DDP DPI PIT	ARS RSR SRG RGQ GQA QAS ASW SWD WDY DYW YWW WWA WAM AMD MDY	0
1581	QQY QYE YEF	ARE RER ERS RSD SDF DFW FWD WDF DFD FDL	0
311	QQF QFY FYT YTT TTP TPS PST	ARG RGS GSG SGF GFR FRW RWV WVM VMD MDY	0
1040	QQY QYY YYS	AKI KIS ISG SGS GSY SYS YSF SFD FDY	0
365	QHY HYD YDD DDL DLP LPR PRI RIT	ARA RAS ASY SYS YSS SSS SSS SSP SPY PYA YAF AFD FDI	0
844	QRY RYN YNR NRA RAP APY PYT	AKV KVS VSY SYL YLS LST STA TAS ASS SSL SLD LDY	0
1275	QQY QYR YRY RYS YSP SPR PRT	ARG RGG GGV GVG VGS GSF SFD FDT	0
1385	MQA QAT ATH THW HWP WPY PYT	ARD RDG DGR GRG RGA GAL ALQ LQY	0
989	AAW AWD WDD DDS DSL SLN LNG NGW GWV	ARV RVQ VQY QYS YSG SGY GYY YYD YDW DWF WFD FDP	0
1544	QQS QSS SSS SSS SSL SLI LIT	ARL RLT LTW TWR WRS RSY SYR YRG RGV GVH VHA HAL ALD LDY	0
1404	AAW AWD WDD DDS DSL SLN LNA NAW AWV	ARQ RQV QVG VGA GAT ATW TWA WAF AFD FDI	0
46	QSS SSS SSS SSP SPY PYT	SRY RYS YSS SSY SYY YYS YSY SYY YYY YYS YSS SSS SSS SSY SYS YSY SYA YAM AMD MDY	0
326	AAW AWD WDD DDS DSL SLN LNG NGF GFW FWV	ART RTL TLR LRV RVS VSG SGD GDY DYV YVR VRD RDF DFD FDL	1
205	QQS QSY SYT YTT TTP TPP PPT	ARS RSA SAR ARF RFS FSF SFD FDY	0
211	QQS QSV SVM VMI MIP IPM PMT	ARG RGR GRF RFF FFD FDY	0
1254	QQY QYF YFY FYW YWP WPI PIT	ARS RSY SYS YSW SWS WSY SYA YAI AID IDY	0
19779	QQR QRN RNN NNW NWY WYT	AIM IMV MVA VAT ATT TTK TKN KND NDF DFH FHY HYY YYK YKD KDV	0
19628	QQS QSG SGT GTF TFP FPP PPT PTT	ARQ RQW QWG WGS GSY SYA YAF AFD FDS	0
853	CSY SYA YAT ATS TSR SRT RTL TLV	VRD RDG DGV GVR VRF RFY FYY YYD YDS DST STG TGY GYY YYP YPD PDS DSF SFF FFK FKY KYG YGM GMD MDV	0
1587	QCF CFE FEG	VRG RGK GKS KSC SCC CCN CNG NGR GRR RRY RYC YCN CNG NGA GAD ADC DCF CFN FNW NWD WDF DFE FEY	0
19655	QQY QYN YNN NNW NWP WPP PPY PYT	ARL RLK LKR KRR RRG RGF GFS FSG SGE GEG EGY GYF YFD FDY	0
214	QQS QSQ SQI QIS ISP SPP PPT	ARR RRV RVC VCY CYN YNR NRL RLG LGV GVC VCA CAG AGG GGM GMD MDY	0
1025	QQY QYY YYS YSA SAP APL PLT	VRE REG EGP GPR PRA RAT ATG TGY GYS YSM SMA MAD ADV DVF VFD FDI	0
390	QQL QLH LHF HFY FYP YPH PHT	AHR HRR RRG RGP GPT PTT TTL TLF LFG FGV GVP VPI PIA IAR ARG RGP GPV PVN VNA NAM AMD MDV	0
19773	QSS SSD SDT DTS TSD SDS DSY SYK YKM	ARN RNA NAI AIR IRI RIY IYG YGV GVV VVA VAL ALG LGE GEW EWF WFH FHY HYG YGM GMD MDV	0
1260	QQS QSY SYS YST STP TPS	ASS SSY SYD YDF DFW FWS WSN SNA NAF AFD FDI	0
1022	QVW VWD WDD DDS DSI SIN INA NAY AYV	ARE REF EFH FHS HSG SGL GLG LGW GWH WHF HFD FDL	0
19766	QET ETY TYS YSD SDL DLM LMY MYT	ARL RLS LSQ SQV QVS VSG SGW GWS WSP SPW PWV WVG VGP	0
19799	HQY QYY YYS YSS SSP SPL PLT	ALL LLT LTV TVL VLT LTP TPD PDD DDA DAF AFD FDI	0
1582	QVY VYE YEF	ARR RRH RHS HSD SDY DYC YCD CDF DFD FDI	0
19844	NAY AYE YEF	ARM RMG MGA GAA AAR ARE REW EWD WDF DFQ FQY	0
164	GTW TWD WDM DMV MVT VTN TNN NNV	ARG RGL GLG LGA GAF AFH FHW HWD WDM DMQ MQP QPD PDY	0
8692	LQH QHW HWS WSY SYP YPY PYT	ARY RYG YGH GHW HWS WSW SWG WGR GRW RWW WWN WNY NYW YWV WVA VAL ALD LDY	0
484	QQY QYN YNS NSY SYS YSR SRT	AGY GYD YDS DSG SGY GYD YDY DYV YVA VAV AVA VAG AGP GPA PAE AEY EYF YFQ FQH	0
1562	QVI VIE IES	ARD RDR DRL RLY LYD YDG DGS GSS SSW SWR WRL RLD LDP	0
500	ATW TWD WDD DDS DSL SLN LNG NGW GWV	ARD RDV DVQ VQY QYS YSG SGS GSY SYL YLG LGA GAY AYY YYF YFD FDY	1
605	QHY HYS YSN SNW NWP WPP PPR PRL RLT	AVP VPG PGP GPV PVF VFG FGI GIF IFP FPP PPW PWS WSY SYF YFD FDN	1
395	QAW AWD WDA DAS AST STG TGV	TRL RLY LYL YLF LFE FEG EGA GAQ AQS QSS SSN SNA NAF AFD FDL	0
19801	CSY SYV YVG VGS GSD SDT DTW TWV	ARV RVY VYS YSY SYG YGV GVP VPF PFD FDY	0
363	QHY HYA YAG AGY GYS YSA SAT	ARK RKG KGS GSD SDR DRL RLS LSD SDN DND NDP DPF PFD FDA	0
19560	SSW SWD WDS DST STG TGL GLV	ARG RGF GFG FGT GTD TDF	0
256	RSW SWD WDS DSN SNL NLS LSY SYS YSV	ARY RYF YFM FMS MSY SYK YKH KHL HLS LSD SDY	0
19683	QSY SYD YDS DSS SSL SLS LSG SGA GAL	ARH RHR HRR RRV RVL VLL LLW LWF WFG FGE GEF EFQ FQL	0
1552	GTW TWD WDS DSS SSL SLN LNP NPV	AGL GLT LTQ TQS QSS SSH SHN HND NDA DAN	0
19789	QQS QSY SYS YST STP TPY PYT	ARA RAT ATN TNY NYD YDS DSS SSG SGY GYY YYS YSL SLY LYF YFD FDY	0
865	QQI QIS ISQ SQY QYP YPI PIT	ART RTG TGM GMY MYF YFG FGF GFF FFH FHH HHS HSW SWS WSN SNA NAA AAL ALD LDY	0
908	QEY EYS YSS SST STP TPY PYN	ARD RDG DGL GLG LGE GEV EVA VAP APA PAY AYL YLY LYG YGI GID IDA	0
1030	LQY QYN YNN NNW NWW WWT	ARN RNV NVA VAT ATE TEG EGS GSL SLL LLH LHY HYD YDY	0
1413	QQG QGF GFS FSS SSP SPF PFS	ARG RGD GDL DLE LET ETT TTI TIF IFF FFY FYN YNA NAV AVD VDV	0
19786	LQH QHD HDI DIY IYA YAS AST	ARL RLA LAS ASG SGF GFR FRD RDY	0
203	QQS QSV SVM VMI MIP IPM PMT	ARG RGR GRF RFF FFD FDY	0
1356	QVL VLQ LQF	ARD RDR DRS RSY SYG YGD GDS DSS SSW SWA WAL ALD LDA	0
1354	QQR QRS RSN SNW NWP WPP PPG PGY GYT	VKD KDL DLG LGI GIA IAA AAR ARR RRF RFV FVS VSG SGA GAF AFD FDI	0
637	QQY QYE YET	ARA RAQ AQK QKR KRG RGR GRS RSE SEW EWA WAY AYA YAH	0
475	QAW AWD WDS DSS SST STA TAV	ARV RVL VLS LSR SRA RAS ASG SGM GMP MPD PDA DAF AFD FDI	0
1606	QCL CLE LEA	VRG RGR GRS RSC SCC CCG CGG GGR GRR RRH RHC HCN CNG NGA GAD ADC DCF CFN FNW NWD WDF DFQ FQH	0
710	GTW TWD WDS DSS SSL SLN LNP NPV	AGL GLT LTQ TQS QSS SSH SHN HND NDA DAN	0
928	MQA QAL ALQ LQT QTP TPL PLT	ARH RHA HAS ASC SCS CSA SAR ARS RSC SCY CYW YWG WGP GPV PVD VDY	1
977	QQY QYG YGQ GQS QSL SLS LST	ARE REG EGT GTT TTG TGS GSG SGG GGK GKP KPI PIG IGA GAF AFA FAH	0
324	WSF SFA FAG AGS GSY SYY YYV	AGE GEL ELL LLP LPY PYY YYG YGM GMD MDV	0
19635	QEN ENY NYN YNT NTI TIP IPS PSL SLS	TMD MDE DEG EGT GTP TPV PVT VTR TRF RFL FLE LEW EWG WGY GYF YFY FYY YYY YYM YMA MAV	0
1366	QQQ QQF QFD FDP DPP PPF PFT	ARE RER ERG RGM GMH MHY HYM YMD MDV	0
1591	QQR QRR RRS RSW SWP WPP PPL PLT	TTG TGD GDF DFS FSE SEF EFE FEP EPF PFS FSM SMD MDY DYF YFH FHF	0
941	GTW TWD WDD DDN DNS NSW SWV	ATR TRW RWN WNY NYF YFF FFD FDF DFD FDY	0
1561	QQY QYL YLQ LQY QYP YPM PMT	ARG RGS GSF SFW FWF WFG FGY	0
546	QQY QYN YNN NNW NWP WPP PPW PWT	ARV RVG VGG GGE GEW EWG WGS GSG SGR GRY RYY YYL YLD LDH	1
19608	QQY QYD YDG DGL GLP LPF PFT	AKH KHM HMS MSM SMQ MQQ QQV QVP VPG PGS GSG SGW GWE WER ERA RAD ADL DLV LVG VGD GDA DAF AFD FDV	1
357	SSY SYT YTS TSS SST STP TPY PYV YVL	ARE REF EFS FSS SSY SYT YTD TDH DHL HLE LEY EYY YYY YYD YDY DYY YYY YYM YMD MDV	0
424	LQI QIY IYN YNM NMP MPI PIT	ARG RGK GKG KGN GNT NTH THK HKP KPY PYG YGY GYV YVR VRY RYF YFD FDV	0
517	HIW IWD WDS DSR SRV RVP VPT PTK TKW KWV	ART RTL TLH LHG HGR GRR RRI RIY IYG YGI GIV IVA VAF AFN FNE NEW EWF WFT FTY TYF YFY FYM YMD MDV	0
19846	QHY HYF YFN FNT NTP TPH PHN	ARL RLD LDA DAR ARV RVD VDA DAG AGW GWQ WQL QLD LDS	0
896	QQL QLN LNS NSY SYS YSL SLT	ARG RGG GGM GMT MTM TMV MVR VRG RGV GVM VMM MMD	0
1045	SSR SRD RDK DKS KSG SGS GSR SRL RLS LSV	ART RTG TGK GKY KYY YYD YDF DFW FWS WSG SGY GYP YPP PPG PGE GEE EEY EYF YFQ FQD	0
19727	QSY SYD YDR DRR RRL RLS LSG SGS GSW SWV	ARA RAA AAY AYY YYD YDT DTS TSG SGY GYG YGD GDY	0
413	GTW TWD WDS DSR SRL RLG LGI GIA IAV	VGL GLD LDW DWN WNY NYN YNP NPL PLR LRY	0
739	QQY QYS YSS SSF SFP FPT PTT	ARW RWG WGD GDE DEG EGF GFD FDI	0
19849	QQY QYY YYN YNS NSP SPY PYT	ARV RVG VGR GRP RPS PSK SKG KGG GGW GWF WFD FDP	0
1371	HMW MWD WDS DSR SRS RSG SGF GFS FSW SWS	ATA TAR ARR RRG RGQ GQR QRI RIY IYG YGV GVV VVS VSF SFG FGE GEF EFF FFY FYY YYY YYS YSM SMD MDV	0
19584	QQF QFS FSS SSY SYP YPY PYT	ARE REN ENY NYG YGS GSV SVY	0
19760	QQS QSP SPQ PQG QGY GYL YLV LVT	ARE REY EYH YHS HSY SYV YVY VYE YEP EPP PPL PLY LYG YGM GMD MDY	0
806	SSY SYA YAG AGS GST STT TTF TFR FRV	AKD KDL DLR LRL RLG LGG GGG GGS GSD SDY	0
1402	SSY SYA YAG AGS GSN SNN NNF NFA FAV	ARV RVS VSR SRG RGG GGS GSF SFS FSD	0
19752	QSY SYD YDR DRY RYT YTH THP HPA PAL ALL	KTH THG HGS GSH SHD HDN	0
927	QQF QFS FSV SVS VSP SPW PWT	ARD RDK DKV KVQ VQG QGR GRV RVE VEV EVG VGS GSG SGG GGR GRH RHD HDY	1
491	STW TWD WDD DDT DTL TLK LKG KGW GWV	ARR RRQ RQL QLL LLD LDD DDG DGT GTG TGY GYQ YQW QWA WAA AAF AFD FDV	0
1580	QQY QYK YKH KHW HWP WPP PPY PYT	ARA RAP APS PSG SGY GYP YPG PGV GVS VSL SLY LYQ YQY QYY YYG YGL GLD LDV	0
559	QQY QYE YEF	ARG RGK GKY KYC YCT CTA TAR ARD RDY DYY YYN YNW NWD WDF DFQ FQH	0
19754	QQD QDG DGW GWS WSL SLI LIT	ARG RGY GYG YGW GWA WAL ALD LDY	0
562	QQF QFE FEF	VRR RRG RGS GSS SSC SCP CPH PHC HCG CGD GDF DFH FHF HFE FEH	0
19794	QQS QSY SYF YFN FNP NPI PIT	ARH RHY HYS YSA SAV AVA VAG AGL GLD LDY	0
19687	GTF TFA FAG AGG GGS GSY SYY YYG YGV	ARG RGG GGW GWF WFD FDY	0
9235	ASW SWD WDS DSM SMT MTV TVD VDG DGV	ARY RYF YFD FDT DTY TYN YNN NNY NYG YGF GFA FAN	0
19819	QVW VWD WDS DSG SGR GRG RGH GHP HPL PLY LYV	ARA RAL ALE LEM EMG MGH GHR HRS RSG SGF GFP FPF PFD FDY	0
555	AVF VFQ FQW	ARD RDE DES ESG SGD GDD DDL DLK LKW KWH WHL HLH LHP	0
987	QQY QYN YNN NNW NWP WPY PYT	AYH YHR HRR RRG RGH GHF HFY FYG YGS GSG SGS GSA SAW AWD WDW DWF WFE FES	1
345	AWY WYD YDR DRE REL ELS LSE SEW EWV	ARD RDP DPA PAA AAW AWP WPL PLQ LQQ QQS QSL SLA LAW AWF WFD FDP	0
209	QQY QYS YSY SYY YYY YYY YYP YPF PFT	ARY RYY YYG YGT GTG TGA GAM AMD MDY	0
1237	QSY SYD YDS DSS SSN SNV NVV	ARG RGI GIV IVF VFS FSY SYA YAM AMD MDV	0
19762	QQY QYY YYY YYG YGY GYP YPI PIT	ARY RYK YKY KYP YPY PYW YWS WSW SWY WYY YYY YYW YWG WGG GGM GMD MDY	0
548	QQY QYE YEF	ARG RGK GKN KNS NSD SDY DYN YNW NWD WDF DFQ FQH	0
482	SSY SYD YDD DDP DPN PNF NFQ FQV	ARY RYS YSY SYP YPF PFY FYS YSI SID IDY	0
352	QQY QYS YSN SNY NYP YPL PLT	ARD RDN DNP NPT PTL TLL LLG LGS GSD SDY	0
27	QQY QYG YGQ GQS QSL SLS LST	ARE REG EGT GTT TTG TGW GWG WGW GWL WLG LGK GKP KPI PIG IGA GAF AFA FAH	0
536	QQL QLE LEF	ARQ RQK QKF KFY FYT YTG TGG GGQ GQG QGW GWY WYF YFD FDL	0
19631	KSL SLT LTS TST STR TRR RRR RRV	VRE REA EAG AGG GGP GPD PDY DYR YRN RNG NGY GYN YNX NXX XXD XDF DFY FYD YDG DGY GYY YYN YNY NYH YHY HYM YMD MDV	0
674	QQY QYY YYR YRS RSP SPL PLT	VRS RSV SVT VTP TPR PRY RYC YCG CGG GGG GGF GFC FCY CYG YGE GEF EFD FDY	0
1565	QQG QGA GAS ASW SWP WPF PFT	ARV RVG VGR GRF RFA FAS ASH SHQ HQL QLD LDY	0
206	QQS QSY SYT YTT TTP TPP PPT	ARF RFW FWW WWR WRS RSF SFD FDY	0
1299	SSH SHT HTS TSR SRG RGT GTW TWV	ARD RDK DKV KVD VDD DDY DYG YGD GDY DYW YWF WFP FPT PTL TLW LWY WYF YFD FDY	0
1416	QVW VWD WDS DSS SSS SSV SVV	ARG RGP GPL PLS LSR SRG RGY GYY YYD YDY	0
1397	QVW VWD WDT DTG TGS GSD SDP DPV PVV	ARD RDS DSS SSS SSS SSW SWA WAR ARW RWF WFF FFD FDL	0
969	GSL SLV LVG VGN GNW NWD WDV DVI	ARF RFG FGG GGE GEV EVL VLR LRY RYT YTD TDW DWP WPK PKP KPA PAW AWV WVD VDL	0
199	QQH QHG HGN GNL NLP LPY PYT	ARP RPY PYL YLT LTY TYP YPQ PQR QRR RRG RGP GPQ PQN QNV NVS VSP SPF PFD FDN	0
483	QQG QGN GNT NTL TLS LSY SYT	ARE REL ELY LYQ YQG QGY GYM YMD MDT DTF TFD FDS	0
9248	HIW IWD WDS DSR SRR RRP RPT PTN TNW NWV	ATT TTK TKH KHG HGR GRR RRI RIY IYG YGV GVV VVA VAF AFK FKE KEW EWF WFT FTY TYF YFY FYM YMD MDV	0
1398	QQS QSN SNS NSW SWP WPY PYT	ANW NWD WDG DGD GDY	0
1307	QQY QYR YRY RYS YSP SPR PRT	ARG RGG GGF GFG FGS GSF SFD FDT	0
1320	AAW AWD WDD DDS DSL SLS LSA SAH AHV HVV	ARE REL ELL LLM LMD MDY DYY YYD YDH DHI HIG IGY GYS YSP SPG PGP GPT	1
1555	QQS QSY SYS YSY SYP YPY PYT	ARY RYY YYS YSS SSG SGG GGS GSY SYY YYR YRY RYS YSR SRG RGF GFD FDY	0
19757	QQS QSQ SQW QWY WYP YPI PIT	ARS RSY SYS YST STK TKL KLA LAM AMD MDY	0
8701	ATW TWD WDN DNS NSL SLN LND NDR DRV	ARE REI EIP IPG PGA GAT ATS TSG SGP GPD PDH DHF HFF FFF FFY FYG YGM GMD MDV	1
1391	LHY HYG YGT GTS TSP SPM PMY MYF	IAS ASS SST STT TTG TGW GWY WYV YVR VRE RED EDF DFD FDY	0
188	QTY TYD YDP DPY PYS YSV SVV	ARD RDL DLI LIH IHG HGV GVT VTR TRN	0
878	GTW TWD WDI DIS ISL SLS LSA SAG AGL	ARG RGS GSH SHL HLY LYD YDF DFW FWS WSA SAS ASH SHP HPP PPN PND NDA DAL ALA LAI	0
8677	QQR QRS RSN SNW NWP WPP PPT	ARD RDR DRS RSY SYY YYL YLD LDY	0
747	ASW SWD WDD DDS DSL SLN LNG NGV GVV	AGP GPS PSI SIT ITE TES ESH SHY HYC YCL CLD LDC DCA CAA AAK AKD KDY DYY YYY YYG YGL GLD LDV	1
707	QQW QWA WAV AVH VHS HSL SLI LIT	ARY RYV YVY VYH YHA HAL ALD LDY	0
955	QQS QST STG TGH GHP HPQ PQT	ART RTY TYG YGI GIY IYD YDL DLY LYV YVD VDY DYT YTE TEY EYV YVM VMD MDY	0
1553	KSL SLT LTS TST STR TRR RRR RRV	VRE REA EAG AGG GGP GPD PDY DYR YRN RNG NGY GYN YNY NYY YYD YDF DFY FYD YDG DGY GYY YYN YNY NYH YHY HYM YMD MDV	0
353	QQY QYN YNN NNW NWP WPP PPR PRY RYT	AGV GVY VYE YEG EGE GEA EAD ADE DEG EGE GEY EYD YDN DNN NNG NGF GFL FLK LKH	0
558	QQY QYE YEF	ARG RGK GKY KYC YCT CTA TAR ARD RDY DYY YYN YNW NWD WDF DFQ FQH	0
520	QVW VWD WDS DSD SDS DSD SDH DHV HVV	ARA RAG AGL GLE LEP EPR PRS RSV SVD VDY DYY YYF YFY FYG YGL GLD LDV	1
8703	QAW AWD WDS DST STL TLG LGV GVV	ARL RLG LGF GFE FEG EGD GDY DYS YSG SGS GSF SFF FFD FDY	0
19749	SSY SYA YAG AGS GSV SVV	AKD KDL DLT LTL TLM LMY MYV YVF VFD FDS DSG SGW GWA WAR ARG RGA GAH AHD HDY DYY YYG YGM GMD MDV	1
351	AAW AWD WDD DDS DSR SRG RGG GGP GPD PDW DWV	ARL RLG LGG GGD GDY DYE YED EDS DSG SGA GAD ADA DAF AFD FDF	0
1289	YSD SDI DIS ISN SNG NGY GYP YPL	ARV RVS VSD SDF DFG FGD GDY DYG YGP GPD PDF	0
303	QQY QYN YNN NNW NWP WPP PPR PRY RYT	AGV GVY VYE YEG EGE GEA EAD ADE DEG EGE GEY EYR YRN RNN NNG NGF GFL FLK LKH	0
19698	QQY QYV YVS VST STP TPL PLT	ARK RKL KLE LEP EPP PPY PYY YYF YFY FYS YSY SYM YMD MDV	0
19770	ASY SYA YAG AGS GSG SGI GIY IYV	ARL RLA LAI AIG IGD GDS DSY	0
341	QQF QFD FDG DGD GDP DPT	ARH RHY HYE YEI EIQ IQI QIG IGR GRY RYG YGM GMN MNV NVY VYY YYL YLM LMY MYR YRF RFA FAS	0
8705	QTW TWG WGA GAG AGI GIL ILV	AKF KFS FSG SGK GKD KDC DCS CSG SGT GTS TSC SCR CRD RDY	0
19557	QQY QYG YGQ GQS QSL SLS LST	ARE REG EGT GTT TTP TPP PPG PGW GWG WGW GWL WLG LGK GKP KPI PIG IGA GAF AFA FAH	0
1411	QSA SAD ADS DSS SSG SGD GDY DYV	ARE REW EWA WAE AED EDG DGD GDF DFG FGN GNA NAF AFH FHV	0
394	ASW SWD WDD DDS DSR SRG RGG GGP GPD PDY DYV	ARL RLH LHY HYS YSD SDR DRS RSG SGS GSY SYF YFN FND NDV DVF VFH FHM	0
697	NSA SAD ADS DSS SSG SGN GNH NHV HVV	AKI KIL ILG LGA GAG AGR GRG RGW GWY WYF YFD FDY	0
19642	MQG QGT GTH THW HWP WPP PPM PMC MCS	ARG RGT GTS TST STG TGL GLR LRE REA EAF AFH FHI	0
19772	QQY QYF YFF FFL FLY LYS	ARI RIR IRQ RQV QVS VSK SKY KYL YLQ LQW QWY WYP YPG PGV GVF VFE FEM	0
1245	QES ESL SLS LSA SAS ASY SYT	ARL RLD LDG DGY GYT YTL TLD LDI	0
9249	QQH QHD HDY DYP YPY PYT	ARL RLG LGS GSD SDY DYD YDV DVW VWF WFD FDY	0
8689	QVR VRD RDN DNN NNE NEN ENE NEW EWV	ARY RYI YID IDF DFG FGD GDH DHM HMD MDF	0
866	QQS QSS SSS SSS SSL SLI LIT	ARY RYE YET ETL TLY LYW YWP WPY PYQ YQN QNS NSG SGM GMD MDY	0
1372	MQG QGT GTH THW HWP WPY PYT	ARD RDR DRP RPH PHI HIL ILT LTG TGF GFD FDF DFD FDY	1
19806	QHF HFE FET	TRG RGR GRD RDG DGY GYD YDD DDG DGF GFH FHP	0
49	QQS QSY SYT YTT TTP TPP PPT	ARF RFV FVF VFF FFL FLP LPY PYA YAM AMD MDY	0
19574	MQN QNK NKQ KQT QTP TPL PLT	VIR IRG RGD GDV DVY VYN YNR NRQ	0
918	QQS QSS SSS SSS SSL SLI LIT	ARG RGY GYY YYG YGA GAA AAM AMD MDY	0
970	GSL SLV LVG VGN GNW NWD WDV DVI	ARF RFG FGG GGE GEV EVL VLR LRY RYT YTD TDW DWP WPK PKP KPA PAW AWV WVD VDL	0
870	AAW AWD WDD DDS DSL SLN LND NDW DWV	VKD KDR DRV RVA VAV AVA VAG AGK GKG KGS GSY SYY YYF YFD FDS	0
821	QQY QYG YGS GSS SSP SPS PST	ARE REG EGT GTT TTG TGS GSG SGW GWL WLG LGK GKP KPI PIG IGA GAF AFA FAY	0
451	GTW TWD WDS DSS SSL SLN LNP NPV	AGL GLT LTQ TQS QSS SSH SHN HND NDA DAN	0
978	QQY QYG YGQ GQS QSL SLS LST	ARE REG EGT GTT TTG TGD GDG DGD GDL DLG LGK GKP KPI PIG IGA GAF AFA FAH	0
1396	GTW TWD WDS DSS SSL SLS LSV SVW VWV	ARD RDH DHL HLG LGW GWS WSS SSI SIW IWS WSA SAP APE PES ESF SFL FLD LDY	0
890	QQY QYE YEF	VRG RGK GKS KSC SCC CCG CGG GGR GRR RRY RYC YCN CNG NGA GAD ADC DCF CFN FNW NWD WDF DFE FEH	0
478	QQY QYW YWS WSE SEP EPV PVT	ARG RGG GGP GPD PDY DYA YAM AMD MDV	0
960	QSY SYD YDS DSP SPT PTL TLT LTS TSP	ATV TVM VMG MGK GKW KWI WIK IKG KGG GGY GYD YDY	0
19598	EAW AWD WDD DDS DSL SLD LDG DGV GVV	ARD RDG DGE GEI EIS ISY SYD YDY DYY YYY YYY YYG YGM GMD MDV	0
19847	QHY HYF YFN FNI NIP IPH PHN	ARL RLD LDA DAR ARV RVD VDA DAG AGW GWQ WQL QLD LDS	0
1373	QQS QSN SNN NNV NVP VPH PHT	ARD RDK DKK KKQ KQG QGE GEV EVV VVL VLP LPA PAA AAS ASF SFR FRW RWF WFA FAP	1
1363	QQY QYN YNS NSY SYP YPW PWT	ARE REE EEH EHI HIT ITF TFG FGG GGV GVI VIV IVR VRY	0
1551	QQY QYN YNN NNW NWW WWT	VRN RNV NVG VGT GTA TAG AGS GSL SLL LLH LHY HYD YDH	0
666	HIW IWD WDS DSR SRR RRP RPT PTN TNW NWV	ATT TTK TKH KHG HGR GRR RRI RIY IYG YGV GVV VVA VAF AFK FKE KEW EWF WFT FTY TYF YFY FYM YMD MDV	0
19824	QQS QSY SYS YST STP TPL PLT	ARD RDR DRG RGI GIG IGA GAR ARR RRG RGP GPY PYY YYM YMD MDV	0
19556	CSY SYT YTH THN HNS NSG SGC GCV	AKG KGL GLL LLR LRD RDG DGS GSS SST STW TWL WLP LPY PYL	0
749	QQA QAN ANS NSF SFP FPL PLT	ARD RDL DLG LGG GGY GYF YFI FIR IRG RGI GIM IMD MDV	1
1388	QQL QLN LNT NTY TYP YPF PFT	AKP KPK PKS KSR SRD RDR DRG RGG GGP GPG PGD GDD DDY DYF YFG FGM GMD MDV	0
811	QQY QYE YEF	TRG RGK GKY KYC YCT CTA TAR ARD RDY DYY YYN YNW NWD WDF DFE FEH	0
1006	QAW AWD WDS DSS SST STD TDV DVV	ARA RAV AVV VVF VFT FTD TDS DSS SSA SAY AYY YYY YYS YSK SKY KYF YFD FDY	0
19711	QQR QRG RGN GNW NWP WPP PPI PIT	ARE REG EGL GLS LSR SRD RDN DNS NSG SGF GFT FTG TGL GLI LID IDY	0
19591	NSY SYS YSI SIH IHS HSP SPW PWV	ARD RDR DRR RRS RSG SGT GTS TSP SPL PLP LPL PLD LDV	0
1327	QQY QYD YDG DGL GLP LPF PFT	AKH KHM HMS MSM SMQ MQQ QQV QVV VVS VSA SAG AGW GWE WER ERA RAD ADL DLV LVG VGD GDA DAF AFD FDV	1
1573	QQY QYY YYN YNP NPP PPW PWT	AKG KGG GGA GAA AAA AAA AAV AVM VMD MDV	0
1603	GTW TWD WDS DSS SSL SLN LNV NVV VVV	ARA RAV AVV VVS VSS SSD SDI DIT ITY TYT YTY TYW YWS WSK SKY KYF YFD FDY	0
932	SSF SFA FAN ANS NSG SGP GPL	ARD RDR DRY RYF YFD FDL	0
289	HQY QYG YGS GST STP TPL PLT	ARV RVS VSI SIF IFG FGV GVG VGT GTF TFD FDY	0
1263	QQY QYD YDN DNL NLG LGD GDL DLS	ARD RDR DRY RYY YYE YET ETS TSG SGS GSN SNA NAF AFD FDV	0
19783	QQY QYG YGS GSS SSP SPY PYT	ARG RGI GIA IAS ASA SAG AGT GTP TPD PDY DYF YFF FFY	0
746	QKY KYG YGT GTS TSA SAI AIT	AVP VPD PDP DPD PDA DAF AFD FDI	0
1417	QAW AWD WDS DSN SNT NTG TGV	ARG RGP GPL PLS LSR SRG RGY GYY YYD YDY	0
143	ATW TWD WDR DRR RRP RPT PTA TAY AYV YVV	AKH KHM HMG MGY GYQ YQV QVR VRE RET ETM TMD MDV	1
810	QQY QYE YEF	TRG RGK GKY KYC YCT CTA TAR ARD RDY DYY YYN YNW NWD WDF DFE FEH	0
19589	QHF HFY FYS YSV SVP VPW PWT	AKD KDR DRG RGP GPR PRG RGV GVG VGE GEL ELF LFD FDS	0
860	QQY QYE YEN ENL NLQ LQF QFT	ASI SIY IYG YGS GSG SGT GTF TFY FYY YYY YYF YFY FYM YMD MDV	0
965	AAW AWD WDD DDS DSP SPP PPG PGE GEA	ARV RVG VGL GLG LGD GDA DAF AFD FDI	0
295	QQS QSY SYT YTT TTP TPP PPT	ART RTY TYG YGI GIY IYD YDL DLY LYV YVD VDY DYT YTE TEY EYV YVM VMD MDY	0
805	QHL HLI LIG IGL GLR LRS	ARR RRS RSN SNW NWP WPY PYL YLP LPF PFD FDP	0
412	QQH QHY HYR YRT RTP TPP PPT	AKD KDS DSQ SQL QLR LRS RSL SLL LLY LYF YFE FEW EWL WLS LSQ SQG QGY GYF YFD FDY	1
