19735	VQT QTV TVQ VQV QVP VPY PYT	TTL TLL LLI LIY IYE YES ESD SDV DVG VGV GVD VDF	0
808	QQY QYE YEF	TRG RGK GKY KYC YCT CTA TAR ARD RDY DYY YYN YNW NWD WDF DFE FEH	0
19692	QQY QYG YGR GRS RSR SRW RWT	AKS KSG SGT GTQ TQY QYY YYD YDT DTT TTG TGY GYE YEY EYR YRG RGL GLE LEY EYF YFG FGY	0
19587	QQY QYD YDN DNL NLP LPL PLT	ATE TET ETA TAL ALV LVV VVS VSE SET ETY TYL YLP LPH PHY HYF YFD FDN	0
911	QQT QTR TRW RWT WTP TPP PPT	VKD KDQ DQT QTI TIF IFH FHK HKN KNG NGA GAV AVD VDF DFF FFS FSY SYF YFD FDL	0
358	QQY QYD YDN DNS NSV SVC VCT	ARG RGP GPV PVP VPA PAV AVF VFY FYG YGD GDY DYR YRL RLD LDP	0
19781	QTW TWG WGA GAG AGI GIR IRV	ARD RDT DTY TYY YYY YYD YDS DSG SGD GDY DYE YED EDA DAF AFD FDI	0
935	HQY QYS YSS SSH SHP HPP PPT	ARA RAD ADG DGL GLT LTY TYF YFS FSE SEL ELL LLQ LQY QYI YIF IFD FDL	0
19609	MEA EAR ARQ RQT QTP TPR PRL RLT	VRG RGP GPE PES ESG SGW GWF WFY FYH YHY HYY YYW YWG WGL GLG LGV	0
492	STW TWD WDD DDT DTL TLE LEG EGW GWV	ARR RRQ RQL QLL LLD LDD DDG DGT GTG TGY GYQ YQW QWA WAA AAF AFD FDV	0
28836	QQS QSY SYS YST STP TPL PLT	ARD RDR DRG RGI GIG IGA GAR ARR RRG RGP GPY PYY YYM YMD MDV	0
19736	QQY QYY YYL YLI LIP IPS PST	ARV RVG VGP GPA PAD ADV DVW VWD WDS DSF SFD FDY	0
1328	SSY SYT YTS TST STR TRT RTP TPY PYV	ARD RDP DPG PGL GLW LWD WDY DYY YYY YYG YGM GMD MDV	0
19756	QQS QSQ SQW QWY WYP YPI PIT	ARS RSY SYS YST STK TKL KLA LAM AMD MDY	0
527	SSR SRD RDK DKS KSG SGS GSR SRL RLS LSV	ART RTG TGK GKY KYY YYD YDF DFW FWS WSG SGY GYP YPP PPG PGE GEE EEY EYF YFQ FQD	0
971	QQY QYF YFS FSP SPP PPY PYT	ARG RGD GDG DGG GGL GLD LDD	0
691	AAW AWD WDD DDS DSL SLI LIG IGV GVV	ARD RDK DKN KNP NPG PGT GTK TKP KPY PYY YYH YHY HYG YGM GMD MDV	0
1571	KQY QYA YAD ADY DYW YWT	ARD RDR DRY RYS YSP SPT PTG TGH GHY HYY YYG YGM GMD MDV	0
19748	QVW VWD WDS DSS SSS SSD SDH DHV HVV	ARL RLP LPM PMV MVT VTM TMS MSF SFD FDY	0
854	CSY SYA YAG AGG GGK GKS KSL SLV	ARD RDG DGV GVR VRY RYY YYY YYD YDS DST STG TGY GYY YYP YPD PDN DNF NFF FFQ FQY QYG YGL GLD LDV	0
1333	SSL SLT LTD TDR DRS RSH SHR HRI	ARE REA EAG AGG GGP GPI PIW IWH WHD HDD DDV DVK VKY KYY YYD YDF DFN FND NDG DGY GYY YYN YNY NYH YHY HYM YMD MDV	0
362	QQY QYE YEF	TRG RGK GKN KNC NCD CDY DYN YNW NWD WDF DFE FEH	0
1560	QIL ILE LEF	ARG RGF GFA FAG AGY GYE YEW EWS WSF SFI	0
19684	QQY QYG YGS GSS SSP SPP PPY PYT	AKE KES ESF SFG FGI GIP IPH PHF	0
19561	SAW AWG WGD GDK DKG KGM GMV	ARG RGF GFG FGT GTD TDF	0
715	QQA QAN ANS NSF SFF FFT	AAD ADP DPW PWE WEL ELN LNA NAF AFN FNV	0
19686	GTF TFA FAG AGG GGS GSY SYY YYG YGV	ARG RGG GGW GWF WFD FDY	0
545	AAW AWD WDD DDS DSL SLS LSG SGP GPA PAV AVV	ARQ RQQ QQD QDS DSG SGY GYS YSG SGP GPE PEV EVS VSY SYY YYS YSH SHY HYG YGM GMD MDV	1
315	QQY QYS YSS SSY SYS YSS SSL SLF LFT	ARE REY EYY YYR YRW RWY WYT YTA TAI AID IDY	0
19613	MQG QGT GTH THW HWP WPP PPY PYT	ARG RGY GYA YAD ADT DTP TPV PVF VFR FRR RRY RYY YYY YYY YYG YGM GMD MDV	0
19750	CSY SYA YAG AGS GSV SVV	ARD RDL DLT LTL TLM LMY MYV YVH VHS HSS SSG SGW GWE WER ERG RGV GVY VYY YYY YYY YYG YGM GMD MDV	1
642	QVW VWD WDI DIS IST STD TDQ DQA QAV	ARH RHV HVR VRS RSG SGY GYP YPD PDT DTA TAY AYY YYF YFD FDK	1
891	QQY QYE YEF	VRT RTA TAD ADC DCE CER ERD RDP DPC PCK CKG KGW GWV WVF VFP FPH	0
1268	QQH QHQ HQY QYN YNS NSL SLI	ARK RKQ KQY QYS YSY SYW YWR WRD RDS DSY SYW YWA WAM AMD MDY	0
136	QQR QRS RSM SMW MWP WPP PPV PVT	ARD RDG DGK GKC KCG CGG GGG GGR GRC RCY CYS YSG SGL GLL LLD LDY	0
708	QQW QWA WAV AVH VHS HSL SLI LIT	ARY RYV YVY VYH YHA HAL ALD LDY	0
538	QSY SYD YDN DNS NSS SSW SWV	ARL RLG LGG GGR GRY RYY YYH YHD HDS DSS SSG SGY GYY YYY YYL YLD LDY	0
316	QQY QYS YSS SSY SYS YSS SSL SLF LFT	ARE REY EYY YYR YRW RWY WYT YTA TAI AID IDY	0
19822	QQY QYL YLY LYH YHP HPA PAT	ARR RRH RHW HWP WPG PGG GGF GFD FDY	0
1035	MQS QSK SKD KDF DFP FPL PLT	ARM RMF MFQ FQE QES ESG SGP GPP PPR PRL RLD LDR DRW RWS WSG SGR GRN RNY NYY YYY YYY YYS YSG SGM GMD MDV	0
934	QAW AWD WDS DSS SSS SSF SFV	ARV RVA VAL ALF LFD FDI DIL ILT LTG TGG GGW GWF WFD FDP	1
825	CSY SYT YTH THN HNS NSG SGC GCV	AKG KGL GLL LLR LRD RDG DGS GSS SST STW TWL WLP LPY PYL	0
525	SSR SRD RDK DKS KSG SGS GSR SRL RLS LSV	ART RTG TGK GKY KYY YYD YDF DFW FWS WSG SGY GYP YPP PPG PGE GEE EEY EYF YFQ FQD	0
1403	GTW TWD WDS DSS SSL SLS LSA SAW AWV	ARS RSS SSR SRI RIY IYD YDL DLN LNP NPS PSL SLT LTA TAY AYY YYD YDM DMD MDV	0
1563	QQA QAY AYK YKT KTP TPY PYT	ARD RDD DDY DYS YST STY TYA YAF AFA FAY	0
855	QQR QRY RYN YNW NWP WPP PPY PYT	VGG GGY GYS YSN SNF NFY FYY YYY YYY YYT YTM TMD MDV	0
