35441	CA AV VM MD DS SN NY YQ QL LI IW	CS SA AR RL LA AG GG GP PE ET TQ QY YF	KLGGALQAK
8151	CV VG GY YT TN NA AG GK KS ST TF	CA AS SS SF FS SG GN NT TG GE EL LF FF	RAKFKQLL
15569	CA AV VE ER RS SY YS SG GG GG GA AD DG GL LT TF	CA AS SS SQ QV VE EG GL LG GT TE EA AF FF	KLGGALQAK
33799	CA AM MN NY YG GG GS SQ QG GN NL LI IF	CA AS SS ST TR RS ST TD DT TQ QY YF	GILGFVFTL
34064	CA AL LS SE EA AG GG GS SG GA AG GS SY YQ QL LT TF	CA AS SS SM MT TG GN NQ QE ET TQ QY YF	KLGGALQAK
35864	CA AM MR RE EG GA AG GY YA AL LN NF	CA AS SS SI IL LA AG GY YY YN NE EQ QF FF	KLGGALQAK
34731	CA AV VS SP PD DD DF FG GN NE EK KL LT TF	CA AS ST TT TQ QG GP PP PV VT TP PD DT TQ QY YF	KLGGALQAK
2460	CA AV VD DD DS SD DK KL LI IF	CA AS SS SH HS SG GG GT TD DT TQ QY YF	KLGGALQAK
35668	CA AA AF FT TS SG GT TY YK KY YI IF	CA AS SS SY YV VG GG GP PG GD DT TQ QY YF	KLGGALQAK
36220	CA AM MR RE EG GA AG GG GN ND DY YK KL LS SF	CA AS SS SL LG GT TG GA AR RG GY YT TF	IVTDFSVIK
2809	CA AV VT TR RD DD DK KI II IF	CA AS SS SW WG GG GG GS SH HY YG GY YT TF	IVTDFSVIK
161	CA AV VR RG GT TY YN NT TD DK KL LI IF	CA AS SS SQ QG GV VI IT TE EA AF FF	KLGGALQAK
34271	CA AM MS SR RL LE EG GD DK KL LI IF	CA AS SS SQ QE EG GG GF FT TD DT TQ QY YF	KLGGALQAK
25392	CA AD DE ES SG GG GS SQ QG GN NL LI IF	CA AS SS SL LA AT TT TD DG GG GG GK KL LF FF	RAKFKQLL
18590	CA AL LS SE EN NG GR RS SQ QG GN NL LI IF	CA AS SS SL LR RD DG GS SE EA AF FF	RAKFKQLL
270	CA AT TE EL LY YG GA AN NS SK KL LT TF	CA AS ST TG GL LA AG GQ QE ET TQ QY YF	KLGGALQAK
34703	CA AE ES SM MD DN ND DM MR RF	CA AS SS SW WD DR RH HK KP PQ QH HF	KLGGALQAK
35117	CL LV VG GE ES SH HD DM MR RF	CA AS SS SL LG GA AN NR RF FY YE EQ QY YF	KLGGALQAK
2373	CA AM MR RT TG GE ET TS SG GS SR RL LT TF	CA AS SS SL LS SG GW WT TY YE EQ QY YF	KLGGALQAK
34720	CA AV VR RP PR RM MD DS SS SY YK KL LI IF	CA AS SS SF FS SS SG GW WD DQ QP PQ QH HF	KLGGALQAK
16933	CA AA AN NY YG GA AG GS SY YQ QL LT TF	CA AS SS SQ QV VV VG GN NT TI IY YF	GILGFVFTL
34207	CA AV VS SQ QI IR RT TS SG GS SR RL LT TF	CA AS SS SQ QL LG GT TG GY YQ QP PQ QH HF	KLGGALQAK
31863	CA AE EG GG GS SQ QG GN NL LI IF	CA AS SS SV VR RS SS SY YE EQ QY YF	GILGFVFTL
25890	CA AG GG GG GS SQ QG GN NL LI IF	CA AS SS SS SR RD DG GG GT TD DT TQ QY YF	GILGFVFTL
7074	CA AG GG GG GQ QG GG GS SQ QG GN NL LI IF	CA AS SS SI IY YS SN NQ QP PQ QH HF	GILGFVFTL
6367	CA AG GG GG GS SQ QG GN NL LI IF	CA AS SS SV VR RS SS SY YE EQ QY YF	GILGFVFTL
2234	CA AV VN NL LN NT TD DK KL LI IF	CA AS SS SS SQ QG GL LG GN NT TI IY YF	ELAGIGILTV
33514	CI IV VR RA AS SG GD DY YK KL LS SF	CA AS SS SP PR RS SG GV VE EQ QF FF	GILGFVFTL
28881	CA AD DS SG GG GG GA AD DG GL LT TF	CA AS SS SF FP PG GG GF FT TG GE EL LF FF	RAKFKQLL
35846	CA AV VR RD DD DK KI II IF	CA AS SS SI IG GG GN NP PA AD DT TQ QY YF	KLGGALQAK
34144	CA AM MS SR RL LE EG GD DK KL LI IF	CA AS SR RV VG GN NT TE EA AF FF	KLGGALQAK
2756	CA AD DS SG GG GG GA AD DG GL LT TF	CA AS SS SW WG GG GG GS SH HY YG GY YT TF	IVTDFSVIK
35056	CA AG GH HD DG GN ND DY YK KL LS SF	CA AS SS SL LG GY YG GY YT TF	KLGGALQAK
35835	CA AV VT TS SL LG GA AN NS SK KL LT TF	CA AS SS SI ID DL LG GV VA AY YE EQ QY YF	KLGGALQAK
23278	CA AE EN NS SK KG GH HD DN ND DM MR RF	CA AS SS SL LS SG GR RP PY YE EQ QY YF	RAKFKQLL
29357	CA AV VL LD DS SN NY YQ QL LI IW	CA AS SS SA AR RS SS ST TE EQ QY YF	GILGFVFTL
28713	CA AV VF FG GS SG GN NT TP PL LV VF	CA AS SS SL LT TG GP PP PY YE EQ QY YF	KLGGALQAK
34377	CA AI IG GP PG GN NM ML LT TF	CA AS SS SL LS SQ QG GA AL LN NT TE EA AF FF	KLGGALQAK
154	CA AE ER RP PL LW WA AG GG GF FK KT TI IF	CA AS SS SQ QE ED DS SS SY YN NE EQ QF FF	KLGGALQAK
26560	CA AA AT TE ET TS SY YD DK KV VI IF	CS SA AG GG GN NT TE EA AF FF	RAKFKQLL
2359	CA AV VF FS SG GG GY YQ QK KV VT TF	CA AS SS SL LG GI IN NT TE EA AF FF	ELAGIGILTV
28355	CA AE ET TH HS SG GG GS SN NY YK KL LT TF	CS SY YS SA AG GE ED DQ QP PQ QH HF	RAKFKQLL
5380	CA AV VS SM MD DG GL LM MF	CA AS SS SG GT TQ QP PG GL LG GG GE EQ QF FF	ELAGIGILTV
7256	CA AV VG GG GQ QL LT TF	CA AS SS SQ QA AN NY YE EQ QY YF	KLGGALQAK
26504	CA AL LE EG GD DD DK KI II IF	CS SA AR RW WG GG GG GT TD DT TQ QY YF	KLGGALQAK
2236	CA AV VN NF FI IT TG GN NQ QF FY YF	CA AS SS SV VG GG GP PP PP PD DT TQ QY YF	KLGGALQAK
5465	CA AV VT TN NY YG GG GA AT TN NK KL LI IF	CA AS SS ST TS SH HV VG GT TE EA AF FF	GILGFVFTL
6792	CA AF FS SR RG GH HY YG GG GS SQ QG GN NL LI IF	CA AS SS SI IR RS SS SY YE EQ QY YF	GILGFVFTL
35979	CA AL LS SG GF FS SQ QG GG GS SE EK KL LV VF	CA AS SS SW WA AY YN NE EQ QF FF	KLGGALQAK
32523	CA AP PS SC CN NA AG GN NM ML LT TF	CA AS SS SI IR RS SA AE EK KL LF FF	GILGFVFTL
23103	CA AA AD DN NY YG GG GS SQ QG GN NL LI IF	CA AS SS SS ST TG GG GG GE EK KD DQ QP PQ QH HF	GILGFVFTL
2274	CA AG GI IR RS SV VE EN NT TG GT TA AS SK KL LT TF	CA AS SS SL LT TG GS SG GD DS SP PL LH HF	KLGGALQAK
25409	CA AA AS SE ET TS SY YD DK KV VI IF	CA AS SS SL LL LD DS SP PG GG GY YG GY YT TF	RAKFKQLL
27291	CA AD DS SG GG GG GA AD DG GL LT TF	CS SV VG GS SG GD DH HG GE EQ QF FF	RAKFKQLL
36131	CV VV VI IL LL LY YN NQ QG GG GK KL LI IF	CA AS SS SP PT TE EN NQ QP PQ QH HF	AVFDRKSDAK
8079	CA AA AS SE ET TS SY YD DK KV VI IF	CA AS SS SF FL LD DR RG GP PN NT TE EA AF FF	RAKFKQLL
4964	CA AE EN NM MG GG GG GS SQ QG GN NL LI IF	CA AS SS SL LE EG GG GT TT TP PF FY YE EQ QY YF	GILGFVFTL
35630	CA AT TD DA AT TG GG GF FK KT TI IF	CA AS SS SL LM MT TG GL LG GD DT TG GE EL LF FF	KLGGALQAK
24339	CA AV VD DR RG GA AQ QK KL LV VF	CA AI IR RT TS SG GV VE ET TQ QY YF	KLGGALQAK
696	CA AE ES SK KN NN NN NA AR RL LM MF	CA AS SS SL LS SG GY YE EQ QY YF	KLGGALQAK
7679	CA AV VI IS SY YS SS SA AS SK KI II IF	CA AS SP PN NR RQ QG GH HT TD DT TQ QY YF	RAKFKQLL
36010	CA AL LD DF FS SS SG GS SA AR RQ QL LT TF	CA AS SS SQ QG GP PG GT TV VH HE EK KL LF FF	KLGGALQAK
33072	CA AV VG GV VG GG GS SQ QG GN NL LI IF	CA AS SS SI IR RS SS SY YE EQ QY YF	GILGFVFTL
25221	CA AL LK KG GT TG GG GF FK KT TI IF	CA AS SS SL LR RG GT TG GG GG GN NQ QP PQ QH HF	KLGGALQAK
34555	CA AV VE EI IW WL LT TG GG GG GN NK KL LT TF	CA AS SS SS SD DR RV VY YT TE EA AF FF	IVTDFSVIK
35217	CA AV VM MR RN NT TG GF FQ QK KL LV VF	CA AS SS SF FV VN NQ QE ET TQ QY YF	KLGGALQAK
26015	CA AV VG GA AL LY YS SG GA AG GS SY YQ QL LT TF	CA AS SS SS SL LT TG GL LH HE EQ QY YF	KLGGALQAK
33854	CA AG GT TH HG GG GS SQ QG GN NL LI IF	CA AS SS SV VR RS ST TD DT TQ QY YF	GILGFVFTL
7331	CA AM MR RE ED DP PG GG GT TS SY YG GK KL LT TF	CA AT TS SD DV VT TG GG GL LV VG GN NQ QP PQ QH HF	GILGFVFTL
2283	CA AV VR RD DI IA AS SG GT TY YK KY YI IF	CA AS SS SL LG GG GR RG GV VT TD DT TQ QY YF	KLGGALQAK
35906	CA AL LS SE EA AV VE EA AA AG GN NK KL LT TF	CA AS SS SM MG GT TG GL LK KA AF FF	KLGGALQAK
35253	CA AR RH HF FN NK KF FY YF	CA AS SS SP PI IQ QD DT TE EA AF FF	KLGGALQAK
34029	CA AV VR RD DA AF FS SG GG GY YN NK KL LI IF	CA AS SG GF FA AG GD DE EK KL LF FF	KLGGALQAK
26074	CA AA AK KE EG GY YS ST TL LT TF	CR RY YK KG GQ QG GV VS SG GA AN NV VL LT TF	GILGFVFTL
30552	CA AY YS SP PA AA AG GG GT TS SY YG GK KL LT TF	CA AS SS SI IR RS SS SY YE EQ QY YF	GILGFVFTL
2530	CA AM MR RE EG GG GE EY YG GN NK KL LV VF	CA AS SS SR RA AD DL LA AG GV VP PL LG GT TG GE EL LF FF	KLGGALQAK
17996	CG GT TE EY YP PN ND DY YK KL LS SF	CA AS SS SV VE EG GV VG GT TS ST TD DT TQ QY YF	GLCTLVAML
35277	CA AM MR RD DP PQ QG GG GR RR RA AL LT TF	CA AS ST TG GT TS SG GG GP PT TL LR RD DE EQ QF FF	KLGGALQAK
34015	CA AV VR RP PD DG GQ QK KL LL LF	CA AT TS SD DS SV VS SG GE EA AF FF	KLGGALQAK
18701	CA AG GP PG GT TG GA AN NN NL LF FF	CA AS SS SL LR RD DG GS SE EA AF FF	RAKFKQLL
587	CA AA AY YS SG GG GG GA AD DG GL LT TF	CA AS SS SP PQ QT TE EY YG GY YT TF	ELAGIGILTV
3	CA AF FM MI IG GA AG GG GT TS SY YG GK KL LT TF	CA AS SS SM MG GS SY YG GY YT TF	GILGFVFTL
31283	CA AA AS SL LG GG GG GS SQ QG GN NL LI IF	CA AS SS SI IR RS ST TD DT TQ QY YF	GILGFVFTL
31492	CA AY YM MP PN NA AG GG GT TS SY YG GK KL LT TF	CA AS SS SQ QG GA AY YG GY YT TF	GILGFVFTL
34399	CA AV VP PR RS SG GA AG GS SY YQ QL LT TF	CA AS SS SV VD DT TS SG GG GA AG GT TD DT TQ QY YF	KLGGALQAK
91	CA AL LR RP PS SN ND DY YK KL LS SF	CA AS SS SP PG GQ QG GI IH HG GY YT TF	KLGGALQAK
34355	CA AG GQ QG GN NQ QG GG GK KL LI IF	CA AS SS SA AR RG GQ QG GG GN NT TI IY YF	KLGGALQAK
6470	CA AG GN NY YG GG GS SQ QG GN NL LI IF	CA AS SS SV VR RS ST TG GE EL LF FF	GILGFVFTL
35800	CA AG GT TN NS SG GN NT TP PL LV VF	CA AS SQ QQ QG GA AV VT TE EA AF FF	KLGGALQAK
2365	CA AG GS SH HP PD DT TG GT TA AS SK KL LT TF	CA AS SS SL LL LG GS SP PL LH HF	KLGGALQAK
36151	CA AV VK KN NA AR RL LM MF	CA AT TS SR RD DP PL LN NE EG GE EQ QY YF	ELAGIGILTV
31681	CA AF FQ QN NQ QG GG GK KL LI IF	CA AS SS ST TR RS SS SE ET TQ QY YF	GILGFVFTL
15581	CA AE EM ME EG GG GS SY YI IP PT TF	CA AS SS SR RD DR RD DY YG GY YT TF	RAKFKQLL
35440	CA AT TD DV VY YR RD DD DK KI II IF	CS SA AR RG GM MN NT TE EA AF FF	KLGGALQAK
36230	CV VV VK KV VP PL LR RN NE EK KL LT TF	CA AS SS SS SA AT TG GA AY YE EQ QY YF	KLGGALQAK
5462	CA AV VN NT TG GD DM MR RF	CA AS SS SP PG GQ QG GL LD DT TQ QY YF	ELAGIGILTV
31885	CA AA AP PT TG GN NN NN ND DM MR RF	CA AS SS SV VR RS ST TD DT TQ QY YF	GILGFVFTL
36216	CA AG GT TG GN NQ QF FY YF	CA AS SS SF FE EQ QG GN NS SP PL LH HF	KLGGALQAK
4978	CA AM MR RE ES SN NA AG GK KS ST TF	CA AS SS SL LT TS SE ET TS SY YE EQ QY YF	RAKFKQLL
34176	CA AV VA AN NT TD DK KL LI IF	CA AS SS SQ QD DR RV VS SY YE EQ QY YF	KLGGALQAK
5544	CA AG GP PI IA AG GG GS SQ QG GN NL LI IF	CA AS SG GV VY YS SN NQ QP PQ QH HF	GILGFVFTL
32672	CA AV VR RD DS SS SS SG GN NT TG GK KL LI IF	CA AS SS SI IR RS SS SY YE EQ QY YF	GILGFVFTL
2562	CA AA AS SE ET TG GR RR RA AL LT TF	CA AS SS SL LG GD DG GN NY YE EQ QY YF	KLGGALQAK
31636	CA AA AS SG GT TS SN NS SG GY YA AL LN NF	CA AS SS ST TG GQ QP PQ QH HF	GILGFVFTL
34252	CA AF FI IG GD DA AG GG GT TS SY YG GK KL LT TF	CA AS SS SQ QD DH HR RM MG GG GH HE EK KL LF FF	KLGGALQAK
26551	CA AV VK KG GN NY YG GQ QN NF FV VF	CS SV VW WS SG GD DS SY YN NE EQ QF FF	KLGGALQAK
34721	CA AV VQ QD DE ER RG GS ST TL LG GR RL LY YF	CA AS SS SF FT TA AG GS ST TG GE EL LF FF	KLGGALQAK
35244	CA AV VL LM MD DS SS SY YK KL LI IF	CA AS SS SN NS SL LP PS SG GV VS SY YN NE EQ QF FF	KLGGALQAK
32353	CA AF FM MV VN NA AG GG GT TS SY YG GK KL LT TF	CA AS SS SI IG GA AH HG GY YT TF	GILGFVFTL
17953	CA AA AS SA AS SG GG GS SQ QG GN NL LI IF	CA AS SS ST TR RL LS SG GG GT TS SN NE EQ QF FF	RAKFKQLL
34125	CA AV VP PD DQ QT TG GA AN NN NL LF FF	CA AS SS SE EP PL LQ QD DY YQ QE ET TQ QY YF	KLGGALQAK
29954	CA AG GG GG GD DG GG GS SQ QG GN NL LI IF	CA AS SS SH HR RS SG GQ QP PQ QH HF	GILGFVFTL
25694	CA AV VI IE ED DT TG GK KL LI IF	CA AS SS SL LV VL LG GR RE ET TE EA AF FF	RAKFKQLL
191	CA AV VT TY YG GG GS SQ QG GN NL LI IF	CA AS SS SQ QQ QG GG GY YE EQ QY YF	KLGGALQAK
5023	CA AF FM MK KG GA AG GG GT TS SY YG GK KL LT TF	CA AS SS SS SP PG GG GM ME ET TQ QY YF	GILGFVFTL
17977	CA AM MR RE EG GN NA AG GN NM ML LT TF	CA AS SS SV VD DP PS SG GG GS SG GN NT TE EA AF FF	KLGGALQAK
35075	CA AA AV VN NQ QA AG GT TA AL LI IF	CA AS SS SS SR RH HE EA AF FF	KLGGALQAK
35692	CA AM MR RE EG GV VD DT TG GR RR RA AL LT TF	CA AS SS SE EF FM MG GM MN NT TE EA AF FF	KLGGALQAK
4107	CA AG GH HT TG GN NH HF FY YF	CA AS SS SW WG GG GG GS SH HY YG GY YT TF	IVTDFSVIK
5408	CA AV VL LN NA AR RL LM MF	CA AS SS SS SG GG GA AR RE ET TQ QY YF	ELAGIGILTV
36086	CA AV VS SG GG GG GA AD DG GL LT TF	CA AS SS SH HG GR RG GN NE EQ QY YF	ELAGIGILTV
35674	CA AV VG GR RL LT TQ QG GG GS SE EK KL LV VF	CA AS ST TP PW WR RE EY YP PL LE EQ QY YF	KLGGALQAK
32260	CG GT TV VF FE EG GS SQ QG GN NL LI IF	CA AS SS SG GR RS ST TD DT TQ QY YF	GILGFVFTL
35603	CA AV VG GS SG GN NT TG GK KL LI IF	CA AS SS SL LV VE EA AT TL LN NY YG GY YT TF	KLGGALQAK
2326	CA AG GP PS SY YY YG GG GS SQ QG GN NL LI IF	CA AS SG GQ QG GT TD DT TQ QY YF	KLGGALQAK
25272	CA AE ES SE EG GP PT TY YT TD DK KL LI IF	CA AS SR RP PP PA AA AA AA AD DK KT TQ QY YF	KLGGALQAK
23285	CA AV VR RG GG GF FG GN NV VL LH HC	CA AS SS SL LS SG GR RP PY YE EQ QY YF	RAKFKQLL
34642	CA AY YR RS SA AG GA AP PF FS SG GG GY YN NK KL LI IF	CA AS SS SL LL LG GS SN NQ QP PQ QH HF	KLGGALQAK
3877	CA AL LS SE EP PN NT TG GN NQ QF FY YF	CA AS SS SW WG GG GG GS SH HY YG GY YT TF	IVTDFSVIK
7210	CA AG GN NY YG GG GS SQ QG GN NL LI IF	CA AS SS ST TR RS ST TG GE EL LF FF	GILGFVFTL
89	CA AL LA AH HG GN NK KL LV VF	CA AS SS SL LT TS SG GE EE ET TQ QY YF	AVFDRKSDAK
14945	CA AG GR RI IY YN NQ QG GG GK KL LI IF	CA AS SS SL LG GR RD DS SP PL LH HF	KLGGALQAK
34463	CP PL LF FS SG GG GY YN NK KL LI IF	CA AS SS SF FL LS SG GD DT TG GN NE EK KL LF FF	KLGGALQAK
25727	CA AR RG GG GG GF FK KT TI IF	CA AS SS SP PV VT TG GG GG GS SG GA AN NV VL LT TF	KLGGALQAK
32415	CA AM MR RE EG GW WP PN NT TN NA AG GK KS ST TF	CA AS SS SI IR RA AA AE ET TQ QY YF	GILGFVFTL
34147	CA AA AT TG GT TA AS SK KL LT TF	CA AS SS SH HP PA AG GG GE EE ET TQ QY YF	KLGGALQAK
6707	CA AA AS SG GG GG GS SQ QG GN NL LI IF	CA AS SS SI IR RS SQ QD DT TQ QY YF	GILGFVFTL
26019	CA AG GA AQ QG GG GG GS SQ QG GN NL LI IF	CA AS SS SI IR RA AA AY YE EQ QY YF	GILGFVFTL
36096	CA AY YR RS SG GG GG GS SE EK KL LV VF	CA AS SS SQ QG GT TY YQ QE ET TQ QY YF	KLGGALQAK
7360	CA AV VS SA AA AS SG GG GS SY YI IP PT TF	CA AS SG GL LV VE ES SA AG GT TE EA AF FF	RAKFKQLL
19628	CA AV VS SR RG GS ST TL LG GR RL LY YF	CA AS SS SL LR RD DG GS SE EA AF FF	RAKFKQLL
34423	CA AV VR RY YG GA AG GS SY YQ QL LT TF	CA AS SS SV VV VP PG GT TD DN NE EQ QF FF	KLGGALQAK
31382	CA AG GG GG GS SQ QG GN NL LI IF	CA AS SS SL LQ QG GA AN NE EK KL LF FF	GILGFVFTL
23020	CA AS SG GG GS SQ QG GN NL LI IF	CA AS SS SL LG GT TA AN NY YG GY YT TF	GILGFVFTL
15942	CA AM MR RE EG GS SR RR RR RD DD DK KI II IF	CA AS SS ST TS ST TG GT TG GY YG GY YT TF	RAKFKQLL
35673	CA AG GL LK KG GN NQ QF FY YF	CA AS ST TG GS SG GT TG GE EL LF FF	KLGGALQAK
2	CA AE EN NM MG GG GG GS SQ QG GN NL LI IF	CA AS SS SI IR RS SG GN NE EQ QY YF	GILGFVFTL
35488	CA AG GG GP PQ QN ND DY YK KL LS SF	CS SV VA AG GV VG GN NT TE EA AF FF	KLGGALQAK
25294	CA AF FM MR RG GR RG GK KL LT TF	CA AS SS SF FR RD DS SY YE EQ QY YF	KLGGALQAK
26505	CA AV VR RD DQ QR RS SG GG GY YN NK KL LI IF	CS SA AR RW WG GG GG GT TD DT TQ QY YF	KLGGALQAK
5228	CA AY YM MS SN NA AG GG GT TS SY YG GK KL LT TF	CS SA AH HS SG GT TS SG GS SS SE EQ QY YF	GILGFVFTL
23891	CV VV VG GF FG GN NV VL LH HC	CA AS SS SL LG GY YG GG GA AG GE ET TQ QY YF	KLGGALQAK
2424	CA AD DM MN NR RD DD DK KI II IF	CA AS SS SL LE EW WG GG GE ET TQ QY YF	GILGFVFTL
6687	CA AL LT TG GG GG GS SQ QG GN NL LI IF	CA AS SS SI IR RS SG GD DT TQ QY YF	GILGFVFTL
23120	CA AL LS SE EG GN NR RD DD DK KI II IF	CA AS SS SW WD DR RA AN NG GY YT TF	KLGGALQAK
34228	CA AA AR RY YN NN NA AG GN NM ML LT TF	CA AS SS SS ST TV VL LG GT TS SS SY YN NE EQ QF FF	KLGGALQAK
7213	CA AF FM MI IG GA AG GG GT TS SY YG GK KL LT TF	CA AS SS SV VG GS SY YG GY YT TF	GILGFVFTL
34831	CV VV VN NG GY YS SS SA AS SK KI II IF	CA AS SS SL LQ QG GD DE EQ QY YV	KLGGALQAK
25291	CA AA AT TE ET TS SY YD DK KV VI IF	CA AS SS SF FL LG GT TG GG GA AS SN NL LI IS SG GN NT TI IY YF	RAKFKQLL
34079	CA AM MR RR RP PI IS SS SG GS SA AR RQ QL LT TF	CA AS SS SP PN NT TG GM ME ET TQ QY YF	KLGGALQAK
7326	CA AA AM ME ET TS SY YD DK KV VI IF	CA AT TS SD DA AG GT TD DY YE EQ QY YF	RAKFKQLL
168	CA AV VE EA AA AG GN NK KL LT TF	CA AS SS SD DG GG GS SN NS SG GA AN NV VL LT TF	AVFDRKSDAK
36324	CA AT TP PS SG GY YS ST TL LT TF	CA AS SS SY YS SL LL LA AA AQ QE ET TQ QY YF	KLGGALQAK
14672	CA AA AA AG GG GT TS SY YG GK KL LT TF	CA AS SS SE ER RI IP PN NQ QP PQ QH HF	KLGGALQAK
5733	CA AG GA AE EG GS SG GN NT TG GK KL LI IF	CA AS SS SI IR RS SA AY YE EQ QY YF	GILGFVFTL
31358	CA AV VN NI IG GL LT TG GG GG GN NK KL LT TF	CA AS SS SI IS SL LA AT TY YN NE EQ QF FF	KLGGALQAK
17001	CA AG GH HT TG GN NQ QF FY YF	CA AS SS SP PL LW WV VA AG GG GR RE ET TQ QY YF	IVTDFSVIK
2558	CA AA AS SG GD DS SG GG GG GA AD DG GL LT TF	CA AS SS SL LE EF FV VV VG GE ET TQ QY YF	KLGGALQAK
38432	CA AP PS SG GY YS ST TL LT TF	CA AS SS SA AE EG GA AG GN NM MN NT TE EA AF FF	KLGGALQAK
34435	CA AY YR RS SP PL LT TG GN NQ QF FY YF	CA AS SS SL LP PR RG GG GL LF FF	KLGGALQAK
25390	CA AA AS SE ET TS SY YD DK KV VI IF	CA AS SS SL LA AG GS SY YE EQ QY YF	RAKFKQLL
5267	CA AM MF FG GM MD DS SS SY YK KL LI IF	CS SV VD DE EG GQ QG GS SS SY YE EQ QY YF	RAKFKQLL
6241	CA AV VN NR RG GY YG GG GS SQ QG GN NL LI IF	CA AS SS SM MR RA AS SV VE EQ QY YF	GILGFVFTL
28676	CA AV VD DN NF FG GN NE EK KL LT TF	CA AS SS SE EG GT TG GG GT TE EA AF FF	KLGGALQAK
29971	CI IP PY YN NN NN ND DM MR RF	CA AS SS SI IG GI IY YG GY YT TF	GILGFVFTL
15315	CA AV VS SR RI IL LW WG GW WE EL LP PT TH HF	CA AS SS SQ QD DR RG GP PG GE EL LF FF	GLCTLVAML
34669	CA AG GV VT TQ QG GG GK KL LI IF	CA AS SS SL LY YA AG GA AS SE EK KL LF FF	KLGGALQAK
5425	CA AV VD DN NY YG GQ QN NF FV VF	CA AS SS SY YG GV VL LS ST TD DT TQ QY YF	ELAGIGILTV
14316	CA AR RG GE ET TS SY YD DK KV VI IF	CA AS SS SS SS SG GV VG GF FY YE EQ QY YF	RAKFKQLL
34937	CA AV VQ QG GA AQ QK KL LV VF	CA AI IS ST TH HE EL LA AG GY YE EQ QY YV	KLGGALQAK
24064	CA AA AR RV VR RG GF FG GN NV VL LH HC	CA AS SG GR RL LS SY YN NE EQ QF FF	RAKFKQLL
35443	CA AV VN NG GG GS SQ QG GN NL LI IF	CS SA AR RL LG GG GQ QQ QY YF	KLGGALQAK
34960	CA AE ES SK KH HN NQ QG GG GK KL LI IF	CA AS SS SF FI IG GS ST TD DT TQ QY YF	KLGGALQAK
35243	CV VV VR RS SG GG GY YN NK KL LI IF	CA AS SS SN NS SL LP PS SG GV VS SY YN NE EQ QF FF	KLGGALQAK
33529	CA AG GS SG GS SQ QG GN NL LI IF	CA AS SS SQ QG GA AY YG GY YT TF	GILGFVFTL
35643	CV VV VD DD DS SG GT TY YK KY YI IF	CA AS SS SS SP PR RT TS SW WE ET TQ QY YF	KLGGALQAK
34392	CA AM MG GN NN NA AR RL LM MF	CA AS SS SV VA AP PG GP PN NE EQ QF FF	KLGGALQAK
34833	CL LV VG GD DI IA AA AG GK KS ST TF	CA AS SS SL LR RV VF FT TG GV VG GT TD DT TQ QY YF	KLGGALQAK
115	CV VV VT TH HY YG GG GS SQ QG GN NL LI IF	CA AS SS SD DE EL LD DR RG GR RA AL LA AK KN NI IQ QY YF	KLGGALQAK
5599	CA AA AN NY YG GG GS SQ QG GN NL LI IF	CA AS SS SG GR RS ST TG GE EL LF FF	GILGFVFTL
35822	CA AV VG GG GY YN NK KL LI IF	CA AS SS SE ET TG GS SN NQ QP PQ QH HF	KLGGALQAK
16949	CA AF FM MK KL LA AG GA AN NS SK KL LT TF	CA AS SK KS SE EK KG GA AG GG GS SP PL LH HF	KLGGALQAK
28447	CA AV VE ED DS SN NY YQ QL LI IW	CA AS SS SD DR RA AS SG GG GA AD DE EQ QF FF	KLGGALQAK
35754	CA AA AS SR RG GG GA AD DG GL LT TF	CA AS SS SS SV VS SL LE EQ QF FF	KLGGALQAK
17883	CA AA AK KR RQ QG GA AQ QK KL LV VF	CA AS SS SG GT TS SK KR RD DE EA AF FF	RAKFKQLL
14314	CA AY YS SP PA AA AG GG GT TS SY YG GK KL LT TF	CA AS SS SQ QG GA AG GE EL LF FF	GILGFVFTL
7214	CA AE ET TS SY YN NQ QG GG GK KL LI IF	CA AS SS SV VQ QG GV VL LN NT TE EA AF FF	KLGGALQAK
22330	CA AD DS SG GG GG GA AD DG GL LT TF	CA AS SS SS ST TG GG GG GE EK KD DQ QP PQ QH HF	RAKFKQLL
31786	CV VV VN NQ QA AG GT TA AL LI IF	CA AS SS ST TR RS SS SY YE EQ QY YF	GILGFVFTL
35214	CA AS SM ME EY YG GN NK KL LV VF	CA AS SS SF FL LT TA AE EN NT TE EA AF FF	KLGGALQAK
35775	CA AG GE EG GW WN NS SG GY YA AL LN NF	CA AS SS SY YP PF FG GY YT TF	KLGGALQAK
38434	CA AV VK KD DS SN NY YQ QL LI IW	CA AS SS SY YS SE ES SG GD DS SP PL LH HF	KLGGALQAK
35963	CA AE EN NI IL LS SG GY YS ST TL LT TF	CA AT TH HR RG GG GA AG GE EL LF FF	KLGGALQAK
36320	CF FL LD DA AG GG GT TS SY YG GK KL LT TF	CA AS SS SY YP PN NT TG GE EL LF FF	KLGGALQAK
17005	CI IL LR RD DL LN NA AG GG GT TS SY YG GK KL LT TF	CA AS SS SP PV VT TG GS SS SY YE EQ QY YF	GLCTLVAML
35617	CA AV VL LD DS SN NY YQ QL LI IW	CA AS SS SG GT TG GN NQ QP PQ QH HF	KLGGALQAK
32602	CA AM MS SG GE EG GG GS SQ QG GN NL LI IF	CA AS SS SI IR RS SN NQ QP PQ QH HF	GILGFVFTL
25852	CA AG GL LT TG GN NQ QF FY YF	CA AS SS SS SP PG GG GF FG GY YN NS SP PL LH HF	KLGGALQAK
31933	CA AG GN NY YG GG GS SQ QG GN NL LI IF	CA AA AS ST TR RS ST TD DT TQ QY YF	GILGFVFTL
27814	CA AA AA AR RI ID DS SS SY YK KL LI IF	CS SV VG GS SG GE ED DS SP PQ QY YF	RAKFKQLL
26127	CA AM MR RE ED DD DR RD DS ST TL LG GR RL LY YF	CS SA AG GQ QG GL LA AG GG GP PG GT TD DT TQ QY YF	RAKFKQLL
28445	CA AV VM MD DS SS SY YK KL LI IF	CA AS SS SD DA AG GG GH HT TD DT TQ QY YF	GILGFVFTL
34518	CA AG GN NT TG GT TA AS SK KL LT TF	CA AS SS SL LE EA AG GG GA AY YN NE EQ QF FF	KLGGALQAK
34334	CA AL LF FR RN NS SG GN NT TP PL LV VF	CA AS SS SQ QG GT TY YE EQ QY YF	KLGGALQAK
16975	CA AE EM ME EG GG GS SY YI IP PT TF	CA AS SS SL LG GT TG GG GS SY YE EQ QY YF	RAKFKQLL
23126	CA AE EM MT TG GG GG GN NK KL LT TF	CA AT TG GT TG GI IS SY YE EQ QY YF	IVTDFSVIK
25107	CA AA AS SE ET TS SY YD DK KV VI IF	CA AS SS SP PR RD DR RE ER RG GE EQ QY YF	RAKFKQLL
35300	CA AE EI IA AA AN NS SN NS SG GY YA AL LN NF	CA AS SS SP PA AL LG GG GV VP PE EA AF FF	KLGGALQAK
35312	CA AV VR RP PP PT TD DS SW WG GK KF FQ QF	CA AS SS SS SP PR RD DW WL LY YQ QE ET TQ QY YF	KLGGALQAK
22582	CA AG GG GG GS SQ QG GN NL LI IF	CA AS SS SG GP PG GG GV VD DE EQ QY YF	RAKFKQLL
2364	CA AV VI IR RY YG GQ QN NF FV VF	CA AS SS SL LK KQ QS SP PH HT TE EA AF FF	RAKFKQLL
16697	CA AR RE EH HM MD DS SN NY YQ QL LI IW	CA AS SS SQ QR RP PS SE EV VG GE EL LF FF	RAKFKQLL
34119	CV VV VS SV VL LG GG GA AD DG GL LT TF	CA AS SS SE EA AG GA AQ QL LW WS SS SY YN NE EQ QF FF	KLGGALQAK
23893	CA AA AS SM MD DS SN NY YQ QL LI IW	CA AS SS SL LG GY YG GG GA AG GE ET TQ QY YF	KLGGALQAK
35064	CA AT TD DR RG GN NS SG GY YA AL LN NF	CA AS SS SL LV VE EV VE ET TQ QY YF	KLGGALQAK
35712	CA AV VR RD DI IE EN ND DY YK KL LS SF	CA AS SG GT TG GG GD DI IG GG GY YT TF	KLGGALQAK
34074	CA AV VE EN NN NA AG GK KS ST TF	CA AS SS SY YP PM MG GG GA AD DG GS SQ QE ET TQ QY YF	KLGGALQAK
25012	CV VG GY YT TN NA AG GK KS ST TF	CA AS SS SW WG GG GG GS SH HY YG GY YT TF	RAKFKQLL
28874	CV VP PH HN NT TD DK KL LI IF	CA AS SS SY YS SF FA AG GG GI ID DE EQ QY YF	KLGGALQAK
35148	CA AV VS SW WG GQ QG GG GK KL LI IF	CA AS SS SI IP PL LA AE ES ST TD DT TQ QY YF	KLGGALQAK
35066	CA AL LS SE EA AS SS SG GN NT TP PL LV VF	CA AS SS SL LW WP PS SG GT TN NE EQ QF FF	KLGGALQAK
2248	CA AV VS SD DR RG GY YS ST TL LT TF	CA AS SS SL LD DR RT TG GE EY YE EQ QY YF	IVTDFSVIK
33372	CA AG GG GG GD DG GG GS SQ QG GN NL LI IF	CA AS SS SI IR RS ST TD DT TQ QY YF	GILGFVFTL
36115	CA AV VN NS SF FY YN NQ QG GG GK KL LI IF	CA AS SS SE EG GQ QE ES SF FS SP PL LH HF	KLGGALQAK
34582	CA AM MR RR RP PI IS SS SG GS SA AR RQ QL LT TF	CA AT TV VN NG GP PQ QE EK KL LF FF	KLGGALQAK
35851	CA AG GN NS SG GN NT TP PL LV VF	CA AS SS SI IG GN NY YN NE EQ QF FF	KLGGALQAK
28614	CA AV VL LP PS SY YN NQ QG GG GK KL LI IF	CA AS SS SE EF FP PP PP PY YE EQ QY YF	KLGGALQAK
22313	CA AL LD DG GA AG GN NT TD DK KL LI IF	CA AS SS SP PG GG GG GY YT TF	KLGGALQAK
34991	CA AL LG GD DN NA AR RL LM MF	CA AS SS SL LV VP PI IV VY YG GY YT TF	KLGGALQAK
17	CA AV VQ QA AD DQ QT TG GA AN NN NL LF FF	CA AT TS SD DS SP PG GG GS SY YN NE EQ QF FF	IVTDFSVIK
33515	CA AF FM MK KG GA AG GG GT TS SY YG GK KL LT TF	CA AS SS SP PR RS SN NQ QP PQ QH HF	GILGFVFTL
513	CI IV VL LG GG GM MK KT TS SY YD DK KV VI IF	CA AS SS SL LS SS SG GT TY YE EQ QY YF	IVTDFSVIK
5528	CA AL LS SE EA AL LH HF FG GN NE EK KL LT TF	CA AS SS SY YL LA AG GS SS SV VY YN NE EQ QF FF	KLGGALQAK
35298	CA AT TD DP PA AN NF FG GN NE EK KL LT TF	CA AS SS SL LV VT TG GT TG GA AS SY YN NE EQ QF FF	KLGGALQAK
34841	CA AG GS SA AF FS SG GG GG GA AD DG GL LT TF	CA AS SS SP PI IR RA AM MG GS SY YE EQ QY YF	KLGGALQAK
36130	CA AV VN NW WE EE EQ QG GG GS SY YI IP PT TF	CA AS SS SP PS SN NE EQ QF FF	KLGGALQAK
5374	CA AV VR RD DP PY YQ QT TG GG GY YN NK KL LI IF	CA AS SS SS SP PE ER RG GR RG GT TD DT TQ QY YF	KLGGALQAK
31612	CA AV VN NL LG GG GG GS SQ QG GN NL LI IF	CA AS SS SS SR RA AS SH HE EQ QY YF	GILGFVFTL
34789	CA AV VE EE EG GA AQ QK KL LV VF	CA AS SS SP PR RV VE EG GA AW WY YT TE EA AF FF	KLGGALQAK
35040	CA AA AT TG GT TY YK KY YI IF	CA AS SS SL LG GP PW WG GV VK KN NI IQ QY YF	KLGGALQAK
14850	CA AV VG GE ES SG GG GQ QN NF FV VF	CA AS SS SH HW WT TG GN NT TE EA AF FF	RAKFKQLL
35168	CA AV VQ QP PQ QI IQ QG GA AQ QK KL LV VF	CA AS SS SL LS SY YN NE EQ QF FF	KLGGALQAK
30573	CA AE EN NY YG GG GS SQ QG GN NL LI IF	CA AS SS SI IR RS SS SY YE EQ QY YF	GILGFVFTL
5432	CA AV VA AS SD DS SN NY YQ QL LI IW	CA AS SS SY YS SS SG GN NT TI IY YF	KLGGALQAK
5469	CA AV VG GA AG GR RR RA AL LT TF	CA AT TA AL LG GD DS SY YE EQ QY YF	ELAGIGILTV
6609	CA AG GQ QY YR RD DD DK KI II IF	CA AS SS SI IG GL LG GE EQ QY YF	GILGFVFTL
26501	CA AE EL LK KE EK KL LI IF	CS SA AR RW WG GG GG GT TD DT TQ QY YF	GLCTLVAML
25797	CA AA AK KE EG GY YS ST TL LT TF	CA AS SS SS SA AA AA AY YE EQ QY YF	RAKFKQLL
27746	CA AE EN NG GG GG GG GA AD DG GL LT TF	CS SV VG GS SG GD DY YE EQ QY YF	RAKFKQLL
35241	CA AV VN NL LA AL LY YT TG GN NQ QF FY YF	CA AS SS SL LV VV VG GV VQ QV VI IQ QY YF	KLGGALQAK
34278	CA AV VR RA AN ND DY YK KL LS SF	CA AS SS SQ QG GS SE EA AF FF	GILGFVFTL
28678	CA AV VR RD DS SN NY YQ QL LI IW	CA AS SS SE EK KS SG GG GP PD DT TQ QY YF	KLGGALQAK
34121	CA AM MR RG GV VK KG GN NN NR RL LA AF	CA AS SS SE EE EV VS ST TE EA AF FF	KLGGALQAK
35394	CA AA AQ QL LP PG GT TG GA AN NN NL LF FF	CS SV VN NQ QI IL LG GQ QP PN NE EK KL LF FF	KLGGALQAK
5322	CA AP PG GA AG GR RR RA AL LT TF	CA AS SS SL LL LN NE EQ QF FF	ELAGIGILTV
5187	CA AV VL LR RM MD DS SS SY YK KL LI IF	CS SA AR RW WG GG GG GT TD DT TQ QY YF	KLGGALQAK
5409	CA AV VD DS SG GG GG GA AD DG GL LT TF	CA AS SS SS SP PA AN NE EG GT TD DT TQ QY YF	ELAGIGILTV
2289	CA AA AI IN NP PT TS SG GT TY YK KY YI IF	CA AS SS SL LR RD DG GS SE EA AF FF	IVTDFSVIK
31347	CA AV VN NY YQ QG GG GS SE EK KL LV VF	CA AS SS SI IR RS ST TT TE EA AF FF	GILGFVFTL
2474	CI IL LI IG GD DS SN NY YQ QL LI IW	CA AS SS SE EG GT TV VN NE EK KL LF FF	KLGGALQAK
6557	CA AA AR RG GA AG GG GT TS SY YG GK KL LT TF	CA AS SA AA AT TV VA AK KN NI IQ QY YF	RAKFKQLL
35230	CY YE EE ET TS SG GS SR RL LT TF	CA AS SS SL LF FI IG GG GY YN NE EQ QF FF	KLGGALQAK
36274	CA AV VR RL LH HN NY YG GQ QN NF FV VF	CS SA AP PA AR RS SE EP PY YE EQ QY YF	KLGGALQAK
2325	CA AV VT TS SG GG GY YN NK KL LI IF	CA AT TT TG GG GR RR RD DR RG GR RD DE EQ QY YF	RAKFKQLL
34321	CA AM MR RG GP PI IS SG GG GY YN NK KL LI IF	CA AS SS SQ QG GR RD DR RH HG GY YT TF	KLGGALQAK
7369	CA AL LS SE ET TS SY YD DK KV VI IF	CA AS SS SK KA AN NP PG GN NT TI IY YF	RAKFKQLL
25767	CA AR RE EH HM MD DS SN NY YQ QL LI IW	CA AS SS SQ QL LG GR RG GD DN NE EQ QF FF	GILGFVFTL
