26471	CA AG GA AG GS SQ QG GN NL LI IF	CS SA AR RE ET TG GY YD DG GP PY YN NE EQ QF FF	GILGFVFTL
35970	CA AT TG GT TG GN NQ QF FY YF	CA AS SS SQ QQ QT TG GY YG GY YT TF	KLGGALQAK
25085	CA AA AS SG GN NH HD DM MR RF	CA AS SS SP PR RT TG GN NS SG GA AN NV VL LT TF	RAKFKQLL
34768	CA AG GA AV VL LN NN NA AR RL LM MF	CA AS SS SL LK KK KQ QT TG GG GS SN NY YG GY YT TF	KLGGALQAK
34445	CA AM MR RT TR RS SG GG GA AD DG GL LT TF	CA AS SS SR RD DR RA AS SF FT TG GE EL LF FF	KLGGALQAK
18695	CA AA AS SS SA AG GA AG GS SY YQ QL LT TF	CA AS SS SL LR RD DG GS SE EA AF FF	RAKFKQLL
36021	CA AG GA AG GY YW WG GQ QN NF FV VF	CA AS SS SQ QV VP PG GQ QG GP PN NY YG GY YT TF	KLGGALQAK
34715	CA AV VP PT TS SG GT TY YK KY YI IF	CA AT TI IP PT TG GS ST TD DT TQ QY YF	KLGGALQAK
2376	CA AV VN ND DG GN NK KL LV VF	CA AS SS SL LS SW WN NQ QP PQ QH HF	ELAGIGILTV
6252	CA AL LC CK KG GD DD DK KI II IF	CA AS SS SM MR RS ST TG GE EL LF FF	GILGFVFTL
377	CA AV VR RR RG GG GR RN NT TG GT TA AS SK KL LT TF	CA AS SS SL LS SG GA AG GN NT TI IY YF	KLGGALQAK
34037	CA AV VV VG GG GT TS SY YG GK KL LT TF	CA AS SG GN NR RV VS SQ QY YF	KLGGALQAK
34867	CA AS SG GM MD DS SS SY YK KL LI IF	CA AS SS SS SP PD DR RG GL LD DE EQ QY YF	KLGGALQAK
31658	CA AG GA AL LG GS SS SN NT TG GK KL LI IF	CA AS SS ST TR RS SA AY YE EQ QY YF	GILGFVFTL
17046	CA AR RA AG GG GG GS SE EK KL LV VF	CA AS SS SQ QI IR RG GG GT TE EA AF FF	RAKFKQLL
258	CA AA AK KS SI IS ST TD DS SW WG GK KL LQ QF	CA AS SS SQ QG GV VA AG GG GW WG GT TQ QY YF	KLGGALQAK
34048	CV VV VS SL LD DN NA AG GN NM ML LT TF	CA AS SR RG GQ QG GV VA AQ QY YV	KLGGALQAK
34596	CI IL LR RG GE EF FG GN NE EK KL LT TF	CA AS SR RR RT TG GQ QS SY YN NS SP PL LH HF	KLGGALQAK
35444	CA AI IG GP PG GN NM ML LT TF	CS SA AR RP PN NK KL LA AG GG GY YE EQ QY YF	KLGGALQAK
34725	CA AV VS SE EG GL LT TG GG GG GN NK KL LT TF	CA AS SS SN NR RG GL LL LA AE EA AF FF	KLGGALQAK
7691	CA AL LS SE ET TS SY YD DK KV VI IF	CA AS SS SE EL LQ QG GA AQ QD DI IS SP PL LH HF	RAKFKQLL
36091	CA AV VD DL LM MK KT TS SY YD DK KV VI IF	CA AS SS SQ QD DR RG GS ST TE EA AF FF	IVTDFSVIK
15046	CA AA AK KE EG GY YS ST TL LT TF	CA AS SS SL LL LW WA AE EY YN NE EQ QF FF	RAKFKQLL
30540	CA AG GA AG GP PG GS SQ QG GN NL LI IF	CA AS SS SI IR RS SS SY YE EQ QY YF	GILGFVFTL
5127	CA AE ET TN NQ QL LY YS ST TL LT TF	CA AW WS SD DE EA AS SY YN NE EQ QF FF	KLGGALQAK
35318	CA AM MY YT TG GN NQ QF FY YF	CA AW WG GG GN NN NE EQ QF FF	KLGGALQAK
24123	CA AV VK KA AA AG GN NK KL LT TF	CA AS SG GR RL LS SY YN NE EQ QF FF	RAKFKQLL
24303	CA AG GM MD DS SN NY YQ QL LI IW	CA AS ST TG GG GG GI IS SY YN NE EQ QF FF	GILGFVFTL
376	CA AI IG GG GS SN NY YK KL LT TF	CA AS SS SL LR RT TG GA AP PH HR RY YT TF	KLGGALQAK
35598	CA AL LS SE EG GR RV VS SG GN NT TP PL LV VF	CA AS SS SF FS ST TD DT TQ QY YF	KLGGALQAK
34396	CA AL LI IG GG GG GY YQ QK KV VT TF	CA AS SS SV VD DK KS ST TT TS SN NY YG GY YT TF	KLGGALQAK
2519	CA AG GV VM MY YS SG GG GG GA AD DG GL LT TF	CA AS SS SF FG GV VS SG GR RD DE EQ QF FF	KLGGALQAK
34869	CA AM MK KE EW WG GN NN NR RL LA AF	CA AS SS ST TG GL LA AG GG GQ QE ET TQ QY YF	KLGGALQAK
35876	CA AD DN NY YG GG GS SQ QG GN NL LI IF	CA AS SS SI IS SG GQ QG GT TD DT TQ QY YF	KLGGALQAK
35321	CA AV VN NS SG GA AN NN NL LF FF	CA AW WL LS SD DT TQ QY YF	KLGGALQAK
34301	CA AE ES SM MY YS SG GG GG GA AD DG GL LT TF	CA AS SS SP PI IP PG GG GS SD DT TQ QY YF	KLGGALQAK
25	CA AV VN NA AG GG GG GS SQ QG GN NL LI IF	CA AS SA AP PD DG GF FF FY YG GY YT TF	GILGFVFTL
25813	CA AV VG GD DN NF FN NK KF FY YF	CA AS SS SS SL LG GG GH HG GE EA AF FF	RAKFKQLL
2379	CA AV VR RD DV VA AT TS SG GT TY YK KY YI IF	CA AS SS SL LY YP PA AM MN NT TE EA AF FF	KLGGALQAK
22988	CA AM MS SA AY YS SG GA AG GS SY YQ QL LT TF	CA AS SS SL LG GT TL LP PY YE EQ QY YF	KLGGALQAK
26555	CA AE ET TH HS SG GG GS SN NY YK KL LT TF	CS SA AR RD DL LG GT TS SK KQ QY YE EQ QY YF	RAKFKQLL
29934	CA AG GA AH HG GG GS SQ QG GN NL LI IF	CA AS SS SG GR RS SA AD DT TQ QY YF	GILGFVFTL
33990	CA AV VG GE EL LA AA AG GN NK KL LT TF	CA AT TS SD DG GR RD DD DE EQ QF FF	KLGGALQAK
23234	CA AT TG GL LT TG GG GG GN NK KL LT TF	CA AS SS SL LG GG GQ QN NY YG GY YT TF	KLGGALQAK
34453	CA AV VT TS SR RS SG GG GY YQ QK KV VT TF	CA AS SI IA AG GP PG GT TG GG GE EK KL LF FF	KLGGALQAK
5400	CA AA AS SS SF FS SG GT TY YK KY YI IF	CA AS SS SL LT TP PP PA AV VA AG GN NE EQ QF FF	ELAGIGILTV
4164	CA AV VD DF FR RD DN NY YG GQ QN NF FV VF	CA AS SS SW WG GG GG GS SH HY YG GY YT TF	IVTDFSVIK
7323	CA AG GA AG GG GG GS SQ QG GN NL LI IF	CA AS SS SQ QR RS ST TD DT TQ QY YF	GILGFVFTL
28372	CI IV VR RL LR RC CR RT TP PT TS SS SS SL	CA AS SS SL LG GG GQ QG GS SN NE EQ QF FF	KLGGALQAK
5576	CA AT TD DG GG GG GG GS SQ QG GN NL LI IF	CA AS SS SG GL LA AG GL LN NE EQ QF FF	GILGFVFTL
18643	CA AV VN NQ QG GG GG GS SQ QG GN NL LI IF	CA AS SS SL LR RD DG GS SE EA AF FF	GILGFVFTL
640	CA AA AR RV VR RG GF FG GN NV VL LH HC	CA AS SS SV VR RS SS SM MN NT TE EA AF FF	AVFDRKSDAK
5817	CA AG GG GG GS SS SN NT TG GK KL LI IF	CA AS SS SI IR RS SS SY YE EQ QY YF	GILGFVFTL
25386	CI IL LS SF FG GN NE EK KL LT TF	CA AS SS SL LA AG GR RN NY YG GY YT TF	KLGGALQAK
24993	CA AP PF FR RG GR RL LM MF	CA AS SS SS SG GT TA AA AY YE EQ QY YF	KLGGALQAK
18350	CA AA AS SS SG GT TG GN NQ QF FY YF	CA AS SS SL LR RD DG GS SE EA AF FF	RAKFKQLL
31503	CA AM MR RE EA AF FR RG GQ QG GN NL LI IF	CA AS SS SQ QL LQ QG GP PS SF FA AE EQ QF FF	IVTDFSVIK
34929	CA AG GG GG GA AG GN NM ML LT TF	CA AI IR RT TT TP PP PG GH HS ST TD DT TQ QY YF	KLGGALQAK
35951	CG GT TD DE EG GD DK KI II IF	CA AS ST TI IT TT TV VT TS SG GN NT TI IY YF	KLGGALQAK
7233	CA AV VS SN NY YQ QL LI IW	CA AS ST TS SG GD DN NE EQ QF FF	ELAGIGILTV
33929	CA AE EK KD DD DK KI II IF	CA AS SS SF FQ QG GL LG GT TE EA AF FF	ELAGIGILTV
5517	CA AA AS SA AP PS SG GN NT TP PL LV VF	CA AS SS SQ QW WG GL LA AG GE ED DT TQ QY YF	KLGGALQAK
95	CA AV VL LE ET TS SG GS SR RL LT TF	CA AS SS SF FR RL LA AR RI IY YE EQ QY YF	KLGGALQAK
36128	CA AV VR RP PP PP PS SS SG GG GY YQ QK KV VT TF	CA AS SS SL LS SD DP PG GE EV VS SP PL LH HF	IVTDFSVIK
24346	CV VV VN NT TG GS SN ND DM MR RF	CA AI IS SE EA AG GA AD DR RP PQ QH HF	KLGGALQAK
34809	CA AA AS SW WG GT TG GN NQ QF FY YF	CA AS SS SA AG GG GD DI IQ QY YF	KLGGALQAK
7035	CA AA AS SD DV VD DY YK KL LS SF	CA AS SS SI IR RS SS SY YE EQ QY YF	GILGFVFTL
13817	CA AG GL LE ET TS SY YD DK KV VI IF	CA AS SS SF FS SG GT TV VR RG GG GY YT TF	RAKFKQLL
28625	CA AW WS SS SN NA AG GG GT TS SY YG GK KL LT TF	CA AS SS SE EG GG GF FT TF FY YN NE EQ QF FF	GLCTLVAML
36186	CA AV VR RD DN NN NA AR RL LM MF	CA AS SS SS SG GQ QG GN NS SP PL LH HF	KLGGALQAK
14631	CA AT TV VP PT TD DS SW WG GK KF FQ QF	CA AS SR RA AG GG GS SS SY YN NE EQ QF FF	KLGGALQAK
25385	CA AR RG GG GG GF FK KT TI IF	CA AS SS SL LA AD DV VG GG GP PQ QH HF	RAKFKQLL
35607	CA AA AS SQ QG GA AQ QK KL LV VF	CA AS ST TE EG GG GH HE ET TQ QY YF	KLGGALQAK
11360	CA AF FM MP PP PY YN NT TD DK KL LI IF	CA AS SS SF FS SG GN NT TG GE EL LF FF	RAKFKQLL
23345	CA AT TE EG GA AS SG GG GS SY YI IP PT TF	CA AS SS SL LS SG GR RP PY YE EQ QY YF	RAKFKQLL
2233	CA AV VN NG GG GD DY YK KL LS SF	CA AS SS SS SP PL LT TS SG GI IY YE EQ QY YF	RAKFKQLL
34033	CA AY YG GT TS SY YD DK KV VI IF	CA AS SG GL LE EG GQ QG GA AG GE EQ QF FF	KLGGALQAK
23833	CA AT TD DD DP PR RA AA AG GG GS SY YI IP PT TF	CA AS SS SL LN NG GM MN NT TE EA AF FF	KLGGALQAK
7266	CA AE EA AG GA AN NN NL LF FF	CA AS SS SQ QS SP PG GG GT TQ QY YF	GLCTLVAML
36211	CA AV VH HT TS SG GT TY YK KY YI IF	CA AI IS SE EG GT TE EA AF FF	KLGGALQAK
25894	CA AA AS SA AL LS SS SG GG GS SN NY YK KL LT TF	CA AS SS SS SR RD DG GG GT TD DT TQ QY YF	KLGGALQAK
30515	CA AG GG GG GS SS SN NT TG GK KL LI IF	CA AS SS SI IR RS SS SY YE EQ QF FF	GILGFVFTL
34706	CA AP PF FK KA AA AG GN NK KL LT TF	CA AS SS SY YD DR RV VN NY YG GY YT TF	KLGGALQAK
33388	CA AL LS SE EA AG GN NY YQ QL LI IW	CA AS SS SI IS SS ST TG GE EL LF FF	GILGFVFTL
35622	CA AM MR RE EG GG GY YS SS SA AS SK KI II IF	CA AS SR RP PQ QG GA AV VE EA AF FF	KLGGALQAK
34402	CA AP PP PQ QT TG GA AN NN NL LF FF	CA AS SS SV VE EA AS SG GV VY YE EQ QY YF	KLGGALQAK
596	CA AV VI IG GY YS SS SA AS SK KI II IF	CA AS SS SV VD DA AL LS SS SY YE EQ QY YF	ELAGIGILTV
2295	CA AR RD DH HP PG GY YS ST TL LT TF	CA AS SS SQ QR RW WM MN NT TE EA AF FF	KLGGALQAK
34200	CL LV VG GE EY YS SG GG GG GA AD DG GL LT TF	CA AS SS SQ QG GT TG GG GT TE EA AF FF	KLGGALQAK
12502	CA AM MS SW WG GR RD DD DK KI II IF	CA AS SS SF FS SG GN NT TG GE EL LF FF	RAKFKQLL
36064	CA AS ST TS SG GT TY YK KY YI IF	CA AS SS SL LT TI IQ QE ET TQ QY YF	KLGGALQAK
31890	CA AG GG GD DG GG GS SQ QG GN NL LI IF	CA AS SS SV VR RS ST TD DT TQ QY YF	GILGFVFTL
1655	CA AL LS SG GD DD DA AG GG GT TS SY YG GK KL LT TF	CA AS SS SL LY YS SA AT TG GE EL LF FF	AVFDRKSDAK
2480	CA AV VP PS SN ND DY YK KL LS SF	CA AS ST TP PR RG GS SA AG GY YT TF	KLGGALQAK
31066	CA AA AS SI IE EG GP PG GP PN NN NN ND DM MR RF	CA AS SS SI IR RS SS SY YE EQ QY YF	GILGFVFTL
29867	CA AL LS SE EA AK KD DE EG GS SE EK KL LV VF	CA AS SS SA AR RS SS SY YE EQ QY YF	GILGFVFTL
35438	CA AT TA AP PY YN NQ QG GG GK KL LI IF	CS SA AR RG GG GL LR RD DT TY YN NE EQ QF FF	KLGGALQAK
15584	CA AE ET TQ QD DS SN NY YQ QL LI IW	CA AS SS ST TS ST TG GT TG GY YG GY YT TF	RAKFKQLL
17861	CA AV VS SE EG GS SQ QG GN NL LI IF	CA AS SS SV VL LA AG GP PY YS SG GA AN NV VL LT TF	KLGGALQAK
3040	CA AL LS SE EA AG GG GF FK KT TI IF	CA AS SS SW WG GG GG GS SH HY YG GY YT TF	IVTDFSVIK
34579	CA AS SR RD DN NY YG GQ QN NF FV VF	CA AT TS SS SS SQ QE EA AT TE EA AF FF	KLGGALQAK
5255	CA AV VR RG GW WG GG GS SY YI IP PT TF	CS SA AR RQ QG GT TT TG GE EL LF FF	RAKFKQLL
2775	CA AM MS SS SN NA AG GG GT TS SY YG GK KL LT TF	CA AS SS SW WG GG GG GS SH HY YG GY YT TF	IVTDFSVIK
34247	CA AL LS SG GW WP PG GG GK KL LI IF	CA AS SS SP PG GT TS SR RG GY YE EQ QY YV	KLGGALQAK
28683	CA AV VF FF FY YN NQ QG GG GK KL LI IF	CA AS SS SE EM MM MD DT TQ QY YF	KLGGALQAK
129	CA AF FM MK KG GA AG GG GT TS SY YG GK KL LT TF	CA AS SS SE ES ST TL LS SL LT TE EA AF FF	GILGFVFTL
35982	CA AG GN NT TN NA AG GK KS ST TF	CA AS SS SD DR RL LA AN NY YN NS SP PL LH HF	KLGGALQAK
34717	CA AP PK KT TD DS SW WG GK KL LQ QF	CA AT TM ME EP PG GQ QG GP PD DT TQ QY YF	KLGGALQAK
31551	CA AE ED DN NN NA AR RL LM MF	CA AS SS SS SF FL LL LS SE EQ QY YF	GILGFVFTL
34920	CV VG GR RK KG GS SA AR RQ QL LT TF	CA AI IS SE ES SR RG GS SL LS SD DT TQ QY YF	KLGGALQAK
35213	CA AT TD DD DG GA AN NS SK KL LT TF	CA AS SS SF FA AP PG GG GG GY YT TG GE EL LF FF	KLGGALQAK
4929	CV VV VS SA AN NN NA AG GN NM ML LT TF	CA AS SS SV VH HR RG GS SG GG GE EL LF FF	KLGGALQAK
23853	CA AF FL LG GG GA AN NN NL LF FF	CA AS SS SL LE EW WG GG GE ET TQ QY YF	KLGGALQAK
35847	CA AE ES ST TL LD DT TG GG GF FK KT TI IF	CA AS SS SI IG GG GS SS SY YN NE EQ QF FF	KLGGALQAK
18	CV VV VN NR RA AG GN NN NR RK KL LI IW	CA AT TS SD DT TH HQ QG GY YQ QQ QF FF	KLGGALQAK
35297	CA AE ES SL LT TG GA AN NN NL LF FF	CA AS SS SL LV VK KG GT TD DT TQ QY YF	KLGGALQAK
114	CA AV VR RG GT TG GG GG GN NK KL LT TF	CA AS SS SD DA AP PG GA AI IN NR RI IF	KLGGALQAK
36207	CA AV VD DL LM MK KT TS SY YD DK KV VI IF	CA AS SS SN ND DP PG GL LA AG GV VE ET TQ QY YF	IVTDFSVIK
25719	CV VV VN NS SF FS SG GA AG GS SY YQ QL LT TF	CA AS SS SP PL LQ QG GA AN NT TG GE EL LF FF	KLGGALQAK
18067	CA AV VM MN NR RD DD DK KI II IF	CA AS SS SL LM MG GG GT TY YN NE EQ QF FF	KLGGALQAK
28463	CA AE ER RG GY YS ST TL LT TF	CA AS SS SK KG GQ QE EG GP PN NT TE EA AF FF	KLGGALQAK
34819	CA AV VR RD DS SN NS SG GY YA AL LN NF	CA AS SS SH HF FE EG GL LD DT TQ QY YF	KLGGALQAK
2247	CA AV VT TD DS SN NF FG GN NE EK KL LT TF	CA AS SS SL LA AQ QG GL LA AK KN NI IQ QY YF	KLGGALQAK
28368	CA AV VD DE EG GG GG GS SQ QG GN NL LI IF	CA AS SS SE EG GG GV VE ET TQ QY YF	GILGFVFTL
5419	CA AA AP PS SN NN NN ND DM MR RF	CA AS SS SY YG GF FN NQ QP PQ QH HF	ELAGIGILTV
2580	CA AG GH HT TG GN NQ QF FY YF	CA AS SS ST TT TG GP PQ QT TP PL LH HF	IVTDFSVIK
35888	CA AV VH HI IH HD DT TN NA AG GK KS ST TF	CA AS SS SI IV VN NG GN NE EQ QF FF	KLGGALQAK
16982	CA AL LS SE ES SG GG GD DD DM MR RF	CA AS SS SP PL LT TS SG GS SY YE EQ QY YF	RAKFKQLL
35411	CA AV VI IS SG GG GS SY YI IP PT TF	CS SA AR RD DG GD DR RG GL LY YG GY YT TF	KLGGALQAK
30096	CA AG GS SG GS SQ QG GN NL LI IF	CA AS SS SI IG GV VH HG GY YT TF	GILGFVFTL
26263	CA AV VT TD DS SN NY YQ QL LI IW	CS SA AR RD DP PS SG GG GD DQ QG GT TQ QY YF	KLGGALQAK
6098	CA AA AT TL LT TG GN NQ QF FY YF	CA AS SS SI IR RS ST TG GE EL LF FF	GILGFVFTL
34951	CA AA AS SP PE EG GA AG GS SY YQ QL LT TF	CA AS SS SL LY YG GG GA AG GE EQ QY YF	KLGGALQAK
6048	CA AV VN NT TN NG GG GS SQ QG GN NL LI IF	CA AS SS SI IR RS SS SY YE EQ QY YF	GILGFVFTL
29782	CA AS SV VG GM MD DS SS SY YK KL LI IF	CA AS SS SA AR RS SS SY YE EQ QY YF	GILGFVFTL
28682	CA AL LS SG GK KD DM MR RF	CA AS SS SE EL LI IG GI IR RP PG GP PA AA AT TK KF	KLGGALQAK
35585	CA AL LS SE EA AF FG GS SG GN NT TP PL LV VF	CA AS SS SH HR RT TG GG GG GS SE EA AF FF	KLGGALQAK
19401	CA AV VG GS SI IY YN NQ QG GG GK KL LI IF	CA AS SS SL LR RD DG GS SE EA AF FF	RAKFKQLL
34653	CV VV VP PA AR RR RA AG GT TA AL LI IF	CA AS SS SL LR RE EP PG GL LS SG GN NT TI IY YF	KLGGALQAK
26522	CA AL LS SE EA AL LQ QG GG GS SE EK KL LV VF	CS SA AT TH HL LE EL LT TT TD DT TQ QY YF	KLGGALQAK
26474	CA AV VL LD DS SN NY YQ QL LI IW	CS SA AR RG GL LA AD DP PY YE EQ QY YF	KLGGALQAK
36280	CA AV VN NW WE EE EQ QG GG GS SY YI IP PT TF	CS SA AP PP PL LA AG GG GV VD DT TQ QY YF	KLGGALQAK
10357	CA AG GE EG GN NN NN ND DM MR RF	CA AS SS SF FS SG GN NT TG GE EL LF FF	RAKFKQLL
35216	CV VV VS SD DL LG GS SQ QG GN NL LI IF	CA AS SS SF FP PS SV VS SY YE EQ QY YF	KLGGALQAK
6240	CA AV VG GA AG GG GG GS SQ QG GN NL LI IF	CA AS SS SM MR RA AS SV VE EQ QF FF	GILGFVFTL
35541	CA AG GE EW WQ QG GN NT TP PL LV VF	CS SV VD DL LE EA AN NY YG GY YT TF	KLGGALQAK
33289	CA AT TG GL LT TG GG GG GN NK KL LT TF	CA AS SS SI IR RS SS SY YE EQ QY YF	GILGFVFTL
29967	CA AG GA AG GG GT TA AS SK KL LT TF	CA AS SS SI IG GA AY YG GY YT TF	GILGFVFTL
34949	CA AA AI IR RH HG GN NQ QF FY YF	CA AS SS SL LV VG GG GG GT TD DT TQ QY YF	KLGGALQAK
23405	CA AF FM MK KH HV VS SS SG GG GS SN NY YK KL LT TF	CA AS SS SP PH HF FQ QV VD DT TG GE EL LF FF	RAKFKQLL
5392	CA AA AD DN NY YG GG GS SQ QG GN NL LI IF	CA AS SS SG GL LN NE EQ QF FF	GILGFVFTL
28444	CA AV VR RD DS SN NY YQ QL LI IW	CA AS SS SA AS SG GG GA AD DT TQ QY YF	KLGGALQAK
22309	CA AD DS SG GG GG GA AD DG GL LT TF	CA AS SS SL LT TE EG GG GR RN NQ QP PQ QH HF	RAKFKQLL
17995	CA AA AS SG GQ QN NT TD DK KL LI IF	CA AS SS SV VE EA AV VP PE ET TQ QY YF	KLGGALQAK
5622	CA AY YS SP PA AA AG GG GT TS SY YG GK KL LT TF	CA AS SS SI IG GL LY YG GY YT TF	GILGFVFTL
31489	CA AF FM MK KG GA AG GG GT TS SY YG GK KL LT TF	CA AS SS SP PT TS SN NT TE EA AF FF	GILGFVFTL
13455	CA AA AS SE ET TS SY YD DK KV VI IF	CA AS SS SF FS SG GN NT TG GE EL LF FF	GILGFVFTL
23017	CA AE EV VF	CA AS SS SL LG GG GG GN NN NE EQ QF FF	IVTDFSVIK
30575	CA AG GA AI IG GS SS SN NT TG GK KL LI IF	CA AS SS SI IR RS SS SY YE EQ QY YF	GILGFVFTL
34603	CA AV VY YQ QG GG GK KL LI IF	CA AS SS SF FG GG GQ QL LY YE EQ QY YF	KLGGALQAK
35402	CA AV VD DR RS SG GG GS SN NY YK KL LT TF	CS SA AF FR RR RG GM MN NT TE EA AF FF	KLGGALQAK
34589	CA AV VS SD DH HT TN NA AG GK KS ST TF	CA AS SK KI IV VD DE EV VG GA AL LH HF	KLGGALQAK
24309	CA AV VN NA AV VD DN NY YG GQ QN NF FV VF	CA AS SS SK KD DS SS ST TD DT TQ QY YF	KLGGALQAK
30795	CA AA AS SE ER RN NN NN NA AR RL LM MF	CA AS SS SI IR RS SS SY YE EQ QY YF	GILGFVFTL
25249	CA AV VR RF FN ND DY YK KL LS SF	CA AS SS SP PP PG GL LV VG GG GE EL LF FF	GLCTLVAML
34400	CA AV VR RP PG GY YA AL LN NF	CA AS SS SV VE EA AG GL LS SY YT TF	KLGGALQAK
35687	CA AM MS SA AG GN NN NN ND DM MR RF	CA AS SS SD DR RD DR RV VE EQ QY YF	KLGGALQAK
2243	CP PP PS SS SG GG GY YN NK KL LI IF	CA AS SS SF FW WG GR RT TG GE EL LF FF	ELAGIGILTV
93	CA AA AS SA AG GG GT TS SY YG GK KL LT TF	CA AS SS SP PS ST TG GG GV VY YG GY YT TF	KLGGALQAK
34522	CA AM MR RE EG GM MF FS SG GG GY YN NK KL LI IF	CA AS SS SL LR RS SE EG GP PT TY YE EQ QY YF	KLGGALQAK
35103	CG GS SG GD DY YK KL LS SF	CA AS SM MA AV VG GA AN NV VL LT TF	ELAGIGILTV
695	CV VV VN NP PN NN NA AG GN NM ML LT TF	CA AS SS SL LS SG GY YE EQ QY YF	KLGGALQAK
7236	CA AV VG GD DN NY YG GG GS SQ QG GN NL LI IF	CA AS SR RI IG GY YT TE EA AF FF	AVFDRKSDAK
34127	CA AV VS SG GG GN NQ QG GG GK KL LI IF	CA AS SS SE EQ QG GL LD DT TQ QY YF	KLGGALQAK
35743	CA AV VR RR RS SN ND DY YK KL LS SF	CA AS ST TP PL LR RL LM MN NT TG GE EL LF FF	KLGGALQAK
36017	CA AM MR RE EH HY YG GG GS SQ QG GN NL LI IF	CA AS SS SQ QK KG GS SG GV VY YT TF	KLGGALQAK
34229	CA AG GQ QS SG GN NQ QF FY YF	CA AS SS SS SV VQ QG GT TG GY YG GY YT TF	KLGGALQAK
16980	CA AV VE EI ID DD DK KI II IF	CA AS SS SP PI IS SG GS SS SY YE EQ QY YF	KLGGALQAK
31892	CA AL LN NY YG GG GS SQ QG GN NL LI IF	CA AS SS SV VR RS ST TD DT TQ QY YF	GILGFVFTL
34645	CI IL LR RN NA AG GG GT TS SY YG GK KL LT TF	CA AS SS SL LM MG GG GG GE EQ QY YF	KLGGALQAK
57	CA AS SI IA AG GT TY YK KY YI IF	CA AS SS SF FS SG GN NT TG GE EL LF FF	RAKFKQLL
34078	CA AF FE ET TS SY YD DK KV VI IF	CA AS SS SP PL LS SP PG GE EN NS SN NQ QP PQ QH HF	KLGGALQAK
23818	CA AY YS SG GD DN NS SK KL LT TF	CA AS SS SS SR RL LG GR RY YN NE EK KL LF FF	RAKFKQLL
4937	CA AA AT TP PS SG GG GG GA AD DG GL LT TF	CA AS SS SF FT TL LA AA AY YS SN NQ QP PQ QH HF	KLGGALQAK
24788	CA AM MK KS ST TN NA AG GK KS ST TF	CA AS SS SL LG GV VA AG GT TN NT TG GE EL LF FF	KLGGALQAK
8924	CA AS SV VG GM MD DS SS SY YK KL LI IF	CA AS SS SF FS SG GN NT TG GE EL LF FF	RAKFKQLL
4943	CA AY YW WT TN NR RD DD DK KI II IF	CA AS SS SL LH HR RS SS SS SS SY YE EQ QY YF	IVTDFSVIK
34009	CA AG GQ QL LG GR RY YN NT TD DK KL LI IF	CA AT TS SD DL LP PG GA AY YN NE EQ QF FF	KLGGALQAK
16943	CA AG GA AG GD DG GG GS SQ QG GN NL LI IF	CA AS SS SQ QE EW WL LA AV VS ST TD DT TQ QY YF	GILGFVFTL
21942	CG GI II IT TG GT TA AS SK KL LT TF	CA AS SS SL LR RD DG GS SE EA AF FF	RAKFKQLL
32526	CA AV VK KE EN NE EK KL LT TF	CA AS SS SI IR RS SA AY YE EQ QY YF	GILGFVFTL
36074	CI IL LR RD DP PS ST TD DS SW WG GK KL LQ QF	CA AS SS SG GT TE ER RE EG GL LT TY YE EQ QY YF	KLGGALQAK
276	CA AV VE ES SG GT TY YK KY YI IF	CA AS SS SA AD DR RG GG GD DE EQ QY YF	RAKFKQLL
35439	CA AP PA AA AG GG GT TS SY YG GK KL LT TF	CS SA AR RG GL LE EE ET TQ QY YF	KLGGALQAK
36288	CA AV VR RV VR RR RQ QL LT TF	CS SA AR RV VS SG GT TS SG GS SS SN NE EQ QY YF	KLGGALQAK
14678	CA AV VN NL LG GG GG GS SQ QG GN NL LI IF	CA AS SS SQ QQ QW WE EE ET TQ QY YF	GILGFVFTL
34909	CA AV VA AN NY YG GG GA AT TN NK KL LI IF	CA AS SS SS SD DR RE EP PG GN NT TI IY YF	KLGGALQAK
14627	CA AV VK KR RT TT TD DS SW WG GK KL LQ QF	CA AI IP PG GL LP PP PE ET TQ QY YF	IVTDFSVIK
35734	CA AA AL LS SN NF FG GN NE EK KL LT TF	CA AS SS SY YP PR RV VG GS SK KN NI IQ QY YF	KLGGALQAK
3582	CA AV VG GA AG GT TA AL LI IF	CA AS SS SW WG GG GG GS SH HY YG GY YT TF	IVTDFSVIK
35000	CA AA AS SS SG GI IA AD DR RG GS ST TL LG GR RL LY YF	CA AS SS SR RW WT TG GV VE EE EQ QY YV	KLGGALQAK
34054	CA AA AH HS SG GT TY YK KY YI IF	CA AS SS SF FG GS SQ QE ET TQ QY YF	KLGGALQAK
35275	CA AA AL LN NN NA AG GN NM ML LT TF	CA AS SS SY YL LD DG GA AG GP PE EA AF FF	KLGGALQAK
34305	CA AI IM MD DS SN NY YQ QL LI IW	CA AS SS SP PR RT TG GD DT TG GE EL LF FF	KLGGALQAK
22990	CA AV VR RG GV VH HQ QA AG GT TA AL LI IF	CA AS SS SP PN NS SN NQ QP PQ QH HF	KLGGALQAK
34996	CA AV VR RD DM MY YN NA AR RL LM MF	CA AS SS SP PP PG GQ QL LS SY YE EQ QY YF	KLGGALQAK
5464	CA AV VA AL LW WG GG GY YN NK KL LI IF	CA AS SS SR RV VS SE EG GR RN NT TE EA AF FF	IVTDFSVIK
34166	CI IV VR RD DH HN NY YG GQ QN NF FV VF	CA AS SS SQ QD DF FS SG GA AI IM MN NT TE EA AF FF	KLGGALQAK
31952	CA AA AS SA AS SG GG GQ QF FY YF	CA AS SR RA AG GR RE EA AF FF	GILGFVFTL
4932	CA AV VR RD DV VV VS SG GS SA AR RQ QL LT TF	CA AS SR RL LD DG GT TS SS SH HE EQ QY YF	KLGGALQAK
5115	CA AA AT TN NT TN NA AG GK KS ST TF	CA AS SS SP PT TT TG GE ED DN NE EQ QF FF	RAKFKQLL
63	CA AA AG GA AR RA AG GG GT TS SY YG GK KL LT TF	CA AS SS SG GG GL LA AG GA AP PY YE EQ QY YF	KLGGALQAK
35097	CA AA AS SA AR RD DN ND DM MR RF	CA AS SS SQ QL LG GQ QG GH HT TE EA AF FF	KLGGALQAK
24652	CA AV VP PN NY YG GQ QN NF FV VF	CA AS SS SS SR RG GG GQ QE ET TQ QY YF	RAKFKQLL
35358	CA AV VL LD DS SN NY YQ QL LI IW	CS SA AR RD DP PG GS SN NY YN NE EQ QF FF	KLGGALQAK
26490	CA AM MR RE EA AY YG GG GS SQ QG GN NL LI IF	CS SA AR RS SK KD DS SR RY YE EQ QY YF	RAKFKQLL
5426	CA AA AR RP PN NY YG GG GS SQ QG GN NL LI IF	CA AS SS SY YP PG GL LA AE EA AF FF	KLGGALQAK
5427	CV VV VS SV VY YS SG GG GG GA AD DG GL LT TF	CA AS SS SY YR RP PG GQ QY YT TE EA AF FF	IVTDFSVIK
38422	CA AM MR RE ET TY YN NF FN NK KF FY YF	CA AS SS SY YS SP PD DY YN NS SP PL LH HF	KLGGALQAK
223	CA AM MR RE EG GL LG GT TG GR RR RA AL LT TF	CA AS SS SQ QE EV VS SS SG GG GS SN NE EQ QF FF	AVFDRKSDAK
36049	CA AV VG GE EN NQ QG GG GK KL LI IF	CA AT TS SD DS SG GG GS SS SY YN NE EQ QF FF	KLGGALQAK
23124	CA AV VV VG GE EG GG GY YQ QK KV VT TF	CA AS SS SY YN NS SY YE EQ QY YF	KLGGALQAK
13152	CA AV VS SG GG GS SN NY YK KL LT TF	CA AS SS SF FS SG GN NT TG GE EL LF FF	RAKFKQLL
15322	CA AE ES SL LW WD DD DK KI II IF	CA AS SS SQ QG GA AG GI IG GR RT TD DT TQ QY YF	RAKFKQLL
123	CA AL LS SE EG GR RN NN NA AR RL LM MF	CA AS SS SE EG GG GQ QG GD DL LW WN NS SP PL LH HF	RAKFKQLL
34735	CA AG GP PN NS SR RY YQ QL LI IW	CA AS SN NG GG GE ET TN NT TG GE EL LF FF	KLGGALQAK
20756	CA AG GE EL LT TP PT TS SS SS SL	CA AS SS SL LR RD DG GS SE EA AF FF	RAKFKQLL
19220	CA AV VS SG GY YS ST TL LT TF	CA AS SS SL LR RD DG GS SE EA AF FF	RAKFKQLL
6598	CA AA AS SG GG GG GS SQ QG GN NL LI IF	CA AS SS SG GR RS SQ QE ET TQ QY YF	GILGFVFTL
34570	CV VV VS SA AL LG GY YG GN NT TG GK KL LI IF	CA AT TS SR RG GP PT TS SG GT TG GS SA AK KN NI IQ QY YF	KLGGALQAK
34741	CA AA AN NI IG GG GG GS SN NY YK KL LT TF	CA AS SS SF FG GT TR RG GG GM MS SD DT TQ QY YF	KLGGALQAK
5129	CA AV VN NQ QG GQ QG GA AQ QK KL LV VF	CA AW WS SL LP PG GL LS SY YE EQ QY YF	ELAGIGILTV
6946	CA AV VQ QA AF FV VE EE ET TS SG GS SR RL LT TF	CA AS SS SI IR RS SS SY YE EQ QY YF	GILGFVFTL
34204	CA AG GP PN NS SG GG GG GA AD DG GL LT TF	CA AS SS SQ QH HT TE EF FY YH HE EQ QF FF	KLGGALQAK
28870	CA AM MS SS SS SF FQ QK KL LV VF	CA AS SS SY YP PP PR RT TG GY YG GT TD DT TQ QY YF	KLGGALQAK
28283	CA AM MT TG GS SG GG GS SN NY YK KL LT TF	CS SV VG GT TG GD DY YE EQ QY YF	RAKFKQLL
32525	CA AG GA AA AG GS SS SN NT TG GK KL LI IF	CA AS SS SI IR RS SA AY YE EQ QY YF	GILGFVFTL
25074	CA AD DS SG GG GG GA AD DG GL LT TF	CA AS SS SL LF FT TD DT TQ QY YF	RAKFKQLL
5501	CA AV VG GG GG GK KL LI IF	CA AS SN NK KG GM MN NQ QP PQ QH HF	ELAGIGILTV
27097	CA AT TD DS SG GG GS SN NY YK KL LT TF	CS SV VG GA AG GE ED DD DE EQ QY YF	RAKFKQLL
34840	CA AA AP PQ QE EY YG GN NK KL LV VF	CA AS SS SP PG GL LA AT TY YE EQ QY YF	KLGGALQAK
28863	CA AV VM MD DS SS SY YK KL LI IF	CA AS SS SG GQ QE EQ QE ET TQ QY YF	KLGGALQAK
2402	CA AV VR RD DS SS SS SA AS SK KI II IF	CA AS ST TE ET TR RS SD DA AD DT TQ QY YF	KLGGALQAK
23888	CA AD DS SG GG GG GA AD DG GL LT TF	CA AS SS SL LG GQ QG GA AV VN NE EK KL LF FF	RAKFKQLL
14318	CA AG GQ QL LG GA AQ QK KL LV VF	CA AS SL LQ QY YP PG GN NT TI IY YF	KLGGALQAK
34169	CA AT TV VD DM MN NR RD DD DK KI II IF	CA AS SS SQ QD DL LS SV VK KL LA AR RE ES ST TD DT TQ QY YF	KLGGALQAK
32368	CA AF FM MK KG GA AG GG GT TS SY YG GK KL LT TF	CA AS SS SI IG GS SY YG GY YT TF	GILGFVFTL
35949	CV VV VN NT TG GD DT TG GR RR RA AL LT TF	CA AS ST TG GW WE EM MN NT TE EA AF FF	KLGGALQAK
36293	CA AA AP PN NS SG GN NT TP PL LV VF	CS SV VD DA AS SG GG GY YN NE EQ QF FF	IVTDFSVIK
35391	CV VV VN NK KG GG GN NA AG GN NM ML LT TF	CS SA AY YR RD DS SY YN NE EQ QF FF	KLGGALQAK
35818	CA AV VN NS SW WY YG GG GA AT TN NK KL LI IF	CA AS SS SD DP PT TS SG GG GY YN NE EQ QF FF	KLGGALQAK
9203	CA AA AF FD DF FN NK KF FY YF	CA AS SS SF FS SG GN NT TG GE EL LF FF	RAKFKQLL
28472	CA AV VG GA AT TG GN NQ QF FY YF	CA AS SS SS SG GA AG GG GL LA AD DT TQ QY YF	RAKFKQLL
33422	CA AG GD DY YG GG GS SQ QG GN NL LI IF	CA AS SS SI IY YS SN NQ QP PQ QH HF	GILGFVFTL
17581	CA AL LS SP PG GG GG GS SQ QG GN NL LI IF	CA AS SS SS SG GL LV VS SN NT TG GE EL LF FF	GILGFVFTL
21370	CA AV VE EG GP PT TD DS SW WG GK KF FQ QF	CA AS SS SL LR RD DG GS SE EA AF FF	RAKFKQLL
14516	CA AY YR RS SK KE ET TS SG GS SR RL LT TF	CA AS SS SP PP PG GG GG GN NT TG GE EL LF FF	RAKFKQLL
18109	CA AD DS SG GG GG GA AD DG GL LT TF	CA AS SS SL LG GG GG GG GT TY YN NE EQ QF FF	RAKFKQLL
112	CA AL LD DS SN NY YQ QL LI IW	CA AS SR RR RQ QG GN NE EK KL LF FF	KLGGALQAK
23375	CA AV VG GT TA AR RL LM MF	CA AS SS SP PH HF FQ QV VD DT TG GE EL LF FF	RAKFKQLL
33490	CA AG GA AG GG GG GS SQ QG GN NL LI IF	CA AS SS SM MR RS SA AD DT TQ QY YF	GILGFVFTL
124	CA AV VG GG GS SA AR RQ QL LT TF	CA AS SS SE EG GQ QT TG GN NT TI IY YF	ELAGIGILTV
26032	CA AV VR RW WR RY YN NN NN ND DM MR RF	CA AA AE ED DP PE EW WG GA AE EA AF FF	KLGGALQAK
24496	CA AT TD DG GG GG GG GS SQ QG GN NL LI IF	CA AS SS SL LG GT TS SG GG GT TG GE EL LF FF	RAKFKQLL
25391	CP PR RG GN NA AG GN NM ML LT TF	CA AS SS SL LA AL LG GD DS SP PL LH HF	RAKFKQLL
34547	CA AL LT TG GT TY YK KY YI IF	CA AS SS SL LP PT TS SG GG GD DT TQ QY YF	KLGGALQAK
17966	CA AA AT TD DN NN NA AR RL LM MF	CA AS SS SV VA AV VG GT TG GS SG GA AN NV VL LT TF	KLGGALQAK
33995	CA AG GA AT TD DS SN NY YQ QL LI IW	CA AT TS SE EG GY YT TG GE EL LF FF	KLGGALQAK
29908	CI IL LR RE EF FY YN ND DM MR RF	CA AS SS SA AR RS SS SY YE EQ QY YF	GILGFVFTL
28735	CA AV VN NI IE EG GY YQ QK KV VT TF	CA AS SS SD DS SS SG GG GL LY YN NE EQ QF FF	GILGFVFTL
35865	CA AA AS SR RE EK KL LT TF	CA AS SS SI IL LG GG GG GY YN NE EQ QF FF	KLGGALQAK
25905	CA AA AT TW WG GG GS SN NY YK KL LT TF	CA AS SS SS SR RD DG GG GT TD DT TQ QY YF	KLGGALQAK
11336	CA AA AM ME ET TS SY YD DK KV VI IF	CA AS SS SF FS SG GN NT TG GE EL LF FF	RAKFKQLL
31745	CA AY YR RS SQ QQ QG GG GS SE EK KL LV VF	CA AS SS ST TR RS SS SY YE EQ QY YF	GILGFVFTL
23001	CA AG GL LN ND DY YK KL LS SF	CA AS SR RP PD DS SY YN NE EQ QF FF	KLGGALQAK
36179	CA AA AS SK KG GN NN NA AR RL LM MF	CA AS SS SL LL LG GQ QK KA AF FF	KLGGALQAK
31942	CA AA AS SG GS SS SN NA AG GN NM ML LT TF	CA AS SR RA AG GR RE EA AF FF	GILGFVFTL
33903	CA AE EN NE ED DT TD DK KL LI IF	CA AS SS SP PG GQ QG GI IA AG GE EL LF FF	KLGGALQAK
