34230	CAS ASS SSW SWE WEG EGN GNT NTE TEA EAF AFF	ELAGIGILTV
22991	CAS AST STP TPD PDW DWG WGG GGT GTY TYE YEQ EQY QYF	KLGGALQAK
35053	CAS ASS SSL SLG LGQ GQD QDG DGY GYT YTF	KLGGALQAK
30421	CAS ASS SSI SIR IRA RAS ASY SYE YEQ EQY QYF	GILGFVFTL
35752	CAS ASS SSP SPF PFN FNT NTE TEA EAF AFF	KLGGALQAK
32921	CAS ASS SSI SIR IRS RSS SSY SYE YEQ EQY QYF	GILGFVFTL
35681	CAS ASN SNQ NQP QPG PGQ GQG QGG GGF GFR FRL RLF LFF	KLGGALQAK
30412	CAS ASS SSI SIR IRA RAS ASY SYE YEQ EQY QYF	GILGFVFTL
34333	CAS ASS SSQ SQG QGR GRT RTG TGY GYN YNE NEQ EQF QFF	KLGGALQAK
34452	CAS ASI SIA IAG AGP GPG PGT GTG TGG GGE GEK EKL KLF LFF	KLGGALQAK
2476	CAS ASS SSD SDD DDG DGM GMN MNT NTE TEA EAF AFF	AVFDRKSDAK
6765	CAS ASS SSI SIR IRS RSS SSY SYE YEQ EQY QYF	GILGFVFTL
5799	CAS ASS SSI SIR IRS RSG SGY GYE YEQ EQY QYF	GILGFVFTL
33167	CAS ASS SSI SIR IRS RSS SSY SYE YEQ EQY QYF	GILGFVFTL
2330	CAS ASS SSA SAG AGG GGG GGG GGQ GQY QYF	ELAGIGILTV
35735	CAS ASS SSY SYS YSL SLG LGG GGG GGN GNT NTI TIY IYF	ELAGIGILTV
2242	CAS ASS SSF SFR FRL RLA LAG AGT GTG TGE GEL ELF LFF	ELAGIGILTV
1233	CAS ASS SSL SLY LYS YSA SAT ATG TGE GEL ELF LFF	AVFDRKSDAK
34780	CAS ASS SSL SLW LWE WEG EGR GRS RSY SYN YNE NEQ EQF QFF	KLGGALQAK
36117	CAS ASS SSP SPT PTG TGG GGN GNT NTE TEA EAF AFF	KLGGALQAK
6610	CAS ASS SSI SIG IGL GLY LYG YGY GYT YTF	GILGFVFTL
35720	CAS ASS SSY SYK YKA KAN ANT NTG TGE GEL ELF LFF	KLGGALQAK
811	CAS ASS SSL SLY LYS YSA SAT ATG TGE GEL ELF LFF	AVFDRKSDAK
5320	CAS ASS SSL SLG LGS GSY SYE YEQ EQY QYF	KLGGALQAK
25382	CAS ASS SSG SGS GSS SSR SRT RTP TPN PNT NTE TEA EAF AFF	GLCTLVAML
16980	CAS ASS SSP SPI PIS ISG SGS GSS SSY SYE YEQ EQY QYF	KLGGALQAK
23891	CAS ASS SSL SLG LGY GYG YGG GGA GAG AGE GET ETQ TQY QYF	KLGGALQAK
28933	CAA AAS ASS SSR SRS RST STD TDT DTQ TQY QYF	GILGFVFTL
179	CAS ASS SSQ SQD QDQ DQG QGQ GQD QDT DTE TEA EAF AFF	KLGGALQAK
27746	CSV SVG VGS GSG SGD GDY DYE YEQ EQY QYF	RAKFKQLL
7065	CAS ASS SSI SIR IRS RST STY TYE YEQ EQY QYF	GILGFVFTL
35320	CAW AWK WKL KLL LLV LVS VST STG TGE GEL ELF LFF	KLGGALQAK
16939	CAS ASS SSL SLP LPG PGT GTV TVQ VQE QET ETQ TQY QYF	GLCTLVAML
26487	CSA SAR ARS RSE SET ETG TGN GNT NTI TIY IYF	GLCTLVAML
9392	CAS ASS SSF SFS FSG SGN GNT NTG TGE GEL ELF LFF	RAKFKQLL
34599	CAS ASR SRW RWT WTG TGG GGD GDT DTE TEA EAF AFF	KLGGALQAK
152	CAS ASS SSQ SQD QDP DPP PPG PGG GGG GGR GRA RAD ADT DTQ TQY QYF	RAKFKQLL
7280	CAS ASK SKS KSG SGL GLG LGG GGT GTT TTE TEA EAF AFF	GILGFVFTL
35486	CSV SVA VAG AGT GTS TSG SGR GRG RGP GPD PDT DTQ TQY QYF	ELAGIGILTV
34639	CAS ASS SSL SLI LIE IEN ENT NTE TEA EAF AFF	KLGGALQAK
14318	CAS ASL SLQ LQY QYP YPG PGN GNT NTI TIY IYF	KLGGALQAK
26258	CSA SAR ARD RDL DLP LPS PSG SGG GGD GDN DNE NEQ EQF QFF	KLGGALQAK
31460	CAS ASS SSP SPR PRS RSS SSQ SQP QPQ PQH QHF	GILGFVFTL
4974	CAS ASS SSL SLL LLA LAG AGV GVS VSA SAD ADT DTQ TQY QYF	RAKFKQLL
35509	CSV SVD VDL DLE LEA EAN ANY NYG YGY GYT YTF	AVFDRKSDAK
34741	CAS ASS SSF SFG FGT GTR TRG RGG GGM GMS MSD SDT DTQ TQY QYF	KLGGALQAK
2254	CAS ASS SSL SLR LRD RDG DGS GSE SEA EAF AFF	RAKFKQLL
3502	CAS ASS SSW SWG WGG GGG GGS GSH SHY HYG YGY GYT YTF	IVTDFSVIK
28468	CAS ASS SSL SLR LRF RFP FPD PDI DIG IGE GEQ EQY QYF	RAKFKQLL
4130	CAS ASS SSW SWG WGG GGG GGS GSH SHY HYG YGY GYT YTF	IVTDFSVIK
33505	CAS ASS SSP SPL PLS LST STD TDT DTQ TQY QYF	GILGFVFTL
35214	CAS ASS SSF SFL FLT LTA TAE AEN ENT NTE TEA EAF AFF	KLGGALQAK
17581	CAS ASS SSS SSG SGL GLV LVS VSN SNT NTG TGE GEL ELF LFF	GILGFVFTL
34304	CAS ASS SSP SPR PRP RPS PSG SGG GGH GHS HST STD TDT DTQ TQY QYF	KLGGALQAK
34797	CAN ANR NRE REG EGG GGT GTD TDT DTQ TQY QYF	KLGGALQAK
36097	CAS ASS SSQ SQS QSG SGT GTY TYN YNS NSP SPL PLH LHF	KLGGALQAK
35273	CAS ASS SSV SVG VGG GGA GAD ADT DTQ TQY QYF	KLGGALQAK
2306	CAT ATS TSR SRD RDR DRG RGH GHG HGD GDT DTI TIY IYF	KLGGALQAK
32604	CAS ASS SSI SIR IRS RSS SSD SDT DTQ TQY QYF	GILGFVFTL
35108	CAS ASS SSL SLE LEP EPS PSY SYE YEQ EQY QYF	KLGGALQAK
22342	CAS ASS SSS SST STL TLY LYG YGS GSY SYN YNE NEQ EQF QFF	RAKFKQLL
34216	CAS ASS SSQ SQT QTL TLA LAG AGG GGP GPW PWE WET ETQ TQY QYF	KLGGALQAK
34236	CAS ASS SSQ SQG QGL GLA LAD ADN DNN NNE NEQ EQF QFF	KLGGALQAK
35940	CAS ASS SST STT TTS TSG SGG GGL GLD LDT DTQ TQY QYF	KLGGALQAK
25463	CAS ASS SSL SLV LVG VGG GGT GTD TDE DEK EKL KLF LFF	RAKFKQLL
23818	CAS ASS SSS SSR SRL RLG LGR GRY RYN YNE NEK EKL KLF LFF	RAKFKQLL
2367	CAS ASS SSL SLL LLR LRT RTG TGG GGN GNE NEQ EQY QYF	KLGGALQAK
21756	CAS ASS SSL SLR LRD RDG DGS GSE SEA EAF AFF	RAKFKQLL
31557	CAS ASS SSS SSQ SQG QGA GAN ANE NEK EKL KLF LFF	RAKFKQLL
2503	CAI AIS ISE SES ESA SAT ATV TVS VSY SYG YGY GYT YTF	ELAGIGILTV
33469	CAS ASS SSL SLD LDS DSS SSY SYE YEQ EQY QYF	KLGGALQAK
7367	CAS ASG SGS GSS SSE SES ESG SGD GDQ DQP QPQ PQH QHF	RAKFKQLL
34945	CAS ASS SSL SLS LSG SGG GGG GGS GSY SYE YEQ EQY QYF	KLGGALQAK
23373	CAS ASS SSL SLY LYS YSP SPL PLA LAY AYS YSW SWN WNE NEK EKL KLF LFF	KLGGALQAK
32270	CAS ASS SSG SGR GRS RST STD TDT DTQ TQY QYF	GILGFVFTL
34621	CAS ASS SSH SHG HGW GWL WLA LAG AGG GGE GED EDT DTQ TQY QYF	KLGGALQAK
668	CAS ASS SSF SFS FSL SLS LSG SGG GGY GYT YTF	ELAGIGILTV
18089	CAS ASS SST STD TDR DRA RAA AAQ AQP QPQ PQH QHF	KLGGALQAK
23845	CAS ASS SSA SAG AGT GTG TGR GRV RVE VET ETQ TQY QYF	KLGGALQAK
18000	CAS ASS SSV SVN VNP NPG PGL GLR LRG RGG GGT GTD TDT DTQ TQY QYF	KLGGALQAK
36310	CAS ASS SSL SLG LGP GPG PGS GSP SPL PLH LHF	ELAGIGILTV
18240	CAS ASS SSL SLR LRD RDG DGS GSE SEA EAF AFF	RAKFKQLL
27875	CSV SVG VGS GSG SGE GED EDS DSP SPQ PQY QYF	RAKFKQLL
36000	CAS ASS SSP SPP PPL PLI LIW IWD WDA DAG AGE GEL ELF LFF	KLGGALQAK
35215	CAS ASS SSF SFN FNG NGA GAP APD PDH DHG HGY GYT YTF	KLGGALQAK
5380	CAS ASS SSG SGT GTQ TQP QPG PGL GLG LGG GGE GEQ EQF QFF	ELAGIGILTV
6858	CAS ASS SSI SIR IRS RSS SSY SYE YEQ EQY QYF	GILGFVFTL
162	CAS ASS SSQ SQQ QQQ QQG QGY GYG YGT GTE TEA EAF AFF	KLGGALQAK
28472	CAS ASS SSS SSG SGA GAG AGG GGL GLA LAD ADT DTQ TQY QYF	RAKFKQLL
218	CAS ASS SSQ SQE QEG EGE GES ESN SNY NYG YGY GYT YTF	KLGGALQAK
30423	CAS ASS SSI SIR IRS RSA SAY AYE YEQ EQY QYF	GILGFVFTL
34865	CAS ASS SSS SSF SFL FLA LAG AGA GAK AKT KTQ TQY QYF	KLGGALQAK
31367	CAS ASS SSI SIY IYS YSN SNQ NQP QPQ PQH QHF	GILGFVFTL
2405	CAS AST STR TRV RVG VGG GGD GDY DYG YGY GYT YTF	KLGGALQAK
28735	CAS ASS SSD SDS DSS SSG SGG GGL GLY LYN YNE NEQ EQF QFF	GILGFVFTL
34122	CAS ASS SSE SEG EGR GRT RTL TLN LNQ NQP QPQ PQH QHF	KLGGALQAK
7369	CAS ASS SSK SKA KAN ANP NPG PGN GNT NTI TIY IYF	RAKFKQLL
24711	CAS ASS SSL SLG LGD GDF DFL FLR LRT RTD TDT DTQ TQY QYF	GILGFVFTL
2294	CAS ASS SSP SPL PLG LGA GAK AKN KNI NIQ IQY QYF	KLGGALQAK
5431	CAS ASS SSY SYS YSR SRF RFP FPY PYE YEQ EQY QYF	KLGGALQAK
5449	CAS ASS SSA SAY AYR YRD RDE DEK EKL KLF LFF	KLGGALQAK
33473	CAS ASS SSL SLR LRS RSS SSY SYE YEQ EQY QYF	GILGFVFTL
28400	CAS ASS SSL SLM LMR MRG RGG GGT GTY TYN YNS NSP SPL PLH LHF	RAKFKQLL
7213	CAS ASS SSV SVG VGS GSY SYG YGY GYT YTF	GILGFVFTL
33472	CAS ASS SSL SLG LGS GSY SYG YGY GYT YTF	GILGFVFTL
15299	CAS ASS SSP SPS PSE SEL ELA LAD ADT DTQ TQY QYF	ELAGIGILTV
28878	CAS AST STP TPL PLR LRG RGD GDR DRP RPY PYE YEQ EQY QYF	KLGGALQAK
3897	CAS ASS SSW SWG WGG GGG GGS GSH SHY HYG YGY GYT YTF	IVTDFSVIK
24692	CAS ASL SLI LIS ISG SGT GTD TDT DTQ TQY QYF	KLGGALQAK
23009	CAS ASS SSL SLA LAD ADE DEQ EQF QFF	RAKFKQLL
34742	CAS ASS SSF SFR FRP RPG PGE GEA EAG AGE GEL ELF LFF	KLGGALQAK
5527	CAS ASS SSY SYG YGQ GQG QGW GWG WGY GYT YTF	ELAGIGILTV
35255	CAS ASS SSP SPR PRP RPQ PQR QRG RGG GGY GYE YEQ EQY QYF	KLGGALQAK
4958	CAS ASS SSF SFM FMY MYQ YQS QSN SNS NSP SPL PLH LHF	KLGGALQAK
34161	CAS ASS SSP SPV PVT VTG TGF GFN FNQ NQP QPQ PQH QHF	KLGGALQAK
5109	CAS ASS SSL SLE LEG EGG GGN GNQ NQP QPQ PQH QHF	KLGGALQAK
33894	CAT ATS TST STG TGL GLW LWG WGY GYT YTF	GILGFVFTL
34566	CAT ATS TSQ SQP QPG PGV GVN VNT NTE TEA EAF AFF	KLGGALQAK
34623	CAS ASS SSL SLA LAG AGG GGG GGQ GQP QPQ PQH QHF	KLGGALQAK
2376	CAS ASS SSL SLS LSW SWN WNQ NQP QPQ PQH QHF	ELAGIGILTV
32392	CAS ASS SSI SIG IGV GVY VYG YGY GYT YTF	GILGFVFTL
23219	CAS ASS SSF SFQ FQG QGL GLG LGT GTE TEA EAF AFF	ELAGIGILTV
18643	CAS ASS SSL SLR LRD RDG DGS GSE SEA EAF AFF	GILGFVFTL
35729	CAS ASS SSY SYG YGA GAG AGE GEQ EQP QPQ PQH QHF	KLGGALQAK
28682	CAS ASS SSE SEL ELI LIG IGI GIR IRP RPG PGP GPA PAA AAT ATK TKF	KLGGALQAK
22988	CAS ASS SSL SLG LGT GTL TLP LPY PYE YEQ EQY QYF	KLGGALQAK
26510	CSA SAS ASE SEQ EQP QPY PYL YLQ LQT QTG TGY GYT YTF	KLGGALQAK
65	CAS ASS SSL SLA LAR ART RTE TED EDN DNY NYE YEQ EQY QYF	KLGGALQAK
15472	CAS ASS SSQ SQT QTR TRG RGA GAG AGN GNT NTI TIY IYF	RAKFKQLL
7175	CAS ASS SST STG TGG GGD GDR DRA RAG AGY GYN YNE NEQ EQF QFF	KLGGALQAK
31880	CAS ASS SSV SVR VRS RSS SSY SYE YEQ EQY QYF	GILGFVFTL
35707	CAS ASS SSV SVV VVG VGA GAN ANQ NQE QET ETQ TQY QYF	KLGGALQAK
708	CAS ASS SSL SLY LYR YRG RGA GAD ADT DTQ TQY QYF	KLGGALQAK
34272	CAS ASS SSQ SQE QEP EPD PDR DRE REG EGN GNY NYG YGY GYT YTF	KLGGALQAK
35958	CAS AST STT TTW TWD WDF DFN FNQ NQP QPQ PQH QHF	KLGGALQAK
35675	CSA SAG AGQ GQG QGA GAR ARR RRA RAF AFF	KLGGALQAK
25925	CAS ASS SSF SFQ FQG QGL GLV LVS VSS SSY SYN YNE NEQ EQF QFF	RAKFKQLL
2568	CAS ASS SSL SLG LGV GVA VAG AGT GTN TNT NTG TGE GEL ELF LFF	IVTDFSVIK
26210	CSA SAR ARA RAR ARR RRG RGE GEL ELT LTD TDT DTQ TQY QYF	KLGGALQAK
34012	CAT ATS TSD SDN DNQ NQG QGS GSL SLS LST STQ TQY QYF	KLGGALQAK
34265	CAS ASS SSQ SQD QDS DSG SGS GSA SAD ADT DTQ TQY QYF	KLGGALQAK
5608	CAS ASS SSI SIG IGL GLY LYG YGY GYT YTF	GILGFVFTL
22323	CAS ASS SSS SSE SEG EGQ GQV QVA VAK AKN KNI NIQ IQY QYF	RAKFKQLL
10407	CAS ASS SSF SFS FSG SGN GNT NTG TGE GEL ELF LFF	RAKFKQLL
35197	CAS ASK SKD KDG DGI GIS ISY SYE YEQ EQY QYF	KLGGALQAK
109	CAS ASR SRE RER ERE REG EGL GLA LAV AVY VYN YNE NEQ EQF QFF	ELAGIGILTV
24282	CAS ASS SSL SLL LLG LGV GVS VSA SAQ AQE QET ETQ TQY QYF	RAKFKQLL
2756	CAS ASS SSW SWG WGG GGG GGS GSH SHY HYG YGY GYT YTF	IVTDFSVIK
23897	CAS ASS SSL SLP LPD PDY DYN YNE NEQ EQF QFF	RAKFKQLL
34715	CAT ATI TIP IPT PTG TGS GST STD TDT DTQ TQY QYF	KLGGALQAK
28301	CSV SVQ VQG QGG GGA GAY AYN YNE NEQ EQF QFF	KLGGALQAK
30399	CAS ASS SSI SII IIA IAL ALD LDT DTQ TQY QYF	GILGFVFTL
5287	CSV SVP VPG PGT GTV TVY VYG YGY GYT YTF	KLGGALQAK
17966	CAS ASS SSV SVA VAV AVG VGT GTG TGS GSG SGA GAN ANV NVL VLT LTF	KLGGALQAK
36067	CAS ASS SST STL TLT LTI TIA IAT ATL TLD LDN DNE NEQ EQF QFF	KLGGALQAK
28451	CAS ASS SSD SDS DSG SGT GTS TSG SGG GGG GGA GAD ADT DTQ TQY QYF	KLGGALQAK
22309	CAS ASS SSL SLT LTE TEG EGG GGR GRN RNQ NQP QPQ PQH QHF	RAKFKQLL
23006	CAS ASS SSF SFN FNG NGV GVR VRE RET ETQ TQY QYF	KLGGALQAK
35648	CAS ASS SSW SWN WND NDR DRL RLQ LQS QSY SYE YEQ EQY QYF	KLGGALQAK
5188	CSA SAS ASE SEG EGA GAG AGE GEV EVY VYG YGY GYT YTF	KLGGALQAK
35467	CSS SSP SPG PGG GGP GPN PNE NEK EKL KLF LFF	KLGGALQAK
34799	CAS ASA SAS AST STG TGL GLA LAG AGG GGR GRL RLN LNT NTG TGE GEL ELF LFF	KLGGALQAK
5163	CSA SAR ARD RDL DLT LTA TAG AGS GSY SYE YEQ EQY QYF	GILGFVFTL
33930	CAS ASS SSH SHY HYF YFG FGT GTE TEA EAF AFF	KLGGALQAK
30401	CAS ASS SSI SII IIQ IQG QGH GHS HSY SYN YNS NSP SPL PLH LHF	KLGGALQAK
247	CAS ASS SSH SHL HLG LGG GGD GDR DRY RYM YMN MNE NEQ EQF QFF	IVTDFSVIK
34761	CAS ASS SSL SLG LGQ GQG QGV GVY VYE YEQ EQY QYF	KLGGALQAK
2290	CAS ASS SSL SLA LAW AWG WGG GGT GTD TDT DTQ TQY QYF	KLGGALQAK
31267	CAS ASS SSI SIR IRS RST STD TDT DTQ TQY QYF	GILGFVFTL
35303	CAS ASS SSR SRT RTG TGG GGT GTD TDT DTQ TQY QYF	KLGGALQAK
35161	CAS ASS SSL SLG LGT GTG TGG GGY GYN YNE NEQ EQF QFF	KLGGALQAK
5105	CAS AST STP TPP PPL PLA LAS ASG SGR GRY RYY YYE YEQ EQY QYF	KLGGALQAK
25441	CAS ASS SSL SLL LLG LGG GGP GPD PDT DTQ TQY QYF	RAKFKQLL
35734	CAS ASS SSY SYP YPR PRV RVG VGS GSK SKN KNI NIQ IQY QYF	KLGGALQAK
14187	CAS ASS SSS SSP SPQ PQG QGR GRE REL ELF LFF	KLGGALQAK
36226	CAS ASS SSP SPL PLP LPR PRL RLA LAG AGE GEE EET ETQ TQY QYF	KLGGALQAK
27120	CSV SVG VGS GSG SGD GDH DHG HGE GEQ EQF QFF	RAKFKQLL
5645	CAS ASS SSI SIG IGV GVY VYG YGY GYT YTF	GILGFVFTL
34229	CAS ASS SSS SSV SVQ VQG QGT GTG TGY GYG YGY GYT YTF	KLGGALQAK
34063	CAS ASS SSL SLL LLG LGG GGQ GQE QET ETQ TQY QYF	KLGGALQAK
34759	CAS ASS SSL SLG LGI GIM IMT MTA TAS AST STN TNE NEK EKL KLF LFF	KLGGALQAK
36021	CAS ASS SSQ SQV QVP VPG PGQ GQG QGP GPN PNY NYG YGY GYT YTF	KLGGALQAK
22993	CAS ASS SSL SLG LGG GGQ GQP QPQ PQH QHF	KLGGALQAK
34933	CAI AIS ISE SES ESW SWG WGG GGA GAE AEA EAF AFF	KLGGALQAK
25384	CAS ASS SSI SIG IGM GMG MGD GDW DWA WAF AFF	KLGGALQAK
35311	CAS ASS SSP SPG PGR GRN RNT NTG TGE GEL ELF LFF	KLGGALQAK
28363	CAS ASR SRV RVR VRG RGG GGT GTG TGA GAN ANV NVL VLT LTF	KLGGALQAK
7313	CAS ASS SSI SIR IRS RSG SGV GVE VEQ EQY QYF	GILGFVFTL
34246	CAS ASS SSP SPG PGT GTG TGD GDA DAY AYG YGY GYT YTF	KLGGALQAK
2284	CAS ASS SSL SLG LGS GSA SAE AEA EAF AFF	KLGGALQAK
35719	CAS ASS SSY SYG YGG GGQ GQR QRA RAS ASY SYE YEQ EQY QYF	KLGGALQAK
31359	CAS ASS SSI SIS ISS SST STG TGE GEL ELF LFF	GILGFVFTL
24428	CAS ASS SSL SLG LGT GTS TSG SGG GGT GTG TGE GEL ELF LFF	RAKFKQLL
34417	CAS ASS SSV SVI VIG IGS GSS SSN SNE NEQ EQF QFF	KLGGALQAK
23244	CAS ASS SSL SLS LSG SGN GNE NEQ EQF QFF	ELAGIGILTV
2421	CAS ASS SSL SLD LDG DGS GSN SNQ NQP QPQ PQH QHF	KLGGALQAK
35898	CAS ASS SSL SLP LPA PAQ AQS QSS SSG SGR GRF RFF FFY FYE YEQ EQF QFF	KLGGALQAK
171	CAS ASS SSL SLT LTG TGG GGA GAE AEA EAF AFF	ELAGIGILTV
24360	CAS ASS SSF SFY FYA YAG AGS GST STN TNE NEQ EQF QFF	RAKFKQLL
53	CAS ASS SSF SFS FSG SGN GNT NTG TGE GEL ELF LFF	RAKFKQLL
2572	CAS ASS SSL SLQ LQG QGT GTG TGA GAN ANV NVL VLT LTF	IVTDFSVIK
35953	CAS AST STP TPG PGQ GQT QTI TIT ITD TDT DTQ TQY QYF	KLGGALQAK
5554	CAS ASS SSA SAR ARS RSS SST STE TEQ EQY QYF	AVFDRKSDAK
24671	CAS ASS SSS SSR SRG RGG GGQ GQE QET ETQ TQY QYF	RAKFKQLL
35728	CAS ASS SSP SPG PGQ GQG QGY GYQ YQP QPQ PQH QHF	KLGGALQAK
30524	CAS ASS SSI SIR IRS RSS SSY SYE YEQ EQY QYF	GILGFVFTL
35621	CAS ASR SRE REP EPV PVG VGR GRN RNE NEQ EQF QFF	KLGGALQAK
34394	CAS ASS SSV SVD VDD DDG DGE GEY EYY YYN YNE NEQ EQF QFF	KLGGALQAK
23974	CAS ASG SGR GRL RLS LSY SYN YNE NEQ EQF QFF	RAKFKQLL
5522	CAS ASS SSW SWG WGQ GQG QGS GSP SPL PLH LHF	ELAGIGILTV
31630	CAS ASS SSS SSR SRS RST STD TDT DTQ TQY QYF	GILGFVFTL
28728	CAS ASS SSV SVG VGV GVT VTD TDT DTQ TQY QYF	KLGGALQAK
25075	CAS ASS SSL SLG LGG GGN GNN NNE NEQ EQF QFF	GLCTLVAML
208	CAS ASS SSQ SQD QDG DGG GGG GGY GYG YGY GYT YTF	RAKFKQLL
17577	CAS ASS SSS SSG SGL GLV LVS VSN SNT NTG TGE GEL ELF LFF	GLCTLVAML
35607	CAS AST STE TEG EGG GGH GHE HET ETQ TQY QYF	KLGGALQAK
34321	CAS ASS SSQ SQG QGR GRD RDR DRH RHG HGY GYT YTF	KLGGALQAK
193	CAS ASS SSQ SQR QRP RPS PSE SEV EVG VGE GEL ELF LFF	IVTDFSVIK
23238	CAS ASS SSL SLL LLS LSR SRT RTG TGE GEL ELF LFF	KLGGALQAK
36284	CSA SAR ARD RDR DRW RWA WAG AGT GTS TST STD TDT DTQ TQY QYF	IVTDFSVIK
29893	CAS ASS SSA SAR ARS RSS SSY SYE YEQ EQY QYF	GILGFVFTL
26150	CSA SAP APR PRG RGS GSP SPT PTN TNE NEK EKL KLF LFF	RAKFKQLL
4973	CAS ASS SSL SLK LKA KAR ARE REA EAY AYN YNS NSP SPL PLH LHF	KLGGALQAK
35876	CAS ASS SSI SIS ISG SGQ GQG QGT GTD TDT DTQ TQY QYF	KLGGALQAK
17003	CAS ASS SSP SPV PVT VTG TGS GSS SSY SYE YEQ EQY QYF	GLCTLVAML
31081	CAS ASS SSI SIR IRS RSS SSY SYE YEQ EQY QYF	GILGFVFTL
85	CAS ASS SSF SFL FLI LIG IGG GGN GNQ NQP QPQ PQH QHF	KLGGALQAK
26125	CSA SAF AFT FTG TGE GEG EGN GNT NTI TIY IYF	RAKFKQLL
2403	CAS AST STP TPG PGT GTS TSA SAY AYN YNE NEQ EQF QFF	KLGGALQAK
376	CAS ASS SSL SLR LRT RTG TGA GAP APH PHR HRY RYT YTF	KLGGALQAK
32602	CAS ASS SSI SIR IRS RSN SNQ NQP QPQ PQH QHF	GILGFVFTL
34708	CAS ASS SSY SYK YKQ KQG QGY GYE YEQ EQY QYF	KLGGALQAK
30405	CAS ASS SSI SIR IRA RAA AAY AYE YEQ EQY QYF	GILGFVFTL
34519	CAS ASS SSL SLE LEG EGE GEY EYA YAQ AQP QPQ PQH QHF	KLGGALQAK
35853	CAS ASS SSI SIG IGQ GQG QGQ GQS QSP SPL PLH LHF	KLGGALQAK
34300	CAS ASS SSP SPG PGE GEF EFE FEK EKL KLF LFF	KLGGALQAK
10497	CAS ASS SSF SFS FSG SGN GNT NTG TGE GEL ELF LFF	GILGFVFTL
36198	CAS ASS SSR SRD RDY DYS YSR SRT RTY TYE YEQ EQY QYF	KLGGALQAK
170	CAS ASS SSL SLE LEM EMG MGA GAG AGT GTE TEA EAF AFF	ELAGIGILTV
7353	CAS ASA SAP APD PDG DGF GFF FFY FYG YGY GYT YTF	KLGGALQAK
35856	CAS ASS SSI SIG IGT GTS TSG SGN GNN NNE NEQ EQF QFF	KLGGALQAK
35100	CAS ASS SSS SSR SRG RGE GEV EVR VRT RTD TDT DTQ TQY QYF	KLGGALQAK
12252	CAS ASS SSF SFS FSG SGN GNT NTG TGE GEL ELF LFF	RAKFKQLL
17155	CAS ASS SSY SYS YSG SGG GGA GAG AGE GEL ELF LFF	RAKFKQLL
28602	CAS ASS SSD SDD DDP DPG PGF GFG FGQ GQP QPQ PQH QHF	KLGGALQAK
24306	CAS ASN SNP NPA PAS ASG SGG GGE GEL ELF LFF	GILGFVFTL
2291	CAS ASS SSL SLF LFA FAG AGE GER ERS RSP SPL PLH LHF	KLGGALQAK
32336	CAS ASS SSI SIF IFG FGQ GQV QVD VDA DAF AFF	GILGFVFTL
5156	CSA SAR ARA RAT ATG TGK GKD KDT DTE TEA EAF AFF	IVTDFSVIK
26240	CSA SAR ARD RDF DFQ FQG QGL GLA LAY AYN YNE NEQ EQF QFF	KLGGALQAK
35732	CAS ASS SSY SYH YHM HMR MRN RNY NYE YEQ EQY QYF	KLGGALQAK
10554	CAS ASS SSF SFS FSG SGN GNT NTG TGE GEL ELF LFF	RAKFKQLL
23227	CAS ASS SSL SLA LAG AGA GAG AGG GGY GYT YTF	GILGFVFTL
97	CAS ASS SSP SPG PGK GKD KDR DRF RFS FSG SGN GNT NTI TIY IYF	KLGGALQAK
15086	CAS ASS SSL SLL LLW LWA WAE AEY EYN YNE NEQ EQF QFF	RAKFKQLL
35337	CAW AWS WSV SVL VLS LSY SYT YTD TDT DTQ TQY QYF	KLGGALQAK
34962	CAS ASS SSF SFT FTG TGP GPN PNT NTE TEA EAF AFF	KLGGALQAK
35191	CAS AST STP TPR PRE REA EAG AGD GDW DWY WYE YEQ EQF QFF	KLGGALQAK
5047	CAS ASS SSF SFL FLG LGD GDR DRD RDE DEQ EQY QYF	KLGGALQAK
27927	CSV SVG VGS GSG SGE GED EDS DSP SPQ PQY QYF	RAKFKQLL
17978	CAS ASS SSV SVD VDP DPT PTG TGG GGN GNY NYG YGY GYT YTF	KLGGALQAK
654	CAS ASK SKN KNP NPG PGT GTE TEI EIY IYE YEQ EQY QYF	KLGGALQAK
5506	CAS ASR SRT RTG TGG GGF GFE FEA EAF AFF	GILGFVFTL
34130	CAS ASS SSE SET ETS TSG SGG GGY GYY YYN YNE NEQ EQF QFF	KLGGALQAK
34240	CAS ASS SSQ SQV QVG VGD GDG DGG GGE GEL ELF LFF	KLGGALQAK
2287	CAS ASS SSS SST STG TGT GTV TVS VSL SLE LEK EKL KLF LFF	KLGGALQAK
33552	CAS ASS SSS SSR SRA RAG AGF GFA FAQ AQY QYF	GILGFVFTL
23019	CAS ASS SSL SLG LGT GTA TAN ANY NYG YGY GYT YTF	KLGGALQAK
2448	CAS ASS SSL SLS LSQ SQG QGG GGN GNE NEQ EQF QFF	ELAGIGILTV
30402	CAS ASS SSI SII IIS ISV SVD VDT DTQ TQY QYF	GILGFVFTL
2390	CAS ASS SSS SSH SHQ HQR QRT RTG TGV GVD VDE DEQ EQF QFF	GILGFVFTL
26395	CSA SAR ARD RDR DRV RVG VGN GNT NTI TIY IYF	GLCTLVAML
33944	CAS ASS SSQ SQA QAT ATN TNT NTG TGE GEL ELF LFF	RAKFKQLL
34651	CAS ASS SSL SLR LRA RAM AMN MNT NTE TEA EAF AFF	KLGGALQAK
2250	CAS ASS SSL SLI LID IDT DTV TVW VWS WSL SLE LEQ EQY QYF	KLGGALQAK
30427	CAS ASS SSI SIR IRS RSA SAY AYE YEQ EQY QYF	GILGFVFTL
24310	CAS ASS SSR SRD RDA DAS ASS SSY SYE YEQ EQY QYF	KLGGALQAK
25400	CAS ASS SSL SLG LGF GFL FLD LDT DTG TGG GGL GLY LYG YGT GTE TEA EAF AFF	AVFDRKSDAK
7255	CAS ASS SSQ SQA QAA AAG AGD GDN DNE NEK EKL KLF LFF	KLGGALQAK
34611	CAS ASS SSF SFR FRA RAF AFF	KLGGALQAK
34234	CAS ASS SSQ SQE QEL ELG LGS GSS SSY SYN YNE NEQ EQF QFF	KLGGALQAK
34827	CAS ASS SSL SLG LGE GEQ EQG QGT GTF	KLGGALQAK
35843	CAS ASS SSI SIG IGG GGG GGN GNT NTE TEA EAF AFF	KLGGALQAK
22365	CAS ASS SSG SGP GPG PGG GGV GVD VDE DEQ EQY QYF	RAKFKQLL
34607	CAS ASS SSF SFL FLD LDG DGN GNQ NQP QPQ PQH QHF	KLGGALQAK
26012	CAS ASS SSL SLV LVS VST STE TEA EAF AFF	RAKFKQLL
35899	CAS ASS SSL SLV LVW VWR WRG RGD GDV DVN VNT NTE TEA EAF AFF	KLGGALQAK
35669	CAS ASS SSY SYV YVG VGG GGP GPG PGD GDT DTQ TQY QYF	KLGGALQAK
25763	CAS ASS SSQ SQD QDP DPS PSR SRT RTY TYE YEQ EQY QYF	GILGFVFTL
35665	CAS ASS SSY SYS YSY SYE YEQ EQY QYF	KLGGALQAK
35256	CAS ASS SSP SPR PRR RRA RAS ASS SSY SYN YNE NEQ EQF QFF	KLGGALQAK
6238	CAS ASS SSM SMG MGV GVY VYG YGY GYT YTF	GILGFVFTL
34809	CAS ASS SSA SAG AGG GGD GDI DIQ IQY QYF	KLGGALQAK
16941	CAS ASS SSQ SQE QEI EIG IGF GFS FSP SPL PLH LHF	GILGFVFTL
34148	CAS ASS SSH SHQ HQR QRG RGR GRN RNT NTE TEA EAF AFF	KLGGALQAK
37320	CAS ASR SRT RTG TGL GLA LAS AST STD TDT DTQ TQY QYF	IVTDFSVIK
35254	CAS ASS SSP SPQ PQT QTG TGK GKR KRL RLY LYE YEQ EQY QYF	AVFDRKSDAK
4930	CAS ASS SSF SFL FLA LAG AGG GGY GYN YNE NEQ EQF QFF	IVTDFSVIK
35059	CAS ASS SSL SLL LLV LVR VRA RAN ANP NPN PNT NTE TEA EAF AFF	KLGGALQAK
100	CAS ASS SSP SPP PPG PGS GSD SDE DEQ EQF QFF	KLGGALQAK
6548	CAS AST STI TII IIP IPG PGL GLA LAG AGP GPR PRE REE EET ETQ TQY QYF	KLGGALQAK
28037	CSV SVG VGT GTG TGD GDW DWG WGE GEQ EQY QYF	RAKFKQLL
36238	CAS ASS SSL SLG LGS GSG SGG GGY GYN YNE NEQ EQF QFF	IVTDFSVIK
29968	CAS ASS SSI SIG IGD GDY DYE YEQ EQY QYF	KLGGALQAK
98	CAS ASS SSP SPK PKI KIL ILA LAY AYT YTD TDT DTQ TQY QYF	KLGGALQAK
24317	CAS ASS SSR SRD RDT DTS TSS SSY SYE YEQ EQY QYF	KLGGALQAK
18220	CAS ASS SSL SLR LRD RDG DGS GSE SEA EAF AFF	RAKFKQLL
34021	CAT ATS TSG SGP GPH PHT HTD TDT DTQ TQY QYF	KLGGALQAK
5288	CSV SVS VSA SAS ASG SGG GGD GDE DEQ EQY QYF	KLGGALQAK
89	CAS ASS SSL SLT LTS TSG SGE GEE EET ETQ TQY QYF	AVFDRKSDAK
35238	CAS ASS SSL SLV LVK VKG KGQ GQG QGG GGD GDE DEQ EQF QFF	KLGGALQAK
177	CAS ASS SSQ SQD QDG DGK GKA KAQ AQY QYF	KLGGALQAK
35008	CAS ASS SSL SLR LRG RGD GDY DYG YGY GYT YTF	KLGGALQAK
38434	CAS ASS SSY SYS YSE SES ESG SGD GDS DSP SPL PLH LHF	KLGGALQAK
28707	CAS ASS SSG SGV GVG VGR GRQ RQT QTY TYE YEQ EQY QYF	GILGFVFTL
27722	CSV SVG VGS GSG SGD GDY DYE YEQ EQY QYF	RAKFKQLL
16965	CAS ASS SSL SLG LGT GTG TGG GGS GSY SYE YEQ EQY QYF	KLGGALQAK
34279	CAS ASS SSQ SQG QGV GVA VAG AGG GGQ GQG QGV GVN VNE NEQ EQF QFF	AVFDRKSDAK
34602	CAS ASS SSF SFF FFR FRN RNY NYG YGY GYT YTF	KLGGALQAK
33368	CAS ASS SSI SIR IRS RST STD TDT DTQ TQY QYF	GILGFVFTL
35370	CSA SAR ARV RVS VSS SSL SLA LAG AGG GGQ GQE QET ETQ TQY QYF	KLGGALQAK
36214	CAS ASN SNP NPT PTG TGV GVG VGD GDE DEK EKL KLF LFF	KLGGALQAK
25302	CAS ASS SSF SFV FVD VDR DRA RAE AET ETQ TQY QYF	RAKFKQLL
5507	CAS ASS SSA SAG AGG GGS GSN SNE NEQ EQF QFF	ELAGIGILTV
379	CAS ASS SSL SLS LSS SSG SGT GTY TYE YEQ EQY QYF	IVTDFSVIK
7442	CAS ASS SSM SMG MGD GDR DRS RSM SMG MGN GNI NIQ IQY QYF	RAKFKQLL
30778	CAS ASS SSI SIR IRS RSS SSY SYE YEQ EQY QYF	GILGFVFTL
28611	CAS ASS SSE SEE EEA EAG AGE GEY EYN YNE NEQ EQF QFF	GILGFVFTL
26535	CSA SAW AWT WTG TGT GTE TEA EAF AFF	GLCTLVAML
34834	CAS ASS SSL SLS LSG SGT GTG TGE GEL ELF LFF	KLGGALQAK
5656	CAS ASS SSI SIR IRA RAG AGY GYT YTE TEA EAF AFF	GILGFVFTL
13821	CAS ASS SSF SFT FTG TGG GGR GRT RTG TGE GEL ELF LFF	RAKFKQLL
34360	CAS ASS SSE SED EDG DGS GSS SSY SYN YNE NEQ EQF QFF	KLGGALQAK
23204	CAT ATS TSR SRV RVR VRA RAD ADT DTQ TQY QYF	KLGGALQAK
7079	CAS ASS SSM SMP MPG PGL GLV LVF VFP FPG PGE GEL ELF LFF	KLGGALQAK
35725	CAS AST STG TGG GGS GSP SPS PSY SYN YNS NSP SPL PLH LHF	KLGGALQAK
23222	CAS ASS SSH SHF HFP FPP PPP PPY PYE YEQ EQY QYF	KLGGALQAK
32595	CAS ASS SSI SIR IRS RSG SGN GNE NEQ EQF QFF	GILGFVFTL
4967	CAS ASS SSL SLG LGG GGL GLY LYL YLY LYN YNE NEQ EQF QFF	KLGGALQAK
38423	CAS ASS SSY SYS YST STA TAS ASE SEQ EQY QYF	KLGGALQAK
15702	CAS ASS SST STS TST STG TGT GTG TGY GYG YGY GYT YTF	RAKFKQLL
27070	CST STG TGQ GQG QGP GPY PYE YEQ EQY QYF	RAKFKQLL
593	CAS ASS SST STK TKA KAG AGE GEY EYA YAD ADT DTQ TQY QYF	KLGGALQAK
35992	CAS ASS SSE SER ERD RDR DRA RAT ATY TYE YEQ EQY QYF	KLGGALQAK
34248	CAS ASS SSP SPR PRL RLA LAG AGE GEY EYT YTS TSS SSY SYN YNE NEQ EQF QFF	KLGGALQAK
35181	CAS ASS SSS SSG SGD GDS DSF SFF FFT FTG TGE GEL ELF LFF	KLGGALQAK
25401	CAS ASS SSL SLG LGG GGD GDP DPG PGV GVG VGP GPQ PQH QHF	IVTDFSVIK
29944	CAS ASS SSG SGR GRS RST STD TDT DTQ TQY QYF	GILGFVFTL
34574	CAT ATS TSR SRS RSG SGL GLA LAG AGV GVY VYS YSY SYE YEQ EQY QYV	AVFDRKSDAK
35019	CAS ASS SSL SLE LEL ELG LGL GLA LAE AEA EAF AFF	KLGGALQAK
32547	CAS ASS SSI SIR IRS RSA SAY AYE YEQ EQY QYF	GILGFVFTL
24309	CAS ASS SSK SKD KDS DSS SST STD TDT DTQ TQY QYF	KLGGALQAK
35410	CSA SAR ARA RAR ARG RGL GLN LNT NTG TGE GEL ELF LFF	KLGGALQAK
27086	CSV SVE VEG EGA GAG AGQ GQG QGQ GQL QLL LLY LYG YGY GYT YTF	KLGGALQAK
25437	CAS ASS SSL SLL LLG LGD GDP DPN PNS NSP SPL PLH LHF	RAKFKQLL
14842	CSA SAR ARD RDR DRL RLA LAG AGE GEY EYS YSE SEQ EQY QYF	GILGFVFTL
35844	CAS ASS SSI SIG IGG GGH GHT HTY TYN YNE NEQ EQF QFF	KLGGALQAK
34049	CAS ASR SRL RLA LAG AGD GDE DEQ EQF QFF	KLGGALQAK
3846	CAS ASS SSW SWG WGG GGG GGS GSH SHY HYG YGY GYT YTF	IVTDFSVIK
35603	CAS ASS SSL SLV LVE VEA EAT ATL TLN LNY NYG YGY GYT YTF	KLGGALQAK
15618	CAS ASS SST STS TST STG TGT GTG TGY GYG YGY GYT YTF	RAKFKQLL
18246	CAS ASS SSL SLR LRD RDG DGS GSE SEA EAF AFF	RAKFKQLL
5180	CSA SAR ARK RKW KWT WTE TEA EAF AFF	KLGGALQAK
4931	CAS ASN SNM NMG MGG GGL GLL LLS LST STD TDT DTQ TQY QYF	ELAGIGILTV
34810	CAS ASS SSA SAP APG PGL GLA LAV AVN VNE NEQ EQF QFF	AVFDRKSDAK
34770	CAS ASS SSL SLL LLS LSG SGD GDT DTY TYS YSY SYN YNE NEQ EQF QFF	KLGGALQAK
14673	CAS ASS SSE SET ETG TGG GGV GVG VGS GSP SPL PLH LHF	KLGGALQAK
38420	CAS ASS SSY SYG YGM GMG MGT GTE TEA EAF AFF	IVTDFSVIK
35676	CAS ASN SNS NSD SDT DTV TVT VTD TDN DNN NNQ NQP QPQ PQH QHF	KLGGALQAK
35624	CAS ASR SRS RSK SKT KTG TGS GSK SKQ KQP QPQ PQH QHF	IVTDFSVIK
6706	CAS ASS SSI SIR IRS RSN SNT NTE TEA EAF AFF	GILGFVFTL
35350	CSA SAP APT PTG TGG GGG GGL GLY LYN YNE NEQ EQF QFF	KLGGALQAK
35263	CAS ASS SSS SSG SGQ GQG QGA GAK AKT KTE TEA EAF AFF	KLGGALQAK
34196	CAS ASS SSQ SQG QGQ GQG QGD GDQ DQP QPQ PQH QHF	KLGGALQAK
34745	CAS ASS SSG SGG GGQ GQG QGL GLF LFY FYE YEQ EQY QYF	KLGGALQAK
17052	CAS ASS SSV SVG VGT GTG TGD GDH DHQ HQP QPQ PQH QHF	KLGGALQAK
34470	CAS ASS SSH SHD HDT DTR TRN RNN NNE NEQ EQF QFF	KLGGALQAK
2392	CAS ASS SSS SSP SPG PGG GGE GES ESP SPL PLH LHF	KLGGALQAK
34110	CAS ASS SSD SDG DGG GGG GGA GAT ATD TDT DTQ TQY QYF	KLGGALQAK
36247	CAS ASS SSS SSR SRD RDR DRG RGY GYE YEQ EQY QYF	KLGGALQAK
33498	CAS ASS SSM SMR MRS RSS SSD SDT DTQ TQY QYF	GILGFVFTL
32399	CAS ASS SSI SIG IGV GVY VYG YGY GYT YTF	GILGFVFTL
25069	CAS ASI SIL ILG LGG GGS GSG SGG GGH GHM HMG MGN GNE NEQ EQF QFF	KLGGALQAK
14897	CAS ASS SSL SLG LGG GGT GTN TNE NEQ EQF QFF	RAKFKQLL
35491	CSV SVD VDL DLE LEA EAN ANY NYG YGY GYT YTF	KLGGALQAK
34192	CAS ASS SSQ SQG QGL GLA LAS ASS SSY SYE YEQ EQY QYV	KLGGALQAK
5061	CAS ASS SSL SLG LGA GAR ARL RLA LAG AGY GYN YNE NEQ EQF QFF	KLGGALQAK
18059	CAS AST STG TGG GGG GGA GAN ANG NGY GYT YTF	KLGGALQAK
7034	CAS ASS SSI SIR IRS RSS SSY SYE YEQ EQY QYF	GILGFVFTL
35723	CAS ASS SSY SYR YRG RGE GEA EAG AGE GEL ELF LFF	KLGGALQAK
5055	CAS ASS SSL SLA LAP APG PGQ GQG QGP GPI PIK IKE KET ETQ TQY QYF	KLGGALQAK
25218	CAS ASS SSL SLG LGV GVA VAG AGT GTN TNT NTG TGE GEL ELF LFF	KLGGALQAK
35328	CAW AWR WRT RTG TGP GPV PVG VGN GNT NTI TIY IYF	KLGGALQAK
35758	CAS ASS SSY SYA YAP APS PSG SGG GGV GVA VAD ADT DTQ TQY QYF	KLGGALQAK
15582	CAS ASS SSR SRL RLA LAG AGE GEG EGD GDT DTQ TQY QYF	RAKFKQLL
13895	CAS ASS SSL SLG LGD GDR DRA RAG AGG GGY GYT YTF	GILGFVFTL
29776	CAS ASS SSA SAR ARS RSS SSY SYE YEQ EQY QYF	GILGFVFTL
