17882	CAS ASS SSG SGE GEG EGG GGT GTT TTN TNT NTG TGE GEL ELF LFF	GILGFVFTL
28713	CAS ASS SSL SLT LTG TGP GPP PPY PYE YEQ EQY QYF	KLGGALQAK
35937	CAS ASS SST STQ TQS QSG SGT GTA TAS ASG SGE GEL ELF LFF	KLGGALQAK
35852	CAS ASS SSI SIG IGQ GQG QGG GGN GNE NEQ EQF QFF	KLGGALQAK
31834	CAS ASS SST STR TRS RST STD TDT DTQ TQY QYF	GILGFVFTL
34527	CAS ASS SSS SSE SEQ EQG QGT GTQ TQR QRG RGY GYT YTF	KLGGALQAK
35339	CAW AWS WSV SVQ VQR QRG RGS GSE SEA EAF AFF	KLGGALQAK
25436	CAS ASS SSL SLL LLG LGA GAE AEN ENT NTI TIY IYF	RAKFKQLL
31858	CAS ASS SSV SVR VRS RSS SSY SYE YEQ EQY QYF	GILGFVFTL
5557	CAS ASS SSA SAT ATG TGT GTG TGV GVG VGY GYT YTF	KLGGALQAK
15992	CAS ASS SSP SPN PNP NPG PGT GTN TNT NTG TGE GEL ELF LFF	KLGGALQAK
14832	CAS ASS SSV SVI VIK IKN KNY NYG YGY GYT YTF	KLGGALQAK
35074	CAS ASS SSS SSF SFL FLA LAG AGE GEV EVY VYN YNE NEQ EQF QFF	KLGGALQAK
34367	CAS ASS SSG SGG GGV GVN VNT NTE TEA EAF AFF	KLGGALQAK
35798	CAS ASN SNP NPG PGQ GQS QST STN TNE NEK EKL KLF LFF	KLGGALQAK
19550	CAS ASS SSL SLR LRD RDG DGS GSE SEA EAF AFF	RAKFKQLL
25797	CAS ASS SSS SSA SAA AAA AAY AYE YEQ EQY QYF	RAKFKQLL
20673	CAS ASS SSL SLR LRD RDG DGS GSE SEA EAF AFF	RAKFKQLL
36119	CAS ASS SSV SVD VDE DEQ EQF QFS FSY SYE YEQ EQY QYF	KLGGALQAK
27079	CSV SVA VAG AGT GTS TSG SGG GGA GAY AYE YEQ EQY QYF	KLGGALQAK
2362	CAS ASS SSL SLI LIA IAG AGG GGG GGD GDT DTQ TQY QYF	KLGGALQAK
7080	CAS ASS SSM SMR MRA RAS ASY SYE YEQ EQY QYF	GILGFVFTL
34793	CAS ASS SSR SRY RYS YSG SGG GGF GFG FGD GDT DTQ TQY QYF	KLGGALQAK
35151	CAS ASS SSL SLA LAL ALV LVG VGV GVA VAG AGY GYT YTF	KLGGALQAK
26474	CSA SAR ARG RGL GLA LAD ADP DPY PYE YEQ EQY QYF	KLGGALQAK
35655	CAS ASS SSY SYS YSE SEG EGA GAN ANT NTE TEA EAF AFF	KLGGALQAK
27085	CSV SVE VED EDR DRR RRP RPD PDE DEQ EQF QFF	RAKFKQLL
34377	CAS ASS SSL SLS LSQ SQG QGA GAL ALN LNT NTE TEA EAF AFF	KLGGALQAK
2358	CAS ASS SSL SLG LGF GFT FTD TDT DTQ TQY QYF	KLGGALQAK
28373	CAS ASS SSL SLK LKG KGQ GQG QGS GSD SDT DTQ TQY QYF	IVTDFSVIK
31924	CAS ASS SSY SYY YYS YSN SNQ NQP QPQ PQH QHF	GILGFVFTL
5152	CSA SAD ADG DGG GGP GPT PTT TTP TPN PNE NEQ EQY QYF	KLGGALQAK
7234	CAS ASS SSE SEL ELL LLA LAG AGM GMN MNT NTG TGE GEL ELF LFF	KLGGALQAK
31943	CAS ASR SRA RAG AGR GRE REA EAF AFF	GILGFVFTL
7262	CAS ASS SSQ SQG QGA GAT ATG TGG GGP GPP PPD PDT DTQ TQY QYF	RAKFKQLL
35680	CAS ASK SKN KNL NLA LAD ADS DST STD TDT DTQ TQY QYF	KLGGALQAK
13976	CAS ASS SSN SNS NSG SGA GAN ANV NVL VLT LTF	RAKFKQLL
19532	CAS ASS SSL SLR LRD RDG DGS GSE SEA EAF AFF	RAKFKQLL
23345	CAS ASS SSL SLS LSG SGR GRP RPY PYE YEQ EQY QYF	RAKFKQLL
35266	CAS ASS SSS SSM SMN MNT NTE TEA EAF AFF	KLGGALQAK
7253	CAS ASS SSH SHV HVG VGT GTG TGW GWD WDL DLR LRT RTD TDT DTQ TQY QYF	KLGGALQAK
35469	CSA SAS ASD SDR DRG RGG GGW GWG WGQ GQF QFF	KLGGALQAK
5176	CSA SAR ARE REV EVS VSG SGE GEK EKL KLF LFF	AVFDRKSDAK
34823	CAS ASS SSL SLD LDT DTV TVG VGP GPT PTG TGG GGE GEE EET ETQ TQY QYF	KLGGALQAK
34344	CAS ASS SSS SSR SRL RLA LAS ASS SSY SYN YNE NEQ EQF QFF	KLGGALQAK
34079	CAS ASS SSP SPN PNT NTG TGM GME MET ETQ TQY QYF	KLGGALQAK
34547	CAS ASS SSL SLP LPT PTS TSG SGG GGD GDT DTQ TQY QYF	KLGGALQAK
5418	CAS ASS SSY SYG YGE GEG EGS GSY SYE YEQ EQY QYF	ELAGIGILTV
23027	CAS ASS SSS SSS SSS SSG SGV GVH VHE HEQ EQF QFF	RAKFKQLL
34224	CAS ASS SSR SRT RTG TGT GTS TSY SYE YEQ EQY QYF	KLGGALQAK
28414	CAS ASS SSS SSP SPG PGL GLA LAV AVD VDT DTQ TQY QYF	RAKFKQLL
23208	CAT ATS TSY SYE YED EDN DNS NSG SGA GAN ANV NVL VLT LTF	GILGFVFTL
31651	CAS ASS SST STG TGQ GQP QPQ PQH QHF	GILGFVFTL
31077	CAS ASS SSI SIR IRS RSS SSY SYE YEQ EQY QYF	GILGFVFTL
34571	CAT ATS TSR SRP RPR PRS RSL SLA LAV AVN VNT NTG TGE GEL ELF LFF	KLGGALQAK
6262	CAS ASS SSQ SQG QGA GAY AYG YGY GYT YTF	GILGFVFTL
28720	CAS AST STS TSG SGL GLA LAE AEL ELY LYN YNE NEQ EQF QFF	KLGGALQAK
4786	CAS ASS SSW SWG WGG GGG GGS GSH SHY HYG YGY GYT YTF	IVTDFSVIK
22990	CAS ASS SSP SPN PNS NSN SNQ NQP QPQ PQH QHF	KLGGALQAK
35594	CAS ASG SGG GGA GAL ALN LNY NYE YEQ EQY QYF	KLGGALQAK
28703	CAS ASS SSE SEV EVV VVS VST STT TTY TYE YEQ EQY QYF	RAKFKQLL
34921	CAI AIS ISE SES ESV SVG VGS GSY SYE YEQ EQY QYF	KLGGALQAK
23119	CAS ASS SSV SVQ VQG QGL GLG LGN GNS NSP SPL PLH LHF	KLGGALQAK
35295	CAS ASS SSL SLS LSS SSG SGQ GQG QGN GNT NTE TEA EAF AFF	KLGGALQAK
23128	CAT ATS TSR SRG RGR GRG RGS GST STD TDT DTQ TQY QYF	KLGGALQAK
16526	CAS ASS SSQ SQR QRP RPS PSE SEV EVG VGE GEL ELF LFF	RAKFKQLL
9609	CAS ASS SSF SFS FSG SGN GNT NTG TGE GEL ELF LFF	RAKFKQLL
16936	CAS ASS SSS SST STG TGG GGG GGE GEK EKD KDQ DQP QPQ PQH QHF	RAKFKQLL
35344	CSA SAA AAQ AQG QGK GKG KGV GVY VYT YTE TEA EAF AFF	KLGGALQAK
2458	CAS ASR SRQ RQG QGN GNT NTG TGE GEL ELF LFF	KLGGALQAK
28829	CAS AST STA TAA AAI AIS ISG SGN GNT NTI TIY IYF	KLGGALQAK
18701	CAS ASS SSL SLR LRD RDG DGS GSE SEA EAF AFF	RAKFKQLL
25079	CAS ASS SSL SLR LRR RRV RVE VEQ EQF QFF	KLGGALQAK
7979	CAS ASS SSF SFL FLD LDR DRG RGP GPN PNT NTE TEA EAF AFF	RAKFKQLL
32396	CAS ASS SSI SIG IGV GVY VYG YGY GYT YTF	GILGFVFTL
5855	CAS ASS SSI SIR IRS RSS SSY SYE YEQ EQY QYF	GILGFVFTL
5393	CAS ASS SSK SKQ KQG QGA GAL ALT LTE TEA EAF AFF	KLGGALQAK
34213	CAS ASS SSQ SQT QTG TGG GGS GSY SYG YGY GYT YTF	KLGGALQAK
25108	CAS ASS SSQ SQT QTS TSG SGG GGA GAR ARE REQ EQF QFF	RAKFKQLL
14190	CAS ASS SSS SSS SSS SST STG TGE GEL ELF LFF	RAKFKQLL
34456	CAS ASM SML MLA LAG AGS GSE SEE EET ETQ TQY QYF	KLGGALQAK
34478	CAS ASS SSL SLG LGE GEA EAR ARG RGH GHE HEQ EQY QYV	KLGGALQAK
26046	CAW AWS WSL SLA LAG AGG GGE GEQ EQF QFF	KLGGALQAK
28455	CAS ASK SKK KKL KLA LAG AGD GDS DSY SYE YEQ EQY QYF	KLGGALQAK
25084	CAS ASS SSP SPR PRT RTG TGN GNS NSG SGA GAN ANV NVL VLT LTF	GILGFVFTL
15289	CAS ASS SSL SLT LTG TGQ GQM QMN MNT NTE TEA EAF AFF	RAKFKQLL
34402	CAS ASS SSV SVE VEA EAS ASG SGV GVY VYE YEQ EQY QYF	KLGGALQAK
35033	CAS ASR SRE REV EVN VNT NTE TEA EAF AFF	KLGGALQAK
28737	CAS ASS SSE SEP EPG PGT GTN TNS NSP SPL PLH LHF	KLGGALQAK
26702	CSA SAG AGQ GQG QGP GPY PYE YEQ EQY QYF	RAKFKQLL
33843	CAS ASS SSV SVR VRS RSS SSY SYE YEQ EQY QYF	GILGFVFTL
32342	CAS ASS SSI SIF IFY FYS YSS SST STD TDT DTQ TQY QYF	GILGFVFTL
35569	CSV SVP VPP PPG PGG GGA GAG AGR GRA RAF AFF	KLGGALQAK
153	CAS ASS SSQ SQD QDQ DQG QGL GLG LGN GNE NEQ EQF QFF	KLGGALQAK
34458	CAS ASR SRQ RQI QIL ILA LAA AAN ANT NTD TDT DTQ TQY QYF	KLGGALQAK
5077	CAS ASS SSP SPG PGQ GQG QGI GIT ITG TGE GEL ELF LFF	KLGGALQAK
13822	CAS ASS SSF SFT FTG TGQ GQA QAN ANT NTE TEA EAF AFF	RAKFKQLL
25452	CAS ASS SSL SLS LSS SSY SYE YEQ EQY QYF	KLGGALQAK
29830	CAS ASS SSA SAR ARS RSS SSY SYE YEQ EQY QYF	GILGFVFTL
31932	CAS ASS SSI SIR IRS RSS SSY SYE YEQ EQY QYF	GILGFVFTL
34534	CAS ASS SSF SFS FSP SPS PSG SGA GAH AHE HEQ EQY QYF	KLGGALQAK
34917	CAI AIS ISE SEP EPT PTR TRQ RQN QNV NVP VPN PNT NTG TGE GEL ELF LFF	KLGGALQAK
17892	CAS ASS SSP SPR PRD RDS DSG SGV GVT VTG TGE GEL ELF LFF	GILGFVFTL
34530	CAS ASS SSG SGR GRA RAG AGP GPL PLL LLS LSG SGA GAN ANV NVL VLT LTF	KLGGALQAK
7072	CAS ASS SSI SIV IVW VWD WDR DRA RAS ASL SLG LGT GTD TDT DTQ TQY QYF	KLGGALQAK
10378	CAS ASS SSF SFS FSG SGN GNT NTG TGE GEL ELF LFF	RAKFKQLL
16957	CAS ASS SSH SHL HLG LGG GGD GDR DRY RYM YMN MNE NEQ EQF QFF	RAKFKQLL
11294	CAS ASS SSF SFS FSG SGN GNT NTG TGE GEL ELF LFF	RAKFKQLL
14626	CAS ASS SSP SPP PPG PGG GGG GGN GNT NTG TGE GEL ELF LFF	RAKFKQLL
35759	CAS ASS SSY SYE YEE EEI EIT ITM TMN MNT NTE TEA EAF AFF	KLGGALQAK
25267	CAS ASI SIG IGT GTS TSP SPR PRY RYE YEQ EQY QYF	KLGGALQAK
34520	CAS ASS SSL SLE LEG EGN GNE NEQ EQY QYF	KLGGALQAK
34169	CAS ASS SSQ SQD QDL DLS LSV SVK VKL KLA LAR ARE RES EST STD TDT DTQ TQY QYF	KLGGALQAK
28867	CAS ASS SSY SYN YNP NPR PRT RTE TEV EVS VSN SNQ NQP QPQ PQH QHF	GILGFVFTL
34474	CAS ASS SSL SLD LDS DSG SGN GNT NTI TIY IYF	KLGGALQAK
5407	CAS ASS SSR SRQ RQG QGS GSW SWL WLE LET ETQ TQY QYF	KLGGALQAK
34813	CAS ASS SSF SFG FGR GRE REQ EQY QYF	KLGGALQAK
35067	CAS ASS SSP SPE PEG EGP GPI PIY IYN YNE NEQ EQF QFF	KLGGALQAK
13910	CAS ASS SSL SLG LGD GDR DRA RAG AGG GGY GYT YTF	RAKFKQLL
5565	CAS ASS SSF SFG FGS GSY SYG YGY GYT YTF	GILGFVFTL
35001	CAS ASS SSS SSG SGT GTR TRP RPT PTE TEQ EQY QYV	KLGGALQAK
34923	CAI AIS ISQ SQS QSV SVN VNT NTE TEA EAF AFF	KLGGALQAK
26556	CSA SAR ARG RGQ GQG QGE GEG EGF GFF	RAKFKQLL
137	CAS ASS SSH SHG HGT GTR TRT RTY TYE YEQ EQY QYF	KLGGALQAK
35368	CSA SAR ARG RGQ GQG QGV GVY VYE YEQ EQY QYV	KLGGALQAK
32772	CAS ASS SSI SIR IRS RSS SSY SYE YEQ EQY QYF	GILGFVFTL
25810	CAS ASS SSS SSL SLG LGD GDR DRN RNT NTE TEA EAF AFF	RAKFKQLL
34480	CAS ASS SSL SLI LIG IGY GYG YGY GYT YTF	KLGGALQAK
24636	CAS ASS SSL SLV LVG VGG GGN GNE NEQ EQF QFF	KLGGALQAK
35127	CAS ASS SSP SPL PLT LTS TSG SGI GIT ITG TGE GEL ELF LFF	KLGGALQAK
6239	CAS ASS SSM SMR MRA RAS ASV SVE VEQ EQF QFF	GILGFVFTL
4966	CAS ASS SSL SLG LGG GGA GAR ARN RNT NTE TEA EAF AFF	KLGGALQAK
7257	CAS ASS SSQ SQD QDF DFV FVL VLY LYS YSG SGN GNT NTI TIY IYF	ELAGIGILTV
34601	CAS ASS SSE SEV EVW VWD WDR DRG RGY GYE YEQ EQY QYF	KLGGALQAK
33828	CAS ASS SSV SVR VRH RHG HGT GTE TEA EAF AFF	GILGFVFTL
25080	CAS ASS SSL SLT LTP TPG PGG GGE GET ETQ TQY QYF	KLGGALQAK
25019	CAS AST STL TLG LGF GFL FLN LNE NEQ EQF QFF	KLGGALQAK
15320	CAS ASS SSQ SQE QER ERG RGP GPY PYN YNE NEQ EQF QFF	KLGGALQAK
24382	CAS ASS SSL SLG LGT GTS TSG SGG GGT GTG TGE GEL ELF LFF	RAKFKQLL
15407	CAS ASS SSQ SQT QTR TRG RGA GAG AGN GNT NTI TIY IYF	RAKFKQLL
34944	CAS ASS SSL SLR LRI RIF IFG FGA GAP APG PGE GEL ELF LFF	KLGGALQAK
34688	CAS ASS SSR SRG RGG GGG GGG GGL GLE LEA EAF AFF	KLGGALQAK
377	CAS ASS SSL SLS LSG SGA GAG AGN GNT NTI TIY IYF	KLGGALQAK
5445	CAS ASN SNF NFQ FQG QGL GLT LTD TDT DTQ TQY QYF	KLGGALQAK
18039	CAS ASS SSV SVR VRS RSS SSM SMN MNT NTE TEA EAF AFF	AVFDRKSDAK
34164	CAS ASS SSQ SQA QAL ALG LGG GGG GGY GYT YTQ TQY QYF	KLGGALQAK
5151	CAW AWV WVL VLG LGP GPA PAG AGD GDT DTQ TQY QYF	KLGGALQAK
17010	CAS ASS SSQ SQA QAD ADS DSL SLN LNS NSP SPL PLH LHF	RAKFKQLL
22985	CAS ASS SSL SLE LEL ELN LNS NSA SAT ATN TNE NEK EKL KLF LFF	KLGGALQAK
27082	CSV SVE VED EDL DLA LAY AYG YGY GYT YTF	RAKFKQLL
35692	CAS ASS SSE SEF EFM FMG MGM GMN MNT NTE TEA EAF AFF	KLGGALQAK
35071	CAS ASS SSQ SQG QGT GTV TVS VSG SGN GNT NTI TIY IYF	KLGGALQAK
32884	CAS ASS SSI SIR IRS RSS SSY SYE YEQ EQY QYF	GILGFVFTL
34301	CAS ASS SSP SPI PIP IPG PGG GGS GSD SDT DTQ TQY QYF	KLGGALQAK
6552	CAT ATS TSQ SQR QRS RST STD TDT DTQ TQY QYF	GILGFVFTL
14176	CAS ASS SSS SSL SLD LDV DVA VAG AGY GYE YEQ EQY QYF	RAKFKQLL
35715	CAS ASR SRT RTG TGD GDY DYR YRR RRA RAG AGE GEL ELF LFF	KLGGALQAK
28771	CAS ASS SSY SYG YGF GFP FPT PTS TSG SGG GGN GNT NTG TGE GEL ELF LFF	RAKFKQLL
35026	CAS ASS SSS SSP SPG PGQ GQG QGA GAK AKN KNE NEQ EQF QFF	KLGGALQAK
31	CAS ASG SGL GLK LKQ KQG QGL GLE LET ETQ TQY QYF	KLGGALQAK
5060	CAS ASS SSL SLE LEG EGP GPY PYE YEQ EQY QYF	KLGGALQAK
26472	CSA SAR ARG RGE GEQ EQG QGS GSV SVT VTE TEA EAF AFF	RAKFKQLL
35835	CAS ASS SSI SID IDL DLG LGV GVA VAY AYE YEQ EQY QYF	KLGGALQAK
28729	CAT ATS TSP SPS PSG SGG GGT GTY TYN YNE NEQ EQF QFF	RAKFKQLL
34047	CAS ASR SRG RGL GLA LAG AGV GVG VGV GVL VLS LSG SGY GYN YNE NEQ EQF QFF	KLGGALQAK
5028	CAS AST STP TPP PPR PRL RLV LVR VRW RWE WET ETQ TQY QYF	KLGGALQAK
7206	CAS ASS SST STR TRS RSS SSY SYE YEQ EQY QYF	GILGFVFTL
6669	CAS ASS SSI SIK IKG KGP GPF PFR FRT RTE TEA EAF AFF	KLGGALQAK
31376	CAS ASS SSK SKR KRS RSQ SQE QEP EPQ PQH QHF	GILGFVFTL
15304	CAS ASS SSQ SQA QAP APA PAG AGA GAG AGH GHE HEQ EQY QYF	RAKFKQLL
7685	CAS ASR SRK RKQ KQG QGS GSD SDT DTG TGE GEL ELF LFF	RAKFKQLL
28574	CAS ASS SSY SYP YPG PGR GRG RGH GHN HNE NEQ EQF QFF	KLGGALQAK
34395	CAS ASS SSV SVD VDG DGG GGT GTQ TQY QYF	KLGGALQAK
18113	CAS ASS SSL SLG LGS GSS SSN SNY NYG YGY GYT YTF	KLGGALQAK
277	CAS ASS SSA SAG AGD GDW DWI WIS ISD SDN DNS NSP SPL PLH LHF	IVTDFSVIK
15828	CAS ASS SST STS TST STG TGT GTG TGY GYG YGY GYT YTF	RAKFKQLL
35697	CAS ASS SSE SEV EVA VAE AES ESS SSY SYG YGY GYT YTF	KLGGALQAK
15293	CAS ASS SSN SNL NLD LDG DGT GTG TGE GEL ELF LFF	RAKFKQLL
24353	CAI AIS ISG SGG GGT GTS TSR SRD RDT DTE TEA EAF AFF	RAKFKQLL
4260	CAS ASS SSW SWG WGG GGG GGS GSH SHY HYG YGY GYT YTF	IVTDFSVIK
2373	CAS ASS SSL SLS LSG SGW GWT WTY TYE YEQ EQY QYF	KLGGALQAK
373	CAS ASS SSG SGP GPG PGQ GQL QLS LST STD TDT DTE TEA EAF AFF	KLGGALQAK
26017	CAS ASS SSS SSP SPQ PQG QGV GVS VSN SNT NTE TEA EAF AFF	GILGFVFTL
16952	CAS ASS SSH SHL HLG LGG GGD GDR DRY RYM YMN MNE NEQ EQF QFF	KLGGALQAK
5175	CSA SAR ARE REG EGT GTG TGG GGT GTT TTG TGE GEL ELF LFF	KLGGALQAK
35847	CAS ASS SSI SIG IGG GGS GSS SSY SYN YNE NEQ EQF QFF	KLGGALQAK
28876	CAS ASS SSY SYS YSQ SQG QGG GGE GEG EGV GVD VDE DEQ EQF QFF	RAKFKQLL
31124	CAS ASS SSI SIR IRS RSS SSY SYE YEQ EQY QYF	GILGFVFTL
5252	CSA SAR ARN RNR NRE REG EGW GWG WGE GEQ EQY QYF	KLGGALQAK
24350	CAI AIS ISE SES ESL SLT LTG TGN GNY NYE YEQ EQY QYF	KLGGALQAK
32601	CAS ASS SSI SIR IRS RSG SGY GYE YEQ EQF QFF	GILGFVFTL
34897	CAS ASS SSE SEG EGG GGH GHP HPF PFN FNQ NQP QPQ PQH QHF	KLGGALQAK
35982	CAS ASS SSD SDR DRL RLA LAN ANY NYN YNS NSP SPL PLH LHF	KLGGALQAK
7239	CAS ASS SST STG TGF GFG FGS GSP SPL PLH LHF	ELAGIGILTV
35911	CAS ASS SSN SNQ NQG QGT GTE TEA EAF AFF	KLGGALQAK
5071	CAS ASS SSL SLT LTG TGT GTY TYE YEQ EQY QYF	RAKFKQLL
34369	CAS ASS SSG SGH GHR HRG RGV GVG VGE GET ETQ TQY QYF	KLGGALQAK
35888	CAS ASS SSI SIV IVN VNG NGN GNE NEQ EQF QFF	KLGGALQAK
7077	CAS ASS SSM SMD MDR DRG RGS GSA SAD ADT DTQ TQY QYF	KLGGALQAK
34177	CAS ASS SSQ SQD QDR DRV RVY VYE YEQ EQY QYF	KLGGALQAK
34553	CAS ASS SSP SPG PGL GLA LAG AGA GAQ AQE QET ETQ TQY QYF	KLGGALQAK
2490	CAI AIM IMT MTD TDS DSS SSG SGN GNT NTI TIY IYF	IVTDFSVIK
15993	CAS ASS SSP SPR PRL RLS LST STD TDT DTQ TQY QYF	RAKFKQLL
6771	CAS ASS SSI SIR IRS RSS SSY SYE YEQ EQY QYF	GILGFVFTL
27092	CSV SVE VEN ENP NPT PTG TGD GDN DNN NNE NEQ EQF QFF	KLGGALQAK
34412	CAS ASS SSV SVG VGG GGT GTD TDF DFY FYN YNE NEQ EQF QFF	KLGGALQAK
26015	CAS ASS SSS SSL SLT LTG TGL GLH LHE HEQ EQY QYF	KLGGALQAK
35098	CAS ASS SSR SRM RMG MGA GAR ARD RDG DGY GYT YTF	KLGGALQAK
28718	CAS ASS SSV SVD VDV DVG VGL GLY LYN YNE NEQ EQF QFF	KLGGALQAK
31618	CAS ASS SSS SSR SRA RAS ASY SYE YEQ EQY QYF	GILGFVFTL
2422	CAS ASS SSL SLD LDV DVG VGR GRA RAA AAS ASY SYE YEQ EQY QYF	KLGGALQAK
23177	CAT ATS TSR SRS RSG SGQ GQG QGE GEK EKL KLF LFF	RAKFKQLL
29954	CAS ASS SSH SHR HRS RSG SGQ GQP QPQ PQH QHF	GILGFVFTL
4951	CAS ASS SSS SSG SGS GSG SGS GSP SPE PEM EMG MGD GDE DEQ EQF QFF	KLGGALQAK
34266	CAS ASS SSQ SQD QDT DTF TFK FKG KGH GHA HAY AYG YGY GYT YTF	KLGGALQAK
34481	CAS ASS SSL SLI LIS ISS SST STE TEA EAF AFF	KLGGALQAK
36138	CAS ASS SSP SPG PGQ GQG QGP GPY PYE YEQ EQY QYF	KLGGALQAK
33499	CAS ASS SSM SMR MRS RSS SSD SDT DTQ TQY QYF	GILGFVFTL
33547	CAS ASS SSR SRL RLS LSN SNQ NQP QPQ PQH QHF	GILGFVFTL
23813	CAS ASS SSP SPI PIP IPV PVV VVT VTE TEA EAF AFF	RAKFKQLL
28476	CAS ASS SSS SSL SLG LGA GAR ARE REQ EQF QFF	IVTDFSVIK
4980	CAS ASS SSL SLY LYE YEQ EQY QYF	GILGFVFTL
34635	CAS ASS SSL SLG LGL GLG LGQ GQP QPQ PQH QHF	ELAGIGILTV
23374	CAS ASS SSP SPD PDD DDT DTT TTD TDT DTQ TQY QYF	KLGGALQAK
34225	CAS ASS SSS SSL SLG LGG GGV GVD VDT DTE TEA EAF AFF	KLGGALQAK
35972	CAS ASS SSF SFV FVG VGG GGS GSY SYE YEQ EQY QYF	KLGGALQAK
15723	CAS ASS SST STS TST STG TGT GTG TGY GYG YGY GYT YTF	GILGFVFTL
2527	CAS ASS SSL SLT LTL TLG LGE GEQ EQG QGF GFY FYG YGY GYT YTF	KLGGALQAK
5551	CAS ASS SSA SAR ARS RSG SGE GEP EPQ PQH QHF	GILGFVFTL
18075	CAS ASS SSL SLY LYS YSA SAT ATG TGE GEL ELF LFF	AVFDRKSDAK
30409	CAS ASS SSI SIR IRA RAS ASV SVE VEQ EQY QYF	GILGFVFTL
5640	CAS ASS SSI SIG IGS GSY SYG YGY GYT YTF	GILGFVFTL
34383	CAS ASS SSP SPQ PQG QGT GTG TGL GLY LYE YEQ EQY QYF	KLGGALQAK
36323	CAS ASS SSY SYS YSK SKA KAG AGA GAH AHE HEQ EQY QYF	KLGGALQAK
35014	CAS ASR SRY RYT YTG TGN GNT NTE TEA EAF AFF	KLGGALQAK
16091	CAS ASS SSQ SQR QRP RPS PSE SEV EVG VGE GEL ELF LFF	RAKFKQLL
26521	CSA SAS ASS SSL SLT LTS TSG SGG GGA GAP APE PEQ EQY QYF	KLGGALQAK
34765	CAS ASS SSL SLG LGT GTN TNS NSG SGN GNT NTI TIY IYF	KLGGALQAK
23241	CAS ASS SSL SLP LPG PGT GTG TGG GGS GSP SPL PLH LHF	GILGFVFTL
34184	CAS ASS SSQ SQE QEI EIG IGG GGN GNQ NQP QPQ PQH QHF	KLGGALQAK
661	CAS ASR SRP RPT PTG TGL GLG LGQ GQP QPQ PQH QHF	ELAGIGILTV
27099	CSV SVG VGD GDR DRA RAY AYG YGY GYT YTF	KLGGALQAK
35850	CAS ASS SSI SIG IGN GNT NTE TEA EAF AFF	KLGGALQAK
23205	CAT ATS TSS SSD SDR DRD RDQ DQP QPQ PQH QHF	KLGGALQAK
34220	CAS ASS SSQ SQV QVD VDR DRV RVT VTD TDT DTQ TQY QYF	KLGGALQAK
15794	CAS ASS SST STS TST STG TGT GTG TGY GYG YGY GYT YTF	RAKFKQLL
11	CAT ATS TSS SSV SVT VTG TGE GEL ELF LFF	KLGGALQAK
24803	CAS ASS SSL SLG LGV GVA VAG AGT GTN TNT NTG TGE GEL ELF LFF	GILGFVFTL
5124	CAS ASR SRT RTG TGN GNL NLN LNT NTE TEA EAF AFF	KLGGALQAK
32594	CAS ASS SSI SIR IRS RSG SGE GET ETQ TQY QYF	GILGFVFTL
32002	CAS ASS SSF SFR FRS RSG SGI GIE IEQ EQY QYF	GILGFVFTL
262	CAS ASS SSQ SQV QVS VSS SSR SRQ RQP QPH PHT HTE TEA EAF AFF	RAKFKQLL
6234	CAS ASS SSL SLR LRS RSS SSY SYE YEQ EQY QYF	GILGFVFTL
14645	CAS ASS SSD SDR DRG RGE GET ETE TEA EAF AFF	KLGGALQAK
35829	CAS ASS SSH SHW HWQ WQI QIS ISN SNQ NQP QPQ PQH QHF	KLGGALQAK
242	CAS ASS SSQ SQY QYV YVF VFQ FQG QGS GSY SYG YGY GYT YTF	KLGGALQAK
144	CAS ASS SSP SPD PDL DLD LDT DTQ TQY QYF	KLGGALQAK
6855	CAS ASS SSI SIR IRS RSS SSY SYE YEQ EQY QYF	GILGFVFTL
34524	CAS ASS SSP SPG PGT GTA TAT ATD TDT DTQ TQY QYF	KLGGALQAK
31861	CAS ASS SSV SVR VRS RSS SSY SYE YEQ EQY QYF	GILGFVFTL
27110	CSV SVG VGQ GQG QGP GPY PYE YEQ EQY QYF	RAKFKQLL
18064	CAS ASS SSF SFL FLA LAG AGT GTD TDT DTQ TQY QYF	GLCTLVAML
34959	CAS ASS SSF SFG FGG GGD GDA DAE AEA EAF AFF	KLGGALQAK
24304	CAV AVN VNG NGL GLA LAG AGP GPT PTD TDT DTQ TQY QYF	KLGGALQAK
5816	CAS ASS SSI SIR IRS RSS SSY SYE YEQ EQY QYF	GILGFVFTL
23663	CAS ASS SSP SPH PHF HFQ FQV QVD VDT DTG TGE GEL ELF LFF	RAKFKQLL
5021	CAS ASS SSS SSG SGG GGT GTY TYG YGY GYT YTF	KLGGALQAK
12702	CAS ASS SSF SFS FSG SGN GNT NTG TGE GEL ELF LFF	RAKFKQLL
7996	CAS ASS SSF SFL FLD LDR DRG RGP GPN PNT NTE TEA EAF AFF	RAKFKQLL
34982	CAS ASS SSL SLG LGT GTK TKT KTI TIA IAK AKN KNI NIQ IQY QYF	KLGGALQAK
36212	CAI AIS ISR SRT RTG TGG GGS GSN SNT NTE TEA EAF AFF	IVTDFSVIK
6259	CAS ASS SSP SPR PRS RST STD TDT DTQ TQY QYF	GILGFVFTL
36179	CAS ASS SSL SLL LLG LGQ GQK QKA KAF AFF	KLGGALQAK
34764	CAS ASS SSL SLG LGT GTG TGV GVK VKE KET ETQ TQY QYF	KLGGALQAK
16000	CAS ASS SSQ SQE QEE EEG EGT GTR TRE REL ELF LFF	KLGGALQAK
36311	CAS ASS SSP SPA PAH AHT HTG TGE GEL ELF LFF	KLGGALQAK
17881	CAS ASS SSF SFF FFR FRS RSG SGG GGS GSL SLN LNY NYG YGY GYT YTF	KLGGALQAK
28306	CSV SVY VYR YRA RAE AER ERG RGS GSY SYG YGY GYT YTF	KLGGALQAK
31928	CAS AST STV TVF VFQ FQG QGG GGG GGQ GQP QPQ PQH QHF	GILGFVFTL
24381	CAS ASS SSL SLG LGT GTS TSG SGG GGT GTG TGE GEL ELF LFF	RAKFKQLL
34425	CAS ASS SSW SWI WID IDT DTQ TQY QYF	KLGGALQAK
14263	CAS ASS SSP SPG PGQ GQP QPE PET ETQ TQY QYF	KLGGALQAK
6230	CAS ASS SSK SKR KRS RST STG TGE GEL ELF LFF	GILGFVFTL
35452	CSA SAR ARV RVP VPA PAG AGA GAS AST STD TDT DTQ TQY QYF	KLGGALQAK
122	CAS ASS SSE SEE EEH EHT HTG TGV GVG VGS GSN SNQ NQP QPQ PQH QHF	AVFDRKSDAK
6635	CAS ASS SSI SIG IGS GSY SYG YGY GYT YTF	GILGFVFTL
3041	CAS ASS SSW SWG WGG GGG GGS GSH SHY HYG YGY GYT YTF	IVTDFSVIK
2364	CAS ASS SSL SLK LKQ KQS QSP SPH PHT HTE TEA EAF AFF	RAKFKQLL
191	CAS ASS SSQ SQQ QQG QGG GGY GYE YEQ EQY QYF	KLGGALQAK
32667	CAS ASS SSI SIR IRS RSS SSY SYE YEQ EQY QYF	GILGFVFTL
2418	CAS ASS SSF SFR FRL RLT LTN TNT NTG TGE GEL ELF LFF	KLGGALQAK
23876	CAS ASS SSL SLE LEW EWG WGG GGE GET ETQ TQY QYF	KLGGALQAK
34294	CAS ASS SSL SLI LIS ISG SGH GHH HHL HLM LMN MNT NTE TEA EAF AFF	KLGGALQAK
35323	CAW AWP WPG PGL GLS LSG SGY GYT YTF	KLGGALQAK
6569	CAS ASR SRL RLV LVS VSM SMN MNT NTE TEA EAF AFF	KLGGALQAK
34457	CAS ASR SRD RDL DLG LGP GPE PEQ EQF QFF	KLGGALQAK
25887	CAS ASS SSS SSR SRD RDG DGG GGT GTD TDT DTQ TQY QYF	KLGGALQAK
34683	CAS ASS SSP SPT PTG TGT GTA TAT ATL TLS LSY SYT YTF	KLGGALQAK
34498	CAS ASS SSR SRT RTS TSG SGG GGG GGA GAQ AQY QYF	KLGGALQAK
18086	CAS ASS SSP SPP PPG PGT GTG TGE GEA EAQ AQA QAF AFF	KLGGALQAK
24290	CAS ASS SSN SNS NSW SWG WGS GSY SYE YEQ EQY QYF	GLCTLVAML
5033	CAS ASR SRE REG EGG GGG GGG GGT GTE TEA EAF AFF	KLGGALQAK
30429	CAS ASS SSI SIR IRS RSA SAY AYE YEQ EQY QYF	GILGFVFTL
33453	CAS ASS SSI SIY IYS YSN SNQ NQP QPQ PQH QHF	GILGFVFTL
35343	CSA SAR ARV RVV VVL VLS LSR SRG RGY GYG YGY GYT YTF	KLGGALQAK
31936	CAG AGR GRG RGT GTD TDD DDY DYG YGY GYT YTF	GILGFVFTL
16949	CAS ASK SKS KSE SEK EKG KGA GAG AGG GGS GSP SPL PLH LHF	KLGGALQAK
36286	CSA SAR ARR RRG RGD GDT DTD TDT DTQ TQY QYF	KLGGALQAK
6944	CAS ASS SSI SIR IRS RSS SSY SYE YEQ EQY QYF	GILGFVFTL
5514	CAS ASS SSP SPG PGS GSG SGN GNT NTI TIY IYF	ELAGIGILTV
34766	CAS ASS SSL SLG LGT GTS TSG SGY GYY YYE YEQ EQY QYF	KLGGALQAK
17965	CAS ASS SSV SVA VAV AVG VGT GTG TGS GSG SGA GAN ANV NVL VLT LTF	AVFDRKSDAK
24987	CAS ASS SSL SLY LYG YGR GRT RTT TTD TDT DTQ TQY QYF	KLGGALQAK
24995	CAS ASS SSS SSM SMT MTK TKS KSW SWE WET ETQ TQY QYF	KLGGALQAK
14644	CAS ASS SSD SDR DRD RDY DYL YLI LIH IHE HEQ EQF QFF	KLGGALQAK
35959	CAS AST STT TTW TWD WDS DSN SNQ NQP QPQ PQH QHF	KLGGALQAK
1168	CAS ASS SSL SLY LYS YSA SAT ATG TGE GEL ELF LFF	AVFDRKSDAK
5655	CAS ASS SSI SIR IRA RAG AGD GDN DNT NTE TEA EAF AFF	GILGFVFTL
35022	CAS ASS SSP SPP PPG PGT GTS TSG SGS GSS SSS SSY SYN YNE NEQ EQF QFF	KLGGALQAK
34951	CAS ASS SSL SLY LYG YGG GGA GAG AGE GEQ EQY QYF	KLGGALQAK
35693	CAS ASS SSE SEG EGD GDT DTQ TQY QYF	KLGGALQAK
35135	CAS ASR SRQ RQG QGG GGT GTS TSP SPL PLH LHF	IVTDFSVIK
16003	CAS ASS SSQ SQE QEG EGQ GQL QLN LNQ NQP QPQ PQH QHF	RAKFKQLL
13820	CAS ASS SSF SFT FTG TGG GGD GDL DLY LYG YGY GYT YTF	RAKFKQLL
25023	CAS ASS SSK SKG KGL GLT LTG TGN GNY NYE YEQ EQY QYF	KLGGALQAK
2365	CAS ASS SSL SLL LLG LGS GSP SPL PLH LHF	KLGGALQAK
34726	CAS ASS SSP SPG PGV GVT VTG TGE GEL ELF LFF	KLGGALQAK
28731	CAS ASS SST STT TTA TAG AGD GDT DTE TEA EAF AFF	RAKFKQLL
26501	CSA SAR ARW RWG WGG GGG GGT GTD TDT DTQ TQY QYF	GLCTLVAML
35907	CAS ASS SSM SMS MSG SGP GPG PGT GTE TEA EAF AFF	KLGGALQAK
35694	CAS ASS SSE SEG EGQ GQG QGM GMA MAY AYE YEQ EQY QYF	KLGGALQAK
28376	CAS ASS SSL SLM LMR MRG RGG GGT GTY TYN YNS NSP SPL PLH LHF	KLGGALQAK
5408	CAS ASS SSS SSG SGG GGA GAR ARE RET ETQ TQY QYF	ELAGIGILTV
2384	CAS ASS SSP SPG PGL GLG LGN GNT NTI TIY IYF	ELAGIGILTV
35088	CAS ASS SSL SLA LAE AES ESE SET ETQ TQY QYF	KLGGALQAK
28862	CAS ASR SRD RDG DGE GEL ELF LFF	KLGGALQAK
35559	CSV SVE VET ETD TDY DYG YGY GYT YTF	KLGGALQAK
18105	CAS ASS SSF SFT FTG TGG GGR GRS RSS SSY SYN YNE NEQ EQF QFF	RAKFKQLL
28356	CTT TTS TSS SSG SGE GEA EAD ADT DTQ TQY QYF	RAKFKQLL
34453	CAS ASI SIA IAG AGP GPG PGT GTG TGG GGE GEK EKL KLF LFF	KLGGALQAK
16186	CAS ASS SSQ SQR QRP RPS PSE SEV EVG VGE GEL ELF LFF	RAKFKQLL
15156	CAS ASS SSL SLL LLW LWA WAE AEY EYN YNE NEQ EQF QFF	RAKFKQLL
4943	CAS ASS SSL SLH LHR HRS RSS SSS SSS SSY SYE YEQ EQY QYF	IVTDFSVIK
35957	CAS AST STR TRG RGG GGS GSS SSY SYN YNE NEQ EQF QFF	KLGGALQAK
5058	CAS ASS SSL SLC LCC CCS CSP SPN PNT NTG TGE GEL ELF LFF	KLGGALQAK
35129	CAS ASS SSS SSP SPP PPG PGL GLA LAG AGS GSH SHE HEQ EQF QFF	KLGGALQAK
35252	CAS ASS SSP SPG PGQ GQV QVQ VQP QPQ PQH QHF	KLGGALQAK
34390	CAS ASS SST STR TRG RGL GLA LAE AEE EEQ EQF QFF	KLGGALQAK
22102	CAS ASS SSL SLR LRD RDG DGS GSE SEA EAF AFF	RAKFKQLL
34632	CAS ASS SSL SLG LGG GGP GPA PAL ALD LDQ DQP QPQ PQH QHF	KLGGALQAK
5598	CAS ASS SSG SGR GRS RST STG TGE GEL ELF LFF	GILGFVFTL
28827	CAS ASS SSY SYP YPQ PQG QGT GTG TGT GTE TEA EAF AFF	KLGGALQAK
25798	CAS ASS SSS SSA SAA AAA AAY AYE YEQ EQY QYF	RAKFKQLL
25698	CAS ASS SSN SNS NSA SAG AGE GEL ELF LFF	KLGGALQAK
6705	CAS ASS SSI SIR IRS RSN SNQ NQP QPQ PQH QHF	GILGFVFTL
35229	CAS ASS SSL SLF LFG FGY GYE YEQ EQY QYF	KLGGALQAK
34989	CAS ASS SSL SLV LVL VLA LAG AGG GGE GEQ EQY QYF	KLGGALQAK
36115	CAS ASS SSE SEG EGQ GQE QES ESF SFS FSP SPL PLH LHF	KLGGALQAK
7159	CAS ASS SSS SSF SFG FGG GGR GRE REL ELF LFF	GILGFVFTL
5270	CSV SVE VEP EPG PGL GLA LAG AGA GAP APQ PQE QET ETQ TQY QYF	KLGGALQAK
2292	CAS ASS SSL SLG LGD GDP DPT PTN TNY NYG YGY GYT YTF	KLGGALQAK
24569	CAS ASS SSL SLG LGT GTS TSG SGG GGT GTG TGE GEL ELF LFF	GILGFVFTL
34725	CAS ASS SSN SNR NRG RGL GLL LLA LAE AEA EAF AFF	KLGGALQAK
28879	CAI AIK IKA KAP APG PGT GTG TGG GGY GYE YEQ EQY QYF	RAKFKQLL
34270	CAS ASS SSQ SQE QEG EGG GGF GFT FTD TDT DTQ TQY QYF	KLGGALQAK
5022	CAS ASS SSS SSI SIR IRG RGP GPL PLS LSG SGN GNT NTI TIY IYF	GILGFVFTL
34905	CAS ASS SSN SNQ NQG QGH GHD HDG DGY GYT YTF	KLGGALQAK
5465	CAS ASS SST STS TSH SHV HVG VGT GTE TEA EAF AFF	GILGFVFTL
5264	CQQ QQQ QQK QKS KSY SYE YEQ EQY QYF	GILGFVFTL
35404	CSA SAG AGT GTV TVT VTD TDT DTQ TQY QYF	KLGGALQAK
17063	CAS ASS SSY SYS YSG SGG GGA GAG AGE GEL ELF LFF	RAKFKQLL
2236	CAS ASS SSV SVG VGG GGP GPP PPP PPD PDT DTQ TQY QYF	KLGGALQAK
31403	CAS ASS SSL SLT LTV TVL VLY LYG YGY GYT YTF	GILGFVFTL
5070	CAS ASS SSL SLT LTF TFS FSG SGA GAN ANV NVL VLT LTF	RAKFKQLL
19401	CAS ASS SSL SLR LRD RDG DGS GSE SEA EAF AFF	RAKFKQLL
35305	CAS ASS SSS SSG SGP GPG PGE GEV EVQ VQP QPQ PQH QHF	KLGGALQAK
35865	CAS ASS SSI SIL ILG LGG GGG GGY GYN YNE NEQ EQF QFF	KLGGALQAK
34416	CAS ASS SSV SVG VGT GTS TSG SGG GGY GYE YEQ EQY QYF	KLGGALQAK
5228	CSA SAH AHS HSG SGT GTS TSG SGS GSS SSE SEQ EQY QYF	GILGFVFTL
594	CAS ASS SSV SVA VAG AGQ GQD QDT DTD TDT DTQ TQY QYF	KLGGALQAK
28456	CAS ASK SKS KSP SPG PGQ GQG QGR GRS RSG SGA GAN ANV NVL VLT LTF	KLGGALQAK
34872	CAS ASS SSV SVP VPR PRD RDR DRD RDY DYL YLE LET ETQ TQY QYF	KLGGALQAK
17869	CAS ASS SSA SAD ADP DPS PSQ SQG QGD GDG DGN GNY NYG YGY GYT YTF	KLGGALQAK
34775	CAS ASS SSL SLQ LQE QES ESS SSY SYN YNS NSP SPL PLH LHF	KLGGALQAK
5249	CSA SAR ARG RGM GME MER ERE REA EAL ALE LET ETQ TQY QYF	KLGGALQAK
869	CAS ASS SSL SLY LYS YSA SAT ATG TGE GEL ELF LFF	AVFDRKSDAK
25073	CAS ASS SSL SLE LEV EVG VGL GLG LGG GGY GYT YTF	GILGFVFTL
34285	CAS ASS SSQ SQT QTL TLG LGG GGS GSY SYG YGY GYT YTF	KLGGALQAK
34689	CAS ASS SSR SRL RLN LNN NNE NEQ EQF QFF	KLGGALQAK
34577	CAT ATS TSS SSG SGY GYY YYG YGY GYT YTF	KLGGALQAK
35917	CAS ASS SSP SPG PGT GTQ TQG QGI GIE IED EDT DTQ TQY QYF	KLGGALQAK
35971	CAS ASS SSA SAP APR PRG RGP GPG PGT GTN TNE NEQ EQF QFF	KLGGALQAK
15215	CAS ASS SSL SLL LLW LWA WAE AEY EYN YNE NEQ EQF QFF	RAKFKQLL
32635	CAS ASS SSI SIR IRS RSS SSY SYE YEQ EQY QYF	GILGFVFTL
5404	CAS ASS SSP SPI PIR IRD RDR DRG RGC GCY CYE YEQ EQY QYF	RAKFKQLL
17178	CAS ASS SSG SGS GST STS TSQ SQG QGG GGD GDT DTG TGE GEL ELF LFF	KLGGALQAK
30425	CAS ASS SSI SIR IRS RSA SAY AYE YEQ EQY QYF	GILGFVFTL
5177	CSA SAR ARG RGD GDY DYS YSF SFH FHE HEQ EQF QFF	KLGGALQAK
