36317	CA AV VN NW WE EE EQ QG GG GS SY YI IP PT TF	CA AS SS ST TP PG GQ QG GA AG GE EQ QF FF	KLGGALQAK
26468	CP PL LP PT TN NA AG GK KS ST TF	CS SA AR RD DY YR RT TG GD DE EK KL LF FF	KLGGALQAK
35465	CA AE ES SG GA AT TN NK KL LI IF	CS SA AW WD DR RL LN NT TE EA AF FF	KLGGALQAK
34834	CA AS SI IN ND DY YK KL LS SF	CA AS SS SL LS SG GT TG GE EL LF FF	KLGGALQAK
35234	CA AV VR RD DT TG GG GG GS SY YI IP PT TF	CA AS SS SL LL LR RD DI IP PP PG GE EL LF FF	KLGGALQAK
16058	CA AG GG GG GS SQ QG GN NL LI IF	CA AS SS SQ QR RP PS SE EV VG GE EL LF FF	RAKFKQLL
36138	CA AE EI IP PS SG GA AG GS SY YQ QL LT TF	CA AS SS SP PG GQ QG GP PY YE EQ QY YF	KLGGALQAK
5491	CI IL LR RD DG GD DD DK KI II IF	CA AS SS SY YG GG GE EN NN NS SP PL LH HF	KLGGALQAK
34927	CA AV VR RK KG GG GG GA AD DG GL LT TF	CA AI IN NL LG GG GT TN NT TG GE EL LF FF	KLGGALQAK
2336	CA AA AS SP PF FS SY YN NT TD DK KL LI IF	CA AS SS SF FG GQ QL LH HI IE EY YF	KLGGALQAK
25076	CA AL LS SE EA AT TG GN NQ QF FY YF	CA AS SS SL LG GM MR RG GG GW WD DE EQ QF FF	KLGGALQAK
34198	CA AV VN NL LG GN NS SG GY YA AL LN NF	CA AS SS SQ QG GR RL LR RT TE EA AF FF	KLGGALQAK
34538	CL LV VG GD DA AY YS SG GA AG GS SY YQ QL LT TF	CA AS SS SG GE ET TY YE EQ QY YF	KLGGALQAK
34062	CA AV VG GA AR RS SG GT TY YK KY YI IF	CA AS SS SL LI IL LT TD DG GT TD DT TQ QY YF	KLGGALQAK
15145	CA AF FT TS SD DS SN NY YQ QL LI IW	CA AS SS SL LL LW WA AE EY YN NE EQ QF FF	RAKFKQLL
18093	CA AA AL LE ET TS SY YD DK KV VI IF	CA AS ST TR RQ QG GA AN NE EK KL LF FF	RAKFKQLL
36331	CA AP PS SN NT TG GN NQ QF FY YF	CA AS SS SR RG GA AL LP PV VD DE EQ QY YF	KLGGALQAK
36191	CA AV VR RG GL LG GG GS SQ QG GN NL LI IF	CA AS SS SL LV VG GE EQ QF FF	KLGGALQAK
7318	CA AG GE EG GG GG GS SQ QG GN NL LI IF	CA AS SS SI IR RS SS SY YE EQ QY YF	GILGFVFTL
33475	CV VV VN NR RD DY YQ QL LI IW	CA AS SS SL LT TS SP PG GN NT TI IY YF	KLGGALQAK
32525	CA AG GA AA AG GS SS SN NT TG GK KL LI IF	CA AS SS SI IR RS SA AY YE EQ QY YF	GILGFVFTL
34114	CA AE EI IR RG GR RD DQ QF FY YF	CA AS SS SD DR RM MN NT TE EA AF FF	KLGGALQAK
18026	CA AD DS SG GG GG GA AD DG GL LT TF	CA AS SS SV VR RS SS SM MN NT TE EA AF FF	RAKFKQLL
28596	CA AV VM MD DS SN NY YQ QL LI IW	CA AS SL LL LG GT TG GG GY YE EQ QY YF	KLGGALQAK
5220	CA AD DS SG GG GG GA AD DG GL LT TF	CS SA AT TL LT TS SG GG GI IY YE EQ QY YF	RAKFKQLL
32775	CA AE EN NG GG GG GG GA AD DG GL LT TF	CA AS SS SI IR RS SS SY YE EQ QY YF	GILGFVFTL
26150	CA AY YR RV VD DD DM MR RF	CS SA AP PR RG GS SP PT TN NE EK KL LF FF	RAKFKQLL
34803	CA AV VE EL LA AG GS SN NY YQ QL LI IW	CA AS SH HS SG GT TG GE EE EQ QY YF	KLGGALQAK
26116	CA AV VA AK KD DL LQ QN NS SG GG GG GA AD DG GL LT TF	CS SA AE EW WD DR RA AY YN NE EQ QF FF	GILGFVFTL
34640	CS SP PS SR RG GA AG GN NM ML LT TF	CA AS SS SL LK KG GN NY YG GY YT TF	KLGGALQAK
29	CA AV VP PS SG GG GY YN NK KL LI IF	CA AS SG GL LD DS SS SS SG GN NT TI IY YF	KLGGALQAK
32519	CA AL LA AP PE EG GQ QK KL LL LF	CA AS SS SI IR RA AS SH HE EQ QF FF	GILGFVFTL
27098	CA AV VR RM MD DS SS SY YK KL LI IF	CS SV VG GA AG GE EG GE EQ QF FF	RAKFKQLL
35895	CA AV VS SG GG GG GA AD DG GL LT TF	CA AS SS SL LG GR RA AY YG GY YT TF	KLGGALQAK
23893	CA AA AS SM MD DS SN NY YQ QL LI IW	CA AS SS SL LG GY YG GG GA AG GE ET TQ QY YF	KLGGALQAK
2565	CL LL LR RT TG GA AN NS SK KL LT TF	CA AS SS SL LG GT TS SG GM MG GE EQ QY YF	KLGGALQAK
1588	CA AA AS SE ET TS SY YD DK KV VI IF	CA AS SS SL LY YS SA AT TG GE EL LF FF	AVFDRKSDAK
34301	CA AE ES SM MY YS SG GG GG GA AD DG GL LT TF	CA AS SS SP PI IP PG GG GS SD DT TQ QY YF	KLGGALQAK
25028	CA AE EN ND DH HN NN NN ND DM MR RF	CA AS SS SL LV VG GS SA AS SG GY YN NS SP PL LH HF	GILGFVFTL
36126	CA AM MR RE EE EF FG GG GT TG GA AN NS SK KL LT TF	CA AS SS SL LG GL LG GG GD DT TQ QY YF	KLGGALQAK
34460	CA AM MR RE EG GP PN NN NF FN NK KF FY YF	CA AS SS SA AS SD DN NL LD DN NE EQ QF FF	KLGGALQAK
35743	CA AV VR RR RS SN ND DY YK KL LS SF	CA AS ST TP PL LR RL LM MN NT TG GE EL LF FF	KLGGALQAK
24638	CI IV VR RD DM ME EY YG GN NK KL LV VF	CA AS SS SL LV VV VA AG GG GP PG GT TD DT TQ QY YF	RAKFKQLL
25218	CA AE ER RG GG GG GS ST TL LG GR RL LY YF	CA AS SS SL LG GV VA AG GT TN NT TG GE EL LF FF	KLGGALQAK
5033	CA AG GA AE EY YG GQ QN NF FV VF	CA AS SR RE EG GG GG GG GT TE EA AF FF	KLGGALQAK
18532	CA AG GA AS SG GS SS SN NT TG GK KL LI IF	CA AS SS SL LR RD DG GS SE EA AF FF	RAKFKQLL
35161	CA AL LS SD DT TS SG GN NT TP PL LV VF	CA AS SS SL LG GT TG GG GY YN NE EQ QF FF	KLGGALQAK
35877	CA AA AL LG GQ QN NF FV VF	CA AS SS SI IS SG GT TG GG GF FY YE EQ QF FF	KLGGALQAK
22322	CV VV VS SD DI IY YN NN NA AG GN NM ML LT TF	CA AS SS SR RF FR RD DS ST TN NE EQ QF FF	KLGGALQAK
4786	CA AV VR RD DG GG GS SG GY YS ST TL LT TF	CA AS SS SW WG GG GG GS SH HY YG GY YT TF	IVTDFSVIK
5058	CA AA AP PY YT TP PG GG GA AT TN NK KL LI IF	CA AS SS SL LC CC CS SP PN NT TG GE EL LF FF	KLGGALQAK
2339	CA AT TD DA AG GA AR RQ QG GG GS SE EK KL LV VF	CA AS SS SF FL LA AG GQ QE ET TQ QY YF	AVFDRKSDAK
28720	CA AV VM MD DS SN NY YQ QL LI IW	CA AS ST TS SG GL LA AE EL LY YN NE EQ QF FF	KLGGALQAK
6807	CS ST TG GG GS SQ QG GN NL LI IF	CA AS SS SI IR RS SS SY YE EQ QY YF	GILGFVFTL
597	CA AV VR RD DP PH HQ QG GT TD DK KL LI IF	CA AS SS SV VD DG GD DT TS ST TD DT TQ QY YF	GILGFVFTL
17954	CA AA AM ME ET TS SY YD DK KV VI IF	CA AS SS ST TR RT TG GT TE ET TN NT TG GE EL LF FF	RAKFKQLL
7253	CA AM MS SA AM MV VG GN NE EK KL LT TF	CA AS SS SH HV VG GT TG GW WD DL LR RT TD DT TQ QY YF	KLGGALQAK
78	CA AA AT TS SN NT TG GK KL LI IF	CA AS SR RT TR RE EG GR RT TD DT TQ QY YF	RAKFKQLL
7294	CA AV VA AK KD DL LQ QN NS SG GG GG GA AD DG GL LT TF	CA AS SS SA AR RS SS ST TE EQ QY YF	GILGFVFTL
2534	CA AT TG GG GN NE EK KL LT TF	CA AS SS SY YG GG GY YT TE EA AF FF	IVTDFSVIK
20756	CA AG GE EL LT TP PT TS SS SS SL	CA AS SS SL LR RD DG GS SE EA AF FF	RAKFKQLL
31933	CA AG GN NY YG GG GS SQ QG GN NL LI IF	CA AA AS ST TR RS ST TD DT TQ QY YF	GILGFVFTL
24316	CA AA AS SR RN NA AG GN NN NR RK KL LI IW	CA AS SS SR RD DT TS SS SY YE EQ QY YF	KLGGALQAK
5135	CA AD DS SG GG GG GA AD DG GL LT TF	CA AW WT TG GT TG GK KI IG GW WD DS SP PL LH HF	RAKFKQLL
2527	CA AV VN NA AW WD DD DK KI II IF	CA AS SS SL LT TL LG GE EQ QG GF FY YG GY YT TF	KLGGALQAK
18072	CA AL LR RE ET TS SY YD DK KV VI IF	CA AS SS SL LY YS SA AT TG GE EL LF FF	RAKFKQLL
7711	CA AV VS SN NT TG GN NQ QF FY YF	CA AS SS SF FL LD DR RG GP PN NT TE EA AF FF	RAKFKQLL
16980	CA AV VE EI ID DD DK KI II IF	CA AS SS SP PI IS SG GS SS SY YE EQ QY YF	KLGGALQAK
35618	CA AV VR RD DR RD DY YK KL LS SF	CA AS SS SR RD DT TA AT TG GE EL LF FF	KLGGALQAK
25383	CA AE ER RE ET TS SY YD DK KV VI IF	CA AS SS SH HS SE EG GA AE EN NI IQ QY YF	RAKFKQLL
250	CA AY YS SV VN NA AG GG GT TS SY YG GK KL LT TF	CA AS SS SP PP PF FH HE EQ QY YF	GILGFVFTL
28411	CA AD DS SG GG GG GA AD DG GL LT TF	CA AS SS SL LR RG GS SM MN NT TE EA AF FF	RAKFKQLL
19486	CA AV VS SA AS SG GT TY YK KY YI IF	CA AS SS SL LR RD DG GS SE EA AF FF	RAKFKQLL
21712	CA AE EN NS SE ED DT TD DK KL LI IF	CA AS SS SL LR RD DG GS SE EA AF FF	RAKFKQLL
2248	CA AV VS SD DR RG GY YS ST TL LT TF	CA AS SS SL LD DR RT TG GE EY YE EQ QY YF	IVTDFSVIK
28956	CA AV VN NT TG GI IS SG GG GG GA AD DG GL LT TF	CA AS SN NH HL LG GI IG GQ QP PQ QH HF	ELAGIGILTV
23018	CA AG GE EG GG GG GS SQ QG GN NL LI IF	CA AS SS SL LG GT TA AN NY YG GY YT TF	GILGFVFTL
34911	CV VV VS SP PN NS SG GN NT TP PL LV VF	CA AI IG GF FP PS SG GG GP PW WT TG GE EL LF FF	KLGGALQAK
15570	CV VV VN NE EG GG GG GA AD DG GL LT TF	CA AS SS SQ QV VI IQ QT TP PN NY YG GY YT TF	KLGGALQAK
6560	CA AV VR RD DG GT TG GA AN NN NL LF FF	CA AS SN NP PS SS ST TD DT TQ QY YF	GILGFVFTL
2559	CA AG GH HT TG GN NQ QF FY YF	CA AS SS SL LE EG GQ QL LF FY YE EQ QY YF	IVTDFSVIK
28714	CA AV VL LD DS SN NY YQ QL LI IW	CA AS SS SP PK KI IG GT TG GA AN NV VL LT TF	KLGGALQAK
14528	CA AV VK KT TG GG GY YQ QK KV VT TF	CA AS SS SP PP PG GG GG GN NT TG GE EL LF FF	RAKFKQLL
29960	CA AV VV VR RG GS SM MD DS SN NY YQ QL LI IW	CA AS SS SI IF FT TI IE EP PQ QH HF	GILGFVFTL
177	CA AV VR RD DR RG GS ST TL LG GR RL LY YF	CA AS SS SQ QD DG GK KA AQ QY YF	KLGGALQAK
23071	CA AL LV VT TF FT TG GG GG GN NK KL LT TF	CA AS SS SS ST TG GG GG GE EK KD DQ QP PQ QH HF	GILGFVFTL
24305	CA AV VQ QE EH HG GS SS SN NT TG GK KL LI IF	CA AS SS SF FS SG GN NT TG GE EL LF FF	RAKFKQLL
5469	CA AV VG GA AG GR RR RA AL LT TF	CA AT TA AL LG GD DS SY YE EQ QY YF	ELAGIGILTV
2493	CA AF FG GS SS SS SA AS SK KI II IF	CA AI IS SA AG GD DS SP PL LH HF	KLGGALQAK
12702	CA AM MR RE ET TN NQ QA AG GT TA AL LI IF	CA AS SS SF FS SG GN NT TG GE EL LF FF	RAKFKQLL
34192	CA AT TD DA AS SQ QA AG GT TA AL LI IF	CA AS SS SQ QG GL LA AS SS SY YE EQ QY YV	KLGGALQAK
11360	CA AF FM MP PP PY YN NT TD DK KL LI IF	CA AS SS SF FS SG GN NT TG GE EL LF FF	RAKFKQLL
24221	CA AE ER RE ET TS SY YD DK KV VI IF	CA AS SS SF FT TG GA AE EG GT TG GE EL LF FF	RAKFKQLL
34573	CA AI IG GP PG GN NM ML LT TF	CA AT TS SR RQ QT TS SI IE EQ QF FF	KLGGALQAK
36137	CA AT TD DP PD DT TG GR RR RA AL LT TF	CA AS SS SL LL LI IR RE EA AY YT TF	KLGGALQAK
24820	CA AD DE ES SG GG GS SQ QG GN NL LI IF	CA AS SS SL LG GV VA AG GT TN NT TG GE EL LF FF	RAKFKQLL
35344	CA AV VS SE EI IQ QG GA AQ QK KL LV VF	CS SA AA AQ QG GK KG GV VY YT TE EA AF FF	KLGGALQAK
34898	CV VV VT TD DY YS SS SA AS SK KI II IF	CA AS SS SE EL LR RA AG GQ QD DG GY YT TF	KLGGALQAK
5433	CA AA AS SR RG GK KG GG GG GA AD DG GL LT TF	CA AS SS SY YS ST TG GT TV VD DY YE EQ QY YF	GILGFVFTL
6748	CA AF FG GG GS SQ QG GN NL LI IF	CA AS SS SI IR RS SS SE ET TQ QY YF	GILGFVFTL
14625	CA AV VI IS SN NS SG GY YA AL LN NF	CA AS ST TT TT TG GN NT TD DT TQ QY YF	GLCTLVAML
642	CA AY YR RR RM ME ET TD DS SW WG GK KL LQ QF	CA AS SS SV VV VL LS ST TD DT TQ QY YF	IVTDFSVIK
29936	CA AE EG GG GN NG GG GS SQ QG GN NL LI IF	CA AS SS SG GR RS SN NT TE EA AF FF	GILGFVFTL
34032	CA AS SP PN NT TG GN NQ QF FY YF	CA AS SG GL LA AG GQ QT TS SN NQ QP PQ QH HF	KLGGALQAK
35733	CA AA AS SV VT TH HT TG GA AN NS SK KL LT TF	CA AS SS SY YP PG GE EQ QY YF	KLGGALQAK
17002	CA AA AS SS SG GG GT TS SY YG GK KL LT TF	CA AS SS SP PL LW WV VA AG GG GR RE ET TQ QY YF	KLGGALQAK
6365	CA AG GG GG GS SS SN NT TG GK KL LI IF	CA AS SS SV VR RS SA AY YE EQ QY YF	GILGFVFTL
23007	CA AV VD DP PM MD DT TG GR RR RA AL LT TF	CA AS SS SF FS SV VG GE EN NE EK KL LF FF	RAKFKQLL
25813	CA AV VG GD DN NF FN NK KF FY YF	CA AS SS SS SL LG GG GH HG GE EA AF FF	RAKFKQLL
4933	CA AL LG GN NT TD DK KL LI IF	CA AS SS SA AK KG GL LG GN NT TI IY YF	ELAGIGILTV
35843	CA AA AT TT TY YN NN NN ND DM MR RF	CA AS SS SI IG GG GG GN NT TE EA AF FF	KLGGALQAK
36294	CA AG GQ QA AP PS SG GS SA AR RQ QL LT TF	CS SV VD DL LR RG GP PG GH HG GY YT TF	KLGGALQAK
32709	CV VV VT TE ET TS SY YD DK KV VI IF	CA AS SS SI IR RS SS SY YE EQ QY YF	GILGFVFTL
28602	CI IL LR RG GD DS SG GG GG GA AD DG GL LT TF	CA AS SS SD DD DP PG GF FG GQ QP PQ QH HF	KLGGALQAK
26262	CI IL LR RD DS SN ND DY YK KL LS SF	CS SA AR RD DL LT TG GR RI IY YE EQ QY YF	KLGGALQAK
35861	CA AL LS SR RP PG GA AN NA AG GG GT TS SY YG GK KL LT TF	CA AS SS SI IG GW WE ET TQ QY YF	KLGGALQAK
6691	CA AG GA AS SG GG GG GS SQ QG GN NL LI IF	CA AS SS SI IR RS SG GY YE EQ QF FF	GILGFVFTL
26559	CA AA AS SE EG GG GF FK KT TI IF	CQ QQ QH HV VR RD DR RV VY YG GY YT TF	RAKFKQLL
19628	CA AV VS SR RG GS ST TL LG GR RL LY YF	CA AS SS SL LR RD DG GS SE EA AF FF	RAKFKQLL
35669	CA AV VR RS SS SL LI IQ QG GA AQ QK KL LV VF	CA AS SS SY YV VG GG GP PG GD DT TQ QY YF	KLGGALQAK
34597	CA AY YR RT TT TS SG GT TY YK KY YI IF	CA AS SR RS SW WD DP PD DT TQ QY YF	KLGGALQAK
5151	CA AV VR RD DM MS SG GA AR RG GA AG GS SY YQ QL LT TF	CA AW WV VL LG GP PA AG GD DT TQ QY YF	KLGGALQAK
34664	CA AT TR RT TN NA AG GK KS ST TF	CA AS SS SL LV VS SM MN NT TE EA AF FF	KLGGALQAK
89	CA AL LA AH HG GN NK KL LV VF	CA AS SS SL LT TS SG GE EE ET TQ QY YF	AVFDRKSDAK
35635	CA AV VW WY YM MR RF	CA AS SS SP PT TS SG GT TV VN NE EQ QF FF	KLGGALQAK
34138	CA AL LG GV VY YN NT TD DK KL LI IF	CA AS SS SP PT TG GD DP PG GA AF FF	KLGGALQAK
2392	CA AA AP PN NT TD DK KL LI IF	CA AS SS SS SP PG GG GE ES SP PL LH HF	KLGGALQAK
2299	CA AV VN NK KG GG GG GS SQ QG GN NL LI IF	CA AS SS SL LV VS SL LN NY YG GY YT TF	GILGFVFTL
35330	CA AP PH HY YG GG GA AT TN NK KL LI IF	CA AW WS SP PG GN NY YG GY YT TF	KLGGALQAK
35662	CA AF FQ QG GG GG GS SQ QG GN NL LI IF	CA AS SS SY YS SP PR RK KG GY YE EA AF FF	KLGGALQAK
34452	CA AP PR RG GD DN NY YG GQ QN NF FV VF	CA AS SI IA AG GP PG GT TG GG GE EK KL LF FF	KLGGALQAK
35295	CV VV VN NG GY YG GG GA AT TN NK KL LI IF	CA AS SS SL LS SS SG GQ QG GN NT TE EA AF FF	KLGGALQAK
3258	CA AL LG GG GG GS SE EK KL LV VF	CA AS SS SW WG GG GG GS SH HY YG GY YT TF	IVTDFSVIK
35891	CA AV VH HL LN NA AG GG GT TS SY YG GK KL LT TF	CA AS SS SI IW WG GI IS SG GQ QP PQ QH HF	ELAGIGILTV
36060	CA AV VD DN NN NN ND DM MR RF	CA AS SR RT TS SG GN NE EQ QF FF	KLGGALQAK
28732	CA AV VR RD DY YG GG GS SQ QG GN NL LI IF	CA AS SA AP PG GL LA AG GN NE EQ QF FF	KLGGALQAK
36096	CA AY YR RS SG GG GG GS SE EK KL LV VF	CA AS SS SQ QG GT TY YQ QE ET TQ QY YF	KLGGALQAK
33986	CA AV VR RR RV VG GF FG GN NV VL LH HC	CA AT TM MS SA AG GG GE EQ QY YF	KLGGALQAK
35259	CI IL LR RG GG GI IY YN NN NN ND DM MR RF	CA AS SS SP PV VP PE EE EN NT TE EA AF FF	KLGGALQAK
28450	CA AA AR RV VR RG GF FG GN NV VL LH HC	CA AS SS SD DS SG GT TG GG GS SP PL LH HF	KLGGALQAK
38430	CA AM MR RE ET TD DG GW WS SS SY YK KL LI IF	CA AS SS ST TH HD DR RG GR RS SN NQ QP PQ QH HF	KLGGALQAK
30391	CA AA AK KE EG GY YS ST TL LT TF	CA AS SS SI IG GY YY YG GY YT TF	GILGFVFTL
26039	CA AV VR RD DT TR RY YT TG GN NQ QF FY YF	CA AW WS SD DP PG GG GL LP PW WA AF FF	KLGGALQAK
33931	CA AA AE EV VM MG GD DY YK KL LS SF	CA AS SS SP PH HR RG GL LE EG GY YT TF	RAKFKQLL
34942	CI IL LG GP PS SE ET TS SG GS SR RL LT TF	CA AS SS SL LN NP PV VN NT TE EA AF FF	KLGGALQAK
33846	CA AA AS SN NP PN NG GK KL LT TF	CA AS SS SV VR RS SS SY YE EQ QY YF	GILGFVFTL
34802	CA AV VF FL LY YG GQ QN NF FV VF	CA AS SH HP PQ QS SG GS SW WS SD DT TQ QY YF	KLGGALQAK
33422	CA AG GD DY YG GG GS SQ QG GN NL LI IF	CA AS SS SI IY YS SN NQ QP PQ QH HF	GILGFVFTL
33530	CA AY YR RT TS SI IL LS SN NF FG GN NE EK KL LT TF	CA AS SS SQ QG GS SY YG GY YT TF	GILGFVFTL
34703	CA AE ES SM MD DN ND DM MR RF	CA AS SS SW WD DR RH HK KP PQ QH HF	KLGGALQAK
7659	CA AV VR RV VN NQ QA AG GT TA AL LI IF	CA AS SS SR RG GG GL LS SY YN NE EQ QF FF	GILGFVFTL
34102	CA AV VI IH HN NT TG GN NQ QF FY YF	CA AS SM MG GL LT TL LR RD DT TQ QY YF	ELAGIGILTV
22989	CA AV VR RG GV VH HQ QA AG GT TA AL LI IF	CA AS SS SL LR RD DG GS SE EA AF FF	KLGGALQAK
34384	CA AE EN NM MA AH HY YN NN ND DM MR RF	CA AS SS SP PS SG GG GA AG GN NE EQ QF FF	KLGGALQAK
5458	CA AV VS SE EN ND DM MR RF	CA AS SS SE EG GT TD DP PQ QE ET TQ QY YF	KLGGALQAK
34401	CV VG GP PN NY YG GG GS SQ QG GN NL LI IF	CA AS SS SV VE EA AG GW WD DE EQ QF FF	KLGGALQAK
696	CA AE ES SK KN NN NN NA AR RL LM MF	CA AS SS SL LS SG GY YE EQ QY YF	KLGGALQAK
35833	CA AV VN NQ QA AG GT TA AL LI IF	CA AS SS SI ID DG GG GV VA AY YE EQ QY YF	KLGGALQAK
38422	CA AM MR RE ET TY YN NF FN NK KF FY YF	CA AS SS SY YS SP PD DY YN NS SP PL LH HF	KLGGALQAK
34818	CA AV VP PS SS SL LR RL LM MF	CA AS SS SG GA AG GT TG GP PY YE EQ QY YF	KLGGALQAK
32001	CA AV VN NQ QG GG GG GS SQ QG GN NL LI IF	CA AS SS SF FR RA AP PY YG GY YT TF	GILGFVFTL
16952	CA AL LL LN NR RD DD DK KI II IF	CA AS SS SH HL LG GG GD DR RY YM MN NE EQ QF FF	KLGGALQAK
5288	CA AV VF FL LY YG GN NN NR RL LA AF	CS SV VS SA AS SG GG GD DE EQ QY YF	KLGGALQAK
34176	CA AV VA AN NT TD DK KL LI IF	CA AS SS SQ QD DR RV VS SY YE EQ QY YF	KLGGALQAK
18086	CA AV VG GS SS SA AS SK KI II IF	CA AS SS SP PP PG GT TG GE EA AQ QA AF FF	KLGGALQAK
16186	CA AV VV VP PG GN NT TG GK KL LI IF	CA AS SS SQ QR RP PS SE EV VG GE EL LF FF	RAKFKQLL
14683	CA AA AT TE ET TN ND DY YK KL LS SF	CA AS SS ST TP PR RQ QG GS SN NT TG GE EL LF FF	RAKFKQLL
16063	CA AV VF FN ND DY YK KL LS SF	CA AS SS SQ QR RP PS SE EV VG GE EL LF FF	RAKFKQLL
5516	CA AA AG GA AG GS SY YQ QL LT TF	CA AS SS SQ QG GQ QG GQ QP PQ QH HF	ELAGIGILTV
35481	CA AG GV VN NS SN ND DY YK KL LS SF	CS SV VA AG GT TG GN NT TE EA AF FF	KLGGALQAK
36291	CA AV VD DL LM MK KT TS SY YD DK KV VI IF	CS SQ QT TS SN NG GR RG GS SS SY YE EQ QY YF	IVTDFSVIK
6162	CA AV VR RD DG GT TG GA AN NN NL LF FF	CA AS SS SI IS SS ST TG GE EL LF FF	GILGFVFTL
31852	CA AM MR RE ED DP PG GG GT TS SY YG GK KL LT TF	CA AS SS ST TY YS SN NQ QP PQ QH HF	GILGFVFTL
123	CA AL LS SE EG GR RN NN NA AR RL LM MF	CA AS SS SE EG GG GQ QG GD DL LW WN NS SP PL LH HF	RAKFKQLL
2279	CA AT TD DR RI IQ QG GA AQ QK KL LV VF	CA AS SS SY YD DR RV VK KN NI IQ QY YF	KLGGALQAK
25452	CA AA AI IQ QD DF FN NY YQ QL LI IW	CA AS SS SL LS SS SY YE EQ QY YF	KLGGALQAK
28683	CA AV VF FF FY YN NQ QG GG GK KL LI IF	CA AS SS SE EM MM MD DT TQ QY YF	KLGGALQAK
2446	CA AE ET TG GG GA AN NN NL LF FF	CA AS SS SL LN NG GG GN NS SY YE EQ QY YF	RAKFKQLL
36120	CA AV VD DG GN NQ QF FY YF	CA AS SS SV VD DE ER RE EQ QY YF	KLGGALQAK
35947	CA AE EN NM MY YS SG GG GG GA AD DG GL LT TF	CA AS SS SW WV VS SG GN NT TI IY YF	KLGGALQAK
2999	CA AM MG GP PS SG GG GS SY YI IP PT TF	CA AS SS SW WG GG GG GS SH HY YG GY YT TF	IVTDFSVIK
29945	CG GT TD DT TG GG GG GS SQ QG GN NL LI IF	CA AS SS SG GR RS ST TD DT TQ QY YF	GILGFVFTL
24359	CA AG GT TN NA AG GK KS ST TF	CA AS SS SF FL LA AG GV VG GY YN NE EQ QF FF	KLGGALQAK
27576	CA AE ET TH HS SG GG GS SN NY YN NL LT TF	CS SV VG GS SG GD DH HG GE EQ QF FF	RAKFKQLL
6333	CA AM MR RP PL LG GM MD DS SN NY YQ QL LI IW	CA AS SS ST TH HG GA AD DE EQ QY YF	GILGFVFTL
367	CA AV VH HG GY YG GQ QN NF FV VF	CA AS SS SE EG GD DS SN NY YE EQ QY YF	KLGGALQAK
5290	CA AA AS SG GY YD DY YK KL LS SF	CS SV VS SA AS SG GG GD DE EQ QY YF	KLGGALQAK
35143	CA AA AS SA AV VN NS SG GA AG GS SY YQ QL LT TF	CA AS SS SF FR RE EP PS SS SQ QY YF	KLGGALQAK
7345	CA AE EM ME EG GG GS SY YI IP PT TF	CT TS SV VP PA AV VT TV VN NF FY YG GY YT TF	RAKFKQLL
34049	CA AV VL LA AN ND DY YK KL LS SF	CA AS SR RL LA AG GD DE EQ QF FF	KLGGALQAK
32911	CA AV VT TG GD DG GG GS SQ QG GN NL LI IF	CA AS SS SI IR RS SS SY YE EQ QY YF	GILGFVFTL
28448	CA AV VK KN NS SN NY YQ QL LI IW	CA AS SS SD DS SG GE EG GA AN NV VL LT TF	KLGGALQAK
35695	CI IV VR RG GA AD DQ QG GA AQ QK KL LV VF	CA AS SS SE EP PQ QT TS SG GN NT TG GE EL LF FF	KLGGALQAK
34770	CA AV VR RP PP PT TD DS SW WG GK KF FQ QF	CA AS SS SL LL LS SG GD DT TY YS SY YN NE EQ QF FF	KLGGALQAK
26033	CA AV VI IG GA AN NN NL LF FF	CA AS SR RI IG GN NG GN NT TI IY YF	KLGGALQAK
25053	CA AV VS SL LS SG GG GY YN NK KL LI IF	CA AS SS SS SH HG GA AG GA AY YN NE EQ QF FF	RAKFKQLL
35864	CA AM MR RE EG GA AG GY YA AL LN NF	CA AS SS SI IL LA AG GY YY YN NE EQ QF FF	KLGGALQAK
7326	CA AA AM ME ET TS SY YD DK KV VI IF	CA AT TS SD DA AG GT TD DY YE EQ QY YF	RAKFKQLL
5496	CA AV VN NP PR RG GS SG GY YA AL LN NF	CA AA AG GW WG GI IG GT TE EA AF FF	ELAGIGILTV
34433	CA AV VL LS SA AS SV VS SN NY YK KL LT TF	CA AS SS SL LA AR RG GL LS SP PD DT TQ QY YF	KLGGALQAK
2401	CA AG GA AG GG GT TS SY YG GK KL LT TF	CA AS SS SY YT TG GY YS SS SP PL LH HF	KLGGALQAK
5264	CA AM MS SG GD DG GG GS SQ QG GN NL LI IF	CQ QQ QQ QK KS SY YE EQ QY YF	GILGFVFTL
35967	CA AA AW WN NQ QG GG GK KL LI IF	CV VT TA AS SS SS ST TD DT TQ QY YF	GILGFVFTL
25086	CA AE EK KE EY YA AD DG GL LT TF	CA AS SS SS SP PE EG GQ QP PL LN NT TG GE EL LF FF	GLCTLVAML
5407	CV VV VR RG GG GR RA AG GG GT TS SY YG GK KL LT TF	CA AS SS SR RQ QG GS SW WL LE ET TQ QY YF	KLGGALQAK
22995	CI IL LR RE ET TS SY YD DK KV VI IF	CA AS SR RP PG GV VG GN NQ QP PQ QH HF	RAKFKQLL
36064	CA AS ST TS SG GT TY YK KY YI IF	CA AS SS SL LT TI IQ QE ET TQ QY YF	KLGGALQAK
14263	CA AV VR RP PT TS SG GT TY YK KY YI IF	CA AS SS SP PG GQ QP PE ET TQ QY YF	KLGGALQAK
25219	CA AF FM MK KR RL LG GN NQ QF FY YF	CA AS SS SL LL LD DR RP PS ST TY YE EQ QY YF	KLGGALQAK
186	CA AV VW WD DN NY YG GQ QN NF FV VF	CA AS SS SQ QE EW WL LA AG GG GP PG GT TQ QY YF	KLGGALQAK
34753	CA AA AH HD DY YG GG GS SQ QG GN NL LI IF	CA AS SS SL LA AT TT TG GT TD DT TQ QY YF	KLGGALQAK
34948	CA AV VR RP PQ QM MN NR RD DD DK KI II IF	CA AS SS SL LT TS SD DG GY YY YE EQ QY YF	KLGGALQAK
25392	CA AD DE ES SG GG GS SQ QG GN NL LI IF	CA AS SS SL LA AT TT TD DG GG GG GK KL LF FF	RAKFKQLL
5498	CA AV VN NP PT TG GG GF FK KT TI IF	CA AS SC CA AG GM MG GN NE EQ QY YF	ELAGIGILTV
35165	CA AL LD DG GN NA AR RL LM MF	CA AS SS SL LS SF FG GV VR RN NT TE EA AF FF	KLGGALQAK
31936	CA AG GA AG GS SQ QG GN NL LI IF	CA AG GR RG GT TD DD DY YG GY YT TF	GILGFVFTL
255	CA AL LS SE EA AP PN NF FG GN NE EK KL LT TF	CA AS SS SQ QD DS SP PG GI IR RD DN NQ QP PQ QH HF	KLGGALQAK
24282	CA AA AS SE ET TS SY YD DK KV VI IF	CA AS SS SL LL LG GV VS SA AQ QE ET TQ QY YF	RAKFKQLL
623	CA AV VD DI IN NN ND DM MR RF	CA AS SS SV VD DG GG GD DP PP PW WE EL LF FF	KLGGALQAK
34695	CA AT TD DS SY YL LW WD DG GA AN NS SK KL LT TF	CA AS SS SS SP PV VG GT TH HH HS SY YE EQ QY YF	KLGGALQAK
2374	CA AV VR RG GL LS SG GG GY YN NK KL LI IF	CA AS SS SL LS SR RE EA AE EA AF FF	KLGGALQAK
35616	CA AV VV VM MN NS SG GY YS ST TL LT TF	CA AS SS SE EN NS SN NQ QP PQ QH HF	KLGGALQAK
23356	CA AD DS SG GG GG GA AD DG GL LT TF	CA AS SS SL LS SG GR RP PY YE EQ QY YF	RAKFKQLL
34355	CA AG GQ QG GN NQ QG GG GK KL LI IF	CA AS SS SA AR RG GQ QG GG GN NT TI IY YF	KLGGALQAK
6254	CA AA AS SA AS SN NN NN ND DM MR RF	CA AS SS SM MV VS SQ QG GE EQ QF FF	GILGFVFTL
209	CA AG GV VR RY YG GQ QN NF FV VF	CA AS SS SQ QD DL LA AG GN NT TG GE EL LF FF	RAKFKQLL
31081	CA AF FM MV VG GA AG GG GT TS SY YG GK KL LT TF	CA AS SS SI IR RS SS SY YE EQ QY YF	GILGFVFTL
35268	CA AV VQ QA AG GG GY YQ QK KV VT TF	CA AS SS SS SN NR RG GF FQ QP PQ QH HF	KLGGALQAK
23888	CA AD DS SG GG GG GA AD DG GL LT TF	CA AS SS SL LG GQ QG GA AV VN NE EK KL LF FF	RAKFKQLL
27087	CI IL LR RE ET TS SY YD DK KV VI IF	CS SV VE EG GP PL LP PA AG GT TL LG GT TQ QY YF	RAKFKQLL
34612	CA AY YM MA AD DR RG GS ST TL LG GR RL LY YF	CA AS SS SF FR RA AQ QY YF	KLGGALQAK
34491	CA AL LD DG GD DA AG GN NM ML LT TF	CA AS SS SL LY YS SV VY YN NE EQ QF FF	AVFDRKSDAK
34206	CA AL LS SV VH HN NA AG GN NM ML LT TF	CA AS SS SQ QL LG GL LA AG GA AE EQ QF FF	KLGGALQAK
26703	CV VV VN NP PS SN NS SG GY YA AL LN NF	CS SA AG GQ QG GP PY YE EQ QY YF	RAKFKQLL
257	CA AV VH HD DS SW WG GK KL LQ QF	CA AS SS SQ QG GT TS SF FF FE EQ QF FF	KLGGALQAK
2469	CA AM MI IL LA AS SN NY YK KL LT TF	CA AS SS SR RS SG GG GL LQ QE ET TQ QY YF	KLGGALQAK
12887	CA AV VR RD DS SA AG GT TA AL LI IF	CA AS SS SF FS SG GN NT TG GE EL LF FF	RAKFKQLL
1168	CA AA AM MD DS SN NY YQ QL LI IW	CA AS SS SL LY YS SA AT TG GE EL LF FF	AVFDRKSDAK
33990	CA AV VG GE EL LA AA AG GN NK KL LT TF	CA AT TS SD DG GR RD DD DE EQ QF FF	KLGGALQAK
35377	CA AA AT TT TS SG GT TY YK KY YI IF	CS SA AS SP PL LS SG GS ST TY YN NE EQ QF FF	KLGGALQAK
27086	CA AP PS SS SG GG GN NT TP PL LV VF	CS SV VE EG GA AG GQ QG GQ QL LL LY YG GY YT TF	KLGGALQAK
34230	CA AV VG GL LG GF FG GN NV VL LH HC	CA AS SS SW WE EG GN NT TE EA AF FF	ELAGIGILTV
35284	CA AV VV VD DN NY YG GQ QN NF FV VF	CA AS SS SG GS SR RA AG GG GA AG GE EQ QF FF	KLGGALQAK
15298	CA AA AS SE ET TS SY YD DK KV VI IF	CA AS SS SP PL LA AG GI IY YN NE EQ QF FF	RAKFKQLL
34011	CV VV VS SD DS SS SG GY YS ST TL LT TF	CA AT TS SD DL LS SS SG GR RG GY YN NE EQ QF FF	KLGGALQAK
36310	CA AV VN NQ QG GR RA AL LT TF	CA AS SS SL LG GP PG GS SP PL LH HF	ELAGIGILTV
625	CA AL LS SE ES SN NS SG GN NT TP PL LV VF	CA AS SS SV VD DP PA AQ QE ET TQ QY YF	GILGFVFTL
2382	CA AL LS SN NN ND DM MR RF	CA AS SS SP PA AR RG GR RV VE EQ QY YF	KLGGALQAK
29797	CA AV VT TD DG GG GS SQ QG GN NL LI IF	CA AS SS SA AR RS SS SY YE EQ QY YF	GILGFVFTL
7680	CA AA AS SE ET TS SY YD DK KV VI IF	CA AS SQ QP PH HG GT TG GD DH HE EQ QY YF	RAKFKQLL
25105	CA AE ES SE EG GP PT TY YT TD DK KL LI IF	CA AS SS SP PR RD DR RE ER RG GE EQ QY YF	RAKFKQLL
35203	CA AE EI IR RG GR RD DQ QF FY YF	CA AS SK KD DG GI IS SY YE EQ QY YF	KLGGALQAK
35009	CV VV VS SD DP PY YT TD DK KL LI IF	CA AS SS SP PE EG GG GG GT TY YN NE EQ QF FF	KLGGALQAK
62	CA AV VG GD DN NF FN NK KF FY YF	CA AS SS SF FS SG GN NT TG GE EL LF FF	AVFDRKSDAK
6544	CA AL LS SE EG GQ QT TG GA AN NN NL LF FF	CA AS SS SW WG GG GL LS SN NQ QP PQ QH HF	ELAGIGILTV
15296	CA AV VK KT TD DS SW WG GK KL LQ QF	CA AS SS SP PG GE EL LV VP PN NT TE EA AF FF	ELAGIGILTV
34259	CA AM MR RE ET TG GN NQ QF FY YF	CA AS SS SQ QD DH HR RM MG GG GH HE EK KL LF FF	KLGGALQAK
32368	CA AF FM MK KG GA AG GG GT TS SY YG GK KL LT TF	CA AS SS SI IG GS SY YG GY YT TF	GILGFVFTL
33556	CA AG GA AH HQ QG GG GK KL LI IF	CA AS SS SS SR RS SA AY YE EQ QY YF	GILGFVFTL
10357	CA AG GE EG GN NN NN ND DM MR RF	CA AS SS SF FS SG GN NT TG GE EL LF FF	RAKFKQLL
25184	CA AV VR RN NQ QG GG GK KL LI IF	CA AS SA AH HP PR RA AS SG GS ST TD DT TQ QY YF	GILGFVFTL
34216	CA AV VR RD DG GA AG GN NT TP PL LV VF	CA AS SS SQ QT TL LA AG GG GP PW WE ET TQ QY YF	KLGGALQAK
6305	CA AF FM MT TN NA AG GG GT TS SY YG GK KL LT TF	CA AS SS SQ QG GS SY YG GY YT TF	GILGFVFTL
6983	CA AV VP PG GG GN NT TG GK KL LI IF	CA AS SS SI IR RS SS SY YE EQ QY YF	GILGFVFTL
15320	CI IV VR RV VW WG GQ QA AG GT TA AL LI IF	CA AS SS SQ QE ER RG GP PY YN NE EQ QF FF	KLGGALQAK
7666	CA AL LS SE EA AG GP PD DK KL LI IF	CA AS SS SF FL LD DR RG GP PN NT TE EA AF FF	RAKFKQLL
5534	CA AL LT TL LI IT TG GR RR RA AL LT TF	CA AS SS SY YV VL LQ QT TY YE EQ QY YF	KLGGALQAK
23203	CV VV VG GL LD DN NY YG GQ QN NF FV VF	CA AT TS SR RV VE ES SG GT TG GE EL LF FF	KLGGALQAK
33799	CA AM MN NY YG GG GS SQ QG GN NL LI IF	CA AS SS ST TR RS ST TD DT TQ QY YF	GILGFVFTL
7264	CV VV VS SP PG GY YS ST TL LT TF	CA AS SS SQ QS SG GT TG GY YG GY YT TF	AVFDRKSDAK
75	CA AG GP PL LG GG GG GS SN NY YK KL LT TF	CA AS SS SY YP PF FG GV VG GP PD DT TQ QY YF	KLGGALQAK
31903	CA AL LK KN NN ND DM MR RF	CA AS SS SW WR RS ST TD DT TQ QY YF	GILGFVFTL
34549	CA AL LW WG GE ET TS SG GS SR RL LT TF	CA AS SS SL LS SG GG GP PE ET TQ QY YF	KLGGALQAK
34726	CA AR RG GN NA AG GN NM ML LT TF	CA AS SS SP PG GV VT TG GE EL LF FF	KLGGALQAK
26059	CV VV VQ QG GG GA AD DG GL LT TF	CA AW WS SW WD DR RG GY YN NE EQ QF FF	KLGGALQAK
25008	CA AA AK KE EG GY YS ST TL LT TF	CA AS SS SW WG GG GG GS SH HY YG GY YT TF	IVTDFSVIK
23206	CA AA AM ME ET TS SY YD DK KV VI IF	CA AT TS ST TG GD DS SN NQ QP PQ QH HF	RAKFKQLL
35841	CA AL LT TG GV VQ QG GG GS SE EK KL LV VF	CA AS SS SI IF FS SG GP PG GI IE EA AF FF	GILGFVFTL
