25769	CA AA AS SE ET TS SY YD DK KV VI IF	CA AS SS SQ QL LG GR RG GD DN NE EQ QF FF	RAKFKQLL
650	CA AV VS SG GN NE EK KL LT TF	CA AS SS SV VY YL LS SG GN NT TI IY YF	ELAGIGILTV
34578	CA AV VG GR RF FR RG GG GS SN NY YK KL LT TF	CA AT TS SS SL LA AG GD DW WN NE EQ QF FF	KLGGALQAK
117	CV VV VS SA AA AR RG GG GG GA AD DG GL LT TF	CA AS SS SD DL LQ QW WV VS SY YE EQ QY YF	IVTDFSVIK
27923	CA AF FM MR RG GR RG GK KL LT TF	CS SV VG GS SG GE ED DS SP PQ QY YF	RAKFKQLL
34665	CA AA AS SG GG GS SQ QG GN NL LI IF	CA AS SS SL LW WA AG GS SY YE EQ QY YF	KLGGALQAK
7675	CA AA AG GE ET TS SY YD DK KV VI IF	CA AS SI IY YS SG GN NG GE EL LF FF	RAKFKQLL
35118	CV VV VS SF FN NA AG GN NN NR RK KL LI IW	CA AS SS SL LG GA AS SG GG GD DT TQ QY YF	KLGGALQAK
17155	CA AA AS SE ET TS SY YD DK KV VI IF	CA AS SS SY YS SG GG GA AG GE EL LF FF	RAKFKQLL
34520	CA AL LS SV VL LR RD DT TG GR RR RA AL LT TF	CA AS SS SL LE EG GN NE EQ QY YF	KLGGALQAK
8616	CA AL LS SE EA AN NN NA AG GN NM ML LT TF	CA AS SS SF FS SG GN NT TG GE EL LF FF	RAKFKQLL
25023	CA AM MS SW WG GR RD DD DK KI II IF	CA AS SS SK KG GL LT TG GN NY YE EQ QY YF	KLGGALQAK
28468	CA AV VG GT TA AR RL LM MF	CA AS SS SL LR RF FP PD DI IG GE EQ QY YF	RAKFKQLL
215	CA AA AT TL LT TG GN NQ QF FY YF	CA AS SS SQ QD DW WG GQ QP PN NT TE EA AF FF	GILGFVFTL
7211	CA AG GG GG GG GG GS SQ QG GN NL LI IF	CA AS SS ST TS SG GA AN NQ QP PQ QH HF	GILGFVFTL
5128	CA AV VV VS SG GA AG GS SY YQ QL LT TF	CA AW WS SI IT TD DT TG GE EL LF FF	KLGGALQAK
26554	CA AA AS SE EG GA AP PD DK KL LI IF	CS SA AP PS SG GE EG GR RD DT TQ QY YF	RAKFKQLL
35012	CA AA AP PV VG GT TY YK KY YI IF	CA AS SR RT TP PL LD DT TQ QY YF	KLGGALQAK
26220	CA AL LS SE EP PN NS SG GG GG GA AD DG GL LT TF	CS SA AR RD DD DS SG GQ QG GF FG GF FL LE ET TQ QY YF	GLCTLVAML
17956	CA AE EW WG GS SG GN NT TG GK KL LI IF	CA AS SS SV VA AG GG GT TE EQ QY YF	KLGGALQAK
34054	CA AA AH HS SG GT TY YK KY YI IF	CA AS SS SF FG GS SQ QE ET TQ QY YF	KLGGALQAK
32526	CA AV VK KE EN NE EK KL LT TF	CA AS SS SI IR RS SA AY YE EQ QY YF	GILGFVFTL
24569	CG GT TV VL LE EG GG GS SQ QG GN NL LI IF	CA AS SS SL LG GT TS SG GG GT TG GE EL LF FF	GILGFVFTL
2247	CA AV VT TD DS SN NF FG GN NE EK KL LT TF	CA AS SS SL LA AQ QG GL LA AK KN NI IQ QY YF	KLGGALQAK
6690	CA AL LT TD DY YS SG GA AG GS SY YQ QL LT TF	CA AS SS SI IR RS SG GT TE EA AF FF	GILGFVFTL
25805	CA AG GH HT TG GN NQ QF FY YF	CA AS SS SS SG GL LA AG GG GN NE EQ QF FF	GILGFVFTL
26049	CA AL LS SE EA AQ QL LG GS SG GY YA AL LN NF	CA AW WS SV VG GQ QG GT TD DG GE EL LF FF	KLGGALQAK
6667	CA AA AK KG GT TS SY YD DK KV VI IF	CA AS SS SI IH HS SN NQ QP PQ QH HF	GILGFVFTL
33484	CA AA AT TG GG GG GS SQ QG GN NL LI IF	CA AS SS SM MR RS SA AD DT TQ QY YF	GILGFVFTL
20245	CA AK KG GL LT TG GG GG GD DK KL LT TF	CA AS SS SL LR RD DG GS SE EA AF FF	RAKFKQLL
34279	CA AV VR RA AG GN NQ QF FY YF	CA AS SS SQ QG GV VA AG GG GQ QG GV VN NE EQ QF FF	AVFDRKSDAK
35457	CV VA AY YS SS SA AS SK KI II IF	CS SA AS SW WP PG GA AN NT TG GE EL LF FF	KLGGALQAK
31376	CA AA AS SG GG GG GS SQ QG GN NL LI IF	CA AS SS SK KR RS SQ QE EP PQ QH HF	GILGFVFTL
13822	CA AA AS SE ET TS SY YD DK KV VI IF	CA AS SS SF FT TG GQ QA AN NT TE EA AF FF	RAKFKQLL
5173	CA AV VS SE EN NR RD DD DK KI II IF	CS SA AR RD DS ST TG GN NG GY YT TF	GLCTLVAML
35210	CA AG GA AP PL LT TG GT TA AS SK KL LT TF	CA AS SS SA AS SS SG GG GA AY YY YT TQ QY YF	KLGGALQAK
18262	CA AE EM ME EG GG GS SY YI IP PT TF	CA AS SS SL LR RD DG GS SE EA AF FF	RAKFKQLL
6355	CI IV VF FY YN NQ QG GG GK KL LI IF	CA AS SS ST TR RS SS SY YE EQ QY YF	GILGFVFTL
6304	CA AF FM MV VN NA AG GG GT TS SY YG GK KL LT TF	CA AS SS SQ QG GS SY YG GY YT TF	GILGFVFTL
32342	CV VV VS SA AG GL LG GK KT TS SY YD DK KV VI IF	CA AS SS SI IF FY YS SS ST TD DT TQ QY YF	GILGFVFTL
27286	CV VV VT TE ET TS SY YD DK KV VI IF	CS SV VG GS SG GD DH HG GE EQ QF FF	RAKFKQLL
34133	CA AV VP PN NF FG GN NE EK KL LT TF	CA AS SS SF FT TG GS SD DT TG GE EL LF FF	KLGGALQAK
5076	CA AE EI IV VG GQ QL LT TF	CA AS SS SP PG GG GL LE EN NE EQ QY YF	KLGGALQAK
5492	CA AV VL LR RM MD DS SS SY YK KL LI IF	CA AS ST TP PR RR RL LG GL LF FP PS SS SG GN NT TI IY YF	KLGGALQAK
2340	CV VV VN NS SG GY YA AL LN NF	CA AS SS SF FT TG GA AG GN NE EQ QF FF	KLGGALQAK
14648	CV VV VN NG GG GD DS SS SY YK KL LI IF	CA AS SS SE EG GQ QV VS SP PG GE EL LF FF	GLCTLVAML
6559	CA AE ER RV VE ED DG GQ QK KL LL LF	CA AS SG GF FG GT TV VN NE EQ QF FF	AVFDRKSDAK
33980	CA AM MS SG GD DG GG GS SQ QG GN NL LI IF	CA AS SS ST TR RS SA AY YE EQ QY YF	GILGFVFTL
21422	CA AA AR RV VR RG GF FG GN NV VL LH HC	CA AS SS SL LR RD DG GS SE EA AF FF	RAKFKQLL
31459	CI IL LS SI IQ QG GG GS SE EK KL LV VF	CA AS SS SP PR RS SS SQ QP PQ QH HF	GILGFVFTL
5774	CG GT TA AD DG GG GS SQ QG GN NL LI IF	CA AS SS SI IR RS SD DD DI IQ QY YF	GILGFVFTL
36054	CA AV VD DN NA AR RL LM MF	CA AS SS SF FD DQ QT TN NQ QP PQ QH HF	ELAGIGILTV
34510	CA AE ES SM MD DS SS SY YK KL LI IF	CA AS SS SY YT TG GG GD DT TE EA AF FF	AVFDRKSDAK
644	CV VV VS SA AN NS SD DG GQ QK KL LL LF	CA AS SS SV VV VS SG GA AN NV VL LT TF	KLGGALQAK
35709	CA AV VI IY YS SG GY YA AL LN NF	CA AS ST TP PG GQ QE EI IY YG GY YT TF	KLGGALQAK
31681	CA AF FQ QN NQ QG GG GK KL LI IF	CA AS SS ST TR RS SS SE ET TQ QY YF	GILGFVFTL
35105	CA AV VR RM MY YS SG GG GG GA AD DG GL LT TF	CA AS SR RS SR RE ER RG GD DE EA AF FF	KLGGALQAK
6349	CA AV VG GR RS SY YS SG GA AG GS SY YQ QL LT TF	CA AS SS ST TR RS SG GT TE EA AF FF	GILGFVFTL
31624	CI IL LR RD DV VG GT TG GT TA AS SK KL LT TF	CA AS SS SS SR RS SG GY YE EQ QY YF	GILGFVFTL
27085	CA AA AS SE ET TS SY YD DK KV VI IF	CS SV VE ED DR RR RP PD DE EQ QF FF	RAKFKQLL
31850	CA AG GR RG GN NN NA AR RL LM MF	CA AS SS ST TT TS SG GG GL LN NE EQ QF FF	GILGFVFTL
25762	CA AV VA AK KD DL LQ QN NS SG GG GG GA AD DG GL LT TF	CA AS SS SQ QD DP PS SR RT TY YE EQ QY YF	GILGFVFTL
38432	CA AP PS SG GY YS ST TL LT TF	CA AS SS SA AE EG GA AG GN NM MN NT TE EA AF FF	KLGGALQAK
35139	CA AV VP PD DS SN NY YQ QL LI IW	CA AS SS SF FA AG GG GG GG GY YT TF	KLGGALQAK
36010	CA AL LD DF FS SS SG GS SA AR RQ QL LT TF	CA AS SS SQ QG GP PG GT TV VH HE EK KL LF FF	KLGGALQAK
34415	CA AV VQ QA AH HS SG GG GG GA AD DG GL LT TF	CA AS SS SV VG GS SG GN NT TI IY YF	KLGGALQAK
22089	CA AA AA AE ET TS SY YD DK KV VI IF	CA AS SS SL LR RD DG GS SE EA AF FF	RAKFKQLL
25298	CA AE EG GE ET TS SY YD DK KV VI IF	CA AS SS SF FT TG GG GT TG GE EL LF FF	RAKFKQLL
28416	CA AF FM MR RP PN NN NA AR RL LM MF	CA AS SS SS SR RT TS SG GG GA AG GQ QF FF	KLGGALQAK
6604	CA AA AA AQ QE ET TS SG GS SR RL LT TF	CA AS SS SI IE EG GG GT TT TE EA AF FF	KLGGALQAK
36152	CI IT TG GG GG GA AD DG GL LT TF	CA AT TS SR RD DR RL LG GR RG GK KG GT TE EA AF FF	KLGGALQAK
7243	CA AM MT TR RS SN NT TG GN NQ QF FY YF	CA AS SS SG GR RH HV VD DT TK KD DT TQ QY YF	IVTDFSVIK
29924	CA AE EN NT TG GG GG GS SQ QG GN NL LI IF	CA AS SS SF FR RS SS SE EK KL LF FF	GILGFVFTL
34490	CA AM MR RE EG GW WG GG GG GA AD DG GL LT TF	CA AS SS SL LW WT TG GT TE ET TQ QY YF	KLGGALQAK
30719	CI IF FV VR RN NR RD DD DK KI II IF	CA AS SS SI IR RS SS SY YE EQ QY YF	GILGFVFTL
32362	CA AG GA AG GS SQ QG GN NL LI IF	CA AS SS SI IG GL LY YG GY YT TF	GILGFVFTL
7168	CA AE EN NM MG GG GG GS SQ QG GN NL LI IF	CA AS SS SS SR RS SG GE ET TQ QY YF	GILGFVFTL
27079	CA AM MR RE EY YN NF FN NK KF FY YF	CS SV VA AG GT TS SG GG GA AY YE EQ QY YF	KLGGALQAK
35113	CA AM MT TR RE EM MN NS SG GY YS ST TL LT TF	CA AS SS SL LE EP PS SY YE EQ QY YF	KLGGALQAK
18092	CA AV VN NM ME EV VS SR RG GG GG GA AD DG GL LT TF	CA AS ST TL LG GG GL LG GQ QP PQ QH HF	ELAGIGILTV
23904	CA AD DS SG GG GG GA AD DG GL LT TF	CA AS SS SQ QQ QG GQ QP PQ QE ET TQ QY YF	RAKFKQLL
27100	CA AA AF FN NS SG GG GS SN NY YK KL LT TF	CS SV VG GQ QG GM MN NT TE EA AF FF	RAKFKQLL
34713	CA AL LS SE EF FL LT TG GG GF FK KT TI IF	CA AS SW WT TG GT TS SA AE ED DY YN NE EQ QF FF	KLGGALQAK
149	CA AV VP PK KV VD DS SN NY YQ QL LI IW	CA AS SS SQ QA AQ QA AS SS SY YE EQ QY YF	KLGGALQAK
18220	CA AA AS SE ET TS SY YD DK KV VI IF	CA AS SS SL LR RD DG GS SE EA AF FF	RAKFKQLL
15310	CA AL LV VD DS SN NY YQ QL LI IW	CA AS SS SQ QD DG GR RG GG GY YG GY YT TF	KLGGALQAK
245	CA AL LG GE EG GN NN NQ QG GG GK KL LI IF	CA AS SS SA AS SG GA AR RD DY YS SN NQ QP PQ QH HF	KLGGALQAK
2477	CA AV VG GD DN NF FN NK KF FY YF	CA AS SS SE ER RD DP PY YE EQ QY YF	AVFDRKSDAK
2481	CA AV VG GA AS SG GG GS SY YI IP PT TF	CA AA AG GG GG GG GT TE EK KL LF FF	KLGGALQAK
24714	CA AA AW WE EG GT TG GR RR RA AL LT TF	CA AS SS SL LG GG GG GL LG GN NE EQ QF FF	KLGGALQAK
15985	CA AA AR RV VR RG GF FG GN NV VL LH HC	CA AS ST TP PI IE ES SS ST TD DT TQ QY YF	KLGGALQAK
34427	CA AV VS SG GN ND DY YK KL LS SF	CA AS ST TV VS SG GE EP PS ST TD DT TQ QY YF	KLGGALQAK
34390	CA AM MS SY YA AT TD DS SW WG GK KL LQ QF	CA AS SS ST TR RG GL LA AE EE EQ QF FF	KLGGALQAK
2333	CA AV VN NL LA AG GG GT TS SY YG GK KL LT TF	CA AS SS SF FA AP PG GN NT TI IY YF	ELAGIGILTV
33814	CA AI IT TY YG GG GS SQ QG GN NL LI IF	CA AS SS ST TR RS ST TD DT TQ QY YF	GILGFVFTL
25353	CA AA AS SE ET TS SY YD DK KV VI IF	CA AS SS SF FV VD DR RV VY YE EQ QY YF	RAKFKQLL
27097	CA AT TD DS SG GG GS SN NY YK KL LT TF	CS SV VG GA AG GE ED DD DE EQ QY YF	RAKFKQLL
24312	CV VV VT TA AG GN NT TG GK KL LI IF	CA AS SS SR RD DS SA AS ST TG GE EL LF FF	KLGGALQAK
34611	CA AV VD DS SN NY YQ QL LI IW	CA AS SS SF FR RA AF FF	KLGGALQAK
17996	CG GT TE EY YP PN ND DY YK KL LS SF	CA AS SS SV VE EG GV VG GT TS ST TD DT TQ QY YF	GLCTLVAML
2244	CA AV VG GA AG GG GY YN NK KL LI IF	CA AS SS SG GT TG GA AN NY YG GY YT TF	KLGGALQAK
35986	CA AY YR RS SN NR RD DD DK KI II IF	CA AS SS SE EW WA AR RG GR RG GR RY YT TG GE EL LF FF	KLGGALQAK
15184	CA AG GG GG GS SQ QG GN NL LI IF	CA AS SS SL LL LW WA AE EY YN NE EQ QF FF	RAKFKQLL
5164	CA AV VP PT TR RS SG GA AN NN NL LF FF	CS SA AR RD DP PP PS SD DV VG GT TQ QY YF	IVTDFSVIK
32394	CA AY YS SL LS SA AG GG GT TS SY YG GK KL LT TF	CA AS SS SI IG GV VY YG GY YT TF	GILGFVFTL
91	CA AL LR RP PS SN ND DY YK KL LS SF	CA AS SS SP PG GQ QG GI IH HG GY YT TF	KLGGALQAK
624	CA AM MS SG GH HN NQ QG GG GK KL LI IF	CA AS SS SV VD DG GK KT TE EQ QY YF	KLGGALQAK
35220	CV VV VS SR RG GN NN NN NA AR RL LM MF	CA AS SS SG GS SG GG GS ST TD DT TQ QY YF	KLGGALQAK
21756	CA AM MR RS ST TG GN NQ QF FY YF	CA AS SS SL LR RD DG GS SE EA AF FF	RAKFKQLL
33909	CA AG GA AV VG GS SS SN NT TG GK KL LI IF	CA AS SS SD DP PG GI IQ QE ET TQ QY YF	GILGFVFTL
36176	CA AY YE EG GG GA AQ QK KL LV VF	CA AS SS SL LF FS SG GL LA AD DE EQ QF FF	KLGGALQAK
34458	CA AD DE EL LV VF	CA AS SR RQ QI IL LA AA AN NT TD DT TQ QY YF	KLGGALQAK
32252	CA AV VN NQ QG GA AQ QK KL LV VF	CA AS SS SG GR RS SG GE ET TQ QY YF	GILGFVFTL
5136	CA AA AD DD DG GR RL LM MF	CA AW WT TG GT TG GK KI IG GW WD DS SP PL LH HF	RAKFKQLL
684	CA AV VG GD DN NF FN NK KF FY YF	CA AS SS SL LR RS SA AA AG GW WP PF FF	AVFDRKSDAK
32322	CA AV VN NP PL LE EG GN NT TG GK KL LI IF	CA AS SS SH HL LL LS ST TV VD DY YE EQ QY YF	KLGGALQAK
34364	CA AL LS SE EN NA AG GG GT TS SY YG GK KL LT TF	CA AS SS SF FT TS SG GG GY YE EQ QY YF	KLGGALQAK
2449	CA AL LQ QG GG GS SE EK KL LV VF	CA AS SS SL LV VG GV VG GG GS SG GN NT TI IY YF	KLGGALQAK
35876	CA AD DN NY YG GG GS SQ QG GN NL LI IF	CA AS SS SI IS SG GQ QG GT TD DT TQ QY YF	KLGGALQAK
38418	CA AT TD DA AF FN NA AG GG GT TS SY YG GK KL LT TF	CA AS SS SY YF FR RS SG GA AL LY YN NE EQ QF FF	KLGGALQAK
2409	CA AY YS SP PA AA AG GG GT TS SY YG GK KL LT TF	CA AS SS SL LG GQ QQ QA AK KN NI IQ QY YF	GILGFVFTL
35634	CV VV VS SY YN NT TD DK KL LI IF	CA AS SS SP PL LG GG GR RT TE EA AF FF	KLGGALQAK
34929	CA AG GG GG GA AG GN NM ML LT TF	CA AI IR RT TT TP PP PG GH HS ST TD DT TQ QY YF	KLGGALQAK
34288	CA AE ER RA AR RS SG GG GG GA AD DG GL LT TF	CA AS SS SR RT TH HG GT TG GK KG GY YT TF	KLGGALQAK
28684	CI IL LR RD DL LN NA AG GG GT TS SY YG GK KL LT TF	CA AS SS SE EV VV VS ST TT TY YE EQ QY YF	KLGGALQAK
35035	CA AV VS SD DP PS SG GT TS SY YD DK KV VI IF	CA AS SR RR RT TG GG GE ER RS SE EA AF FF	KLGGALQAK
5231	CA AE ET TL LA AP PG GG GS SY YI IP PT TF	CS SA AL LG GG GT TQ QY YF	GILGFVFTL
532	CA AA AT TN NS SN NS SG GY YA AL LN NF	CA AS SS SL LS SS SG GT TY YE EQ QY YF	IVTDFSVIK
35931	CA AT TV VT TR RN NR RD DD DK KI II IF	CA AS SS SS SG GT TG GD DV VY YE EQ QY YF	KLGGALQAK
5517	CA AA AS SA AP PS SG GN NT TP PL LV VF	CA AS SS SQ QW WG GL LA AG GE ED DT TQ QY YF	KLGGALQAK
35660	CA AF FR RG GS SQ QG GN NL LI IF	CA AS SS SY YS SI IG GN NQ QP PQ QH HF	KLGGALQAK
5533	CA AV VP PI IT TG GG GG GN NK KL LT TF	CA AS SS SY YS SS SF FG GT TD DT TQ QY YF	ELAGIGILTV
2511	CA AM MR RE ES SS SG GY YS ST TL LT TF	CA AI IS SL LT TL LL LG GQ QR RD DQ QE ET TQ QY YF	RAKFKQLL
5319	CA AA AR RV VR RG GF FG GN NV VL LH HC	CA AS SS SL LG GL LA AG GG GQ QE ET TQ QY YF	AVFDRKSDAK
34711	CA AV VS SD DQ QN NS SG GG GS SN NY YK KL LT TF	CA AS ST TP PR RR RT TL LE EQ QF FF	KLGGALQAK
5317	CA AM MR RE EG GP PT TM MN NT TG GF FQ QK KL LV VF	CA AS SS SG GG GT TG GG GT TS SG GS SL LR RE EQ QF FF	KLGGALQAK
34773	CV VV VS SA AR RG GG GA AD DG GL LT TF	CA AS SS SL LP PL LA AG GG GS ST TD DT TQ QY YF	KLGGALQAK
86	CV VV VL LG GV VM MD DS SN NY YQ QL LI IW	CA AS SS SL LD DP PG GQ QG GW WT TN NT TE EA AF FF	GILGFVFTL
19413	CA AG GR RE EL LE EA AG GG GT TS SY YG GK KL LT TF	CA AS SS SL LR RD DG GS SE EA AF FF	RAKFKQLL
19210	CG GT TD DK KG GG GG GY YQ QK KV VT TF	CA AS SS SL LR RD DG GS SE EA AF FF	RAKFKQLL
18064	CG GT TE EY YP PN ND DY YK KL LS SF	CA AS SS SF FL LA AG GT TD DT TQ QY YF	GLCTLVAML
33891	CA AT TA AR RS SS SM MD DS SN NY YQ QL LI IW	CA AT TA AP PH HS SG GN NQ QP PQ QH HF	GILGFVFTL
34880	CA AF FL LG GS SG GN NF FN NK KF FY YF	CA AS SS SD DL LE EP PQ QE ET TQ QY YF	KLGGALQAK
5806	CA AL LT TG GN NY YG GQ QN NF FV VF	CA AS SS SI IR RS SS SY YE EQ QY YF	GILGFVFTL
16963	CA AV VR RD DS SA AG GT TA AL LI IF	CA AS SS SL LG GT TG GG GS SY YE EQ QY YF	KLGGALQAK
36085	CV VV VT TG GN NQ QF FY YF	CA AS SS SQ QY YH HV VE EG GS ST TE EA AF FF	KLGGALQAK
31924	CA AG GP PQ QD DG GG GS SQ QG GN NL LI IF	CA AS SS SY YY YS SN NQ QP PQ QH HF	GILGFVFTL
35350	CA AV VI IN NA AR RL LM MF	CS SA AP PT TG GG GG GL LY YN NE EQ QF FF	KLGGALQAK
34985	CA AV VG GR RN NN NN NA AR RL LM MF	CA AS SS SL LI IG GG GA AN NE EQ QF FF	KLGGALQAK
2293	CA AV VS SQ QW WA AQ QK KL LV VF	CA AS SS SL LG GL LA AG GL LN NE EQ QF FF	KLGGALQAK
28676	CA AV VD DN NF FG GN NE EK KL LT TF	CA AS SS SE EG GT TG GG GT TE EA AF FF	KLGGALQAK
28877	CA AG GA AG GD DG GG GS SQ QG GN NL LI IF	CA AS SS SY YS SS SG GG GA AD DT TQ QY YF	GILGFVFTL
36200	CA AI IN NQ QG GG GG GA AT TN NK KL LI IF	CA AS SS SP PG GR RT TG GE EL LF FF	KLGGALQAK
31655	CA AV VS SG GD DG GG GS SQ QG GN NL LI IF	CA AS SS ST TR RS SA AY YE EQ QY YF	GILGFVFTL
6259	CA AG GS SS SG GG GS SQ QG GN NL LI IF	CA AS SS SP PR RS ST TD DT TQ QY YF	GILGFVFTL
31555	CA AD DE ES SG GG GS SQ QG GN NL LI IF	CA AS SS SS SQ QG GA AN NE EK KL LF FF	RAKFKQLL
28734	CA AG GT TA AG GN NQ QF FY YF	CA AS SL LR RD DG GE EL LF FF	KLGGALQAK
5191	CA AM MN NP PA AW WG GG GA AT TN NK KL LI IF	CS SA AS SP PG GD DY YE EQ QY YF	KLGGALQAK
34993	CA AA AV VP PS SG GS SA AR RQ QL LT TF	CA AS SS SP PF FY YM ME ET TQ QY YF	KLGGALQAK
8151	CV VG GY YT TN NA AG GK KS ST TF	CA AS SS SF FS SG GN NT TG GE EL LF FF	RAKFKQLL
33016	CA AL LS SE EG GV VG GK KL LI IF	CA AS SS SI IR RS SS SY YE EQ QY YF	GILGFVFTL
35646	CA AL LG GN NS SG GN NT TP PL LV VF	CA AS SS SS SW WN NT TE EA AF FF	KLGGALQAK
5249	CE EI IV VN NY YG GG GA AT TN NK KL LI IF	CS SA AR RG GM ME ER RE EA AL LE ET TQ QY YF	KLGGALQAK
30399	CA AG GP PA AE EV VS SG GG GS SQ QG GN NL LI IF	CA AS SS SI II IA AL LD DT TQ QY YF	GILGFVFTL
35940	CA AV VS SD DR RD DY YG GQ QN NF FV VF	CA AS SS ST TT TS SG GG GL LD DT TQ QY YF	KLGGALQAK
28724	CA AY YR RI IS SL LN NN NN ND DM MR RF	CA AS SS SD DP PS SF FF FL LT TN NT TE EA AF FF	GILGFVFTL
27119	CA AT TD DA AK KG GG GS SN NY YK KL LT TF	CS SV VG GS SG GD DG GG GE EQ QF FF	RAKFKQLL
4939	CA AE EG GG GG GS SQ QG GN NL LI IF	CA AS SS SL LA AG GL LA AG GG GE EL LF FF	ELAGIGILTV
6348	CA AS SA AG GS SG GN NT TG GK KL LI IF	CA AS SS ST TR RS SG GT TE EA AF FF	GILGFVFTL
13987	CA AV VA AG GY YS ST TL LT TF	CA AS SS SP PT TS SN NE EQ QF FF	KLGGALQAK
30413	CA AL LK KA AG GT TA AL LI IF	CA AS SS SI IR RA AS SY YE EQ QY YF	GILGFVFTL
36067	CA AL LS SE EA AF FT TG GG GG GN NK KL LT TF	CA AS SS ST TL LT TI IA AT TL LD DN NE EQ QF FF	KLGGALQAK
17995	CA AA AS SG GQ QN NT TD DK KL LI IF	CA AS SS SV VE EA AV VP PE ET TQ QY YF	KLGGALQAK
30524	CA AG GS SG GS SQ QG GN NL LI IF	CA AS SS SI IR RS SS SY YE EQ QY YF	GILGFVFTL
26060	CA AT TD DG GG GN NN NA AR RL LM MF	CA AW WS SW WG GS SG GG GE EQ QY YF	KLGGALQAK
35218	CA AT TT TN ND DY YK KL LS SF	CA AS SS SG GA AL LQ QD DS SN NQ QP PQ QH HF	KLGGALQAK
28835	CG GA AA AG GN NM ML LT TF	CA AS SG GM MT TG GL LT TS SE EQ QY YF	KLGGALQAK
3897	CA AV VS SQ QD DS SN NY YQ QL LI IW	CA AS SS SW WG GG GG GS SH HY YG GY YT TF	IVTDFSVIK
23017	CA AE EV VF	CA AS SS SL LG GG GG GN NN NE EQ QF FF	IVTDFSVIK
24311	CA AA AH HR RV VD DS SG GA AG GS SY YQ QL LT TF	CA AS SS SR RD DL LS SG GA AN NV VL LT TF	KLGGALQAK
34338	CA AP PP PA AR RY YG GK KL LT TF	CA AS SS SQ QQ QG GG GW WT TE EA AF FF	KLGGALQAK
3646	CA AG GG GN NT TG GK KL LI IF	CA AS SS SW WG GG GG GS SH HY YG GY YT TF	IVTDFSVIK
34514	CA AV VG GG GD DS SG GG GY YQ QK KV VT TF	CA AS SS SD DW WG GL LS SY YE EQ QY YV	KLGGALQAK
25409	CA AA AS SE ET TS SY YD DK KV VI IF	CA AS SS SL LL LD DS SP PG GG GY YG GY YT TF	RAKFKQLL
34091	CA AV VG GD DG GS SG GT TY YK KY YI IF	CA AS SS SP PP PG GA AD DP PY YN NE EQ QF FF	KLGGALQAK
5092	CA AM MR RG GL LI IQ QG GA AQ QK KL LV VF	CA AS SS SS SA AG GT TG GG GQ QE ET TQ QY YF	KLGGALQAK
18008	CI IL LW WV VA AA AG GN NK KL LT TF	CA AS SS SV VR RS SS SM MN NT TE EA AF FF	KLGGALQAK
31268	CA AA AS SM MG GG GG GS SQ QG GN NL LI IF	CA AS SS SI IR RS ST TD DT TQ QY YF	GILGFVFTL
35138	CA AM MR RL LP PG GG GK KL LI IF	CA AS SS SE EG GL LG GT TE EA AF FF	KLGGALQAK
34451	CA AL LN NG GG GS SQ QG GN NL LI IF	CA AT TG GG GS SG GN NI IQ QY YF	KLGGALQAK
6366	CA AG GA AD DG GS SG GN NT TG GK KL LI IF	CA AS SS SV VR RS SA AY YE EQ QY YF	GILGFVFTL
28715	CA AL LR RP PA AV VG GN NQ QG GG GK KL LI IF	CA AS SS SP PN NG GG GA AP PS SY YE EQ QY YF	KLGGALQAK
6569	CA AG GH HS SG GG GG GA AD DG GL LT TF	CA AS SR RL LV VS SM MN NT TE EA AF FF	KLGGALQAK
36300	CA AM ME EG GG GY YQ QK KV VT TF	CS SV VS SW WD DE EG GY YE EQ QY YF	KLGGALQAK
7087	CA AL LS SE EV VM MD DT TG GR RR RA AL LT TF	CA AS SS SP PR RT TD DL LS SA AP PN NT TG GE EL LF FF	RAKFKQLL
35001	CA AP PY YS SG GA AN NS SK KL LT TF	CA AS SS SS SG GT TR RP PT TE EQ QY YV	KLGGALQAK
5380	CA AV VS SM MD DG GL LM MF	CA AS SS SG GT TQ QP PG GL LG GG GE EQ QF FF	ELAGIGILTV
33596	CA AY YP PV VY YN NF FN NK KF FY YF	CA AS SS ST TI IG GT TG GG GL LE EK KL LF FF	KLGGALQAK
154	CA AE ER RP PL LW WA AG GG GF FK KT TI IF	CA AS SS SQ QE ED DS SS SY YN NE EQ QF FF	KLGGALQAK
7693	CA AT TD DS SY YG GQ QN NF FV VF	CA AS SS SF FG GI ID DS SP PL LH HF	KLGGALQAK
12586	CA AM MK KS ST TN NA AG GK KS ST TF	CA AS SS SF FS SG GN NT TG GE EL LF FF	RAKFKQLL
5506	CA AV VR RE ET TG GA AN NN NL LF FF	CA AS SR RT TG GG GF FE EA AF FF	GILGFVFTL
34863	CA AT TA AR RL LR RD DD DK KI II IF	CA AS SS SP PT TG GP PN NT TE EA AF FF	KLGGALQAK
14319	CA AL LS SK KM MD DS SS SY YK KL LI IF	CA AS SS SL LP PP PR RS SG GA AA AY YN NE EQ QF FF	KLGGALQAK
6078	CA AV VV VE EG GG GG GS SQ QG GN NL LI IF	CA AS SS SI IR RS SS SY YE EQ QY YF	GILGFVFTL
17862	CA AT TD DA AG GI IL LS SG GT TY YK KY YI IF	CA AS SS SV VR RV VG GS SP PL LH HF	KLGGALQAK
7091	CA AV VA AV VG GV VS SG GG GG GA AD DG GL LT TF	CA AS SS SQ QG GA AY YG GY YT TF	GILGFVFTL
36314	CA AV VM MD DS SS SY YK KL LI IF	CA AS SS SD DG GT TG GG GY YN NE EQ QF FF	KLGGALQAK
34166	CI IV VR RD DH HN NY YG GQ QN NF FV VF	CA AS SS SQ QD DF FS SG GA AI IM MN NT TE EA AF FF	KLGGALQAK
23852	CV VV VS SG GL LT TG GG GG GN NK KL LT TF	CA AS SS SL LE ER RG GS SY YN NE EQ QF FF	KLGGALQAK
23823	CA AT TG GY YN NN NA AG GN NM ML LT TF	CA AS SS SS SS SG GQ QT TY YG GY YT TF	KLGGALQAK
24986	CL LV VG GD DI IR RT TG GA AN NN NL LF FF	CA AS SS SL LV VF FT TG GG GA AG GN NE EQ QF FF	KLGGALQAK
24713	CA AL LG GD DR RG GN NQ QF FY YF	CA AS SS SL LG GG GG GI IG GT TD DT TQ QY YF	KLGGALQAK
32695	CA AT TN NY YG GG GS SQ QG GN NL LI IF	CA AS SS SI IR RS SS SY YE EQ QY YF	GILGFVFTL
14270	CA AV VF FL LY YG GN NN NR RL LA AF	CA AS SS SP PS SS SS SY YE EQ QY YF	RAKFKQLL
8008	CA AG GN NR RD DD DK KI II IF	CA AS SS SF FL LD DR RG GP PN NT TE EA AF FF	RAKFKQLL
28881	CA AD DS SG GG GG GA AD DG GL LT TF	CA AS SS SF FP PG GG GF FT TG GE EL LF FF	RAKFKQLL
28730	CA AG GQ QD DS SN NY YQ QL LI IW	CA AT TS SP PS SG GG GT TY YN NE EQ QF FF	KLGGALQAK
25808	CI IL LR RE ET TS SY YD DK KV VI IF	CA AS SS SS SG GL LA AG GV VN NE EQ QF FF	RAKFKQLL
2404	CV VV VS SD DY YR RD DD DK KI II IF	CA AS ST TQ QN NR RE EN NT TE EA AF FF	KLGGALQAK
36119	CG GG GS SN NY YK KL LT TF	CA AS SS SV VD DE EQ QF FS SY YE EQ QY YF	KLGGALQAK
2273	CA AY YR RS SG GN NN NN ND DM MR RF	CA AS SS SL LL LN NQ QP PQ QH HF	KLGGALQAK
35334	CA AG GR RV VS SG GS SA AR RQ QL LT TF	CA AW WS SV VG GA AG GS SN NE EQ QY YV	KLGGALQAK
40	CA AL LD DR RA AG GN NN NR RK KL LI IW	CA AS SS SY YR RV VD DS SN NQ QP PQ QH HF	GILGFVFTL
34155	CG GA AD DI II IF FR RD DT TG GN NQ QF FY YF	CA AS SS SP PG GQ QG GT TH HY YE EQ QY YV	KLGGALQAK
2455	CA AV VR RV VG GS SG GG GY YN NK KL LI IF	CA AS SS SP PR RT TD DA AE ER RA AK KN NI IQ QY YF	RAKFKQLL
36271	CA AV VN NP PG GG GY YN NK KL LI IF	CS SA AG GL LE EN NS SG GG GA AW WN NE EQ QF FF	KLGGALQAK
34767	CA AL LS SE ED DG GQ QG GA AQ QK KL LV VF	CA AS SS SL LG GW WG GA AK KN NI IQ QY YF	KLGGALQAK
2837	CG GT TE EY YP PN ND DY YK KL LS SF	CA AS SS SW WG GG GG GS SH HY YG GY YT TF	IVTDFSVIK
35058	CA AV VD DV VT TG GA AG GS SY YQ QL LT TF	CA AS SS SL LI IE EA AS SG GG GF FE EQ QF FF	KLGGALQAK
36155	CA AV VD DL LM MK KT TS SY YD DK KV VI IF	CA AS SG GD DR RG GW WD DQ QP PQ QH HF	IVTDFSVIK
14678	CA AV VN NL LG GG GG GS SQ QG GN NL LI IF	CA AS SS SQ QQ QW WE EE ET TQ QY YF	GILGFVFTL
22326	CA AA AS SY YP PP PY YS SS SA AS SK KI II IF	CA AS SS SW WG GQ QG GK KT TG GE EL LF FF	RAKFKQLL
15992	CA AV VI IG GG GS SQ QG GN NL LI IF	CA AS SS SP PN NP PG GT TN NT TG GE EL LF FF	KLGGALQAK
34084	CV VG GN NN NA AG GN NM ML LT TF	CA AS SS SP PP PP PG GV VS SM MN NT TE EA AF FF	KLGGALQAK
2530	CA AM MR RE EG GG GE EY YG GN NK KL LV VF	CA AS SS SR RA AD DL LA AG GV VP PL LG GT TG GE EL LF FF	KLGGALQAK
674	CA AV VN NL LP PG GT TY YK KY YI IF	CA AS SS SL LG GT TG GF FG GY YT TF	AVFDRKSDAK
6842	CA AG GP PP PG GS SS SN NT TG GK KL LI IF	CA AS SS SI IR RS SS SY YE EQ QY YF	GILGFVFTL
32547	CA AG GS SG GS SQ QG GN NL LI IF	CA AS SS SI IR RS SA AY YE EQ QY YF	GILGFVFTL
6545	CA AG GP PT TH HN NM MN NY YG GG GS SQ QG GN NL LI IF	CA AS SS SY YY YS SN NQ QP PQ QH HF	GILGFVFTL
25004	CA AM MS SG GD DG GG GS SQ QG GN NL LI IF	CA AS SS SW WG GG GG GS SH HY YG GY YT TF	IVTDFSVIK
35019	CA AF FM MS SL LI IQ QG GA AQ QK KL LV VF	CA AS SS SL LE EL LG GL LA AE EA AF FF	KLGGALQAK
34978	CA AV VM MP PG GS SA AR RQ QL LT TF	CA AS SS SL LF FR RS SY YE EQ QY YF	KLGGALQAK
28876	CV VV VT TE ET TS SY YD DK KV VI IF	CA AS SS SY YS SQ QG GG GE EG GV VD DE EQ QF FF	RAKFKQLL
35904	CI IA AR RS SG GT TY YK KY YI IF	CA AS SS SM MG GS SG GQ QS SY YG GY YT TF	KLGGALQAK
34208	CA AV VR RL LA AY YN NN NN ND DM MR RF	CA AS SS SQ QN NT TR RT TD DG GY YT TF	KLGGALQAK
34157	CA AV VD DS SG GY YS ST TL LT TF	CA AS SS SP PP PD DS SY YE EQ QY YF	KLGGALQAK
10417	CV VV VC CS SL LQ QG GA AQ QK KL LV VF	CA AS SS SF FS SG GN NT TG GE EL LF FF	RAKFKQLL
277	CV VV VK KR RS SS SN NT TG GK KL LI IF	CA AS SS SA AG GD DW WI IS SD DN NS SP PL LH HF	IVTDFSVIK
28878	CA AL LS SG GY YF FG GN NE EK KL LT TF	CA AS ST TP PL LR RG GD DR RP PY YE EQ QY YF	KLGGALQAK
31834	CA AG GN NY YG GG GS SQ QG GN NL LI IF	CA AS SS ST TR RS ST TD DT TQ QY YF	GILGFVFTL
24588	CA AV VS SD DQ QE EG GA AQ QK KL LV VF	CA AS SS SL LI IA AL LG GN NT TE EA AF FF	RAKFKQLL
14315	CA AA AS SE ET TS SY YD DK KV VI IF	CA AS SS SR RS SG GG GA AG GE EL LF FF	RAKFKQLL
36128	CA AV VR RP PP PP PS SS SG GG GY YQ QK KV VT TF	CA AS SS SL LS SD DP PG GE EV VS SP PL LH HF	IVTDFSVIK
5255	CA AV VR RG GW WG GG GS SY YI IP PT TF	CS SA AR RQ QG GT TT TG GE EL LF FF	RAKFKQLL
35655	CA AL LG GV VT TY YN NN NN ND DM MR RF	CA AS SS SY YS SE EG GA AN NT TE EA AF FF	KLGGALQAK
6091	CA AA AD DN NY YG GG GS SQ QG GN NL LI IF	CA AS SS SI IR RS ST TD DT TQ QY YF	GILGFVFTL
23973	CA AD DS SG GG GG GA AD DG GL LT TF	CA AS SS SY YK KG GL LA AI IT TT TY YE EQ QY YF	RAKFKQLL
5518	CA AV VH HI IL LT TG GG GG GN NK KL LT TF	CA AS SS SS SG GS SG GT TE EA AF FF	GILGFVFTL
32391	CA AM MS SG GD DG GG GS SQ QG GN NL LI IF	CA AS SS SI IG GV VH HG GY YT TF	GILGFVFTL
2386	CA AV VE ED DP PI IY YN NF FN NK KF FY YF	CA AS SS SP PS SR RP PW WG GP PH HS SN NT TG GE EL LF FF	KLGGALQAK
2326	CA AG GP PS SY YY YG GG GS SQ QG GN NL LI IF	CA AS SG GQ QG GT TD DT TQ QY YF	KLGGALQAK
25080	CA AE EK KP PG GS SG GY YA AL LN NF	CA AS SS SL LT TP PG GG GE ET TQ QY YF	KLGGALQAK
33911	CA AA AM ME ET TS SY YD DK KV VI IF	CA AS SS SE EQ QG GQ QG GE EK KL LF FF	RAKFKQLL
269	CA AA AL LE EL LN NY YG GQ QN NF FV VF	CA AS SS ST TG GR RN NY YG GY YT TF	GILGFVFTL
25400	CA AT TF FG GN NE EK KL LT TF	CA AS SS SL LG GF FL LD DT TG GG GL LY YG GT TE EA AF FF	AVFDRKSDAK
26153	CA AV VS SD DS SN NY YQ QL LI IW	CS SA AQ QS SG GP PG GE EV VE EK KL LF FF	GILGFVFTL
8972	CV VV VN NP PP PG GN NT TP PL LV VF	CA AS SS SF FS SG GN NT TG GE EL LF FF	RAKFKQLL
35805	CA AV VR RD DI IL LG GQ QN NF FV VF	CA AS SR RS SG GT TG GG GT TN NT TE EA AF FF	KLGGALQAK
27814	CA AA AA AR RI ID DS SS SY YK KL LI IF	CS SV VG GS SG GE ED DS SP PQ QY YF	RAKFKQLL
3041	CG GA AG GR RV VD DD DM MR RF	CA AS SS SW WG GG GG GS SH HY YG GY YT TF	IVTDFSVIK
2277	CA AV VN ND DQ QF FY YF	CA AS SS SP PG GQ QL LL LM MN NT TE EA AF FF	ELAGIGILTV
17004	CA AV VG GL LY YY YG GN NN NR RL LA AF	CA AS SS SP PV VT TG GS SS SY YE EQ QY YF	GLCTLVAML
35479	CA AT TE EG GA AY YG GN NN NR RL LA AF	CS SG GW WE EG GL LY YG GY YT TF	KLGGALQAK
26563	CA AA AA AR RM MD DS SS SY YK KL LI IF	CS SA AG GG GN NT TE EA AF FF	RAKFKQLL
27061	CA AA AS ST TN NA AR RL LM MF	CS SA AQ QG GG GP PF FH HE EQ QY YF	KLGGALQAK
36062	CI IL LR RA AL LY YN NN NN ND DM MR RF	CA AS SS SL LE EG GS SG GV VT TG GK KL LF FF	AVFDRKSDAK
