699	CA AE ER RL LE EY YG GN NK KL LV VF	CA AS SS SL LT TG GE EG GS SP PL LH HF	KLGGALQAK
7366	CI IA AP PE EP PT TL LG GR RL LY YF	CA AS SG GQ QE EL LA AG GT TD DT TQ QY YF	KLGGALQAK
28818	CA AA AS SG GY YD DY YK KL LS SF	CA AS SS SY YG GF FP PT TS SG GG GN NT TG GE EL LF FF	RAKFKQLL
33998	CA AG GY YN NT TD DK KL LI IF	CA AT TS SV VV VI IT TE EA AF FF	KLGGALQAK
5404	CA AG GV VG GT TG GA AN NN NL LF FF	CA AS SS SP PI IR RD DR RG GC CY YE EQ QY YF	RAKFKQLL
382	CA AL LL LN NR RD DD DK KI II IF	CA AS SS SL LS SS SG GT TY YE EQ QY YF	IVTDFSVIK
36246	CA AY YR RR RE EG GK KL LI IF	CA AS SS SS SG GG GS SY YE EQ QY YF	KLGGALQAK
6601	CA AV VR RD DG GT TG GA AN NN NL LF FF	CA AS SS SG GT TS SV VH HE EQ QY YF	GILGFVFTL
36283	CA AG GQ QL LS SG GG GY YQ QK KV VT TF	CS SA AR RD DQ QL LR RE ED DN NY YG GY YT TF	KLGGALQAK
35378	CA AY YR RS SF FS SG GN NQ QF FY YF	CS SA AS SR RR RD DI II IS SG GY YT TF	KLGGALQAK
7689	CA AA AG GE ET TS SY YD DK KV VI IF	CA AS SR RS SG GD DS SN NQ QP PQ QH HF	RAKFKQLL
25394	CA AG GG GG GS SQ QG GN NL LI IF	CA AS SS SL LD DT TQ QY YF	GILGFVFTL
5428	CA AL LS SS SG GA AG GS SY YQ QL LT TF	CA AS SS SY YS SA AG GR RD DN NE EQ QF FF	KLGGALQAK
17970	CA AA AS SE ET TS SY YD DK KV VI IF	CA AS SS SV VA AV VG GT TG GS SG GA AN NV VL LT TF	RAKFKQLL
69	CA AV VS SE EK KN NR RD DD DK KI II IF	CA AS SS SP PR RG GE EK KL LF FF	KLGGALQAK
23843	CA AV VE EA AR RE EG GG GS SE EK KL LV VF	CA AS SK KL LS SF FN NY YG GY YT TF	KLGGALQAK
34474	CA AE EI IP PH HH HH HG GS SG GN NT TG GK KL LI IF	CA AS SS SL LD DS SG GN NT TI IY YF	KLGGALQAK
30361	CA AM MS SR RG GI ID DR RG GS ST TL LG GR RL LY YF	CA AS SS SI IG GV VH HG GY YT TF	GILGFVFTL
34761	CA AV VS SG GY YS ST TL LT TF	CA AS SS SL LG GQ QG GV VY YE EQ QY YF	KLGGALQAK
30562	CA AT TA AN NT TG GF FQ QK KL LV VF	CA AS SS SI IR RS SS SY YE EQ QY YF	GILGFVFTL
5218	CA AV VW WV VY YG GQ QN NF FV VF	CS SA AS ST TQ QG GA AL LV VL LT TN NE EQ QF FF	GILGFVFTL
20673	CA AV VG GR RM MD DS SS SY YK KL LI IF	CA AS SS SL LR RD DG GS SE EA AF FF	RAKFKQLL
36160	CA AV VN NW WE EE EQ QG GG GS SY YI IP PT TF	CA AS SR RV VS SG GS SL LS SY YN NE EQ QF FF	KLGGALQAK
33908	CV VV VS SA AG GY YA AL LN NF	CA AS SR RS SL LQ QT TF FF	KLGGALQAK
14516	CA AY YR RS SK KE ET TS SG GS SR RL LT TF	CA AS SS SP PP PG GG GG GN NT TG GE EL LF FF	RAKFKQLL
35617	CA AV VL LD DS SN NY YQ QL LI IW	CA AS SS SG GT TG GN NQ QP PQ QH HF	KLGGALQAK
35015	CA AA AA AG GG GG GN NK KL LT TF	CA AS SS SG GR RQ QG GR RG GY YT TF	KLGGALQAK
35328	CV VV VN NS SR RL LS SG GA AG GS SY YQ QL LT TF	CA AW WR RT TG GP PV VG GN NT TI IY YF	KLGGALQAK
23845	CI IL LR RD DW WE ER RK KY YG GN NK KL LV VF	CA AS SS SA AG GT TG GR RV VE ET TQ QY YF	KLGGALQAK
2330	CA AM MR RE EA AN NA AG GG GT TS SY YG GK KL LT TF	CA AS SS SA AG GG GG GG GQ QY YF	ELAGIGILTV
35402	CA AV VD DR RS SG GG GS SN NY YK KL LT TF	CS SA AF FR RR RG GM MN NT TE EA AF FF	KLGGALQAK
29698	CA AM MR RE EA AT TG GT TA AL LI IF	CA AS SS SA AR RS SS SY YE EQ QY YF	GILGFVFTL
18107	CA AR RR RG GG GA AD DG GL LT TF	CA AS SS SL LA AL LA AG GP PY YE EQ QY YF	ELAGIGILTV
26525	CA AE EP PK KG GG GT TY YK KY YI IF	CS SA AW WT TG GT TE EA AF FF	GLCTLVAML
36287	CA AV VQ QD DS SN NY YQ QL LI IW	CS SA AR RT TG GE EV VE EQ QY YF	KLGGALQAK
35569	CA AL LS SE EG GA AG GG GT TS SY YG GK KL LT TF	CS SV VP PP PG GG GA AG GR RA AF FF	KLGGALQAK
35762	CA AV VS SY YQ QG GG GS SE EK KL LV VF	CA AS SS SY YG GA AG GG GY YN NE EQ QF FF	KLGGALQAK
13989	CA AA AS SE ET TS SY YD DK KV VI IF	CA AS SS SR RT TD DG GN NT TI IY YF	RAKFKQLL
235	CI IL LR RG GS SG GA AG GS SY YQ QL LT TF	CA AS SS SQ QF FL LG GV VG GE ET TD DT TQ QY YF	KLGGALQAK
24963	CA AD DS SG GG GG GA AD DG GL LT TF	CA AS SS SL LN NR RG GD DP PE EA AF FF	GLCTLVAML
5019	CA AA AS SI IW WN NG GN NQ QF FY YF	CA AS SS SR RW WT TS SE ED DE EQ QF FF	KLGGALQAK
23962	CA AM MR RE EG GQ QA AG GQ QK KL LL LF	CA AS SS SY YG GT TG GE EN NT TE EA AF FF	RAKFKQLL
5256	CA AE ES SY YS SS SA AS SK KI II IF	CS SA AR RS SL LA AS SG GR RL LQ QP PG GF FE EQ QY YF	KLGGALQAK
35273	CA AY YR RI IR RG GS SQ QG GN NL LI IF	CA AS SS SV VG GG GA AD DT TQ QY YF	KLGGALQAK
35314	CA AL LG GE EP PG GA AA AG GN NK KL LT TF	CA AR RV VR RE EG GP PD DT TE EA AF FF	KLGGALQAK
283	CA AA AY YS SG GG GG GA AD DG GL LT TF	CA AS SS SA AS SG GV VG GY YE EQ QY YF	KLGGALQAK
34121	CA AM MR RG GV VK KG GN NN NR RL LA AF	CA AS SS SE EE EV VS ST TE EA AF FF	KLGGALQAK
85	CA AV VV VP PR RG GT TS SG GS SR RL LT TF	CA AS SS SF FL LI IG GG GN NQ QP PQ QH HF	KLGGALQAK
10	CA AA AS SE EQ QG GG GK KL LI IF	CA AT TS SD DR RT TG GT TG GI IQ QA AN NY YG GY YT TF	ELAGIGILTV
34290	CA AM MM MY YN NN NN ND DM MR RF	CA AS SF FG GD DT TE EA AF FF	KLGGALQAK
27843	CG GR RQ QM ML LL LF FT TT TV VL LW WR RT TG GT TS SG GT TY YK KY YI IF	CS SV VG GS SG GE ED DS SP PQ QY YF	RAKFKQLL
31776	CA AG GN NY YG GG GS SQ QG GN NL LI IF	CA AS SS ST TR RS SS SY YE EQ QY YF	GILGFVFTL
4390	CA AV VR RD DH HS SG GN NT TP PL LV VF	CA AS SS SW WG GG GG GS SH HY YG GY YT TF	IVTDFSVIK
28710	CV VV VN NM MD DN NA AR RL LM MF	CA AS SS SI IT TE EG GE ED DS SV VS ST TD DT TQ QY YF	RAKFKQLL
5414	CA AV VK KD DN NA AG GN NM ML LT TF	CA AS SS SY YD DG GV VE EQ QF FF	RAKFKQLL
34310	CA AV VT TG GY YS ST TL LT TF	CA AS SS SQ QD DG GR RY YE EQ QY YF	KLGGALQAK
35356	CA AT TG GP PY YN NQ QG GG GK KL LI IF	CS SA AR RD DI IA AG GG GT TY YN NE EQ QF FF	KLGGALQAK
23230	CA AA AS SN NT TG GK KL LI IF	CA AS SS SL LG GF FT TD DT TQ QY YF	RAKFKQLL
28417	CA AT TD DV VA AR RD DS SS SY YK KL LI IF	CA AS SS SS ST TM MG GD DT TI IY YF	KLGGALQAK
34484	CA AV VS SD DY YN NQ QG GG GK KL LI IF	CA AS SS SL LR RE EQ QG GR RY YN NE EQ QF FF	KLGGALQAK
35193	CA AV VS SG GG GG GA AD DG GL LT TF	CA AW WS SG GT TA AT TP PY YE EQ QY YV	KLGGALQAK
2315	CA AV VP PT TI IL LT TG GG GG GN NK KL LT TF	CA AT TS SR RV VQ QE ET TQ QY YF	IVTDFSVIK
628	CA AA AE EI IN NA AG GG GT TS SY YG GK KL LT TF	CA AS SS SV VE EL LA AP PG GE EL LF FF	GILGFVFTL
25222	CG GA AD DS SA AS SG GT TY YK KY YI IF	CA AS SS SP PE EY YN NE EQ QF FF	RAKFKQLL
35188	CA AE EE EG GA AS SS SG GT TY YK KY YI IF	CA AS SS SV VN NR RG GE EA AF FF	KLGGALQAK
6347	CA AV VN NK KG GG GG GS SQ QG GN NL LI IF	CA AS SS ST TR RA AS SE EG GQ QY YF	GILGFVFTL
18104	CA AL LS SG GA AN NN NN ND DM MR RF	CA AS SS SF FP PG GL LA AD DR RQ QY YF	KLGGALQAK
28703	CA AA AS SE ET TS SY YD DK KV VI IF	CA AS SS SE EV VV VS ST TT TY YE EQ QY YF	RAKFKQLL
33505	CA AA AL LE EP PG GF FQ QK KL LV VF	CA AS SS SP PL LS ST TD DT TQ QY YF	GILGFVFTL
205	CV VV VS SS SI IS SG GG GG GA AD DG GL LT TF	CA AS SS SQ QD DA AA AG GE EK KL LF FF	KLGGALQAK
5417	CA AM MS ST TN NT TG GN NQ QF FY YF	CA AS SS SY YF FS SP PL LA AV VN NT TG GE EL LF FF	KLGGALQAK
6959	CA AV VN NT TP PP PF FY YF	CA AS SS SI IR RS SS SY YE EQ QY YF	ELAGIGILTV
7084	CA AV VN NP PS SN NT TG GK KL LI IF	CA AS SS SP PF FG GS SD DE EQ QF FF	GILGFVFTL
36025	CA AV VE EP PL LY YG GN NK KL LV VF	CA AT TS SD DR RL LA AG GG GE EL LF FF	KLGGALQAK
36245	CA AL LG GN NN NR RL LA AF	CA AS SS SP PT TD DA AM MN NT TE EA AF FF	KLGGALQAK
31333	CA AG GA AG GD DG GG GS SQ QG GN NL LI IF	CA AS SS SI IR RS ST TT TE EA AF FF	GILGFVFTL
34870	CA AG GM MD DS SS SY YK KL LI IF	CA AS SS ST TT TT TS SG GY YS ST TD DT TQ QY YF	KLGGALQAK
25002	CA AA AS SE ET TS SY YD DK KV VI IF	CA AS SS SW WG GG GG GS SH HY YG GY YT TF	RAKFKQLL
35791	CA AL LA AP PT TT TD DS SW WG GK KF FQ QF	CA AS SG GW WF FA AE EA AF FF	KLGGALQAK
2004	CA AV VD DL LD DS SG GG GG GA AD DG GL LT TF	CA AS SS SL LY YS SA AT TG GE EL LF FF	AVFDRKSDAK
25072	CA AV VR RA AF FT TG GG GG GN NK KL LT TF	CA AS SS SL LE EG GL LA AG GA AG GI IQ QY YF	KLGGALQAK
24334	CA AL LS SE EG GN NS SG GG GY YQ QK KV VT TF	CA AS SS SE ES SW WG GP PY YE EQ QY YF	IVTDFSVIK
5731	CA AG GA AD DG GS SS SN NT TG GK KL LI IF	CA AS SS SI IR RS SA AY YE EQ QY YF	GILGFVFTL
32592	CA AG GG GG GY YG GG GS SQ QG GN NL LI IF	CA AS SS SI IR RS SD DT TE EA AF FF	GILGFVFTL
10950	CA AA AT TE ET TS SY YD DK KV VI IF	CA AS SS SF FS SG GN NT TG GE EL LF FF	RAKFKQLL
35887	CI IL LR RE EK KS SG GG GS SN NY YK KL LT TF	CA AS SS SI IV VL LG GL LG GE EK KL LF FF	RAKFKQLL
6	CI IV VR RV VA AN NT TD DK KL LI IF	CA AS SS SS SF FS SA AN NE EK KL LF FF	GILGFVFTL
33590	CA AF FM MK KG GA AG GG GT TS SY YG GK KL LT TF	CA AS SS ST TG GS SY YG GY YT TF	GILGFVFTL
2286	CA AE EI II IY YG GN NN NR RL LA AF	CA AS SS SS SR RQ QS SE EA AD DT TQ QY YF	KLGGALQAK
29774	CA AA AK KV VT TF	CA AS SS SA AR RS SS SY YE EQ QY YF	GILGFVFTL
16044	CA AV VF FL LY YG GN NN NR RL LA AF	CA AS SS SQ QR RP PS SE EV VG GE EL LF FF	RAKFKQLL
23849	CA AF FM MK KH HR RK KS SH HR RD DD DK KI II IF	CA AS SS SL LD DD DL LQ QG GN NT TE EA AF FF	RAKFKQLL
16659	CA AE EM ME EG GG GN NY YI IP PT TF	CA AS SS SQ QR RP PS SE EV VG GE EL LF FF	RAKFKQLL
705	CA AF FM MK KH HA AI II II IQ QG GA AQ QK KL LV VF	CA AS SS SL LW WR RA AL LE EQ QY YF	RAKFKQLL
34199	CA AL LD DP PR RN NY YG GQ QN NF FV VF	CA AS SS SQ QG GS SS SG GN NT TI IY YF	KLGGALQAK
33860	CA AE EN NG GG GG GG GS SQ QG GN NL LI IF	CA AS SS SY YR RA AT TD DT TQ QY YF	GILGFVFTL
26491	CV VV VS SD DV VN NT TD DK KL LI IF	CS SA AR RS SR RV VG GN NT TI IY YF	GLCTLVAML
23305	CA AV VR RN NY YG GG GA AT TN NK KL LI IF	CA AS SS SL LS SG GR RP PY YE EQ QY YF	RAKFKQLL
2306	CA AA AH HL LS SN NF FG GN NE EK KL LT TF	CA AT TS SR RD DR RG GH HG GD DT TI IY YF	KLGGALQAK
7061	CV VV VN NI IG GG GG GS SQ QG GN NL LI IF	CA AS SS SI IR RS ST TD DT TQ QY YF	GILGFVFTL
6951	CA AV VN NL LY YG GG GS SQ QG GN NL LI IF	CA AS SS SI IR RS SS SY YE EQ QY YF	GILGFVFTL
34873	CV VV VN NT TG GN NQ QF FY YF	CA AS ST TG GT TG GE EY YY YG GY YT TF	KLGGALQAK
27758	CA AD DS SG GG GG GA AD DG GL LT TF	CS SV VG GS SG GE ED DN NE EQ QY YF	RAKFKQLL
34233	CA AV VW WD DS SN NY YQ QL LI IW	CA AS SS SQ QE EG GE EG GF FQ QP PQ QH HF	KLGGALQAK
2371	CA AL LS SD DR RG GG GN NK KL LT TF	CA AS SS SL LS SF FR RD DK KA AL LW WG GY YT TF	KLGGALQAK
32983	CA AG GD DS SP PA AG GK KS ST TF	CA AS SS SI IR RS SS SY YE EQ QY YF	GILGFVFTL
33206	CA AE EM ME EG GG GS SY YI IP PT TF	CA AS SS SI IR RS SS SY YE EQ QY YF	RAKFKQLL
34487	CV VV VF FN ND DY YK KL LS SF	CA AS SS SL LV VG GS SE EM MN NT TE EA AF FF	KLGGALQAK
5507	CA AV VN NK KD DF FN NK KF FY YF	CA AS SS SA AG GG GS SN NE EQ QF FF	ELAGIGILTV
23844	CA AV VE ES SV VD DD DK KI II IF	CA AS SR RL LS SG GG GG GY YN NE EQ QF FF	KLGGALQAK
6549	CA AF FM MD DY YY YN NT TD DK KL LI IF	CA AS ST TL LT TS SG GS SY YF FS SY YN NE EQ QF FF	KLGGALQAK
159	CA AA AS SF FS SG GN NT TG GK KL LI IF	CA AS SS SQ QG GA AG GI IG GR RT TD DT TQ QY YF	KLGGALQAK
1233	CA AV VL LR RM MD DS SS SY YK KL LI IF	CA AS SS SL LY YS SA AT TG GE EL LF FF	AVFDRKSDAK
34708	CA AV VE EG GT TI IQ QG GA AQ QK KL LV VF	CA AS SS SY YK KQ QG GY YE EQ QY YF	KLGGALQAK
5080	CA AG GH HT TG GN NQ QF FY YF	CA AS SS SP PV VT TG GG GG GS SG GA AN NV VL LT TF	IVTDFSVIK
25447	CA AT TD DD DN NA AG GN NM ML LT TF	CA AS SS SL LR RG GI ID DE EQ QY YF	RAKFKQLL
34975	CA AL LS SE EA AL LV VG GN NE EK KL LT TF	CA AS SS SL LF FQ QG GS SG GT TE EA AF FF	KLGGALQAK
34268	CA AV VK KL LR RD DA AR RL LM MF	CA AS SS SQ QD DY YR RL LA AG GV VA AG GE EL LF FF	KLGGALQAK
683	CA AG GP PK KG GG GA AT TN NK KL LI IF	CA AS SS SL LR RG GR RL LR RH HY YN NE EQ QF FF	KLGGALQAK
23014	CA AA AS SR RG GY YS ST TL LT TF	CA AS SS SL LG GG GG GN NN NE EQ QF FF	KLGGALQAK
7344	CA AD DS SG GG GG GA AD DG GL LT TF	CA AT TS SV VG GQ QG GT TG GD DE EQ QY YF	RAKFKQLL
14272	CA AE ET TH HS SG GG GS SN NY YK KL LT TF	CA AS SS SP PS SS SS SY YE EQ QY YF	RAKFKQLL
34095	CA AV VR RD DE EY YG GG GS SQ QG GN NL LI IF	CA AS SS SP PV VG GG GS SG GE EL LF FF	KLGGALQAK
35679	CA AL LG GE EP PG GA AA AG GN NK KL LT TF	CA AS SI IL LA AR RG GG GT TE EA AF FF	KLGGALQAK
36212	CA AV VD DL LM MK KT TS SY YD DK KV VI IF	CA AI IS SR RT TG GG GS SN NT TE EA AF FF	IVTDFSVIK
35696	CA AL LG GP PT TS SG GT TY YK KY YI IF	CA AS SS SE ER RG GT TG GI II IW WE EK KL LF FF	KLGGALQAK
33917	CA AA AS SE ET TS SY YD DK KV VI IF	CA AS SS SE EQ QG GQ QG GE EK KL LF FF	RAKFKQLL
36322	CA AV VD DL LM MK KT TS SY YD DK KV VI IF	CA AS SS SY YS SG GY YG GG GY YT TF	IVTDFSVIK
25294	CA AF FM MR RG GR RG GK KL LT TF	CA AS SS SF FR RD DS SY YE EQ QY YF	KLGGALQAK
33386	CA AF FG GG GG GG GS SQ QG GN NL LI IF	CA AS SS SI IR RS SV VD DT TQ QY YF	GILGFVFTL
17893	CA AA AS SG GG GT TY YK KY YI IF	CA AS SS SS SG GL LV VS SN NT TG GE EL LF FF	GLCTLVAML
34743	CG GT TE ES SG GA AN NN NL LF FF	CA AS SS SF FS SV VE EE ET TA AN NY YG GY YT TF	KLGGALQAK
15330	CV VV VN NM MD DN NA AR RL LM MF	CA AS SS SQ QG GT TV VN NT TE EA AF FF	RAKFKQLL
630	CA AV VN NK KG GG GG GS SQ QG GN NL LI IF	CA AS SS SV VG GG GA AG GV VS SN NE EQ QF FF	GILGFVFTL
33516	CA AM MS SG GD DG GG GS SQ QG GN NL LI IF	CA AS SS SP PR RS SN NQ QP PQ QH HF	GILGFVFTL
35885	CA AT TD DA AG GD DA AG GG GT TS SY YG GK KL LT TF	CA AS SS SI IV VG GQ QG GN NQ QP PQ QH HF	KLGGALQAK
25783	CA AA AS SE ET TS SY YD DK KV VI IF	CA AS SS SR RL LG GQ QG GA AI IT TE EA AF FF	RAKFKQLL
239	CA AT TD DS SN NT TG GK KL LI IF	CA AS SS SQ QG GQ QL LS ST TD DT TQ QY YF	KLGGALQAK
31404	CA AE EN NE EG GG GG GS SQ QG GN NL LI IF	CA AS SS SL LY YA AS SY YE EQ QY YF	GILGFVFTL
27841	CA AG GE EG GS ST TG GN NQ QF FY YF	CS SV VG GS SG GE ED DS SP PQ QY YF	RAKFKQLL
13978	CA AA AP PE ET TS SY YD DK KV VI IF	CA AS SS SP PG GT TS SE ET TG GE EL LF FF	RAKFKQLL
30421	CA AA AS SA AG GG GG GS SQ QG GN NL LI IF	CA AS SS SI IR RA AS SY YE EQ QY YF	GILGFVFTL
35621	CA AM MS SD DS SN NY YQ QL LI IW	CA AS SR RE EP PV VG GR RN NE EQ QF FF	KLGGALQAK
5652	CA AD DM MN NR RD DD DK KI II IF	CA AS SS SI IR RA AA AY YE EQ QY YF	GILGFVFTL
3074	CV VV VN NG GG GD DS SS SY YK KL LI IF	CA AS SS SW WG GG GG GS SH HY YG GY YT TF	IVTDFSVIK
26494	CA AC CM MD DS SN NY YQ QL LI IW	CS SA AR RT TG GD DT TE EA AF FF	KLGGALQAK
34485	CA AR RR RE EG GG GK KL LI IF	CA AS SS SL LS SF FL LG GR RE ET TQ QY YF	KLGGALQAK
28415	CG GT TG GF FT TQ QG GG GS SE EK KL LV VF	CA AS SS SS SP PG GT TG GI IS SY YE EQ QY YF	KLGGALQAK
26521	CA AM MS SG GK KT TS SG GT TY YK KY YI IF	CS SA AS SS SL LT TS SG GG GA AP PE EQ QY YF	KLGGALQAK
2462	CA AL LS SE EA AG GN NY YG GQ QN NF FV VF	CA AS SS SL LG GG GP PG GL LY YN NE EQ QF FF	KLGGALQAK
26190	CA AA AS SA AT TR RG GT TD DK KL LI IF	CS SA AR RA AL LP PV VG GN NT TI IY YF	GLCTLVAML
596	CA AV VI IG GY YS SS SA AS SK KI II IF	CA AS SS SV VD DA AL LS SS SY YE EQ QY YF	ELAGIGILTV
35963	CA AE EN NI IL LS SG GY YS ST TL LT TF	CA AT TH HR RG GG GA AG GE EL LF FF	KLGGALQAK
26055	CA AL LS SV VF FS SG GG GG GA AD DG GL LT TF	CA AW WS SV VG GQ QG GT TD DG GE EL LF FF	KLGGALQAK
2562	CA AA AS SE ET TG GR RR RA AL LT TF	CA AS SS SL LG GD DG GN NY YE EQ QY YF	KLGGALQAK
35296	CA AA AK KF FG GN NE EK KL LT TF	CA AS SS SL LT TG GA AF FY YG GY YT TF	KLGGALQAK
31368	CA AM MR RG GD DA AG GG GT TS SY YG GK KL LT TF	CA AS SS SI IY YS SN NQ QP PQ QH HF	GILGFVFTL
25277	CA AE EM ME EG GG GS SY YI IP PT TF	CA AS SS SD DR RG GG GI IG GG GS SA AF FF	RAKFKQLL
4192	CA AR RG GG GG GF FK KT TI IF	CA AS SS SW WG GG GG GS SH HY YG GY YT TF	IVTDFSVIK
24692	CA AF FM MI IN NA AG GG GT TS SY YG GK KL LT TF	CA AS SL LI IS SG GT TD DT TQ QY YF	KLGGALQAK
35912	CA AL LS SE EA AG GE ET TS SG GS SR RL LT TF	CA AS SS SP PF FA AG GG GM MS ST TD DT TQ QY YF	KLGGALQAK
17967	CA AL LT TP PG GA AA AG GN NK KL LT TF	CA AS SS SV VA AV VG GT TG GS SG GA AN NV VL LT TF	KLGGALQAK
33072	CA AV VG GV VG GG GS SQ QG GN NL LI IF	CA AS SS SI IR RS SS SY YE EQ QY YF	GILGFVFTL
35025	CA AL LS SE EE EG GT TY YK KY YI IF	CA AS SS SS SI IS SG GK KQ QE ET TQ QY YF	KLGGALQAK
34823	CA AL LS SD DS SM MN NY YG GG GS SQ QG GN NL LI IF	CA AS SS SL LD DT TV VG GP PT TG GG GE EE ET TQ QY YF	KLGGALQAK
13821	CA AG GG GE ET TS SY YD DK KV VI IF	CA AS SS SF FT TG GG GR RT TG GE EL LF FF	RAKFKQLL
14243	CA AA AS SE ET TS SY YD DK KV VI IF	CA AS ST TQ QQ QG GS SY YG GY YT TF	RAKFKQLL
35756	CA AV VE ED DS SS SG GY YA AL LN NF	CA AS SS SW WI IQ QR RP PD DY YG GY YT TF	KLGGALQAK
8170	CA AY YS SP PA AA AG GG GT TS SY YG GK KL LT TF	CA AS SS SF FS SG GN NT TG GE EL LF FF	RAKFKQLL
6598	CA AA AS SG GG GG GS SQ QG GN NL LI IF	CA AS SS SG GR RS SQ QE ET TQ QY YF	GILGFVFTL
34201	CA AA AH HT TG GY YG GG GS SQ QG GN NL LI IF	CA AS SS SQ QG GT TG GS SY YE EQ QY YF	KLGGALQAK
32999	CA AT TE EG GA AS SG GG GS SY YI IP PT TF	CA AS SS SI IR RS SS SY YE EQ QY YF	GILGFVFTL
33178	CA AA AL LY YS SS SA AS SK KI II IF	CA AS SS SI IR RS SS SY YE EQ QY YF	GILGFVFTL
34762	CA AG GR RN NT TD DK KL LI IF	CA AS SS SL LG GR RG GL LN NT TE EA AF FF	KLGGALQAK
34079	CA AM MR RR RP PI IS SS SG GS SA AR RQ QL LT TF	CA AS SS SP PN NT TG GM ME ET TQ QY YF	KLGGALQAK
36202	CA AV VR RP PR RG GD DT TG GR RR RA AL LT TF	CA AS SG GG GQ QY YN NE EQ QF FF	KLGGALQAK
5389	CA AV VR RG GT TG GT TA AS SK KL LT TF	CA AS SR RQ QL LR RG GL LM MA AY YE EQ QY YF	ELAGIGILTV
15794	CA AA AS SE ET TS SY YD DK KV VI IF	CA AS SS ST TS ST TG GT TG GY YG GY YT TF	RAKFKQLL
26260	CA AS SD DT TQ QG GG GS SE EK KL LV VF	CS SA AR RD DL LS SG GG GS SY YN NE EQ QF FF	KLGGALQAK
27120	CA AE ET TH HS SG GG GS SN NY YK KL LT TF	CS SV VG GS SG GD DH HG GE EQ QF FF	RAKFKQLL
26140	CA AV VT TL LG GG GN NQ QF FY YF	CS SA AP PG GQ QG GN NY YE EQ QY YF	KLGGALQAK
14627	CA AV VK KR RT TT TD DS SW WG GK KL LQ QF	CA AI IP PG GL LP PP PE ET TQ QY YF	IVTDFSVIK
7235	CA AL LS SE EG GG GG GA AT TN NK KL LI IF	CA AS SS SP PG GV VG GT TY YN NE EQ QF FF	KLGGALQAK
5488	CA AL LS SE EA AS SS SG GG GY YQ QK KV VT TF	CA AS SS SS SI IA AR RV VI IQ QY YF	KLGGALQAK
34531	CV VV VS SA AS SG GG GY YN NK KL LI IF	CA AS SG GT TN NS SY YN NE EQ QF FF	KLGGALQAK
2438	CA AA AS SM MG GG GG GS SQ QG GN NL LI IF	CA AS SS SL LG GQ QG GV VF FY YT TF	IVTDFSVIK
5624	CA AF FM MK KD DA AG GG GT TS SY YG GK KL LT TF	CA AS SS SI IG GS SY YG GY YT TF	GILGFVFTL
17036	CA AE EI IR RG GG GK KL LI IF	CA AS SS SQ QD DH HG GG GS SS SY YG GY YT TF	KLGGALQAK
34662	CA AM MR RR RP PI IS SS SG GS SA AR RQ QL LT TF	CA AS SS SL LT TG GP PD DG GY YG GY YT TF	KLGGALQAK
34795	CV VV VR RL LT TG GT TA AS SK KL LT TF	CA AS SS SW WK KD DP PD DL LS SG GY YT TF	KLGGALQAK
36239	CA AT TS SA AG GN NM ML LT TF	CA AS SS SL LP PD DR RG GS SR RF FG GF FF	AVFDRKSDAK
23278	CA AE EN NS SK KG GH HD DN ND DM MR RF	CA AS SS SL LS SG GR RP PY YE EQ QY YF	RAKFKQLL
31406	CA AA AS SG GG GG GS SQ QG GN NL LI IF	CA AS SS SM MF FG GT TD DT TQ QY YF	GILGFVFTL
35172	CA AV VR RM MD DY YK KL LS SF	CA AS SS SP PE ED DG GP PY YN NE EQ QF FF	KLGGALQAK
4956	CV VV VL LN NT TD DK KL LI IF	CA AS SS SF FG GE EQ QF FF	GILGFVFTL
34189	CA AA AS SA AR RI IY YG GG GS SQ QG GN NL LI IF	CA AS SS SQ QG GF FS SN NQ QP PQ QH HF	KLGGALQAK
33391	CA AG GP PS SG GN NM MN NY YG GG GS SQ QG GN NL LI IF	CA AS SS SI IV VA AL LD DE EQ QF FF	GILGFVFTL
7686	CA AA AS SE ET TS SY YD DK KV VI IF	CA AS SR RP PT TG GD DY YG GY YT TF	RAKFKQLL
7269	CA AS SH HS SG GT TY YK KY YI IF	CA AS SS SQ QY YL LW WG GG GE EL LF FF	KLGGALQAK
22245	CA AV VG GE EY YD DY YK KL LS SF	CA AS SS SL LR RD DG GS SE EA AF FF	RAKFKQLL
32921	CA AV VV VH HG GS SS SN NT TG GK KL LI IF	CA AS SS SI IR RS SS SY YE EQ QY YF	GILGFVFTL
28457	CA AF FM MK KG GA AG GG GT TS SY YG GK KL LT TF	CA AS SQ QG GV VS SY YN NS SP PL LH HF	GILGFVFTL
34055	CA AV VR RP PR RA AD DG GG GA AT TN NK KL LI IF	CA AS SS SF FH HA AD DY YN NE EQ QF FF	KLGGALQAK
34146	CA AM MR RR RP PI IS SS SG GS SA AR RQ QL LT TF	CA AS SS SH HP PA AG GG GE EE ET TQ QY YF	KLGGALQAK
35016	CA AL LF FS SD DN NA AR RL LM MF	CA AS SS SK KR RQ QS SM MN NT TE EA AF FF	KLGGALQAK
374	CA AV VK KY YS SG GA AG GS SY YQ QL LT TF	CA AS SS SG GS SS SG GT TS SK KN NI IQ QY YF	KLGGALQAK
26032	CA AV VR RW WR RY YN NN NN ND DM MR RF	CA AA AE ED DP PE EW WG GA AE EA AF FF	KLGGALQAK
12	CA AA AE EN NS SG GY YS ST TL LT TF	CA AT TG GT TS SP PN NE EK KL LF FF	RAKFKQLL
284	CA AE EN ND DN NY YG GQ QN NF FV VF	CA AS SS SA AT TG GT TE EN NN NE EQ QF FF	KLGGALQAK
34477	CA AT TD DY YN ND DY YK KL LS SF	CA AS SS SL LE EV VQ QG GG GP PE EQ QY YF	KLGGALQAK
23228	CA AA AD DH HG GS SG GN NT TG GK KL LI IF	CA AS SS SL LD DR RD DL LS SS SY YN NE EQ QF FF	KLGGALQAK
2775	CA AM MS SS SN NA AG GG GT TS SY YG GK KL LT TF	CA AS SS SW WG GG GG GS SH HY YG GY YT TF	IVTDFSVIK
14677	CA AM MS SG GD DG GG GS SQ QG GN NL LI IF	CA AS SS SL LL LL LA AG GE EN NT TG GE EL LF FF	GILGFVFTL
34008	CA AV VR RS ST TT TN NA AG GK KS ST TF	CA AT TS SD DK KG GG GL LK KA AF FF	KLGGALQAK
31340	CA AV VS SP PN ND DY YK KL LS SF	CA AS SS SI IR RS ST TT TE EA AF FF	GILGFVFTL
2566	CA AM MR RE EV VG GR RR RA AL LT TF	CA AS SS SL LG GV VA AG GT TN NT TG GE EL LF FF	KLGGALQAK
35726	CA AV VN NA AG GS SQ QG GN NL LI IF	CA AT TE EG GL LA AE EW WG GQ QQ QE ET TQ QY YF	KLGGALQAK
34492	CA AV VD DP PR RI IL LT TG GG GG GN NK KL LT TF	CA AS SS SP PG GG GP PY YF FT TD DT TQ QY YF	KLGGALQAK
11294	CP PQ QG GA AQ QK KL LV VF	CA AS SS SF FS SG GN NT TG GE EL LF FF	RAKFKQLL
34226	CG GA AG GL LY YS SG GG GG GA AD DG GL LT TF	CA AS SS SS SR RM MN NT TE EA AF FF	KLGGALQAK
2246	CA AH HL LQ QG GA AQ QK KL LV VF	CA AS SS SL LA AG GT TG GE EL LF FF	IVTDFSVIK
32297	CA AG GA AG GG GG GS SQ QG GN NL LI IF	CA AS SS SG GR RS ST TG GE EL LF FF	GILGFVFTL
35801	CA AM MR RG GG GW WG GN NQ QG GG GK KL LI IF	CA AS SR RD DS SL LD DY YG GY YT TF	KLGGALQAK
36279	CA AV VD DL LM MK KT TS SY YD DK KV VI IF	CS SA AP PN NP PN NT TG GE EL LF FF	IVTDFSVIK
32605	CA AM MS SG GD DG GG GS SQ QG GN NL LI IF	CA AS SS SI IR RS SS SE EP PQ QH HF	GILGFVFTL
7083	CA AV VN NE EG GG GG GS SQ QG GN NL LI IF	CA AS SS SM MR RS SS SY YE EQ QY YF	GILGFVFTL
35739	CA AL LG GE EP PS SG GG GG GA AD DG GL LT TF	CA AS SS SR RS SS SY YN NE EQ QF FF	KLGGALQAK
35431	CA AV VR RG GL LN NN NA AG GN NM ML LT TF	CS SA AR RD DL LL LA AG GG GY YT TG GE EL LF FF	KLGGALQAK
25402	CA AG GG GG GS SQ QG GN NL LI IF	CA AS SS SL LG GG GG GN NE EA AF FF	GILGFVFTL
15321	CA AS SR RR RT TA AR RQ QL LT TF	CA AS SS SQ QE ES SK KN NE EQ QY YF	RAKFKQLL
28372	CI IV VR RL LR RC CR RT TP PT TS SS SS SL	CA AS SS SL LG GG GQ QG GS SN NE EQ QF FF	KLGGALQAK
5238	CI IL LS SS SG GT TY YK KY YI IF	CS SA AP PT TP PL LL LA AG GG GY YN NE EQ QF FF	GILGFVFTL
3038	CA AG GA AT TD DS SW WG GK KL LQ QF	CA AS SS SW WG GG GG GS SH HY YG GY YT TF	IVTDFSVIK
34562	CA AV VG GA AN NP PT TD DS SW WG GK KL LQ QF	CA AS ST TV VQ QA AD DY YG GY YT TF	KLGGALQAK
35333	CV VV VS SQ QQ QD DT TG GR RR RA AL LT TF	CA AW WS SV VF FQ QR RE ES SY YN NE EQ QF FF	KLGGALQAK
7679	CA AV VI IS SY YS SS SA AS SK KI II IF	CA AS SP PN NR RQ QG GH HT TD DT TQ QY YF	RAKFKQLL
8147	CA AD DS SG GG GG GA AD DG GL LT TF	CA AS SS SF FS SG GN NT TG GE EL LF FF	RAKFKQLL
15322	CA AE ES SL LW WD DD DK KI II IF	CA AS SS SQ QG GA AG GI IG GR RT TD DT TQ QY YF	RAKFKQLL
35399	CI IL LS SK KI IT TG GN NQ QF FY YF	CS SA AE EL LV VT TE EQ QY YF	KLGGALQAK
34907	CA AA AS SA AT TG GG GK KR RF	CA AS SS SP PG GT TG GG GF FQ QP PQ QH HF	KLGGALQAK
15324	CA AA AR RA AG GG GT TS SY YG GK KL LT TF	CA AS SS SQ QG GG GT TG GL LG GE EQ QY YF	KLGGALQAK
5855	CA AG GS SN NT TN NA AG GK KS ST TF	CA AS SS SI IR RS SS SY YE EQ QY YF	GILGFVFTL
24598	CA AA AS SE ET TS SY YD DK KV VI IF	CA AS SS SL LQ QG GG GT TG GE EL LF FF	RAKFKQLL
30089	CA AG GR RG GN NN NA AR RL LM MF	CA AS SS SI IG GS SY YG GY YT TF	GILGFVFTL
30088	CA AF FM MI IN NA AG GG GT TS SY YG GK KL LT TF	CA AS SS SI IG GS SH HG GY YT TF	GILGFVFTL
16935	CA AL LS SE EF FE EG GA AG GN NN NR RK KL LI IW	CA AS SS SR RL LG GD DT TQ QY YF	KLGGALQAK
8	CA AS SV VG GM MD DS SS SY YK KL LI IF	CA AT TS SD DF FR RD DS SS SN NE EQ QF FF	KLGGALQAK
33996	CA AV VP PF FF FS SG GA AG GS SY YQ QL LT TF	CA AT TS SG GG GH HG GY YT TF	KLGGALQAK
34585	CA AV VP PG GG GT TS SY YG GK KL LT TF	CA AS SF FS SG GG GS SY YN NE EQ QF FF	KLGGALQAK
33961	CV VG GY YT TN NA AG GK KS ST TF	CA AS SS SP PP PG GG GG GN NT TG GE EL LF FF	RAKFKQLL
5606	CA AF FM MT TN NA AG GG GT TS SY YG GK KL LT TF	CA AS SS SI IG GI IY YG GY YT TF	GILGFVFTL
24361	CA AA AA AR RV VG GG GS SQ QG GN NL LI IF	CA AS SS SL LD DG GY YG GY YT TF	RAKFKQLL
6262	CA AF FM MT TN NA AG GG GT TS SY YG GK KL LT TF	CA AS SS SQ QG GA AY YG GY YT TF	GILGFVFTL
35208	CA AS SP PQ QG GG GS SE EK KL LV VF	CA AS SR RF FA AG GG GN NE EK KL LF FF	KLGGALQAK
24707	CA AV VG GD DN NF FN NK KF FY YF	CA AS SS SI IL LF FG GE EQ QF FF	RAKFKQLL
272	CA AG GH HT TG GN NQ QF FY YF	CA AS SS SS SG GL LV VS SN NT TG GE EL LF FF	IVTDFSVIK
5804	CA AA AG GG GS SQ QG GN NL LI IF	CA AS SS SI IR RS SS SY YE EQ QF FF	GILGFVFTL
18115	CA AD DS SG GG GG GA AD DG GL LT TF	CA AS SS SL LI IQ QT TG GQ QA AL LE EQ QY YF	RAKFKQLL
34336	CA AS SD DT TY YT TG GA AN NS SK KL LT TF	CA AS SS SQ QL LR RG GE EE EA AF FF	KLGGALQAK
34614	CA AE ES SW WG GG GG GF FK KT TI IF	CA AS SS SF FS SK KG GS SG GT TD DG GY YT TF	KLGGALQAK
26138	CA AV VT TR RT TD DS SW WG GK KF FQ QF	CS SA AP PG GE EG GY YG GN NT TI IY YF	KLGGALQAK
34561	CA AD DP PP PG GY YQ QL LI IW	CA AS SS SW WG GT TN NT TE EA AF FF	KLGGALQAK
9609	CA AG GG GG GS SQ QG GN NL LI IF	CA AS SS SF FS SG GN NT TG GE EL LF FF	RAKFKQLL
35820	CA AV VR RD DL LN ND DY YK KL LS SF	CA AS SS SE ED DR RD DG GN NT TI IY YF	KLGGALQAK
18590	CA AL LS SE EN NG GR RS SQ QG GN NL LI IF	CA AS SS SL LR RD DG GS SE EA AF FF	RAKFKQLL
25265	CI IL LT TE ET TS SY YD DK KV VI IF	CA AS SA AS SL LG GG GG GL LY YE EQ QY YF	RAKFKQLL
32402	CA AA AS SP PR RD DQ QP PL LS SG GA AG GS SY YQ QL LT TF	CA AS SS SI IH HS SG GN NQ QP PQ QH HF	GILGFVFTL
22001	CA AV VD DF FR RD DN NY YG GQ QN NF FV VF	CA AS SS SL LR RD DG GS SE EA AF FF	RAKFKQLL
35372	CA AV VK KD DN NY YG GQ QN NF FV VF	CS SA AS SG GL LS SS SY YE EQ QY YV	KLGGALQAK
30422	CA AA AR RM MI IK KA AA AG GN NK KL LT TF	CA AS SS SI IR RA AS SY YE EQ QY YF	GILGFVFTL
25912	CA AV VR RD DR RE EN NQ QG GG GK KL LI IF	CA AS SS ST TS SE EG GG GL LF FY YE EQ QY YF	KLGGALQAK
5253	CA AV VT TT TD DS SW WG GK KL LQ QF	CS SA AR RP PR RT TS SG GS SG GA AG GE EL LF FF	ELAGIGILTV
36052	CA AV VG GA AG GN NN ND DM MR RF	CA AS SA AT TP PE EG GE ET TQ QY YF	KLGGALQAK
7176	CG GT TE ER RS SG GG GS SN NY YK KL LT TF	CA AS SS ST TG GV VY YG GY YT TF	GILGFVFTL
2541	CG GC CH HT TG GN NQ QF FY YF	CA AS SS SH HG GS SG GS SP PY YG GY YT TF	IVTDFSVIK
25108	CA AE ES SE EG GP PT TY YT TD DK KL LI IF	CA AS SS SQ QT TS SG GG GA AR RE EQ QF FF	RAKFKQLL
32304	CA AG GA AG GN NT TG GK KL LI IF	CA AS SS SG GR RS ST TG GE EL LF FF	GILGFVFTL
