4968	CA AG GG GN NT TG GK KL LI IF	CA AS SS SL LG GQ QG GA AS SQ QP PQ QH HF	KLGGALQAK
34919	CA AV VQ QA AY YR RD DN NY YG GQ QN NF FV VF	CA AI IS SE ES SN NS SN NT TG GE EL LF FF	KLGGALQAK
35748	CA AV VG GV VL LR RG GQ QA AG GT TA AL LI IF	CA AS SR RP PG GR RA AD DY YG GY YT TF	KLGGALQAK
33840	CA AE EN NM MG GG GG GS SQ QG GN NL LI IF	CA AS SS SV VR RS SG GE ET TQ QY YF	GILGFVFTL
33945	CA AG GA AG GS SQ QG GN NL LI IF	CA AS SS SQ QD DR RV VR RE ET TQ QY YF	GILGFVFTL
33554	CA AG GA AG GS SQ QG GN NL LI IF	CA AS SS SS SR RS SA AY YE EQ QY YF	GILGFVFTL
34621	CA AL LM ME EY YG GN NK KL LV VF	CA AS SS SH HG GW WL LA AG GG GE ED DT TQ QY YF	KLGGALQAK
25385	CA AR RG GG GG GF FK KT TI IF	CA AS SS SL LA AD DV VG GG GP PQ QH HF	RAKFKQLL
35484	CA AG GV VV VT TN ND DY YK KL LS SF	CS SV VA AG GT TG GN NT TE EA AF FF	KLGGALQAK
34633	CA AR RK KY YK KL LS SF	CA AS SS SL LG GG GR RN NN NE EQ QF FF	KLGGALQAK
26548	CA AV VN NQ QA AG GT TA AL LI IF	CS SG GL LA AG GG GP PG GE EQ QY YF	KLGGALQAK
6686	CA AG GN NY YG GG GS SQ QG GN NL LI IF	CA AS SS SI IR RS SD DE EK KL LF FF	GILGFVFTL
35909	CA AY YR RE EN ND DM MR RF	CA AS SS SM MV VA AG GV VY YN NE EQ QF FF	KLGGALQAK
16650	CV VV VN NM MD DN NA AR RL LM MF	CA AS SS SQ QR RP PS SE EV VG GE EL LF FF	RAKFKQLL
34074	CA AV VE EN NN NA AG GK KS ST TF	CA AS SS SY YP PM MG GG GA AD DG GS SQ QE ET TQ QY YF	KLGGALQAK
34722	CA AV VR RD DG GA AA AG GN NK KL LT TF	CA AS SS SG GG GT TS SG GS SN NE EQ QF FF	KLGGALQAK
35467	CA AM MS SV VF FY YN NQ QG GG GK KL LI IF	CS SS SP PG GG GP PN NE EK KL LF FF	KLGGALQAK
35168	CA AV VQ QP PQ QI IQ QG GA AQ QK KL LV VF	CA AS SS SL LS SY YN NE EQ QF FF	KLGGALQAK
32417	CA AE ER RD DG GG GG GS SQ QG GN NL LI IF	CA AS SS SI IR RA AA AE ET TQ QY YF	GILGFVFTL
18087	CA AL LS SE EG GT TY YK KY YI IF	CA AS SS SS SR RG GR RR RD DP PG GE EL LF FF	KLGGALQAK
2347	CA AV VS ST TG GF FQ QK KL LV VF	CA AS SS SL LG GE ET TQ QY YF	ELAGIGILTV
12507	CA AL LL LI IY YG GG GY YQ QK KV VT TF	CA AS SS SF FS SG GN NT TG GE EL LF FF	RAKFKQLL
35470	CA AV VL LG GG GG GA AD DG GL LT TF	CS SF FR RI IG GG GT TE EA AF FF	KLGGALQAK
35808	CA AT TD DE EV VY YN NN ND DM MR RF	CA AS SR RV VG GN NT TE EA AF FF	KLGGALQAK
16765	CA AE EN NP PS SS SA AS SK KI II IF	CA AS SS SQ QR RP PS SE EV VG GE EL LF FF	RAKFKQLL
35658	CA AA AF FS SG GG GY YN NK KL LI IF	CA AS SS SY YS SG GS SD DT TQ QY YF	KLGGALQAK
28595	CV VV VN NW WP PG GD DM MR RF	CA AS SK KS SE ER RG GT TY YE EQ QY YF	KLGGALQAK
2275	CA AV VF	CA AS SS SL LT TL LS SD DT TQ QY YF	KLGGALQAK
5089	CA AV VS SL LG GF FS SG GS SA AR RQ QL LT TF	CA AS SS SQ QL LG GR RG GD DN NE EQ QF FF	KLGGALQAK
29859	CA AA AS SG GG GG GS SQ QG GN NL LI IF	CA AS SS SA AR RS SS SY YE EQ QY YF	GILGFVFTL
29018	CA AL LQ QR RG GT TY YK KY YI IF	CA AS SS SA AR RD DT TS SY YE EQ QY YF	KLGGALQAK
35254	CA AL LS SD DS SG GG GS SY YI IP PT TF	CA AS SS SP PQ QT TG GK KR RL LY YE EQ QY YF	AVFDRKSDAK
25107	CA AA AS SE ET TS SY YD DK KV VI IF	CA AS SS SP PR RD DR RE ER RG GE EQ QY YF	RAKFKQLL
34632	CA AM MR RE EH HP PF	CA AS SS SL LG GG GP PA AL LD DQ QP PQ QH HF	KLGGALQAK
34593	CA AV VK KG GT TG GA AS SG GG GG GA AD DG GL LT TF	CA AS SR RG GT TG GG GL LS SY YE EQ QY YF	KLGGALQAK
25920	CA AG GA AG GS SQ QG GN NL LI IF	CA AS ST TL LG GE ER RN NP PR RG GY YT TF	GILGFVFTL
35562	CA AV VS SP PV VS SS SG GS SA AR RQ QL LT TF	CS SV VE EW WV VG GG GP PT TE EA AF FF	KLGGALQAK
35613	CA AL LS SD DQ QF FK KA AA AG GN NK KL LT TF	CA AS SS SD DS SQ QG GS SY YN NS SP PL LH HF	KLGGALQAK
26615	CA AA AK KE EG GG GS SE EK KL LV VF	CS SA AG GG GN NT TE EA AF FF	RAKFKQLL
36206	CA AV VK KG GR RG GD DT TG GR RR RA AL LT TF	CA AS SS SE EQ QG GS SS SE EA AF FF	KLGGALQAK
34758	CV VV VN NR RR RY YP PG GN NQ QF FY YF	CA AS SS SL LG GA AQ QE ET TQ QY YF	KLGGALQAK
25282	CA AV VG GP PT TG GK KL LI IF	CA AS SS SE ED DR RG GY YQ QE ET TQ QY YF	KLGGALQAK
187	CA AV VK KG GG GG GA AD DG GL LT TF	CA AS SS SQ QG GA AF FS SV VE EQ QY YF	ELAGIGILTV
23243	CA AT TH HG GG GG GG GN NK KL LT TF	CA AS SS SL LR RP PG GR RA AY YE EQ QY YF	KLGGALQAK
26479	CA AV VL LL LF FN NT TD DK KL LI IF	CS SA AR RG GP PG GR RG GE EQ QY YF	KLGGALQAK
104	CG GT TD DS SN ND DY YK KL LS SF	CA AR RQ QP PL LR RG GA AN NV VL LT TF	KLGGALQAK
35315	CA AV VE EQ QD DS SN NY YQ QL LI IW	CA AW WA AL LP PP PG GA AN NV VL LT TF	KLGGALQAK
35638	CA AV VR RD DI IL LK KA AA AG GN NK KL LT TF	CA AS SS SR RT TE EE ET TQ QY YF	KLGGALQAK
34124	CA AV VL LN NS SG GG GY YQ QK KV VT TF	CA AS SS SE EG GT TS SG GQ QE ET TQ QY YF	KLGGALQAK
28933	CA AG GT TY YG GG GS SQ QG GN NL LI IF	CA AA AS SS SR RS ST TD DT TQ QY YF	GILGFVFTL
35853	CA AV VT TP PP PG GD DM MR RF	CA AS SS SI IG GQ QG GQ QS SP PL LH HF	KLGGALQAK
35745	CA AV VW WY YM MR RF	CA AS SI IP PA AG GG GP PG GD DT TQ QY YF	KLGGALQAK
35029	CL LV VV VF FG GA AG GS SY YQ QL LT TF	CA AS SS ST TQ QM ME ET TQ QY YF	KLGGALQAK
34316	CA AE ES SG GY YS SS SA AS SK KI II IF	CA AS SS SQ QE EG GR RE ET TE EA AF FF	KLGGALQAK
31619	CA AE ED DY YG GG GS SQ QG GN NL LI IF	CA AS SS SS SR RS SA AN NE EQ QF FF	GILGFVFTL
6946	CA AV VQ QA AF FV VE EE ET TS SG GS SR RL LT TF	CA AS SS SI IR RS SS SY YE EQ QY YF	GILGFVFTL
34983	CA AL LS SE ET TM MD DS SN NY YQ QL LI IW	CA AS SS SL LI IF FP PG GD DL LP PH HQ QE ET TQ QY YF	KLGGALQAK
25016	CA AV VM MK KD DP PN NA AG GG GT TS SY YG GK KL LT TF	CA AS SS SW WG GG GG GS SH HY YG GY YT TF	IVTDFSVIK
34709	CA AG GP PQ QT TL LS SG GG GY YN NK KL LI IF	CA AS SS SY YL LG GD DN NN NQ QP PQ QH HF	KLGGALQAK
5640	CA AF FM MV VN NA AG GG GT TS SY YG GK KL LT TF	CA AS SS SI IG GS SY YG GY YT TF	GILGFVFTL
35178	CA AI IG GP PG GN NM ML LT TF	CA AS SS SR RA AG GA AT TY YN NE EQ QF FF	KLGGALQAK
34565	CA AL LS SE EE EV VD DY YG GN NN NR RL LA AF	CA AT TS SL LA AE ES ST TD DT TQ QY YF	KLGGALQAK
25270	CA AA AS SE ET TS SY YD DK KV VI IF	CA AS SL LR RL LG GI ID DQ QE ET TQ QY YF	RAKFKQLL
35964	CA AA AS SA AN NN NY YG GQ QN NF FV VF	CA AT TN NR RG GF FT TE EA AF FF	AVFDRKSDAK
35668	CA AA AF FT TS SG GT TY YK KY YI IF	CA AS SS SY YV VG GG GP PG GD DT TQ QY YF	KLGGALQAK
17040	CA AM MN NY YG GG GS SQ QG GN NL LI IF	CA AS SS SQ QD DW WG GT TV VY YG GY YT TF	KLGGALQAK
35477	CA AV VQ QA AR RT TD DK KL LI IF	CS SG GA AT TG GL LS SY YN NE EQ QF FF	KLGGALQAK
34697	CA AL LI IN NT TS SG GT TY YK KY YI IF	CA AS SS ST TA AD DR RW WY YG GY YT TF	KLGGALQAK
21476	CV VV VS SE EN NT TG GF FQ QK KL LV VF	CA AS SS SL LR RD DG GS SE EA AF FF	RAKFKQLL
35667	CA AA AS SA AD DA AR RL LM MF	CA AS SS SY YV VA AG GG GQ QE ET TQ QY YF	KLGGALQAK
25029	CI IV VM MD DD DF FQ QK KL LV VF	CA AS SS SS SH HG GA AG GA AY YN NE EQ QF FF	RAKFKQLL
25806	CA AA AM ME ET TS SY YD DK KV VI IF	CA AS SS SS SG GL LA AG GL LN NE EQ QF FF	RAKFKQLL
26127	CA AM MR RE ED DD DR RD DS ST TL LG GR RL LY YF	CS SA AG GQ QG GL LA AG GG GP PG GT TD DT TQ QY YF	RAKFKQLL
7674	CA AA AS SE ET TS SY YD DK KV VI IF	CA AS SI IV VR RN ND DR RD DP PT TG GE EL LF FF	RAKFKQLL
34931	CA AL LI IR RA AD DS SW WG GK KF FQ QF	CA AI IS SE EG GE EG GV VS SY YN NS SP PL LH HF	KLGGALQAK
34081	CA AT TD DD DM MR RF	CA AS SS SP PP PG GA AP PN NY YG GY YT TF	KLGGALQAK
34956	CA AL LS SE EA AF FS SG GN NT TP PL LV VF	CA AS SR RG GP PV VE ET TQ QY YF	KLGGALQAK
23828	CA AG GS ST TT TD DS SW WG GK KL LQ QF	CA AS SY YD DR RG GT TE EA AF FF	KLGGALQAK
22358	CA AV VP PY YN NQ QG GG GK KL LI IF	CA AS SS SG GP PG GG GV VD DE EQ QY YF	RAKFKQLL
34902	CA AA AS SV VW WY YA AR RL LM MF	CA AS SS SG GT TS SG GN NT TG GE EL LF FF	KLGGALQAK
32524	CA AV VV VR RG GI IS SR RW WH HQ QN NA AG GG GT TS SY YG GK KL LT TF	CA AS SS SI IR RS SA AQ QP PQ QH HF	GILGFVFTL
7356	CA AV VS SE EY YS ST TL LT TF	CA AS SG GL LN NP PQ QE ER RS ST TD DT TQ QY YF	RAKFKQLL
35649	CA AL LS SE EL LD DT TD DK KL LI IF	CA AS SS SY YG GA AG GE ER RY YE EQ QY YF	KLGGALQAK
27090	CA AV VQ QP PG GA AN NN NL LF FF	CS SV VE EL LI IG GY YT TF	KLGGALQAK
36231	CA AL LS SE EA AG GN NF FN NK KF FY YF	CA AS SS SS SE EA AG GA AR RE ET TQ QY YF	KLGGALQAK
35403	CA AV VT TR RS SN ND DY YK KL LS SF	CS SA AG GG GG GA AT TY YN NE EQ QF FF	KLGGALQAK
34304	CA AE ER RS SL LN NN NT TD DK KL LI IF	CA AS SS SP PR RP PS SG GG GH HS ST TD DT TQ QY YF	KLGGALQAK
19422	CA AG GN NY YG GG GS SQ QG GN NL LI IF	CA AS SS SL LR RD DG GS SE EA AF FF	RAKFKQLL
32195	CA AG GG GG GS SQ QG GN NL LI IF	CA AS SS SF FR RS SS SE ET TQ QY YF	GILGFVFTL
34447	CV VV VR RE ER RG GG GG GN NK KL LT TF	CA AS SS SS SR RI IR RE EH HE EQ QY YF	KLGGALQAK
27291	CA AD DS SG GG GG GA AD DG GL LT TF	CS SV VG GS SG GD DH HG GE EQ QF FF	RAKFKQLL
30515	CA AG GG GG GS SS SN NT TG GK KL LI IF	CA AS SS SI IR RS SS SY YE EQ QF FF	GILGFVFTL
2292	CA AV VE EG GP PT TD DS SW WG GK KF FQ QF	CA AS SS SL LG GD DP PT TN NY YG GY YT TF	KLGGALQAK
11196	CA AV VR RF FN NA AG GN NM ML LT TF	CA AS SS SF FS SG GN NT TG GE EL LF FF	RAKFKQLL
34453	CA AV VT TS SR RS SG GG GY YQ QK KV VT TF	CA AS SI IA AG GP PG GT TG GG GE EK KL LF FF	KLGGALQAK
35854	CA AM MR RG GT TK KT TS SY YD DK KV VI IF	CA AS SS SI IG GR RS ST TE EA AF FF	KLGGALQAK
34023	CA AV VR RE EV VD DR RT TG GK KL LI IF	CA AT TS SR RA AS ST TD DT TQ QY YF	KLGGALQAK
5599	CA AA AN NY YG GG GS SQ QG GN NL LI IF	CA AS SS SG GR RS ST TG GE EL LF FF	GILGFVFTL
33502	CA AG GA AG GG GG GS SQ QG GN NL LI IF	CA AS SS SM MR RS ST TD DT TQ QY YF	GILGFVFTL
24291	CA AG GL LT TD DG GQ QN NF FV VF	CA AS SS SP PD DS SN NG GY YT TF	KLGGALQAK
34829	CA AV VN NT TG GF FQ QK KL LV VF	CA AS SS SL LG GQ QG GT TS SG GG GG GI IN NT TG GE EL LF FF	KLGGALQAK
34511	CA AM MR RP PP PF FR RG GG GY YN NK KL LI IF	CV VS SS SS SR RD DS SQ QN NQ QP PQ QH HF	KLGGALQAK
30032	CA AY YS SS SN NA AG GG GT TS SY YG GK KL LT TF	CA AS SS SI IG GL LY YG GY YT TF	GILGFVFTL
34939	CA AD DS SG GF FQ QK KL LV VF	CA AS SS SF FG GT TG GN NY YG GY YT TF	KLGGALQAK
34996	CA AV VR RD DM MY YN NA AR RL LM MF	CA AS SS SP PP PG GQ QL LS SY YE EQ QY YF	KLGGALQAK
35258	CA AV VG GH HE ED DG GG GS SN NY YK KL LT TF	CA AS SS SP PV VF FR RT TE EQ QY YF	KLGGALQAK
34957	CA AG GN NS SG GT TY YK KY YI IF	CA AS SR RG GP PV VE ET TQ QY YF	KLGGALQAK
5142	CA AT TE EG GA AS SG GG GS SY YI IP PT TF	CA AW WV VL LG GP PA AG GD DT TQ QY YF	KLGGALQAK
7667	CA AF FL LL LT TD DS SN NY YQ QL LI IW	CA AS SS SF FS SG GN NT TG GE EL LF FF	RAKFKQLL
26512	CA AV VR RS SP PH HS SW WG GK KL LQ QF	CS SA AS SG GL LA AG GV VL LT TD DT TQ QY YF	AVFDRKSDAK
16981	CA AV VV VD DS SG GY YA AL LN NF	CA AS SS SP PL LI IG GA AN NV VL LT TF	KLGGALQAK
200	CA AV VW WS SY YG GG GS SQ QG GN NL LI IF	CA AS SS SH HG GQ QG GR RG GN NT TE EA AF FF	KLGGALQAK
6609	CA AG GQ QY YR RD DD DK KI II IF	CA AS SS SI IG GL LG GE EQ QY YF	GILGFVFTL
140	CG GP PG GG GY YN NK KL LI IF	CA AS SS SL LA AG GT TS SG GR RD DE EQ QF FF	KLGGALQAK
4926	CA AY YR RS SV VG GT TP PL LV VF	CA AS SS SL LG GA AG GK KV VT TD DT TQ QY YF	KLGGALQAK
30395	CA AV VR RD DK KP PP PG GP PG GG GG GS SY YI IP PT TF	CA AS SS SI IH HG GA AG GT TE EA AF FF	GILGFVFTL
5062	CA AG GA AS SN NT TG GK KL LI IF	CA AS SS SL LG GD DN NT TE EA AF FF	GILGFVFTL
5107	CA AF FM ML LG GA AG GG GT TS SY YG GK KL LT TF	CA AS SS SF FL LT TG GN NT TE EA AF FF	GILGFVFTL
31938	CA AT TD DA AG GG GG GS SQ QG GN NL LI IF	CA AS SM ME EL LA AG GL LN NE EQ QF FF	GILGFVFTL
35641	CA AE EN NM MR RA AG GN NM ML LT TF	CA AS SS SS SF FM MG GN NQ QP PQ QH HF	KLGGALQAK
36269	CA AA AH HP PP PM MY YS SG GG GG GA AD DG GL LT TF	CS SA AD DS SG GE EL LS SY YE EQ QY YF	KLGGALQAK
6164	CA AA AD DN NY YG GG GS SQ QG GN NL LI IF	CA AS SS SI IY YG GG GA AG GD DG GY YT TF	GILGFVFTL
34608	CV VV VS SD DT TS SG GT TY YK KY YI IF	CA AS SS SF FL LG GG GR RN NP PN NE EQ QF FF	KLGGALQAK
13976	CA AA AA AE ET TS SY YD DK KV VI IF	CA AS SS SN NS SG GA AN NV VL LT TF	RAKFKQLL
36106	CA AY YR RR RD DD DK KI II IF	CA AS SS SQ QG GL LA AA AS SY YE EQ QY YF	KLGGALQAK
35687	CA AM MS SA AG GN NN NN ND DM MR RF	CA AS SS SD DR RD DR RV VE EQ QY YF	KLGGALQAK
33898	CI IV VN ND DA AG GT TS SY YG GK KL LT TF	CA AS SS SQ QE EL LS SR RR RN NT TE EA AF FF	KLGGALQAK
5799	CA AG GA AD DG GG GG GS SQ QG GN NL LI IF	CA AS SS SI IR RS SG GY YE EQ QY YF	GILGFVFTL
57	CA AS SI IA AG GT TY YK KY YI IF	CA AS SS SF FS SG GN NT TG GE EL LF FF	RAKFKQLL
35303	CA AE ER RS SG GG GS SY YI IP PT TF	CA AS SS SR RT TG GG GT TD DT TQ QY YF	KLGGALQAK
34334	CA AL LF FR RN NS SG GN NT TP PL LV VF	CA AS SS SQ QG GT TY YE EQ QY YF	KLGGALQAK
183	CA AW WK KS SN NQ QF FY YF	CA AS SS SQ QE EL LL LS SS SG GE EL LF FF	ELAGIGILTV
28301	CA AA AS ST TN NA AR RL LM MF	CS SV VQ QG GG GA AY YN NE EQ QF FF	KLGGALQAK
5132	CA AL LK KL LI IK KA AA AG GN NK KL LT TF	CA AW WT TG GT TG GK KI IG GW WD DS SP PL LH HF	KLGGALQAK
14674	CA AV VN NI IR RQ QA AG GT TA AL LI IF	CA AS SS SG GG GD DR RG GT TE EA AF FF	KLGGALQAK
35428	CA AV VR RD DG GG GM MG GS SN NT TG GK KL LI IF	CS SA AR RD DL LE EV VL LS SY YE EQ QY YF	KLGGALQAK
35162	CI IL LG GE EK KT TS SY YD DK KV VI IF	CA AS SS SL LG GY YG GM MN NT TE EA AF FF	KLGGALQAK
35454	CA AV VN NS SW WN NN NN NA AR RL LM MF	CS SA AS SP PR RG GY YT TE EA AF FF	KLGGALQAK
34173	CA AV VR RG GR RV VS ST TD DK KL LI IF	CA AS SS SQ QD DQ QG GI IT TE EA AF FF	KLGGALQAK
5273	CA AM MR RE EG GW WN NT TG GF FQ QK KL LV VF	CS SV VE ET TG GG GQ QG GA AW WD DT TQ QY YF	KLGGALQAK
15827	CA AL LG GD DS SG GA AG GS SY YQ QL LT TF	CA AS SS ST TS ST TG GT TG GY YG GY YT TF	RAKFKQLL
14675	CA AD DS SG GG GG GA AD DG GL LT TF	CA AS SS SG GR RT TG GS SS SY YE EQ QY YF	GILGFVFTL
34300	CA AV VN NP PE EG GS ST TL LT TF	CA AS SS SP PG GE EF FE EK KL LF FF	KLGGALQAK
5527	CA AV VN NA AG GN ND DM MR RF	CA AS SS SY YG GQ QG GW WG GY YT TF	ELAGIGILTV
24351	CD DT TL LD DN NN ND DM MR RF	CA AI IS SE ES SL LT TP PP PG GL LP PL LF FN NY YG GY YT TF	KLGGALQAK
32247	CA AA AK KE EG GY YS ST TL LT TF	CA AS SS SG GG GG GV VY YG GY YT TF	KLGGALQAK
34808	CA AY YM MW WG GG GT TS SY YG GK KL LT TF	CA AS SR RW WD DS SY YN NQ QP PQ QH HF	KLGGALQAK
35103	CG GS SG GD DY YK KL LS SF	CA AS SM MA AV VG GA AN NV VL LT TF	ELAGIGILTV
15326	CA AV VV VE EF FG GG GS SN NY YK KL LT TF	CA AS SS SQ QG GL LG GE EN NT TE EA AF FF	RAKFKQLL
34864	CA AG GV VW WA AD DS SW WG GK KL LQ QF	CA AS SS SQ QL LN NT TY YG GY YT TF	KLGGALQAK
22315	CV VV VT TD DF FN NA AG GN NN NR RK KL LI IW	CA AS SS SP PG GG GG GY YT TF	KLGGALQAK
35002	CA AD DY YT TG GN NQ QF FY YF	CA AS SS SS SP PV VT TG GQ QT TE EA AF FF	KLGGALQAK
30493	CA AA AK KS SN NT TG GK KL LI IF	CA AS SS SI IR RS SS SE ET TQ QY YF	GILGFVFTL
25767	CA AR RE EH HM MD DS SN NY YQ QL LI IW	CA AS SS SQ QL LG GR RG GD DN NE EQ QF FF	GILGFVFTL
28307	CG GA AD DG GG GG GT TY YK KY YI IF	CS SY YS SA AG GE ED DQ QP PQ QH HF	RAKFKQLL
34051	CL LV VG GD DM ME EG GG GS ST TL LG GR RL LY YF	CA AS SR RY YG GT TP PG GT TE EA AF FF	KLGGALQAK
32253	CI IV VR RV VS SG GA AG GG GT TS SY YG GK KL LT TF	CA AS SS SG GR RS SG GE ET TQ QY YF	GILGFVFTL
53	CA AV VG GG GL LV VF FG GN NE EK KL LT TF	CA AS SS SF FS SG GN NT TG GE EL LF FF	RAKFKQLL
34696	CA AV VN NG GF FG GN NV VL LH HC	CA AS SS SS SQ QG GN NT TG GE EL LF FF	KLGGALQAK
7882	CA AG GA AG GN NY YQ QL LI IW	CA AS SS SF FL LD DR RG GP PN NT TE EA AF FF	RAKFKQLL
99	CA AL LD DE EA AG GT TA AS SK KL LT TF	CA AS SS SP PP PA AG GS SG GQ QE ET TQ QY YF	KLGGALQAK
32537	CA AL LK KI IP PL LV VF	CA AS SS SI IR RS SA AY YE EQ QY YF	GILGFVFTL
10119	CA AV VD DP PM MD DT TG GR RR RA AL LT TF	CA AS SS SF FS SG GN NT TG GE EL LF FF	RAKFKQLL
23241	CA AG GG GG GS SQ QG GN NL LI IF	CA AS SS SL LP PG GT TG GG GS SP PL LH HF	GILGFVFTL
35741	CG GT TF FP PP PY YS SS SA AS SK KI II IF	CA AS SS SY YF FG GG GT TE EA AF FF	KLGGALQAK
24	CI IL LR RE ET TS SY YD DK KV VI IF	CA AS SA AL LL LS SS SY YN NS SP PL LH HF	GILGFVFTL
2368	CA AE EM ME EG GG GS SY YI IP PT TF	CA AS SS SL LR RG GD DR RG GD DT TQ QY YF	KLGGALQAK
34798	CA AV VN NV VP PS SD DG GQ QK KL LL LF	CA AS SA AP PH HG GG GP PI IN NT TG GE EL LF FF	KLGGALQAK
36156	CG GT TE EI IG GG GG GT TS SY YG GK KL LT TF	CA AS SG GT TE ET TQ QY YF	KLGGALQAK
5051	CA AV VR RD DI IG GN NQ QG GG GK KL LI IF	CA AS SS SH HS SS SG GG GV VA AD DT TQ QY YF	KLGGALQAK
18246	CA AA AL LM MN NR RD DD DK KI II IF	CA AS SS SL LR RD DG GS SE EA AF FF	RAKFKQLL
25274	CA AV VR RG GQ QA AG GT TA AL LI IF	CA AS SS SA AG GQ QA AG GF FS SP PL LH HF	KLGGALQAK
2560	CV VV VN NM MD DN NA AR RL LM MF	CA AS SS SL LG GD DF FL LR RT TD DT TQ QY YF	RAKFKQLL
34954	CA AV VL LG GV VY YN NT TN NA AG GK KS ST TF	CA AS SR RF FY YR RG GN NY YG GY YT TF	KLGGALQAK
6236	CA AG GA AH HG GS SS SN NT TG GK KL LI IF	CA AS SS SM MD DR RG GS SA AD DT TQ QY YF	GILGFVFTL
34782	CI IL LR RD DF FL LQ QG GA AQ QK KL LV VF	CA AS SS SP PE EA AG GA AL LF FN NE EQ QF FF	KLGGALQAK
238	CA AA AQ QG GA AQ QK KL LV VF	CA AS SS SQ QG GL LV VS SG GS SP PL LH HF	ELAGIGILTV
35993	CA AE EN NL LV VL LN NT TD DK KL LI IF	CA AS SS SS ST TG GL LN NT TE EA AF FF	KLGGALQAK
30385	CA AF FM MI IG GA AG GG GT TS SY YG GK KL LT TF	CA AS SS SI IG GV VW WG GY YT TF	GILGFVFTL
7265	CA AE EL LK KE EK KL LI IF	CA AS SS SQ QS SP PG GG GT TQ QY YF	GLCTLVAML
36182	CA AF FL LT TS SG GG GS SY YI IP PT TF	CA AS SS SR RS SR RG GL LE EH HY YE EQ QY YF	AVFDRKSDAK
34721	CA AV VQ QD DE ER RG GS ST TL LG GR RL LY YF	CA AS SS SF FT TA AG GS ST TG GE EL LF FF	KLGGALQAK
5473	CA AE EN NG GG GG GG GA AD DG GL LT TF	CA AS SS ST TT TA AG GD DT TE EA AF FF	KLGGALQAK
36118	CA AM MR RE EA AN NT TG GN NQ QF FY YF	CA AS SS SV VA AG GG GE EA AE EA AF FF	KLGGALQAK
35017	CA AV VN NN NF FN NK KF FY YF	CA AS SS SL LD DM MS SG GS SY YE EQ QY YV	KLGGALQAK
35830	CA AE EK KT TS SY YD DK KV VI IF	CA AS SS SI IA AG GY YT TE EA AF FF	KLGGALQAK
35452	CA AP PG GP PD DS SS SY YK KL LI IF	CS SA AR RV VP PA AG GA AS ST TD DT TQ QY YF	KLGGALQAK
32502	CA AG GG GG GS SQ QG GN NL LI IF	CA AS SS SI IR RA AA AY YE EQ QY YF	GILGFVFTL
34680	CA AV VN NM MD DT TG GN NQ QF FY YF	CA AS SS SP PH HS SY YE EQ QY YF	ELAGIGILTV
35556	CA AF FG GF FN NN NA AR RL LM MF	CS SV VE EG GS SG GG GF FQ QE ET TQ QY YF	KLGGALQAK
32769	CA AD DS SG GG GG GA AD DG GL LT TF	CA AS SS SI IR RS SS SY YE EQ QY YF	GILGFVFTL
36023	CA AM MR RR RP PI IS SS SG GS SA AR RQ QL LT TF	CA AS SS SS SR RD DN NQ QE ET TQ QY YF	KLGGALQAK
34635	CA AG GN NT TP PL LV VF	CA AS SS SL LG GL LG GQ QP PQ QH HF	ELAGIGILTV
35628	CA AE ET TD DN NA AG GN NM ML LT TF	CA AS SS SF FT TV VL LG GD DE EQ QY YF	KLGGALQAK
25299	CA AA AA AE ET TS SY YD DK KV VI IF	CA AS SS SF FV VD DR RA AE ET TQ QY YF	RAKFKQLL
35152	CA AA AS SY YN NT TD DK KL LI IF	CA AS SS SL LA AT TG GY YE EQ QY YV	KLGGALQAK
6240	CA AV VG GA AG GG GG GS SQ QG GN NL LI IF	CA AS SS SM MR RA AS SV VE EQ QF FF	GILGFVFTL
64	CA AF FL LG GG GA AN NN NL LF FF	CA AS SS SL LA AA AS SY YE EQ QY YF	KLGGALQAK
35022	CA AV VS SD DL LY YG GG GS SQ QG GN NL LI IF	CA AS SS SP PP PG GT TS SG GS SS SS SY YN NE EQ QF FF	KLGGALQAK
33903	CA AE EN NE ED DT TD DK KL LI IF	CA AS SS SP PG GQ QG GI IA AG GE EL LF FF	KLGGALQAK
28845	CA AV VA AK KD DL LQ QN NS SG GG GG GA AD DG GL LT TF	CA AS SG GM MT TG GL LT TS SE EQ QY YF	GILGFVFTL
262	CA AV VT TP PY YT TG GG GF FK KT TI IF	CA AS SS SQ QV VS SS SR RQ QP PH HT TE EA AF FF	RAKFKQLL
33509	CA AI IG GG GD DG GG GS SQ QG GN NL LI IF	CA AS SS SP PR RS SG GN NT TI IY YF	GILGFVFTL
34974	CA AQ QT TG GA AN NN NL LF FF	CA AS SS SL LF FQ QG GS SG GT TE EA AF FF	KLGGALQAK
34264	CA AI IG GP PG GN NM ML LT TF	CA AS SS SQ QD DR RP PG GG GR RP PY YN NE EQ QF FF	KLGGALQAK
7069	CA AV VR RG GG GV VH HG GN NN NR RL LA AF	CA AS SS SI IS SP PN NQ QP PQ QH HF	KLGGALQAK
56	CA AV VS SP PW WG GG GY YN NK KL LI IF	CA AS SS SF FS SG GN NT TG GE EL LF FF	RAKFKQLL
35644	CA AM MR RE EW WG GS SG GS SR RL LT TF	CA AS SS SS SQ QG GS SN NY YG GY YT TF	KLGGALQAK
679	CA AP PI IG GG GG GN NK KL LT TF	CA AS SS SL LP PT TA AN NY YG GY YT TF	KLGGALQAK
19	CA AV VG GA AN NY YQ QL LI IW	CA AT TS SD DW WL LA AG GD DA AD DT TQ QY YF	KLGGALQAK
4952	CL LV VA AP PG GG GY YN NK KL LI IF	CA AS SS SS SQ QG GA AL LK KR RE EI IP PY YE EQ QY YF	IVTDFSVIK
28373	CA AL LS SE ER RV VS SG GG GY YN NK KL LI IF	CA AS SS SL LK KG GQ QG GS SD DT TQ QY YF	IVTDFSVIK
34386	CA AV VN NT TN NA AG GK KS ST TF	CA AS SS SQ QG GQ QN NQ QE ET TQ QY YF	KLGGALQAK
33366	CA AG GA AG GG GG GS SQ QG GN NL LI IF	CA AS SS SI IR RS ST TD DT TQ QY YF	GILGFVFTL
4945	CA AM MR RV VG GN NN NN ND DM MR RF	CA AS SS SL LV VA AT TG GL LS SY YE EQ QY YF	KLGGALQAK
14644	CI IL LY YN NT TD DK KL LI IF	CA AS SS SD DR RD DY YL LI IH HE EQ QF FF	KLGGALQAK
6092	CA AG GP PY YN NQ QG GG GK KL LI IF	CA AS SS SI IR RS ST TE ET TQ QY YF	GILGFVFTL
34318	CA AV VK KR RG GD DD DK KI II IF	CA AS SS SQ QG GL LA AG GI IA AT TQ QE ET TQ QY YF	KLGGALQAK
34877	CA AL LS SE EE ES SG GE EV VI IF	CA AS SS SD DF FG GI IS SG GT TY YN NE EQ QF FF	KLGGALQAK
24428	CA AT TD DA AS SG GG GS SN NY YK KL LT TF	CA AS SS SL LG GT TS SG GG GT TG GE EL LF FF	RAKFKQLL
6089	CA AV VD DE EG GG GG GS SQ QG GN NL LI IF	CA AS SS SI IR RS ST TD DT TQ QY YF	GILGFVFTL
33844	CA AP PS SA AG GG GG GS SQ QG GN NL LI IF	CA AS SS SV VR RS SS SY YE EQ QY YF	GILGFVFTL
38421	CA AV VR RD DG GD DR RD DD DK KI II IF	CA AS SS SY YL LG GQ QG GD DA AY YG GY YT TF	KLGGALQAK
26022	CA AV VR RV VG GT TT TD DS SL LL	CA AS SS SP PL LS ST TD DT TQ QY YF	GILGFVFTL
35573	CA AV VT TG GG GN ND DY YK KL LS SF	CS SV VQ QG GA AN NT TG GE EL LF FF	KLGGALQAK
26569	CA AA AK KE EG GY YS ST TL LT TF	CS SA AG GG GN NT TE EA AF FF	RAKFKQLL
34831	CV VV VN NG GY YS SS SA AS SK KI II IF	CA AS SS SL LQ QG GD DE EQ QY YV	KLGGALQAK
5073	CA AV VN NG GG GY YN NK KL LI IF	CA AS SS SL LV VG GR RG GG GN NQ QP PQ QH HF	KLGGALQAK
5115	CA AA AT TN NT TN NA AG GK KS ST TF	CA AS SS SP PT TT TG GE ED DN NE EQ QF FF	RAKFKQLL
33858	CA AG GG GG GS SG GG GS SQ QG GN NL LI IF	CA AS SS SW WR RS SD DT TE EA AF FF	GILGFVFTL
35125	CA AV VN NI IN NQ QA AG GT TA AL LI IF	CA AS SS SL LV VR RQ QG GA AS ST TI IG GT TQ QY YF	KLGGALQAK
25102	CV VV VR RF FT TG GG GG GN NK KL LT TF	CA AS SS SL LG GG GA AG GE ET TQ QY YF	GLCTLVAML
25382	CA AA AT TN NN NA AG GN NM ML LT TF	CA AS SS SG GS SS SR RT TP PN NT TE EA AF FF	GLCTLVAML
34429	CA AF FD DS SG GA AG GS SY YQ QL LT TF	CA AS SI IS SA AD DT TQ QY YF	KLGGALQAK
36093	CA AF FE EW WG GN NN NN NN ND DM MR RF	CA AS SS SQ QG GG GQ QG GA AT TE EA AF FF	KLGGALQAK
2252	CA AI IG GY YQ QK KV VT TF	CA AS SS SL LR RD DG GS SE EA AF FF	RAKFKQLL
2491	CA AL LS SE EN NR RG GD DY YK KL LS SF	CA AI IR RE EL LP PT TR RT TD DT TQ QY YF	KLGGALQAK
35920	CI IR RG GS SA AR RQ QL LT TF	CA AS SS SP PL LG GG GS SM MN NT TE EA AF FF	KLGGALQAK
4940	CA AV VS SD DL LA AD DY YK KL LS SF	CA AS SS SL LA AG GP PG GA AG GG GE EQ QF FF	KLGGALQAK
29955	CA AE EN NI IG GG GS SQ QG GN NL LI IF	CA AS SS SH HY YS SV VN NE EQ QF FF	GILGFVFTL
18007	CA AL LK KL LG GN NA AG GN NM ML LT TF	CA AS SS SV VN NP PN NP PI IR RD DR RD DN NE EK KL LF FF	KLGGALQAK
34517	CI IL LR RD DV VS SS SG GT TY YK KY YI IF	CA AS SS SL LE EA AG GG GA AY YN NE EQ QF FF	KLGGALQAK
26484	CA AE ED DN NN NA AR RL LM MF	CS SA AR RP PQ QP PV VG GN NT TI IY YF	GLCTLVAML
34465	CA AV VW WY YM MR RF	CA AS SS SF FQ QG GS SP PQ QE ET TQ QY YF	KLGGALQAK
25905	CA AA AT TW WG GG GS SN NY YK KL LT TF	CA AS SS SS SR RD DG GG GT TD DT TQ QY YF	KLGGALQAK
13892	CA AA AM ME ET TS SY YD DK KV VI IF	CA AS SS SL LG GD DR RA AG GG GY YT TF	RAKFKQLL
4970	CA AV VE ER RR RE ET TS SG GS SR RL LT TF	CA AS SS SL LG GR RA AY YE EQ QY YF	KLGGALQAK
30438	CA AG GA AQ QI IT TN NR RD DD DK KI II IF	CA AS SS SI IR RS SF FY YE EQ QY YF	GILGFVFTL
6797	CA AV VV VV VG GS SS SN NT TG GK KL LI IF	CA AS SS SI IR RS SS SY YE EQ QY YF	GILGFVFTL
24335	CA AL LS SE EG GN NS SG GG GY YQ QK KV VT TF	CA AS SS SE ES SW WG GP PY YE EQ QY YF	AVFDRKSDAK
26152	CA AV VN NQ QA AG GT TA AL LI IF	CS SA AQ QA AG GG GE EM ML LP PG GE EL LF FF	KLGGALQAK
29771	CA AT TD DA AS SG GG GS SN NY YK KL LT TF	CA AS SS SA AR RS SS SY YE EQ QY YF	RAKFKQLL
26016	CA AL LR RA AG GG GT TS SY YG GK KL LT TF	CA AS SS SS SP PQ QG GV VS SN NT TE EA AF FF	KLGGALQAK
35640	CA AR RP PS SD DY YK KL LS SF	CA AS SS SS SD DS SG GT TE EA AF FF	KLGGALQAK
14671	CA AM MR RE ED DN NA AG GN NM ML LT TF	CA AS SS SE EK KD DR RT TV VG GT TD DT TQ QY YF	GILGFVFTL
35306	CL LV VA AG GG GG GA AT TN NK KL LI IF	CA AS SS SS SG GT TG GF FP PH HN NT TE EA AF FF	KLGGALQAK
34990	CA AV VI IL LD DQ QT TG GA AN NN NL LF FF	CA AS SS SL LV VP PG GM MN NT TE EA AF FF	KLGGALQAK
32285	CA AA AS SG GG GG GS SQ QG GN NL LI IF	CA AS SS SG GR RS ST TD DT TQ QY YF	GILGFVFTL
35148	CA AV VS SW WG GQ QG GG GK KL LI IF	CA AS SS SI IP PL LA AE ES ST TD DT TQ QY YF	KLGGALQAK
2344	CA AA AS SS SA AG GA AG GS SY YQ QL LT TF	CA AS SS SL LF FG GG GT TY YE EQ QY YF	KLGGALQAK
35034	CA AV VR RD DM MD DN NA AG GN NM ML LT TF	CA AS SR RN NF FR RG GG GI ID DT TQ QY YF	KLGGALQAK
36130	CA AV VN NW WE EE EQ QG GG GS SY YI IP PT TF	CA AS SS SP PS SN NE EQ QF FF	KLGGALQAK
5510	CA AV VP PF FS SG GG GY YN NK KL LI IF	CA AS SS SK KT TG GT TS SS SY YN NE EQ QF FF	AVFDRKSDAK
35890	CA AA AT TA AT TN NF FG GN NE EK KL LT TF	CA AS SS SI IV VR RG GG GV VY YN NE EQ QF FF	KLGGALQAK
34250	CA AV VQ QA AS SS SN NF FG GN NE EK KL LT TF	CA AS SS SQ QA AR RS SN NE EQ QF FF	KLGGALQAK
23373	CV VV VH HT TG GT TA AS SK KL LT TF	CA AS SS SL LY YS SP PL LA AY YS SW WN NE EK KL LF FF	KLGGALQAK
26470	CV VV VP PR RQ QS SS SN NT TG GK KL LI IF	CS SA AR RE EG GF FS ST TE EA AF FF	KLGGALQAK
2504	CA AG GP PD DS SW WG GK KL LQ QF	CA AI IS SE ES SL LA AG GR RT TY YN NE EQ QF FF	KLGGALQAK
35845	CI IL LR RD DV VG GG GG GT TS SY YG GK KL LT TF	CA AS SS SI IG GG GL LL LN NT TE EA AF FF	KLGGALQAK
6626	CA AY YR RT TK KE ET TS SG GS SR RL LT TF	CA AS SS SI IG GS SY YG GY YT TF	GILGFVFTL
22321	CA AV VR RD DI IG GF FG GN NV VL LH HC	CA AS SS SP PT TT TG GH HT TE EA AF FF	KLGGALQAK
26561	CA AE EN NR RD DD DK KI II IF	CS SA AD DW WS ST TG GG GA AN NY YG GY YT TF	KLGGALQAK
24591	CA AA AI IN NC CY YY YG GN NN NR RL LA AF	CA AS SS SL LL LG GY YN NE EQ QF FF	RAKFKQLL
18001	CA AS SR RS SG GT TY YK KY YI IF	CA AS SS SV VN NP PG GQ QG GA AN NY YG GY YT TF	KLGGALQAK
13	CA AV VH HL LI IW WE EG GG GG GA AT TN NK KL LI IF	CA AT TS SD DF FT TD DS SG GA AN NV VL LT TF	GILGFVFTL
25908	CV VG GY YT TN NA AG GK KS ST TF	CA AS SS SS SR RS SE EG GS SY YE EQ QY YF	RAKFKQLL
34618	CA AL LS SD DH HS SG GY YS ST TL LT TF	CA AS SS SF FT TN NN NE EQ QF FF	KLGGALQAK
25104	CA AA AT TA AA AG GT TY YK KY YI IF	CA AS SS SL LL LL LP PD DT TQ QY YF	KLGGALQAK
