34166	CIV IVR VRD RDH DHN HNY NYG YGQ GQN QNF NFV FVF	KLGGALQAK
7210	CAG AGN GNY NYG YGG GGS GSQ SQG QGN GNL NLI LIF	GILGFVFTL
28610	CAV AVA VAD ADS DSN SNY NYQ YQL QLI LIW	KLGGALQAK
36284	CAV AVD VDL DLM LMK MKT KTS TSY SYD YDK DKV KVI VIF	IVTDFSVIK
5543	CAV AVG VGG GGT GTG TGK GKL KLI LIF	ELAGIGILTV
34917	CAE AEL ELN LNA NAG AGN GNN NNR NRK RKL KLI LIW	KLGGALQAK
35660	CAF AFR FRG RGS GSQ SQG QGN GNL NLI LIF	KLGGALQAK
4949	CAE AEN ENL NLP LPN PNS NSG SGY GYA YAL ALN LNF	IVTDFSVIK
6360	CAV AVS VSA SAG AGR GRG RGS GST STL TLG LGR GRL RLY LYF	IVTDFSVIK
25697	CAG AGH GHL HLY LYG YGG GGS GSQ SQG QGN GNL NLI LIF	KLGGALQAK
34457	CAV AVR VRD RDS DSN SNY NYQ YQL QLI LIW	KLGGALQAK
7263	CAV AVR VRG RGL GLN LNT NTG TGF GFQ FQK QKL KLV LVF	RAKFKQLL
34910	CAA AAS ASN SNS NSG SGG GGA GAD ADG DGL GLT LTF	KLGGALQAK
6596	CAE AEQ EQG QGS GSQ SQG QGN GNL NLI LIF	GILGFVFTL
7325	CAG AGG GGG GGS GSQ SQG QGN GNL NLI LIF	GILGFVFTL
27092	CAV AVP VPL PLT LTQ TQG QGL GLT LTF	KLGGALQAK
34943	CAP APR PRL RLN LNY NYG YGQ GQN QNF NFV FVF	KLGGALQAK
34699	CAM AMR MRN RNM NMN MNR NRD RDD DDK DKI KII IIF	KLGGALQAK
5561	CAN ANT NTG TGS GSQ SQG QGN GNL NLI LIF	GILGFVFTL
33480	CIV IVR VRT RTA TAG AGN GNN NNR NRK RKL KLI LIW	KLGGALQAK
25921	CAA AAS ASE SET ETS TSY SYD YDK DKV KVI VIF	RAKFKQLL
11360	CAF AFM FMP MPP PPY PYN YNT NTD TDK DKL KLI LIF	RAKFKQLL
25023	CAM AMS MSW SWG WGR GRD RDD DDK DKI KII IIF	KLGGALQAK
34794	CLV LVG VGD GDN DNR NRG RGS GST STL TLG LGR GRL RLY LYF	KLGGALQAK
25993	CAL ALS LSV SVN VNG NGN GNN NNR NRL RLA LAF	KLGGALQAK
683	CAG AGP GPK PKG KGG GGA GAT ATN TNK NKL KLI LIF	KLGGALQAK
10031	CAV AVG VGD GDN DNF NFN FNK NKF KFY FYF	RAKFKQLL
29929	CAP APG PGE GET ETG TGA GAN ANN NNL NLF LFF	GILGFVFTL
35089	CVV VVN VNT NTG TGN GNQ NQF QFY FYF	KLGGALQAK
34268	CAV AVK VKL KLR LRD RDA DAR ARL RLM LMF	KLGGALQAK
28586	CAV AVR VRY RYG YGN GNN NNR NRL RLA LAF	KLGGALQAK
35158	CAA AAR ARD RDY DYG YGF GFK FKT KTI TIF	KLGGALQAK
24977	CAV AVE VEV EVE VEY EYG YGN GNK NKL KLV LVF	KLGGALQAK
35173	CAL ALS LSE SEA EAP APS PSG SGY GYN YNK NKL KLI LIF	KLGGALQAK
6334	CVV VVS VSG SGY GYS YST STL TLT LTF	KLGGALQAK
29935	CAV AVA VAD ADS DSN SNY NYQ YQL QLI LIW	GILGFVFTL
261	CAA AAS ASG SGG GGG GGA GAD ADG DGL GLT LTF	RAKFKQLL
34642	CAY AYR YRS RSA SAG AGA GAP APF PFS FSG SGG GGY GYN YNK NKL KLI LIF	KLGGALQAK
36311	CIV IVR VRV RVA VAG AGG GGG GGG GGN GNK NKL KLT LTF	KLGGALQAK
35732	CAG AGA GAR ARN RNN NNN NND NDM DMR MRF	KLGGALQAK
32672	CAV AVR VRD RDS DSS SSS SSG SGN GNT NTG TGK GKL KLI LIF	GILGFVFTL
31932	CAY AYM YMS MSN SNA NAG AGG GGT GTS TSY SYG YGK GKL KLT LTF	GILGFVFTL
23375	CAV AVG VGT GTA TAR ARL RLM LMF	RAKFKQLL
34902	CAA AAS ASV SVW VWY WYA YAR ARL RLM LMF	KLGGALQAK
26926	CAG AGG GGG GGS GSQ SQG QGN GNL NLI LIF	RAKFKQLL
32331	CAP APY PYS YSG SGG GGG GGA GAD ADG DGL GLT LTF	IVTDFSVIK
34739	CAV AVR VRE REQ EQS QSS SSN SND NDY DYK YKL KLS LSF	KLGGALQAK
6605	CAF AFI FIG IGN GNT NTG TGK GKL KLI LIF	GILGFVFTL
26059	CVV VVQ VQG QGG GGA GAD ADG DGL GLT LTF	KLGGALQAK
36099	CAT ATP TPL PLD LDS DSW SWG WGK GKL KLQ LQF	KLGGALQAK
35905	CGL GLH LHP HPF	KLGGALQAK
34953	CAE AEN ENY NYG YGQ GQN QNF NFV FVF	KLGGALQAK
25107	CAA AAS ASE SET ETS TSY SYD YDK DKV KVI VIF	RAKFKQLL
34589	CAV AVS VSD SDH DHT HTN TNA NAG AGK GKS KST STF	KLGGALQAK
35041	CAV AVI VIQ IQI QIN IND NDY DYK YKL KLS LSF	KLGGALQAK
36209	CAM AMR MRE RED EDN DNT NTD TDK DKL KLI LIF	KLGGALQAK
25807	CAY AYS YSP SPA PAA AAG AGG GGT GTS TSY SYG YGK GKL KLT LTF	GILGFVFTL
22308	CAD ADS DSG SGG GGG GGA GAD ADG DGL GLT LTF	RAKFKQLL
12502	CAM AMS MSW SWG WGR GRD RDD DDK DKI KII IIF	RAKFKQLL
2300	CAV AVN VNP NPG PGG GGN GNK NKL KLT LTF	ELAGIGILTV
31340	CAV AVS VSP SPN PND NDY DYK YKL KLS LSF	GILGFVFTL
17920	CAV AVL VLD LDS DSN SNY NYQ YQL QLI LIW	GLCTLVAML
34971	CAR ARE REG EGG GGD GDD DDK DKI KII IIF	KLGGALQAK
31359	CAE AER ERQ RQN QNF NFV FVF	GILGFVFTL
35871	CAV AVR VRD RDE DEK EKA KAA AAG AGN GNK NKL KLT LTF	KLGGALQAK
5257	CAD ADS DSG SGG GGG GGA GAD ADG DGL GLT LTF	RAKFKQLL
28866	CAE AER ERV RVG VGA GAG AGG GGT GTS TSY SYG YGK GKL KLT LTF	KLGGALQAK
11304	CAA AAS ASG SGN GNH NHD HDM DMR MRF	RAKFKQLL
23214	CAV AVS VSD SDY DYI YII IIQ IQG QGA GAQ AQK QKL KLV LVF	KLGGALQAK
35744	CAI AIG IGP GPG PGN GNM NML MLT LTF	KLGGALQAK
34248	CAA AAY AYS YSG SGG GGG GGA GAD ADG DGL GLT LTF	KLGGALQAK
5437	CAM AMA MAR ARS RSN SNF NFG FGN GNE NEK EKL KLT LTF	ELAGIGILTV
5486	CAV AVG VGG GGP GPR PRS RSD SDS DSW SWG WGK GKL KLQ LQF	KLGGALQAK
34496	CAY AYR YRR RRG RGR GRN RNA NAG AGG GGT GTS TSY SYG YGK GKL KLT LTF	KLGGALQAK
23009	CAA AAM AME MET ETS TSY SYD YDK DKV KVI VIF	RAKFKQLL
14844	CAD ADS DSG SGG GGG GGA GAD ADG DGL GLT LTF	RAKFKQLL
25079	CAA AAR ARK RKG KGA GAG AGS GSY SYQ YQL QLT LTF	KLGGALQAK
35832	CAV AVS VSS SSQ SQA QAG AGT GTA TAL ALI LIF	KLGGALQAK
27120	CAE AET ETH THS HSG SGG GGS GSN SNY NYK YKL KLT LTF	RAKFKQLL
5984	CAA AAR ARV RVR VRG RGF GFG FGN GNV NVL VLH LHC	GILGFVFTL
29927	CAV AVT VTS TSN SNT NTG TGK GKL KLI LIF	GILGFVFTL
36214	CAV AVN VNW NWE WEE EEQ EQG QGG GGS GSY SYI YIP IPT PTF	KLGGALQAK
34056	CAA AAS ASG SGK GKN KNN NNY NYG YGQ GQN QNF NFV FVF	KLGGALQAK
34037	CAV AVV VVG VGG GGT GTS TSY SYG YGK GKL KLT LTF	KLGGALQAK
34092	CAM AMR MRR RRP RPI PIS ISS SSG SGS GSA SAR ARQ RQL QLT LTF	KLGGALQAK
7072	CAL ALS LSE SEA EAY AYA YAG AGN GNN NNR NRK RKL KLI LIW	KLGGALQAK
25263	CAD ADS DSG SGG GGG GGA GAD ADG DGL GLT LTF	RAKFKQLL
2371	CAL ALS LSD SDR DRG RGG GGN GNK NKL KLT LTF	KLGGALQAK
24652	CAV AVP VPN PNY NYG YGQ GQN QNF NFV FVF	RAKFKQLL
34447	CVV VVR VRE RER ERG RGG GGG GGN GNK NKL KLT LTF	KLGGALQAK
36152	CIT ITG TGG GGG GGA GAD ADG DGL GLT LTF	KLGGALQAK
668	CAV AVR VRN RNA NAG AGN GNN NNR NRK RKL KLI LIW	ELAGIGILTV
175	CAV AVG VGG GGG GGG GGA GAD ADG DGL GLT LTF	ELAGIGILTV
18075	CAA AAK AKE KEG EGY GYS YST STL TLT LTF	AVFDRKSDAK
14250	CAH AHA HAP APL PLD LDD DDM DMR MRF	KLGGALQAK
32332	CAL ALS LSE SEA EAG AGT GTG TGG GGS GSY SYI YIP IPT PTF	GILGFVFTL
35647	CAV AVR VRG RGE GED EDT DTD TDK DKL KLI LIF	KLGGALQAK
5080	CAG AGH GHT HTG TGN GNQ NQF QFY FYF	IVTDFSVIK
2296	CAE AEN ENS NSM SMN MNR NRD RDD DDK DKI KII IIF	KLGGALQAK
32883	CAV AVG VGD GDN DNF NFN FNK NKF KFY FYF	GILGFVFTL
23849	CAF AFM FMK MKH KHR HRK RKS KSH SHR HRD RDD DDK DKI KII IIF	RAKFKQLL
25285	CIV IVR VRE REG EGS GSQ SQG QGN GNL NLI LIF	KLGGALQAK
7256	CAV AVG VGG GGQ GQL QLT LTF	KLGGALQAK
6036	CAF AFM FMT MTN TNA NAG AGG GGT GTS TSY SYG YGK GKL KLT LTF	GILGFVFTL
35404	CAL ALG LGE GEL ELG LGA GAA AAG AGN GNK NKL KLT LTF	KLGGALQAK
34722	CAV AVR VRD RDG DGA GAA AAG AGN GNK NKL KLT LTF	KLGGALQAK
30431	CAG AGA GAL ALG LGS GSS SSN SNT NTG TGK GKL KLI LIF	GILGFVFTL
35578	CAT ATD TDG DGG GGT GTG TGG GGF GFK FKT KTI TIF	KLGGALQAK
26046	CAV AVS VSR SRG RGQ GQA QAG AGT GTA TAL ALI LIF	KLGGALQAK
26492	CAE AED EDS DSN SNA NAR ARL RLM LMF	GLCTLVAML
35334	CAG AGR GRV RVS VSG SGS GSA SAR ARQ RQL QLT LTF	KLGGALQAK
35816	CAV AVR VRD RDP DPQ PQA QAI AIS ISN SNF NFG FGN GNE NEK EKL KLT LTF	KLGGALQAK
34464	CAM AMR MRR RRP RPI PIS ISS SSG SGS GSA SAR ARQ RQL QLT LTF	KLGGALQAK
35068	CAL ALS LSE SEA EAR ART RTN TNA NAG AGK GKS KST STF	KLGGALQAK
35353	CVV VVN VNA NAG AGS GSE SEF EFN FNN NNA NAG AGN GNM NML MLT LTF	KLGGALQAK
5121	CAG AGP GPD PDN DNY NYG YGQ GQN QNF NFV FVF	GILGFVFTL
34790	CAT ATV TVD VDN DNS NSG SGG GGS GSN SNY NYK YKL KLT LTF	KLGGALQAK
7227	CAV AVN VNL NLG LGS GSY SYI YIP IPT PTF	ELAGIGILTV
7353	CIL ILR LRD RDL DLN LNA NAG AGG GGT GTS TSY SYG YGK GKL KLT LTF	KLGGALQAK
35888	CAV AVH VHI HIH IHD HDT DTN TNA NAG AGK GKS KST STF	KLGGALQAK
34734	CAV AVD VDI DIT ITA TAD ADM DMR MRF	KLGGALQAK
5240	CAE AED EDN DNN NNA NAR ARL RLM LMF	GLCTLVAML
34162	CAL ALG LGS GSY SYG YGG GGS GSQ SQG QGN GNL NLI LIF	KLGGALQAK
34407	CAM AMR MRE REG EGF GFV FVP VPG PGG GGT GTS TSY SYG YGK GKL KLT LTF	KLGGALQAK
144	CAA AAT ATN TNQ NQA QAG AGT GTA TAL ALI LIF	KLGGALQAK
31970	CAL ALG LGF GFA FAA AAD ADG DGQ GQK QKL KLL LLF	GILGFVFTL
23213	CAV AVI VIQ IQR QRS RSQ SQA QAG AGT GTA TAL ALI LIF	KLGGALQAK
34870	CAG AGM GMD MDS DSS SSY SYK YKL KLI LIF	KLGGALQAK
31928	CGT GTG TGV GVV VVS VSG SGG GGG GGA GAD ADG DGL GLT LTF	GILGFVFTL
38434	CAV AVK VKD KDS DSN SNY NYQ YQL QLI LIW	KLGGALQAK
27968	CAT ATD TDA DAS ASG SGG GGS GSN SNY NYK YKL KLT LTF	RAKFKQLL
9	CAP APG PGG GGG GGG GGN GNK NKL KLT LTF	ELAGIGILTV
6771	CAV AVT VTS TSD SDP DPN PNQ NQG QGG GGK GKL KLI LIF	GILGFVFTL
5221	CAV AVK VKT KTS TSY SYD YDK DKV KVI VIF	KLGGALQAK
24326	CIL ILR LRD RDL DLN LNA NAG AGG GGT GTS TSY SYG YGK GKL KLT LTF	RAKFKQLL
16943	CAG AGA GAG AGD GDG DGG GGS GSQ SQG QGN GNL NLI LIF	GILGFVFTL
35406	CAL ALE LEY EYG YGN GNK NKL KLV LVF	KLGGALQAK
25100	CAL ALS LSP SPY PYS YSG SGA GAG AGS GSY SYQ YQL QLT LTF	KLGGALQAK
34651	CAV AVY VYN YNF NFN FNK NKF KFY FYF	KLGGALQAK
5021	CAL ALG LGD GDL DLI LIS ISG SGG GGG GGA GAD ADG DGL GLT LTF	KLGGALQAK
34571	CAG AGE GEN ENS NSG SGY GYA YAL ALN LNF	KLGGALQAK
34249	CAA AAS ASL SLG LGG GGS GSN SNY NYK YKL KLT LTF	KLGGALQAK
31375	CAP APH PHK HKA KAA AAG AGN GNK NKL KLT LTF	GILGFVFTL
154	CAE AER ERP RPL PLW LWA WAG AGG GGF GFK FKT KTI TIF	KLGGALQAK
26681	CAV AVH VHG HGY GYG YGQ GQN QNF NFV FVF	RAKFKQLL
7159	CAE AEN ENM NMR MRN RNT NTD TDK DKL KLI LIF	GILGFVFTL
34650	CAA AAS ASV SVY VYG YGN GNN NNR NRL RLA LAF	KLGGALQAK
13927	CAA AAM AME MET ETS TSY SYD YDK DKV KVI VIF	RAKFKQLL
49	CAV AVE VEV EVN VNA NAG AGN GNN NNR NRK RKL KLI LIW	GILGFVFTL
5074	CAV AVR VRS RSG SGG GGY GYN YNK NKL KLI LIF	KLGGALQAK
682	CAV AVG VGI GII IIQ IQG QGA GAQ AQK QKL KLV LVF	ELAGIGILTV
25090	CAE AEM EME MEG EGG GGS GSY SYI YIP IPT PTF	GLCTLVAML
35341	CAT ATG TGG GGN GNK NKV KVI VIF	KLGGALQAK
34299	CVV VVS VSR SRG RGL GLT LTG TGG GGG GGN GNK NKL KLT LTF	KLGGALQAK
23889	CAA AAP APT PTG TGN GNN NNN NND NDM DMR MRF	GILGFVFTL
15325	CAV AVS VSP SPG PGS GSF SFG FGN GNE NEK EKL KLT LTF	KLGGALQAK
26127	CAM AMR MRE RED EDD DDR DRD RDS DST STL TLG LGR GRL RLY LYF	RAKFKQLL
28723	CAV AVR VRA RAP APL PLY LYN YNN NNN NND NDM DMR MRF	KLGGALQAK
35782	CAG AGL GLI LIS ISG SGG GGY GYN YNK NKL KLI LIF	KLGGALQAK
2231	CVV VVR VRM RMR MRD RDD DDK DKI KII IIF	KLGGALQAK
28835	CGA GAA AAG AGN GNM NML MLT LTF	KLGGALQAK
33516	CAM AMS MSG SGD GDG DGG GGS GSQ SQG QGN GNL NLI LIF	GILGFVFTL
5118	CVV VVS VSE SEN ENT NTG TGF GFQ FQK QKL KLV LVF	KLGGALQAK
23162	CAT ATV TVI VIF IFQ FQG QGA GAQ AQK QKL KLV LVF	RAKFKQLL
2381	CAA AAT ATY TYS YSG SGA GAG AGS GSY SYQ YQL QLT LTF	ELAGIGILTV
35642	CVV VVN VNH NHP HPL PLW LWG WGW GWE WEL ELP LPT PTH THF	KLGGALQAK
17047	CAF AFG FGG GGG GGG GGS GSE SEK EKL KLV LVF	RAKFKQLL
34052	CAM AMS MSE SEG EGY GYG YGN GNK NKL KLV LVF	KLGGALQAK
38427	CAA AAG AGF GFM FMN MNY NYG YGG GGS GSQ SQG QGN GNL NLI LIF	KLGGALQAK
23001	CAG AGL GLN LND NDY DYK YKL KLS LSF	KLGGALQAK
33598	CAM AMS MSG SGD GDG DGG GGS GSQ SQG QGN GNL NLI LIF	GILGFVFTL
5242	CAE AED EDQ DQG QGG GGK GKL KLI LIF	KLGGALQAK
34188	CAT ATG TGL GLY LYN YNN NNA NAR ARL RLM LMF	KLGGALQAK
34	CAL ALI LID IDQ DQT QTG TGA GAN ANN NNL NLF LFF	IVTDFSVIK
59	CAV AVL VLP LPM PMD MDS DSN SNY NYQ YQL QLI LIW	RAKFKQLL
34606	CAA AAQ AQN QNN NND NDM DMR MRF	KLGGALQAK
5273	CAM AMR MRE REG EGW GWN WNT NTG TGF GFQ FQK QKL KLV LVF	KLGGALQAK
5041	CAA AAS ASA SAM AMI MIK IKT KTG TGA GAN ANN NNL NLF LFF	KLGGALQAK
5094	CAV AVA VAV AVG VGV GVS VSG SGG GGG GGA GAD ADG DGL GLT LTF	GILGFVFTL
32631	CGT GTE TEW EWE WEA EAR ARL RLM LMF	GILGFVFTL
33547	CAG AGG GGL GLE LEN ENA NAG AGG GGT GTS TSY SYG YGK GKL KLT LTF	GILGFVFTL
5608	CAW AWS WSS SSN SNA NAG AGG GGT GTS TSY SYG YGK GKL KLT LTF	GILGFVFTL
23000	CAA AAD ADQ DQA QAG AGT GTA TAL ALI LIF	RAKFKQLL
19550	CAE AEG EGG GGN GNT NTG TGK GKL KLI LIF	RAKFKQLL
31655	CAV AVS VSG SGD GDG DGG GGS GSQ SQG QGN GNL NLI LIF	GILGFVFTL
26240	CAE AEN ENP NPS PSS SSG SGG GGS GSY SYI YIP IPT PTF	KLGGALQAK
6548	CAL ALA LAN ANT NTG TGG GGT GTS TSY SYG YGK GKL KLT LTF	KLGGALQAK
8104	CAA AAT ATE TET ETS TSY SYD YDK DKV KVI VIF	RAKFKQLL
5051	CAV AVR VRD RDI DIG IGN GNQ NQG QGG GGK GKL KLI LIF	KLGGALQAK
35427	CAA AAS ASA SAS ASS SSN SNM NML MLT LTF	KLGGALQAK
35258	CAV AVG VGH GHE HED EDG DGG GGS GSN SNY NYK YKL KLT LTF	KLGGALQAK
2237	CAV AVS VSG SGR GRG RGS GST STL TLG LGR GRL RLY LYF	ELAGIGILTV
2461	CAV AVN VNP NPS PSG SGY GYA YAL ALN LNF	ELAGIGILTV
34149	CAL ALS LSE SEA EAA AAG AGA GAN ANS NSK SKL KLT LTF	KLGGALQAK
14674	CAV AVN VNI NIR IRQ RQA QAG AGT GTA TAL ALI LIF	KLGGALQAK
6949	CEP EPP PPV PVS VSD SDG DGQ GQK QKL KLL LLF	GILGFVFTL
30437	CAG AGS GSN SNT NTN TNA NAG AGK GKS KST STF	GILGFVFTL
25089	CAG AGR GRN RNY NYN YNQ NQG QGG GGK GKL KLI LIF	GLCTLVAML
13890	CAY AYR YRS RSP SPY PYS YSG SGA GAG AGS GSY SYQ YQL QLT LTF	KLGGALQAK
7318	CAG AGE GEG EGG GGG GGS GSQ SQG QGN GNL NLI LIF	GILGFVFTL
36100	CAV AVD VDL DLM LMK MKT KTS TSY SYD YDK DKV KVI VIF	IVTDFSVIK
35916	CAE AEN ENK NKG KGS GSG SGA GAG AGS GSY SYQ YQL QLT LTF	KLGGALQAK
13891	CAA AAS ASE SET ETS TSY SYD YDK DKV KVI VIF	RAKFKQLL
25701	CAV AVR VRP RPS PSR SRF	KLGGALQAK
2618	CAV AVG VGD GDN DNF NFN FNK NKF KFY FYF	IVTDFSVIK
22324	CAL ALD LDG DGP GPG PGN GNT NTD TDK DKL KLI LIF	KLGGALQAK
23845	CIL ILR LRD RDW DWE WER ERK RKY KYG YGN GNK NKL KLV LVF	KLGGALQAK
24569	CGT GTV TVL VLE LEG EGG GGS GSQ SQG QGN GNL NLI LIF	GILGFVFTL
10	CAA AAS ASE SEQ EQG QGG GGK GKL KLI LIF	ELAGIGILTV
6670	CAV AVP VPL PLA LAG AGT GTG TGR GRR RRA RAL ALT LTF	ELAGIGILTV
30706	CAS ASA SAG AGS GSQ SQG QGN GNL NLI LIF	GILGFVFTL
27100	CAA AAF AFN FNS NSG SGG GGS GSN SNY NYK YKL KLT LTF	RAKFKQLL
34621	CAL ALM LME MEY EYG YGN GNK NKL KLV LVF	KLGGALQAK
2459	CAV AVK VKP KPD PDG DGQ GQK QKL KLL LLF	RAKFKQLL
36131	CVV VVI VIL ILL LLY LYN YNQ NQG QGG GGK GKL KLI LIF	AVFDRKSDAK
27096	CAV AVG VGD GDN DNF NFN FNK NKF KFY FYF	AVFDRKSDAK
34083	CAG AGI GIA IAG AGN GNM NML MLT LTF	KLGGALQAK
34125	CAV AVP VPD PDQ DQT QTG TGA GAN ANN NNL NLF LFF	KLGGALQAK
7068	CAE AEN ENN NNG NGG GGG GGS GSQ SQG QGN GNL NLI LIF	GILGFVFTL
2398	CAV AVS VSA SAN ANF NFG FGN GNE NEK EKL KLT LTF	KLGGALQAK
35934	CAI AIG IGP GPG PGN GNM NML MLT LTF	KLGGALQAK
6687	CAL ALT LTG TGG GGG GGS GSQ SQG QGN GNL NLI LIF	GILGFVFTL
32270	CAG AGP GPE PEG EGG GGG GGS GSQ SQG QGN GNL NLI LIF	GILGFVFTL
34558	CAM AMS MSP SPY PYN YNT NTD TDK DKL KLI LIF	KLGGALQAK
25288	CAG AGS GSG SGD GDG DGG GGS GSQ SQG QGN GNL NLI LIF	GILGFVFTL
27085	CAA AAS ASE SET ETS TSY SYD YDK DKV KVI VIF	RAKFKQLL
26418	CAM AMK MKS KST STN TNA NAG AGK GKS KST STF	GLCTLVAML
30385	CAF AFM FMI MIG IGA GAG AGG GGT GTS TSY SYG YGK GKL KLT LTF	GILGFVFTL
34959	CAA AAG AGA GAQ AQK QKL KLV LVF	KLGGALQAK
35975	CAV AVG VGP GPN PNN NNN NND NDM DMR MRF	KLGGALQAK
36243	CAL ALS LSS SSG SGG GGY GYQ YQK QKV KVT VTF	KLGGALQAK
28475	CAV AVR VRE REG EGN GNN NNR NRL RLA LAF	KLGGALQAK
34654	CAV AVL VLS LSG SGA GAG AGS GSY SYQ YQL QLT LTF	KLGGALQAK
7200	CAG AGA GAA AAG AGS GSS SSN SNT NTG TGK GKL KLI LIF	GILGFVFTL
7239	CAV AVI VID IDK DKL KLI LIF	ELAGIGILTV
15871	CAL ALN LNN NNN NNA NAR ARL RLM LMF	RAKFKQLL
5431	CAV AVV VVW VWG WGN GNT NTP TPL PLV LVF	KLGGALQAK
14832	CAA AAS ASR SRA RAS ASD SDG DGQ GQK QKL KLL LLF	KLGGALQAK
25800	CAT ATA TAA AAG AGG GGG GGA GAD ADG DGL GLT LTF	KLGGALQAK
5546	CAA AAR ARV RVD VDM DMY MYS YSG SGG GGG GGA GAD ADG DGL GLT LTF	ELAGIGILTV
5084	CAA AAM AME MET ETS TSY SYD YDK DKV KVI VIF	RAKFKQLL
33514	CIV IVR VRA RAS ASG SGD GDY DYK YKL KLS LSF	GILGFVFTL
34226	CGA GAG AGL GLY LYS YSG SGG GGG GGA GAD ADG DGL GLT LTF	KLGGALQAK
6550	CAV AVR VRS RSM SMD MDS DSN SNY NYQ YQL QLI LIW	KLGGALQAK
149	CAV AVP VPK PKV KVD VDS DSN SNY NYQ YQL QLI LIW	KLGGALQAK
7673	CAA AAS ASE SET ETS TSY SYD YDK DKV KVI VIF	RAKFKQLL
36211	CAV AVH VHT HTS TSG SGT GTY TYK YKY KYI YIF	KLGGALQAK
34348	CAA AAK AKD KDN DNY NYG YGQ GQN QNF NFV FVF	KLGGALQAK
26040	CAV AVQ VQA QAE AEG EGS GSY SYG YGG GGA GAT ATN TNK NKL KLI LIF	GILGFVFTL
36075	CAM AMI MIL ILS LSG SGG GGY GYQ YQK QKV KVT VTF	KLGGALQAK
27814	CAA AAA AAR ARI RID IDS DSS SSY SYK YKL KLI LIF	RAKFKQLL
36185	CAM AMR MRE REF EFY FYT YTG TGN GNQ NQF QFY FYF	KLGGALQAK
5280	CAG AGA GAS ASG SGG GGS GSQ SQG QGN GNL NLI LIF	GILGFVFTL
35734	CAA AAL ALS LSN SNF NFG FGN GNE NEK EKL KLT LTF	KLGGALQAK
28360	CAV AVR VRP RPE PEG EGA GAQ AQK QKL KLV LVF	KLGGALQAK
28355	CAE AET ETH THS HSG SGG GGS GSN SNY NYK YKL KLT LTF	RAKFKQLL
34460	CAM AMR MRE REG EGP GPN PNN NNF NFN FNK NKF KFY FYF	KLGGALQAK
35383	CAV AVR VRD RDY DYK YKN KNR NRD RDD DDK DKI KII IIF	KLGGALQAK
2301	CAV AVK VKG KGS GST STF	ELAGIGILTV
35547	CVV VVR VRS RSG SGG GGY GYN YNK NKL KLI LIF	KLGGALQAK
33478	CAY AYP YPI PIG IGT GTG TGT GTY TYK YKY KYI YIF	RAKFKQLL
2562	CAA AAS ASE SET ETG TGR GRR RRA RAL ALT LTF	KLGGALQAK
35857	CAA AAS ASG SGR GRD RDS DSN SNY NYQ YQL QLI LIW	KLGGALQAK
31553	CAA AAI AIS ISV SVG VGG GGS GSN SNY NYK YKL KLT LTF	GILGFVFTL
2460	CAV AVD VDD DDS DSD SDK DKL KLI LIF	KLGGALQAK
201	CAE AEK EKN KNN NNF NFN FNK NKF KFY FYF	RAKFKQLL
6685	CAG AGA GAN ANG NGS GSS SSN SNT NTG TGK GKL KLI LIF	GILGFVFTL
14255	CIL ILK LKS KSG SGY GYA YAL ALN LNF	KLGGALQAK
35213	CAT ATD TDD DDG DGA GAN ANS NSK SKL KLT LTF	KLGGALQAK
35702	CAL ALG LGE GEP EPG PGT GTG TGN GNQ NQF QFY FYF	KLGGALQAK
18116	CAD ADS DSG SGG GGG GGA GAD ADG DGL GLT LTF	RAKFKQLL
34612	CAY AYM YMA MAD ADR DRG RGS GST STL TLG LGR GRL RLY LYF	KLGGALQAK
35636	CVV VVV VVD VDG DGG GGS GSQ SQG QGN GNL NLI LIF	KLGGALQAK
35657	CAL ALM LMN MNY NYG YGG GGS GSQ SQG QGN GNL NLI LIF	KLGGALQAK
4959	CAA AAS ASS SSW SWV WVN VNF NFN FNK NKF KFY FYF	KLGGALQAK
31371	CIV IVR VRG RGF GFS FSN SNS NSG SGY GYA YAL ALN LNF	GILGFVFTL
5124	CAL ALS LSE SEA EAY AYA YAG AGG GGT GTS TSY SYG YGK GKL KLT LTF	KLGGALQAK
186	CAV AVW VWD WDN DNY NYG YGQ GQN QNF NFV FVF	KLGGALQAK
34802	CAV AVF VFL FLY LYG YGQ GQN QNF NFV FVF	KLGGALQAK
29947	CVV VVN VNM NMD MDN DNA NAR ARL RLM LMF	GILGFVFTL
5657	CAE AER ERG RGG GGG GGG GGS GSQ SQG QGN GNL NLI LIF	GILGFVFTL
5320	CAV AVR VRD RDI DIN INR NRG RGN GNT NTP TPL PLV LVF	KLGGALQAK
26524	CAV AVN VNS NSR SRG RGV GVE VEF EFY FYF	IVTDFSVIK
35170	CAV AVA VAF AFD FDG DGN GNN NNR NRL RLA LAF	KLGGALQAK
24707	CAV AVG VGD GDN DNF NFN FNK NKF KFY FYF	RAKFKQLL
34355	CAG AGQ GQG QGN GNQ NQG QGG GGK GKL KLI LIF	KLGGALQAK
35643	CVV VVD VDD DDS DSG SGT GTY TYK YKY KYI YIF	KLGGALQAK
30719	CIF IFV FVR VRN RNR NRD RDD DDK DKI KII IIF	GILGFVFTL
35379	CAE AES ESG SGN GNS NSG SGY GYA YAL ALN LNF	KLGGALQAK
31854	CAG AGV GVS VSG SGN GNT NTG TGK GKL KLI LIF	GILGFVFTL
31475	CAG AGT GTD TDG DGG GGS GSQ SQG QGN GNL NLI LIF	GILGFVFTL
5377	CAV AVN VNL NLG LGL GLT LTA TAG AGG GGT GTS TSY SYG YGK GKL KLT LTF	ELAGIGILTV
18055	CAE AEM EME MEG EGG GGS GSY SYI YIP IPT PTF	GLCTLVAML
30982	CAH AHN HNA NAG AGG GGT GTS TSY SYG YGK GKL KLT LTF	GILGFVFTL
17050	CAV AVI VIV IVA VAR ARL RLM LMF	KLGGALQAK
28731	CAA AAS ASG SGN GNH NHD HDM DMR MRL	RAKFKQLL
31192	CAA AAP APG PGG GGG GGG GGS GSQ SQG QGN GNL NLI LIF	GILGFVFTL
34190	CAT ATD TDA DAS ASG SGG GGF GFK FKT KTI TIF	KLGGALQAK
35877	CAA AAL ALG LGQ GQN QNF NFV FVF	KLGGALQAK
35411	CAV AVI VIS ISG SGG GGS GSY SYI YIP IPT PTF	KLGGALQAK
16000	CAV AVL VLD LDS DSN SNY NYQ YQL QLI LIW	KLGGALQAK
7659	CAV AVR VRV RVN VNQ NQA QAG AGT GTA TAL ALI LIF	GILGFVFTL
36140	CAA AAH AHP HPP PPM PMY MYS YSG SGG GGG GGA GAD ADG DGL GLT LTF	KLGGALQAK
34010	CAL ALS LSD SDF DFS FSE SEN ENT NTP TPL PLV LVF	KLGGALQAK
35751	CLV LVG VGA GAD ADS DSN SNY NYQ YQL QLI LIW	KLGGALQAK
4931	CAV AVS VSS SSN SNS NSG SGG GGY GYQ YQK QKV KVT VTF	ELAGIGILTV
35793	CAM AMR MRE REH EHN HNT NTD TDK DKL KLI LIF	KLGGALQAK
23006	CAW AWN WNP NPD PDN DNY NYG YGQ GQN QNF NFV FVF	KLGGALQAK
33506	CAA AAP APY PYS YSS SSN SNT NTG TGK GKL KLI LIF	GILGFVFTL
33592	CAL ALS LSE SES ESW SWT WTA TAM AMD MDS DSN SNY NYQ YQL QLI LIW	GILGFVFTL
35550	CAT ATD TDA DAL ALP LPN PNA NAG AGG GGT GTS TSY SYG YGK GKL KLT LTF	KLGGALQAK
35308	CAA AAP APD PDQ DQG QGG GGS GSE SEK EKL KLV LVF	KLGGALQAK
35082	CAL ALS LSE SEN ENN NNN NNA NAG AGN GNM NML MLT LTF	KLGGALQAK
23	CAA AAS ASM SMT MTG TGN GNQ NQF QFY FYF	KLGGALQAK
25326	CGT GTE TEY EYP YPN PND NDY DYK YKL KLS LSF	RAKFKQLL
34470	CLL LLR LRT RTG TGS GSY SYQ YQL QLT LTF	KLGGALQAK
32247	CAA AAK AKE KEG EGY GYS YST STL TLT LTF	KLGGALQAK
88	CAV AVQ VQP QPF PFS FSG SGG GGY GYN YNK NKL KLI LIF	KLGGALQAK
34242	CAT ATD TDG DGW GWS WSS SSG SGY GYS YST STL TLT LTF	KLGGALQAK
4985	CAV AVS VSA SAA AAS ASG SGG GGS GSY SYI YIP IPT PTF	KLGGALQAK
15618	CAM AMR MRR RRP RPN PNA NAG AGG GGT GTS TSY SYG YGK GKL KLT LTF	RAKFKQLL
28861	CVG VGY GYT YTN TNA NAG AGK GKS KST STF	KLGGALQAK
34835	CAL ALG LGE GEP EPG PGG GGL GLS LSY SYA YAG AGG GGT GTS TSY SYG YGK GKL KLT LTF	KLGGALQAK
2415	CAM AMS MSD SDL DLY LYS YSG SGA GAG AGS GSY SYQ YQL QLT LTF	KLGGALQAK
34721	CAV AVQ VQD QDE DER ERG RGS GST STL TLG LGR GRL RLY LYF	KLGGALQAK
34099	CAG AGL GLY LYN YNN NNN NND NDM DMR MRF	KLGGALQAK
35270	CAL ALS LSV SVG VGG GGP GPD PDT DTG TGR GRR RRA RAL ALT LTF	KLGGALQAK
35979	CAL ALS LSG SGF GFS FSQ SQG QGG GGS GSE SEK EKL KLV LVF	KLGGALQAK
26395	CAE AED EDS DSN SNA NAR ARL RLM LMF	GLCTLVAML
34385	CAY AYR YRA RAP APR PRG RGN GNE NEK EKL KLT LTF	KLGGALQAK
25894	CAA AAS ASA SAL ALS LSS SSG SGG GGS GSN SNY NYK YKL KLT LTF	KLGGALQAK
22326	CAA AAS ASY SYP YPP PPY PYS YSS SSA SAS ASK SKI KII IIF	RAKFKQLL
30923	CAM AMR MRS RST STG TGN GNQ NQF QFY FYF	GILGFVFTL
2306	CAA AAH AHL HLS LSN SNF NFG FGN GNE NEK EKL KLT LTF	KLGGALQAK
20662	CAD ADS DSG SGG GGS GSA SAD ADG DGL GLT LTF	RAKFKQLL
24361	CAA AAA AAR ARV RVG VGG GGS GSQ SQG QGN GNL NLI LIF	RAKFKQLL
34730	CAC ACS CSG SGG GGY GYQ YQK QKV KVT VTF	KLGGALQAK
34311	CAL ALD LDY DYS YSP SPT PTG TGN GNQ NQF QFY FYF	KLGGALQAK
19628	CAV AVS VSR SRG RGS GST STL TLG LGR GRL RLY LYF	RAKFKQLL
35972	CAE AES ESP SPI PIS ISG SGS GSA SAR ARQ RQL QLT LTF	KLGGALQAK
6359	CAV AVG VGA GAA AAG AGG GGY GYN YNK NKL KLI LIF	IVTDFSVIK
14646	CAV AVR VRD RDN DNN NNA NAG AGN GNM NML MLT LTF	KLGGALQAK
34930	CAV AVR VRE RER ERG RGS GSG SGT GTY TYK YKY KYI YIF	KLGGALQAK
28754	CAA AAD ADD DDG DGR GRL RLM LMF	RAKFKQLL
6606	CAF AFM FMT MTN TNA NAG AGG GGT GTS TSY SYG YGK GKL KLT LTF	GILGFVFTL
34592	CAV AVN VNN NNA NAR ARL RLM LMF	KLGGALQAK
22322	CVV VVS VSD SDI DIY IYN YNN NNA NAG AGN GNM NML MLT LTF	KLGGALQAK
16962	CAA AAK AKE KEG EGG GGS GSE SEK EKL KLV LVF	RAKFKQLL
34310	CAV AVT VTG TGY GYS YST STL TLT LTF	KLGGALQAK
26501	CAE AEL ELK LKE KEK EKL KLI LIF	GLCTLVAML
34952	CVA VAG AGG GGA GAA AAG AGN GNK NKL KLT LTF	KLGGALQAK
11940	CAA AAR ARV RVR VRG RGF GFG FGN GNV NVL VLH LHC	RAKFKQLL
17043	CAV AVS VSD SDS DSN SNY NYQ YQL QLI LIW	RAKFKQLL
283	CAA AAY AYS YSG SGG GGG GGA GAD ADG DGL GLT LTF	KLGGALQAK
24018	CVG VGY GYT YTN TNA NAG AGK GKS KST STF	RAKFKQLL
34868	CAG AGR GRA RAG AGT GTY TYK YKY KYI YIF	KLGGALQAK
35947	CAE AEN ENM NMY MYS YSG SGG GGG GGA GAD ADG DGL GLT LTF	KLGGALQAK
34208	CAV AVR VRL RLA LAY AYN YNN NNN NND NDM DMR MRF	KLGGALQAK
2335	CAL ALP LPS PSG SGG GGY GYN YNK NKL KLI LIF	GILGFVFTL
2775	CAM AMS MSS SSN SNA NAG AGG GGT GTS TSY SYG YGK GKL KLT LTF	IVTDFSVIK
30413	CAL ALK LKA KAG AGT GTA TAL ALI LIF	GILGFVFTL
33909	CAG AGA GAV AVG VGS GSS SSN SNT NTG TGK GKL KLI LIF	GILGFVFTL
36129	CAT ATD TDS DSD SDS DSN SNY NYQ YQL QLI LIW	KLGGALQAK
5557	CAA AAE AET ETG TGA GAN ANN NNL NLF LFF	KLGGALQAK
3	CAF AFM FMI MIG IGA GAG AGG GGT GTS TSY SYG YGK GKL KLT LTF	GILGFVFTL
23138	CVG VGY GYT YTN TNA NAG AGK GKS KST STF	RAKFKQLL
36322	CAV AVD VDL DLM LMK MKT KTS TSY SYD YDK DKV KVI VIF	IVTDFSVIK
34873	CVV VVN VNT NTG TGN GNQ NQF QFY FYF	KLGGALQAK
35728	CAG AGQ GQS QSY SYG YGN GNK NKL KLV LVF	KLGGALQAK
15329	CVV VVS VSR SRD RDD DDK DKI KII IIF	RAKFKQLL
35823	CVR VRR RRA RAG AGG GGS GSY SYI YIP IPT PTF	ELAGIGILTV
34993	CAA AAV AVP VPS PSG SGS GSA SAR ARQ RQL QLT LTF	KLGGALQAK
38435	CAG AGA GAS ASG SGD GDY DYK YKL KLS LSF	KLGGALQAK
27875	CVV VVT VTE TET ETS TSY SYD YDK DKV KVI VIF	RAKFKQLL
2525	CAG AGV GVS VSP SPN PNS NSG SGG GGS GSN SNY NYK YKL KLT LTF	AVFDRKSDAK
31447	CAG AGQ GQS QSS SSD SDF DFA FAY AYG YGG GGS GSQ SQG QGN GNL NLI LIF	GILGFVFTL
34929	CAG AGG GGG GGA GAG AGN GNM NML MLT LTF	KLGGALQAK
24347	CGT GTD TDK DKG KGG GGG GGS GSQ SQG QGN GNL NLI LIF	GILGFVFTL
5230	CAV AVG VGN GNQ NQG QGG GGK GKL KLI LIF	KLGGALQAK
17953	CAA AAS ASA SAS ASG SGG GGS GSQ SQG QGN GNL NLI LIF	RAKFKQLL
5091	CAM AMG MGP GPS PSG SGG GGS GSY SYI YIP IPT PTF	KLGGALQAK
34087	CAL ALS LSE SES ESE SEM EMY MYS YSG SGG GGG GGA GAD ADG DGL GLT LTF	KLGGALQAK
24333	CAM AMS MSP SPG PGG GGS GSG SGY GYA YAL ALN LNF	KLGGALQAK
24352	CIL ILR LRE REF EFY FYN YND NDM DMR MRF	RAKFKQLL
34797	CAA AAR ARL RLM LMG MGT GTY TYK YKY KYI YIF	KLGGALQAK
24812	CAD ADS DSG SGG GGG GGA GAD ADG DGL GLT LTF	RAKFKQLL
38428	CAV AVD VDL DLM LMK MKT KTS TSY SYD YDK DKV KVI VIF	IVTDFSVIK
35505	CGT GTA TAS ASN SNT NTG TGK GKL KLI LIF	KLGGALQAK
35459	CAV AVS VSE SED EDG DGG GGG GGS GSE SEK EKL KLV LVF	KLGGALQAK
34275	CAR ART RTG TGT GTA TAS ASK SKL KLT LTF	KLGGALQAK
35132	CAL ALS LSD SDG DGQ GQN QNF NFV FVF	KLGGALQAK
5603	CAG AGD GDG DGG GGG GGG GGS GSQ SQG QGN GNL NLI LIF	GILGFVFTL
35672	CAY AYI YIN INT NTG TGA GAN ANS NSK SKL KLT LTF	KLGGALQAK
31850	CAG AGR GRG RGN GNN NNA NAR ARL RLM LMF	GILGFVFTL
4938	CAS ASS SSR SRP RPA PAG AGR GRD RDD DDK DKI KII IIF	KLGGALQAK
4936	CAG AGA GAS ASG SGS GSS SSN SNT NTG TGK GKL KLI LIF	GILGFVFTL
5258	CAV AVN VNY NYG YGN GNK NKL KLV LVF	ELAGIGILTV
7238	CAV AVS VSA SAS ASG SGT GTY TYK YKY KYI YIF	KLGGALQAK
16697	CAR ARE REH EHM HMD MDS DSN SNY NYQ YQL QLI LIW	RAKFKQLL
4966	CAL ALN LNT NTG TGN GNQ NQF QFY FYF	KLGGALQAK
6358	CAG AGA GAG AGG GGG GGS GSQ SQG QGN GNL NLI LIF	GILGFVFTL
35796	CAV AVI VIF IFY FYN YNQ NQG QGG GGK GKL KLI LIF	KLGGALQAK
115	CVV VVT VTH THY HYG YGG GGS GSQ SQG QGN GNL NLI LIF	KLGGALQAK
35324	CAM AMR MRG RGP GPY PYS YSS SSN SNT NTG TGK GKL KLI LIF	KLGGALQAK
35239	CAG AGQ GQG QGY GYN YNN NNN NND NDM DMR MRF	KLGGALQAK
34897	CAE AET ETD TDQ DQR QRM RMD MDT DTG TGR GRR RRA RAL ALT LTF	KLGGALQAK
35218	CAT ATT TTN TND NDY DYK YKL KLS LSF	KLGGALQAK
31077	CIP IPA PAR ARG RGE GEY EYG YGG GGS GSQ SQG QGN GNL NLI LIF	GILGFVFTL
11985	CAL ALR LRA RAG AGN GNQ NQF QFY FYF	RAKFKQLL
5032	CAP APL PLS LSN SNF NFG FGN GNE NEK EKL KLT LTF	KLGGALQAK
6362	CAG AGQ GQT QTG TGN GNT NTG TGK GKL KLI LIF	GILGFVFTL
28714	CAV AVL VLD LDS DSN SNY NYQ YQL QLI LIW	KLGGALQAK
32402	CAA AAS ASP SPR PRD RDQ DQP QPL PLS LSG SGA GAG AGS GSY SYQ YQL QLT LTF	GILGFVFTL
4970	CAV AVE VER ERR RRE RET ETS TSG SGS GSR SRL RLT LTF	KLGGALQAK
35557	CAF AFL FLF LFG FGN GNE NEK EKL KLT LTF	KLGGALQAK
