2273	CAY AYR YRS RSG SGN GNN NNN NND NDM DMR MRF	KLGGALQAK
34022	CAE AES ESK SKE KEG EGP GPG PGG GGS GSY SYI YIP IPT PTF	KLGGALQAK
2347	CAV AVS VST STG TGF GFQ FQK QKL KLV LVF	ELAGIGILTV
35741	CGT GTF TFP FPP PPY PYS YSS SSA SAS ASK SKI KII IIF	KLGGALQAK
34563	CAT ATD TDA DAF AFM FMI MIY IYN YNQ NQG QGG GGK GKL KLI LIF	KLGGALQAK
34744	CAE AES ESG SGG GGR GRG RGS GST STL TLG LGR GRL RLY LYF	KLGGALQAK
15312	CAE AET ETQ TQD QDS DSN SNY NYQ YQL QLI LIW	RAKFKQLL
2395	CIL ILR LRD RDV DVI VIK IKA KAA AAG AGN GNK NKL KLT LTF	RAKFKQLL
16063	CAV AVF VFN FND NDY DYK YKL KLS LSF	RAKFKQLL
34752	CAT ATP TPY PYR YRT RTA TAA AAG AGN GNK NKL KLT LTF	KLGGALQAK
14675	CAD ADS DSG SGG GGG GGA GAD ADG DGL GLT LTF	GILGFVFTL
22323	CAD ADS DSG SGG GGG GGA GAD ADG DGL GLT LTF	RAKFKQLL
17009	CAV AVG VGD GDN DNF NFN FNK NKF KFY FYF	GLCTLVAML
35731	CAA AAS ASI SIR IRA RAA AAG AGN GNK NKL KLT LTF	KLGGALQAK
34554	CAV AVG VGY GYG YGN GNK NKL KLV LVF	KLGGALQAK
23206	CAA AAM AME MET ETS TSY SYD YDK DKV KVI VIF	RAKFKQLL
34357	CVV VVN VNL NLG LGG GGS GST STL TLG LGR GRL RLY LYF	KLGGALQAK
262	CAV AVT VTP TPY PYT YTG TGG GGF GFK FKT KTI TIF	RAKFKQLL
36237	CAA AAI AIR IRS RSA SAS ASK SKI KII IIF	AVFDRKSDAK
23859	CAA AAM AMD MDS DSN SNY NYQ YQL QLI LIW	KLGGALQAK
5260	CAV AVE VEA EAG AGG GGT GTS TSY SYG YGK GKL KLT LTF	KLGGALQAK
35914	CAV AVR VRD RDS DSN SNN NNA NAR ARL RLM LMF	KLGGALQAK
31	CAA AAT ATG TGG GGF GFK FKT KTI TIF	KLGGALQAK
4948	CAV AVS VSL SLY LYA YAR ARL RLM LMF	KLGGALQAK
15297	CAA AAS ASE SES ESS SSN SND NDY DYK YKL KLS LSF	RAKFKQLL
35074	CAY AYR YRS RSA SAK AKT KTQ TQG QGG GGS GSE SEK EKL KLV LVF	KLGGALQAK
18818	CIQ IQS QSQ SQG QGG GGS GSE SEK EKL KLV LVF	RAKFKQLL
34415	CAV AVQ VQA QAH AHS HSG SGG GGG GGA GAD ADG DGL GLT LTF	KLGGALQAK
35595	CAG AGT GTP TPA PAS ASR SRG RGY GYA YAL ALN LNF	KLGGALQAK
26561	CAE AEN ENR NRD RDD DDK DKI KII IIF	KLGGALQAK
33366	CAG AGA GAG AGG GGG GGS GSQ SQG QGN GNL NLI LIF	GILGFVFTL
29954	CAG AGG GGG GGD GDG DGG GGS GSQ SQG QGN GNL NLI LIF	GILGFVFTL
25282	CAV AVG VGP GPT PTG TGK GKL KLI LIF	KLGGALQAK
26022	CAV AVR VRV RVG VGT GTT TTD TDS DSL SLL	GILGFVFTL
7711	CAV AVS VSN SNT NTG TGN GNQ NQF QFY FYF	RAKFKQLL
14980	CAV AVL VLG LGT GTQ TQG QGG GGS GSE SEK EKL KLV LVF	RAKFKQLL
35720	CAS ASL SLG LGS GSE SEK EKL KLV LVF	KLGGALQAK
35630	CAT ATD TDA DAT ATG TGG GGF GFK FKT KTI TIF	KLGGALQAK
34057	CAA AAL ALL LLF LFF	KLGGALQAK
23828	CAG AGS GST STT TTD TDS DSW SWG WGK GKL KLQ LQF	KLGGALQAK
35451	CAV AVT VTI TIL ILY LYS YSG SGG GGG GGA GAD ADG DGL GLT LTF	KLGGALQAK
36006	CVV VVS VSL SLV LVN VNT NTD TDK DKL KLI LIF	KLGGALQAK
5058	CAA AAP APY PYT YTP TPG PGG GGA GAT ATN TNK NKL KLI LIF	KLGGALQAK
7077	CVV VVS VSR SRM RMD MDS DSS SSY SYK YKL KLI LIF	KLGGALQAK
2250	CAL ALP LPR PRS RSG SGN GNT NTG TGK GKL KLI LIF	KLGGALQAK
18070	CAA AAS ASE SET ETS TSY SYD YDK DKV KVI VIF	RAKFKQLL
17978	CAL ALS LSE SEA EAH AHG HGG GGN GNK NKL KLV LVF	KLGGALQAK
7367	CAA AAV AVE VET ETS TSY SYD YDK DKV KVI VIF	RAKFKQLL
2245	CAL ALS LSA SAI AIL ILY LYN YNF NFN FNK NKF KFY FYF	KLGGALQAK
7204	CAG AGA GAG AGS GSQ SQG QGN GNL NLI LIF	GILGFVFTL
33386	CAF AFG FGG GGG GGG GGS GSQ SQG QGN GNL NLI LIF	GILGFVFTL
7212	CAG AGQ GQV QVN VNG NGG GGS GSQ SQG QGN GNL NLI LIF	GILGFVFTL
2475	CVV VVN VNG NGG GGA GAD ADG DGL GLT LTF	GILGFVFTL
5288	CAV AVF VFL FLY LYG YGN GNN NNR NRL RLA LAF	KLGGALQAK
23229	CAE AES ESE SEG EGP GPT PTY TYT YTD TDK DKL KLI LIF	RAKFKQLL
34500	CAM AMR MRP RPP PPF PFR FRG RGG GGY GYN YNK NKL KLI LIF	KLGGALQAK
5806	CAL ALT LTG TGN GNY NYG YGQ GQN QNF NFV FVF	GILGFVFTL
34979	CVV VVS VSP SPL PLN LND NDY DYK YKL KLS LSF	KLGGALQAK
14683	CAA AAT ATE TET ETN TND NDY DYK YKL KLS LSF	RAKFKQLL
33590	CAF AFM FMK MKG KGA GAG AGG GGT GTS TSY SYG YGK GKL KLT LTF	GILGFVFTL
36117	CAV AVT VTY TYA YAG AGN GNN NNR NRK RKL KLI LIW	KLGGALQAK
32604	CAG AGN GNY NYG YGG GGS GSQ SQG QGN GNL NLI LIF	GILGFVFTL
5407	CVV VVR VRG RGG GGR GRA RAG AGG GGT GTS TSY SYG YGK GKL KLT LTF	KLGGALQAK
25725	CAA AAS ASE SET ETS TSY SYD YDK DKV KVI VIF	RAKFKQLL
32349	CAV AVD VDF DFR FRD RDN DNY NYG YGQ GQN QNF NFV FVF	GILGFVFTL
194	CAV AVE VEA EAA AAG AGN GNK NKL KLT LTF	KLGGALQAK
34688	CAV AVR VRI RIQ IQG QGA GAQ AQK QKL KLV LVF	KLGGALQAK
31267	CAS ASG SGG GGG GGS GSE SEK EKL KLV LVF	GILGFVFTL
679	CAP API PIG IGG GGG GGN GNK NKL KLT LTF	KLGGALQAK
18000	CAM AMR MRE REG EGQ GQA QAG AGQ GQK QKL KLL LLF	KLGGALQAK
28728	CAV AVM VMD MDS DSS SSY SYK YKL KLI LIF	KLGGALQAK
25452	CAA AAI AIQ IQD QDF DFN FNY NYQ YQL QLI LIW	KLGGALQAK
223	CAM AMR MRE REG EGL GLG LGT GTG TGR GRR RRA RAL ALT LTF	AVFDRKSDAK
35781	CAL ALS LSA SAW AWA WAN ANQ NQA QAG AGT GTA TAL ALI LIF	KLGGALQAK
32775	CAE AEN ENG NGG GGG GGG GGA GAD ADG DGL GLT LTF	GILGFVFTL
37236	CAA AAS ASG SGN GNQ NQF QFY FYF	IVTDFSVIK
35309	CAL ALR LRS RSL SLK LKT KTS TSY SYD YDK DKV KVI VIF	KLGGALQAK
26	CAE AEM EMA MAG AGG GGT GTS TSY SYG YGK GKL KLT LTF	KLGGALQAK
35577	CAG AGH GHP HPE PES ESG SGK GKS KST STF	KLGGALQAK
35627	CAG AGY GYN YNT NTD TDK DKL KLI LIF	KLGGALQAK
8	CAS ASV SVG VGM GMD MDS DSS SSY SYK YKL KLI LIF	KLGGALQAK
34039	CAA AAT ATA TAS ASN SNA NAR ARL RLM LMF	KLGGALQAK
23900	CAL ALM LMP MPP PPA PAG AGY GYG YGG GGS GSQ SQG QGN GNL NLI LIF	KLGGALQAK
34587	CAE AEN ENQ NQE QET ETS TSG SGS GSR SRL RLT LTF	KLGGALQAK
35708	CAV AVE VED EDL DLI LIG IGG GGA GAD ADG DGL GLT LTF	KLGGALQAK
9486	CAV AVR VRG RGY GYN YNA NAG AGN GNM NML MLT LTF	RAKFKQLL
28935	CAV AVN VNT NTP TPP PPG PGD GDS DSN SNY NYQ YQL QLI LIW	GILGFVFTL
17882	CAV AVR VRD RDD DDT DTG TGG GGF GFK FKT KTI TIF	GILGFVFTL
2234	CAV AVN VNL NLN LNT NTD TDK DKL KLI LIF	ELAGIGILTV
34812	CAV AVD VDP DPL PLS LSS SSG SGS GSA SAR ARQ RQL QLT LTF	KLGGALQAK
32518	CAM AMS MSG SGD GDG DGG GGS GSQ SQG QGN GNL NLI LIF	GILGFVFTL
34963	CAL ALG LGE GEL ELD LDS DSW SWG WGK GKL KLQ LQF	KLGGALQAK
35385	CAE AES ESM SMN MNY NYG YGG GGS GSQ SQG QGN GNL NLI LIF	KLGGALQAK
2287	CAG AGF GFL FLI LIT ITG TGA GAG AGS GSY SYQ YQL QLT LTF	KLGGALQAK
6683	CAG AGA GAG AGV GVG VGY GYG YGG GGS GSQ SQG QGN GNL NLI LIF	GILGFVFTL
35879	CAV AVN VNY NYN YNT NTG TGY GYG YGG GGS GSQ SQG QGN GNL NLI LIF	KLGGALQAK
2390	CRN RNA NAG AGG GGT GTS TSY SYG YGK GKL KLT LTF	GILGFVFTL
5379	CAF AFM FMD MDS DSN SNY NYQ YQL QLI LIW	KLGGALQAK
34478	CAE AEN ENS NSV SVG VGR GRR RRA RAL ALT LTF	KLGGALQAK
26522	CAL ALS LSE SEA EAL ALQ LQG QGG GGS GSE SEK EKL KLV LVF	KLGGALQAK
35355	CAA AAT ATA TAG AGN GNT NTP TPL PLV LVF	KLGGALQAK
36160	CAV AVN VNW NWE WEE EEQ EQG QGG GGS GSY SYI YIP IPT PTF	KLGGALQAK
30156	CAF AFM FMT MTS TSP SPG PGG GGT GTS TSY SYG YGK GKL KLT LTF	GILGFVFTL
24496	CAT ATD TDG DGG GGG GGG GGS GSQ SQG QGN GNL NLI LIF	RAKFKQLL
34041	CAL ALS LSE SEA EAL ALP LPR PRD RDK DKL KLI LIF	KLGGALQAK
5447	CAY AYR YRS RSV SVY VYS YSG SGA GAG AGS GSY SYQ YQL QLT LTF	KLGGALQAK
29357	CAV AVL VLD LDS DSN SNY NYQ YQL QLI LIW	GILGFVFTL
16058	CAG AGG GGG GGS GSQ SQG QGN GNL NLI LIF	RAKFKQLL
31663	CAA AAP APK PKG KGA GAN ANN NNL NLF LFF	GILGFVFTL
35438	CAT ATA TAP APY PYN YNQ NQG QGG GGK GKL KLI LIF	KLGGALQAK
4879	CAT ATV TVS VST STD TDS DSW SWG WGK GKF KFQ FQF	IVTDFSVIK
29967	CAG AGA GAG AGG GGT GTA TAS ASK SKL KLT LTF	GILGFVFTL
23833	CAT ATD TDD DDP DPR PRA RAA AAG AGG GGS GSY SYI YIP IPT PTF	KLGGALQAK
168	CAV AVE VEA EAA AAG AGN GNK NKL KLT LTF	AVFDRKSDAK
6551	CAV AVR VRD RDG DGT GTG TGA GAN ANN NNL NLF LFF	GILGFVFTL
17965	CAV AVG VGD GDN DNF NFN FNK NKF KFY FYF	AVFDRKSDAK
7324	CAV AVA VAT ATM TMG MGS GSG SGG GGS GSN SNY NYK YKL KLT LTF	GILGFVFTL
26214	CAG AGP GPP PPS PSG SGA GAG AGS GSY SYQ YQL QLT LTF	GLCTLVAML
35885	CAT ATD TDA DAG AGD GDA DAG AGG GGT GTS TSY SYG YGK GKL KLT LTF	KLGGALQAK
23222	CAV AVL VLG LGG GGS GSA SAR ARQ RQL QLT LTF	KLGGALQAK
5156	CAG AGH GHT HTG TGN GNQ NQF QFY FYF	IVTDFSVIK
5460	CAG AGH GHT HTG TGN GNQ NQF QFY FYF	IVTDFSVIK
34830	CVA VAT ATE TEY EYG YGN GNK NKL KLV LVF	KLGGALQAK
36008	CAV AVD VDS DSG SGN GNT NTP TPL PLV LVF	KLGGALQAK
32983	CAG AGD GDS DSP SPA PAG AGK GKS KST STF	GILGFVFTL
34351	CAV AVR VRF RFT FTS TSG SGT GTY TYK YKY KYI YIF	KLGGALQAK
12586	CAM AMK MKS KST STN TNA NAG AGK GKS KST STF	RAKFKQLL
35301	CAA AAS ASI SIN ING NGG GGF GFK FKT KTI TIF	KLGGALQAK
34390	CAM AMS MSY SYA YAT ATD TDS DSW SWG WGK GKL KLQ LQF	KLGGALQAK
30882	CAG AGA GAG AGA GAS ASN SNT NTG TGK GKL KLI LIF	GILGFVFTL
36051	CAV AVD VDL DLM LMK MKT KTS TSY SYD YDK DKV KVI VIF	IVTDFSVIK
35792	CAL ALI LIG IGG GGS GSN SNY NYK YKL KLT LTF	KLGGALQAK
171	CAV AVS VSQ SQG QGG GGA GAD ADG DGL GLT LTF	ELAGIGILTV
34792	CAG AGS GSG SGT GTY TYK YKY KYI YIF	KLGGALQAK
29012	CAV AVG VGS GSW SWG WGK GKL KLQ LQF	GILGFVFTL
30423	CAV AVQ VQG QGS GSQ SQG QGN GNL NLI LIF	GILGFVFTL
6230	CAG AGN GNY NYG YGG GGS GSQ SQG QGN GNL NLI LIF	GILGFVFTL
36053	CAA AAS ASR SRD RDQ DQK QKV KVT VTF	KLGGALQAK
35434	CAV AVR VRP RPR PRD RDD DDK DKI KII IIF	KLGGALQAK
35986	CAY AYR YRS RSN SNR NRD RDD DDK DKI KII IIF	KLGGALQAK
41	CAV AVG VGD GDN DNF NFN FNK NKF KFY FYF	AVFDRKSDAK
34445	CAM AMR MRT RTR TRS RSG SGG GGA GAD ADG DGL GLT LTF	KLGGALQAK
30088	CAF AFM FMI MIN INA NAG AGG GGT GTS TSY SYG YGK GKL KLT LTF	GILGFVFTL
34667	CAA AAR ARD RDN DNT NTG TGG GGF GFK FKT KTI TIF	KLGGALQAK
25924	CAY AYR YRS RSF SFV FVW VWS WSN SNN NND NDM DMR MRF	GILGFVFTL
35719	CAT ATE TEG EGG GGL GLY LYN YNF NFN FNK NKF KFY FYF	KLGGALQAK
28840	CAE AEN ENL NLG LGG GGG GGS GSQ SQG QGN GNL NLI LIF	GILGFVFTL
34775	CAV AVR VRD RDN DNT NTG TGK GKL KLI LIF	KLGGALQAK
14548	CAA AAR ARV RVR VRG RGF GFG FGN GNV NVL VLH LHC	AVFDRKSDAK
34283	CAL ALS LSE SEL ELN LNT NTG TGN GNQ NQF QFY FYF	KLGGALQAK
18095	CAD ADS DSG SGG GGG GGA GAD ADG DGL GLT LTF	RAKFKQLL
16980	CAV AVE VEI EID IDD DDK DKI KII IIF	KLGGALQAK
34154	CAF AFM FMN MNP NPA PAG AGT GTY TYK YKY KYI YIF	KLGGALQAK
15303	CIV IVR VRE REI EIN INN NND NDM DMR MRF	RAKFKQLL
34030	CLC LCG CGD GDS DSN SNY NYQ YQL QLI LIW	KLGGALQAK
35567	CAV AVR VRD RDS DSA SAS ASG SGT GTY TYK YKY KYI YIF	KLGGALQAK
2316	CAE AES ESK SKE KEL ELS LSF	KLGGALQAK
113	CAA AAS ASA SAS ASN SNQ NQG QGG GGK GKL KLI LIF	RAKFKQLL
35292	CAA AAS ASI SIN INR NRN RNT NTG TGN GNQ NQF QFY FYF	KLGGALQAK
36329	CAV AVD VDL DLM LMK MKT KTS TSY SYD YDK DKV KVI VIF	IVTDFSVIK
29971	CIP IPY PYN YNN NNN NND NDM DMR MRF	GILGFVFTL
35306	CLV LVA VAG AGG GGG GGA GAT ATN TNK NKL KLI LIF	KLGGALQAK
24353	CAA AAS ASE SET ETS TSY SYD YDK DKV KVI VIF	RAKFKQLL
34904	CAV AVK VKD KDY DYK YKL KLS LSF	KLGGALQAK
26152	CAV AVN VNQ NQA QAG AGT GTA TAL ALI LIF	KLGGALQAK
28470	CAV AVM VMP MPD PDP DPN PNA NAG AGG GGT GTS TSY SYG YGK GKL KLT LTF	KLGGALQAK
33522	CAD ADS DSG SGG GGG GGA GAD ADG DGL GLT LTF	RAKFKQLL
2440	CAL ALG LGE GEL ELG LGA GAG AGA GAG AGS GSY SYQ YQL QLT LTF	IVTDFSVIK
32998	CAN ANY NYQ YQL QLI LIW	GILGFVFTL
5498	CAV AVN VNP NPT PTG TGG GGF GFK FKT KTI TIF	ELAGIGILTV
35327	CAV AVD VDF DFE FET ETS TSG SGS GSR SRL RLT LTF	KLGGALQAK
2448	CAV AVG VGA GAG AGS GSA SAR ARQ RQL QLT LTF	ELAGIGILTV
34515	CIV IVR VRV RVE VEG EGF GFH FHS HSG SGG GGG GGA GAD ADG DGL GLT LTF	KLGGALQAK
24803	CAG AGG GGG GGQ GQG QGG GGS GSQ SQG QGN GNL NLI LIF	GILGFVFTL
35468	CAL ALR LRG RGS GSG SGG GGA GAT ATN TNK NKL KLI LIF	KLGGALQAK
34942	CIL ILG LGP GPS PSE SET ETS TSG SGS GSR SRL RLT LTF	KLGGALQAK
6668	CAA AAS ASP SPT PTG TGM GMD MDS DSN SNY NYQ YQL QLI LIW	GILGFVFTL
2369	CAH AHP HPD PDS DSN SNY NYQ YQL QLI LIW	KLGGALQAK
28597	CAA AAS ASF SFN FNN NNA NAG AGN GNM NML MLT LTF	KLGGALQAK
14796	CAA AAS ASE SET ETS TSY SYD YDK DKV KVI VIF	RAKFKQLL
34141	CAM AMR MRE REG EGD GDL DLS LSG SGA GAG AGS GSY SYQ YQL QLT LTF	KLGGALQAK
35284	CAV AVV VVD VDN DNY NYG YGQ GQN QNF NFV FVF	KLGGALQAK
31064	CAG AGV GVR VRD RDG DGN GNN NNR NRL RLA LAF	GILGFVFTL
28400	CAA AAM AME MET ETS TSY SYD YDK DKV KVI VIF	RAKFKQLL
31458	CAG AGT GTH THG HGG GGS GSQ SQG QGN GNL NLI LIF	GILGFVFTL
36010	CAL ALD LDF DFS FSS SSG SGS GSA SAR ARQ RQL QLT LTF	KLGGALQAK
13976	CAA AAA AAE AET ETS TSY SYD YDK DKV KVI VIF	RAKFKQLL
17977	CAM AMR MRE REG EGN GNA NAG AGN GNM NML MLT LTF	KLGGALQAK
28876	CVV VVT VTE TET ETS TSY SYD YDK DKV KVI VIF	RAKFKQLL
16542	CAP APY PYG YGG GGA GAT ATN TNK NKL KLI LIF	RAKFKQLL
2379	CAV AVR VRD RDV DVA VAT ATS TSG SGT GTY TYK YKY KYI YIF	KLGGALQAK
15583	CAY AYR YRS RSA SAR ARE RET ETG TGN GNQ NQF QFY FYF	RAKFKQLL
16003	CAE AEM EME MEG EGG GGS GSY SYI YIP IPT PTF	RAKFKQLL
26519	CAE AED EDN DNN NNA NAR ARL RLM LMF	GLCTLVAML
34843	CAV AVR VRD RDG DGG GGM GMG MGS GSN SNT NTG TGK GKL KLI LIF	KLGGALQAK
26015	CAV AVG VGA GAL ALY LYS YSG SGA GAG AGS GSY SYQ YQL QLT LTF	KLGGALQAK
34603	CAV AVY VYQ YQG QGG GGK GKL KLI LIF	KLGGALQAK
32253	CIV IVR VRV RVS VSG SGA GAG AGG GGT GTS TSY SYG YGK GKL KLT LTF	GILGFVFTL
7213	CAF AFM FMI MIG IGA GAG AGG GGT GTS TSY SYG YGK GKL KLT LTF	GILGFVFTL
2578	CAG AGH GHT HTG TGN GNQ NQF QFY FYF	IVTDFSVIK
34781	CAV AVP VPY PYH YHA HAG AGK GKS KST STF	KLGGALQAK
16002	CAE AEM EME MEG EGG GGS GSY SYI YIP IPT PTF	RAKFKQLL
35271	CAV AVF VFN FNQ NQA QAG AGT GTA TAL ALI LIF	KLGGALQAK
26109	CAA AAS ASE SEG EGN GNT NTD TDK DKL KLI LIF	KLGGALQAK
35674	CAV AVG VGR GRL RLT LTQ TQG QGG GGS GSE SEK EKL KLV LVF	KLGGALQAK
35162	CIL ILG LGE GEK EKT KTS TSY SYD YDK DKV KVI VIF	KLGGALQAK
21046	CAE AET ETH THS HSG SGG GGS GSN SNY NYK YKL KLT LTF	RAKFKQLL
34647	CAG AGR GRS RST STG TGK GKL KLI LIF	AVFDRKSDAK
23212	CAG AGS GSY SYG YGG GGS GSQ SQG QGN GNL NLI LIF	IVTDFSVIK
6607	CAV AVS VSC SCD CDG DGL GLS LSN SNN NNN NND NDM DMR MRF	GILGFVFTL
26190	CAA AAS ASA SAT ATR TRG RGT GTD TDK DKL KLI LIF	GLCTLVAML
5154	CAV AVF VFN FND NDY DYK YKL KLS LSF	AVFDRKSDAK
16936	CAE AEM EME MEG EGG GGS GSY SYI YIP IPT PTF	RAKFKQLL
34059	CAV AVS VSG SGG GGS GSY SYI YIP IPT PTF	KLGGALQAK
35572	CAV AVR VRD RDL DLG LGP GPG PGS GSG SGG GGY GYQ YQK QKV KVT VTF	KLGGALQAK
28407	CAV AVA VAK AKD KDL DLQ LQN QNS NSG SGG GGG GGA GAD ADG DGL GLT LTF	GILGFVFTL
23817	CAA AAS ASV SVV VVS VSG SGG GGS GSN SNY NYK YKL KLT LTF	KLGGALQAK
16942	CAA AAD ADD DDG DGR GRL RLM LMF	RAKFKQLL
34972	CVV VVP VPE PEQ EQA QAD ADR DRG RGS GST STL TLG LGR GRL RLY LYF	KLGGALQAK
33852	CAA AAN ANY NYG YGG GGS GSQ SQG QGN GNL NLI LIF	GILGFVFTL
34809	CAA AAS ASW SWG WGT GTG TGN GNQ NQF QFY FYF	KLGGALQAK
34271	CAM AMS MSR SRL RLE LEG EGD GDK DKL KLI LIF	KLGGALQAK
5576	CAT ATD TDG DGG GGG GGG GGS GSQ SQG QGN GNL NLI LIF	GILGFVFTL
2266	CAV AVR VRT RTR TRN RNS NSG SGN GNT NTP TPL PLV LVF	ELAGIGILTV
159	CAA AAS ASF SFS FSG SGN GNT NTG TGK GKL KLI LIF	KLGGALQAK
34866	CAD ADY DYM YMR MRF	KLGGALQAK
24282	CAA AAS ASE SET ETS TSY SYD YDK DKV KVI VIF	RAKFKQLL
25219	CAF AFM FMK MKR KRL RLG LGN GNQ NQF QFY FYF	KLGGALQAK
34860	CAV AVT VTY TYY YYG YGQ GQN QNF NFV FVF	KLGGALQAK
32884	CAV AVS VSE SEG EGG GGG GGS GSQ SQG QGN GNL NLI LIF	GILGFVFTL
36274	CAV AVR VRL RLH LHN HNY NYG YGQ GQN QNF NFV FVF	KLGGALQAK
32616	CAG AGH GHT HTG TGN GNQ NQF QFY FYF	GILGFVFTL
7668	CAA AAS ASE SET ETS TSY SYD YDK DKV KVI VIF	RAKFKQLL
6637	CAF AFM FMI MIH IHA HAG AGG GGT GTS TSY SYG YGK GKL KLT LTF	GILGFVFTL
36085	CVV VVT VTG TGN GNQ NQF QFY FYF	KLGGALQAK
7371	CAG AGG GGG GGS GSQ SQG QGN GNL NLI LIF	GILGFVFTL
25767	CAR ARE REH EHM HMD MDS DSN SNY NYQ YQL QLI LIW	GILGFVFTL
36122	CAV AVR VRE REP EPY PYG YGQ GQN QNF NFV FVF	KLGGALQAK
36067	CAL ALS LSE SEA EAF AFT FTG TGG GGG GGN GNK NKL KLT LTF	KLGGALQAK
29018	CAL ALQ LQR QRG RGT GTY TYK YKY KYI YIF	KLGGALQAK
35320	CAA AAT ATV TVT VTG TGN GNQ NQF QFY FYF	KLGGALQAK
2275	CAV AVF	KLGGALQAK
35967	CAA AAW AWN WNQ NQG QGG GGK GKL KLI LIF	GILGFVFTL
34025	CAE AEN ENR NRN RNF NFN FNK NKF KFY FYF	KLGGALQAK
34964	CAV AVG VGE GEV EVG VGQ GQK QKL KLL LLF	KLGGALQAK
33858	CAG AGG GGG GGS GSG SGG GGS GSQ SQG QGN GNL NLI LIF	GILGFVFTL
35624	CAL ALS LSE SEA EAL ALG LGG GGR GRR RRA RAL ALT LTF	IVTDFSVIK
5558	CAE AEN ENM NMG MGG GGG GGS GSQ SQG QGN GNL NLI LIF	GILGFVFTL
36324	CAT ATP TPS PSG SGY GYS YST STL TLT LTF	KLGGALQAK
657	CAL ALG LGI GIP IPG PGG GGQ GQK QKL KLL LLF	KLGGALQAK
34463	CPL PLF LFS FSG SGG GGY GYN YNK NKL KLI LIF	KLGGALQAK
13	CAV AVH VHL HLI LIW IWE WEG EGG GGG GGA GAT ATN TNK NKL KLI LIF	GILGFVFTL
33490	CAG AGA GAG AGG GGG GGS GSQ SQG QGN GNL NLI LIF	GILGFVFTL
13820	CAA AAS ASE SET ETS TSY SYD YDK DKV KVI VIF	RAKFKQLL
25716	CGL GLN LNY NYG YGG GGS GSQ SQG QGN GNL NLI LIF	RAKFKQLL
4290	CAT ATE TER ERI RIP IPY PYG YGN GNK NKL KLV LVF	IVTDFSVIK
35016	CAL ALF LFS FSD SDN DNA NAR ARL RLM LMF	KLGGALQAK
35819	CAV AVS VSP SPG PGY GYS YST STL TLT LTF	KLGGALQAK
25696	CAA AAA AAR ARM RMD MDS DSS SSY SYK YKL KLI LIF	RAKFKQLL
35312	CAV AVR VRP RPP PPT PTD TDS DSW SWG WGK GKF KFQ FQF	KLGGALQAK
31679	CAM AMS MSG SGE GEG EGG GGS GSQ SQG QGN GNL NLI LIF	GILGFVFTL
35134	CAM AMR MRE REG EGE GEY EYN YNF NFN FNK NKF KFY FYF	KLGGALQAK
35773	CAS ASD SDS DSN SNN NNA NAG AGN GNM NML MLT LTF	AVFDRKSDAK
2457	CAV AVR VRL RLY LYN YNT NTD TDK DKL KLI LIF	KLGGALQAK
5412	CAV AVN VNS NSF SFG FGT GTG TGN GNT NTG TGK GKL KLI LIF	ELAGIGILTV
35740	CAD ADR DRW RWQ WQF QFY FYF	KLGGALQAK
23127	CAV AVN VNA NAG AGN GNM NML MLT LTF	ELAGIGILTV
18110	CAD ADS DSG SGG GGG GGA GAD ADG DGL GLT LTF	RAKFKQLL
34884	CAA AAS ASD SDG DGG GGA GAT ATN TNK NKL KLI LIF	KLGGALQAK
34244	CAM AMR MRE REG EGS GSQ SQA QAG AGT GTA TAL ALI LIF	KLGGALQAK
6239	CAL ALD LDP DPD PDT DTD TDK DKL KLI LIF	GILGFVFTL
8091	CAV AVS VSD SDR DRA RAG AGN GNM NML MLT LTF	RAKFKQLL
25899	CAD ADS DSG SGG GGG GGA GAD ADG DGL GLT LTF	RAKFKQLL
8106	CIL ILM LME MET ETS TSY SYD YDK DKV KVI VIF	RAKFKQLL
7167	CAG AGA GAL ALG LGS GSS SSN SNT NTG TGK GKL KLI LIF	GILGFVFTL
5655	CAV AVG VGE GES ESS SSA SAS ASK SKI KII IIF	GILGFVFTL
35011	CAV AVR VRS RSN SNF NFN FNK NKF KFY FYF	KLGGALQAK
35139	CAV AVP VPD PDS DSN SNY NYQ YQL QLI LIW	KLGGALQAK
28614	CAV AVL VLP LPS PSY SYN YNQ NQG QGG GGK GKL KLI LIF	KLGGALQAK
25276	CAA AAL ALD LDS DSW SWG WGK GKF KFQ FQF	KLGGALQAK
5374	CAV AVR VRD RDP DPY PYQ YQT QTG TGG GGY GYN YNK NKL KLI LIF	KLGGALQAK
25400	CAT ATF TFG FGN GNE NEK EKL KLT LTF	AVFDRKSDAK
23814	CAV AVR VRV RVG VGD GDM DMR MRF	KLGGALQAK
34088	CAV AVA VAQ AQE QET ETS TSG SGS GSR SRL RLT LTF	KLGGALQAK
35723	CAV AVA VAD ADS DSN SNY NYQ YQL QLI LIW	KLGGALQAK
5279	CVV VVR VRS RST STG TGF GFQ FQK QKL KLV LVF	RAKFKQLL
4976	CAA AAY AYK YKL KLS LSF	RAKFKQLL
2419	CAA AAK AKG KGS GSN SNY NYK YKL KLT LTF	KLGGALQAK
213	CAV AVE VED EDN DNY NYG YGQ GQN QNF NFV FVF	KLGGALQAK
34267	CAL ALS LSA SAR ARF	KLGGALQAK
36052	CAV AVG VGA GAG AGN GNN NND NDM DMR MRF	KLGGALQAK
24696	CAV AVR VRA RAY AYN YNQ NQG QGG GGK GKL KLI LIF	KLGGALQAK
32399	CAY AYM YMA MAN ANA NAG AGG GGT GTS TSY SYG YGK GKL KLT LTF	GILGFVFTL
6254	CAA AAS ASA SAS ASN SNN NNN NND NDM DMR MRF	GILGFVFTL
28380	CAG AGG GGG GGS GSS SSN SNT NTG TGK GKL KLI LIF	GILGFVFTL
35984	CAM AMN MNT NTG TGF GFQ FQK QKL KLV LVF	KLGGALQAK
34991	CAL ALG LGD GDN DNA NAR ARL RLM LMF	KLGGALQAK
23244	CAV AVN VNT NTG TGF GFQ FQK QKL KLV LVF	ELAGIGILTV
34418	CAM AMR MRE REG EGP GPG PGG GGF GFK FKT KTI TIF	KLGGALQAK
10000	CAV AVG VGP GPT PTD TDP DPG PGY GYS YST STL TLT LTF	RAKFKQLL
24598	CAA AAS ASE SET ETS TSY SYD YDK DKV KVI VIF	RAKFKQLL
18240	CAD ADS	RAKFKQLL
5173	CAV AVS VSE SEN ENR NRD RDD DDK DKI KII IIF	GLCTLVAML
35273	CAY AYR YRI RIR IRG RGS GSQ SQG QGN GNL NLI LIF	KLGGALQAK
28439	CAG AGA GAG AGS GSQ SQG QGN GNL NLI LIF	GILGFVFTL
35402	CAV AVD VDR DRS RSG SGG GGS GSN SNY NYK YKL KLT LTF	KLGGALQAK
30089	CAG AGR GRG RGN GNN NNA NAR ARL RLM LMF	GILGFVFTL
36115	CAV AVN VNS NSF SFY FYN YNQ NQG QGG GGK GKL KLI LIF	KLGGALQAK
5592	CAG AGT GTY TYG YGG GGS GSQ SQG QGN GNL NLI LIF	GILGFVFTL
14630	CAD ADS DSG SGG GGG GGA GAD ADG DGL GLT LTF	RAKFKQLL
32362	CAG AGA GAG AGS GSQ SQG QGN GNL NLI LIF	GILGFVFTL
25446	CAS ASF SFY FYN YNQ NQG QGG GGK GKL KLI LIF	GILGFVFTL
30422	CAA AAR ARM RMI MIK IKA KAA AAG AGN GNK NKL KLT LTF	GILGFVFTL
34421	CAV AVR VRV RVG VGS GSG SGN GNT NTG TGK GKL KLI LIF	AVFDRKSDAK
152	CAY AYR YRS RSS SSP SPN PNN NNN NND NDM DMR MRF	RAKFKQLL
25290	CAA AAS ASD SDT DTS TSY SYD YDK DKV KVI VIF	RAKFKQLL
23224	CAV AVK VKG KGI GIQ IQG QGA GAQ AQK QKL KLV LVF	KLGGALQAK
30381	CAA AAS ASF SFY FYN YNQ NQG QGG GGK GKL KLI LIF	GILGFVFTL
15572	CAA AAS ASE SED EDG DGG GGF GFK FKT KTI TIF	RAKFKQLL
23816	CAV AVA VAK AKD KDL DLQ LQN QNS NSG SGG GGG GGA GAD ADG DGL GLT LTF	GILGFVFTL
18058	CAV AVS VSL SLS LSG SGG GGY GYN YNK NKL KLI LIF	KLGGALQAK
2468	CAP APD PDT DTG TGN GNQ NQF QFY FYF	KLGGALQAK
2283	CAV AVR VRD RDI DIA IAS ASG SGT GTY TYK YKY KYI YIF	KLGGALQAK
32595	CAE AEN ENN NNG NGG GGG GGS GSQ SQG QGN GNL NLI LIF	GILGFVFTL
34712	CAA AAR ARI RIY IYN YNT NTD TDK DKL KLI LIF	KLGGALQAK
34862	CIL ILR LRD RDS DSL SLT LTG TGN GNQ NQF QFY FYF	KLGGALQAK
35265	CAE AES ESI SIA IAG AGY GYQ YQK QKV KVT VTF	KLGGALQAK
2239	CVG VGK GKD KDG DGQ GQK QKL KLL LLF	KLGGALQAK
35629	CAA AAY AYN YNQ NQG QGG GGK GKL KLI LIF	AVFDRKSDAK
17298	CAA AAK AKE KEG EGY GYS YST STL TLT LTF	GLCTLVAML
8429	CAL ALS LSE SEA EAG AGG GGM GMG MGG GGG GGA GAD ADG DGL GLT LTF	RAKFKQLL
35342	CAA AAK AKP KPL PLF LFI FIN INE NEK EKL KLT LTF	KLGGALQAK
26525	CAE AEP EPK PKG KGG GGT GTY TYK YKY KYI YIF	GLCTLVAML
11210	CAT ATA TAG AGG GGT GTS TSY SYG YGK GKL KLT LTF	RAKFKQLL
36202	CAV AVR VRP RPR PRG RGD GDT DTG TGR GRR RRA RAL ALT LTF	KLGGALQAK
35391	CVV VVN VNK NKG KGG GGN GNA NAG AGN GNM NML MLT LTF	KLGGALQAK
35153	CAL ALC LCL CLI LIQ IQG QGA GAQ AQK QKL KLV LVF	KLGGALQAK
35294	CVV VVT VTE TEP EPN PNT NTD TDK DKL KLI LIF	KLGGALQAK
2339	CAT ATD TDA DAG AGA GAR ARQ RQG QGG GGS GSE SEK EKL KLV LVF	AVFDRKSDAK
5266	CAL ALS LSG SGG GGS GSN SNY NYK YKL KLT LTF	GILGFVFTL
2247	CAV AVT VTD TDS DSN SNF NFG FGN GNE NEK EKL KLT LTF	KLGGALQAK
35801	CAM AMR MRG RGG GGW GWG WGN GNQ NQG QGG GGK GKL KLI LIF	KLGGALQAK
34938	CAL ALF LFL FLD LDK DKR KRR RRN RNN NNN NND NDM DMR MRF	KLGGALQAK
35252	CAL ALS LSE SEA EAP APY PYG YGG GGS GSQ SQG QGN GNL NLI LIF	KLGGALQAK
34737	CAG AGD GDY DYG YGN GNN NNR NRL RLA LAF	KLGGALQAK
26546	CAV AVN VNQ NQA QAG AGT GTA TAL ALI LIF	KLGGALQAK
34707	CAT ATG TGL GLN LNT NTG TGT GTA TAS ASK SKL KLT LTF	KLGGALQAK
7322	CAV AVR VRR RRD RDG DGN GNK NKL KLV LVF	GILGFVFTL
17890	CAA AAK AKE KEG EGY GYS YST STL TLT LTF	KLGGALQAK
34726	CAR ARG RGN GNA NAG AGN GNM NML MLT LTF	KLGGALQAK
29698	CAM AMR MRE REA EAT ATG TGT GTA TAL ALI LIF	GILGFVFTL
35207	CAI AIG IGP GPG PGN GNM NML MLT LTF	KLGGALQAK
7261	CAV AVN VNT NTG TGG GGF GFK FKT KTI TIF	KLGGALQAK
24996	CAV AVN VNG NGN GNN NNR NRL RLA LAF	RAKFKQLL
28365	CAY AYR YRS RSA SAE AES ESG SGS GSE SEK EKL KLV LVF	KLGGALQAK
27843	CGR GRQ RQM QML MLL LLF LFT FTT TTV TVL VLW LWR WRT RTG TGT GTS TSG SGT GTY TYK YKY KYI YIF	RAKFKQLL
25076	CAL ALS LSE SEA EAT ATG TGN GNQ NQF QFY FYF	KLGGALQAK
26155	CAE AED EDL DLQ LQK QKL KLV LVF	GLCTLVAML
30386	CAF AFM FMT MTG TGA GAG AGG GGT GTS TSY SYG YGK GKL KLT LTF	GILGFVFTL
5073	CAV AVN VNG NGG GGY GYN YNK NKL KLI LIF	KLGGALQAK
23123	CAL ALG LGE GEQ EQY QYD YDG DGQ GQK QKL KLL LLF	KLGGALQAK
23901	CAF AFR FRW RWD WDD DDK DKI KII IIF	KLGGALQAK
25008	CAA AAK AKE KEG EGY GYS YST STL TLT LTF	IVTDFSVIK
35864	CAM AMR MRE REG EGA GAG AGY GYA YAL ALN LNF	KLGGALQAK
34864	CAG AGV GVW VWA WAD ADS DSW SWG WGK GKL KLQ LQF	KLGGALQAK
26135	CSY SYG YGG GGS GSQ SQG QGN GNL NLI LIF	GILGFVFTL
6319	CAV AVG VGG GGG GGG GGG GGS GSQ SQG QGN GNL NLI LIF	GILGFVFTL
694	CAA AAS ASA SAD ADG DGA GAT ATN TNK NKL KLI LIF	KLGGALQAK
35948	CAV AVH VHD HDA DAG AGN GNN NNR NRK RKL KLI LIW	KLGGALQAK
5263	CAG AGS GST STS TSG SGS GSR SRL RLT LTF	KLGGALQAK
15308	CAY AYI YIG IGQ GQG QGG GGS GSE SEK EKL KLV LVF	GILGFVFTL
6304	CAF AFM FMV MVN VNA NAG AGG GGT GTS TSY SYG YGK GKL KLT LTF	GILGFVFTL
16939	CGT GTE TEY EYP YPN PND NDY DYK YKL KLS LSF	GLCTLVAML
31417	CAM AMS MSG SGD GDG DGG GGS GSQ SQG QGN GNL NLI LIF	GILGFVFTL
5490	CAA AAR ARV RVR VRG RGF GFG FGN GNV NVL VLH LHC	AVFDRKSDAK
590	CAV AVR VRT RTS TSY SYD YDK DKV KVI VIF	KLGGALQAK
2326	CAG AGP GPS PSY SYY YYG YGG GGS GSQ SQG QGN GNL NLI LIF	KLGGALQAK
27091	CAG AGQ GQG QGS GSA SAG AGN GNN NNR NRK RKL KLI LIW	KLGGALQAK
4980	CAV AVN VNI NIG IGG GGG GGS GSQ SQG QGN GNL NLI LIF	GILGFVFTL
109	CAV AVR VRP RPD PDK DKL KLI LIF	ELAGIGILTV
28823	CAV AVV VVW VWG WGG GGS GSR SRL RLT LTF	GILGFVFTL
6959	CAV AVN VNT NTP TPP PPF PFY FYF	ELAGIGILTV
26504	CAL ALE LEG EGD GDD DDK DKI KII IIF	KLGGALQAK
36023	CAM AMR MRR RRP RPI PIS ISS SSG SGS GSA SAR ARQ RQL QLT LTF	KLGGALQAK
34665	CAA AAS ASG SGG GGS GSQ SQG QGN GNL NLI LIF	KLGGALQAK
4946	CAV AVI VIA IAD ADT DTG TGG GGF GFK FKT KTI TIF	KLGGALQAK
28734	CAG AGT GTA TAG AGN GNQ NQF QFY FYF	KLGGALQAK
25692	CAA AAK AKE KEG EGY GYS YST STL TLT LTF	RAKFKQLL
11482	CAE AET ETQ TQD QDS DSN SNY NYQ YQL QLI LIW	RAKFKQLL
35937	CAM AMR MRR RRP RPI PIS ISS SSG SGS GSA SAR ARQ RQL QLT LTF	KLGGALQAK
34373	CVV VVM VMQ MQD QDS DSW SWG WGK GKL KLQ LQF	KLGGALQAK
25218	CAE AER ERG RGG GGG GGS GST STL TLG LGR GRL RLY LYF	KLGGALQAK
16947	CAV AVT VTF TFL FLS LSG SGG GGY GYN YNK NKL KLI LIF	KLGGALQAK
6802	CAG AGG GGG GGG GGA GAG AGS GSY SYQ YQL QLT LTF	GILGFVFTL
4130	CAG AGA GAL ALG LGS GSS SSN SNT NTG TGK GKL KLI LIF	IVTDFSVIK
35865	CAA AAS ASR SRE REK EKL KLT LTF	KLGGALQAK
34230	CAV AVG VGL GLG LGF GFG FGN GNV NVL VLH LHC	ELAGIGILTV
26511	CVG VGG GGT GTS TSY SYG YGK GKL KLT LTF	RAKFKQLL
4982	CAF AFL FLG LGG GGS GSY SYI YIP IPT PTF	KLGGALQAK
5677	CAG AGA GAM AMG MGG GGG GGS GSQ SQG QGN GNL NLI LIF	GILGFVFTL
35091	CAS ASF SFS FSS SSG SGS GSA SAR ARQ RQL QLT LTF	KLGGALQAK
24317	CAL ALS LSE SEN ENG NGR GRS RSQ SQG QGN GNL NLI LIF	KLGGALQAK
26148	CAY AYG YGG GGS GSQ SQG QGN GNL NLI LIF	GILGFVFTL
28284	CAM AMT MTF TFS FSG SGG GGS GSN SNY NYK YKL KLT LTF	RAKFKQLL
2382	CAL ALS LSN SNN NND NDM DMR MRF	KLGGALQAK
7034	CAV AVS VSG SGS GSQ SQG QGN GNL NLI LIF	GILGFVFTL
5706	CAG AGA GAE AEG EGS GSS SSN SNT NTG TGK GKL KLI LIF	GILGFVFTL
13910	CAV AVR VRM RMD MDS DSN SNY NYQ YQL QLI LIW	RAKFKQLL
34946	CAG AGV GVN VNS NSN SND NDY DYK YKL KLS LSF	KLGGALQAK
5452	CPR PRQ RQG QGR GRR RRA RAL ALT LTF	KLGGALQAK
35269	CAA AAS ASA SAG AGE GES ESG SGG GGS GSY SYI YIP IPT PTF	KLGGALQAK
5321	CLV LVG VGV GVW VWP WPA PAG AGN GNT NTP TPL PLV LVF	IVTDFSVIK
14672	CAA AAA AAG AGG GGT GTS TSY SYG YGK GKL KLT LTF	KLGGALQAK
35925	CAV AVS VSP SPY PYG YGG GGA GAT ATN TNK NKL KLI LIF	KLGGALQAK
15190	CAY AYS YSP SPA PAA AAG AGG GGT GTS TSY SYG YGK GKL KLT LTF	GILGFVFTL
25910	CAG AGA GAR ARE RET ETS TSY SYD YDK DKV KVI VIF	RAKFKQLL
34628	CAA AAR ARD RDD DDK DKI KII IIF	KLGGALQAK
35736	CAR ARM RMG MGE GES EST STL TLT LTF	KLGGALQAK
34214	CGA GAD ADN DNY NYN YNK NKL KLI LIF	KLGGALQAK
36180	CAV AVY VYY YYG YGD GDK DKL KLI LIF	KLGGALQAK
