25720	CAL ALS LSE SEA EAI AIR IRN RNT NTG TGG GGF GFK FKT KTI TIF	KLGGALQAK
5142	CAT ATE TEG EGA GAS ASG SGG GGS GSY SYI YIP IPT PTF	KLGGALQAK
35032	CAG AGR GRD RDD DDY DYK YKL KLS LSF	KLGGALQAK
31343	CAL ALK LKL KLI LIK IKA KAA AAG AGN GNK NKL KLT LTF	GILGFVFTL
2518	CAL ALS LSE SEA EAN ANT NTG TGN GNQ NQF QFY FYF	KLGGALQAK
81	CAV AVS VSG SGG GGA GAD ADG DGL GLT LTF	ELAGIGILTV
5081	CAR ARE REH EHM HMD MDS DSN SNY NYQ YQL QLI LIW	KLGGALQAK
31652	CAV AVT VTY TYG YGG GGS GSQ SQG QGN GNL NLI LIF	GILGFVFTL
25385	CAR ARG RGG GGG GGF GFK FKT KTI TIF	RAKFKQLL
4322	CGE GEN ENQ NQG QGG GGK GKL KLI LIF	IVTDFSVIK
35390	CAV AVG VGF GFM FMD MDS DSN SNY NYQ YQL QLI LIW	KLGGALQAK
28718	CAG AGP GPG PGS GSN SND NDY DYK YKL KLS LSF	KLGGALQAK
22730	CAL ALT LTG TGG GGG GGA GAD ADG DGL GLT LTF	RAKFKQLL
33589	CAF AFM FMV MVD VDA DAG AGG GGT GTS TSY SYG YGK GKL KLT LTF	GILGFVFTL
33529	CAG AGS GSG SGS GSQ SQG QGN GNL NLI LIF	GILGFVFTL
34620	CAV AVR VRF RFD FDL DLA LAA AAG AGN GNK NKL KLT LTF	KLGGALQAK
17895	CAA AAS ASG SGG GGT GTY TYK YKY KYI YIF	GLCTLVAML
35848	CAL ALS LSE SEA EAM AMN MNN NNA NAG AGN GNM NML MLT LTF	GILGFVFTL
5112	CAM AMS MSY SYT YTG TGN GNQ NQF QFY FYF	KLGGALQAK
31998	CAV AVL VLG LGG GGA GAN ANS NSK SKL KLT LTF	GILGFVFTL
35253	CAR ARH RHF HFN FNK NKF KFY FYF	KLGGALQAK
34150	CAE AET ETL TLT LTY TYN YNQ NQG QGG GGK GKL KLI LIF	KLGGALQAK
34120	CAL ALD LDV DVP VPR PRF	KLGGALQAK
7331	CAM AMR MRE RED EDP DPG PGG GGT GTS TSY SYG YGK GKL KLT LTF	GILGFVFTL
14849	CAV AVG VGE GED EDK DKV KVI VIF	RAKFKQLL
26954	CAM AMR MRE REG EGS GSG SGY GYT YTG TGN GNQ NQF QFY FYF	RAKFKQLL
33530	CAY AYR YRT RTS TSI SIL ILS LSN SNF NFG FGN GNE NEK EKL KLT LTF	GILGFVFTL
18039	CIL ILW LWV WVA VAA AAG AGN GNK NKL KLT LTF	AVFDRKSDAK
31066	CAA AAS ASI SIE IEG EGP GPG PGP GPN PNN NNN NND NDM DMR MRF	GILGFVFTL
34988	CAV AVN VNP NPY PYK YKL KLS LSF	KLGGALQAK
5495	CAF AFY FYT YTG TGN GNQ NQF QFY FYF	KLGGALQAK
34874	CAV AVE VED EDG DGG GGA GAT ATN TNK NKL KLI LIF	KLGGALQAK
7224	CAA AAT ATG TGT GTS TSY SYD YDK DKV KVI VIF	GILGFVFTL
35676	CAG AGQ GQR QRY RYS YST STL TLT LTF	KLGGALQAK
34132	CAV AVA VAS ASG SGN GNT NTP TPL PLV LVF	KLGGALQAK
36247	CAV AVN VNR NRN RNG NGG GGG GGN GNK NKL KLT LTF	KLGGALQAK
94	CAV AVE VEQ EQG QGS GSG SGT GTY TYK YKY KYI YIF	KLGGALQAK
25084	CAG AGA GAS ASG SGG GGG GGS GSQ SQG QGN GNL NLI LIF	GILGFVFTL
42	CAA AAR ARV RVR VRG RGF GFG FGN GNV NVL VLH LHC	AVFDRKSDAK
34401	CVG VGP GPN PNY NYG YGG GGS GSQ SQG QGN GNL NLI LIF	KLGGALQAK
7355	CAD ADS DSG SGG GGG GGA GAD ADG DGL GLT LTF	RAKFKQLL
36158	CAG AGP GPD PDS DSG SGT GTY TYK YKY KYI YIF	KLGGALQAK
34974	CAQ AQT QTG TGA GAN ANN NNL NLF LFF	KLGGALQAK
35594	CIS ISR SRL RLP LPG PGG GGF GFK FKT KTI TIF	KLGGALQAK
35610	CAL ALA LAE AEG EGG GGI GIS ISN SNF NFG FGN GNE NEK EKL KLT LTF	KLGGALQAK
5275	CAA AAA AAR ARM RMD MDS DSS SSY SYK YKL KLI LIF	RAKFKQLL
25727	CAR ARG RGG GGG GGF GFK FKT KTI TIF	KLGGALQAK
23027	CAG AGT GTD TDS DSW SWG WGK GKF KFQ FQF	RAKFKQLL
2328	CAV AVN VND NDY DYK YKL KLS LSF	GILGFVFTL
26505	CAV AVR VRD RDQ DQR QRS RSG SGG GGY GYN YNK NKL KLI LIF	KLGGALQAK
33945	CAG AGA GAG AGS GSQ SQG QGN GNL NLI LIF	GILGFVFTL
124	CAV AVG VGG GGS GSA SAR ARQ RQL QLT LTF	ELAGIGILTV
15302	CAA AAR ARV RVR VRG RGF GFG FGN GNV NVL VLH LHC	AVFDRKSDAK
35129	CAV AVK VKD KDR DRG RGS GST STL TLG LGR GRL RLY LYF	KLGGALQAK
35585	CAL ALS LSE SEA EAF AFG FGS GSG SGN GNT NTP TPL PLV LVF	KLGGALQAK
86	CVV VVL VLG LGV GVM VMD MDS DSN SNY NYQ YQL QLI LIW	GILGFVFTL
24986	CLV LVG VGD GDI DIR IRT RTG TGA GAN ANN NNL NLF LFF	KLGGALQAK
26014	CAA AAS ASI SIN INQ NQG QGG GGK GKL KLI LIF	KLGGALQAK
15794	CAA AAS ASE SET ETS TSY SYD YDK DKV KVI VIF	RAKFKQLL
24358	CAL ALT LTL TLN LNT NTG TGG GGF GFK FKT KTI TIF	KLGGALQAK
28583	CGA GAA AAM AMN MNT NTG TGN GNQ NQF QFY FYF	KLGGALQAK
16944	CAY AYR YRS RSA SAQ AQE QET ETS TSG SGS GSR SRL RLT LTF	ELAGIGILTV
36105	CAV AVN VNS NSG SGY GYG YGG GGA GAT ATN TNK NKL KLI LIF	KLGGALQAK
35236	CAA AAR ARI RIT ITG TGT GTA TAS ASK SKL KLT LTF	KLGGALQAK
18663	CAV AVG VGA GAA AAG AGG GGF GFK FKT KTI TIF	RAKFKQLL
26558	CAD ADH DHN HNA NAR ARL RLM LMF	RAKFKQLL
34297	CAM AMS MSA SAT ATR TRG RGG GGG GGA GAD ADG DGL GLT LTF	KLGGALQAK
23012	CVV VVS VSA SAD ADG DGG GGG GGA GAD ADG DGL GLT LTF	KLGGALQAK
23962	CAM AMR MRE REG EGQ GQA QAG AGQ GQK QKL KLL LLF	RAKFKQLL
36289	CIL ILN LNY NYG YGG GGS GSQ SQG QGN GNL NLI LIF	KLGGALQAK
34016	CAE AER ERA RAS AST STD TDS DSW SWG WGK GKL KLQ LQF	KLGGALQAK
624	CAM AMS MSG SGH GHN HNQ NQG QGG GGK GKL KLI LIF	KLGGALQAK
3952	CIL ILW LWV WVA VAA AAG AGN GNK NKL KLT LTF	IVTDFSVIK
34033	CAY AYG YGT GTS TSY SYD YDK DKV KVI VIF	KLGGALQAK
35164	CAV AVY VYG YGG GGS GSQ SQG QGN GNL NLI LIF	KLGGALQAK
5178	CAV AVG VGS GSG SGA GAG AGS GSY SYQ YQL QLT LTF	RAKFKQLL
25273	CAE AET ETE TET ETS TSY SYD YDK DKV KVI VIF	RAKFKQLL
5018	CAG AGV GVS VSG SGG GGS GSY SYI YIP IPT PTF	KLGGALQAK
36078	CAE AES EST STT TTD TDK DKL KLI LIF	IVTDFSVIK
24036	CAD ADS DSG SGG GGG GGA GAD ADG DGL GLT LTF	RAKFKQLL
275	CAT ATG TGS GSM SME MEY EYG YGN GNK NKL KLV LVF	IVTDFSVIK
2312	CAL ALS LSR SRN RND NDY DYK YKL KLS LSF	KLGGALQAK
14561	CAV AVT VTH THT HTG TGG GGF GFK FKT KTI TIF	RAKFKQLL
34799	CAA AAS ASP SPF	KLGGALQAK
25378	CAL ALL LLN LNR NRD RDD DDK DKI KII IIF	RAKFKQLL
2348	CIV IVR VRV RVA VAN ANT NTD TDK DKL KLI LIF	GILGFVFTL
35889	CAF AFM FMN MNY NYG YGG GGS GSQ SQG QGN GNL NLI LIF	KLGGALQAK
7280	CAG AGG GGG GGS GSQ SQG QGN GNL NLI LIF	GILGFVFTL
28307	CGA GAD ADG DGG GGG GGT GTY TYK YKY KYI YIF	RAKFKQLL
2577	CIL ILQ LQE QET ETS TSG SGS GSR SRL RLT LTF	KLGGALQAK
28680	CAG AGM GMD MDS DSS SSY SYK YKL KLI LIF	KLGGALQAK
34783	CVV VVK VKT KTD TDN DNA NAG AGN GNM NML MLT LTF	KLGGALQAK
5270	CAV AVN VNR NRG RGY GYS YST STL TLT LTF	KLGGALQAK
31890	CAG AGG GGD GDG DGG GGS GSQ SQG QGN GNL NLI LIF	GILGFVFTL
34196	CAW AWG WGG GGG GGK GKL KLI LIF	KLGGALQAK
27723	CAM AMS MSG SGS GSG SGG GGS GSN SNY NYK YKL KLT LTF	RAKFKQLL
2580	CAG AGH GHT HTG TGN GNQ NQF QFY FYF	IVTDFSVIK
35833	CAV AVN VNQ NQA QAG AGT GTA TAL ALI LIF	KLGGALQAK
7079	CAG AGH GHQ HQG QGN GNN NNA NAG AGN GNM NML MLT LTF	KLGGALQAK
31434	CAM AMR MRE REG EGG GGG GGS GSQ SQG QGN GNL NLI LIF	GILGFVFTL
15702	CAY AYR YRS RSD SDS DSG SGT GTY TYK YKY KYI YIF	RAKFKQLL
36176	CAY AYE YEG EGG GGA GAQ AQK QKL KLV LVF	KLGGALQAK
25029	CIV IVM VMD MDD DDF DFQ FQK QKL KLV LVF	RAKFKQLL
23240	CAV AVG VGT GTA TAR ARL RLM LMF	RAKFKQLL
16659	CAE AEM EME MEG EGG GGN GNY NYI YIP IPT PTF	RAKFKQLL
5079	CAM AMM MMN MNT NTG TGF GFQ FQK QKL KLV LVF	KLGGALQAK
25053	CAV AVS VSL SLS LSG SGG GGY GYN YNK NKL KLI LIF	RAKFKQLL
23071	CAL ALV LVT VTF TFT FTG TGG GGG GGN GNK NKL KLT LTF	GILGFVFTL
23823	CAT ATG TGY GYN YNN NNA NAG AGN GNM NML MLT LTF	KLGGALQAK
8437	CAY AYG YGG GGS GSQ SQG QGN GNL NLI LIF	RAKFKQLL
28305	CVV VVN VNG NGA GAG AGN GNM NML MLT LTF	KLGGALQAK
16934	CAA AAS ASE SET ETS TSY SYD YDK DKV KVI VIF	RAKFKQLL
23907	CAA AAI AIS ISG SGA GAG AGS GSY SYQ YQL QLT LTF	RAKFKQLL
36183	CAL ALE LEG EGF GFP FPN PNY NYK YKY KYI YIF	AVFDRKSDAK
36130	CAV AVN VNW NWE WEE EEQ EQG QGG GGS GSY SYI YIP IPT PTF	KLGGALQAK
34729	CAV AVW VWT WTG TGM GMD MDS DSN SNY NYQ YQL QLI LIW	KLGGALQAK
34085	CAM AMS MSA SAT ATA TAG AGG GGT GTS TSY SYG YGK GKL KLT LTF	KLGGALQAK
34278	CAV AVR VRA RAN AND NDY DYK YKL KLS LSF	GILGFVFTL
6996	CAV AVS VSK SKT KTG TGN GNK NKL KLV LVF	GILGFVFTL
34473	CAT ATD TDA DAD ADY DYG YGG GGS GSQ SQG QGN GNL NLI LIF	KLGGALQAK
28300	CAD ADS DSG SGG GGG GGA GAD ADG DGL GLT LTF	RAKFKQLL
33526	CAV AVN VNA NAG AGG GGG GGS GSQ SQG QGN GNL NLI LIF	GILGFVFTL
34237	CAV AVS VSE SEG EGN GNF NFN FNK NKF KFY FYF	KLGGALQAK
31081	CAF AFM FMV MVG VGA GAG AGG GGT GTS TSY SYG YGK GKL KLT LTF	GILGFVFTL
34928	CAV AVD VDS DSA SAG AGA GAQ AQK QKL KLV LVF	KLGGALQAK
25222	CGA GAD ADS DSA SAS ASG SGT GTY TYK YKY KYI YIF	RAKFKQLL
36119	CGG GGS GSN SNY NYK YKL KLT LTF	KLGGALQAK
23896	CAD ADS DSG SGG GGG GGA GAD ADG DGL GLT LTF	RAKFKQLL
32594	CAA AAR ARE REE EEG EGD GDA DAR ARL RLM LMF	GILGFVFTL
5157	CLV LVG VGD GDM DMR MRS RSG SGA GAG AGS GSY SYQ YQL QLT LTF	KLGGALQAK
26147	CVV VVT VTE TET ETS TSY SYD YDK DKV KVI VIF	RAKFKQLL
7310	CAF AFM FMK MKG KGA GAG AGG GGT GTS TSY SYG YGK GKL KLT LTF	GILGFVFTL
31633	CAS ASF SFT FTG TGG GGG GGN GNK NKL KLT LTF	GILGFVFTL
18230	CAD ADP DPG PGG GGG GGA GAD ADG DGL GLT LTF	RAKFKQLL
35155	CAG AGL GLG LGS GSY SYQ YQL QLT LTF	KLGGALQAK
25011	CAL ALR LRP RPA PAV AVG VGN GNQ NQG QGG GGK GKL KLI LIF	IVTDFSVIK
25439	CAG AGE GEG EGN GNN NNN NND NDM DMR MRF	RAKFKQLL
21614	CAT ATV TVD VDL DLM LMN MNY NYG YGG GGS GSQ SQG QGN GNL NLI LIF	RAKFKQLL
7672	CAA AAS ASE SET ETS TSY SYD YDK DKV KVI VIF	RAKFKQLL
28933	CAG AGT GTY TYG YGG GGS GSQ SQG QGN GNL NLI LIF	GILGFVFTL
32002	CAV AVD VDM DMA MAG AGG GGS GSQ SQG QGN GNL NLI LIF	GILGFVFTL
24716	CAA AAS ASE SEG EGG GGF GFK FKT KTI TIF	RAKFKQLL
28879	CAE AES ESE SEG EGP GPT PTY TYT YTD TDK DKL KLI LIF	RAKFKQLL
23356	CAD ADS DSG SGG GGG GGA GAD ADG DGL GLT LTF	RAKFKQLL
5233	CLV LVG VGD GDS DSW SWG WGK GKL KLQ LQF	KLGGALQAK
25441	CAA AAS ASE SET ETS TSY SYD YDK DKV KVI VIF	RAKFKQLL
13853	CGS GSG SGT GTY TYK YKY KYI YIF	RAKFKQLL
28851	CAA AAM AME MET ETS TSY SYD YDK DKV KVI VIF	RAKFKQLL
83	CAM AMS MSS SSY SYS YSG SGN GNT NTG TGK GKL KLI LIF	RAKFKQLL
2360	CAA AAS ASI	ELAGIGILTV
0	CAF AFM FMI MIN INA NAG AGG GGT GTS TSY SYG YGK GKL KLT LTF	GILGFVFTL
34431	CAV AVR VRD RDL DLD LDS DSN SNY NYQ YQL QLI LIW	KLGGALQAK
18115	CAD ADS DSG SGG GGG GGA GAD ADG DGL GLT LTF	RAKFKQLL
5378	CAA AAS ASA SAP APG PGS GSA SAR ARQ RQL QLT LTF	KLGGALQAK
35061	CAL ALS LSE SED EDN DNY NYG YGQ GQN QNF NFV FVF	KLGGALQAK
5180	CAL ALR LRD RDD DDK DKI KII IIF	KLGGALQAK
243	CAV AVM VMD MDG DGQ GQK QKL KLL LLF	GILGFVFTL
31555	CAD ADE DES ESG SGG GGS GSQ SQG QGN GNL NLI LIF	RAKFKQLL
29776	CAE AEM EME MEG EGG GGS GSY SYI YIP IPT PTF	GILGFVFTL
2477	CAV AVG VGD GDN DNF NFN FNK NKF KFY FYF	AVFDRKSDAK
7158	CAR ARA RAT ATN TND NDY DYK YKL KLS LSF	GILGFVFTL
36005	CAF AFI FIG IGD GDA DAG AGG GGT GTS TSY SYG YGK GKL KLT LTF	KLGGALQAK
35881	CIV IVR VRD RDE DEI EIK IKA KAA AAG AGN GNK NKL KLT LTF	KLGGALQAK
6598	CAA AAS ASG SGG GGG GGS GSQ SQG QGN GNL NLI LIF	GILGFVFTL
40	CAL ALD LDR DRA RAG AGN GNN NNR NRK RKL KLI LIW	GILGFVFTL
34257	CAM AMR MRF RFQ FQG QGA GAQ AQK QKL KLV LVF	KLGGALQAK
34298	CAV AVN VNG NGR GRD RDR DRG RGT GTS TSY SYG YGK GKL KLT LTF	KLGGALQAK
34909	CAV AVA VAN ANY NYG YGG GGA GAT ATN TNK NKL KLI LIF	KLGGALQAK
24590	CAV AVS VSD SDM DME MEY EYG YGN GNK NKL KLV LVF	RAKFKQLL
24382	CAD ADS DSG SGG GGG GGA GAD ADG DGL GLT LTF	RAKFKQLL
8654	CVV VVR VRN RNM NMN MNT NTG TGF GFQ FQK QKL KLV LVF	RAKFKQLL
35621	CAM AMS MSD SDS DSN SNY NYQ YQL QLI LIW	KLGGALQAK
34136	CAE AEK EKR KRN RND NDY DYK YKL KLS LSF	KLGGALQAK
35958	CAV AVN VNG NGG GGT GTG TGR GRR RRA RAL ALT LTF	KLGGALQAK
35907	CAL ALS LSE SEA EAF AFS FSG SGN GNT NTP TPL PLV LVF	KLGGALQAK
6162	CAV AVR VRD RDG DGT GTG TGA GAN ANN NNL NLF LFF	GILGFVFTL
219	CAA AAS ASA SAG AGT GTY TYK YKY KYI YIF	KLGGALQAK
7074	CAG AGG GGG GGQ GQG QGG GGS GSQ SQG QGN GNL NLI LIF	GILGFVFTL
25299	CAA AAA AAE AET ETS TSY SYD YDK DKV KVI VIF	RAKFKQLL
35166	CAA AAT ATT TTN TNT NTG TGF GFQ FQK QKL KLV LVF	KLGGALQAK
25294	CAF AFM FMR MRG RGR GRG RGK GKL KLT LTF	KLGGALQAK
36272	CAV AVD VDL DLM LMK MKT KTS TSY SYD YDK DKV KVI VIF	IVTDFSVIK
957	CAA AAP APR PRG RGG GGQ GQN QNF NFV FVF	AVFDRKSDAK
185	CAV AVR VRQ RQN QNF NFV FVF	ELAGIGILTV
25462	CAA AAS ASE SET ETS TSY SYD YDK DKV KVI VIF	RAKFKQLL
35095	CAL ALS LSE SEL ELN LNY NYG YGG GGS GSQ SQG QGN GNL NLI LIF	KLGGALQAK
26556	CIV IVR VRE REG EGD GDR DRD RDD DDK DKI KII IIF	RAKFKQLL
5136	CAA AAD ADD DDG DGR GRL RLM LMF	RAKFKQLL
18072	CAL ALR LRE RET ETS TSY SYD YDK DKV KVI VIF	RAKFKQLL
34720	CAV AVR VRP RPR PRM RMD MDS DSS SSY SYK YKL KLI LIF	KLGGALQAK
5550	CAV AVN VNL NLG LGG GGG GGS GSQ SQG QGN GNL NLI LIF	GILGFVFTL
5959	CAG AGA GAG AGN GNT NTG TGK GKL KLI LIF	GILGFVFTL
24463	CAV AVH VHG HGY GYG YGQ GQN QNF NFV FVF	RAKFKQLL
187	CAV AVK VKG KGG GGG GGA GAD ADG DGL GLT LTF	ELAGIGILTV
36310	CAV AVN VNQ NQG QGR GRA RAL ALT LTF	ELAGIGILTV
15289	CAD ADE DEG EGE GEG EGG GGG GGA GAD ADG DGL GLT LTF	RAKFKQLL
23128	CAG AGN GNS NSG SGA GAG AGS GSY SYQ YQL QLT LTF	KLGGALQAK
24699	CAA AAP APG PGG GGG GGG GGS GSQ SQG QGN GNL NLI LIF	GILGFVFTL
34064	CAL ALS LSE SEA EAG AGG GGS GSG SGA GAG AGS GSY SYQ YQL QLT LTF	KLGGALQAK
34367	CAM AMR MRE REN ENN NNY NYG YGQ GQN QNF NFV FVF	KLGGALQAK
7243	CAM AMT MTR TRS RSN SNT NTG TGN GNQ NQF QFY FYF	IVTDFSVIK
38425	CAG AGE GEG EGS GSG SGG GGG GGA GAD ADG DGL GLT LTF	KLGGALQAK
35985	CAV AVR VRH RHS HSG SGG GGY GYN YNK NKL KLI LIF	KLGGALQAK
2318	CAV AVR VRS RSS SSG SGG GGS GSY SYI YIP IPT PTF	KLGGALQAK
36249	CAS ASG SGL GLF LFG FGN GNE NEK EKL KLT LTF	KLGGALQAK
5599	CAA AAN ANY NYG YGG GGS GSQ SQG QGN GNL NLI LIF	GILGFVFTL
215	CAA AAT ATL TLT LTG TGN GNQ NQF QFY FYF	GILGFVFTL
34595	CAM AMR MRE REP EPA PAN ANM NMN MNY NYG YGG GGS GSQ SQG QGN GNL NLI LIF	KLGGALQAK
21464	CAG AGT GTG TGN GNT NTG TGK GKL KLI LIF	RAKFKQLL
35639	CAG AGQ GQG QGN GNY NYG YGQ GQN QNF NFV FVF	KLGGALQAK
583	CAV AVP VPN PNS NSG SGG GGG GGA GAD ADG DGL GLT LTF	ELAGIGILTV
28369	CAD ADS DSG SGG GGG GGA GAD ADG DGL GLT LTF	RAKFKQLL
35993	CAE AEN ENL NLV LVL VLN LNT NTD TDK DKL KLI LIF	KLGGALQAK
35321	CAV AVN VNS NSG SGA GAN ANN NNL NLF LFF	KLGGALQAK
24322	CAA AAK AKE KEG EGY GYS YST STL TLT LTF	RAKFKQLL
25112	CAG AGA GAG AGS GSQ SQG QGN GNL NLI LIF	GILGFVFTL
35266	CLV LVV VVI VIL ILT LTG TGG GGG GGN GNK NKL KLT LTF	KLGGALQAK
6092	CAG AGP GPY PYN YNQ NQG QGG GGK GKL KLI LIF	GILGFVFTL
35058	CAV AVD VDV DVT VTG TGA GAG AGS GSY SYQ YQL QLT LTF	KLGGALQAK
28463	CAE AER ERG RGY GYS YST STL TLT LTF	KLGGALQAK
7360	CAV AVS VSA SAA AAS ASG SGG GGS GSY SYI YIP IPT PTF	RAKFKQLL
35635	CAV AVW VWY WYM YMR MRF	KLGGALQAK
34469	CLV LVG VGD GDI DIN INT NTG TGG GGF GFK FKT KTI TIF	KLGGALQAK
35847	CAE AES EST STL TLD LDT DTG TGG GGF GFK FKT KTI TIF	KLGGALQAK
34715	CAV AVP VPT PTS TSG SGT GTY TYK YKY KYI YIF	KLGGALQAK
29702	CVV VVE VES ESG SGG GGS GSY SYI YIP IPT PTF	GILGFVFTL
27746	CAE AEN ENG NGG GGG GGG GGA GAD ADG DGL GLT LTF	RAKFKQLL
34908	CAA AAP APG PGN GNT NTP TPL PLV LVF	KLGGALQAK
35852	CAV AVR VRE REY EYG YGN GNK NKL KLV LVF	KLGGALQAK
34532	CAV AVK VKG KGH GHA HAG AGK GKS KST STF	KLGGALQAK
16265	CAD ADS DSG SGG GGG GGA GAD ADG DGL GLT LTF	RAKFKQLL
35726	CAV AVN VNA NAG AGS GSQ SQG QGN GNL NLI LIF	KLGGALQAK
32520	CAV AVN VNG NGG GGG GGG GGS GSQ SQG QGN GNL NLI LIF	GILGFVFTL
2333	CAV AVN VNL NLA LAG AGG GGT GTS TSY SYG YGK GKL KLT LTF	ELAGIGILTV
34225	CAE AEA EAG AGG GGG GGA GAD ADG DGL GLT LTF	KLGGALQAK
33552	CAL ALD LDM DMG MGG GGG GGS GSQ SQG QGN GNL NLI LIF	GILGFVFTL
35332	CAM AMR MRG RGL GLD LDS DSN SNY NYQ YQL QLI LIW	KLGGALQAK
2533	CAL ALG LGE GEP EPP PPI PII IIQ IQG QGA GAQ AQK QKL KLV LVF	RAKFKQLL
33985	CAE AES EST STP TPN PNS NSG SGY GYA YAL ALN LNF	KLGGALQAK
2391	CAV AVS VSD SDN DNN NNA NAR ARL RLM LMF	KLGGALQAK
15046	CAA AAK AKE KEG EGY GYS YST STL TLT LTF	RAKFKQLL
36271	CAV AVN VNP NPG PGG GGY GYN YNK NKL KLI LIF	KLGGALQAK
35182	CAV AVQ VQA QAG AGI GIK IKA KAA AAG AGN GNK NKL KLT LTF	KLGGALQAK
34833	CLV LVG VGD GDI DIA IAA AAG AGK GKS KST STF	KLGGALQAK
200	CAV AVW VWS WSY SYG YGG GGS GSQ SQG QGN GNL NLI LIF	KLGGALQAK
23020	CAS ASG SGG GGS GSQ SQG QGN GNL NLI LIF	GILGFVFTL
34584	CAV AVS VSG SGG GGG GGA GAD ADG DGL GLT LTF	KLGGALQAK
5127	CAE AET ETN TNQ NQL QLY LYS YST STL TLT LTF	KLGGALQAK
34209	CVV VVD VDL DLG LGG GGF GFK FKT KTI TIF	KLGGALQAK
31476	CAG AGQ GQE QEG EGQ GQN QNF NFV FVF	GILGFVFTL
24290	CAV AVV VVG VGT GTG TGN GNQ NQF QFY FYF	GLCTLVAML
35590	CIV IVM VMG MGY GYS YST STL TLT LTF	KLGGALQAK
34423	CAV AVR VRY RYG YGA GAG AGS GSY SYQ YQL QLT LTF	KLGGALQAK
35125	CAV AVN VNI NIN INQ NQA QAG AGT GTA TAL ALI LIF	KLGGALQAK
34758	CVV VVN VNR NRR RRY RYP YPG PGN GNQ NQF QFY FYF	KLGGALQAK
35145	CAL ALS LSE SET ETD TDA DAG AGN GNM NML MLT LTF	KLGGALQAK
14677	CAM AMS MSG SGD GDG DGG GGS GSQ SQG QGN GNL NLI LIF	GILGFVFTL
3053	CAV AVK VKA KAG AGY GYA YAL ALN LNF	IVTDFSVIK
5050	CAV AVS VSD SDD DDK DKI KII IIF	RAKFKQLL
35604	CAV AVR VRD RDS DSG SGT GTY TYK YKY KYI YIF	KLGGALQAK
34112	CAL ALS LSV SVA VAA AAG AGN GNK NKL KLT LTF	KLGGALQAK
15323	CAF AFL FLG LGG GGA GAN ANN NNL NLF LFF	KLGGALQAK
35765	CAY AYR YRS RSA SAL ALY LYE YEG EGG GGS GSE SEK EKL KLV LVF	KLGGALQAK
34836	CIV IVA VAG AGG GGT GTS TSY SYG YGK GKL KLT LTF	KLGGALQAK
26537	CAL ALS LSE SES ESN SNS NSG SGN GNT NTP TPL PLV LVF	GLCTLVAML
2531	CAA AAT ATP TPY PYN YNT NTD TDK DKL KLI LIF	KLGGALQAK
6091	CAA AAD ADN DNY NYG YGG GGS GSQ SQG QGN GNL NLI LIF	GILGFVFTL
35072	CAG AGH GHV HVF VFG FGN GNE NEK EKL KLT LTF	KLGGALQAK
34610	CAA AAS ASP SPG PGQ GQN QNF NFV FVF	KLGGALQAK
23371	CAY AYR YRV RVD VDN DNA NAR ARL RLM LMF	KLGGALQAK
2411	CAA AAS ASP SPF PFS FSG SGA GAG AGS GSY SYQ YQL QLT LTF	KLGGALQAK
33499	CAS ASN SNY NYG YGG GGS GSQ SQG QGN GNL NLI LIF	GILGFVFTL
14621	CAR ARS RSG SGA GAG AGS GSY SYQ YQL QLT LTF	KLGGALQAK
35186	CAE AEN ENR NRS RSG SGA GAG AGS GSY SYQ YQL QLT LTF	KLGGALQAK
35913	CAL ALS LSE SEP EPR PRS RSG SGN GNT NTP TPL PLV LVF	KLGGALQAK
102	CAV AVA VAS ASY SYN YNQ NQG QGG GGK GKL KLI LIF	KLGGALQAK
5183	CAG AGA GAH AHG HGS GSS SSN SNT NTG TGK GKL KLI LIF	GILGFVFTL
34936	CAV AVT VTG TGY GYS YSN SNS NSG SGY GYA YAL ALN LNF	KLGGALQAK
35743	CAV AVR VRR RRS RSN SND NDY DYK YKL KLS LSF	KLGGALQAK
2261	CAV AVK VKD KDS DSN SNY NYQ YQL QLI LIW	RAKFKQLL
34337	CAV AVG VGT GTT TTY TYG YGN GNN NNR NRL RLA LAF	KLGGALQAK
25436	CAA AAS ASE SET ETS TSY SYD YDK DKV KVI VIF	RAKFKQLL
34678	CAM AMR MRL RLG LGY GYS YST STL TLT LTF	KLGGALQAK
35836	CAA AAV AVT VTN TND NDY DYK YKL KLS LSF	KLGGALQAK
31745	CAY AYR YRS RSQ SQQ QQG QGG GGS GSE SEK EKL KLV LVF	GILGFVFTL
17956	CAE AEW EWG WGS GSG SGN GNT NTG TGK GKL KLI LIF	KLGGALQAK
8622	CIV IVM VMD MDD DDF DFQ FQK QKL KLV LVF	RAKFKQLL
34426	CAY AYS YSG SGN GNT NTP TPL PLV LVF	AVFDRKSDAK
11726	CAV AVT VTA TAY AYN YNT NTD TDK DKL KLI LIF	RAKFKQLL
35251	CAA AAR ARY RYS YSG SGN GNT NTP TPL PLV LVF	KLGGALQAK
35443	CAV AVN VNG NGG GGS GSQ SQG QGN GNL NLI LIF	KLGGALQAK
3646	CAG AGG GGN GNT NTG TGK GKL KLI LIF	IVTDFSVIK
114	CAV AVR VRG RGT GTG TGG GGG GGN GNK NKL KLT LTF	KLGGALQAK
2466	CAT ATR TRD RDD DDK DKI KII IIF	AVFDRKSDAK
5473	CAE AEN ENG NGG GGG GGG GGA GAD ADG DGL GLT LTF	KLGGALQAK
30425	CAP APF PFT FTG TGY GYQ YQK QKV KVT VTF	GILGFVFTL
24635	CAA AAS ASD SDG DGG GGS GSN SNY NYK YKL KLT LTF	RAKFKQLL
35234	CAV AVR VRD RDT DTG TGG GGG GGS GSY SYI YIP IPT PTF	KLGGALQAK
34400	CAV AVR VRP RPG PGY GYA YAL ALN LNF	KLGGALQAK
5219	CAQ AQT QTG TGA GAN ANN NNL NLF LFF	KLGGALQAK
5078	CAV AVG VGD GDN DNF NFN FNK NKF KFY FYF	AVFDRKSDAK
263	CAA AAS ASG SGR GRV RVS VSG SGG GGS GSN SNY NYK YKL KLT LTF	KLGGALQAK
18088	CAL ALL LLE LEM EMV MVI VIK IKA KAA AAG AGN GNK NKL KLT LTF	RAKFKQLL
3105	CAV AVQ VQD QDS DSN SNY NYQ YQL QLI LIW	IVTDFSVIK
35293	CAV AVS VSG SGP GPE PEM EME MEY EYG YGN GNK NKL KLV LVF	KLGGALQAK
5034	CAL ALG LGD GDS DSG SGA GAG AGS GSY SYQ YQL QLT LTF	KLGGALQAK
34305	CAI AIM IMD MDS DSN SNY NYQ YQL QLI LIW	KLGGALQAK
16957	CVV VVT VTE TET ETS TSY SYD YDK DKV KVI VIF	RAKFKQLL
35893	CAA AAS ASA SAS ASS SSS SSR SRL RLT LTF	KLGGALQAK
25704	CAA AAV AVE VET ETS TSY SYD YDK DKV KVI VIF	RAKFKQLL
18073	CAD ADS DSG SGG GGG GGA GAD ADG DGL GLT LTF	AVFDRKSDAK
26262	CIL ILR LRD RDS DSN SND NDY DYK YKL KLS LSF	KLGGALQAK
635	CAM AMR MRE REP EPN PNY NYG YGQ GQN QNF NFV FVF	RAKFKQLL
23964	CAV AVG VGD GDN DNF NFN FNK NKF KFY FYF	RAKFKQLL
34219	CAA AAS ASV SVS VSN SNY NYG YGQ GQN QNF NFV FVF	KLGGALQAK
26615	CAA AAK AKE KEG EGG GGS GSE SEK EKL KLV LVF	RAKFKQLL
5392	CAA AAD ADN DNY NYG YGG GGS GSQ SQG QGN GNL NLI LIF	GILGFVFTL
34454	CAA AAS ASV SVG VGG GGG GGA GAD ADG DGL GLT LTF	KLGGALQAK
34740	CAF AFL FLS LSG SGS GSA SAR ARQ RQL QLT LTF	KLGGALQAK
8896	CAF AFM FMK MKG KGA GAG AGG GGT GTS TSY SYG YGK GKL KLT LTF	RAKFKQLL
12455	CAA AAS ASI SIP IPN PNQ NQA QAG AGT GTA TAL ALI LIF	RAKFKQLL
6237	CAF AFM FMS MSN SNA NAG AGG GGT GTS TSY SYG YGK GKL KLT LTF	GILGFVFTL
31363	CAG AGT GTI TIA IAG AGG GGS GSQ SQG QGN GNL NLI LIF	GILGFVFTL
34985	CAV AVG VGR GRN RNN NNN NNA NAR ARL RLM LMF	KLGGALQAK
34220	CAV AVN VNA NAE AEG EGS GSG SGN GNT NTG TGK GKL KLI LIF	KLGGALQAK
35651	CVV VVT VTL TLL LLS LSG SGG GGY GYN YNK NKL KLI LIF	KLGGALQAK
24592	CAP APW PWG WGF GFN FNK NKF KFY FYF	RAKFKQLL
17955	CAV AVA VAK AKD KDL DLQ LQN QNS NSG SGG GGG GGA GAD ADG DGL GLT LTF	GILGFVFTL
24684	CAG AGA GAG AGN GNT NTG TGK GKL KLI LIF	GILGFVFTL
34394	CAM AMR MRE REM EMM MMT MTT TTD TDS DSW SWG WGK GKL KLQ LQF	KLGGALQAK
5653	CAV AVN VNA NAG AGG GGG GGS GSQ SQG QGN GNL NLI LIF	GILGFVFTL
4944	CAL ALS LSD SDP DPQ PQR QRN RNY NYG YGQ GQN QNF NFV FVF	KLGGALQAK
34913	CAT ATD TDR DRG RGG GGK GKL KLT LTF	KLGGALQAK
27291	CAD ADS DSG SGG GGG GGA GAD ADG DGL GLT LTF	RAKFKQLL
2235	CAV AVN VNT NTY TYS YSG SGA GAG AGS GSY SYQ YQL QLT LTF	ELAGIGILTV
14187	CAM AMR MRE REG EGQ GQG QGG GGG GGF GFK FKT KTI TIF	KLGGALQAK
5169	CAG AGG GGG GGS GSQ SQG QGN GNL NLI LIF	GILGFVFTL
35229	CAV AVE VEQ EQF QFT FTT TTS TSG SGT GTY TYK YKY KYI YIF	KLGGALQAK
2230	CAM AME MEA EAG AGG GGY GYQ YQK QKV KVT VTF	KLGGALQAK
34075	CAA AAT ATR TRY RYN YNN NNN NND NDM DMR MRF	KLGGALQAK
35681	CAL ALS LSD SDF DFN FND NDY DYK YKL KLS LSF	KLGGALQAK
35694	CAY AYG YGD GDS DSN SNY NYQ YQL QLI LIW	KLGGALQAK
34569	CAI AIP IPS PSG SGG GGT GTA TAS ASK SKL KLT LTF	KLGGALQAK
13977	CAA AAS ASE SET ETS TSY SYD YDK DKV KVI VIF	RAKFKQLL
17863	CAL ALS LSE SEG EGV GVG VGK GKL KLI LIF	KLGGALQAK
35412	CAG AGG GGG GGG GGD GDS DSN SNY NYQ YQL QLI LIW	KLGGALQAK
25717	CAA AAT ATE TET ETS TSY SYD YDK DKV KVI VIF	RAKFKQLL
14247	CAF AFL FLG LGG GGA GAN ANN NNL NLF LFF	KLGGALQAK
23965	CAL ALL LLN LNR NRD RDD DDK DKI KII IIF	RAKFKQLL
35970	CAT ATG TGT GTG TGN GNQ NQF QFY FYF	KLGGALQAK
34234	CAH AHQ HQG QGD GDS DSN SNY NYQ YQL QLI LIW	KLGGALQAK
5391	CAA AAR ARD RDD DDK DKI KII IIF	KLGGALQAK
34086	CAM AMS MSD SDS DSN SNY NYQ YQL QLI LIW	KLGGALQAK
33991	CAV AVR VRP RPP PPN PNG NGQ GQN QNF NFV FVF	KLGGALQAK
7234	CAS ASV SVG VGM GMD MDS DSS SSY SYK YKL KLI LIF	KLGGALQAK
6552	CAT ATD TDG DGG GGG GGG GGS GSQ SQG QGN GNL NLI LIF	GILGFVFTL
28246	CAT ATD TDA DAS ASG SGG GGN GNN NNY NYK YKL KLT LTF	RAKFKQLL
34238	CVG VGR GRK RKG KGS GSA SAR ARQ RQL QLT LTF	KLGGALQAK
2520	CAM AMR MRE REG EGG GGS GSG SGA GAT ATN TNK NKL KLI LIF	KLGGALQAK
34949	CAA AAI AIR IRH RHG HGN GNQ NQF QFY FYF	KLGGALQAK
38423	CAV AVK VKG KGI GIT ITG TGG GGG GGN GNK NKL KLT LTF	KLGGALQAK
189	CAV AVK VKG KGD GDD DDK DKI KII IIF	ELAGIGILTV
24335	CAL ALS LSE SEG EGN GNS NSG SGG GGY GYQ YQK QKV KVT VTF	AVFDRKSDAK
4958	CAA AAS ASG SGG GGG GGS GSY SYI YIP IPT PTF	KLGGALQAK
2528	CAV AVG VGD GDN DNF NFN FNK NKF KFY FYF	AVFDRKSDAK
34486	CAP APS PST STG TGN GNQ NQF QFY FYF	KLGGALQAK
4956	CVV VVL VLN LNT NTD TDK DKL KLI LIF	GILGFVFTL
4464	CAP APG PGN GNQ NQF QFY FYF	IVTDFSVIK
33500	CAG AGQ GQL QLG LGG GGG GGS GSQ SQG QGN GNL NLI LIF	GILGFVFTL
34235	CAV AVQ VQG QGT GTY TYG YGN GNK NKL KLV LVF	KLGGALQAK
34110	CAV AVN VNW NWG WGG GGS GSE SEK EKL KLV LVF	KLGGALQAK
31627	CAG AGQ GQS QSE SEE EEA EAN ANY NYG YGG GGS GSQ SQG QGN GNL NLI LIF	GILGFVFTL
24591	CAA AAI AIN INC NCY CYY YYG YGN GNN NNR NRL RLA LAF	RAKFKQLL
31930	CAF AFM FMT MTN TNA NAG AGG GGT GTS TSY SYG YGK GKL KLT LTF	GILGFVFTL
25438	CAA AAG AGE GET ETS TSY SYD YDK DKV KVI VIF	RAKFKQLL
24221	CAE AER ERE RET ETS TSY SYD YDK DKV KVI VIF	RAKFKQLL
18109	CAD ADS DSG SGG GGG GGA GAD ADG DGL GLT LTF	RAKFKQLL
34352	CAV AVR VRR RRD RDD DDK DKI KII IIF	KLGGALQAK
34227	CAL ALR LRG RGG GGT GTS TSY SYG YGK GKL KLT LTF	KLGGALQAK
128	CAG AGA GAQ AQT QTG TGA GAN ANN NNL NLF LFF	KLGGALQAK
34804	CAA AAS ASE SES ESE SEG EGA GAG AGN GNM NML MLT LTF	KLGGALQAK
2279	CAT ATD TDR DRI RIQ IQG QGA GAQ AQK QKL KLV LVF	KLGGALQAK
7214	CAE AET ETS TSY SYN YNQ NQG QGG GGK GKL KLI LIF	KLGGALQAK
5043	CIL ILS LSG SGG GGG GGG GGA GAD ADG DGL GLT LTF	KLGGALQAK
31399	CAG AGQ GQE QEG EGG GGG GGS GSQ SQG QGN GNL NLI LIF	GILGFVFTL
25390	CAA AAS ASE SET ETS TSY SYD YDK DKV KVI VIF	RAKFKQLL
125	CAM AMN MNR NRY RYS YST STL TLT LTF	RAKFKQLL
6231	CAW AWS WSS SSN SNA NAG AGG GGT GTS TSY SYG YGK GKL KLT LTF	GILGFVFTL
24307	CAE AEN ENK NKG KGG GGG GGS GSQ SQG QGN GNL NLI LIF	GILGFVFTL
6602	CAV AVN VNL NLG LGG GGG GGS GSQ SQG QGN GNL NLI LIF	GILGFVFTL
15230	CAE AET ETQ TQD QDS DSN SNY NYQ YQL QLI LIW	RAKFKQLL
31856	CAP APR PRA RAL ALS LSG SGA GAQ AQK QKL KLV LVF	GILGFVFTL
35800	CAG AGT GTN TNS NSG SGN GNT NTP TPL PLV LVF	KLGGALQAK
35165	CAL ALD LDG DGN GNA NAR ARL RLM LMF	KLGGALQAK
34260	CAM AMR MRE REA EAP APR PRG RGK GKL KLI LIF	KLGGALQAK
34915	CAG AGA GAF AFD FDT DTN TNA NAG AGK GKS KST STF	KLGGALQAK
35040	CAA AAT ATG TGT GTY TYK YKY KYI YIF	KLGGALQAK
34914	CAL ALS LSE SEE EEN ENN NNN NND NDM DMR MRF	KLGGALQAK
33577	CAV AVD VDN DNT NTD TDK DKL KLI LIF	GILGFVFTL
25391	CPR PRG RGN GNA NAG AGN GNM NML MLT LTF	RAKFKQLL
36156	CGT GTE TEI EIG IGG GGG GGT GTS TSY SYG YGK GKL KLT LTF	KLGGALQAK
14640	CLV LVE VEF EFE FEG EGS GSQ SQG QGN GNL NLI LIF	KLGGALQAK
25408	CVV VVN VNL NLE LEV EVF VFA FAY AYY YYG YGN GNN NNR NRL RLA LAF	GILGFVFTL
2340	CVV VVN VNS NSG SGY GYA YAL ALN LNF	KLGGALQAK
34958	CAM AMR MRE REI EIV IVW VWT WTG TGG GGF GFK FKT KTI TIF	KLGGALQAK
27068	CVG VGY GYT YTN TNA NAG AGK GKS KST STF	RAKFKQLL
5071	CAV AVR VRG RGL GLS LSN SNS NSN SNS NSG SGY GYA YAL ALN LNF	RAKFKQLL
33814	CAI AIT ITY TYG YGG GGS GSQ SQG QGN GNL NLI LIF	GILGFVFTL
29771	CAT ATD TDA DAS ASG SGG GGS GSN SNY NYK YKL KLT LTF	RAKFKQLL
6232	CAL ALT LTY TYG YGG GGS GSQ SQG QGN GNL NLI LIF	GILGFVFTL
25451	CAV AVR VRQ RQA QAG AGT GTA TAL ALI LIF	RAKFKQLL
25796	CAA AAS ASM SMG MGG GGG GGS GSQ SQG QGN GNL NLI LIF	GILGFVFTL
31378	CAV AVN VNM NMG MGG GGG GGS GSQ SQG QGN GNL NLI LIF	GILGFVFTL
10357	CAG AGE GEG EGN GNN NNN NND NDM DMR MRF	RAKFKQLL
35486	CAV AVN VNR NRD RDY DYK YKL KLS LSF	ELAGIGILTV
36097	CIL ILS LSR SRQ RQE QEG EGG GGA GAD ADG DGL GLT LTF	KLGGALQAK
18052	CAL ALS LSE SEA EAH AHT HTG TGN GNQ NQF QFY FYF	KLGGALQAK
55	CAM AMT MTR TRS RSN SNT NTG TGN GNQ NQF QFY FYF	IVTDFSVIK
7306	CAV AVP VPD PDN DNY NYG YGQ GQN QNF NFV FVF	GILGFVFTL
34524	CAE AEP EPY PYN YNF NFN FNK NKF KFY FYF	KLGGALQAK
35652	CAT ATD TDR DRD RDS DSG SGY GYS YST STL TLT LTF	KLGGALQAK
5022	CAM AMS MSA SAS ASN SNF NFG FGN GNE NEK EKL KLT LTF	GILGFVFTL
34523	CAL ALS LSE SEA EAQ AQF QFN FNG NGS GSS SSN SNT NTG TGK GKL KLI LIF	KLGGALQAK
