26138	CAV AVT VTR TRT RTD TDS DSW SWG WGK GKF KFQ FQF	KLGGALQAK
16977	CIR IRG RGG GGN GNY NYG YGG GGS GSQ SQG QGN GNL NLI LIF	KLGGALQAK
5319	CAA AAR ARV RVR VRG RGF GFG FGN GNV NVL VLH LHC	AVFDRKSDAK
33554	CAG AGA GAG AGS GSQ SQG QGN GNL NLI LIF	GILGFVFTL
14254	CAA AAK AKE KEG EGY GYS YST STL TLT LTF	KLGGALQAK
35991	CAL ALS LSL SLQ LQG QGD GDD DDK DKI KII IIF	KLGGALQAK
31551	CAE AED EDN DNN NNA NAR ARL RLM LMF	GILGFVFTL
36330	CAT ATD TDG DGG GGI GIK IKA KAA AAG AGN GNK NKL KLT LTF	KLGGALQAK
689	CAL ALG LGV GVG VGS GSG SGA GAG AGS GSY SYQ YQL QLT LTF	AVFDRKSDAK
23120	CAL ALS LSE SEG EGN GNR NRD RDD DDK DKI KII IIF	KLGGALQAK
35023	CAY AYR YRK RKT KTS TSY SYD YDK DKV KVI VIF	KLGGALQAK
17881	CLV LVG VGD GDK DKG KGD GDD DDK DKI KII IIF	KLGGALQAK
34997	CLV LVG VGN GNQ NQG QGG GGK GKL KLI LIF	KLGGALQAK
25797	CAA AAK AKE KEG EGY GYS YST STL TLT LTF	RAKFKQLL
13987	CAV AVA VAG AGY GYS YST STL TLT LTF	KLGGALQAK
33394	CAY AYR YRS RSL SLP LPM PMD MDS DSN SNY NYQ YQL QLI LIW	GILGFVFTL
5215	CVV VVL VLW LWD WDS DSG SGG GGS GSN SNY NYK YKL KLT LTF	KLGGALQAK
19401	CAV AVG VGS GSI SIY IYN YNQ NQG QGG GGK GKL KLI LIF	RAKFKQLL
5092	CAM AMR MRG RGL GLI LIQ IQG QGA GAQ AQK QKL KLV LVF	KLGGALQAK
5100	CAA AAR ARV RVR VRG RGF GFG FGN GNV NVL VLH LHC	AVFDRKSDAK
5132	CAL ALK LKL KLI LIK IKA KAA AAG AGN GNK NKL KLT LTF	KLGGALQAK
34941	CAM AMR MRE RED EDP DPN PNF NFG FGN GNE NEK EKL KLT LTF	KLGGALQAK
35109	CAV AVR VRS RSS SSG SGS GSA SAR ARQ RQL QLT LTF	KLGGALQAK
34387	CAV AVG VGT GTP TPN PNS NSG SGG GGS GSN SNY NYK YKL KLT LTF	KLGGALQAK
27927	CVV VVN VNI NID IDN DNA NAR ARL RLM LMF	RAKFKQLL
8544	CAV AVS VSI SIG IGA GAY AYG YGG GGS GSQ SQG QGN GNL NLI LIF	RAKFKQLL
32519	CAL ALA LAP APE PEG EGQ GQK QKL KLL LLF	GILGFVFTL
34636	CAL ALS LSG SGA GAY AYN YNF NFN FNK NKF KFY FYF	KLGGALQAK
6664	CAF AFM FMI MIN INA NAG AGG GGT GTS TSY SYG YGK GKL KLT LTF	GILGFVFTL
34788	CAV AVG VGS GSN SNA NAG AGG GGT GTS TSY SYG YGK GKL KLT LTF	KLGGALQAK
23902	CAY AYT YTG TGT GTS TSG SGT GTY TYK YKY KYI YIF	KLGGALQAK
34131	CAE AET ETT TTP TPG PGN GNT NTG TGF GFQ FQK QKL KLV LVF	KLGGALQAK
7356	CAV AVS VSE SEY EYS YST STL TLT LTF	RAKFKQLL
14333	CAA AAM AME MET ETS TSY SYD YDK DKV KVI VIF	RAKFKQLL
35194	CIL ILR LRD RDV DVE VED EDM DMR MRF	KLGGALQAK
27063	CAA AAV AVD VDN DNY NYG YGQ GQN QNF NFV FVF	RAKFKQLL
684	CAV AVG VGD GDN DNF NFN FNK NKF KFY FYF	AVFDRKSDAK
17180	CGT GTE TEY EYP YPN PND NDY DYK YKL KLS LSF	GLCTLVAML
34414	CAM AMK MKG KGL GLT LTG TGG GGG GGN GNK NKL KLT LTF	KLGGALQAK
35628	CAE AET ETD TDN DNA NAG AGN GNM NML MLT LTF	KLGGALQAK
23824	CAL ALS LSL SLN LNR NRD RDD DDK DKI KII IIF	KLGGALQAK
37043	CAV AVR VRD RDI DIP IPA PAS ASY SYK YKL KLI LIF	IVTDFSVIK
1447	CAV AVN VNN NNR NRT RTG TGG GGF GFK FKT KTI TIF	AVFDRKSDAK
34718	CAT ATA TAY AYI YIN INT NTG TGK GKL KLI LIF	KLGGALQAK
32279	CGT GTD TDK DKG KGG GGG GGS GSQ SQG QGN GNL NLI LIF	GILGFVFTL
17046	CAR ARA RAG AGG GGG GGS GSE SEK EKL KLV LVF	RAKFKQLL
31677	CAG AGN GNY NYG YGG GGS GSQ SQG QGN GNL NLI LIF	GILGFVFTL
35706	CAL ALS LSE SEP EPG PGA GAN ANN NNL NLF LFF	KLGGALQAK
38430	CAM AMR MRE RET ETD TDG DGW GWS WSS SSY SYK YKL KLI LIF	KLGGALQAK
24682	CAA AAK AKE KEG EGY GYS YST STL TLT LTF	KLGGALQAK
34787	CAV AVP VPI PIP IPL PLV LVP VPG PGK GKL KLI LIF	KLGGALQAK
8391	CVV VVT VTE TET ETS TSY SYD YDK DKV KVI VIF	RAKFKQLL
14264	CAL ALS LSE SEA EAG AGP GPD PDK DKL KLI LIF	RAKFKQLL
35770	CAA AAS ASR SRV RVA VAN ANN NNN NND NDM DMR MRF	KLGGALQAK
35945	CAM AMR MRE REG EGF GFG FGN GNE NEK EKL KLT LTF	KLGGALQAK
6549	CAF AFM FMD MDY DYY YYN YNT NTD TDK DKL KLI LIF	KLGGALQAK
5033	CAG AGA GAE AEY EYG YGQ GQN QNF NFV FVF	KLGGALQAK
29962	CAV AVG VGV GVE VEE EET ETS TSG SGS GSR SRL RLT LTF	GILGFVFTL
34251	CAV AVA VAD ADF DFF FFS FSG SGA GAT ATN TNK NKL KLI LIF	KLGGALQAK
36221	CAV AVK VKG KGG GGG GGK GKL KLI LIF	ELAGIGILTV
23225	CIL ILR LRD RDV DVG VGT GTG TGT GTA TAS ASK SKL KLT LTF	GILGFVFTL
30540	CAG AGA GAG AGP GPG PGS GSQ SQG QGN GNL NLI LIF	GILGFVFTL
22245	CAV AVG VGE GEY EYD YDY DYK YKL KLS LSF	RAKFKQLL
5506	CAV AVR VRE RET ETG TGA GAN ANN NNL NLF LFF	GILGFVFTL
34413	CAE AEI EIS IST STD TDG DGQ GQK QKL KLL LLF	KLGGALQAK
24302	CAY AYS YSP SPA PAA AAG AGG GGT GTS TSY SYG YGK GKL KLT LTF	GILGFVFTL
38429	CAV AVP VPL PLS LSN SND NDY DYK YKL KLS LSF	ELAGIGILTV
20783	CAS ASS SSM SME MEY EYG YGN GNK NKL KLV LVF	RAKFKQLL
18665	CVV VVD VDY DYT YTD TDK DKL KLI LIF	RAKFKQLL
34306	CAV AVR VRA RAD ADS DSN SNY NYQ YQL QLI LIW	IVTDFSVIK
10417	CVV VVC VCS CSL SLQ LQG QGA GAQ AQK QKL KLV LVF	RAKFKQLL
22309	CAD ADS DSG SGG GGG GGA GAD ADG DGL GLT LTF	RAKFKQLL
17179	CAA AAA AAE AET ETS TSY SYD YDK DKV KVI VIF	RAKFKQLL
28465	CAM AMP MPG PGA GAN ANS NSK SKL KLT LTF	KLGGALQAK
34692	CAY AYR YRS RSP SPN PNP NPY PYS YSG SGG GGG GGA GAD ADG DGL GLT LTF	KLGGALQAK
33591	CAL ALS LSE SEA EAS ASR SRM RMD MDS DSN SNY NYQ YQL QLI LIW	GILGFVFTL
25393	CAG AGH GHT HTG TGN GNQ NQF QFY FYF	IVTDFSVIK
34497	CAA AAS ASA SAR ARD RDT DTD TDK DKL KLI LIF	KLGGALQAK
25742	CAV AVG VGA GAS ASN SND NDY DYK YKL KLS LSF	KLGGALQAK
25070	CAL ALS LSG SGM GMT MTN TNT NTG TGT GTA TAS ASK SKL KLT LTF	KLGGALQAK
34103	CVV VVS VSP SPH PHG HGS GSS SSN SNT NTG TGK GKL KLI LIF	KLGGALQAK
35618	CAV AVR VRD RDR DRD RDY DYK YKL KLS LSF	KLGGALQAK
69	CAV AVS VSE SEK EKN KNR NRD RDD DDK DKI KII IIF	KLGGALQAK
29963	CVV VVN VNR NRD RDY DYQ YQL QLI LIW	KLGGALQAK
35219	CAV AVL VLR LRT RTS TSG SGG GGS GSY SYI YIP IPT PTF	KLGGALQAK
32502	CAG AGG GGG GGS GSQ SQG QGN GNL NLI LIF	GILGFVFTL
5315	CAE AER ERT RTG TGG GGF GFK FKT KTI TIF	KLGGALQAK
33901	CGA GAA AAG AGN GNM NML MLT LTF	KLGGALQAK
27947	CAE AES EST STS TSG SGG GGK GKL KLI LIF	GLCTLVAML
199	CAV AVA VAN ANG NGS GSQ SQG QGN GNL NLI LIF	KLGGALQAK
35304	CAE AEN ENY NYQ YQG QGG GGK GKL KLI LIF	KLGGALQAK
2271	CAM AMR MRE RED EDE DEF EFS FSG SGG GGY GYN YNK NKL KLI LIF	KLGGALQAK
32610	CAV AVG VGG GGS GSQ SQG QGN GNL NLI LIF	GILGFVFTL
34174	CAV AVR VRE REG EGS GSG SGG GGG GGA GAD ADG DGL GLT LTF	KLGGALQAK
351	CAA AAM AME MEI EIS ISN SNF NFG FGN GNE NEK EKL KLT LTF	IVTDFSVIK
6	CIV IVR VRV RVA VAN ANT NTD TDK DKL KLI LIF	GILGFVFTL
11402	CAA AAG AGS GSA SAN ANT NTG TGN GNQ NQF QFY FYF	RAKFKQLL
20245	CAK AKG KGL GLT LTG TGG GGG GGD GDK DKL KLT LTF	RAKFKQLL
34205	CAY AYR YRG RGL GLN LNS NSG SGN GNT NTP TPL PLV LVF	KLGGALQAK
26126	CAV AVS VSD SDS DSN SNY NYQ YQL QLI LIW	KLGGALQAK
35449	CAL ALS LSE SEA EAR ARR RRT RTG TGF GFQ FQK QKL KLV LVF	KLGGALQAK
34336	CAS ASD SDT DTY TYT YTG TGA GAN ANS NSK SKL KLT LTF	KLGGALQAK
36283	CAG AGQ GQL QLS LSG SGG GGY GYQ YQK QKV KVT VTF	KLGGALQAK
23124	CAV AVV VVG VGE GEG EGG GGY GYQ YQK QKV KVT VTF	KLGGALQAK
36319	CAV AVD VDL DLM LMK MKT KTS TSY SYD YDK DKV KVI VIF	IVTDFSVIK
25753	CAR ARE REH EHM HMD MDS DSN SNY NYQ YQL QLI LIW	KLGGALQAK
34561	CAD ADP DPP PPG PGY GYQ YQL QLI LIW	KLGGALQAK
35990	CAV AVR VRE REW EWN WNN NNA NAR ARL RLM LMF	KLGGALQAK
35263	CAM AMK MKK KKT KTS TSY SYD YDK DKV KVI VIF	KLGGALQAK
17860	CAV AVS VSL SLL LLN LND NDY DYK YKL KLS LSF	GLCTLVAML
30441	CAG AGS GSG SGD GDG DGG GGS GSQ SQG QGN GNL NLI LIF	GILGFVFTL
34053	CLV LVG VGD GDG DGN GNS NSN SNY NYQ YQL QLI LIW	KLGGALQAK
25925	CAA AAS ASE SEG EGA GAP APD PDK DKL KLI LIF	RAKFKQLL
34382	CVV VVN VNS NSA SAG AGT GTY TYK YKY KYI YIF	KLGGALQAK
34139	CAL ALS LSG SGQ GQE QEG EGG GGS GSE SEK EKL KLV LVF	KLGGALQAK
6333	CAM AMR MRP RPL PLG LGM GMD MDS DSN SNY NYQ YQL QLI LIW	GILGFVFTL
30401	CAL ALS LSE SEA EAG AGL GLY LYN YNF NFN FNK NKF KFY FYF	KLGGALQAK
2416	CAV AVR VRD RDE DEA EAG AGG GGS GSY SYI YIP IPT PTF	IVTDFSVIK
25890	CAG AGG GGG GGS GSQ SQG QGN GNL NLI LIF	GILGFVFTL
76	CAV AVH VHG HGY GYG YGQ GQN QNF NFV FVF	RAKFKQLL
30438	CAG AGA GAQ AQI QIT ITN TNR NRD RDD DDK DKI KII IIF	GILGFVFTL
28875	CAG AGP GPG PGD GDG DGG GGS GSQ SQG QGN GNL NLI LIF	GILGFVFTL
35381	CLV LVG VGD GDP DPL PLS LSS SSG SGS GSA SAR ARQ RQL QLT LTF	KLGGALQAK
32394	CAY AYS YSL SLS LSA SAG AGG GGT GTS TSY SYG YGK GKL KLT LTF	GILGFVFTL
29774	CAA AAK AKV KVT VTF	GILGFVFTL
34973	CAM AMR MRG RGP GPF PFS FSS SSN SNT NTG TGK GKL KLI LIF	KLGGALQAK
36179	CAA AAS ASK SKG KGN GNN NNA NAR ARL RLM LMF	KLGGALQAK
26472	CAA AAS ASE SET ETS TSY SYD YDK DKV KVI VIF	RAKFKQLL
35790	CAM AMS MSL SLY LYN YNF NFN FNK NKF KFY FYF	KLGGALQAK
36021	CAG AGA GAG AGY GYW YWG WGQ GQN QNF NFV FVF	KLGGALQAK
5453	CAV AVR VRD RDE DEY EYS YSG SGA GAG AGS GSY SYQ YQL QLT LTF	KLGGALQAK
18007	CAL ALK LKL KLG LGN GNA NAG AGN GNM NML MLT LTF	KLGGALQAK
34872	CLV LVS VSQ SQG QGG GGK GKL KLI LIF	KLGGALQAK
2289	CAA AAI AIN INP NPT PTS TSG SGT GTY TYK YKY KYI YIF	IVTDFSVIK
16004	CAV AVR VRD RDS DSN SNY NYQ YQL QLI LIW	KLGGALQAK
34703	CAE AES ESM SMD MDN DND NDM DMR MRF	KLGGALQAK
2560	CVV VVN VNM NMD MDN DNA NAR ARL RLM LMF	RAKFKQLL
31636	CAA AAS ASG SGT GTS TSN SNS NSG SGY GYA YAL ALN LNF	GILGFVFTL
18262	CAE AEM EME MEG EGG GGS GSY SYI YIP IPT PTF	RAKFKQLL
35335	CAA AAS ASA SAG AGS GSN SNQ NQF QFY FYF	KLGGALQAK
34408	CAM AMR MRE RES EST STS TSG SGT GTY TYK YKY KYI YIF	KLGGALQAK
36003	CAL ALS LSE SEA EAH AHQ HQG QGG GGK GKL KLI LIF	KLGGALQAK
272	CAG AGH GHT HTG TGN GNQ NQF QFY FYF	IVTDFSVIK
24304	CAV AVS VSE SED EDS DSS SSY SYK YKL KLI LIF	KLGGALQAK
25852	CAG AGL GLT LTG TGN GNQ NQF QFY FYF	KLGGALQAK
35712	CAV AVR VRD RDI DIE IEN END NDY DYK YKL KLS LSF	KLGGALQAK
162	CAV AVD VDM DMG MGA GAG AGK GKS KST STF	KLGGALQAK
25914	CAA AAS ASE SET ETS TSY SYD YDK DKV KVI VIF	RAKFKQLL
30421	CAA AAS ASA SAG AGG GGG GGS GSQ SQG QGN GNL NLI LIF	GILGFVFTL
35408	CAV AVK VKA KAN ANF NFN FNK NKF KFY FYF	KLGGALQAK
2587	CVV VVN VNM NMD MDN DNA NAR ARL RLM LMF	IVTDFSVIK
28845	CAV AVA VAK AKD KDL DLQ LQN QNS NSG SGG GGG GGA GAD ADG DGL GLT LTF	GILGFVFTL
34774	CVV VVG VGA GAG AGT GTA TAL ALI LIF	KLGGALQAK
34096	CAM AMS MSP SPS PSN SNF NFG FGN GNE NEK EKL KLT LTF	ELAGIGILTV
35307	CAL ALG LGE GEG EGQ GQG QGG GGS GSE SEK EKL KLV LVF	KLGGALQAK
32334	CAP APR PRT RTS TSG SGT GTY TYK YKY KYI YIF	GILGFVFTL
30409	CAV AVD VDA DAD ADY DYG YGG GGS GSQ SQG QGN GNL NLI LIF	GILGFVFTL
585	CIL ILR LRD RDL DLP LPI PIS ISN SNF NFG FGN GNE NEK EKL KLT LTF	RAKFKQLL
35177	CAA AAS ASM SMG MGG GGA GAQ AQK QKL KLV LVF	KLGGALQAK
6241	CAV AVN VNR NRG RGY GYG YGG GGS GSQ SQG QGN GNL NLI LIF	GILGFVFTL
24884	CAV AVR VRP RPN PNA NAR ARL RLM LMF	GLCTLVAML
532	CAA AAT ATN TNS NSN SNS NSG SGY GYA YAL ALN LNF	IVTDFSVIK
26523	CAG AGT GTT TTS TSG SGT GTY TYK YKY KYI YIF	KLGGALQAK
30573	CAE AEN ENY NYG YGG GGS GSQ SQG QGN GNL NLI LIF	GILGFVFTL
21061	CLV LVG VGY GYT YTG TGG GGG GGN GNK NKL KLT LTF	RAKFKQLL
34663	CAM AMR MRE REG EGW GWD WDQ DQT QTG TGA GAN ANN NNL NLF LFF	KLGGALQAK
14316	CAR ARG RGE GET ETS TSY SYD YDK DKV KVI VIF	RAKFKQLL
7368	CAG AGG GGG GGS GSQ SQG QGN GNL NLI LIF	GILGFVFTL
23011	CAV AVS VSG SGA GAG AGS GSY SYQ YQL QLT LTF	KLGGALQAK
18008	CIL ILW LWV WVA VAA AAG AGN GNK NKL KLT LTF	KLGGALQAK
15944	CAE AEM EME MEG EGG GGS GSY SYI YIP IPT PTF	RAKFKQLL
35899	CAG AGT GTD TDY DYK YKL KLS LSF	KLGGALQAK
15331	CAL ALI LIA IAN ANR NRD RDD DDK DKI KII IIF	KLGGALQAK
5494	CAA AAH AHR HRD RDT DTG TGN GNQ NQF QFY FYF	KLGGALQAK
16963	CAV AVR VRD RDS DSA SAG AGT GTA TAL ALI LIF	KLGGALQAK
655	CVV VVS VSA SAP APH PHT HTD TDK DKL KLI LIF	KLGGALQAK
34406	CAV AVR VRD RDP DPR PRA RAR ARL RLM LMF	KLGGALQAK
31333	CAG AGA GAG AGD GDG DGG GGS GSQ SQG QGN GNL NLI LIF	GILGFVFTL
36104	CAV AVS VSR SRD RDM DMN MNY NYG YGG GGS GSQ SQG QGN GNL NLI LIF	KLGGALQAK
5250	CAE AET ETP TPS PSS SSG SGK GKL KLI LIF	RAKFKQLL
627	CAV AVG VGV GVQ VQG QGA GAQ AQK QKL KLV LVF	ELAGIGILTV
631	CAT ATE TEV EVN VNQ NQA QAG AGT GTA TAL ALI LIF	IVTDFSVIK
34986	CAA AAS ASG SGN GNN NNF NFN FNK NKF KFY FYF	KLGGALQAK
35071	CAG AGV GVY VYA YAG AGG GGT GTS TSY SYG YGK GKL KLT LTF	KLGGALQAK
31406	CAA AAS ASG SGG GGG GGS GSQ SQG QGN GNL NLI LIF	GILGFVFTL
10950	CAA AAT ATE TET ETS TSY SYD YDK DKV KVI VIF	RAKFKQLL
29781	CAM AMN MNP NPA PAW AWG WGG GGA GAT ATN TNK NKL KLI LIF	GILGFVFTL
22311	CAE AEM EME MEG EGG GGS GSY SYI YIP IPT PTF	RAKFKQLL
35844	CVV VVN VNI NIA IAG AGN GNR NRD RDD DDK DKI KII IIF	KLGGALQAK
25805	CAG AGH GHT HTG TGN GNQ NQF QFY FYF	GILGFVFTL
14678	CAV AVN VNL NLG LGG GGG GGS GSQ SQG QGN GNL NLI LIF	GILGFVFTL
5099	CAI AIR IRM RMD MDS DSS SSY SYK YKL KLI LIF	KLGGALQAK
34428	CAV AVK VKW KWF WFS FSG SGG GGY GYN YNK NKL KLI LIF	KLGGALQAK
14192	CAA AAS ASE SET ETS TSY SYD YDK DKV KVI VIF	RAKFKQLL
34521	CAE AES ESP SPM PMK MKT KTS TSY SYD YDK DKV KVI VIF	KLGGALQAK
34079	CAM AMR MRR RRP RPI PIS ISS SSG SGS GSA SAR ARQ RQL QLT LTF	KLGGALQAK
34754	CAV AVV VVM VMD MDS DSN SNY NYQ YQL QLI LIW	KLGGALQAK
5322	CAP APG PGA GAG AGR GRR RRA RAL ALT LTF	ELAGIGILTV
28712	CAE AEM EME MEG EGG GGS GSY SYI YIP IPT PTF	RAKFKQLL
25384	CAA AAS ASA SAA AAA AAG AGG GGG GGA GAD ADG DGL GLT LTF	KLGGALQAK
5222	CAF AFR FRG RGG GGA GAD ADG DGL GLT LTF	KLGGALQAK
5436	CAV AVK VKR KRS RSN SNF NFG FGN GNE NEK EKL KLT LTF	ELAGIGILTV
30494	CAL ALG LGG GGS GSQ SQG QGN GNL NLI LIF	GILGFVFTL
6951	CAV AVN VNL NLY LYG YGG GGS GSQ SQG QGN GNL NLI LIF	GILGFVFTL
35760	CAV AVR VRP RPI PIS ISG SGG GGG GGA GAD ADG DGL GLT LTF	KLGGALQAK
5535	CAG AGE GET ETM TMD MDS DSN SNY NYQ YQL QLI LIW	KLGGALQAK
34315	CAA AAL ALI LIS ISN SNA NAG AGG GGT GTS TSY SYG YGK GKL KLT LTF	KLGGALQAK
15345	CAV AVG VGD GDN DNF NFN FNK NKF KFY FYF	AVFDRKSDAK
33600	CAG AGS GSN SNG NGG GGS GSQ SQG QGN GNL NLI LIF	GILGFVFTL
34186	CAA AAR ARY RYS YSG SGG GGG GGA GAD ADG DGL GLT LTF	KLGGALQAK
74	CAG AGQ GQL QLV LVF VFD FDT DTD TDK DKL KLI LIF	RAKFKQLL
34108	CAV AVS VSL SLN LNT NTG TGG GGF GFK FKT KTI TIF	KLGGALQAK
27088	CIV IVR VRE REV EVG VGD GDK DKL KLI LIF	RAKFKQLL
224	CAV AVH VHG HGY GYG YGQ GQN QNF NFV FVF	KLGGALQAK
5163	CAG AGG GGG GGS GSQ SQG QGN GNL NLI LIF	GILGFVFTL
36288	CAV AVR VRV RVR VRR RRQ RQL QLT LTF	KLGGALQAK
23237	CAG AGG GGG GGS GSQ SQG QGN GNL NLI LIF	GILGFVFTL
2342	CAA AAD ADN DNA NAR ARL RLM LMF	ELAGIGILTV
3880	CAL ALS LSE SEA EAN ANT NTG TGG GGF GFK FKT KTI TIF	IVTDFSVIK
25404	CAA AAS ASE SET ETS TSY SYD YDK DKV KVI VIF	RAKFKQLL
2337	CAA AAY AYY YYS YSG SGG GGG GGA GAD ADG DGL GLT LTF	KLGGALQAK
35489	CAV AVS VSM SML MLG LGN GNE NEK EKL KLT LTF	KLGGALQAK
2393	CAA AAS ASN SNS NSG SGY GYA YAL ALN LNF	ELAGIGILTV
23906	CAV AVG VGP GPW PWY WYS YSS SSA SAS ASK SKI KII IIF	KLGGALQAK
35195	CIV IVR VRG RGA GAD ADQ DQG QGA GAQ AQK QKL KLV LVF	KLGGALQAK
26259	CAV AVL VLD LDS DSN SNY NYQ YQL QLI LIW	KLGGALQAK
34044	CAM AMR MRR RRP RPI PIS ISS SSG SGS GSA SAR ARQ RQL QLT LTF	KLGGALQAK
28361	CAV AVA VAS ASG SGY GYS YST STL TLT LTF	KLGGALQAK
24126	CAG AGA GAG AGS GSQ SQG QGN GNL NLI LIF	RAKFKQLL
7344	CAD ADS DSG SGG GGG GGA GAD ADG DGL GLT LTF	RAKFKQLL
35774	CAA AAS ASL SLY LYN YNQ NQG QGG GGK GKL KLI LIF	KLGGALQAK
35339	CAG AGP GPG PGD GDT DTG TGN GNQ NQF QFY FYF	KLGGALQAK
25102	CVV VVR VRF RFT FTG TGG GGG GGN GNK NKL KLT LTF	GLCTLVAML
26514	CVV VVN VNI NIG IGS GSG SGN GNQ NQF QFY FYF	RAKFKQLL
29799	CAA AAS ASA SAS ASG SGT GTY TYK YKY KYI YIF	GILGFVFTL
19	CAV AVG VGA GAN ANY NYQ YQL QLI LIW	KLGGALQAK
35603	CAV AVG VGS GSG SGN GNT NTG TGK GKL KLI LIF	KLGGALQAK
33946	CAV AVR VRG RGA GAT ATN TNK NKL KLI LIF	KLGGALQAK
28371	CAT ATA TAS AST STS TSG SGT GTY TYK YKY KYI YIF	RAKFKQLL
27060	CAV AVQ VQE QEG EGK GKL KLI LIF	KLGGALQAK
677	CAV AVM VMD MDS DSN SNY NYQ YQL QLI LIW	IVTDFSVIK
34304	CAE AER ERS RSL SLN LNN NNT NTD TDK DKL KLI LIF	KLGGALQAK
34253	CAP APS PSH SHQ HQL QLT LTF	KLGGALQAK
31383	CAG AGI GIL ILY LYG YGG GGS GSQ SQG QGN GNL NLI LIF	GILGFVFTL
15298	CAA AAS ASE SET ETS TSY SYD YDK DKV KVI VIF	RAKFKQLL
34350	CIP IPE PER ERL RLG LGN GNN NNN NNA NAG AGN GNM NML MLT LTF	KLGGALQAK
34223	CAT ATD TDP DPS PSD SDG DGQ GQK QKL KLL LLF	KLGGALQAK
25454	CAT ATD TDL DLN LNP NPG PGA GAG AGS GSY SYQ YQL QLT LTF	KLGGALQAK
28737	CVV VVN VNT NTG TGA GAS ASK SKI KII IIF	KLGGALQAK
35968	CAV AVG VGD GDS DSG SGT GTT TTD TDS DSW SWG WGK GKF KFQ FQF	KLGGALQAK
5544	CAG AGP GPI PIA IAG AGG GGS GSQ SQG QGN GNL NLI LIF	GILGFVFTL
7163	CAV AVN VNR NRG RGF GFG FGN GNV NVL VLH LHC	ELAGIGILTV
22358	CAV AVP VPY PYN YNQ NQG QGG GGK GKL KLI LIF	RAKFKQLL
35749	CAL ALS LSG SGL GLT LTQ TQG QGG GGS GSE SEK EKL KLV LVF	KLGGALQAK
34076	CVL VLA LAT ATG TGK GKL KLI LIF	KLGGALQAK
29957	CAV AVG VGR GRD RDT DTG TGG GGF GFK FKT KTI TIF	GILGFVFTL
34957	CAG AGN GNS NSG SGT GTY TYK YKY KYI YIF	KLGGALQAK
33230	CAV AVR VRN RNQ NQG QGG GGS GSE SEK EKL KLV LVF	GILGFVFTL
34429	CAF AFD FDS DSG SGA GAG AGS GSY SYQ YQL QLT LTF	KLGGALQAK
23548	CAV AVN VNA NAY AYP YPH PHN HNY NYG YGQ GQN QNF NFV FVF	RAKFKQLL
5652	CAD ADM DMN MNR NRD RDD DDK DKI KII IIF	GILGFVFTL
25402	CAG AGG GGG GGS GSQ SQG QGN GNL NLI LIF	GILGFVFTL
44	CAG AGN GNS NSG SGG GGS GSN SNY NYK YKL KLT LTF	KLGGALQAK
35826	CAA AAS ASI SIT ITG TGT GTA TAS ASK SKL KLT LTF	KLGGALQAK
6671	CAE AEN ENM NMG MGG GGG GGS GSQ SQG QGN GNL NLI LIF	GILGFVFTL
28715	CAL ALR LRP RPA PAV AVG VGN GNQ NQG QGG GGK GKL KLI LIF	KLGGALQAK
36196	CVV VVN VNT NTG TGF GFQ FQK QKL KLV LVF	KLGGALQAK
26016	CAL ALR LRA RAG AGG GGT GTS TSY SYG YGK GKL KLT LTF	KLGGALQAK
2558	CAA AAS ASG SGD GDS DSG SGG GGG GGA GAD ADG DGL GLT LTF	KLGGALQAK
2309	CAG AGG GGI GIY IYG YGG GGS GSQ SQG QGN GNL NLI LIF	KLGGALQAK
23813	CAA AAS ASE SET ETS TSY SYD YDK DKV KVI VIF	RAKFKQLL
24975	CAT ATD TDR DRA RAG AGS GSA SAR ARQ RQL QLT LTF	KLGGALQAK
7231	CAV AVN VNG NGA GAY AYS YSG SGG GGG GGA GAD ADG DGL GLT LTF	KLGGALQAK
2423	CAV AVG VGA GAN ANS NSG SGY GYS YST STL TLT LTF	ELAGIGILTV
36154	CAV AVK VKN KNP NPG PGG GGS GSY SYI YIP IPT PTF	KLGGALQAK
23285	CAV AVR VRG RGG GGF GFG FGN GNV NVL VLH LHC	RAKFKQLL
35884	CAV AVY VYS YSG SGN GNT NTP TPL PLV LVF	KLGGALQAK
34842	CAV AVN VNG NGL GLD LDS DSN SNY NYQ YQL QLI LIW	KLGGALQAK
26555	CAE AET ETH THS HSG SGG GGS GSN SNY NYK YKL KLT LTF	RAKFKQLL
24363	CAV AVT VTP TPG PGG GGG GGA GAD ADG DGL GLT LTF	KLGGALQAK
35656	CAE AEN ENN NND NDM DMR MRF	KLGGALQAK
10306	CAV AVS VSA SAR ARL RLN LNT NTD TDK DKL KLI LIF	RAKFKQLL
5029	CAV AVA VAV AVG VGV GVS VSG SGG GGG GGA GAD ADG DGL GLT LTF	GILGFVFTL
19693	CAF AFM FMK MKG KGA GAG AGG GGT GTS TSY SYG YGK GKL KLT LTF	RAKFKQLL
35464	CAV AVT VTL TLS LSP SPH PHG HGG GGA GAT ATN TNK NKL KLI LIF	KLGGALQAK
35583	CAR ARW RWR WRK RKT KTS TSY SYD YDK DKV KVI VIF	KLGGALQAK
15383	CAA AAS ASE SEY EYG YGN GNK NKL KLV LVF	RAKFKQLL
34152	CAV AVE VED EDD DDS DSS SSY SYG YGG GGS GSQ SQG QGN GNL NLI LIF	KLGGALQAK
24846	CAV AVP VPL PLT LTG TGG GGG GGN GNK NKL KLT LTF	GLCTLVAML
23103	CAA AAD ADN DNY NYG YGG GGS GSQ SQG QGN GNL NLI LIF	GILGFVFTL
2364	CAV AVI VIR IRY RYG YGQ GQN QNF NFV FVF	RAKFKQLL
34314	CAL ALP LPT PTP TPT PTS TSD SDG DGQ GQK QKL KLL LLF	KLGGALQAK
23630	CAA AAS ASS SSG SGG GGT GTS TSY SYG YGK GKL KLT LTF	RAKFKQLL
35454	CAV AVN VNS NSW SWN WNN NNN NNA NAR ARL RLM LMF	KLGGALQAK
34961	CVV VVN VNV NVG VGA GAN ANA NAG AGK GKS KST STF	KLGGALQAK
34526	CVV VVP VPT PTS TSG SGS GSA SAR ARQ RQL QLT LTF	KLGGALQAK
36222	CAV AVL VLS LSG SGT GTA TAS ASK SKL KLT LTF	IVTDFSVIK
34625	CAV AVR VRP RPG PGK GKY KYN YNT NTD TDK DKL KLI LIF	KLGGALQAK
16425	CAV AVK VKP KPM PMF MFS FSG SGG GGY GYN YNK NKL KLI LIF	RAKFKQLL
28037	CAL ALS LSE SEA EAN ANT NTG TGG GGF GFK FKT KTI TIF	RAKFKQLL
34494	CAV AVS VSA SAS ASG SGR GRD RDD DDK DKI KII IIF	KLGGALQAK
22330	CAD ADS DSG SGG GGG GGA GAD ADG DGL GLT LTF	RAKFKQLL
23374	CAR ARG RGF GFQ FQK QKL KLV LVF	KLGGALQAK
35130	CAK AKY KYN YNF NFN FNK NKF KFY FYF	KLGGALQAK
34686	CAY AYG YGA GAS ASG SGT GTY TYK YKY KYI YIF	KLGGALQAK
34346	CAV AVR VRP RPN PNY NYG YGQ GQN QNF NFV FVF	KLGGALQAK
35283	CAV AVK VKF KFL FLA LAG AGG GGT GTS TSY SYG YGK GKL KLT LTF	KLGGALQAK
23014	CAA AAS ASR SRG RGY GYS YST STL TLT LTF	KLGGALQAK
5650	CAA AAR ARR RRR RRG RGM GMD MDS DSS SSY SYK YKL KLI LIF	GILGFVFTL
28573	CAV AVN VNE NEA EAG AGG GGY GYN YNK NKL KLI LIF	ELAGIGILTV
34236	CAA AAR ARS RSH SHQ HQG QGG GGK GKL KLI LIF	KLGGALQAK
34228	CAA AAR ARY RYN YNN NNA NAG AGN GNM NML MLT LTF	KLGGALQAK
36112	CAL ALS LSV SVK VKE KET ETS TSG SGS GSR SRL RLT LTF	KLGGALQAK
8924	CAS ASV SVG VGM GMD MDS DSS SSY SYK YKL KLI LIF	RAKFKQLL
30405	CAE AEV EVK VKG KGG GGG GGS GSQ SQG QGN GNL NLI LIF	GILGFVFTL
34727	CAM AMR MRK RKT KTN TNR NRD RDD DDK DKI KII IIF	KLGGALQAK
5287	CAV AVR VRY RYN YNT NTD TDK DKL KLI LIF	KLGGALQAK
7264	CVV VVS VSP SPG PGY GYS YST STL TLT LTF	AVFDRKSDAK
2095	CAF AFI FID IDT DTG TGG GGF GFK FKT KTI TIF	AVFDRKSDAK
36077	CAV AVN VNT NTG TGG GGF GFK FKT KTI TIF	ELAGIGILTV
23846	CAD ADS DSG SGG GGG GGA GAD ADG DGL GLT LTF	RAKFKQLL
36236	CAV AVD VDL DLM LMK MKT KTS TSY SYD YDK DKV KVI VIF	IVTDFSVIK
5115	CAA AAT ATN TNT NTN TNA NAG AGK GKS KST STF	RAKFKQLL
29610	CAE AET ETH THS HSG SGG GGS GSN SNY NYK YKL KLT LTF	GILGFVFTL
641	CAV AVN VNP NPG PGW GWG WGG GGS GSN SNY NYK YKL KLT LTF	ELAGIGILTV
35752	CAG AGG GGG GGS GSG SGG GGS GSY SYI YIP IPT PTF	KLGGALQAK
23843	CAV AVE VEA EAR ARE REG EGG GGS GSE SEK EKL KLV LVF	KLGGALQAK
36096	CAY AYR YRS RSG SGG GGG GGS GSE SEK EKL KLV LVF	KLGGALQAK
31901	CAA AAM AME MET ETS TSY SYD YDK DKV KVI VIF	RAKFKQLL
2667	CAA AAS ASE SET ETS TSY SYD YDK DKV KVI VIF	IVTDFSVIK
36118	CAM AMR MRE REA EAN ANT NTG TGN GNQ NQF QFY FYF	KLGGALQAK
629	CAM AMN MNP NPA PAW AWG WGG GGA GAT ATN TNK NKL KLI LIF	KLGGALQAK
34308	CAA AAS ASV SVG VGS GSS SSN SNT NTG TGK GKL KLI LIF	KLGGALQAK
14625	CAV AVI VIS ISN SNS NSG SGY GYA YAL ALN LNF	GLCTLVAML
35812	CAT ATE TEN ENS NSG SGG GGS GSN SNY NYK YKL KLT LTF	KLGGALQAK
18	CVV VVN VNR NRA RAG AGN GNN NNR NRK RKL KLI LIW	KLGGALQAK
35932	CAG AGG GGG GGN GNT NTG TGK GKL KLI LIF	KLGGALQAK
23825	CAD ADS DSG SGG GGG GGA GAD ADG DGL GLT LTF	RAKFKQLL
35168	CAV AVQ VQP QPQ PQI QIQ IQG QGA GAQ AQK QKL KLV LVF	KLGGALQAK
21860	CAA AAK AKE KEG EGY GYS YST STL TLT LTF	RAKFKQLL
33898	CIV IVN VND NDA DAG AGT GTS TSY SYG YGK GKL KLT LTF	KLGGALQAK
24339	CAV AVD VDR DRG RGA GAQ AQK QKL KLV LVF	KLGGALQAK
75	CAG AGP GPL PLG LGG GGG GGS GSN SNY NYK YKL KLT LTF	KLGGALQAK
5531	CAV AVA VAY AYY YYG YGN GNN NNR NRL RLA LAF	KLGGALQAK
24711	CAF AFM FMT MTS TSP SPG PGG GGT GTS TSY SYG YGK GKL KLT LTF	GILGFVFTL
33580	CAV AVN VNA NAG AGG GGG GGS GSQ SQG QGN GNL NLI LIF	GILGFVFTL
285	CAH AHL HLQ LQG QGA GAQ AQK QKL KLV LVF	IVTDFSVIK
35815	CAE AEN ENL NLF LFS FSG SGA GAG AGS GSY SYQ YQL QLT LTF	IVTDFSVIK
35121	CAD ADL DLR LRD RDG DGQ GQK QKL KLL LLF	KLGGALQAK
2493	CAF AFG FGS GSS SSS SSA SAS ASK SKI KII IIF	KLGGALQAK
27099	CIT ITG TGT GTY TYK YKY KYI YIF	KLGGALQAK
34172	CAV AVQ VQA QAR ARG RGA GAG AGG GGT GTS TSY SYG YGK GKL KLT LTF	KLGGALQAK
760	CAA AAA AAR ARM RMD MDS DSS SSY SYK YKL KLI LIF	AVFDRKSDAK
33498	CAY AYS YSY SYG YGG GGS GSQ SQG QGN GNL NLI LIF	GILGFVFTL
18333	CAV AVN VNA NAV AVS VSN SNQ NQA QAG AGT GTA TAL ALI LIF	RAKFKQLL
23876	CAG AGG GGG GGS GSQ SQG QGN GNL NLI LIF	KLGGALQAK
34111	CAV AVD VDT DTS TSG SGS GSE SEK EKL KLV LVF	AVFDRKSDAK
34780	CAL ALS LSE SEA EAK AKA KAA AAG AGN GNK NKL KLT LTF	KLGGALQAK
17877	CAY AYR YRD RDD DDY DYK YKL KLS LSF	RAKFKQLL
33894	CAL ALG LGE GES ESA SAG AGG GGT GTS TSY SYG YGK GKL KLT LTF	GILGFVFTL
28457	CAF AFM FMK MKG KGA GAG AGG GGT GTS TSY SYG YGK GKL KLT LTF	GILGFVFTL
4964	CAE AEN ENM NMG MGG GGG GGS GSQ SQG QGN GNL NLI LIF	GILGFVFTL
34119	CVV VVS VSV SVL VLG LGG GGA GAD ADG DGL GLT LTF	KLGGALQAK
37689	CAT ATA TAS ASS SST STD TDS DSW SWG WGK GKL KLQ LQF	IVTDFSVIK
31624	CIL ILR LRD RDV DVG VGT GTG TGT GTA TAS ASK SKL KLT LTF	GILGFVFTL
47	CAG AGA GAS ASG SGG GGS GSQ SQG QGN GNL NLI LIF	GILGFVFTL
23372	CAA AAK AKE KEG EGY GYS YST STL TLT LTF	KLGGALQAK
5697	CAS ASA SAG AGS GSG SGN GNT NTG TGK GKL KLI LIF	GILGFVFTL
32364	CAA AAS ASP SPN PNA NAG AGG GGT GTS TSY SYG YGK GKL KLT LTF	GILGFVFTL
23973	CAD ADS DSG SGG GGG GGA GAD ADG DGL GLT LTF	RAKFKQLL
34398	CAV AVR VRD RDY DYK YKL KLS LSF	KLGGALQAK
23211	CVV VVN VNI NIE IEG EGT GTG TGN GNQ NQF QFY FYF	KLGGALQAK
6545	CAG AGP GPT PTH THN HNM NMN MNY NYG YGG GGS GSQ SQG QGN GNL NLI LIF	GILGFVFTL
32337	CAL ALS LSE SEA EAG AGV GVT VTG TGG GGS GSY SYI YIP IPT PTF	GILGFVFTL
25719	CVV VVN VNS NSF SFS FSG SGA GAG AGS GSY SYQ YQL QLT LTF	KLGGALQAK
31630	CAG AGA GAG AGG GGG GGS GSQ SQG QGN GNL NLI LIF	GILGFVFTL
35149	CAV AVR VRD RDP DPS PSG SGG GGS GSY SYI YIP IPT PTF	KLGGALQAK
220	CAK AKG KGG GGS GSG SGY GYS YST STL TLT LTF	ELAGIGILTV
4257	CAW AWS WSS SSN SNA NAG AGG GGT GTS TSY SYG YGK GKL KLT LTF	GILGFVFTL
35241	CAV AVN VNL NLA LAL ALY LYT YTG TGN GNQ NQF QFY FYF	KLGGALQAK
196	CAV AVG VGD GDN DNF NFN FNK NKF KFY FYF	AVFDRKSDAK
23663	CVP VPR PRN RNF NFG FGN GNE NEK EKL KLT LTF	RAKFKQLL
15320	CIV IVR VRV RVW VWG WGQ GQA QAG AGT GTA TAL ALI LIF	KLGGALQAK
17511	CAG AGA GAS ASG SGS GSS SSN SNT NTG TGK GKL KLI LIF	GILGFVFTL
27730	CAM AMS MSR SRS RSG SGG GGS GSN SNY NYK YKL KLT LTF	RAKFKQLL
34250	CAV AVQ VQA QAS ASS SSN SNF NFG FGN GNE NEK EKL KLT LTF	KLGGALQAK
28684	CIL ILR LRD RDL DLN LNA NAG AGG GGT GTS TSY SYG YGK GKL KLT LTF	KLGGALQAK
35136	CAV AVV VVS VSN SNN NNN NND NDM DMR MRF	KLGGALQAK
34434	CAV AVE VES ESP SPY PYG YGN GNN NNR NRL RLA LAF	KLGGALQAK
34051	CLV LVG VGD GDM DME MEG EGG GGS GST STL TLG LGR GRL RLY LYF	KLGGALQAK
36199	CAV AVD VDL DLM LMK MKT KTS TSY SYD YDK DKV KVI VIF	IVTDFSVIK
17975	CGA GAG AGS GSY SYQ YQL QLT LTF	KLGGALQAK
7035	CAA AAS ASD SDV DVD VDY DYK YKL KLS LSF	GILGFVFTL
23827	CAV AVK VKR KRA RAR ARL RLM LMF	KLGGALQAK
5110	CAL ALG LGE GEG EGE GEE EEN ENA NAG AGG GGT GTS TSY SYG YGK GKL KLT LTF	KLGGALQAK
24334	CAL ALS LSE SEG EGN GNS NSG SGG GGY GYQ YQK QKV KVT VTF	IVTDFSVIK
64	CAF AFL FLG LGG GGA GAN ANN NNL NLF LFF	KLGGALQAK
2790	CAV AVS VST STV TVP VPP PPS PSG SGG GGY GYQ YQK QKV KVT VTF	IVTDFSVIK
5869	CAV AVG VGG GGS GSQ SQG QGN GNL NLI LIF	GILGFVFTL
35455	CAV AVV VVP VPL PLT LTG TGA GAG AGS GSY SYQ YQL QLT LTF	KLGGALQAK
14628	CAL ALG LGG GGF GFG FGT GTY TYK YKY KYI YIF	KLGGALQAK
25705	CIV IVR VRE REG EGN GNL NLD LDD DDM DMR MRF	RAKFKQLL
3468	CAV AVR VRD RDS DSG SGD GDK DKI KII IIF	KLGGALQAK
36264	CAM AMR MRN RNY NYG YGG GGS GSQ SQG QGN GNL NLI LIF	KLGGALQAK
5373	CAL ALS LSD SDL DLA LAG AGG GGT GTS TSY SYG YGK GKL KLT LTF	KLGGALQAK
34549	CAL ALW LWG WGE GET ETS TSG SGS GSR SRL RLT LTF	KLGGALQAK
5238	CIL ILS LSS SSG SGT GTY TYK YKY KYI YIF	GILGFVFTL
35554	CAV AVS VSL SLG LGD GDY DYK YKL KLS LSF	KLGGALQAK
7338	CAA AAA AAE AET ETS TSY SYD YDK DKV KVI VIF	GILGFVFTL
28864	CAL ALG LGD GDY DYR YRD RDD DDK DKI KII IIF	KLGGALQAK
34719	CAV AVC VCS CSG SGG GGY GYN YNK NKL KLI LIF	ELAGIGILTV
32772	CAT ATE TEG EGA GAY AYS YSG SGA GAG AGS GSY SYQ YQL QLT LTF	GILGFVFTL
30554	CAV AVR VRP RPH PHT HTG TGG GGF GFK FKT KTI TIF	GILGFVFTL
