422	CAA AAS ASK SKG KGT GTG TGF GFQ FQK QKL KLV LVF	CAS ASS SSH SHP HPS PSE SEG EGS GSR SRK RKK KKY KYE YEQ EQY QYF	YLQPRTFLL	CAASKGTGFQKLVF	TRAV13-1	TRAJ8	CASSHPSEGSRKKYEQYF	TRBV4-2	TRBJ2-7
146	CAM AMR MRG RGY GYG YGG GGS GSQ SQG QGN GNL NLI LIF	CAS ASS SSQ SQE QEW EWR WRE REF EFL FLR LRE REQ EQF QFF	TTDPSFLGRY	CAMRGYGGSQGNLIF	TRAV14/DV4	TRAJ42	CASSQEWREFLREQFF	TRBV4-1	TRBJ2-1
3	CAV AVP VPG PGN GNN NND NDM DMR MRF	CAS ASS SSN SNP NPG PGP GPW PWG WGS GSP SPL PLH LHF	LTDEMIAQY	CAVPGNNDMRF	TRAV39	TRAJ43	CASSNPGPWGSPLHF	TRBV6-5	TRBJ1-6
92	CAA AAR ARG RGP GPS PSG SGY GYS YST STL TLT LTF	CAI AIS ISE SEP EPG PGS GSN SNT NTE TEA EAF AFF	LTDEMIAQY	CAARGPSGYSTLTF	TRAV12-2	TRAJ11	CAISEPGSNTEAFF	TRBV10-3	TRBJ1-1
38	CVF VFY FYQ YQG QGG GGK GKL KLI LIF	CAS ASR SRD RDE DEG EGR GRG RGR GRY RYG YGA GAN ANV NVL VLT LTF	LTDEMIAQY	CVFYQGGKLIF	TRAV24	TRAJ23	CASRDEGRGRYGANVLTF	TRBV7-9	TRBJ2-6
165	CAL ALM LMT MTG TGN GNQ NQF QFY FYF	CAS ASS SSP SPG PGF GFP FPE PEQ EQF QFF	TTDPSFLGRY	CALMTGNQFYF	TRAV6	TRAJ49	CASSPGFPEQFF	TRBV6-2	TRBJ2-1
203	CAV AVR VRT RTS TSG SGT GTY TYK YKY KYI YIF	CAS ASS SSI SIP IPA PAS ASG SGT GTL TLE LEQ EQF QFF	TTDPSFLGRY	CAVRTSGTYKYIF	TRAV21	TRAJ40	CASSIPASGTLEQFF	TRBV19	TRBJ2-1
457	CVV VVN VNG NGN GNT NTD TDK DKL KLI LIF	CAS ASN SNE NEQ EQN QNS NSN SNE NEQ EQF QFF	YLQPRTFLL	CVVNGNTDKLIF	TRAV12-1	TRAJ34	CASNEQNSNEQFF	TRBV7-9	TRBJ2-1
135	CAP APA PAV AVY VYN YNF NFN FNK NKF KFY FYF	CAS ASS SSL SLD LDN DNS NSP SPL PLH LHF	TTDPSFLGRY	CAPAVYNFNKFYF	TRAV12-2	TRAJ21	CASSLDNSPLHF	TRBV28	TRBJ1-6
240	CAL ALS LSG SGN GNT NTD TDK DKL KLI LIF	CAS ASS SSL SLA LAG AGG GGI GIV IVD VDE DEQ EQF QFF	TTDPSFLGRY	CALSGNTDKLIF	TRAV9-2	TRAJ34	CASSLAGGIVDEQFF	TRBV28	TRBJ2-1
378	CAA AAN ANR NRL RLG LGG GGT GTS TSY SYG YGK GKL KLT LTF	CAS ASS SSE SEG EGL GLV LVY VYE YEQ EQY QYF	TTDPSFLGRY	CAANRLGGTSYGKLTF	TRAV8-4	TRAJ52	CASSEGLVYEQYF	TRBV2	TRBJ2-7
237	CAV AVK VKE KER ERH RHS HSS SSA SAS ASK SKI KII IIF	CAS ASS SSF SFE FEN ENT NTG TGE GEL ELF LFF	TTDPSFLGRY	CAVKERHSSASKIIF	TRAV12-2	TRAJ3	CASSFENTGELFF	TRBV28	TRBJ2-2
548	CVV VVN VNN NNA NAD ADK DKL KLI LIF	CSA SAR ARD RDS DSM SMA MAQ AQN QNT NTG TGE GEL ELF LFF	YLQPRTFLL	CVVNNADKLIF	TRAV12-1	TRAJ34	CSARDSMAQNTGELFF	TRBV20-1	TRBJ2-2
480	CAF AFF FFP FPR PRS RSS SST STL TLG LGR GRL RLY LYF	CAT ATL TLG LGT GTS TSG SGH GHN HNE NEQ EQF QFF	YLQPRTFLL	CAFFPRSSTLGRLYF	TRAV24	TRAJ18	CATLGTSGHNEQFF	TRBV15	TRBJ2-1
528	CAA AAS ASN SNS NSQ SQE QET ETS TSG SGS GSR SRL RLT LTF	CAS AST STN TNW NWG WGL GLR LRQ RQP QPQ PQH QHF	YLQPRTFLL	CAASNSQETSGSRLTF	TRAV23/DV6	TRAJ58	CASTNWGLRQPQHF	TRBV19	TRBJ1-5
98	CAG AGR GRN RNA NAG AGK GKS KST STF	CAS ASS SSL SLV LVV VVT VTG TGE GEL ELF LFF	LTDEMIAQY	CAGRNAGKSTF	TRAV35	TRAJ27	CASSLVVTGELFF	TRBV7-3	TRBJ2-2
505	CAA AAS ASL SLN LNN NNF NFN FNK NKF KFY FYF	CAS ASS SSH SHR HRN RNT NTL TLE LEA EAF AFF	YLQPRTFLL	CAASLNNFNKFYF	TRAV13-1	TRAJ21	CASSHRNTLEAFF	TRBV4-3	TRBJ1-1
335	CAR ARG RGG GGA GAT ATN TNK NKL KLI LIF	CSA SAR ARI RIL ILA LAG AGD GDT DTG TGE GEL ELF LFF	TTDPSFLGRY	CARGGATNKLIF	TRAV1-2	TRAJ32	CSARILAGDTGELFF	TRBV20-1	TRBJ2-2
386	CAV AVR VRG RGT GTG TGR GRR RRA RAL ALT LTF	CSA SAG AGG GGT GTG TGI GIY IYG YGS GSY SYE YEQ EQY QYF	YLQPRTFLL	CAVRGTGRRALTF	TRAV1-2	TRAJ5	CSAGGTGIYGSYEQYF	TRBV20-1	TRBJ2-7
55	CVV VVN VNA NAR ARG RGY GYD YDK DKV KVI VIF	CAS ASS SSP SPS PST STG TGK GKV KVS VST STE TEA EAF AFF	LTDEMIAQY	CVVNARGYDKVIF	TRAV12-1	TRAJ50	CASSPSTGKVSTEAFF	TRBV12-4	TRBJ1-1
228	CVV VVF VFP FPG PGS GSA SAR ARQ RQL QLT LTF	CSA SAR ARD RDP DPR PRT RTG TGS GSS SSY SYE YEQ EQY QYF	TTDPSFLGRY	CVVFPGSARQLTF	TRAV12-1	TRAJ22	CSARDPRTGSSYEQYF	TRBV20-1	TRBJ2-7
591	CAP APG PGR GRI RIQ IQG QGA GAQ AQK QKL KLV LVF	CAS ASS SSG SGG GGA GAL ALS LSE SEQ EQY QYF	YLQPRTFLL	CAPGRIQGAQKLVF	TRAV24	TRAJ54	CASSGGALSEQYF	TRBV19	TRBJ2-7
272	CAV AVN VNS NSG SGG GGY GYQ YQK QKV KVT VTF	CAS ASS SSF SFE FEN ENT NTG TGE GEL ELF LFF	TTDPSFLGRY	CAVNSGGYQKVTF	TRAV1-2	TRAJ13	CASSFENTGELFF	TRBV28	TRBJ2-2
46	CAE AES EST STG TGG GGA GAG AGK GKS KST STF	CAS ASS SSS SSR SRH RHS HSG SGE GEK EKL KLF LFF	LTDEMIAQY	CAESTGGAGKSTF	TRAV5	TRAJ27	CASSSRHSGEKLFF	TRBV27	TRBJ1-4
340	CAT ATD TDG DGD GDS DSG SGY GYA YAL ALN LNF	CAT ATL TLS LSG SGD GDI DIY IYN YNE NEQ EQF QFF	TTDPSFLGRY	CATDGDSGYALNF	TRAV17	TRAJ41	CATLSGDIYNEQFF	TRBV6-2	TRBJ2-1
391	CVV VVN VNR NRN RNN NND NDM DMR MRF	CAS ASM SMD MDE DEN ENT NTG TGE GEL ELF LFF	YLQPRTFLL	CVVNRNNDMRF	TRAV12-1	TRAJ43	CASMDENTGELFF	TRBV5-1	TRBJ2-2
147	CLV LVG VGD GDP DPR PRG RGG GGY GYN YNK NKL KLI LIF	CAS ASK SKG KGG GGQ GQE QET ETQ TQY QYF	TTDPSFLGRY	CLVGDPRGGYNKLIF	TRAV4	TRAJ4	CASKGGQETQYF	TRBV7-9	TRBJ2-5
143	CAL ALS LSE SEG EGR GRA RAY AYG YGG GGS GSQ SQG QGN GNL NLI LIF	CAS ASS SSA SAS ASN SNG NGG GGG GGE GET ETQ TQY QYF	TTDPSFLGRY	CALSEGRAYGGSQGNLIF	TRAV19	TRAJ42	CASSASNGGGETQYF	TRBV9	TRBJ2-5
500	CVV VVN VNR NRR RRD RDD DDM DMR MRF	CSA SAH AHR HRD RDQ DQN QNT NTG TGE GEL ELF LFF	YLQPRTFLL	CVVNRRDDMRF	TRAV12-1	TRAJ43	CSAHRDQNTGELFF	TRBV20-1	TRBJ2-2
196	CAV AVT VTD TDS DSN SNY NYQ YQL QLI LIW	CAS ASR SRP RPP PPG PGA GAD ADT DTE TEA EAF AFF	TTDPSFLGRY	CAVTDSNYQLIW	TRAV21	TRAJ33	CASRPPGADTEAFF	TRBV7-9	TRBJ1-1
262	CAL ALD LDT DTG TGN GNQ NQF QFY FYF	CAS ASN SNP NPG PGH GHS HSN SNQ NQP QPQ PQH QHF	TTDPSFLGRY	CALDTGNQFYF	TRAV6	TRAJ49	CASNPGHSNQPQHF	TRBV6-5	TRBJ1-5
549	CAM AMS MSG SGY GYK YKL KLS LSF	CAS ASS SSE SEG EGP GPG PGG GGD GDE DEQ EQY QYF	YLQPRTFLL	CAMSGYKLSF	TRAV12-3	TRAJ20	CASSEGPGGDEQYF	TRBV6-1	TRBJ2-7
81	CAV AVR VRD RDE DED EDD DDK DKI KII IIF	CAS ASS SSL SLP LPG PGR GRG RGE GET ETQ TQY QYF	LTDEMIAQY	CAVRDEDDKIIF	TRAV1-1	TRAJ30	CASSLPGRGETQYF	TRBV7-9	TRBJ2-5
110	CAV AVN VNT NTG TGN GNQ NQF QFY FYF	CAS ASR SRW RWA WAP APG PGE GEL ELF LFF	LTDEMIAQY	CAVNTGNQFYF	TRAV20	TRAJ49	CASRWAPGELFF	TRBV11-2	TRBJ2-2
487	CAV AVN VNA NAA AAG AGG GGG GGA GAD ADG DGL GLT LTF	CAS ASS SSE SES ESS SSG SGG GGF GFF FFN FNE NEQ EQF QFF	YLQPRTFLL	CAVNAAGGGADGLTF	TRAV8-1	TRAJ45	CASSESSGGFFNEQFF	TRBV2	TRBJ2-1
509	CAV AVK VKD KDT DTD TDK DKL KLI LIF	CAS ASS SSL SLA LAG AGS GSS SSY SYN YNS NSP SPL PLH LHF	YLQPRTFLL	CAVKDTDKLIF	TRAV21	TRAJ34	CASSLAGSSYNSPLHF	TRBV7-8	TRBJ1-6
241	CAV AVR VRD RDR DRM RMN MNR NRD RDD DDK DKI KII IIF	CAS ASS SSL SLT LTD TDS DST STD TDT DTQ TQY QYF	TTDPSFLGRY	CAVRDRMNRDDKIIF	TRAV3	TRAJ30	CASSLTDSTDTQYF	TRBV27	TRBJ2-3
163	CAE AES ESL SLG LGG GGY GYS YST STL TLT LTF	CAS AST STD TDS DSD SDT DTQ TQY QYF	TTDPSFLGRY	CAESLGGYSTLTF	TRAV5	TRAJ11	CASTDSDTQYF	TRBV6-5	TRBJ2-3
367	CAA AAS ASG SGG GGS GSY SYI YIP IPT PTF	CAS ASS SSV SVE VEE EET ETS TSA SAG AGG GGH GHE HEQ EQF QFF	TTDPSFLGRY	CAASGGSYIPTF	TRAV9-2	TRAJ6	CASSVEETSAGGHEQFF	TRBV9	TRBJ2-1
202	CAG AGG GGA GAD ADK DKL KLI LIF	CAS ASS SSL SLR LRQ RQG QGA GAD ADT DTQ TQY QYF	TTDPSFLGRY	CAGGADKLIF	TRAV21	TRAJ34	CASSLRQGADTQYF	TRBV12-4	TRBJ2-3
326	CAL ALS LSE SED EDG DGT GTG TGG GGF GFK FKT KTI TIF	CAS ASE SER ERR RRG RGL GLS LSG SGY GYT YTF	TTDPSFLGRY	CALSEDGTGGFKTIF	TRAV19	TRAJ9	CASERRGLSGYTF	TRBV6-1	TRBJ1-2
142	CAM AME MET ETG TGN GNQ NQF QFY FYF	CAS ASD SDS DSG SGY GYT YTE TEA EAF AFF	TTDPSFLGRY	CAMETGNQFYF	TRAV12-3	TRAJ49	CASDSGYTEAFF	TRBV19	TRBJ1-1
225	CAM AMS MSA SAI AIE IET ETS TSG SGS GSR SRL RLT LTF	CAS ASS SSV SVA VAY AYE YEQ EQY QYF	TTDPSFLGRY	CAMSAIETSGSRLTF	TRAV12-3	TRAJ58	CASSVAYEQYF	TRBV6-6	TRBJ2-7
533	CAV AVK VKD KDK DKL KLI LIF	CAS ASS SSL SLT LTS TSG SGS GSE SEQ EQF QFF	YLQPRTFLL	CAVKDKLIF	TRAV5	TRAJ34	CASSLTSGSEQFF	TRBV11-2	TRBJ2-1
32	CAL ALR LRI RIY IYN YNQ NQG QGG GGK GKL KLI LIF	CAS ASS SSV SVG VGL GLA LAG AGV GVY VYS YSY SYN YNE NEQ EQF QFF	LTDEMIAQY	CALRIYNQGGKLIF	TRAV19	TRAJ23	CASSVGLAGVYSYNEQFF	TRBV5-1	TRBJ2-1
404	CAV AVS VSR SRS RSR SRG RGG GGF GFG FGN GNV NVL VLH LHC	CSA SAR ARD RDP DPW PWQ WQV QVN VNT NTG TGE GEL ELF LFF	YLQPRTFLL	CAVSRSRGGFGNVLHC	TRAV1-2	TRAJ35	CSARDPWQVNTGELFF	TRBV20-1	TRBJ2-2
438	CAV AVT VTP TPL PLY LYG YGG GGS GSQ SQG QGN GNL NLI LIF	CAS ASS SSL SLV LVG VGT GTS TSG SGR GRP RPA PAG AGD GDE DEQ EQF QFF	YLQPRTFLL	CAVTPLYGGSQGNLIF	TRAV12-2	TRAJ42	CASSLVGTSGRPAGDEQFF	TRBV5-1	TRBJ2-1
395	CVV VVN VNT NTG TGL GLT LTG TGG GGG GGN GNK NKL KLT LTF	CAE AEQ EQD QDM DMN MNT NTG TGE GEL ELF LFF	YLQPRTFLL	CVVNTGLTGGGNKLTF	TRAV12-1	TRAJ10	CAEQDMNTGELFF	TRBV2	TRBJ2-2
259	CAV AVL VLS LSG SGN GNT NTG TGK GKL KLI LIF	CAS ASS SSL SLD LDG DGY GYT YTG TGE GEL ELF LFF	TTDPSFLGRY	CAVLSGNTGKLIF	TRAV21	TRAJ37	CASSLDGYTGELFF	TRBV27	TRBJ2-2
479	CAG AGG GGD GDN DNF NFN FNK NKF KFY FYF	CAS ASS SSP SPR PRT RTA TAT ATY TYE YEQ EQY QYF	YLQPRTFLL	CAGGDNFNKFYF	TRAV27	TRAJ21	CASSPRTATYEQYF	TRBV7-8	TRBJ2-7
560	CAG AGL GLN LND NDY DYK YKL KLS LSF	CAS AST STG TGA GAD ADT DTQ TQY QYF	YLQPRTFLL	CAGLNDYKLSF	TRAV1-2	TRAJ20	CASTGADTQYF	TRBV6-6	TRBJ2-3
355	CVV VVG VGT GTG TGF GFQ FQK QKL KLV LVF	CAS ASS SSF SFV FVS VSE SEE EEH EHN HNG NGY GYT YTF	TTDPSFLGRY	CVVGTGFQKLVF	TRAV12-1	TRAJ8	CASSFVSEEHNGYTF	TRBV7-9	TRBJ1-2
521	CAG AGV GVT VTG TGG GGG GGN GNK NKL KLT LTF	CAS ASS SSA SAG AGT GTG TGF GFY FYG YGY GYT YTF	YLQPRTFLL	CAGVTGGGNKLTF	TRAV35	TRAJ10	CASSAGTGFYGYTF	TRBV6-1	TRBJ1-2
145	CAA AAG AGG GGS GSQ SQG QGN GNL NLI LIF	CAS ASS SSS SSR SRA RAG AGA GAT ATD TDT DTQ TQY QYF	TTDPSFLGRY	CAAGGSQGNLIF	TRAV1-2	TRAJ42	CASSSRAGATDTQYF	TRBV27	TRBJ2-3
153	CAV AVP VPA PAF AFG FGN GNE NEK EKL KLT LTF	CAS ASS SSP SPT PTS TSG SGS GST STD TDT DTQ TQY QYF	TTDPSFLGRY	CAVPAFGNEKLTF	TRAV20	TRAJ48	CASSPTSGSTDTQYF	TRBV27	TRBJ2-3
192	CAL ALG LGG GGS GSQ SQG QGN GNL NLI LIF	CAS ASS SSL SLR LRS RSG SGQ GQD QDE DEQ EQF QFF	TTDPSFLGRY	CALGGSQGNLIF	TRAV9-2	TRAJ42	CASSLRSGQDEQFF	TRBV27	TRBJ2-1
108	CAT ATD TDG DGA GAQ AQK QKL KLV LVF	CAS ASS SSY SYW YWG WGG GGT GTD TDT DTQ TQY QYF	LTDEMIAQY	CATDGAQKLVF	TRAV17	TRAJ54	CASSYWGGTDTQYF	TRBV6-6	TRBJ2-3
468	CAG AGL GLN LNY NYG YGG GGS GSQ SQG QGN GNL NLI LIF	CAS ASS SSL SLS LSL SLS LSQ SQG QGS GSF SFG FGY GYT YTF	YLQPRTFLL	CAGLNYGGSQGNLIF	TRAV35	TRAJ42	CASSLSLSQGSFGYTF	TRBV7-8	TRBJ1-2
525	CAT ATD TDD DDR DRG RGA GAQ AQK QKL KLV LVF	CSA SAS ASG SGG GGS GSY SYG YGS GSY SYN YNE NEQ EQF QFF	YLQPRTFLL	CATDDRGAQKLVF	TRAV17	TRAJ54	CSASGGSYGSYNEQFF	TRBV20-1	TRBJ2-1
148	CAM AMS MSD SDL DLT LTG TGT GTA TAS ASK SKL KLT LTF	CAS ASS SSL SLS LSD SDS DSY SYE YEQ EQY QYF	TTDPSFLGRY	CAMSDLTGTASKLTF	TRAV12-3	TRAJ44	CASSLSDSYEQYF	TRBV5-8	TRBJ2-7
234	CAA AAS ASV SVV VVS VSM SMD MDS DSS SSY SYK YKL KLI LIF	CAS ASS SSP SPN PNQ NQG QGL GLT LTQ TQY QYE YEQ EQY QYF	TTDPSFLGRY	CAASVVSMDSSYKLIF	TRAV29/DV5	TRAJ12	CASSPNQGLTQYEQYF	TRBV5-6	TRBJ2-7
296	CAV AVP VPS PSF SFG FGN GNE NEK EKL KLT LTF	CAS ASS SSA SAF AFF FFE FES ESG SGE GEL ELF LFF	TTDPSFLGRY	CAVPSFGNEKLTF	TRAV20	TRAJ48	CASSAFFESGELFF	TRBV27	TRBJ2-2
254	CVV VVS VSD SDQ DQE QEG EGA GAQ AQK QKL KLV LVF	CAS ASS SSL SLI LIL ILM LMG MGT GTS TSG SGG GGE GEQ EQF QFF	TTDPSFLGRY	CVVSDQEGAQKLVF	TRAV8-2	TRAJ54	CASSLILMGTSGGEQFF	TRBV7-3	TRBJ2-1
373	CAV AVS VSG SGY GYG YGN GNK NKL KLV LVF	CAS ASS SSS SSS SSG SGP GPV PVN VNE NEQ EQF QFF	TTDPSFLGRY	CAVSGYGNKLVF	TRAV8-4	TRAJ47	CASSSSGPVNEQFF	TRBV27	TRBJ2-1
155	CAA AAS ASE SEG EGN GNT NTG TGF GFQ FQK QKL KLV LVF	CAS ASS SSL SLP LPT PTG TGE GET ETQ TQY QYF	TTDPSFLGRY	CAASEGNTGFQKLVF	TRAV29/DV5	TRAJ8	CASSLPTGETQYF	TRBV5-6	TRBJ2-5
83	CAL ALS LSN SNS NSN SNS NSG SGY GYA YAL ALN LNF	CSV SVG VGP GPR PRQ RQL QLM LMN MNT NTE TEA EAF AFF	LTDEMIAQY	CALSNSNSGYALNF	TRAV19	TRAJ41	CSVGPRQLMNTEAFF	TRBV29-1	TRBJ1-1
226	CAV AVP VPT PTD TDS DSW SWG WGK GKL KLQ LQF	CAS ASS SSE SEI EII IIS ISG SGN GNY NYG YGY GYT YTF	TTDPSFLGRY	CAVPTDSWGKLQF	TRAV1-1	TRAJ24	CASSEIISGNYGYTF	TRBV28	TRBJ1-2
260	CAV AVP VPN PNF NFG FGN GNE NEK EKL KLT LTF	CAS ASS SSL SLS LSG SGL GLG LGE GET ETQ TQY QYF	TTDPSFLGRY	CAVPNFGNEKLTF	TRAV20	TRAJ48	CASSLSGLGETQYF	TRBV27	TRBJ2-5
583	CAV AVR VRD RDS DSN SNY NYQ YQL QLI LIW	CAS ASS SSP SPG PGA GAP APG PGQ GQG QGS GSY SYE YEQ EQY QYF	YLQPRTFLL	CAVRDSNYQLIW	TRAV1-2	TRAJ33	CASSPGAPGQGSYEQYF	TRBV27	TRBJ2-7
181	CAQ AQS QSN SNY NYK YKL KLT LTF	CAS ASS SST STR TRA RAT ATN TNE NEK EKL KLF LFF	TTDPSFLGRY	CAQSNYKLTF	TRAV9-2	TRAJ53	CASSTRATNEKLFF	TRBV27	TRBJ1-4
224	CAF AFI FIR IRD RDY DYK YKL KLS LSF	CAS ASS SSL SLG LGL GLN LNE NEQ EQF QFF	TTDPSFLGRY	CAFIRDYKLSF	TRAV24	TRAJ20	CASSLGLNEQFF	TRBV27	TRBJ2-1
571	CVN VNM NMD MDS DSN SNY NYQ YQL QLI LIW	CSA SAR ARG RGS GSS SSQ SQW QWE WET ETQ TQY QYF	YLQPRTFLL	CVNMDSNYQLIW	TRAV1-2	TRAJ33	CSARGSSQWETQYF	TRBV20-1	TRBJ2-5
118	CAV AVR VRG RGG GGS GSG SGT GTY TYK YKY KYI YIF	CAS ASS SSL SLP LPR PRA RAN ANT NTG TGE GEL ELF LFF	LTDEMIAQY	CAVRGGSGTYKYIF	TRAV21	TRAJ40	CASSLPRANTGELFF	TRBV19	TRBJ2-2
220	CAA AAS ASQ SQD QDS DSW SWG WGK GKL KLQ LQF	CAS ASS SSL SLA LAS ASG SGQ GQG QGP GPY PYE YEQ EQY QYF	TTDPSFLGRY	CAASQDSWGKLQF	TRAV29/DV5	TRAJ24	CASSLASGQGPYEQYF	TRBV5-6	TRBJ2-7
198	CAV AVA VAP APS PSL SLG LGF GFG FGN GNV NVL VLH LHC	CAS AST STK TKG KGG GGT GTD TDT DTQ TQY QYF	TTDPSFLGRY	CAVAPSLGFGNVLHC	TRAV12-2	TRAJ35	CASTKGGTDTQYF	TRBV6-2	TRBJ2-3
268	CGT GTG TGL GLA LAY AYN YNN NND NDM DMR MRF	CAS ASS SSR SRP RPE PEG EGE GEQ EQY QYF	TTDPSFLGRY	CGTGLAYNNDMRF	TRAV30	TRAJ43	CASSRPEGEQYF	TRBV10-2	TRBJ2-7
168	CAL ALS LSD SDN DNQ NQG QGN GNL NLI LIF	CAS ASS SSY SYP YPR PRR RRS RSS SSS SSY SYN YNE NEQ EQF QFF	TTDPSFLGRY	CALSDNQGNLIF	TRAV9-2	TRAJ42	CASSYPRRSSSYNEQFF	TRBV28	TRBJ2-1
325	CAV AVS VSL SLG LGN GNR NRL RLA LAF	CAS ASG SGI GIA IAG AGP GPT PTD TDT DTQ TQY QYF	TTDPSFLGRY	CAVSLGNRLAF	TRAV1-2	TRAJ7	CASGIAGPTDTQYF	TRBV27	TRBJ2-3
523	CVV VVN VNN NNN NNN NND NDM DMR MRF	CAG AGQ GQG QGM GMN MNT NTG TGE GEL ELF LFF	YLQPRTFLL	CVVNNNNDMRF	TRAV12-1	TRAJ43	CAGQGMNTGELFF	TRBV19	TRBJ2-2
282	CAA AAT ATP TPG PGS GSN SNY NYK YKL KLT LTF	CAS ASS SSF SFT FTP TPG PGG GGQ GQE QET ETQ TQY QYF	TTDPSFLGRY	CAATPGSNYKLTF	TRAV29/DV5	TRAJ53	CASSFTPGGQETQYF	TRBV5-6	TRBJ2-5
57	CAM AMR MRG RGS GSE SEN ENT NTG TGT GTA TAS ASK SKL KLT LTF	CAS ASS SSV SVV VVL VLT LTS TSG SGP GPT PTD TDT DTQ TQY QYF	LTDEMIAQY	CAMRGSENTGTASKLTF	TRAV14/DV4	TRAJ44	CASSVVLTSGPTDTQYF	TRBV9	TRBJ2-3
256	CAV AVG VGS GSM SMG MGG GGG GGY GYQ YQK QKV KVT VTF	CAS ASS SSQ SQY QYR YRE RET ETS TSD SDT DTQ TQY QYF	TTDPSFLGRY	CAVGSMGGGYQKVTF	TRAV8-3	TRAJ13	CASSQYRETSDTQYF	TRBV4-1	TRBJ2-3
27	CAG AGR GRL RLL LLI LIY IYG YGQ GQN QNF NFV FVF	CAT ATG TGL GLG LGF GFD FDY DYG YGY GYT YTF	LTDEMIAQY	CAGRLLIYGQNFVF	TRAV25	TRAJ26	CATGLGFDYGYTF	TRBV19	TRBJ1-2
297	CAV AVA VAP APL PLR LRA RAD ADG DGQ GQK QKL KLL LLF	CAS ASS SSL SLD LDQ DQD QDR DRA RAY AYT YTG TGE GEL ELF LFF	TTDPSFLGRY	CAVAPLRADGQKLLF	TRAV8-3	TRAJ16	CASSLDQDRAYTGELFF	TRBV27	TRBJ2-2
291	CAM AMS MSP SPM PMG MGA GAG AGS GSY SYQ YQL QLT LTF	CAS ASA SAS ASE SEL ELA LAD ADT DTD TDT DTQ TQY QYF	TTDPSFLGRY	CAMSPMGAGSYQLTF	TRAV14/DV4	TRAJ28	CASASELADTDTQYF	TRBV10-1	TRBJ2-3
407	CAF AFG FGD GDT DTG TGR GRR RRA RAL ALT LTF	CAS ASS SSI SIS ISG SGF GFD FDG DGY GYT YTF	YLQPRTFLL	CAFGDTGRRALTF	TRAV24	TRAJ5	CASSISGFDGYTF	TRBV19	TRBJ1-2
212	CAM AMR MRG RGR GRK RKY KYN YNF NFN FNK NKF KFY FYF	CSG SGG GGT GTG TGG GGF GFY FYN YNE NEQ EQF QFF	TTDPSFLGRY	CAMRGRKYNFNKFYF	TRAV14/DV4	TRAJ21	CSGGTGGFYNEQFF	TRBV20-1	TRBJ2-1
275	CAA AAL ALN LNT NTG TGN GNQ NQF QFY FYF	CAS ASS SSL SLA LAG AGN GNE NEQ EQY QYF	TTDPSFLGRY	CAALNTGNQFYF	TRAV27	TRAJ49	CASSLAGNEQYF	TRBV7-9	TRBJ2-7
405	CVV VVN VNQ NQA QAD ADK DKL KLS LSF	CAS ASS SSP SPD PDI DIE IEA EAF AFF	YLQPRTFLL	CVVNQADKLSF	TRAV12-1	TRAJ20	CASSPDIEAFF	TRBV7-9	TRBJ1-1
132	CAA AAS ASA SAF AFI FIS ISN SNT NTG TGK GKL KLI LIF	CAS ASS SSD SDD DDG DGT GTG TGI GIE IET ETQ TQY QYF	TTDPSFLGRY	CAASAFISNTGKLIF	TRAV29/DV5	TRAJ37	CASSDDGTGIETQYF	TRBV9	TRBJ2-5
579	CAV AVG VGS GSA SAK AKG KGS GST STG TGA GAN ANN NNL NLF LFF	CAS ASR SRT RTG TGQ GQG QGA GAT ATQ TQY QYF	YLQPRTFLL	CAVGSAKGSTGANNLFF	TRAV22	TRAJ36	CASRTGQGATQYF	TRBV11-2	TRBJ2-5
287	CAA AAS ASI SIG IGL GLN LNT NTG TGN GNQ NQF QFY FYF	CAS ASS SSF SFT FTG TGN GND NDD DDY DYE YEQ EQY QYF	TTDPSFLGRY	CAASIGLNTGNQFYF	TRAV23/DV6	TRAJ49	CASSFTGNDDYEQYF	TRBV13	TRBJ2-7
94	CAK AKY KYN YNF NFN FNK NKF KFY FYF	CAS ASG SGE GED EDS DSL SLV LVY VYG YGY GYT YTF	LTDEMIAQY	CAKYNFNKFYF	TRAV12-2	TRAJ21	CASGEDSLVYGYTF	TRBV7-9	TRBJ1-2
584	CVV VVN VNK NKM KMD MDD DDM DMR MRF	CSA SAR ART RTD TDH DHN HNT NTG TGE GEL ELF LFF	YLQPRTFLL	CVVNKMDDMRF	TRAV12-1	TRAJ43	CSARTDHNTGELFF	TRBV20-1	TRBJ2-2
184	CAV AVS VSE SEI EIA IAA AAG AGN GNK NKL KLT LTF	CAT ATS TSA SAA AAS ASG SGR GRA RAY AYN YNE NEQ EQF QFF	TTDPSFLGRY	CAVSEIAAGNKLTF	TRAV8-4	TRAJ17	CATSAASGRAYNEQFF	TRBV24-1	TRBJ2-1
471	CAA AAS ASG SGM GMD MDT DTG TGR GRR RRA RAL ALT LTF	CAS ASS SST STR TRT RTE TEG EGT GTE TEA EAF AFF	YLQPRTFLL	CAASGMDTGRRALTF	TRAV13-1	TRAJ5	CASSTRTEGTEAFF	TRBV4-1	TRBJ1-1
522	CAT ATP TPG PGG GGQ GQK QKL KLV LVF	CAS AST STL TLR LRD RDR DRG RGN GNQ NQP QPQ PQH QHF	YLQPRTFLL	CATPGGQKLVF	TRAV17	TRAJ54	CASTLRDRGNQPQHF	TRBV28	TRBJ1-5
210	CAM AMI MIQ IQY QYN YNN NNN NND NDM DMR MRF	CAS ASS SSI SIE IES ESG SGQ GQL QLW LWE WEL ELF LFF	TTDPSFLGRY	CAMIQYNNNDMRF	TRAV14/DV4	TRAJ43	CASSIESGQLWELFF	TRBV19	TRBJ2-2
511	CVV VVN VNR NRD RDD DDK DKI KII IIF	CAS ASS SSH SHR HRN RNT NTL TLE LEA EAF AFF	YLQPRTFLL	CVVNRDDKIIF	TRAV12-1	TRAJ30	CASSHRNTLEAFF	TRBV4-3	TRBJ1-1
255	CAQ AQN QNS NSG SGG GGY GYQ YQK QKV KVT VTF	CAS ASS SSF SFE FEN ENT NTG TGE GEL ELF LFF	TTDPSFLGRY	CAQNSGGYQKVTF	TRAV1-2	TRAJ13	CASSFENTGELFF	TRBV28	TRBJ2-2
371	CAA AAY AYM YMR MRF	CAS ASS SSL SLA LAP APG PGV GVS VSQ SQT QTQ TQY QYF	TTDPSFLGRY	CAAYMRF	TRAV21	TRAJ43	CASSLAPGVSQTQYF	TRBV11-2	TRBJ2-5
455	CVV VVN VNS NSF SFD FDK DKL KLI LIF	CAS ASS SSL SLE LEI EIE IEQ EQY QYF	YLQPRTFLL	CVVNSFDKLIF	TRAV12-1	TRAJ34	CASSLEIEQYF	TRBV7-9	TRBJ2-7
331	CAV AVP VPF PFS FSG SGG GGY GYN YNK NKL KLI LIF	CAT ATS TSR SRA RAG AGQ GQG QGH GHE HEQ EQY QYF	TTDPSFLGRY	CAVPFSGGYNKLIF	TRAV1-2	TRAJ4	CATSRAGQGHEQYF	TRBV15	TRBJ2-7
74	CAY AYT YTS TSG SGG GGS GSN SNY NYK YKL KLT LTF	CAS ASS SSS SSR SRQ RQG QGP GPK PKE KEY EYG YGY GYT YTF	LTDEMIAQY	CAYTSGGSNYKLTF	TRAV38-2/DV8	TRAJ53	CASSSRQGPKEYGYTF	TRBV7-6	TRBJ1-2
413	CVV VVN VNK NKE KED EDD DDM DMR MRF	CAS AST STE TET ETN TNT NTG TGE GEL ELF LFF	YLQPRTFLL	CVVNKEDDMRF	TRAV12-1	TRAJ43	CASTETNTGELFF	TRBV5-1	TRBJ2-2
310	CLV LVG VGD GDI DIP IPP PPM PMK MKL KLI LIF	CAS ASS SSP SPG PGT GTS TSN SNT NTG TGE GEL ELF LFF	TTDPSFLGRY	CLVGDIPPMKLIF	TRAV4	TRAJ4	CASSPGTSNTGELFF	TRBV7-8	TRBJ2-2
506	CAL ALS LSG SGQ GQV QVQ VQD QDQ DQG QGG GGS GSE SEK EKL KLV LVF	CAS ASS SSH SHD HDI DIE IEA EAF AFF	YLQPRTFLL	CALSGQVQDQGGSEKLVF	TRAV16	TRAJ57	CASSHDIEAFF	TRBV7-9	TRBJ1-1
242	CAV AVL VLG LGG GGG GGG GGA GAD ADG DGL GLT LTF	CAS ASS SSV SVY VYE YEL ELS LSL SLP LPG PGA GAA AAQ AQY QYF	TTDPSFLGRY	CAVLGGGGADGLTF	TRAV21	TRAJ45	CASSVYELSLPGAAQYF	TRBV9	TRBJ2-5
319	CAL ALG LGG GGT GTS TSY SYG YGK GKL KLT LTF	CAS ASS SSI SIE IEW EWS WSG SGG GGQ GQE QET ETQ TQY QYF	TTDPSFLGRY	CALGGTSYGKLTF	TRAV9-2	TRAJ52	CASSIEWSGGQETQYF	TRBV19	TRBJ2-5
171	CAS ASG SGG GGS GSQ SQG QGN GNL NLI LIF	CAS ASS SSS SSR SRA RAA AAS AST STD TDT DTQ TQY QYF	TTDPSFLGRY	CASGGSQGNLIF	TRAV9-2	TRAJ42	CASSSRAASTDTQYF	TRBV27	TRBJ2-3
358	CAL ALS LST STS TSQ SQG QGN GNL NLI LIF	CAS ASA SAA AAR ARQ RQG QGS GSD SDE DEQ EQY QYF	TTDPSFLGRY	CALSTSQGNLIF	TRAV9-2	TRAJ42	CASAARQGSDEQYF	TRBV27	TRBJ2-7
581	CAV AVR VRP RPF PFL FLL LLS LSG SGG GGY GYN YNK NKL KLI LIF	CAS ASS SSL SLA LAS AST STD TDT DTQ TQY QYF	YLQPRTFLL	CAVRPFLLSGGYNKLIF	TRAV3	TRAJ4	CASSLASTDTQYF	TRBV28	TRBJ2-3
483	CAV AVS VSF SFQ FQT QTG TGA GAN ANN NNL NLF LFF	CAS ASR SRE REE EET ETG TGI GIR IRF RFY FYE YEQ EQY QYF	YLQPRTFLL	CAVSFQTGANNLFF	TRAV21	TRAJ36	CASREETGIRFYEQYF	TRBV2	TRBJ2-7
227	CVV VVN VNA NAP APR PRF RFW FWT WTG TGG GGY GYQ YQK QKV KVT VTF	CAS ASS SSL SLS LSA SAP APK PKP KPF PFY FYN YNS NSP SPL PLH LHF	TTDPSFLGRY	CVVNAPRFWTGGYQKVTF	TRAV12-1	TRAJ13	CASSLSAPKPFYNSPLHF	TRBV5-6	TRBJ1-6
477	CVV VVN VNV NVR VRD RDR DRL RLM LMF	CAS AST STD TDD DDI DIE IEA EAF AFF	YLQPRTFLL	CVVNVRDRLMF	TRAV12-1	TRAJ31	CASTDDIEAFF	TRBV7-9	TRBJ1-1
