261	CVV VVN VNP NPL PLG LGS GSG SGG GGY GYN YNK NKL KLI LIF	CAS ASS SSS SSS SSA SAE AES ESS SSY SYN YNE NEQ EQF QFF	TTDPSFLGRY	CVVNPLGSGGYNKLIF	TRAV12-1	TRAJ4	CASSSSAESSYNEQFF	TRBV7-6	TRBJ2-1
283	CAE AES ESR SRT RTG TGN GNT NTP TPL PLV LVF	CAT ATD TDS DSS SSS SSY SYE YEQ EQY QYF	TTDPSFLGRY	CAESRTGNTPLVF	TRAV13-2	TRAJ29	CATDSSSYEQYF	TRBV7-9	TRBJ2-7
26	CAY AYR YRS RSS SSN SNY NYQ YQL QLI LIW	CAS ASS SSL SLV LVP VPQ PQG QGP GPN PNY NYG YGY GYT YTF	LTDEMIAQY	CAYRSSNYQLIW	TRAV3	TRAJ33	CASSLVPQGPNYGYTF	TRBV27	TRBJ1-2
244	CLV LVG VGD GDT DTG TGT GTG TGG GGF GFK FKT KTI TIF	CAS AST STS TSG SGG GGT GTQ TQH QHF	TTDPSFLGRY	CLVGDTGTGGFKTIF	TRAV4	TRAJ9	CASTSGGTQHF	TRBV19	TRBJ1-5
465	CAM AMR MRE REG EGN GNN NNY NYG YGQ GQN QNF NFV FVF	CAS ASQ SQR QRG RGG GGR GRE REE EET ETQ TQY QYF	YLQPRTFLL	CAMREGNNYGQNFVF	TRAV14/DV4	TRAJ26	CASQRGGREETQYF	TRBV7-6	TRBJ2-5
396	CAV AVS VSE SEP EPS PSA SAG AGK GKS KST STF	CAS ASS SSQ SQG QGP GPN PNG NGY GYT YTF	YLQPRTFLL	CAVSEPSAGKSTF	TRAV8-4	TRAJ27	CASSQGPNGYTF	TRBV4-1	TRBJ1-2
88	CAF AFM FMR MRG RGD GDG DGQ GQK QKL KLL LLF	CAS ASS SSL SLA LAI AIG IGD GDK DKV KVE VEQ EQY QYF	LTDEMIAQY	CAFMRGDGQKLLF	TRAV38-1	TRAJ16	CASSLAIGDKVEQYF	TRBV7-9	TRBJ2-7
117	CAM AMR MRE REA EAD ADS DSS SSG SGS GSA SAR ARQ RQL QLT LTF	CAS ASS SSP SPQ PQV QVG VGV GVA VAN ANE NEK EKL KLF LFF	LTDEMIAQY	CAMREADSSGSARQLTF	TRAV14/DV4	TRAJ22	CASSPQVGVANEKLFF	TRBV9	TRBJ1-4
467	CAA AAS ASY SYD YDS DSG SGA GAG AGS GSY SYQ YQL QLT LTF	CAS ASS SSD SDL DLK LKG KGS GST STD TDT DTQ TQY QYF	YLQPRTFLL	CAASYDSGAGSYQLTF	TRAV29/DV5	TRAJ28	CASSDLKGSTDTQYF	TRBV2	TRBJ2-3
453	CVV VVN VND NDA DAA AAA AAG AGN GNK NKL KLT LTF	CAS ASQ SQG QGL GLN LNT NTG TGE GEL ELF LFF	YLQPRTFLL	CVVNDAAAGNKLTF	TRAV12-1	TRAJ17	CASQGLNTGELFF	TRBV15	TRBJ2-2
535	CAV AVN VNG NGF GFS FSG SGG GGY GYN YNK NKL KLI LIF	CAS ASS SSP SPG PGE GEA EAR ARG RGE GEQ EQF QFF	YLQPRTFLL	CAVNGFSGGYNKLIF	TRAV8-1	TRAJ4	CASSPGEARGEQFF	TRBV5-6	TRBJ2-1
418	CVV VVN VNR NRA RAD ADK DKL KLV LVF	CAS ASS SSD SDA DAN ANT NTG TGE GEL ELF LFF	YLQPRTFLL	CVVNRADKLVF	TRAV12-1	TRAJ47	CASSDANTGELFF	TRBV7-9	TRBJ2-2
586	CAV AVP VPH PHP HPS PSN SNF NFG FGN GNE NEK EKL KLT LTF	CAS ASS SSI SIL ILA LAG AGT GTY TYN YNE NEQ EQF QFF	YLQPRTFLL	CAVPHPSNFGNEKLTF	TRAV41	TRAJ48	CASSILAGTYNEQFF	TRBV27	TRBJ2-1
352	CAM AMS MSH SHS HSG SGA GAG AGS GSY SYQ YQL QLT LTF	CAS ASS SSL SLW LWG WGA GAH AHT HTE TEA EAF AFF	TTDPSFLGRY	CAMSHSGAGSYQLTF	TRAV12-3	TRAJ28	CASSLWGAHTEAFF	TRBV11-2	TRBJ1-1
95	CAT ATM TMG MGF GFG FGN GNV NVL VLH LHC	CAS ASS SSY SYS YSR SRA RAS ASG SGD GDD DDN DNE NEQ EQF QFF	LTDEMIAQY	CATMGFGNVLHC	TRAV6	TRAJ35	CASSYSRASGDDNEQFF	TRBV6-6	TRBJ2-1
365	CAE AES ESL SLG LGG GGY GYN YNK NKL KLI LIF	CAS AST STP TPG PGS GSE SED EDT DTQ TQY QYF	TTDPSFLGRY	CAESLGGYNKLIF	TRAV5	TRAJ4	CASTPGSEDTQYF	TRBV6-5	TRBJ2-3
309	CAV AVG VGD GDA DAS ASG SGG GGS GSY SYI YIP IPT PTF	CAS ASS SSS SSL SLT LTD TDT DTQ TQY QYF	TTDPSFLGRY	CAVGDASGGSYIPTF	TRAV21	TRAJ6	CASSSLTDTQYF	TRBV27	TRBJ2-3
529	CAE AEK EKR KRS RSS SSG SGD GDK DKL KLT LTF	CAS ASS SSL SLD LDI DIK IKA KAF AFF	YLQPRTFLL	CAEKRSSGDKLTF	TRAV13-2	TRAJ46	CASSLDIKAFF	TRBV7-9	TRBJ1-1
13	CAV AVN VNS NSG SGG GGS GSN SNY NYK YKL KLT LTF	CSV SVH VHQ HQG QGW GWP WPY PYE YEQ EQY QYF	LTDEMIAQY	CAVNSGGSNYKLTF	TRAV12-2	TRAJ53	CSVHQGWPYEQYF	TRBV29-1	TRBJ2-7
546	CAV AVS VSG SGG GGG GGA GAD ADG DGL GLT LTF	CAS ASS SSV SVG VGA GAG AGS GSN SNQ NQP QPQ PQH QHF	YLQPRTFLL	CAVSGGGADGLTF	TRAV21	TRAJ45	CASSVGAGSNQPQHF	TRBV9	TRBJ1-5
70	CAL ALS LSP SPP PPG PGS GSR SRL RLT LTF	CAS ASV SVD VDR DRD RDW DWT WTW TWG WGT GTE TEA EAF AFF	LTDEMIAQY	CALSPPGSRLTF	TRAV9-2	TRAJ58	CASVDRDWTWGTEAFF	TRBV2	TRBJ1-1
507	CAG AGG GGS GSQ SQG QGN GNL NLI LIF	CAS ASS SSY SYP YPW PWD WDS DSQ SQS QSS SSY SYN YNE NEQ EQF QFF	YLQPRTFLL	CAGGSQGNLIF	TRAV27	TRAJ42	CASSYPWDSQSSYNEQFF	TRBV6-6	TRBJ2-1
236	CIL ILP LPL PLL LLG LGG GGT GTS TSY SYG YGK GKL KLT LTF	CAS ASS SSL SLG LGQ GQA QAY AYE YEQ EQY QYF	TTDPSFLGRY	CILPLLGGTSYGKLTF	TRAV26-2	TRAJ52	CASSLGQAYEQYF	TRBV7-8	TRBJ2-7
96	CAV AVR VRP RPG PGT GTY TYK YKY KYI YIF	CAS ASS SSY SYR YRL RLA LAG AGG GGV GVP VPH PHN HNE NEQ EQF QFF	LTDEMIAQY	CAVRPGTYKYIF	TRAV21	TRAJ40	CASSYRLAGGVPHNEQFF	TRBV6-2	TRBJ2-1
501	CVV VVN VND NDR DRD RDR DRL RLM LMF	CAS ASQ SQD QDR DRN RNT NTG TGE GEL ELF LFF	YLQPRTFLL	CVVNDRDRLMF	TRAV12-1	TRAJ31	CASQDRNTGELFF	TRBV2	TRBJ2-2
141	CAE AES ESR SRG RGN GNT NTG TGF GFQ FQK QKL KLV LVF	CAS ASG SGT GTG TGG GGT GTE TET ETQ TQY QYF	TTDPSFLGRY	CAESRGNTGFQKLVF	TRAV5	TRAJ8	CASGTGGTETQYF	TRBV28	TRBJ2-5
124	CAT ATD TDI DIV IVR VRE REG EGG GGS GSE SEK EKL KLV LVF	CSV SVH VHQ HQG QGW GWP WPY PYE YEQ EQY QYF	LTDEMIAQY	CATDIVREGGSEKLVF	TRAV17	TRAJ57	CSVHQGWPYEQYF	TRBV29-1	TRBJ2-7
425	CVV VVN VNK NKD KDD DDK DKI KII IIF	CAL ALS LSD SDQ DQN QNT NTG TGE GEL ELF LFF	YLQPRTFLL	CVVNKDDKIIF	TRAV12-1	TRAJ30	CALSDQNTGELFF	TRBV7-8	TRBJ2-2
515	CVV VVT VTG TGG GGG GGN GNK NKL KLT LTF	CAS ASS SSQ SQD QDI DIL ILA LAR ARY RYN YNE NEQ EQF QFF	YLQPRTFLL	CVVTGGGNKLTF	TRAV10	TRAJ10	CASSQDILARYNEQFF	TRBV3-1	TRBJ2-1
215	CAV AVH VHS HSG SGY GYS YST STL TLT LTF	CAS ASS SSE SED EDH DHR HRV RVT VTG TGN GNT NTI TIY IYF	TTDPSFLGRY	CAVHSGYSTLTF	TRAV21	TRAJ11	CASSEDHRVTGNTIYF	TRBV5-4	TRBJ1-3
176	CAF AFM FMK MKP KPP PPY PYG YGN GNY NYQ YQL QLI LIW	CAT ATS TSD SDL DLG LGP GPT PTG TGE GEL ELF LFF	TTDPSFLGRY	CAFMKPPYGNYQLIW	TRAV38-1	TRAJ33	CATSDLGPTGELFF	TRBV24-1	TRBJ2-2
436	CAP APP PPP PPR PRG RGK GKS KST STF	CAW AWQ WQV QVM VMN MNT NTG TGE GEL ELF LFF	YLQPRTFLL	CAPPPRGKSTF	TRAV16	TRAJ27	CAWQVMNTGELFF	TRBV30	TRBJ2-2
307	CAT ATG TGF GFS FSG SGG GGY GYN YNK NKL KLI LIF	CAS ASS SSQ SQY QYR YRE RET ETS TSD SDT DTQ TQY QYF	TTDPSFLGRY	CATGFSGGYNKLIF	TRAV17	TRAJ4	CASSQYRETSDTQYF	TRBV4-1	TRBJ2-3
342	CVL VLR LRD RDA DAG AGN GNM NML MLT LTF	CAS ASS SSR SRD RDR DRG RGE GEY EYN YNE NEQ EQF QFF	TTDPSFLGRY	CVLRDAGNMLTF	TRAV38-2/DV8	TRAJ39	CASSRDRGEYNEQFF	TRBV13	TRBJ2-1
120	CAM AMR MRD RDN DNY NYQ YQL QLI LIW	CAS ASS SSE SEA EAQ AQG QGP GPQ PQY QYF	LTDEMIAQY	CAMRDNYQLIW	TRAV12-3	TRAJ33	CASSEAQGPQYF	TRBV6-1	TRBJ2-7
542	CAV AVI VIN INS NSG SGY GYS YST STL TLT LTF	CAS ASS SSP SPT PTP TPS PSG SGQ GQG QGT GTA TAD ADT DTQ TQY QYF	YLQPRTFLL	CAVINSGYSTLTF	TRAV21	TRAJ11	CASSPTPSGQGTADTQYF	TRBV13	TRBJ2-3
421	CVV VVN VNK NKE KED EDD DDM DMR MRF	CAR ARG RGD GDR DRN RNT NTG TGE GEL ELF LFF	YLQPRTFLL	CVVNKEDDMRF	TRAV12-1	TRAJ43	CARGDRNTGELFF	TRBV6-1	TRBJ2-2
502	CAA AAI AIG IGA GAD ADG DGL GLT LTF	CAI AIS ISE SES ESV SVR VRN RNS NSN SNQ NQP QPQ PQH QHF	YLQPRTFLL	CAAIGADGLTF	TRAV29/DV5	TRAJ45	CAISESVRNSNQPQHF	TRBV10-3	TRBJ1-5
205	CAL ALG LGG GGS GSQ SQG QGN GNL NLI LIF	CAS ASS SSD SDR DRA RAP APS PSS SSD SDT DTQ TQY QYF	TTDPSFLGRY	CALGGSQGNLIF	TRAV9-2	TRAJ42	CASSDRAPSSDTQYF	TRBV27	TRBJ2-3
526	CAV AVI VIG IGG GGS GSQ SQG QGN GNL NLI LIF	CAI AIE IED EDR DRN RNT NTG TGE GEL ELF LFF	YLQPRTFLL	CAVIGGSQGNLIF	TRAV12-2	TRAJ42	CAIEDRNTGELFF	TRBV10-3	TRBJ2-2
28	CGA GAS ASL SLA LAG AGS GSA SAR ARQ RQL QLT LTF	CAS ASS SSR SRG RGA GAG AGH GHS HSD SDG DGY GYT YTF	LTDEMIAQY	CGASLAGSARQLTF	TRAV34	TRAJ22	CASSRGAGHSDGYTF	TRBV13	TRBJ1-2
317	CAV AVD VDP DPS PSN SNS NSG SGY GYA YAL ALN LNF	CAS ASS SSL SLT LTQ TQG QGG GGV GVL VLF LFF	TTDPSFLGRY	CAVDPSNSGYALNF	TRAV39	TRAJ41	CASSLTQGGVLFF	TRBV28	TRBJ1-4
311	CGA GAN ANG NGA GAN ANN NNL NLF LFF	CAS ASS SSS SST STS TSG SGV GVT VTD TDT DTQ TQY QYF	TTDPSFLGRY	CGANGANNLFF	TRAV1-2	TRAJ36	CASSSTSGVTDTQYF	TRBV27	TRBJ2-3
51	CAT ATD TDY DYR YRG RGG GGQ GQK QKL KLL LLF	CAW AWT WTR TRR RRD RDG DGG GGE GEL ELF LFF	LTDEMIAQY	CATDYRGGQKLLF	TRAV17	TRAJ16	CAWTRRDGGELFF	TRBV30	TRBJ2-2
508	CVV VVN VNR NRN RNN NND NDM DMR MRF	CAT ATQ TQS QSD SDP DPN PNT NTG TGE GEL ELF LFF	YLQPRTFLL	CVVNRNNDMRF	TRAV12-1	TRAJ43	CATQSDPNTGELFF	TRBV2	TRBJ2-2
361	CAV AVV VVF VFS FSG SGG GGY GYN YNK NKL KLI LIF	CAS ASS SSQ SQS QSR SRD RDR DRV RVD VDF	TTDPSFLGRY	CAVVFSGGYNKLIF	TRAV12-2	TRAJ4	CASSQSRDRVDF	TRBV7-3	TRBJ2-4
401	CVV VVK VKN KNR NRD RDD DDK DKI KII IIF	CAS ASS SSQ SQK QKA KAA AAQ AQG QGV GVS VSS SSY SYE YEQ EQY QYF	YLQPRTFLL	CVVKNRDDKIIF	TRAV12-1	TRAJ30	CASSQKAAQGVSSYEQYF	TRBV3-1	TRBJ2-7
154	CAR ARK RKG KGG GGS GST STD TDK DKL KLI LIF	CAS ASS SSL SLG LGG GGG GGL GLN LNY NYG YGY GYT YTF	TTDPSFLGRY	CARKGGSTDKLIF	TRAV19	TRAJ34	CASSLGGGLNYGYTF	TRBV27	TRBJ1-2
320	CAA AAI AIL ILG LGF GFG FGN GNE NEK EKL KLT LTF	CAS ASS SSA SAG AGT GTG TGG GGY GYT YTF	TTDPSFLGRY	CAAILGFGNEKLTF	TRAV29/DV5	TRAJ48	CASSAGTGGYTF	TRBV9	TRBJ1-2
328	CAV AVS VSA SAI AIS ISN SNF NFG FGN GNE NEK EKL KLT LTF	CAS ASS SSV SVG VGF GFP FPG PGE GEL ELF LFF	TTDPSFLGRY	CAVSAISNFGNEKLTF	TRAV41	TRAJ48	CASSVGFPGELFF	TRBV9	TRBJ2-2
22	CAL ALS LSN SNA NAG AGG GGT GTS TSY SYG YGK GKL KLT LTF	CAS ASS SSV SVI VIQ IQG QGA GAA AAG AGE GEL ELF LFF	LTDEMIAQY	CALSNAGGTSYGKLTF	TRAV9-2	TRAJ52	CASSVIQGAAGELFF	TRBV19	TRBJ2-2
37	CAS ASD SDN DNA NAG AGN GNN NNR NRK RKL KLI LIW	CAT ATR TRG RGE GEG EGA GAQ AQY QYS YSP SPL PLH LHF	LTDEMIAQY	CASDNAGNNRKLIW	TRAV24	TRAJ38	CATRGEGAQYSPLHF	TRBV6-5	TRBJ1-6
281	CVV VVN VNA NAP APS PSG SGG GGY GYN YNK NKL KLI LIF	CAS ASS SSQ SQE QED EDA DAG AGF GFS FSY SYN YNE NEQ EQF QFF	TTDPSFLGRY	CVVNAPSGGYNKLIF	TRAV12-1	TRAJ4	CASSQEDAGFSYNEQFF	TRBV14	TRBJ2-1
136	CVG VGG GGG GGA GAD ADG DGL GLT LTF	CAS ASS SSL SLG LGA GAG AGG GGS GSG SGE GEQ EQY QYF	TTDPSFLGRY	CVGGGADGLTF	TRAV12-1	TRAJ45	CASSLGAGGSGEQYF	TRBV12-4	TRBJ2-7
334	CIL ILR LRG RGG GGG GGG GGT GTS TSY SYG YGK GKL KLT LTF	CAS ASS SSD SDQ DQG QGA GAN ANY NYE YEQ EQY QYF	TTDPSFLGRY	CILRGGGGTSYGKLTF	TRAV26-2	TRAJ52	CASSDQGANYEQYF	TRBV27	TRBJ2-7
517	CVV VVN VNE NEY EYD YDD DDM DMR MRF	CSA SAR ARD RDA DAA AAG AGQ GQN QNT NTG TGE GEL ELF LFF	YLQPRTFLL	CVVNEYDDMRF	TRAV12-1	TRAJ43	CSARDAAGQNTGELFF	TRBV20-1	TRBJ2-2
443	CAV AVR VRS RSS SSG SGG GGS GSY SYI YIP IPT PTF	CAS ASS SST STR TRD RDS DSN SNQ NQP QPQ PQH QHF	YLQPRTFLL	CAVRSSGGSYIPTF	TRAV1-2	TRAJ6	CASSTRDSNQPQHF	TRBV19	TRBJ1-5
128	CAV AVR VRG RGG GGD GDM DMR MRF	CAS AST STN TNR NRG RGG GGI GIT ITY TYE YEQ EQY QYF	LTDEMIAQY	CAVRGGDMRF	TRAV21	TRAJ43	CASTNRGGITYEQYF	TRBV6-6	TRBJ2-7
338	CAV AVR VRS RSS SSG SGG GGS GSY SYI YIP IPT PTF	CAS ASS SSL SLK LKV KVD VDG DGY GYN YNE NEQ EQF QFF	TTDPSFLGRY	CAVRSSGGSYIPTF	TRAV8-6	TRAJ6	CASSLKVDGYNEQFF	TRBV6-2	TRBJ2-1
554	CVV VVN VNA NAG AGD GDK DKL KLT LTF	CAS ASS SSP SPD PDI DIE IEQ EQF QFF	YLQPRTFLL	CVVNAGDKLTF	TRAV12-1	TRAJ46	CASSPDIEQFF	TRBV7-9	TRBJ2-1
375	CAM AMR MRE REW EWN WND NDK DKI KII IIF	CAS ASS SSL SLS LSG SGS GSP SPS PSP SPL PLH LHF	TTDPSFLGRY	CAMREWNDKIIF	TRAV14/DV4	TRAJ30	CASSLSGSPSPLHF	TRBV27	TRBJ1-6
399	CAV AVQ VQD QDL DLG LGT GTS TSG SGS GSR SRL RLT LTF	CAS ASS SSA SAR ART RTG TGE GEL ELF LFF	YLQPRTFLL	CAVQDLGTSGSRLTF	TRAV20	TRAJ58	CASSARTGELFF	TRBV9	TRBJ2-2
534	CLV LVG VGE GEN ENF NFN FNK NKF KFY FYF	CAS ASS SSL SLG LGQ GQS QSL SLE LEQ EQY QYF	YLQPRTFLL	CLVGENFNKFYF	TRAV4	TRAJ21	CASSLGQSLEQYF	TRBV5-1	TRBJ2-7
499	CAL ALN LND NDY DYK YKL KLS LSF	CSA SAS ASL SLG LGG GGI GIT ITS TSS SST STD TDT DTQ TQY QYF	YLQPRTFLL	CALNDYKLSF	TRAV19	TRAJ20	CSASLGGITSSTDTQYF	TRBV20-1	TRBJ2-3
179	CAM AMS MSR SRN RND NDY DYK YKL KLS LSF	CAS ASS SSA SAF AFR FRG RGE GEG EGE GEK EKL KLF LFF	TTDPSFLGRY	CAMSRNDYKLSF	TRAV12-3	TRAJ20	CASSAFRGEGEKLFF	TRBV28	TRBJ1-4
56	CAG AGN GNA NAG AGN GNM NML MLT LTF	CAS AST STG TGP GPG PGG GGL GLA LAA AAG AGE GEQ EQY QYF	LTDEMIAQY	CAGNAGNMLTF	TRAV13-1	TRAJ39	CASTGPGGLAAGEQYF	TRBV27	TRBJ2-7
140	CAM AMR MRD RDW DWA WAL ALT LTG TGG GGG GGN GNK NKL KLT LTF	CAS ASS SSG SGD GDR DRE REQ EQF QFF	TTDPSFLGRY	CAMRDWALTGGGNKLTF	TRAV14/DV4	TRAJ10	CASSGDREQFF	TRBV27	TRBJ2-1
35	CAA AAN ANS NSG SGY GYA YAL ALN LNF	CAS ASS SSL SLA LAL ALA LAG AGR GRN RNY NYN YNE NEQ EQF QFF	LTDEMIAQY	CAANSGYALNF	TRAV17	TRAJ41	CASSLALAGRNYNEQFF	TRBV7-9	TRBJ2-1
498	CAA AAS ASG SGL GLK LKM KMD MDS DSS SSY SYK YKL KLI LIF	CAS ASS SSS SST STP TPN PNR NRG RGL GLA LAV AVG VGQ GQY QYF	YLQPRTFLL	CAASGLKMDSSYKLIF	TRAV29/DV5	TRAJ12	CASSSTPNRGLAVGQYF	TRBV27	TRBJ2-7
351	CAV AVP VPA PAG AGT GTA TAL ALI LIF	CAS AST STQ TQD QDS DSY SYG YGY GYT YTF	TTDPSFLGRY	CAVPAGTALIF	TRAV1-2	TRAJ15	CASTQDSYGYTF	TRBV12-4	TRBJ1-2
350	CAL ALS LSG SGP GPT PTG TGT GTA TAS ASK SKL KLT LTF	CAS ASS SSW SWT WTS TSG SGS GSY SYE YEQ EQY QYF	TTDPSFLGRY	CALSGPTGTASKLTF	TRAV16	TRAJ44	CASSWTSGSYEQYF	TRBV28	TRBJ2-7
449	CAV AVR VRD RDL DLN LNM NMD MDT DTG TGR GRR RRA RAL ALT LTF	CAS ASS SSL SLG LGG GGE GEG EGK GKT KTQ TQY QYF	YLQPRTFLL	CAVRDLNMDTGRRALTF	TRAV3	TRAJ5	CASSLGGEGKTQYF	TRBV5-6	TRBJ2-5
249	CAE AEW EWT WTG TGG GGY GYQ YQK QKV KVT VTF	CAS ASG SGF GFD FDA DAG AGQ GQG QGS GSY SYE YEQ EQY QYF	TTDPSFLGRY	CAEWTGGYQKVTF	TRAV1-2	TRAJ13	CASGFDAGQGSYEQYF	TRBV28	TRBJ2-7
100	CAV AVR VRE RER ERG RGG GGY GYN YNK NKL KLI LIF	CAS ASS SSY SYT YTR TRL RLV LVQ VQN QNT NTG TGE GEL ELF LFF	LTDEMIAQY	CAVRERGGYNKLIF	TRAV3	TRAJ4	CASSYTRLVQNTGELFF	TRBV6-2	TRBJ2-2
302	CAV AVK VKL KLK LKR KRR RRG RGQ GQN QNF NFV FVF	CAS ASS SSL SLG LGG GGG GGG GGG GGT GTQ TQP QPQ PQH QHF	TTDPSFLGRY	CAVKLKRRGQNFVF	TRAV21	TRAJ26	CASSLGGGGGTQPQHF	TRBV12-3	TRBJ1-5
303	CAL ALS LSA SAG AGR GRR RRA RAL ALT LTF	CAS ASS SSL SLY LYE YES ESH SHN HNE NEQ EQF QFF	TTDPSFLGRY	CALSAGRRALTF	TRAV9-2	TRAJ5	CASSLYESHNEQFF	TRBV5-5	TRBJ2-1
316	CAL ALS LSE SEA EAS ASH SHL HLF LFQ FQG QGA GAQ AQK QKL KLV LVF	CAT ATT TTG TGG GGP GPE PEE EEK EKL KLF LFF	TTDPSFLGRY	CALSEASHLFQGAQKLVF	TRAV19	TRAJ54	CATTGGPEEKLFF	TRBV27	TRBJ1-4
194	CAT ATG TGG GGD GDS DSG SGA GAG AGS GSY SYQ YQL QLT LTF	CAS ASS SSY SYS YST STT TTG TGR GRY RYE YEQ EQF QFF	TTDPSFLGRY	CATGGDSGAGSYQLTF	TRAV17	TRAJ28	CASSYSTTGRYEQFF	TRBV6-5	TRBJ2-1
208	CAV AVR VRA RAL ALI LIG IGF GFG FGN GNV NVL VLH LHC	CAT ATS TSG SGD GDY DYG YGG GGS GSI SIS ISD SDT DTQ TQY QYF	TTDPSFLGRY	CAVRALIGFGNVLHC	TRAV3	TRAJ35	CATSGDYGGSISDTQYF	TRBV15	TRBJ2-3
103	CAH AHA HAG AGG GGT GTS TSY SYG YGK GKL KLT LTF	CAS ASR SRS RSG SGT GTG TGT GTY TYE YEQ EQY QYF	LTDEMIAQY	CAHAGGTSYGKLTF	TRAV19	TRAJ52	CASRSGTGTYEQYF	TRBV19	TRBJ2-7
590	CAL ALT LTY TYS YSG SGG GGY GYN YNK NKL KLI LIF	CAS ASS SSV SVG VGG GGS GSE SEK EKN KNT NTE TEA EAF AFF	YLQPRTFLL	CALTYSGGYNKLIF	TRAV9-2	TRAJ4	CASSVGGSEKNTEAFF	TRBV9	TRBJ1-1
112	CAG AGA GAL ALE LET ETS TSG SGS GSR SRL RLT LTF	CAS ASS SSR SRD RDS DSG SGY GYS YSP SPL PLH LHF	LTDEMIAQY	CAGALETSGSRLTF	TRAV27	TRAJ58	CASSRDSGYSPLHF	TRBV6-5	TRBJ1-6
97	CAV AVR VRP RPR PRG RGE GEW EWR WRS RSG SGT GTY TYK YKY KYI YIF	CAS ASS SSA SAG AGE GEA EAG AGE GEL ELF LFF	LTDEMIAQY	CAVRPRGEWRSGTYKYIF	TRAV1-2	TRAJ40	CASSAGEAGELFF	TRBV7-6	TRBJ2-2
423	CVV VVN VNG NGG GGD GDK DKI KII IIF	CAS ASS SSL SLD LDI DIE IEA EAF AFF	YLQPRTFLL	CVVNGGDKIIF	TRAV12-1	TRAJ30	CASSLDIEAFF	TRBV7-9	TRBJ1-1
273	CAA AAS ASE SEG EGQ GQK QKL KLL LLF	CAS AST STL TLD LDI DIL ILG LGY GYT YTF	TTDPSFLGRY	CAASEGQKLLF	TRAV29/DV5	TRAJ16	CASTLDILGYTF	TRBV12-4	TRBJ1-2
570	CVV VVN VNR NRD RDD DDK DKI KII IIF	CAS ASS SSE SES ESN SNS NSL SLE LEA EAF AFF	YLQPRTFLL	CVVNRDDKIIF	TRAV12-1	TRAJ30	CASSESNSLEAFF	TRBV25-1	TRBJ1-1
30	CAA AAN ANT NTG TGN GNQ NQF QFY FYF	CAS ASS SSF SFA FAV AVN VNT NTE TEA EAF AFF	LTDEMIAQY	CAANTGNQFYF	TRAV5	TRAJ49	CASSFAVNTEAFF	TRBV27	TRBJ1-1
543	CAL ALS LSV SVG VGT GTG TGA GAN ANN NNL NLF LFF	CAS ASS SSI SIS ISG SGS GSG SGS GSD SDT DTQ TQY QYF	YLQPRTFLL	CALSVGTGANNLFF	TRAV19	TRAJ36	CASSISGSGSDTQYF	TRBV7-7	TRBJ2-3
107	CAL ALT LTN TNA NAG AGG GGT GTS TSY SYG YGK GKL KLT LTF	CAS ASS SSL SLG LGQ GQP QPA PAG AGE GEQ EQF QFF	LTDEMIAQY	CALTNAGGTSYGKLTF	TRAV24	TRAJ52	CASSLGQPAGEQFF	TRBV12-4	TRBJ2-1
82	CAV AVR VRG RGG GGQ GQK QKL KLL LLF	CAR ART RTG TGQ GQV QVK VKA KAK AKN KNI NIQ IQY QYF	LTDEMIAQY	CAVRGGQKLLF	TRAV12-2	TRAJ16	CARTGQVKAKNIQYF	TRBV9	TRBJ2-4
589	CAG AGQ GQL QLR LRG RGG GGS GSE SEK EKL KLV LVF	CSA SAS AST STD TDR DRE REL ELN LNE NEQ EQY QYF	YLQPRTFLL	CAGQLRGGSEKLVF	TRAV35	TRAJ57	CSASTDRELNEQYF	TRBV20-1	TRBJ2-7
14	CAF AFM FMK MKT KTG TGA GAN ANS NSK SKL KLT LTF	CAI AIS ISG SGP GPE PET ETN TNQ NQP QPQ PQH QHF	LTDEMIAQY	CAFMKTGANSKLTF	TRAV38-1	TRAJ56	CAISGPETNQPQHF	TRBV10-3	TRBJ1-5
177	CAM AMR MRD RDA DAG AGG GGG GGA GAD ADG DGL GLT LTF	CAI AIG IGT GTG TGP GPM PMN MNT NTE TEA EAF AFF	TTDPSFLGRY	CAMRDAGGGADGLTF	TRAV14/DV4	TRAJ45	CAIGTGPMNTEAFF	TRBV7-9	TRBJ1-1
540	CAA AAS ASV SVG VGS GSN SNN NNN NND NDM DMR MRF	CAS ASS SSP SPT PTG TGE GEP EPN PNY NYG YGY GYT YTF	YLQPRTFLL	CAASVGSNNNDMRF	TRAV29/DV5	TRAJ43	CASSPTGEPNYGYTF	TRBV28	TRBJ1-2
513	CVV VVN VNG NGA GAD ADK DKL KLI LIF	CAS ASS SSL SLD LDI DIE IEA EAF AFF	YLQPRTFLL	CVVNGADKLIF	TRAV12-1	TRAJ34	CASSLDIEAFF	TRBV7-9	TRBJ1-1
562	CVV VVN VNR NRY RYD YDD DDM DMR MRF	CSA SAL ALR LRD RDK DKN KNT NTG TGE GEL ELF LFF	YLQPRTFLL	CVVNRYDDMRF	TRAV12-1	TRAJ43	CSALRDKNTGELFF	TRBV20-1	TRBJ2-2
536	CVV VVN VNN NNE NED EDD DDM DMR MRF	CGS GSG SGI GIQ IQN QNT NTG TGE GEL ELF LFF	YLQPRTFLL	CVVNNEDDMRF	TRAV12-1	TRAJ43	CGSGIQNTGELFF	TRBV12-3	TRBJ2-2
374	CAL ALI LIL ILP LPY PYS YSG SGG GGG GGA GAD ADG DGL GLT LTF	CSA SAR ARD RDP DPG PGT GTG TGA GAY AYY YYG YGY GYT YTF	TTDPSFLGRY	CALILPYSGGGADGLTF	TRAV19	TRAJ45	CSARDPGTGAYYGYTF	TRBV20-1	TRBJ1-2
491	CVV VVN VNN NNN NNN NND NDM DMR MRF	CAS ASN SNE NEE EEN ENT NTG TGE GEL ELF LFF	YLQPRTFLL	CVVNNNNDMRF	TRAV12-1	TRAJ43	CASNEENTGELFF	TRBV5-1	TRBJ2-2
329	CAV AVP VPN PNF NFG FGN GNE NEK EKL KLT LTF	CAS ASG SGL GLG LGS GSS SSY SYE YEQ EQY QYF	TTDPSFLGRY	CAVPNFGNEKLTF	TRAV20	TRAJ48	CASGLGSSYEQYF	TRBV27	TRBJ2-7
139	CAL ALS LSA SAG AGN GNQ NQF QFY FYF	CAS ASS SSD SDR DRT RTS TSQ SQE QET ETQ TQY QYF	TTDPSFLGRY	CALSAGNQFYF	TRAV9-2	TRAJ49	CASSDRTSQETQYF	TRBV27	TRBJ2-5
475	CGG GGN GNR NRD RDD DDK DKI KII IIF	CAS ASS SSP SPD PDI DIE IEQ EQY QYF	YLQPRTFLL	CGGNRDDKIIF	TRAV12-1	TRAJ30	CASSPDIEQYF	TRBV7-9	TRBJ2-7
34	CVA VAR ARM RMD MDS DSS SSY SYK YKL KLI LIF	CAS ASS SSD SDS DSG SGF GFG FGY GYG YGY GYT YTF	LTDEMIAQY	CVARMDSSYKLIF	TRAV12-1	TRAJ12	CASSDSGFGYGYTF	TRBV10-1	TRBJ1-2
298	CAA AAV AVG VGP GPT PTG TGT GTA TAS ASK SKL KLT LTF	CAS ASS SSW SWT WTS TSG SGS GSY SYE YEQ EQY QYF	TTDPSFLGRY	CAAVGPTGTASKLTF	TRAV13-1	TRAJ44	CASSWTSGSYEQYF	TRBV28	TRBJ2-7
569	CIV IVR VRV RVP VPG PGP GPW PWS WSR SRG RGS GSN SNY NYK YKL KLT LTF	CSG SGI GIR IRL RLA LAS ASG SGR GRS RSY SYE YEQ EQY QYF	YLQPRTFLL	CIVRVPGPWSRGSNYKLTF	TRAV26-1	TRAJ53	CSGIRLASGRSYEQYF	TRBV20-1	TRBJ2-7
162	CAL ALG LGG GGS GSQ SQG QGN GNL NLI LIF	CAS ASS SSM SMR MRS RSG SGS GSD SDE DEQ EQY QYF	TTDPSFLGRY	CALGGSQGNLIF	TRAV9-2	TRAJ42	CASSMRSGSDEQYF	TRBV27	TRBJ2-7
127	CAM AMR MRS RSN SNY NYQ YQL QLI LIW	CAS ASS SSL SLS LSQ SQG QGS GSQ SQY QYF	LTDEMIAQY	CAMRSNYQLIW	TRAV12-3	TRAJ33	CASSLSQGSQYF	TRBV27	TRBJ2-3
217	CAM AMR MRD RDW DWA WAL ALT LTG TGG GGG GGN GNK NKL KLT LTF	CAS ASA SAL ALA LAQ AQA QAY AYE YEQ EQY QYF	TTDPSFLGRY	CAMRDWALTGGGNKLTF	TRAV14/DV4	TRAJ10	CASALAQAYEQYF	TRBV27	TRBJ2-7
573	CAV AVN VNA NAL ALD LDD DDY DYK YKL KLS LSF	CAI AIS ISE SES ESQ SQE QEF EFY FYG YGY GYT YTF	YLQPRTFLL	CAVNALDDYKLSF	TRAV8-1	TRAJ20	CAISESQEFYGYTF	TRBV10-3	TRBJ1-2
246	CAA AAN ANS NSG SGG GGY GYQ YQK QKV KVT VTF	CAT ATG TGQ GQS QSN SNT NTG TGE GEL ELF LFF	TTDPSFLGRY	CAANSGGYQKVTF	TRAV1-2	TRAJ13	CATGQSNTGELFF	TRBV28	TRBJ2-2
551	CAL ALS LSE SEG EGT GTY TYN YNN NNN NND NDM DMR MRF	CAI AIR IRS RSG SGN GNT NTY TYS YSY SYE YEQ EQY QYF	YLQPRTFLL	CALSEGTYNNNDMRF	TRAV19	TRAJ43	CAIRSGNTYSYEQYF	TRBV10-3	TRBJ2-7
531	CAT ATR TRN RNT NTD TDK DKL KLI LIF	CAS ASS SSF SFG FGR GRG RGG GGS GSQ SQP QPQ PQH QHF	YLQPRTFLL	CATRNTDKLIF	TRAV17	TRAJ34	CASSFGRGGSQPQHF	TRBV27	TRBJ1-5
492	CVP VPR PRD RDT DTG TGR GRR RRA RAL ALT LTF	CAS ASS SSS SSI SIY IYG YGT GTS TSY SYE YEQ EQY QYF	YLQPRTFLL	CVPRDTGRRALTF	TRAV12-1	TRAJ5	CASSSIYGTSYEQYF	TRBV12-4	TRBJ2-7
532	CVV VVN VNQ NQV QVP VPG PGY GYA YAL ALN LNF	CSV SVE VEK EKD KDR DRN RNT NTG TGE GEL ELF LFF	YLQPRTFLL	CVVNQVPGYALNF	TRAV12-1	TRAJ41	CSVEKDRNTGELFF	TRBV29-1	TRBJ2-2
253	CAL ALS LSD SDY DYN YNQ NQG QGG GGK GKL KLI LIF	CAS ASS SSG SGE GEG EGG GGP GPW PWG WGS GSL SLQ LQF QFF	TTDPSFLGRY	CALSDYNQGGKLIF	TRAV19	TRAJ23	CASSGEGGPWGSLQFF	TRBV2	TRBJ2-1
299	CAA AAS ASA SAQ AQG QGG GGA GAD ADG DGL GLT LTF	CAS ASS SSF SFL FLA LAG AGA GAV AVE VEQ EQF QFF	TTDPSFLGRY	CAASAQGGADGLTF	TRAV29/DV5	TRAJ45	CASSFLAGAVEQFF	TRBV28	TRBJ2-1
424	CAR ARM RMD MDS DSN SNY NYQ YQL QLI LIW	CAS ASS SSV SVK VKP KPD PDS DSP SPA PAE AEA EAF AFF	YLQPRTFLL	CARMDSNYQLIW	TRAV1-2	TRAJ33	CASSVKPDSPAEAFF	TRBV6-4	TRBJ1-1
239	CAG AGQ GQS QSN SNQ NQF QFY FYF	CAS ASS SSF SFG FGD GDQ DQP QPQ PQH QHF	TTDPSFLGRY	CAGQSNQFYF	TRAV35	TRAJ49	CASSFGDQPQHF	TRBV28	TRBJ1-5
427	CVV VVN VNG NGG GGD GDK DKI KII IIF	CAS ASS SSA SAD ADI DIE IEA EAF AFF	YLQPRTFLL	CVVNGGDKIIF	TRAV12-1	TRAJ30	CASSADIEAFF	TRBV7-9	TRBJ1-1
197	CAA AAS ASG SGG GGF GFG FGN GNE NEK EKL KLT LTF	CAS ASS SSA SAG AGD GDY DYG YGY GYT YTF	TTDPSFLGRY	CAASGGFGNEKLTF	TRAV29/DV5	TRAJ48	CASSAGDYGYTF	TRBV9	TRBJ1-2
43	CAA AAL ALF LFT FTG TGG GGG GGN GNK NKL KLT LTF	CAS ASS SSL SLG LGI GIG IGT GTQ TQP QPQ PQH QHF	LTDEMIAQY	CAALFTGGGNKLTF	TRAV21	TRAJ10	CASSLGIGTQPQHF	TRBV27	TRBJ1-5
89	CAV AVD VDF DFS FSG SGT GTY TYK YKY KYI YIF	CAS ASS SSQ SQD QDG DGQ GQG QGA GAM AMY MYE YEQ EQY QYF	LTDEMIAQY	CAVDFSGTYKYIF	TRAV8-3	TRAJ40	CASSQDGQGAMYEQYF	TRBV4-1	TRBJ2-7
315	CAL ALS LSD SDY DYS YSS SSG SGG GGS GSY SYI YIP IPT PTF	CAS ASS SST STA TAR ARL RLG LGD GDT DTG TGE GEL ELF LFF	TTDPSFLGRY	CALSDYSSGGSYIPTF	TRAV19	TRAJ6	CASSTARLGDTGELFF	TRBV18	TRBJ2-2
403	CAV AVN VNM NMD MDD DDK DKI KII IIF	CAS ASS SSP SPD PDI DIE IEA EAF AFF	YLQPRTFLL	CAVNMDDKIIF	TRAV12-2	TRAJ30	CASSPDIEAFF	TRBV7-9	TRBJ1-1
62	CAV AVR VRH RHR HRG RGG GGQ GQK QKL KLL LLF	CAS ASS SSP SPS PSG SGS GSF SFE FEQ EQF QFF	LTDEMIAQY	CAVRHRGGQKLLF	TRAV21	TRAJ16	CASSPSGSFEQFF	TRBV7-9	TRBJ2-1
68	CAV AVS VSS SSA SAR ARQ RQL QLT LTF	CAS ASS SSG SGT GTV TVT VTS TSS SSS SST STD TDT DTQ TQY QYF	LTDEMIAQY	CAVSSARQLTF	TRAV3	TRAJ22	CASSGTVTSSSTDTQYF	TRBV2	TRBJ2-3
258	CAV AVR VRV RVP VPS PSG SGA GAG AGS GSY SYQ YQL QLT LTF	CAS ASR SRE RET ETG TGR GRA RAA AAG AGN GNT NTI TIY IYF	TTDPSFLGRY	CAVRVPSGAGSYQLTF	TRAV1-2	TRAJ28	CASRETGRAAGNTIYF	TRBV14	TRBJ1-3
545	CAQ AQD QDG DGQ GQN QNF NFV FVF	CAS ASS SSP SPS PSP SPK PKR KRG RGA GAY AYE YEQ EQY QYF	YLQPRTFLL	CAQDGQNFVF	TRAV12-2	TRAJ26	CASSPSPKRGAYEQYF	TRBV9	TRBJ2-7
9	CAV AVR VRG RGG GGS GSG SGT GTY TYK YKY KYI YIF	CAS ASI SIN INR NRA RAA AAN ANT NTG TGE GEL ELF LFF	LTDEMIAQY	CAVRGGSGTYKYIF	TRAV21	TRAJ40	CASINRAANTGELFF	TRBV19	TRBJ2-2
248	CAM AMR MRD RDW DWE WEL ELT LTG TGG GGG GGN GNK NKL KLT LTF	CAS ASG SGD GDS DSP SPL PLH LHF	TTDPSFLGRY	CAMRDWELTGGGNKLTF	TRAV14/DV4	TRAJ10	CASGDSPLHF	TRBV27	TRBJ1-6
462	CAA AAI AIN IND NDY DYK YKL KLS LSF	CAS ASS SSG SGS GSP SPG PGT GTG TGD GDY DYG YGY GYT YTF	YLQPRTFLL	CAAINDYKLSF	TRAV1-2	TRAJ20	CASSGSPGTGDYGYTF	TRBV6-1	TRBJ1-2
306	CVV VVN VNR NRG RGG GGY GYS YST STL TLT LTF	CAS ASS SSL SLP LPD PDL DLQ LQE QET ETQ TQY QYF	TTDPSFLGRY	CVVNRGGYSTLTF	TRAV12-1	TRAJ11	CASSLPDLQETQYF	TRBV7-2	TRBJ2-5
213	CVV VVN VNM NMD MDS DSN SNY NYQ YQL QLI LIW	CAS ASS SSL SLQ LQR QRE REY EYP YPY PYE YEQ EQY QYF	TTDPSFLGRY	CVVNMDSNYQLIW	TRAV12-1	TRAJ33	CASSLQREYPYEQYF	TRBV27	TRBJ2-7
341	CAL ALS LSD SDV DVD VDM DMR MRF	CAS ASS SSE SET ETH THS HSN SNQ NQP QPQ PQH QHF	TTDPSFLGRY	CALSDVDMRF	TRAV9-2	TRAJ43	CASSETHSNQPQHF	TRBV27	TRBJ1-5
489	CAV AVG VGD GDN DNF NFN FNK NKF KFY FYF	CAS ASS SSR SRT RTS TSA SAK AKL KLG LGE GEQ EQY QYF	YLQPRTFLL	CAVGDNFNKFYF	TRAV8-3	TRAJ21	CASSRTSAKLGEQYF	TRBV28	TRBJ2-7
111	CAG AGG GGH GHT HTP TPL PLV LVF	CAS ASS SSL SLT LTD TDL DLY LYG YGY GYT YTF	LTDEMIAQY	CAGGHTPLVF	TRAV5	TRAJ29	CASSLTDLYGYTF	TRBV3-1	TRBJ1-2
379	CAV AVP VPH PHF HFG FGN GNE NEK EKL KLT LTF	CAS ASS SST STE TEP EPL PLG LGS GSD SDI DIQ IQY QYF	TTDPSFLGRY	CAVPHFGNEKLTF	TRAV20	TRAJ48	CASSTEPLGSDIQYF	TRBV27	TRBJ2-4
441	CAG AGV GVG VGP GPS PSD SDS DSN SNY NYQ YQL QLI LIW	CAS ASS SSW SWD WDR DRF RFN FNE NEQ EQF QFF	YLQPRTFLL	CAGVGPSDSNYQLIW	TRAV27	TRAJ33	CASSWDRFNEQFF	TRBV5-1	TRBJ2-1
398	CAV AVN VNR NRD RDD DDK DKI KII IIF	CAS ASS SSP SPD PDI DIE IEA EAF AFF	YLQPRTFLL	CAVNRDDKIIF	TRAV12-2	TRAJ30	CASSPDIEAFF	TRBV7-9	TRBJ1-1
157	CAA AAG AGA GAG AGT GTA TAS ASK SKL KLT LTF	CAS ASS SSS SSD SDL DLG LGG GGG GGT GTD TDT DTQ TQY QYF	TTDPSFLGRY	CAAGAGTASKLTF	TRAV29/DV5	TRAJ44	CASSSDLGGGTDTQYF	TRBV13	TRBJ2-3
493	CAL ALS LSE SED EDY DYD YDY DYK YKL KLS LSF	CAS ASR SRH RHF HFR FRE REV EVN VNT NTE TEA EAF AFF	YLQPRTFLL	CALSEDYDYKLSF	TRAV19	TRAJ20	CASRHFREVNTEAFF	TRBV3-1	TRBJ1-1
504	CVV VVN VND NDG DGN GNK NKL KLV LVF	CAS ASQ SQE QEL ELD LDT DTG TGE GEL ELF LFF	YLQPRTFLL	CVVNDGNKLVF	TRAV12-1	TRAJ47	CASQELDTGELFF	TRBV2	TRBJ2-2
69	CAM AMR MRS RSN SNY NYQ YQL QLI LIW	CAS ASS SSE SEA EAQ AQG QGP GPQ PQH QHF	LTDEMIAQY	CAMRSNYQLIW	TRAV12-3	TRAJ33	CASSEAQGPQHF	TRBV6-1	TRBJ1-5
17	CIV IVR VRV RVF VFR FRK RKK KKG KGQ GQN QNF NFV FVF	CAS ASS SSL SLA LAH AHQ HQT QTY TYE YEQ EQY QYF	LTDEMIAQY	CIVRVFRKKGQNFVF	TRAV26-1	TRAJ26	CASSLAHQTYEQYF	TRBV5-6	TRBJ2-7
322	CAL ALT LTG TGS GSQ SQG QGN GNL NLI LIF	CAS ASS SSL SLR LRD RDG DGG GGD GDT DTQ TQY QYF	TTDPSFLGRY	CALTGSQGNLIF	TRAV9-2	TRAJ42	CASSLRDGGDTQYF	TRBV27	TRBJ2-3
289	CAG AGQ GQP QPA PAG AGT GTA TAL ALI LIF	CAS ASS SSF SFR FRT RTS TSG SGN GNE NEQ EQY QYF	TTDPSFLGRY	CAGQPAGTALIF	TRAV5	TRAJ15	CASSFRTSGNEQYF	TRBV27	TRBJ2-7
158	CAF AFS FSS SSG SGN GNT NTP TPL PLV LVF	CAS ASS SSQ SQE QED EDR DRW RWV WVI VIG IGE GEL ELF LFF	TTDPSFLGRY	CAFSSGNTPLVF	TRAV21	TRAJ29	CASSQEDRWVIGELFF	TRBV14	TRBJ2-2
544	CAE AER ERD RDN DND NDM DMR MRF	CAS ASS SST STA TAG AGT GTS TSG SGR GRG RGE GEL ELF LFF	YLQPRTFLL	CAERDNDMRF	TRAV13-2	TRAJ43	CASSTAGTSGRGELFF	TRBV9	TRBJ2-2
336	CAA AAS ASA SAE AEG EGN GNT NTG TGK GKL KLI LIF	CAS ASS SSD SDP DPG PGA GAR ARV RVW VWE WEQ EQY QYF	TTDPSFLGRY	CAASAEGNTGKLIF	TRAV29/DV5	TRAJ37	CASSDPGARVWEQYF	TRBV2	TRBJ2-7
49	CAF AFM FMK MKL KLY LYN YNF NFN FNK NKF KFY FYF	CAS ASS SSG SGP GPL PLA LAG AGR GRR RRT RTD TDT DTQ TQY QYF	LTDEMIAQY	CAFMKLYNFNKFYF	TRAV38-1	TRAJ21	CASSGPLAGRRTDTQYF	TRBV13	TRBJ2-3
587	CVV VVN VNN NNP NPD PDS DSG SGY GYA YAL ALN LNF	CAS ASS SSP SPL PLG LGG GGG GGN GNT NTG TGE GEL ELF LFF	YLQPRTFLL	CVVNNPDSGYALNF	TRAV12-1	TRAJ41	CASSPLGGGNTGELFF	TRBV3-1	TRBJ2-2
144	CAV AVQ VQR QRP RPP PPT PTD TDS DSW SWG WGK GKL KLQ LQF	CAS ASS SSL SLS LSL SLI LIY IYE YEQ EQY QYF	TTDPSFLGRY	CAVQRPPTDSWGKLQF	TRAV20	TRAJ24	CASSLSLIYEQYF	TRBV12-3	TRBJ2-7
80	CAT ATD TDG DGN GNN NNN NNA NAG AGN GNM NML MLT LTF	CAS ASS SSV SVA VAG AGS GSS SSY SYE YEQ EQY QYF	LTDEMIAQY	CATDGNNNAGNMLTF	TRAV17	TRAJ39	CASSVAGSSYEQYF	TRBV2	TRBJ2-7
414	CVV VVN VNA NAP APS PSG SGN GNT NTP TPL PLV LVF	CSA SAR ARD RDL DLG LGA GAQ AQN QNT NTG TGE GEL ELF LFF	YLQPRTFLL	CVVNAPSGNTPLVF	TRAV12-1	TRAJ29	CSARDLGAQNTGELFF	TRBV20-1	TRBJ2-2
