460	CVV VVN VNR NRR RRD RDD DDM DMR MRF	CAS AST STE TEG EGN GNT NTG TGE GEL ELF LFF	YLQPRTFLL	CVVNRRDDMRF	TRAV12-1	TRAJ43	CASTEGNTGELFF	TRBV12-3	TRBJ2-2
204	CAM AMS MSA SAR ARS RSG SGY GYS YST STL TLT LTF	CAS ASS SSL SLL LLP LPE PEQ EQE QET ETQ TQY QYF	TTDPSFLGRY	CAMSARSGYSTLTF	TRAV12-3	TRAJ11	CASSLLPEQETQYF	TRBV28	TRBJ2-5
406	CGA GAE AET ETS TSG SGS GSR SRL RLT LTF	CAS ASS SSL SLA LAE AEG EGP GPR PRY RYG YGY GYT YTF	YLQPRTFLL	CGAETSGSRLTF	TRAV34	TRAJ58	CASSLAEGPRYGYTF	TRBV7-6	TRBJ1-2
172	CAL ALS LSG SGY GYT YTG TGG GGG GGN GNK NKL KLT LTF	CAS ASS SSP SPR PRD RDH DHQ HQE QET ETQ TQY QYF	TTDPSFLGRY	CALSGYTGGGNKLTF	TRAV19	TRAJ10	CASSPRDHQETQYF	TRBV27	TRBJ2-5
514	CVV VVN VNQ NQA QAD ADK DKL KLI LIF	CAT ATG TGL GLA LAN ANT NTG TGE GEL ELF LFF	YLQPRTFLL	CVVNQADKLIF	TRAV12-1	TRAJ34	CATGLANTGELFF	TRBV7-9	TRBJ2-2
199	CAA AAS ASV SVG VGY GYG YGG GGA GAT ATN TNK NKL KLI LIF	CAS ASR SRQ RQA QAG AGD GDE DEQ EQY QYF	TTDPSFLGRY	CAASVGYGGATNKLIF	TRAV29/DV5	TRAJ32	CASRQAGDEQYF	TRBV13	TRBJ2-7
304	CGP GPG PGG GGY GYN YNK NKL KLI LIF	CSV SVE VEG EGD GDL DLS LSG SGD GDE DEQ EQF QFF	TTDPSFLGRY	CGPGGYNKLIF	TRAV6	TRAJ4	CSVEGDLSGDEQFF	TRBV29-1	TRBJ2-1
218	CAV AVR VRS RSR SRG RGN GNN NNR NRL RLA LAF	CAS ASS SSP SPS PSG SGS GSL SLE LEQ EQY QYF	TTDPSFLGRY	CAVRSRGNNRLAF	TRAV21	TRAJ7	CASSPSGSLEQYF	TRBV7-9	TRBJ2-7
156	CAV AVG VGL GLN LNT NTG TGT GTA TAS ASK SKL KLT LTF	CAS ASS SSW SWT WTS TSG SGS GSH SHE HEQ EQY QYF	TTDPSFLGRY	CAVGLNTGTASKLTF	TRAV36/DV7	TRAJ44	CASSWTSGSHEQYF	TRBV28	TRBJ2-7
206	CAA AAS ASS SSG SGN GNT NTG TGK GKL KLI LIF	CAS ASW SWT WTD TDS DSQ SQG QGE GET ETQ TQY QYF	TTDPSFLGRY	CAASSGNTGKLIF	TRAV29/DV5	TRAJ37	CASWTDSQGETQYF	TRBV2	TRBJ2-5
161	CAA AAS ASL SLS LSL SLN LNS NSG SGY GYA YAL ALN LNF	CAS ASS SSP SPG PGR GRM RMS MSS SSR SRY RYE YEQ EQY QYF	TTDPSFLGRY	CAASLSLNSGYALNF	TRAV29/DV5	TRAJ41	CASSPGRMSSRYEQYF	TRBV3-1	TRBJ2-7
47	CAA AAR ARE REI EIG IGN GNQ NQF QFY FYF	CAR ARR RRG RGD GDR DRA RAE AEQ EQY QYF	LTDEMIAQY	CAAREIGNQFYF	TRAV29/DV5	TRAJ49	CARRGDRAEQYF	TRBV2	TRBJ2-7
231	CAA AAS ASD SDG DGN GNT NTG TGK GKL KLI LIF	CAS ASW SWT WTD TDD DDN DNQ NQP QPQ PQH QHF	TTDPSFLGRY	CAASDGNTGKLIF	TRAV29/DV5	TRAJ37	CASWTDDNQPQHF	TRBV2	TRBJ1-5
370	CAM AMR MRE REE EEY EYY YYG YGN GNN NNR NRL RLA LAF	CAS ASS SSL SLY LYG YGQ GQS QSD SDS DSP SPL PLH LHF	TTDPSFLGRY	CAMREEYYGNNRLAF	TRAV14/DV4	TRAJ7	CASSLYGQSDSPLHF	TRBV28	TRBJ1-6
2	CAV AVR VRT RTS TSG SGT GTY TYK YKY KYI YIF	CAS ASS SSE SEG EGI GIT ITS TSN SNQ NQP QPQ PQH QHF	LTDEMIAQY	CAVRTSGTYKYIF	TRAV21	TRAJ40	CASSEGITSNQPQHF	TRBV7-2	TRBJ1-5
109	CAV AVR VRR RRR RRF RFL FLN LND NDM DMR MRF	CAS ASS SSL SLK LKA KAP APP PPH PHS HSN SNT NTE TEA EAF AFF	LTDEMIAQY	CAVRRRFLNDMRF	TRAV21	TRAJ43	CASSLKAPPHSNTEAFF	TRBV7-9	TRBJ1-1
585	CAV AVR VRV RVS VSG SGG GGY GYN YNK NKL KLI LIF	CAI AIS ISG SGD GDP DPT PTG TGV GVN VNN NNE NEQ EQF QFF	YLQPRTFLL	CAVRVSGGYNKLIF	TRAV1-2	TRAJ4	CAISGDPTGVNNEQFF	TRBV10-3	TRBJ2-1
463	CVV VVN VNK NKE KED EDR DRL RLM LMF	CAS ASG SGD GDT DTN TNT NTG TGE GEL ELF LFF	YLQPRTFLL	CVVNKEDRLMF	TRAV12-1	TRAJ31	CASGDTNTGELFF	TRBV5-1	TRBJ2-2
349	CAM AMR MRA RAT ATA TAR ARQ RQL QLT LTF	CSA SAR ARD RDR DRE REG EGP GPN PNY NYE YEQ EQY QYF	TTDPSFLGRY	CAMRATARQLTF	TRAV14/DV4	TRAJ22	CSARDREGPNYEQYF	TRBV20-1	TRBJ2-7
362	CVV VVN VNP NPV PVT VTG TGN GNT NTP TPL PLV LVF	CAS ASR SRW RWT WTD TDG DGI GIM IMN MNT NTE TEA EAF AFF	TTDPSFLGRY	CVVNPVTGNTPLVF	TRAV12-1	TRAJ29	CASRWTDGIMNTEAFF	TRBV28	TRBJ1-1
452	CLV LVG VGD GDT DTY TYS YSG SGA GAG AGS GSY SYQ YQL QLT LTF	CAS ASS SSL SLL LLG LGE GEP EPG PGE GEA EAF AFF	YLQPRTFLL	CLVGDTYSGAGSYQLTF	TRAV4	TRAJ28	CASSLLGEPGEAFF	TRBV5-4	TRBJ1-1
263	CAP APH PHR HRR RRE REA EAG AGG GGS GSY SYI YIP IPT PTF	CAS ASS SSV SVS VSY SYG YGY GYT YTF	TTDPSFLGRY	CAPHRREAGGSYIPTF	TRAV16	TRAJ6	CASSVSYGYTF	TRBV25-1	TRBJ1-2
29	CVV VVN VNI NIG IGS GST STL TLT LTF	CAS ASS SST STG TGG GGR GRG RGE GEQ EQF QFF	LTDEMIAQY	CVVNIGSTLTF	TRAV12-1	TRAJ11	CASSTGGRGEQFF	TRBV7-3	TRBJ2-1
264	CAL ALP LPL PLG LGE GED EDK DKI KII IIF	CAS ASS SSL SLS LSS SSP SPF PFW FWE WEQ EQF QFF	TTDPSFLGRY	CALPLGEDKIIF	TRAV19	TRAJ30	CASSLSSPFWEQFF	TRBV27	TRBJ2-1
25	CAA AAL ALG LGN GNQ NQF QFY FYF	CAS ASS SSL SLG LGA GAG AGT GTY TYE YEQ EQY QYF	LTDEMIAQY	CAALGNQFYF	TRAV8-4	TRAJ49	CASSLGAGTYEQYF	TRBV7-8	TRBJ2-7
175	CAG AGL GLI LIG IGF GFG FGN GNV NVL VLH LHC	CSV SVA VAS ASS SSE SEA EAF AFF	TTDPSFLGRY	CAGLIGFGNVLHC	TRAV35	TRAJ35	CSVASSEAFF	TRBV29-1	TRBJ1-1
345	CAT ATD TDA DAN ANY NYG YGQ GQN QNF NFV FVF	CAS ASS SSP SPR PRD RDW DWY WYN YNE NEQ EQF QFF	TTDPSFLGRY	CATDANYGQNFVF	TRAV17	TRAJ26	CASSPRDWYNEQFF	TRBV27	TRBJ2-1
332	CAL ALD LDV DVS VSG SGS GSA SAR ARQ RQL QLT LTF	CSA SAR ARD RDG DGD GDS DSI SIS ISY SYN YNE NEQ EQF QFF	TTDPSFLGRY	CALDVSGSARQLTF	TRAV9-2	TRAJ22	CSARDGDSISYNEQFF	TRBV20-1	TRBJ2-1
559	CAV AVN VNT NTL TLM LMY MYS YSG SGG GGG GGA GAD ADG DGL GLT LTF	CAS ASS SSP SPD PDI DIE IEA EAF AFF	YLQPRTFLL	CAVNTLMYSGGGADGLTF	TRAV12-2	TRAJ45	CASSPDIEAFF	TRBV7-9	TRBJ1-1
454	CVV VVN VNN NNN NNN NND NDM DMR MRF	CAT ATQ TQD QDT DTN TNT NTG TGE GEL ELF LFF	YLQPRTFLL	CVVNNNNDMRF	TRAV12-1	TRAJ43	CATQDTNTGELFF	TRBV3-1	TRBJ2-2
461	CVV VVN VNE NEA EAD ADK DKL KLI LIF	CSA SAR ARD RDG DGV GVA VAH AHN HNT NTG TGE GEL ELF LFF	YLQPRTFLL	CVVNEADKLIF	TRAV12-1	TRAJ34	CSARDGVAHNTGELFF	TRBV20-1	TRBJ2-2
364	CLV LVG VGD GDW DWG WGN GNY NYG YGQ GQN QNF NFV FVF	CSG SGK GKP KPR PRG RGG GGA GAI AIY IYE YEQ EQY QYF	TTDPSFLGRY	CLVGDWGNYGQNFVF	TRAV4	TRAJ26	CSGKPRGGAIYEQYF	TRBV20-1	TRBJ2-7
428	CAV AVN VNS NSA SAD ADK DKL KLI LIF	CAS ASS SSR SRD RDI DIE IEA EAF AFF	YLQPRTFLL	CAVNSADKLIF	TRAV12-2	TRAJ34	CASSRDIEAFF	TRBV7-9	TRBJ1-1
294	CAV AVV VVP VPT PTF TFG FGG GGS GSY SYI YIP IPT PTF	CSV SVE VEG EGT GTE TES ESY SYE YEQ EQY QYF	TTDPSFLGRY	CAVVPTFGGSYIPTF	TRAV22	TRAJ6	CSVEGTESYEQYF	TRBV29-1	TRBJ2-7
11	CAM AMS MSG SGR GRA RAG AGG GGT GTS TSY SYG YGK GKL KLT LTF	CAS ASS SSL SLV LVE VET ETN TNY NYG YGY GYT YTF	LTDEMIAQY	CAMSGRAGGTSYGKLTF	TRAV12-3	TRAJ52	CASSLVETNYGYTF	TRBV6-5	TRBJ1-2
193	CIV IVR VRA RAL ALL LLG LGG GGY GYQ YQK QKV KVT VTF	CSA SAR ARD RDR DRT RTS TSG SGT GTY TYE YEQ EQY QYF	TTDPSFLGRY	CIVRALLGGYQKVTF	TRAV26-1	TRAJ13	CSARDRTSGTYEQYF	TRBV20-1	TRBJ2-7
42	CAS ASA SAG AGG GGG GGN GNK NKL KLT LTF	CAS ASR SRE REG EGR GRA RAY AYN YNE NEQ EQF QFF	LTDEMIAQY	CASAGGGNKLTF	TRAV21	TRAJ10	CASREGRAYNEQFF	TRBV6-6	TRBJ2-1
45	CAV AVR VRG RGS GSP SPG PGT GTY TYK YKY KYI YIF	CAS ASL SLN LNR NRA RAA AAN ANT NTG TGE GEL ELF LFF	LTDEMIAQY	CAVRGSPGTYKYIF	TRAV21	TRAJ40	CASLNRAANTGELFF	TRBV19	TRBJ2-2
90	CAM AMR MRE REG EGP GPG PGA GAG AGS GSY SYQ YQL QLT LTF	CAS ASR SRS RSG SGQ GQR QRN RNT NTE TEA EAF AFF	LTDEMIAQY	CAMREGPGAGSYQLTF	TRAV14/DV4	TRAJ28	CASRSGQRNTEAFF	TRBV6-5	TRBJ1-1
389	CVV VVN VNK NKE KED EDR DRL RLM LMF	CAS ASS SSL SLD LDI DIE IEL ELF LFF	YLQPRTFLL	CVVNKEDRLMF	TRAV12-1	TRAJ31	CASSLDIELFF	TRBV7-9	TRBJ1-4
519	CAV AVP VPP PPG PGF GFQ FQK QKL KLV LVF	CAS ASS SSQ SQD QDG DGG GGG GGN GNT NTE TEA EAF AFF	YLQPRTFLL	CAVPPGFQKLVF	TRAV2	TRAJ8	CASSQDGGGNTEAFF	TRBV14	TRBJ1-1
274	CAA AAV AVG VGG GGY GYQ YQK QKV KVT VTF	CAS ASS SSY SYR YRG RGS GSS SSL SLS LSS SSY SYE YEQ EQY QYF	TTDPSFLGRY	CAAVGGYQKVTF	TRAV13-1	TRAJ13	CASSYRGSSLSSYEQYF	TRBV5-5	TRBJ2-7
8	CAE AEN ENI NIF IFS FSG SGG GGY GYN YNK NKL KLI LIF	CAS ASS SSD SDT DTQ TQG QGS GSQ SQP QPQ PQH QHF	LTDEMIAQY	CAENIFSGGYNKLIF	TRAV13-2	TRAJ4	CASSDTQGSQPQHF	TRBV2	TRBJ1-5
382	CAL ALH LHD HDY DYK YKL KLS LSF	CAS ASS SSL SLS LSA SAG AGL GLD LDE DEQ EQF QFF	TTDPSFLGRY	CALHDYKLSF	TRAV9-2	TRAJ20	CASSLSAGLDEQFF	TRBV27	TRBJ2-1
368	CAG AGP GPK PKN KNT NTG TGN GNQ NQF QFY FYF	CAS ASS SSL SLD LDH DHP HPW PWG WGS GSP SPL PLH LHF	TTDPSFLGRY	CAGPKNTGNQFYF	TRAV25	TRAJ49	CASSLDHPWGSPLHF	TRBV27	TRBJ1-6
31	CAV AVR VRD RDG DGG GGF GFG FGN GNV NVL VLH LHC	CAS ASS SSY SYD YDN DNG NGG GGN GNT NTG TGE GEL ELF LFF	LTDEMIAQY	CAVRDGGFGNVLHC	TRAV3	TRAJ35	CASSYDNGGNTGELFF	TRBV6-5	TRBJ2-2
76	CAA AAR ARN RNH NHM HMN MNY NYG YGG GGS GSQ SQG QGN GNL NLI LIF	CAS ASS SSY SYS YSR SRP RPT PTG TGH GHT HTE TEA EAF AFF	LTDEMIAQY	CAARNHMNYGGSQGNLIF	TRAV21	TRAJ42	CASSYSRPTGHTEAFF	TRBV6-2	TRBJ1-1
77	CAC ACN CNT NTG TGN GNQ NQF QFY FYF	CAS ASS SSL SLA LAS ASN SNQ NQP QPQ PQH QHF	LTDEMIAQY	CACNTGNQFYF	TRAV5	TRAJ49	CASSLASNQPQHF	TRBV27	TRBJ1-5
16	CAV AVN VND NDA DAG AGG GGT GTS TSY SYG YGK GKL KLT LTF	CAS ASS SSL SLG LGG GGP GPG PGT GTG TGY GYE YEQ EQY QYF	LTDEMIAQY	CAVNDAGGTSYGKLTF	TRAV12-2	TRAJ52	CASSLGGPGTGYEQYF	TRBV27	TRBJ2-7
0	CAV AVD VDI DIR IRA RAG AGN GNM NML MLT LTF	CAS ASS SSL SLA LAG AGY GYE YEQ EQY QYF	LTDEMIAQY	CAVDIRAGNMLTF	TRAV39	TRAJ39	CASSLAGYEQYF	TRBV5-1	TRBJ2-7
129	CAG AGA GAA AAG AGN GNK NKL KLT LTF	CAS ASS SSY SYG YGP GPP PPY PYE YEQ EQY QYF	LTDEMIAQY	CAGAAGNKLTF	TRAV29/DV5	TRAJ17	CASSYGPPYEQYF	TRBV6-5	TRBJ2-7
469	CVV VVN VNE NEG EGD GDK DKL KLI LIF	CAW AWD WDR DRD RDH DHN HNT NTG TGE GEL ELF LFF	YLQPRTFLL	CVVNEGDKLIF	TRAV12-1	TRAJ34	CAWDRDHNTGELFF	TRBV30	TRBJ2-2
6	CAA AAN ANS NSG SGY GYA YAL ALN LNF	CAS ASS SSL SLA LAL ALA LAG AGI GIR IRY RYN YNE NEQ EQF QFF	LTDEMIAQY	CAANSGYALNF	TRAV17	TRAJ41	CASSLALAGIRYNEQFF	TRBV7-9	TRBJ2-1
265	CAM AMR MRE REF EFS FSN SND NDY DYK YKL KLS LSF	CAS ASS SSL SLR LRD RDS DSG SGD GDT DTQ TQY QYF	TTDPSFLGRY	CAMREFSNDYKLSF	TRAV14/DV4	TRAJ20	CASSLRDSGDTQYF	TRBV27	TRBJ2-3
473	CVV VVN VNR NRV RVD VDG DGY GYA YAL ALN LNF	CAW AWE WED EDR DRN RNT NTG TGE GEL ELF LFF	YLQPRTFLL	CVVNRVDGYALNF	TRAV12-1	TRAJ41	CAWEDRNTGELFF	TRBV30	TRBJ2-2
339	CAV AVP VPN PNF NFG FGN GNE NEK EKL KLT LTF	CAS ASS SSP SPL PLG LGT GTY TYE YEQ EQY QYF	TTDPSFLGRY	CAVPNFGNEKLTF	TRAV20	TRAJ48	CASSPLGTYEQYF	TRBV27	TRBJ2-7
380	CAV AVE VER ERN RNA NAG AGN GNM NML MLT LTF	CAS ASS SSP SPL PLS LSG SGL GLK LKE KEY EYF	TTDPSFLGRY	CAVERNAGNMLTF	TRAV22	TRAJ39	CASSPLSGLKEYF	TRBV13	TRBJ2-3
221	CAE AES ESK SKS KSG SGY GYN YNK NKL KLI LIF	CAS ASS SSL SLV LVP VPG PGH GHN HNE NEQ EQF QFF	TTDPSFLGRY	CAESKSGYNKLIF	TRAV5	TRAJ4	CASSLVPGHNEQFF	TRBV27	TRBJ2-1
138	CAS ASP SPN PNY NYG YGN GNM NML MLT LTF	CAS ASK SKQ KQG QGW GWS WSN SNQ NQP QPQ PQH QHF	TTDPSFLGRY	CASPNYGNMLTF	TRAV24	TRAJ39	CASKQGWSNQPQHF	TRBV12-4	TRBJ1-5
101	CAA AAS ASN SNQ NQA QAG AGT GTA TAL ALI LIF	CAS ASI SIG IGM GMY MYR YRN RNE NEQ EQF QFF	LTDEMIAQY	CAASNQAGTALIF	TRAV29/DV5	TRAJ15	CASIGMYRNEQFF	TRBV5-1	TRBJ2-1
305	CLV LVG VGG GGG GGF GFK FKT KTI TIF	CAS ASS SSE SEK EKL KLP LPE PEF EFN FNQ NQP QPQ PQH QHF	TTDPSFLGRY	CLVGGGFKTIF	TRAV4	TRAJ9	CASSEKLPEFNQPQHF	TRBV6-1	TRBJ1-5
79	CAV AVP VPS PSG SGY GYA YAL ALN LNF	CAT ATT TTE TEQ EQG QGS GSL SLI LIE IEQ EQY QYF	LTDEMIAQY	CAVPSGYALNF	TRAV39	TRAJ41	CATTEQGSLIEQYF	TRBV6-1	TRBJ2-7
247	CAM AMR MRE REG EGS GSG SGG GGF GFG FGN GNV NVL VLH LHC	CSV SVL VLT LTT TTG TGP GPG PGQ GQP QPQ PQH QHF	TTDPSFLGRY	CAMREGSGGFGNVLHC	TRAV14/DV4	TRAJ35	CSVLTTGPGQPQHF	TRBV29-1	TRBJ1-5
520	CAL ALS LSG SGL GLI LIQ IQG QGG GGS GSE SEK EKL KLV LVF	CAS ASS SSL SLG LGI GIA IAK AKN KNI NIQ IQY QYF	YLQPRTFLL	CALSGLIQGGSEKLVF	TRAV16	TRAJ57	CASSLGIAKNIQYF	TRBV11-2	TRBJ2-4
388	CAG AGD GDG DGN GNF NFG FGN GNE NEK EKL KLT LTF	CAS ASS SSQ SQD QDP DPG PGR GRG RGS GSP SPL PLH LHF	YLQPRTFLL	CAGDGNFGNEKLTF	TRAV27	TRAJ48	CASSQDPGRGSPLHF	TRBV4-3	TRBJ1-6
211	CAA AAR ARR RRW RWA WAI AIG IGA GAG AGK GKS KST STF	CAS ASS SSD SDR DRA RAG AGT GTD TDT DTQ TQY QYF	TTDPSFLGRY	CAARRWAIGAGKSTF	TRAV29/DV5	TRAJ27	CASSDRAGTDTQYF	TRBV27	TRBJ2-3
233	CAV AVW VWD WDN DNQ NQG QGG GGK GKL KLI LIF	CSV SVE VEE EEA EAG AGS GSY SYE YEQ EQY QYF	TTDPSFLGRY	CAVWDNQGGKLIF	TRAV2	TRAJ23	CSVEEAGSYEQYF	TRBV29-1	TRBJ2-7
201	CAL ALM LMG MGS GSQ SQG QGN GNL NLI LIF	CAS ASS SSL SLD LDS DSP SPY PYE YEQ EQY QYF	TTDPSFLGRY	CALMGSQGNLIF	TRAV9-2	TRAJ42	CASSLDSPYEQYF	TRBV27	TRBJ2-7
327	CAA AAL ALM LMG MGN GNQ NQF QFY FYF	CAS ASS SSL SLM LML MLG LGE GEE EET ETQ TQY QYF	TTDPSFLGRY	CAALMGNQFYF	TRAV12-3	TRAJ49	CASSLMLGEETQYF	TRBV7-7	TRBJ2-5
84	CVV VVR VRG RGF GFQ FQK QKL KLV LVF	CAT ATS TSP SPH PHQ HQE QEG EGR GRT RTE TEA EAF AFF	LTDEMIAQY	CVVRGFQKLVF	TRAV12-1	TRAJ8	CATSPHQEGRTEAFF	TRBV15	TRBJ1-1
116	CAV AVR VRY RYR YRG RGS GST STL TLG LGR GRL RLY LYF	CAS ASS SSR SRG RGT GTS TSG SGR GRG RGI GIN INE NEQ EQF QFF	LTDEMIAQY	CAVRYRGSTLGRLYF	TRAV21	TRAJ18	CASSRGTSGRGINEQFF	TRBV27	TRBJ2-1
243	CAA AAS ASI SIG IGY GYS YST STL TLT LTF	CSV SVR VRL RLA LAG AGG GGS GSG SGE GET ETQ TQY QYF	TTDPSFLGRY	CAASIGYSTLTF	TRAV13-1	TRAJ11	CSVRLAGGSGETQYF	TRBV29-1	TRBJ2-5
356	CAL ALN LNA NAG AGN GNM NML MLT LTF	CAS AST STT TTG TGT GTG TGY GYA YAE AEA EAF AFF	TTDPSFLGRY	CALNAGNMLTF	TRAV6	TRAJ39	CASTTGTGYAEAFF	TRBV6-2	TRBJ1-1
541	CAV AVR VRD RDR DRG RGS GSQ SQG QGN GNL NLI LIF	CAS ASS SSP SPD PDR DRG RGG GGG GGY GYT YTF	YLQPRTFLL	CAVRDRGSQGNLIF	TRAV1-2	TRAJ42	CASSPDRGGGYTF	TRBV18	TRBJ1-2
530	CVV VVN VNK NKE KEN ENN NNL NLF LFF	CAW AWG WGS GSM SMN MNT NTG TGE GEL ELF LFF	YLQPRTFLL	CVVNKENNLFF	TRAV12-1	TRAJ36	CAWGSMNTGELFF	TRBV30	TRBJ2-2
190	CAE AEF EFT FTR TRQ RQA QAG AGT GTA TAL ALI LIF	CAS ASS SSL SLS LSA SAG AGL GLD LDE DEQ EQF QFF	TTDPSFLGRY	CAEFTRQAGTALIF	TRAV4	TRAJ15	CASSLSAGLDEQFF	TRBV27	TRBJ2-1
91	CAV AVS VSP SPS PSE SEG EGT GTY TYK YKY KYI YIF	CAS ASS SSL SLD LDD DDG DGD GDR DRW RWG WGY GYT YTF	LTDEMIAQY	CAVSPSEGTYKYIF	TRAV3	TRAJ40	CASSLDDGDRWGYTF	TRBV7-6	TRBJ1-2
481	CAA AAS ASG SGG GGG GGG GGG GGA GAD ADG DGL GLT LTF	CAS ASS SSY SYG YGN GNQ NQP QPQ PQH QHF	YLQPRTFLL	CAASGGGGGADGLTF	TRAV29/DV5	TRAJ45	CASSYGNQPQHF	TRBV7-9	TRBJ1-5
150	CVG VGT GTP TPD PDY DYQ YQL QLI LIW	CAS ASR SRL RLQ LQG QGA GAG AGT GTE TEA EAF AFF	TTDPSFLGRY	CVGTPDYQLIW	TRAV12-1	TRAJ33	CASRLQGAGTEAFF	TRBV28	TRBJ1-1
75	CAA AAR ARP RPG PGA GAD ADK DKL KLI LIF	CAS AST STT TTE TEE EEN ENR NRP RPY PYE YEQ EQY QYF	LTDEMIAQY	CAARPGADKLIF	TRAV29/DV5	TRAJ34	CASTTEENRPYEQYF	TRBV7-9	TRBJ2-7
408	CAM AMW MWG WGS GSR SRN RNA NAG AGN GNN NNR NRK RKL KLI LIW	CAS ASS SSH SHG HGG GGP GPG PGG GGL GLN LNE NEQ EQF QFF	YLQPRTFLL	CAMWGSRNAGNNRKLIW	TRAV12-3	TRAJ38	CASSHGGPGGLNEQFF	TRBV4-3	TRBJ2-1
323	CAA AAA AAT ATD TDS DSW SWG WGK GKL KLQ LQF	CAS ASS SSL SLE LEQ EQG QGL GLP LPH PHA HAQ AQY QYF	TTDPSFLGRY	CAAATDSWGKLQF	TRAV29/DV5	TRAJ24	CASSLEQGLPHAQYF	TRBV5-5	TRBJ2-7
552	CVV VVN VNN NNN NNN NND NDM DMR MRF	CAI AIE IED EDL DLN LNT NTG TGE GEL ELF LFF	YLQPRTFLL	CVVNNNNDMRF	TRAV12-1	TRAJ43	CAIEDLNTGELFF	TRBV6-5	TRBJ2-2
429	CAT ATA TAS ASG SGG GGG GGA GAD ADG DGL GLT LTF	CAS ASS SSL SLV LVS VSP SPG PGF GFG FGT GTE TEA EAF AFF	YLQPRTFLL	CATASGGGADGLTF	TRAV17	TRAJ45	CASSLVSPGFGTEAFF	TRBV5-1	TRBJ1-1
41	CAV AVN VNV NVG VGG GGG GGS GSN SNY NYK YKL KLT LTF	CSV SVG VGT GTG TGW GWP WPY PYE YEQ EQY QYF	LTDEMIAQY	CAVNVGGGSNYKLTF	TRAV12-2	TRAJ53	CSVGTGWPYEQYF	TRBV29-1	TRBJ2-7
170	CAA AAG AGP GPG PGG GGA GAD ADG DGL GLT LTF	CAS ASS SSP SPQ PQG QGV GVT VTQ TQY QYF	TTDPSFLGRY	CAAGPGGADGLTF	TRAV29/DV5	TRAJ45	CASSPQGVTQYF	TRBV6-5	TRBJ2-5
582	CAP APN PNA NAG AGG GGT GTS TSY SYG YGK GKL KLT LTF	CAS ASS SSV SVA VAY AYR YRG RGN GNE NEQ EQF QFF	YLQPRTFLL	CAPNAGGTSYGKLTF	TRAV24	TRAJ52	CASSVAYRGNEQFF	TRBV9	TRBJ2-1
497	CVV VVN VNM NMP MPG PGA GAG AGS GSY SYQ YQL QLT LTF	CAS ASS SSP SPV PVA VAG AGG GGN GNT NTG TGE GEL ELF LFF	YLQPRTFLL	CVVNMPGAGSYQLTF	TRAV12-1	TRAJ28	CASSPVAGGNTGELFF	TRBV13	TRBJ2-2
485	CVV VVG VGT GTG TGG GGG GGN GNK NKL KLT LTF	CSA SAN ANR NRA RAG AGK GKN KNI NIQ IQY QYF	YLQPRTFLL	CVVGTGGGNKLTF	TRAV12-1	TRAJ10	CSANRAGKNIQYF	TRBV20-1	TRBJ2-4
553	CAG AGN GNQ NQG QGG GGK GKL KLI LIF	CSA SAR ARD RDR DRS RSS SSY SYE YEQ EQY QYF	YLQPRTFLL	CAGNQGGKLIF	TRAV39	TRAJ23	CSARDRSSYEQYF	TRBV20-1	TRBJ2-7
451	CAV AVN VNM NMR MRR RRD RDD DDK DKI KII IIF	CAS ASR SRY RYG YGG GGQ GQG QGD GDS DSE SEQ EQF QFF	YLQPRTFLL	CAVNMRRDDKIIF	TRAV12-2	TRAJ30	CASRYGGQGDSEQFF	TRBV6-2	TRBJ2-1
568	CAA AAS ASE SEG EGG GGG GGS GST STL TLG LGR GRL RLY LYF	CAS ASS SSE SES EST STG TGY GYG YGY GYT YTF	YLQPRTFLL	CAASEGGGSTLGRLYF	TRAV29/DV5	TRAJ18	CASSESTGYGYTF	TRBV2	TRBJ1-2
44	CAF AFM FMK MKP KPK PKN KNY NYG YGG GGS GSQ SQG QGN GNL NLI LIF	CAS ASS SSS SSR SRQ RQG QGP GPK PKE KEY EYG YGY GYT YTF	LTDEMIAQY	CAFMKPKNYGGSQGNLIF	TRAV38-1	TRAJ42	CASSSRQGPKEYGYTF	TRBV7-6	TRBJ1-2
178	CAA AAS ASE SEG EGD GDS DSN SNY NYQ YQL QLI LIW	CAS ASD SDL DLL LLN LNR NRA RAS ASY SYE YEQ EQY QYF	TTDPSFLGRY	CAASEGDSNYQLIW	TRAV29/DV5	TRAJ33	CASDLLNRASYEQYF	TRBV7-9	TRBJ2-7
377	CAE AEA EAA AAP APT PTG TGT GTA TAS ASK SKL KLT LTF	CAS ASS SSF SFT FTS TSG SGS GSY SYE YEQ EQY QYF	TTDPSFLGRY	CAEAAPTGTASKLTF	TRAV13-2	TRAJ44	CASSFTSGSYEQYF	TRBV28	TRBJ2-7
67	CAV AVG VGA GAY AYN YNQ NQG QGG GGK GKL KLI LIF	CAS ASS SSL SLP LPG PGA GAR ARS RSG SGA GAN ANV NVL VLT LTF	LTDEMIAQY	CAVGAYNQGGKLIF	TRAV20	TRAJ23	CASSLPGARSGANVLTF	TRBV5-6	TRBJ2-6
159	CAM AMS MST STG TGN GNN NNA NAR ARL RLM LMF	CAS AST STD TDG DGG GGF GFG FGY GYT YTF	TTDPSFLGRY	CAMSTGNNARLMF	TRAV12-3	TRAJ31	CASTDGGFGYTF	TRBV6-5	TRBJ1-2
369	CAL ALS LSA SAN ANQ NQA QAG AGT GTA TAL ALI LIF	CAS ASS SSL SLR LRS RSG SGL GLD LDT DTQ TQY QYF	TTDPSFLGRY	CALSANQAGTALIF	TRAV16	TRAJ15	CASSLRSGLDTQYF	TRBV27	TRBJ2-3
113	CAV AVR VRD RDI DIS ISD SDG DGQ GQK QKL KLL LLF	CAS ASS SSP SPL PLS LSY SYE YEQ EQY QYF	LTDEMIAQY	CAVRDISDGQKLLF	TRAV1-2	TRAJ16	CASSPLSYEQYF	TRBV12-4	TRBJ2-7
123	CAV AVV VVR VRS RSG SGT GTY TYK YKY KYI YIF	CAS ASS SSL SLT LTG TGT GTG TGA GAL ALY LYE YEQ EQY QYF	LTDEMIAQY	CAVVRSGTYKYIF	TRAV8-3	TRAJ40	CASSLTGTGALYEQYF	TRBV7-9	TRBJ2-7
539	CIP IPI PIS ISG SGG GGY GYN YNK NKL KLI LIF	CAS ASS SSQ SQE QEG EGV GVG VGQ GQG QGW GWS WSP SPL PLH LHF	YLQPRTFLL	CIPISGGYNKLIF	TRAV26-1	TRAJ4	CASSQEGVGQGWSPLHF	TRBV4-1	TRBJ1-6
66	CAL ALR LRS RSN SNY NYQ YQL QLI LIW	CAW AWG WGL GLA LAG AGG GGP GPI PIE IEQ EQF QFF	LTDEMIAQY	CALRSNYQLIW	TRAV12-3	TRAJ33	CAWGLAGGPIEQFF	TRBV30	TRBJ2-1
486	CVV VVN VNM NME MED EDK DKL KLV LVF	CAS ASL SLR LRQ RQN QNS NSG SGE GEQ EQF QFF	YLQPRTFLL	CVVNMEDKLVF	TRAV12-1	TRAJ47	CASLRQNSGEQFF	TRBV10-2	TRBJ2-1
72	CAV AVG VGG GGG GGA GAD ADG DGL GLT LTF	CAS ASV SVN VNP NPT PTG TGA GAK AKN KNI NIQ IQY QYF	LTDEMIAQY	CAVGGGADGLTF	TRAV21	TRAJ45	CASVNPTGAKNIQYF	TRBV6-6	TRBJ2-4
384	CAM AMR MRE REK EKN KNQ NQG QGG GGK GKL KLI LIF	CAS ASS SSE SED EDR DRG RGS GSY SYG YGY GYT YTF	TTDPSFLGRY	CAMREKNQGGKLIF	TRAV14/DV4	TRAJ23	CASSEDRGSYGYTF	TRBV6-1	TRBJ1-2
337	CAV AVA VAG AGR GRN RNT NTG TGR GRR RRA RAL ALT LTF	CAS ASS SSQ SQD QDG DGI GIA IAG AGY GYN YNE NEQ EQF QFF	TTDPSFLGRY	CAVAGRNTGRRALTF	TRAV2	TRAJ5	CASSQDGIAGYNEQFF	TRBV4-3	TRBJ2-1
232	CAA AAS ASA SAG AGP GPI PIG IGF GFG FGN GNV NVL VLH LHC	CAS ASS SSP SPG PGQ GQR QRS RSY SYN YNE NEQ EQF QFF	TTDPSFLGRY	CAASAGPIGFGNVLHC	TRAV13-1	TRAJ35	CASSPGQRSYNEQFF	TRBV18	TRBJ2-1
466	CVV VVN VNR NRE RED EDM DML MLT LTF	CAW AWT WTR TRD RDR DRN RNT NTG TGE GEL ELF LFF	YLQPRTFLL	CVVNREDMLTF	TRAV12-1	TRAJ39	CAWTRDRNTGELFF	TRBV30	TRBJ2-2
185	CAM AMR MRE REG EGL GLG LGS GSG SGG GGS GSN SNY NYK YKL KLT LTF	CAS ASS SSL SLT LTA TAP APT PTD TDT DTQ TQY QYF	TTDPSFLGRY	CAMREGLGSGGSNYKLTF	TRAV14/DV4	TRAJ53	CASSLTAPTDTQYF	TRBV13	TRBJ2-3
267	CAT ATD TDP DPT PTL TLN LNT NTG TGN GNQ NQF QFY FYF	CSV SVR VRG RGR GRT RTH THN HNE NEQ EQF QFF	TTDPSFLGRY	CATDPTLNTGNQFYF	TRAV17	TRAJ49	CSVRGRTHNEQFF	TRBV29-1	TRBJ2-1
216	CAM AMR MRV RVW VWG WGN GNN NNN NND NDM DMR MRF	CAS ASS SSS SSR SRG RGR GRT RTS TSS SSY SYE YEQ EQY QYF	TTDPSFLGRY	CAMRVWGNNNDMRF	TRAV14/DV4	TRAJ43	CASSSRGRTSSYEQYF	TRBV7-8	TRBJ2-7
250	CAV AVF VFS FSG SGN GNT NTG TGK GKL KLI LIF	CSV SVE VEQ EQG QGT GTY TYE YEQ EQY QYF	TTDPSFLGRY	CAVFSGNTGKLIF	TRAV21	TRAJ37	CSVEQGTYEQYF	TRBV29-1	TRBJ2-7
442	CVV VVN VNE NEN ENN NND NDM DMR MRF	CAS ASG SGD GDE DEN ENT NTG TGE GEL ELF LFF	YLQPRTFLL	CVVNENNDMRF	TRAV12-1	TRAJ43	CASGDENTGELFF	TRBV5-1	TRBJ2-2
496	CAV AVN VNT NTG TGF GFQ FQK QKL KLV LVF	CAS ASS SSL SLY LYG YGG GGY GYE YEQ EQY QYF	YLQPRTFLL	CAVNTGFQKLVF	TRAV12-2	TRAJ8	CASSLYGGYEQYF	TRBV7-3	TRBJ2-7
410	CAM AMR MRE RET ETN TNF NFG FGN GNE NEK EKL KLT LTF	CAS ASS SSR SRN RNR NRY RYT YTD TDT DTQ TQY QYF	YLQPRTFLL	CAMRETNFGNEKLTF	TRAV14/DV4	TRAJ48	CASSRNRYTDTQYF	TRBV7-7	TRBJ2-3
301	CAL ALF LFS FSS SSG SGN GNQ NQF QFY FYF	CAS ASS SSL SLD LDS DSP SPY PYE YEQ EQY QYF	TTDPSFLGRY	CALFSSGNQFYF	TRAV9-2	TRAJ49	CASSLDSPYEQYF	TRBV27	TRBJ2-7
538	CAV AVE VEV EVY VYS YSG SGG GGG GGA GAD ADG DGL GLT LTF	CAW AWS WSG SGF GFA FAN ANT NTG TGE GEL ELF LFF	YLQPRTFLL	CAVEVYSGGGADGLTF	TRAV36/DV7	TRAJ45	CAWSGFANTGELFF	TRBV30	TRBJ2-2
397	CAV AVT VTN TNS NSN SNY NYQ YQL QLI LIW	CAS ASR SRL RLG LGT GTG TGE GEV EVG VGE GEL ELF LFF	YLQPRTFLL	CAVTNSNYQLIW	TRAV1-2	TRAJ33	CASRLGTGEVGELFF	TRBV25-1	TRBJ2-2
279	CAV AVR VRD RDR DRW RWD WDD DDY DYK YKL KLS LSF	CAC ACA CAG AGF GFL FLH LHH HHT HTG TGE GEL ELF LFF	TTDPSFLGRY	CAVRDRWDDYKLSF	TRAV1-2	TRAJ20	CACAGFLHHTGELFF	TRBV30	TRBJ2-2
280	CAM AMS MSL SLG LGS GSF SFG FGN GNV NVL VLH LHC	CAS ASN SNP NPG PGG GGV GVE VET ETQ TQY QYF	TTDPSFLGRY	CAMSLGSFGNVLHC	TRAV12-3	TRAJ35	CASNPGGVETQYF	TRBV6-5	TRBJ2-5
152	CAL ALS LSP SPW PWV WVG VGS GSQ SQG QGN GNL NLI LIF	CAS ASS SSL SLY LYI YIS ISV SVG VGS GSN SNT NTE TEA EAF AFF	TTDPSFLGRY	CALSPWVGSQGNLIF	TRAV9-2	TRAJ42	CASSLYISVGSNTEAFF	TRBV28	TRBJ1-1
23	CAV AVD VDL DLS LSG SGS GSA SAR ARQ RQL QLT LTF	CSA SAR ARG RGD GDR DRG RGE GEG EGY GYE YEQ EQY QYF	LTDEMIAQY	CAVDLSGSARQLTF	TRAV39	TRAJ22	CSARGDRGEGYEQYF	TRBV20-1	TRBJ2-7
447	CAC ACN CNA NAG AGN GNM NML MLT LTF	CAS ASR SRT RTD TDG DGL GLA LAG AGY GYN YNE NEQ EQF QFF	YLQPRTFLL	CACNAGNMLTF	TRAV8-3	TRAJ39	CASRTDGLAGYNEQFF	TRBV12-4	TRBJ2-1
1	CGT GTE TEL ELR LRG RGK GKL KLI LIF	CAS ASS SSL SLG LGF GFP FPN PNQ NQP QPQ PQH QHF	LTDEMIAQY	CGTELRGKLIF	TRAV30	TRAJ23	CASSLGFPNQPQHF	TRBV27	TRBJ1-5
61	CAV AVG VGT GTN TNY NYG YGN GNN NNR NRL RLA LAF	CAS ASS SSE SEA EAP API PIG IGN GNT NTI TIY IYF	LTDEMIAQY	CAVGTNYGNNRLAF	TRAV8-3	TRAJ7	CASSEAPIGNTIYF	TRBV10-2	TRBJ1-3
238	CAE AEN ENS NSG SGG GGA GAT ATN TNK NKL KLI LIF	CAS ASS SSL SLS LSG SGY GYN YNE NEQ EQF QFF	TTDPSFLGRY	CAENSGGATNKLIF	TRAV13-2	TRAJ32	CASSLSGYNEQFF	TRBV27	TRBJ2-1
566	CAV AVA VAN ANQ NQA QAG AGT GTA TAL ALI LIF	CAT ATC TCL CLG LGS GSS SSA SAG AGE GEL ELF LFF	YLQPRTFLL	CAVANQAGTALIF	TRAV21	TRAJ15	CATCLGSSAGELFF	TRBV27	TRBJ2-2
420	CAV AVM VMD MDS DSN SNY NYQ YQL QLI LIW	CSA SAR ARV RVL VLT LTS TSG SGE GET ETY TYE YEQ EQY QYF	YLQPRTFLL	CAVMDSNYQLIW	TRAV1-2	TRAJ33	CSARVLTSGETYEQYF	TRBV20-1	TRBJ2-7
324	CAL ALS LSG SGT GTG TGN GNQ NQF QFY FYF	CAS ASS SSL SLS LSG SGP GPL PLE LET ETQ TQY QYF	TTDPSFLGRY	CALSGTGNQFYF	TRAV9-2	TRAJ49	CASSLSGPLETQYF	TRBV27	TRBJ2-5
464	CVV VVN VNS NSA SAD ADK DKL KLI LIF	CAS ASS SSP SPE PEI EIK IKA KAF AFF	YLQPRTFLL	CVVNSADKLIF	TRAV12-1	TRAJ34	CASSPEIKAFF	TRBV7-9	TRBJ1-1
271	CAE AEV EVN VNG NGG GGS GSQ SQG QGN GNL NLI LIF	CAS ASS SSP SPK PKT KTG TGR GRH RHQ HQE QET ETQ TQY QYF	TTDPSFLGRY	CAEVNGGSQGNLIF	TRAV13-2	TRAJ42	CASSPKTGRHQETQYF	TRBV27	TRBJ2-5
24	CAL ALS LSA SAL ALN LNT NTG TGG GGF GFK FKT KTI TIF	CAS ASH SHP HPG PGT GTG TGT GTS TSS SSY SYN YNS NSP SPL PLH LHF	LTDEMIAQY	CALSALNTGGFKTIF	TRAV9-2	TRAJ9	CASHPGTGTSSYNSPLHF	TRBV19	TRBJ1-6
104	CAT ATP TPR PRS RSG SGG GGS GSY SYI YIP IPT PTF	CAI AIS ISE SEE EEH EHT HTG TGE GEY EYQ YQP QPQ PQH QHF	LTDEMIAQY	CATPRSGGSYIPTF	TRAV17	TRAJ6	CAISEEHTGEYQPQHF	TRBV10-3	TRBJ1-5
78	CAN ANG NGE GEG EGS GSQ SQG QGN GNL NLI LIF	CAW AWS WSV SVG VGQ GQG QGA GAR ARE REQ EQY QYF	LTDEMIAQY	CANGEGSQGNLIF	TRAV14/DV4	TRAJ42	CAWSVGQGAREQYF	TRBV30	TRBJ2-7
550	CAA AAR ARE REG EGT GTG TGN GNQ NQF QFY FYF	CAS ASS SSL SLG LGP GPE PEA EAF AFF	YLQPRTFLL	CAAREGTGNQFYF	TRAV29/DV5	TRAJ49	CASSLGPEAFF	TRBV7-9	TRBJ1-1
321	CAL ALR LRT RTG TGN GNQ NQF QFY FYF	CAS ASL SLG LGL GLA LAG AGE GEL ELF LFF	TTDPSFLGRY	CALRTGNQFYF	TRAV6	TRAJ49	CASLGLAGELFF	TRBV6-1	TRBJ2-2
4	CAR ARQ RQA QAG AGN GNM NML MLT LTF	CAS ASQ SQG QGG GGA GAG AGY GYL YLY LYG YGY GYT YTF	LTDEMIAQY	CARQAGNMLTF	TRAV9-2	TRAJ39	CASQGGAGYLYGYTF	TRBV2	TRBJ1-2
36	CAV AVR VRG RGG GGQ GQK QKL KLL LLF	CAS ASS SSL SLD LDW DWN WNY NYG YGY GYT YTF	LTDEMIAQY	CAVRGGQKLLF	TRAV12-2	TRAJ16	CASSLDWNYGYTF	TRBV14	TRBJ1-2
318	CAV AVK VKS KSL SLD LDT DTG TGR GRR RRA RAL ALT LTF	CAS ASS SSL SLL LLG LGA GAR ARN RNE NEQ EQF QFF	TTDPSFLGRY	CAVKSLDTGRRALTF	TRAV8-1	TRAJ5	CASSLLGARNEQFF	TRBV7-3	TRBJ2-1
65	CAV AVR VRG RGG GGS GSG SGT GTY TYK YKY KYI YIF	CAS ASS SSP SPT PTV TVS VSN SNT NTG TGE GEL ELF LFF	LTDEMIAQY	CAVRGGSGTYKYIF	TRAV21	TRAJ40	CASSPTVSNTGELFF	TRBV19	TRBJ2-2
412	CAV AVN VNE NED EDD DDK DKI KII IIF	CAS ASS SSS SSD SDI DIS ISA SAF AFF	YLQPRTFLL	CAVNEDDKIIF	TRAV12-2	TRAJ30	CASSSDISAFF	TRBV7-9	TRBJ1-1
430	CAA AAS ASI SIK IKA KAG AGS GSA SAR ARQ RQL QLT LTF	CAS ASS SSL SLD LDI DIE IEQ EQY QYF	YLQPRTFLL	CAASIKAGSARQLTF	TRAV13-1	TRAJ22	CASSLDIEQYF	TRBV7-9	TRBJ2-7
5	CAA AAN ANT NTG TGN GNQ NQF QFY FYF	CAS ASS SSL SLA LAV AVN VNT NTE TEA EAF AFF	LTDEMIAQY	CAANTGNQFYF	TRAV5	TRAJ49	CASSLAVNTEAFF	TRBV27	TRBJ1-1
63	CIV IVP VPR PRG RGG GGA GAD ADG DGL GLT LTF	CAS ASS SSP SPG PGI GIP IPN PNY NYG YGY GYT YTF	LTDEMIAQY	CIVPRGGADGLTF	TRAV26-1	TRAJ45	CASSPGIPNYGYTF	TRBV27	TRBJ1-2
59	CAG AGR GRT RTN TNA NAG AGK GKS KST STF	CAW AWS WST STG TGG GGT GTW TWT WTG TGE GEL ELF LFF	LTDEMIAQY	CAGRTNAGKSTF	TRAV35	TRAJ27	CAWSTGGTWTGELFF	TRBV30	TRBJ2-2
419	CAV AVN VNR NRD RDD DDK DKI KII IIF	CAS ASS SSL SLD LDI DIE IEA EAF AFF	YLQPRTFLL	CAVNRDDKIIF	TRAV12-2	TRAJ30	CASSLDIEAFF	TRBV7-9	TRBJ1-1
60	CAV AVR VRV RVD VDS DSN SNY NYQ YQL QLI LIW	CAS ASS SSF SFT FTG TGR GRR RRE RET ETQ TQY QYF	LTDEMIAQY	CAVRVDSNYQLIW	TRAV1-1	TRAJ33	CASSFTGRRETQYF	TRBV7-9	TRBJ2-5
411	CAV AVN VNG NGL GLG LGM GMG MGG GGG GGA GAD ADG DGL GLT LTF	CAS ASS SSP SPD PDI DIE IEA EAF AFF	YLQPRTFLL	CAVNGLGMGGGADGLTF	TRAV12-2	TRAJ45	CASSPDIEAFF	TRBV7-9	TRBJ1-1
476	CAV AVR VRD RDA DAS ASG SGA GAA AAG AGN GNK NKL KLT LTF	CAS ASS SSA SAP APD PDR DRG RGN GNT NTE TEA EAF AFF	YLQPRTFLL	CAVRDASGAAGNKLTF	TRAV1-1	TRAJ17	CASSAPDRGNTEAFF	TRBV19	TRBJ1-1
574	CAT ATE TEE EET ETS TSG SGS GSR SRL RLT LTF	CAS ASS SSL SLE LEA EAG AGD GDY DYN YNE NEQ EQF QFF	YLQPRTFLL	CATEETSGSRLTF	TRAV17	TRAJ58	CASSLEAGDYNEQFF	TRBV7-6	TRBJ2-1
230	CAP APP PPD PDS DSS SSY SYK YKL KLI LIF	CAS ASS SSL SLQ LQG QGV GVS VSY SYE YEQ EQY QYF	TTDPSFLGRY	CAPPDSSYKLIF	TRAV12-2	TRAJ12	CASSLQGVSYEQYF	TRBV28	TRBJ2-7
564	CAA AAY AYS YSG SGG GGG GGA GAD ADG DGL GLT LTF	CAC ACT CTG TGR GRG RGG GGN GNG NGY GYT YTF	YLQPRTFLL	CAAYSGGGADGLTF	TRAV12-2	TRAJ45	CACTGRGGNGYTF	TRBV6-5	TRBJ1-2
433	CVV VVN VNR NRA RAD ADK DKL KLI LIF	CAS ASS SSP SPD PDI DIE IEQ EQY QYF	YLQPRTFLL	CVVNRADKLIF	TRAV12-1	TRAJ34	CASSPDIEQYF	TRBV7-9	TRBJ2-7
558	CAL ALG LGG GGS GSN SND NDY DYK YKL KLS LSF	CAS ASS SSL SLA LAG AGG GGF GFT FTG TGE GEL ELF LFF	YLQPRTFLL	CALGGSNDYKLSF	TRAV17	TRAJ20	CASSLAGGFTGELFF	TRBV7-8	TRBJ2-2
