413	CAS AST STE TET ETN TNT NTG TGE GEL ELF LFF	YLQPRTFLL
310	CAS ASS SSP SPG PGT GTS TSN SNT NTG TGE GEL ELF LFF	TTDPSFLGRY
506	CAS ASS SSH SHD HDI DIE IEA EAF AFF	YLQPRTFLL
242	CAS ASS SSV SVY VYE YEL ELS LSL SLP LPG PGA GAA AAQ AQY QYF	TTDPSFLGRY
319	CAS ASS SSI SIE IEW EWS WSG SGG GGQ GQE QET ETQ TQY QYF	TTDPSFLGRY
171	CAS ASS SSS SSR SRA RAA AAS AST STD TDT DTQ TQY QYF	TTDPSFLGRY
358	CAS ASA SAA AAR ARQ RQG QGS GSD SDE DEQ EQY QYF	TTDPSFLGRY
581	CAS ASS SSL SLA LAS AST STD TDT DTQ TQY QYF	YLQPRTFLL
483	CAS ASR SRE REE EET ETG TGI GIR IRF RFY FYE YEQ EQY QYF	YLQPRTFLL
227	CAS ASS SSL SLS LSA SAP APK PKP KPF PFY FYN YNS NSP SPL PLH LHF	TTDPSFLGRY
477	CAS AST STD TDD DDI DIE IEA EAF AFF	YLQPRTFLL
