346	CAS ASS SSV SVD VDR DRA RAQ AQL QLF LFG FGY GYT YTF	TTDPSFLGRY
460	CAS AST STE TEG EGN GNT NTG TGE GEL ELF LFF	YLQPRTFLL
204	CAS ASS SSL SLL LLP LPE PEQ EQE QET ETQ TQY QYF	TTDPSFLGRY
406	CAS ASS SSL SLA LAE AEG EGP GPR PRY RYG YGY GYT YTF	YLQPRTFLL
172	CAS ASS SSP SPR PRD RDH DHQ HQE QET ETQ TQY QYF	TTDPSFLGRY
514	CAT ATG TGL GLA LAN ANT NTG TGE GEL ELF LFF	YLQPRTFLL
199	CAS ASR SRQ RQA QAG AGD GDE DEQ EQY QYF	TTDPSFLGRY
304	CSV SVE VEG EGD GDL DLS LSG SGD GDE DEQ EQF QFF	TTDPSFLGRY
218	CAS ASS SSP SPS PSG SGS GSL SLE LEQ EQY QYF	TTDPSFLGRY
156	CAS ASS SSW SWT WTS TSG SGS GSH SHE HEQ EQY QYF	TTDPSFLGRY
206	CAS ASW SWT WTD TDS DSQ SQG QGE GET ETQ TQY QYF	TTDPSFLGRY
161	CAS ASS SSP SPG PGR GRM RMS MSS SSR SRY RYE YEQ EQY QYF	TTDPSFLGRY
47	CAR ARR RRG RGD GDR DRA RAE AEQ EQY QYF	LTDEMIAQY
231	CAS ASW SWT WTD TDD DDN DNQ NQP QPQ PQH QHF	TTDPSFLGRY
370	CAS ASS SSL SLY LYG YGQ GQS QSD SDS DSP SPL PLH LHF	TTDPSFLGRY
2	CAS ASS SSE SEG EGI GIT ITS TSN SNQ NQP QPQ PQH QHF	LTDEMIAQY
109	CAS ASS SSL SLK LKA KAP APP PPH PHS HSN SNT NTE TEA EAF AFF	LTDEMIAQY
585	CAI AIS ISG SGD GDP DPT PTG TGV GVN VNN NNE NEQ EQF QFF	YLQPRTFLL
463	CAS ASG SGD GDT DTN TNT NTG TGE GEL ELF LFF	YLQPRTFLL
349	CSA SAR ARD RDR DRE REG EGP GPN PNY NYE YEQ EQY QYF	TTDPSFLGRY
362	CAS ASR SRW RWT WTD TDG DGI GIM IMN MNT NTE TEA EAF AFF	TTDPSFLGRY
452	CAS ASS SSL SLL LLG LGE GEP EPG PGE GEA EAF AFF	YLQPRTFLL
263	CAS ASS SSV SVS VSY SYG YGY GYT YTF	TTDPSFLGRY
29	CAS ASS SST STG TGG GGR GRG RGE GEQ EQF QFF	LTDEMIAQY
264	CAS ASS SSL SLS LSS SSP SPF PFW FWE WEQ EQF QFF	TTDPSFLGRY
25	CAS ASS SSL SLG LGA GAG AGT GTY TYE YEQ EQY QYF	LTDEMIAQY
175	CSV SVA VAS ASS SSE SEA EAF AFF	TTDPSFLGRY
345	CAS ASS SSP SPR PRD RDW DWY WYN YNE NEQ EQF QFF	TTDPSFLGRY
332	CSA SAR ARD RDG DGD GDS DSI SIS ISY SYN YNE NEQ EQF QFF	TTDPSFLGRY
559	CAS ASS SSP SPD PDI DIE IEA EAF AFF	YLQPRTFLL
454	CAT ATQ TQD QDT DTN TNT NTG TGE GEL ELF LFF	YLQPRTFLL
461	CSA SAR ARD RDG DGV GVA VAH AHN HNT NTG TGE GEL ELF LFF	YLQPRTFLL
364	CSG SGK GKP KPR PRG RGG GGA GAI AIY IYE YEQ EQY QYF	TTDPSFLGRY
428	CAS ASS SSR SRD RDI DIE IEA EAF AFF	YLQPRTFLL
294	CSV SVE VEG EGT GTE TES ESY SYE YEQ EQY QYF	TTDPSFLGRY
11	CAS ASS SSL SLV LVE VET ETN TNY NYG YGY GYT YTF	LTDEMIAQY
193	CSA SAR ARD RDR DRT RTS TSG SGT GTY TYE YEQ EQY QYF	TTDPSFLGRY
42	CAS ASR SRE REG EGR GRA RAY AYN YNE NEQ EQF QFF	LTDEMIAQY
45	CAS ASL SLN LNR NRA RAA AAN ANT NTG TGE GEL ELF LFF	LTDEMIAQY
90	CAS ASR SRS RSG SGQ GQR QRN RNT NTE TEA EAF AFF	LTDEMIAQY
389	CAS ASS SSL SLD LDI DIE IEL ELF LFF	YLQPRTFLL
519	CAS ASS SSQ SQD QDG DGG GGG GGN GNT NTE TEA EAF AFF	YLQPRTFLL
274	CAS ASS SSY SYR YRG RGS GSS SSL SLS LSS SSY SYE YEQ EQY QYF	TTDPSFLGRY
8	CAS ASS SSD SDT DTQ TQG QGS GSQ SQP QPQ PQH QHF	LTDEMIAQY
382	CAS ASS SSL SLS LSA SAG AGL GLD LDE DEQ EQF QFF	TTDPSFLGRY
368	CAS ASS SSL SLD LDH DHP HPW PWG WGS GSP SPL PLH LHF	TTDPSFLGRY
31	CAS ASS SSY SYD YDN DNG NGG GGN GNT NTG TGE GEL ELF LFF	LTDEMIAQY
76	CAS ASS SSY SYS YSR SRP RPT PTG TGH GHT HTE TEA EAF AFF	LTDEMIAQY
77	CAS ASS SSL SLA LAS ASN SNQ NQP QPQ PQH QHF	LTDEMIAQY
16	CAS ASS SSL SLG LGG GGP GPG PGT GTG TGY GYE YEQ EQY QYF	LTDEMIAQY
0	CAS ASS SSL SLA LAG AGY GYE YEQ EQY QYF	LTDEMIAQY
129	CAS ASS SSY SYG YGP GPP PPY PYE YEQ EQY QYF	LTDEMIAQY
469	CAW AWD WDR DRD RDH DHN HNT NTG TGE GEL ELF LFF	YLQPRTFLL
6	CAS ASS SSL SLA LAL ALA LAG AGI GIR IRY RYN YNE NEQ EQF QFF	LTDEMIAQY
265	CAS ASS SSL SLR LRD RDS DSG SGD GDT DTQ TQY QYF	TTDPSFLGRY
473	CAW AWE WED EDR DRN RNT NTG TGE GEL ELF LFF	YLQPRTFLL
339	CAS ASS SSP SPL PLG LGT GTY TYE YEQ EQY QYF	TTDPSFLGRY
380	CAS ASS SSP SPL PLS LSG SGL GLK LKE KEY EYF	TTDPSFLGRY
221	CAS ASS SSL SLV LVP VPG PGH GHN HNE NEQ EQF QFF	TTDPSFLGRY
138	CAS ASK SKQ KQG QGW GWS WSN SNQ NQP QPQ PQH QHF	TTDPSFLGRY
101	CAS ASI SIG IGM GMY MYR YRN RNE NEQ EQF QFF	LTDEMIAQY
305	CAS ASS SSE SEK EKL KLP LPE PEF EFN FNQ NQP QPQ PQH QHF	TTDPSFLGRY
79	CAT ATT TTE TEQ EQG QGS GSL SLI LIE IEQ EQY QYF	LTDEMIAQY
247	CSV SVL VLT LTT TTG TGP GPG PGQ GQP QPQ PQH QHF	TTDPSFLGRY
520	CAS ASS SSL SLG LGI GIA IAK AKN KNI NIQ IQY QYF	YLQPRTFLL
388	CAS ASS SSQ SQD QDP DPG PGR GRG RGS GSP SPL PLH LHF	YLQPRTFLL
211	CAS ASS SSD SDR DRA RAG AGT GTD TDT DTQ TQY QYF	TTDPSFLGRY
233	CSV SVE VEE EEA EAG AGS GSY SYE YEQ EQY QYF	TTDPSFLGRY
201	CAS ASS SSL SLD LDS DSP SPY PYE YEQ EQY QYF	TTDPSFLGRY
327	CAS ASS SSL SLM LML MLG LGE GEE EET ETQ TQY QYF	TTDPSFLGRY
84	CAT ATS TSP SPH PHQ HQE QEG EGR GRT RTE TEA EAF AFF	LTDEMIAQY
116	CAS ASS SSR SRG RGT GTS TSG SGR GRG RGI GIN INE NEQ EQF QFF	LTDEMIAQY
243	CSV SVR VRL RLA LAG AGG GGS GSG SGE GET ETQ TQY QYF	TTDPSFLGRY
356	CAS AST STT TTG TGT GTG TGY GYA YAE AEA EAF AFF	TTDPSFLGRY
541	CAS ASS SSP SPD PDR DRG RGG GGG GGY GYT YTF	YLQPRTFLL
530	CAW AWG WGS GSM SMN MNT NTG TGE GEL ELF LFF	YLQPRTFLL
190	CAS ASS SSL SLS LSA SAG AGL GLD LDE DEQ EQF QFF	TTDPSFLGRY
91	CAS ASS SSL SLD LDD DDG DGD GDR DRW RWG WGY GYT YTF	LTDEMIAQY
481	CAS ASS SSY SYG YGN GNQ NQP QPQ PQH QHF	YLQPRTFLL
150	CAS ASR SRL RLQ LQG QGA GAG AGT GTE TEA EAF AFF	TTDPSFLGRY
75	CAS AST STT TTE TEE EEN ENR NRP RPY PYE YEQ EQY QYF	LTDEMIAQY
408	CAS ASS SSH SHG HGG GGP GPG PGG GGL GLN LNE NEQ EQF QFF	YLQPRTFLL
323	CAS ASS SSL SLE LEQ EQG QGL GLP LPH PHA HAQ AQY QYF	TTDPSFLGRY
552	CAI AIE IED EDL DLN LNT NTG TGE GEL ELF LFF	YLQPRTFLL
429	CAS ASS SSL SLV LVS VSP SPG PGF GFG FGT GTE TEA EAF AFF	YLQPRTFLL
41	CSV SVG VGT GTG TGW GWP WPY PYE YEQ EQY QYF	LTDEMIAQY
170	CAS ASS SSP SPQ PQG QGV GVT VTQ TQY QYF	TTDPSFLGRY
582	CAS ASS SSV SVA VAY AYR YRG RGN GNE NEQ EQF QFF	YLQPRTFLL
497	CAS ASS SSP SPV PVA VAG AGG GGN GNT NTG TGE GEL ELF LFF	YLQPRTFLL
485	CSA SAN ANR NRA RAG AGK GKN KNI NIQ IQY QYF	YLQPRTFLL
553	CSA SAR ARD RDR DRS RSS SSY SYE YEQ EQY QYF	YLQPRTFLL
451	CAS ASR SRY RYG YGG GGQ GQG QGD GDS DSE SEQ EQF QFF	YLQPRTFLL
568	CAS ASS SSE SES EST STG TGY GYG YGY GYT YTF	YLQPRTFLL
44	CAS ASS SSS SSR SRQ RQG QGP GPK PKE KEY EYG YGY GYT YTF	LTDEMIAQY
178	CAS ASD SDL DLL LLN LNR NRA RAS ASY SYE YEQ EQY QYF	TTDPSFLGRY
377	CAS ASS SSF SFT FTS TSG SGS GSY SYE YEQ EQY QYF	TTDPSFLGRY
67	CAS ASS SSL SLP LPG PGA GAR ARS RSG SGA GAN ANV NVL VLT LTF	LTDEMIAQY
159	CAS AST STD TDG DGG GGF GFG FGY GYT YTF	TTDPSFLGRY
369	CAS ASS SSL SLR LRS RSG SGL GLD LDT DTQ TQY QYF	TTDPSFLGRY
113	CAS ASS SSP SPL PLS LSY SYE YEQ EQY QYF	LTDEMIAQY
123	CAS ASS SSL SLT LTG TGT GTG TGA GAL ALY LYE YEQ EQY QYF	LTDEMIAQY
539	CAS ASS SSQ SQE QEG EGV GVG VGQ GQG QGW GWS WSP SPL PLH LHF	YLQPRTFLL
66	CAW AWG WGL GLA LAG AGG GGP GPI PIE IEQ EQF QFF	LTDEMIAQY
486	CAS ASL SLR LRQ RQN QNS NSG SGE GEQ EQF QFF	YLQPRTFLL
72	CAS ASV SVN VNP NPT PTG TGA GAK AKN KNI NIQ IQY QYF	LTDEMIAQY
384	CAS ASS SSE SED EDR DRG RGS GSY SYG YGY GYT YTF	TTDPSFLGRY
337	CAS ASS SSQ SQD QDG DGI GIA IAG AGY GYN YNE NEQ EQF QFF	TTDPSFLGRY
232	CAS ASS SSP SPG PGQ GQR QRS RSY SYN YNE NEQ EQF QFF	TTDPSFLGRY
466	CAW AWT WTR TRD RDR DRN RNT NTG TGE GEL ELF LFF	YLQPRTFLL
185	CAS ASS SSL SLT LTA TAP APT PTD TDT DTQ TQY QYF	TTDPSFLGRY
267	CSV SVR VRG RGR GRT RTH THN HNE NEQ EQF QFF	TTDPSFLGRY
216	CAS ASS SSS SSR SRG RGR GRT RTS TSS SSY SYE YEQ EQY QYF	TTDPSFLGRY
250	CSV SVE VEQ EQG QGT GTY TYE YEQ EQY QYF	TTDPSFLGRY
442	CAS ASG SGD GDE DEN ENT NTG TGE GEL ELF LFF	YLQPRTFLL
496	CAS ASS SSL SLY LYG YGG GGY GYE YEQ EQY QYF	YLQPRTFLL
410	CAS ASS SSR SRN RNR NRY RYT YTD TDT DTQ TQY QYF	YLQPRTFLL
301	CAS ASS SSL SLD LDS DSP SPY PYE YEQ EQY QYF	TTDPSFLGRY
538	CAW AWS WSG SGF GFA FAN ANT NTG TGE GEL ELF LFF	YLQPRTFLL
397	CAS ASR SRL RLG LGT GTG TGE GEV EVG VGE GEL ELF LFF	YLQPRTFLL
279	CAC ACA CAG AGF GFL FLH LHH HHT HTG TGE GEL ELF LFF	TTDPSFLGRY
280	CAS ASN SNP NPG PGG GGV GVE VET ETQ TQY QYF	TTDPSFLGRY
152	CAS ASS SSL SLY LYI YIS ISV SVG VGS GSN SNT NTE TEA EAF AFF	TTDPSFLGRY
23	CSA SAR ARG RGD GDR DRG RGE GEG EGY GYE YEQ EQY QYF	LTDEMIAQY
447	CAS ASR SRT RTD TDG DGL GLA LAG AGY GYN YNE NEQ EQF QFF	YLQPRTFLL
1	CAS ASS SSL SLG LGF GFP FPN PNQ NQP QPQ PQH QHF	LTDEMIAQY
61	CAS ASS SSE SEA EAP API PIG IGN GNT NTI TIY IYF	LTDEMIAQY
238	CAS ASS SSL SLS LSG SGY GYN YNE NEQ EQF QFF	TTDPSFLGRY
566	CAT ATC TCL CLG LGS GSS SSA SAG AGE GEL ELF LFF	YLQPRTFLL
420	CSA SAR ARV RVL VLT LTS TSG SGE GET ETY TYE YEQ EQY QYF	YLQPRTFLL
324	CAS ASS SSL SLS LSG SGP GPL PLE LET ETQ TQY QYF	TTDPSFLGRY
464	CAS ASS SSP SPE PEI EIK IKA KAF AFF	YLQPRTFLL
271	CAS ASS SSP SPK PKT KTG TGR GRH RHQ HQE QET ETQ TQY QYF	TTDPSFLGRY
24	CAS ASH SHP HPG PGT GTG TGT GTS TSS SSY SYN YNS NSP SPL PLH LHF	LTDEMIAQY
104	CAI AIS ISE SEE EEH EHT HTG TGE GEY EYQ YQP QPQ PQH QHF	LTDEMIAQY
78	CAW AWS WSV SVG VGQ GQG QGA GAR ARE REQ EQY QYF	LTDEMIAQY
550	CAS ASS SSL SLG LGP GPE PEA EAF AFF	YLQPRTFLL
321	CAS ASL SLG LGL GLA LAG AGE GEL ELF LFF	TTDPSFLGRY
4	CAS ASQ SQG QGG GGA GAG AGY GYL YLY LYG YGY GYT YTF	LTDEMIAQY
36	CAS ASS SSL SLD LDW DWN WNY NYG YGY GYT YTF	LTDEMIAQY
318	CAS ASS SSL SLL LLG LGA GAR ARN RNE NEQ EQF QFF	TTDPSFLGRY
65	CAS ASS SSP SPT PTV TVS VSN SNT NTG TGE GEL ELF LFF	LTDEMIAQY
412	CAS ASS SSS SSD SDI DIS ISA SAF AFF	YLQPRTFLL
430	CAS ASS SSL SLD LDI DIE IEQ EQY QYF	YLQPRTFLL
5	CAS ASS SSL SLA LAV AVN VNT NTE TEA EAF AFF	LTDEMIAQY
63	CAS ASS SSP SPG PGI GIP IPN PNY NYG YGY GYT YTF	LTDEMIAQY
59	CAW AWS WST STG TGG GGT GTW TWT WTG TGE GEL ELF LFF	LTDEMIAQY
419	CAS ASS SSL SLD LDI DIE IEA EAF AFF	YLQPRTFLL
60	CAS ASS SSF SFT FTG TGR GRR RRE RET ETQ TQY QYF	LTDEMIAQY
411	CAS ASS SSP SPD PDI DIE IEA EAF AFF	YLQPRTFLL
476	CAS ASS SSA SAP APD PDR DRG RGN GNT NTE TEA EAF AFF	YLQPRTFLL
574	CAS ASS SSL SLE LEA EAG AGD GDY DYN YNE NEQ EQF QFF	YLQPRTFLL
230	CAS ASS SSL SLQ LQG QGV GVS VSY SYE YEQ EQY QYF	TTDPSFLGRY
564	CAC ACT CTG TGR GRG RGG GGN GNG NGY GYT YTF	YLQPRTFLL
433	CAS ASS SSP SPD PDI DIE IEQ EQY QYF	YLQPRTFLL
558	CAS ASS SSL SLA LAG AGG GGF GFT FTG TGE GEL ELF LFF	YLQPRTFLL
261	CAS ASS SSS SSS SSA SAE AES ESS SSY SYN YNE NEQ EQF QFF	TTDPSFLGRY
283	CAT ATD TDS DSS SSS SSY SYE YEQ EQY QYF	TTDPSFLGRY
26	CAS ASS SSL SLV LVP VPQ PQG QGP GPN PNY NYG YGY GYT YTF	LTDEMIAQY
244	CAS AST STS TSG SGG GGT GTQ TQH QHF	TTDPSFLGRY
465	CAS ASQ SQR QRG RGG GGR GRE REE EET ETQ TQY QYF	YLQPRTFLL
396	CAS ASS SSQ SQG QGP GPN PNG NGY GYT YTF	YLQPRTFLL
88	CAS ASS SSL SLA LAI AIG IGD GDK DKV KVE VEQ EQY QYF	LTDEMIAQY
117	CAS ASS SSP SPQ PQV QVG VGV GVA VAN ANE NEK EKL KLF LFF	LTDEMIAQY
467	CAS ASS SSD SDL DLK LKG KGS GST STD TDT DTQ TQY QYF	YLQPRTFLL
453	CAS ASQ SQG QGL GLN LNT NTG TGE GEL ELF LFF	YLQPRTFLL
535	CAS ASS SSP SPG PGE GEA EAR ARG RGE GEQ EQF QFF	YLQPRTFLL
418	CAS ASS SSD SDA DAN ANT NTG TGE GEL ELF LFF	YLQPRTFLL
586	CAS ASS SSI SIL ILA LAG AGT GTY TYN YNE NEQ EQF QFF	YLQPRTFLL
352	CAS ASS SSL SLW LWG WGA GAH AHT HTE TEA EAF AFF	TTDPSFLGRY
95	CAS ASS SSY SYS YSR SRA RAS ASG SGD GDD DDN DNE NEQ EQF QFF	LTDEMIAQY
365	CAS AST STP TPG PGS GSE SED EDT DTQ TQY QYF	TTDPSFLGRY
309	CAS ASS SSS SSL SLT LTD TDT DTQ TQY QYF	TTDPSFLGRY
529	CAS ASS SSL SLD LDI DIK IKA KAF AFF	YLQPRTFLL
13	CSV SVH VHQ HQG QGW GWP WPY PYE YEQ EQY QYF	LTDEMIAQY
546	CAS ASS SSV SVG VGA GAG AGS GSN SNQ NQP QPQ PQH QHF	YLQPRTFLL
70	CAS ASV SVD VDR DRD RDW DWT WTW TWG WGT GTE TEA EAF AFF	LTDEMIAQY
507	CAS ASS SSY SYP YPW PWD WDS DSQ SQS QSS SSY SYN YNE NEQ EQF QFF	YLQPRTFLL
236	CAS ASS SSL SLG LGQ GQA QAY AYE YEQ EQY QYF	TTDPSFLGRY
96	CAS ASS SSY SYR YRL RLA LAG AGG GGV GVP VPH PHN HNE NEQ EQF QFF	LTDEMIAQY
501	CAS ASQ SQD QDR DRN RNT NTG TGE GEL ELF LFF	YLQPRTFLL
141	CAS ASG SGT GTG TGG GGT GTE TET ETQ TQY QYF	TTDPSFLGRY
124	CSV SVH VHQ HQG QGW GWP WPY PYE YEQ EQY QYF	LTDEMIAQY
425	CAL ALS LSD SDQ DQN QNT NTG TGE GEL ELF LFF	YLQPRTFLL
515	CAS ASS SSQ SQD QDI DIL ILA LAR ARY RYN YNE NEQ EQF QFF	YLQPRTFLL
215	CAS ASS SSE SED EDH DHR HRV RVT VTG TGN GNT NTI TIY IYF	TTDPSFLGRY
176	CAT ATS TSD SDL DLG LGP GPT PTG TGE GEL ELF LFF	TTDPSFLGRY
436	CAW AWQ WQV QVM VMN MNT NTG TGE GEL ELF LFF	YLQPRTFLL
307	CAS ASS SSQ SQY QYR YRE RET ETS TSD SDT DTQ TQY QYF	TTDPSFLGRY
342	CAS ASS SSR SRD RDR DRG RGE GEY EYN YNE NEQ EQF QFF	TTDPSFLGRY
120	CAS ASS SSE SEA EAQ AQG QGP GPQ PQY QYF	LTDEMIAQY
542	CAS ASS SSP SPT PTP TPS PSG SGQ GQG QGT GTA TAD ADT DTQ TQY QYF	YLQPRTFLL
421	CAR ARG RGD GDR DRN RNT NTG TGE GEL ELF LFF	YLQPRTFLL
502	CAI AIS ISE SES ESV SVR VRN RNS NSN SNQ NQP QPQ PQH QHF	YLQPRTFLL
205	CAS ASS SSD SDR DRA RAP APS PSS SSD SDT DTQ TQY QYF	TTDPSFLGRY
526	CAI AIE IED EDR DRN RNT NTG TGE GEL ELF LFF	YLQPRTFLL
28	CAS ASS SSR SRG RGA GAG AGH GHS HSD SDG DGY GYT YTF	LTDEMIAQY
317	CAS ASS SSL SLT LTQ TQG QGG GGV GVL VLF LFF	TTDPSFLGRY
311	CAS ASS SSS SST STS TSG SGV GVT VTD TDT DTQ TQY QYF	TTDPSFLGRY
51	CAW AWT WTR TRR RRD RDG DGG GGE GEL ELF LFF	LTDEMIAQY
508	CAT ATQ TQS QSD SDP DPN PNT NTG TGE GEL ELF LFF	YLQPRTFLL
361	CAS ASS SSQ SQS QSR SRD RDR DRV RVD VDF	TTDPSFLGRY
401	CAS ASS SSQ SQK QKA KAA AAQ AQG QGV GVS VSS SSY SYE YEQ EQY QYF	YLQPRTFLL
154	CAS ASS SSL SLG LGG GGG GGL GLN LNY NYG YGY GYT YTF	TTDPSFLGRY
320	CAS ASS SSA SAG AGT GTG TGG GGY GYT YTF	TTDPSFLGRY
328	CAS ASS SSV SVG VGF GFP FPG PGE GEL ELF LFF	TTDPSFLGRY
22	CAS ASS SSV SVI VIQ IQG QGA GAA AAG AGE GEL ELF LFF	LTDEMIAQY
37	CAT ATR TRG RGE GEG EGA GAQ AQY QYS YSP SPL PLH LHF	LTDEMIAQY
281	CAS ASS SSQ SQE QED EDA DAG AGF GFS FSY SYN YNE NEQ EQF QFF	TTDPSFLGRY
136	CAS ASS SSL SLG LGA GAG AGG GGS GSG SGE GEQ EQY QYF	TTDPSFLGRY
334	CAS ASS SSD SDQ DQG QGA GAN ANY NYE YEQ EQY QYF	TTDPSFLGRY
517	CSA SAR ARD RDA DAA AAG AGQ GQN QNT NTG TGE GEL ELF LFF	YLQPRTFLL
443	CAS ASS SST STR TRD RDS DSN SNQ NQP QPQ PQH QHF	YLQPRTFLL
128	CAS AST STN TNR NRG RGG GGI GIT ITY TYE YEQ EQY QYF	LTDEMIAQY
338	CAS ASS SSL SLK LKV KVD VDG DGY GYN YNE NEQ EQF QFF	TTDPSFLGRY
554	CAS ASS SSP SPD PDI DIE IEQ EQF QFF	YLQPRTFLL
375	CAS ASS SSL SLS LSG SGS GSP SPS PSP SPL PLH LHF	TTDPSFLGRY
399	CAS ASS SSA SAR ART RTG TGE GEL ELF LFF	YLQPRTFLL
534	CAS ASS SSL SLG LGQ GQS QSL SLE LEQ EQY QYF	YLQPRTFLL
499	CSA SAS ASL SLG LGG GGI GIT ITS TSS SST STD TDT DTQ TQY QYF	YLQPRTFLL
179	CAS ASS SSA SAF AFR FRG RGE GEG EGE GEK EKL KLF LFF	TTDPSFLGRY
56	CAS AST STG TGP GPG PGG GGL GLA LAA AAG AGE GEQ EQY QYF	LTDEMIAQY
140	CAS ASS SSG SGD GDR DRE REQ EQF QFF	TTDPSFLGRY
35	CAS ASS SSL SLA LAL ALA LAG AGR GRN RNY NYN YNE NEQ EQF QFF	LTDEMIAQY
498	CAS ASS SSS SST STP TPN PNR NRG RGL GLA LAV AVG VGQ GQY QYF	YLQPRTFLL
351	CAS AST STQ TQD QDS DSY SYG YGY GYT YTF	TTDPSFLGRY
350	CAS ASS SSW SWT WTS TSG SGS GSY SYE YEQ EQY QYF	TTDPSFLGRY
449	CAS ASS SSL SLG LGG GGE GEG EGK GKT KTQ TQY QYF	YLQPRTFLL
249	CAS ASG SGF GFD FDA DAG AGQ GQG QGS GSY SYE YEQ EQY QYF	TTDPSFLGRY
100	CAS ASS SSY SYT YTR TRL RLV LVQ VQN QNT NTG TGE GEL ELF LFF	LTDEMIAQY
302	CAS ASS SSL SLG LGG GGG GGG GGG GGT GTQ TQP QPQ PQH QHF	TTDPSFLGRY
303	CAS ASS SSL SLY LYE YES ESH SHN HNE NEQ EQF QFF	TTDPSFLGRY
316	CAT ATT TTG TGG GGP GPE PEE EEK EKL KLF LFF	TTDPSFLGRY
194	CAS ASS SSY SYS YST STT TTG TGR GRY RYE YEQ EQF QFF	TTDPSFLGRY
208	CAT ATS TSG SGD GDY DYG YGG GGS GSI SIS ISD SDT DTQ TQY QYF	TTDPSFLGRY
103	CAS ASR SRS RSG SGT GTG TGT GTY TYE YEQ EQY QYF	LTDEMIAQY
590	CAS ASS SSV SVG VGG GGS GSE SEK EKN KNT NTE TEA EAF AFF	YLQPRTFLL
112	CAS ASS SSR SRD RDS DSG SGY GYS YSP SPL PLH LHF	LTDEMIAQY
97	CAS ASS SSA SAG AGE GEA EAG AGE GEL ELF LFF	LTDEMIAQY
423	CAS ASS SSL SLD LDI DIE IEA EAF AFF	YLQPRTFLL
273	CAS AST STL TLD LDI DIL ILG LGY GYT YTF	TTDPSFLGRY
570	CAS ASS SSE SES ESN SNS NSL SLE LEA EAF AFF	YLQPRTFLL
30	CAS ASS SSF SFA FAV AVN VNT NTE TEA EAF AFF	LTDEMIAQY
543	CAS ASS SSI SIS ISG SGS GSG SGS GSD SDT DTQ TQY QYF	YLQPRTFLL
107	CAS ASS SSL SLG LGQ GQP QPA PAG AGE GEQ EQF QFF	LTDEMIAQY
82	CAR ART RTG TGQ GQV QVK VKA KAK AKN KNI NIQ IQY QYF	LTDEMIAQY
589	CSA SAS AST STD TDR DRE REL ELN LNE NEQ EQY QYF	YLQPRTFLL
14	CAI AIS ISG SGP GPE PET ETN TNQ NQP QPQ PQH QHF	LTDEMIAQY
177	CAI AIG IGT GTG TGP GPM PMN MNT NTE TEA EAF AFF	TTDPSFLGRY
540	CAS ASS SSP SPT PTG TGE GEP EPN PNY NYG YGY GYT YTF	YLQPRTFLL
513	CAS ASS SSL SLD LDI DIE IEA EAF AFF	YLQPRTFLL
562	CSA SAL ALR LRD RDK DKN KNT NTG TGE GEL ELF LFF	YLQPRTFLL
536	CGS GSG SGI GIQ IQN QNT NTG TGE GEL ELF LFF	YLQPRTFLL
374	CSA SAR ARD RDP DPG PGT GTG TGA GAY AYY YYG YGY GYT YTF	TTDPSFLGRY
491	CAS ASN SNE NEE EEN ENT NTG TGE GEL ELF LFF	YLQPRTFLL
329	CAS ASG SGL GLG LGS GSS SSY SYE YEQ EQY QYF	TTDPSFLGRY
139	CAS ASS SSD SDR DRT RTS TSQ SQE QET ETQ TQY QYF	TTDPSFLGRY
475	CAS ASS SSP SPD PDI DIE IEQ EQY QYF	YLQPRTFLL
34	CAS ASS SSD SDS DSG SGF GFG FGY GYG YGY GYT YTF	LTDEMIAQY
298	CAS ASS SSW SWT WTS TSG SGS GSY SYE YEQ EQY QYF	TTDPSFLGRY
569	CSG SGI GIR IRL RLA LAS ASG SGR GRS RSY SYE YEQ EQY QYF	YLQPRTFLL
162	CAS ASS SSM SMR MRS RSG SGS GSD SDE DEQ EQY QYF	TTDPSFLGRY
127	CAS ASS SSL SLS LSQ SQG QGS GSQ SQY QYF	LTDEMIAQY
217	CAS ASA SAL ALA LAQ AQA QAY AYE YEQ EQY QYF	TTDPSFLGRY
573	CAI AIS ISE SES ESQ SQE QEF EFY FYG YGY GYT YTF	YLQPRTFLL
246	CAT ATG TGQ GQS QSN SNT NTG TGE GEL ELF LFF	TTDPSFLGRY
551	CAI AIR IRS RSG SGN GNT NTY TYS YSY SYE YEQ EQY QYF	YLQPRTFLL
531	CAS ASS SSF SFG FGR GRG RGG GGS GSQ SQP QPQ PQH QHF	YLQPRTFLL
492	CAS ASS SSS SSI SIY IYG YGT GTS TSY SYE YEQ EQY QYF	YLQPRTFLL
532	CSV SVE VEK EKD KDR DRN RNT NTG TGE GEL ELF LFF	YLQPRTFLL
253	CAS ASS SSG SGE GEG EGG GGP GPW PWG WGS GSL SLQ LQF QFF	TTDPSFLGRY
299	CAS ASS SSF SFL FLA LAG AGA GAV AVE VEQ EQF QFF	TTDPSFLGRY
424	CAS ASS SSV SVK VKP KPD PDS DSP SPA PAE AEA EAF AFF	YLQPRTFLL
239	CAS ASS SSF SFG FGD GDQ DQP QPQ PQH QHF	TTDPSFLGRY
427	CAS ASS SSA SAD ADI DIE IEA EAF AFF	YLQPRTFLL
197	CAS ASS SSA SAG AGD GDY DYG YGY GYT YTF	TTDPSFLGRY
43	CAS ASS SSL SLG LGI GIG IGT GTQ TQP QPQ PQH QHF	LTDEMIAQY
89	CAS ASS SSQ SQD QDG DGQ GQG QGA GAM AMY MYE YEQ EQY QYF	LTDEMIAQY
315	CAS ASS SST STA TAR ARL RLG LGD GDT DTG TGE GEL ELF LFF	TTDPSFLGRY
403	CAS ASS SSP SPD PDI DIE IEA EAF AFF	YLQPRTFLL
62	CAS ASS SSP SPS PSG SGS GSF SFE FEQ EQF QFF	LTDEMIAQY
68	CAS ASS SSG SGT GTV TVT VTS TSS SSS SST STD TDT DTQ TQY QYF	LTDEMIAQY
258	CAS ASR SRE RET ETG TGR GRA RAA AAG AGN GNT NTI TIY IYF	TTDPSFLGRY
545	CAS ASS SSP SPS PSP SPK PKR KRG RGA GAY AYE YEQ EQY QYF	YLQPRTFLL
9	CAS ASI SIN INR NRA RAA AAN ANT NTG TGE GEL ELF LFF	LTDEMIAQY
248	CAS ASG SGD GDS DSP SPL PLH LHF	TTDPSFLGRY
462	CAS ASS SSG SGS GSP SPG PGT GTG TGD GDY DYG YGY GYT YTF	YLQPRTFLL
306	CAS ASS SSL SLP LPD PDL DLQ LQE QET ETQ TQY QYF	TTDPSFLGRY
213	CAS ASS SSL SLQ LQR QRE REY EYP YPY PYE YEQ EQY QYF	TTDPSFLGRY
341	CAS ASS SSE SET ETH THS HSN SNQ NQP QPQ PQH QHF	TTDPSFLGRY
489	CAS ASS SSR SRT RTS TSA SAK AKL KLG LGE GEQ EQY QYF	YLQPRTFLL
111	CAS ASS SSL SLT LTD TDL DLY LYG YGY GYT YTF	LTDEMIAQY
379	CAS ASS SST STE TEP EPL PLG LGS GSD SDI DIQ IQY QYF	TTDPSFLGRY
441	CAS ASS SSW SWD WDR DRF RFN FNE NEQ EQF QFF	YLQPRTFLL
398	CAS ASS SSP SPD PDI DIE IEA EAF AFF	YLQPRTFLL
157	CAS ASS SSS SSD SDL DLG LGG GGG GGT GTD TDT DTQ TQY QYF	TTDPSFLGRY
493	CAS ASR SRH RHF HFR FRE REV EVN VNT NTE TEA EAF AFF	YLQPRTFLL
504	CAS ASQ SQE QEL ELD LDT DTG TGE GEL ELF LFF	YLQPRTFLL
69	CAS ASS SSE SEA EAQ AQG QGP GPQ PQH QHF	LTDEMIAQY
17	CAS ASS SSL SLA LAH AHQ HQT QTY TYE YEQ EQY QYF	LTDEMIAQY
322	CAS ASS SSL SLR LRD RDG DGG GGD GDT DTQ TQY QYF	TTDPSFLGRY
289	CAS ASS SSF SFR FRT RTS TSG SGN GNE NEQ EQY QYF	TTDPSFLGRY
158	CAS ASS SSQ SQE QED EDR DRW RWV WVI VIG IGE GEL ELF LFF	TTDPSFLGRY
544	CAS ASS SST STA TAG AGT GTS TSG SGR GRG RGE GEL ELF LFF	YLQPRTFLL
336	CAS ASS SSD SDP DPG PGA GAR ARV RVW VWE WEQ EQY QYF	TTDPSFLGRY
49	CAS ASS SSG SGP GPL PLA LAG AGR GRR RRT RTD TDT DTQ TQY QYF	LTDEMIAQY
587	CAS ASS SSP SPL PLG LGG GGG GGN GNT NTG TGE GEL ELF LFF	YLQPRTFLL
144	CAS ASS SSL SLS LSL SLI LIY IYE YEQ EQY QYF	TTDPSFLGRY
80	CAS ASS SSV SVA VAG AGS GSS SSY SYE YEQ EQY QYF	LTDEMIAQY
414	CSA SAR ARD RDL DLG LGA GAQ AQN QNT NTG TGE GEL ELF LFF	YLQPRTFLL
422	CAS ASS SSH SHP HPS PSE SEG EGS GSR SRK RKK KKY KYE YEQ EQY QYF	YLQPRTFLL
146	CAS ASS SSQ SQE QEW EWR WRE REF EFL FLR LRE REQ EQF QFF	TTDPSFLGRY
3	CAS ASS SSN SNP NPG PGP GPW PWG WGS GSP SPL PLH LHF	LTDEMIAQY
92	CAI AIS ISE SEP EPG PGS GSN SNT NTE TEA EAF AFF	LTDEMIAQY
38	CAS ASR SRD RDE DEG EGR GRG RGR GRY RYG YGA GAN ANV NVL VLT LTF	LTDEMIAQY
165	CAS ASS SSP SPG PGF GFP FPE PEQ EQF QFF	TTDPSFLGRY
203	CAS ASS SSI SIP IPA PAS ASG SGT GTL TLE LEQ EQF QFF	TTDPSFLGRY
457	CAS ASN SNE NEQ EQN QNS NSN SNE NEQ EQF QFF	YLQPRTFLL
135	CAS ASS SSL SLD LDN DNS NSP SPL PLH LHF	TTDPSFLGRY
240	CAS ASS SSL SLA LAG AGG GGI GIV IVD VDE DEQ EQF QFF	TTDPSFLGRY
378	CAS ASS SSE SEG EGL GLV LVY VYE YEQ EQY QYF	TTDPSFLGRY
237	CAS ASS SSF SFE FEN ENT NTG TGE GEL ELF LFF	TTDPSFLGRY
548	CSA SAR ARD RDS DSM SMA MAQ AQN QNT NTG TGE GEL ELF LFF	YLQPRTFLL
480	CAT ATL TLG LGT GTS TSG SGH GHN HNE NEQ EQF QFF	YLQPRTFLL
528	CAS AST STN TNW NWG WGL GLR LRQ RQP QPQ PQH QHF	YLQPRTFLL
98	CAS ASS SSL SLV LVV VVT VTG TGE GEL ELF LFF	LTDEMIAQY
505	CAS ASS SSH SHR HRN RNT NTL TLE LEA EAF AFF	YLQPRTFLL
335	CSA SAR ARI RIL ILA LAG AGD GDT DTG TGE GEL ELF LFF	TTDPSFLGRY
386	CSA SAG AGG GGT GTG TGI GIY IYG YGS GSY SYE YEQ EQY QYF	YLQPRTFLL
55	CAS ASS SSP SPS PST STG TGK GKV KVS VST STE TEA EAF AFF	LTDEMIAQY
228	CSA SAR ARD RDP DPR PRT RTG TGS GSS SSY SYE YEQ EQY QYF	TTDPSFLGRY
591	CAS ASS SSG SGG GGA GAL ALS LSE SEQ EQY QYF	YLQPRTFLL
272	CAS ASS SSF SFE FEN ENT NTG TGE GEL ELF LFF	TTDPSFLGRY
46	CAS ASS SSS SSR SRH RHS HSG SGE GEK EKL KLF LFF	LTDEMIAQY
340	CAT ATL TLS LSG SGD GDI DIY IYN YNE NEQ EQF QFF	TTDPSFLGRY
391	CAS ASM SMD MDE DEN ENT NTG TGE GEL ELF LFF	YLQPRTFLL
147	CAS ASK SKG KGG GGQ GQE QET ETQ TQY QYF	TTDPSFLGRY
143	CAS ASS SSA SAS ASN SNG NGG GGG GGE GET ETQ TQY QYF	TTDPSFLGRY
500	CSA SAH AHR HRD RDQ DQN QNT NTG TGE GEL ELF LFF	YLQPRTFLL
196	CAS ASR SRP RPP PPG PGA GAD ADT DTE TEA EAF AFF	TTDPSFLGRY
262	CAS ASN SNP NPG PGH GHS HSN SNQ NQP QPQ PQH QHF	TTDPSFLGRY
549	CAS ASS SSE SEG EGP GPG PGG GGD GDE DEQ EQY QYF	YLQPRTFLL
81	CAS ASS SSL SLP LPG PGR GRG RGE GET ETQ TQY QYF	LTDEMIAQY
110	CAS ASR SRW RWA WAP APG PGE GEL ELF LFF	LTDEMIAQY
487	CAS ASS SSE SES ESS SSG SGG GGF GFF FFN FNE NEQ EQF QFF	YLQPRTFLL
509	CAS ASS SSL SLA LAG AGS GSS SSY SYN YNS NSP SPL PLH LHF	YLQPRTFLL
241	CAS ASS SSL SLT LTD TDS DST STD TDT DTQ TQY QYF	TTDPSFLGRY
163	CAS AST STD TDS DSD SDT DTQ TQY QYF	TTDPSFLGRY
367	CAS ASS SSV SVE VEE EET ETS TSA SAG AGG GGH GHE HEQ EQF QFF	TTDPSFLGRY
202	CAS ASS SSL SLR LRQ RQG QGA GAD ADT DTQ TQY QYF	TTDPSFLGRY
326	CAS ASE SER ERR RRG RGL GLS LSG SGY GYT YTF	TTDPSFLGRY
142	CAS ASD SDS DSG SGY GYT YTE TEA EAF AFF	TTDPSFLGRY
225	CAS ASS SSV SVA VAY AYE YEQ EQY QYF	TTDPSFLGRY
533	CAS ASS SSL SLT LTS TSG SGS GSE SEQ EQF QFF	YLQPRTFLL
32	CAS ASS SSV SVG VGL GLA LAG AGV GVY VYS YSY SYN YNE NEQ EQF QFF	LTDEMIAQY
404	CSA SAR ARD RDP DPW PWQ WQV QVN VNT NTG TGE GEL ELF LFF	YLQPRTFLL
438	CAS ASS SSL SLV LVG VGT GTS TSG SGR GRP RPA PAG AGD GDE DEQ EQF QFF	YLQPRTFLL
395	CAE AEQ EQD QDM DMN MNT NTG TGE GEL ELF LFF	YLQPRTFLL
259	CAS ASS SSL SLD LDG DGY GYT YTG TGE GEL ELF LFF	TTDPSFLGRY
479	CAS ASS SSP SPR PRT RTA TAT ATY TYE YEQ EQY QYF	YLQPRTFLL
560	CAS AST STG TGA GAD ADT DTQ TQY QYF	YLQPRTFLL
355	CAS ASS SSF SFV FVS VSE SEE EEH EHN HNG NGY GYT YTF	TTDPSFLGRY
521	CAS ASS SSA SAG AGT GTG TGF GFY FYG YGY GYT YTF	YLQPRTFLL
145	CAS ASS SSS SSR SRA RAG AGA GAT ATD TDT DTQ TQY QYF	TTDPSFLGRY
153	CAS ASS SSP SPT PTS TSG SGS GST STD TDT DTQ TQY QYF	TTDPSFLGRY
192	CAS ASS SSL SLR LRS RSG SGQ GQD QDE DEQ EQF QFF	TTDPSFLGRY
108	CAS ASS SSY SYW YWG WGG GGT GTD TDT DTQ TQY QYF	LTDEMIAQY
468	CAS ASS SSL SLS LSL SLS LSQ SQG QGS GSF SFG FGY GYT YTF	YLQPRTFLL
525	CSA SAS ASG SGG GGS GSY SYG YGS GSY SYN YNE NEQ EQF QFF	YLQPRTFLL
148	CAS ASS SSL SLS LSD SDS DSY SYE YEQ EQY QYF	TTDPSFLGRY
234	CAS ASS SSP SPN PNQ NQG QGL GLT LTQ TQY QYE YEQ EQY QYF	TTDPSFLGRY
296	CAS ASS SSA SAF AFF FFE FES ESG SGE GEL ELF LFF	TTDPSFLGRY
254	CAS ASS SSL SLI LIL ILM LMG MGT GTS TSG SGG GGE GEQ EQF QFF	TTDPSFLGRY
373	CAS ASS SSS SSS SSG SGP GPV PVN VNE NEQ EQF QFF	TTDPSFLGRY
155	CAS ASS SSL SLP LPT PTG TGE GET ETQ TQY QYF	TTDPSFLGRY
83	CSV SVG VGP GPR PRQ RQL QLM LMN MNT NTE TEA EAF AFF	LTDEMIAQY
226	CAS ASS SSE SEI EII IIS ISG SGN GNY NYG YGY GYT YTF	TTDPSFLGRY
260	CAS ASS SSL SLS LSG SGL GLG LGE GET ETQ TQY QYF	TTDPSFLGRY
583	CAS ASS SSP SPG PGA GAP APG PGQ GQG QGS GSY SYE YEQ EQY QYF	YLQPRTFLL
181	CAS ASS SST STR TRA RAT ATN TNE NEK EKL KLF LFF	TTDPSFLGRY
224	CAS ASS SSL SLG LGL GLN LNE NEQ EQF QFF	TTDPSFLGRY
571	CSA SAR ARG RGS GSS SSQ SQW QWE WET ETQ TQY QYF	YLQPRTFLL
118	CAS ASS SSL SLP LPR PRA RAN ANT NTG TGE GEL ELF LFF	LTDEMIAQY
220	CAS ASS SSL SLA LAS ASG SGQ GQG QGP GPY PYE YEQ EQY QYF	TTDPSFLGRY
198	CAS AST STK TKG KGG GGT GTD TDT DTQ TQY QYF	TTDPSFLGRY
268	CAS ASS SSR SRP RPE PEG EGE GEQ EQY QYF	TTDPSFLGRY
168	CAS ASS SSY SYP YPR PRR RRS RSS SSS SSY SYN YNE NEQ EQF QFF	TTDPSFLGRY
325	CAS ASG SGI GIA IAG AGP GPT PTD TDT DTQ TQY QYF	TTDPSFLGRY
523	CAG AGQ GQG QGM GMN MNT NTG TGE GEL ELF LFF	YLQPRTFLL
282	CAS ASS SSF SFT FTP TPG PGG GGQ GQE QET ETQ TQY QYF	TTDPSFLGRY
57	CAS ASS SSV SVV VVL VLT LTS TSG SGP GPT PTD TDT DTQ TQY QYF	LTDEMIAQY
256	CAS ASS SSQ SQY QYR YRE RET ETS TSD SDT DTQ TQY QYF	TTDPSFLGRY
27	CAT ATG TGL GLG LGF GFD FDY DYG YGY GYT YTF	LTDEMIAQY
297	CAS ASS SSL SLD LDQ DQD QDR DRA RAY AYT YTG TGE GEL ELF LFF	TTDPSFLGRY
291	CAS ASA SAS ASE SEL ELA LAD ADT DTD TDT DTQ TQY QYF	TTDPSFLGRY
407	CAS ASS SSI SIS ISG SGF GFD FDG DGY GYT YTF	YLQPRTFLL
212	CSG SGG GGT GTG TGG GGF GFY FYN YNE NEQ EQF QFF	TTDPSFLGRY
275	CAS ASS SSL SLA LAG AGN GNE NEQ EQY QYF	TTDPSFLGRY
405	CAS ASS SSP SPD PDI DIE IEA EAF AFF	YLQPRTFLL
132	CAS ASS SSD SDD DDG DGT GTG TGI GIE IET ETQ TQY QYF	TTDPSFLGRY
579	CAS ASR SRT RTG TGQ GQG QGA GAT ATQ TQY QYF	YLQPRTFLL
287	CAS ASS SSF SFT FTG TGN GND NDD DDY DYE YEQ EQY QYF	TTDPSFLGRY
94	CAS ASG SGE GED EDS DSL SLV LVY VYG YGY GYT YTF	LTDEMIAQY
584	CSA SAR ART RTD TDH DHN HNT NTG TGE GEL ELF LFF	YLQPRTFLL
184	CAT ATS TSA SAA AAS ASG SGR GRA RAY AYN YNE NEQ EQF QFF	TTDPSFLGRY
471	CAS ASS SST STR TRT RTE TEG EGT GTE TEA EAF AFF	YLQPRTFLL
522	CAS AST STL TLR LRD RDR DRG RGN GNQ NQP QPQ PQH QHF	YLQPRTFLL
210	CAS ASS SSI SIE IES ESG SGQ GQL QLW LWE WEL ELF LFF	TTDPSFLGRY
511	CAS ASS SSH SHR HRN RNT NTL TLE LEA EAF AFF	YLQPRTFLL
255	CAS ASS SSF SFE FEN ENT NTG TGE GEL ELF LFF	TTDPSFLGRY
371	CAS ASS SSL SLA LAP APG PGV GVS VSQ SQT QTQ TQY QYF	TTDPSFLGRY
455	CAS ASS SSL SLE LEI EIE IEQ EQY QYF	YLQPRTFLL
331	CAT ATS TSR SRA RAG AGQ GQG QGH GHE HEQ EQY QYF	TTDPSFLGRY
74	CAS ASS SSS SSR SRQ RQG QGP GPK PKE KEY EYG YGY GYT YTF	LTDEMIAQY
