35882	CAT ATD TDA DAG AGD GDA DAG AGG GGT GTS TSY SYG YGK GKL KLT LTF	CAS ASS SSI SIV IVG VGA GAG AGN GNQ NQP QPQ PQH QHF	KLGGALQAK	CATDAGDAGGTSYGKLTF	TRAV17	TRAJ52	CASSIVGAGNQPQHF	TRBV19	TRBJ1-5
35072	CAG AGH GHV HVF VFG FGN GNE NEK EKL KLT LTF	CAS ASS SSQ SQP QPM PMG MGG GGE GES ESY SYN YNE NEQ EQF QFF	KLGGALQAK	CAGHVFGNEKLTF	TRAV35	TRAJ48	CASSQPMGGESYNEQFF	TRBV7-8	TRBJ2-1
5606	CAF AFM FMT MTN TNA NAG AGG GGT GTS TSY SYG YGK GKL KLT LTF	CAS ASS SSI SIG IGI GIY IYG YGY GYT YTF	GILGFVFTL	CAFMTNAGGTSYGKLTF	TRAV38-1	TRAJ52	CASSIGIYGYTF	TRBV19	TRBJ1-2
33818	CAG AGS GSY SYG YGG GGS GSQ SQG QGN GNL NLI LIF	CAS ASS SST STR TRS RST STD TDT DTQ TQY QYF	GILGFVFTL	CAGSYGGSQGNLIF	TRAV25	TRAJ42	CASSTRSTDTQYF	TRBV19	TRBJ2-3
34317	CAV AVR VRD RDH DHQ HQA QAG AGT GTA TAL ALI LIF	CAS ASS SSQ SQG QGA GAG AGR GRD RDP DPT PTG TGE GEL ELF LFF	KLGGALQAK	CAVRDHQAGTALIF	TRAV1-2	TRAJ15	CASSQGAGRDPTGELFF	TRBV3-1	TRBJ2-2
35627	CAG AGY GYN YNT NTD TDK DKL KLI LIF	CAS ASS SSE SEG EGL GLA LAG AGG GGG GGG GGE GET ETQ TQY QYF	KLGGALQAK	CAGYNTDKLIF	TRAV3	TRAJ34	CASSEGLAGGGGETQYF	TRBV6-5	TRBJ2-5
16981	CAV AVV VVD VDS DSG SGY GYA YAL ALN LNF	CAS ASS SSP SPL PLI LIG IGA GAN ANV NVL VLT LTF	KLGGALQAK	CAVVDSGYALNF	TRAV22	TRAJ41	CASSPLIGANVLTF	TRBV3-1	TRBJ2-6
5260	CAV AVE VEA EAG AGG GGT GTS TSY SYG YGK GKL KLT LTF	CSA SAS ASD SDV DVG VGL GLN LNQ NQP QPQ PQH QHF	KLGGALQAK	CAVEAGGTSYGKLTF	TRAV12-2	TRAJ52	CSASDVGLNQPQHF	TRBV20-1	TRBJ1-5
24638	CIV IVR VRD RDM DME MEY EYG YGN GNK NKL KLV LVF	CAS ASS SSL SLV LVV VVA VAG AGG GGP GPG PGT GTD TDT DTQ TQY QYF	RAKFKQLL	CIVRDMEYGNKLVF	TRAV26-1	TRAJ47	CASSLVVAGGPGTDTQYF	TRBV7-3	TRBJ2-3
35149	CAV AVR VRD RDP DPS PSG SGG GGS GSY SYI YIP IPT PTF	CAS ASS SSL SLA LAG AGQ GQN QNT NTE TEA EAF AFF	KLGGALQAK	CAVRDPSGGSYIPTF	TRAV3	TRAJ6	CASSLAGQNTEAFF	TRBV7-9	TRBJ1-1
35564	CAA AAS ASG SGG GGS GSN SNY NYK YKL KLT LTF	CSV SVG VGS GSG SGV GVD VDQ DQF QFF	KLGGALQAK	CAASGGSNYKLTF	TRAV29DV5	TRAJ53	CSVGSGVDQFF	TRBV29-1	TRBJ2-1
23093	CGT GTE TEY EYP YPN PND NDY DYK YKL KLS LSF	CAS ASS SSS SST STG TGG GGG GGE GEK EKD KDQ DQP QPQ PQH QHF	GLCTLVAML	CGTEYPNDYKLSF	TRAV30	TRAJ20	CASSSTGGGEKDQPQHF	TRBV5-4	TRBJ1-5
32601	CAG AGH GHT HTG TGN GNQ NQF QFY FYF	CAS ASS SSI SIR IRS RSG SGY GYE YEQ EQF QFF	GILGFVFTL	CAGHTGNQFYF	TRAV35	TRAJ49	CASSIRSGYEQFF	TRBV19	TRBJ2-1
24282	CAA AAS ASE SET ETS TSY SYD YDK DKV KVI VIF	CAS ASS SSL SLL LLG LGV GVS VSA SAQ AQE QET ETQ TQY QYF	RAKFKQLL	CAASETSYDKVIF	TRAV13-1	TRAJ50	CASSLLGVSAQETQYF	TRBV12-4	TRBJ2-5
34012	CAV AVR VRD RDN DNS NSG SGN GNT NTP TPL PLV LVF	CAT ATS TSD SDN DNQ NQG QGS GSL SLS LST STQ TQY QYF	KLGGALQAK	CAVRDNSGNTPLVF	TRAV1-2	TRAJ29	CATSDNQGSLSTQYF	TRBV24-1	TRBJ2-5
9154	CAT ATE TEL ELY LYG YGA GAN ANS NSK SKL KLT LTF	CAS ASS SSF SFS FSG SGN GNT NTG TGE GEL ELF LFF	RAKFKQLL	CATELYGANSKLTF	TRAV17	TRAJ56	CASSFSGNTGELFF	TRBV12-3	TRBJ2-2
35342	CAA AAK AKP KPL PLF LFI FIN INE NEK EKL KLT LTF	CAL ALG LGE GEL ELG LGG GGE GES ESS SSG SGA GAN ANV NVL VLT LTF	KLGGALQAK	CAAKPLFINEKLTF	TRAV8-1	TRAJ48	CALGELGGESSGANVLTF	TRDV1	TRBJ2-6
185	CAV AVR VRQ RQN QNF NFV FVF	CAS ASS SSQ SQE QEV EVS VSY SYV YVP VPQ PQN QNY NYE YEQ EQY QYF	ELAGIGILTV	CAVRQNFVF	TRAV12-2	TRAJ26	CASSQEVSYVPQNYEQYF	TRBV4-2	TRBJ2-7
15312	CAE AET ETQ TQD QDS DSN SNY NYQ YQL QLI LIW	CAS ASS SSQ SQD QDG DGW GWA WAG AGD GDQ DQP QPQ PQH QHF	RAKFKQLL	CAETQDSNYQLIW	TRAV5	TRAJ33	CASSQDGWAGDQPQHF	TRBV4-1	TRBJ1-5
35350	CAV AVI VIN INA NAR ARL RLM LMF	CSA SAP APT PTG TGG GGG GGL GLY LYN YNE NEQ EQF QFF	KLGGALQAK	CAVINARLMF	TRAV12-2	TRAJ31	CSAPTGGGLYNEQFF	TRBV20-1	TRBJ2-1
35266	CLV LVV VVI VIL ILT LTG TGG GGG GGN GNK NKL KLT LTF	CAS ASS SSS SSM SMN MNT NTE TEA EAF AFF	KLGGALQAK	CLVVILTGGGNKLTF	TRAV4	TRAJ10	CASSSMNTEAFF	TRBV7-9	TRBJ1-1
6089	CAV AVD VDE DEG EGG GGG GGS GSQ SQG QGN GNL NLI LIF	CAS ASS SSI SIR IRS RST STD TDT DTQ TQY QYF	GILGFVFTL	CAVDEGGGSQGNLIF	TRAV39	TRAJ42	CASSIRSTDTQYF	TRBV19	TRBJ2-3
34730	CAC ACS CSG SGG GGY GYQ YQK QKV KVT VTF	CAS ASS SSR SRG RGP GPG PGQ GQG QGE GEE EET ETQ TQY QYF	KLGGALQAK	CACSGGYQKVTF	TRAV24	TRAJ13	CASSRGPGQGEETQYF	TRBV2	TRBJ2-5
23208	CAV AVA VAK AKD KDL DLQ LQN QNS NSG SGG GGG GGA GAD ADG DGL GLT LTF	CAT ATS TSY SYE YED EDN DNS NSG SGA GAN ANV NVL VLT LTF	GILGFVFTL	CAVAKDLQNSGGGADGLTF	TRAV3	TRAJ45	CATSYEDNSGANVLTF	TRBV15	TRBJ2-6
34573	CAI AIG IGP GPG PGN GNM NML MLT LTF	CAT ATS TSR SRQ RQT QTS TSI SIE IEQ EQF QFF	KLGGALQAK	CAIGPGNMLTF	TRAV12-3	TRAJ39	CATSRQTSIEQFF	TRBV15	TRBJ2-1
7699	CVV VVT VTE TET ETS TSY SYD YDK DKV KVI VIF	CAS ASS SSF SFL FLD LDR DRG RGP GPN PNT NTE TEA EAF AFF	RAKFKQLL	CVVTETSYDKVIF	TRAV12-1	TRAJ50	CASSFLDRGPNTEAFF	TRBV12-3	TRBJ1-1
7442	CAE AET ETQ TQD QDS DSN SNY NYQ YQL QLI LIW	CAS ASS SSM SMG MGD GDR DRS RSM SMG MGN GNI NIQ IQY QYF	RAKFKQLL	CAETQDSNYQLIW	TRAV5	TRAJ33	CASSMGDRSMGNIQYF	TRBV21-1	TRBJ2-4
33899	CAL ALK LKG KGS GSG SGA GAG AGS GSY SYQ YQL QLT LTF	CAS ASS SSI SIR IRD RDR DRA RAF AFG FGE GEQ EQY QYF	KLGGALQAK	CALKGSGAGSYQLTF	TRAV19	TRAJ28	CASSIRDRAFGEQYF	TRBV11-1	TRBJ2-7
130	CAA AAR ARG RGG GGS GSN SNY NYQ YQL QLI LIW	CAS ASS SSG SGA GAG AGA GAE AEA EAF AFF	RAKFKQLL	CAARGGSNYQLIW	TRAV8-1	TRAJ33	CASSGAGAEAFF	TRBV2	TRBJ1-1
29945	CGT GTD TDT DTG TGG GGG GGS GSQ SQG QGN GNL NLI LIF	CAS ASS SSG SGR GRS RST STD TDT DTQ TQY QYF	GILGFVFTL	CGTDTGGGSQGNLIF	TRAV30	TRAJ42	CASSGRSTDTQYF	TRBV19	TRBJ2-3
25463	CAA AAS ASE SET ETS TSY SYD YDK DKV KVI VIF	CAS ASS SSL SLV LVG VGG GGT GTD TDE DEK EKL KLF LFF	RAKFKQLL	CAASETSYDKVIF	TRAV13-1	TRAJ50	CASSLVGGTDEKLFF	TRBV7-9	TRBJ1-4
27091	CAG AGQ GQG QGS GSA SAG AGN GNN NNR NRK RKL KLI LIW	CSV SVE VEL ELL LLD LDY DYG YGY GYT YTF	KLGGALQAK	CAGQGSAGNNRKLIW	TRAV35	TRAJ38	CSVELLDYGYTF	TRBV29-1	TRBJ1-2
36282	CAV AVE VED EDQ DQG QGT GTD TDK DKL KLI LIF	CSA SAR ARD RDH DHN HNE NEG EGS GSY SYN YNE NEQ EQF QFF	AVFDRKSDAK	CAVEDQGTDKLIF	TRAV2	TRAJ34	CSARDHNEGSYNEQFF	TRBV20-1	TRBJ2-1
35854	CAM AMR MRG RGT GTK TKT KTS TSY SYD YDK DKV KVI VIF	CAS ASS SSI SIG IGR GRS RST STE TEA EAF AFF	KLGGALQAK	CAMRGTKTSYDKVIF	TRAV14DV4	TRAJ50	CASSIGRSTEAFF	TRBV19	TRBJ1-1
33475	CVV VVN VNR NRD RDY DYQ YQL QLI LIW	CAS ASS SSL SLT LTS TSP SPG PGN GNT NTI TIY IYF	KLGGALQAK	CVVNRDYQLIW	TRAV12-1	TRAJ33	CASSLTSPGNTIYF	TRBV19	TRBJ1-3
5253	CAV AVT VTT TTD TDS DSW SWG WGK GKL KLQ LQF	CSA SAR ARP RPR PRT RTS TSG SGS GSG SGA GAG AGE GEL ELF LFF	ELAGIGILTV	CAVTTDSWGKLQF	TRAV12-2	TRAJ24	CSARPRTSGSGAGELFF	TRBV20-1	TRBJ2-2
34313	CAG AGA GAD ADF DFN FNK NKF KFY FYF	CAS ASS SSQ SQD QDR DRA RAN ANT NTD TDT DTQ TQY QYF	KLGGALQAK	CAGADFNKFYF	TRAV27	TRAJ21	CASSQDRANTDTQYF	TRBV3-1	TRBJ2-3
2502	CAV AVN VNN NNA NAR ARL RLM LMF	CAI AIS ISE SEP EPG PGL GLL LLS LSG SGA GAN ANV NVL VLT LTF	ELAGIGILTV	CAVNNARLMF	TRAV12-2	TRAJ31	CAISEPGLLSGANVLTF	TRBV10-3	TRBJ2-6
155	CAV AVN VNG NGN GNQ NQF QFY FYF	CAS ASS SSQ SQE QEE EEE EES ESL SLG LGY GYE YEQ EQY QYF	ELAGIGILTV	CAVNGNQFYF	TRAV12-2	TRAJ49	CASSQEEESLGYEQYF	TRBV4-1	TRBJ2-7
5803	CAA AAT ATG TGS GSQ SQG QGN GNL NLI LIF	CAS ASS SSI SIR IRS RSS SSE SET ETQ TQY QYF	GILGFVFTL	CAATGSQGNLIF	TRAV13-1	TRAJ42	CASSIRSSETQYF	TRBV19	TRBJ2-5
33393	CAG AGA GAG AGG GGG GGS GSQ SQG QGN GNL NLI LIF	CAS ASS SSI SIY IYG YGG GGA GAG AGD GDG DGY GYT YTF	GILGFVFTL	CAGAGGGSQGNLIF	TRAV27	TRAJ42	CASSIYGGAGDGYTF	TRBV19	TRBJ1-2
35579	CAV AVN VNA NAE AEK EKL KLV LVF	CSV SVV VVG VGP GPN PNT NTE TEA EAF AFF	KLGGALQAK	CAVNAEKLVF	TRAV12-2	TRAJ57	CSVVGPNTEAFF	TRBV29-1	TRBJ1-1
24909	CAR ARD RDR DRG RGS GSG SGG GGS GSN SNY NYK YKL KLT LTF	CAS ASS SSL SLN LNR NRG RGD GDP DPE PEA EAF AFF	GLCTLVAML	CARDRGSGGSNYKLTF	IGHV3-74	TRAJ53	CASSLNRGDPEAFF	TRBV11-2	TRBJ1-1
34520	CAL ALS LSV SVL VLR LRD RDT DTG TGR GRR RRA RAL ALT LTF	CAS ASS SSL SLE LEG EGN GNE NEQ EQY QYF	KLGGALQAK	CALSVLRDTGRRALTF	TRAV19	TRAJ5	CASSLEGNEQYF	TRBV5-5	TRBJ2-7
34514	CAV AVG VGG GGD GDS DSG SGG GGY GYQ YQK QKV KVT VTF	CAS ASS SSD SDW DWG WGL GLS LSY SYE YEQ EQY QYV	KLGGALQAK	CAVGGDSGGYQKVTF	TRAV8-3	TRAJ13	CASSDWGLSYEQYV	TRBV5-5	TRBJ2-7
26702	CAV AVN VNI NIG IGT GTS TSG SGA GAG AGS GSY SYQ YQL QLT LTF	CSA SAG AGQ GQG QGP GPY PYE YEQ EQY QYF	RAKFKQLL	CAVNIGTSGAGSYQLTF	TRAV12-2	TRAJ28	CSAGQGPYEQYF	TRBV29-1	TRBJ2-7
26491	CVV VVS VSD SDV DVN VNT NTD TDK DKL KLI LIF	CSA SAR ARS RSR SRV RVG VGN GNT NTI TIY IYF	GLCTLVAML	CVVSDVNTDKLIF	TRAV8-2	TRAJ34	CSARSRVGNTIYF	TRBV20-1	TRBJ1-3
25353	CAA AAS ASE SET ETS TSY SYD YDK DKV KVI VIF	CAS ASS SSF SFV FVD VDR DRV RVY VYE YEQ EQY QYF	RAKFKQLL	CAASETSYDKVIF	TRAV13-1	TRAJ50	CASSFVDRVYEQYF	TRBV7-9	TRBJ2-7
29960	CAV AVV VVR VRG RGS GSM SMD MDS DSN SNY NYQ YQL QLI LIW	CAS ASS SSI SIF IFT FTI TIE IEP EPQ PQH QHF	GILGFVFTL	CAVVRGSMDSNYQLIW	TRAV22	TRAJ33	CASSIFTIEPQHF	TRBV19	TRBJ1-5
5450	CAV AVG VGD GDN DNF NFN FNK NKF KFY FYF	CAS ASS SSD SDA DAR ARK RKG KGL GLA LAG AGQ GQE QET ETQ TQY QYF	AVFDRKSDAK	CAVGDNFNKFYF	TRAV8-3	TRAJ21	CASSDARKGLAGQETQYF	TRBV6-1	TRBJ2-5
34366	CAY AYR YRS RSA SAW AWE WEN ENN NNA NAR ARL RLM LMF	CAS ASS SSG SGG GGA GAG AGN GNN NNY NYG YGY GYT YTF	KLGGALQAK	CAYRSAWENNARLMF	TRAV38-2DV8	TRAJ31	CASSGGAGNNYGYTF	TRBV9	TRBJ1-2
27063	CAA AAV AVD VDN DNY NYG YGQ GQN QNF NFV FVF	CSG SGG GGQ GQG QGP GPD PDN DNE NEQ EQF QFF	RAKFKQLL	CAAVDNYGQNFVF	TRAV13-1	TRAJ26	CSGGQGPDNEQFF	TRBV29-1	TRBJ2-1
34060	CAV AVL VLT LTM TME MEY EYG YGN GNK NKL KLV LVF	CAS ASS SSL SLG LGA GAA AAS ASG SGL GLY LYY YYN YNE NEQ EQF QFF	KLGGALQAK	CAVLTMEYGNKLVF	TRAV20	TRAJ47	CASSLGAASGLYYNEQFF	TRBV12-3	TRBJ2-1
17155	CAA AAS ASE SET ETS TSY SYD YDK DKV KVI VIF	CAS ASS SSY SYS YSG SGG GGA GAG AGE GEL ELF LFF	RAKFKQLL	CAASETSYDKVIF	TRAV13-1	TRAJ50	CASSYSGGAGELFF	TRBV3-1	TRBJ2-2
27755	CGA GAD ADS DSA SAS ASG SGT GTY TYK YKY KYI YIF	CSV SVG VGS GSG SGE GED EDN DNE NEQ EQY QYF	RAKFKQLL	CGADSASGTYKYIF	TRAV34	TRAJ40	CSVGSGEDNEQYF	TRBV29-1	TRBJ2-7
6951	CAV AVN VNL NLY LYG YGG GGS GSQ SQG QGN GNL NLI LIF	CAS ASS SSI SIR IRS RSS SSY SYE YEQ EQY QYF	GILGFVFTL	CAVNLYGGSQGNLIF	TRAV8-1	TRAJ42	CASSIRSSYEQYF	TRBV19	TRBJ2-7
14847	CAA AAG AGT GTQ TQG QGA GAQ AQK QKL KLV LVF	CAS ASS SSH SHS HSG SGG GGD GDQ DQE QET ETQ TQY QYF	RAKFKQLL	CAAGTQGAQKLVF	TRAV29DV5	TRAJ54	CASSHSGGDQETQYF	TRBV4-1	TRBJ2-5
34641	CAL ALS LSE SEA EAI AIS ISG SGG GGY GYN YNK NKL KLI LIF	CAS ASS SSL SLL LLG LGS GSG SGV GVE VET ETQ TQY QYF	KLGGALQAK	CALSEAISGGYNKLIF	TRAV19	TRAJ4	CASSLLGSGVETQYF	TRBV27	TRBJ2-5
36234	CAQ AQM QMY MYS YSG SGG GGG GGA GAD ADG DGL GLT LTF	CAS ASS SSF SFW FWG WGS GSG SGR GRD RDT DTQ TQY QYF	KLGGALQAK	CAQMYSGGGADGLTF	TRAV38-2DV8	TRAJ45	CASSFWGSGRDTQYF	TRBV7-2	TRBJ2-3
25287	CAA AAS ASE SET ETS TSY SYD YDK DKV KVI VIF	CAS ASS SSF SFG FGP GPP PPK PKP KPD PDT DTQ TQY QYF	RAKFKQLL	CAASETSYDKVIF	TRAV13-1	TRAJ50	CASSFGPPKPDTQYF	TRBV7-9	TRBJ2-3
14645	CVV VVN VNL NLL LLN LNY NYQ YQL QLI LIW	CAS ASS SSD SDR DRG RGE GET ETE TEA EAF AFF	KLGGALQAK	CVVNLLNYQLIW	TRAV12-1	TRAJ33	CASSDRGETEAFF	TRBV2	TRBJ1-1
24692	CAF AFM FMI MIN INA NAG AGG GGT GTS TSY SYG YGK GKL KLT LTF	CAS ASL SLI LIS ISG SGT GTD TDT DTQ TQY QYF	KLGGALQAK	CAFMINAGGTSYGKLTF	TRAV38-1	TRAJ52	CASLISGTDTQYF	TRBV11-2	TRBJ2-3
14264	CAL ALS LSE SEA EAG AGP GPD PDK DKL KLI LIF	CAS ASS SSP SPS PSS SSS SSY SYE YEQ EQY QYF	RAKFKQLL	CALSEAGPDKLIF	TRAV9-2	TRAJ34	CASSPSSSYEQYF	TRBV12-4	TRBJ2-7
25109	CVV VVS VSG SGY GYG YGF GFN FNK NKF KFY FYF	CAS ASS SSS SSG SGD GDS DSG SGD GDQ DQE QET ETQ TQY QYF	RAKFKQLL	CVVSGYGFNKFYF	TRAV8-2	TRAJ21	CASSSGDSGDQETQYF	TRBV7-2	TRBJ2-5
35584	CAL ALS LSE SEM EMI MIG IGS GSG SGN GNT NTG TGK GKL KLI LIF	CAS ASG SGT GTS TSV SVY VYN YNE NEQ EQF QFF	KLGGALQAK	CALSEMIGSGNTGKLIF	TRAV19	TRAJ37	CASGTSVYNEQFF	TRBV13	TRBJ2-1
5467	CIL ILR LRL RLY LYQ YQG QGA GAQ AQK QKL KLV LVF	CAS ASS SSW SWL WLG LGR GRV RVW VWG WGN GNQ NQP QPQ PQH QHF	KLGGALQAK	CILRLYQGAQKLVF	TRAV26-2	TRAJ54	CASSWLGRVWGNQPQHF	TRBV6-1	TRBJ1-5
30502	CAG AGA GAT ATG TGG GGG GGS GSQ SQG QGN GNL NLI LIF	CAS ASS SSI SIR IRS RSS SSF SFE FEA EAF AFF	GILGFVFTL	CAGATGGGSQGNLIF	TRAV27	TRAJ42	CASSIRSSFEAFF	TRBV19	TRBJ1-1
31553	CAA AAI AIS ISV SVG VGG GGS GSN SNY NYK YKL KLT LTF	CAS ASS SSS SSG SGL GLF LFS FSF	GILGFVFTL	CAAISVGGSNYKLTF	TRAV29DV5	TRAJ53	CASSSGLFSF	TRBV19	TRBJ1-1
5251	CAE AES ESM SMN MNA NAR ARL RLM LMF	CSA SAR ARN RNP NPS PSG SGT GTN TNN NNE NEQ EQF QFF	GILGFVFTL	CAESMNARLMF	TRAV5	TRAJ31	CSARNPSGTNNEQFF	TRBV20-1	TRBJ2-1
22308	CAD ADS DSG SGG GGG GGA GAD ADG DGL GLT LTF	CAS ASS SSL SLR LRE REG EGS GSE SEA EAF AFF	RAKFKQLL	CADSGGGADGLTF	TRAV13-2	TRAJ45	CASSLREGSEAFF	TRBV5-6	TRBJ1-1
17298	CAA AAK AKE KEG EGY GYS YST STL TLT LTF	CAS ASS SSS SSG SGL GLV LVS VSN SNT NTG TGE GEL ELF LFF	GLCTLVAML	CAAKEGYSTLTF	TRAV13-1	TRAJ11	CASSSGLVSNTGELFF	TRBV9	TRBJ2-2
6705	CAM AMS MSG SGG GGG GGR GRE RET ETS TSG SGS GSR SRL RLT LTF	CAS ASS SSI SIR IRS RSN SNQ NQP QPQ PQH QHF	GILGFVFTL	CAMSGGGRETSGSRLTF	TRAV12-3	TRAJ58	CASSIRSNQPQHF	TRBV19	TRBJ1-5
5566	CAV AVG VGG GGG GGG GGG GGS GSQ SQG QGN GNL NLI LIF	CAS ASS SSF SFR FRS RSS SSE SET ETQ TQY QYF	GILGFVFTL	CAVGGGGGSQGNLIF	TRAV8-3	TRAJ42	CASSFRSSETQYF	TRBV19	TRBJ2-5
28468	CAV AVG VGT GTA TAR ARL RLM LMF	CAS ASS SSL SLR LRF RFP FPD PDI DIG IGE GEQ EQY QYF	RAKFKQLL	CAVGTARLMF	TRAV8-3	TRAJ31	CASSLRFPDIGEQYF	TRBV6-5	TRBJ2-7
26213	CAV AVG VGG GGL GLN LND NDY DYK YKL KLS LSF	CSA SAR ARD RDD DDS DSG SGQ GQG QGF GFG FGF GFL FLE LET ETQ TQY QYF	GLCTLVAML	CAVGGLNDYKLSF	TRAV8-3	TRAJ20	CSARDDSGQGFGFLETQYF	TRBV20-1	TRBJ2-5
35896	CAV AVS VSL SLL LLN LNT NTD TDK DKL KLI LIF	CAS ASS SSL SLG LGS GSN SNQ NQP QPQ PQH QHF	KLGGALQAK	CAVSLLNTDKLIF	TRAV21	TRAJ34	CASSLGSNQPQHF	TRBV19	TRBJ1-5
38424	CAV AVN VNT NTG TGG GGF GFK FKT KTI TIF	CAS ASS SSY SYS YST STG TGY GYE YEQ EQY QYF	ELAGIGILTV	CAVNTGGFKTIF	TRAV12-2	TRAJ9	CASSYSTGYEQYF	TRBV6-3	TRBJ2-7
18087	CAL ALS LSE SEG EGT GTY TYK YKY KYI YIF	CAS ASS SSS SSR SRG RGR GRR RRD RDP DPG PGE GEL ELF LFF	KLGGALQAK	CALSEGTYKYIF	TRAV19	TRAJ40	CASSSRGRRDPGELFF	TRBV28	TRBJ2-2
4951	CAI AIG IGF GFG FGG GGY GYN YNK NKL KLI LIF	CAS ASS SSS SSG SGS GSG SGS GSP SPE PEM EMG MGD GDE DEQ EQF QFF	KLGGALQAK	CAIGFGGYNKLIF	TRAV14DV4	TRAJ4	CASSSGSGSPEMGDEQFF	TRBV7-8	TRBJ2-1
15723	CAF AFM FMK MKD KDA DAG AGG GGT GTS TSY SYG YGK GKL KLT LTF	CAS ASS SST STS TST STG TGT GTG TGY GYG YGY GYT YTF	GILGFVFTL	CAFMKDAGGTSYGKLTF	TRAV38-1	TRAJ52	CASSTSTGTGYGYTF	TRBV4-1	TRBJ1-2
29911	CAY AYM YMT MTN TNA NAG AGG GGT GTS TSY SYG YGK GKL KLT LTF	CAS ASS SSE SEG EGS GSY SYG YGY GYT YTF	GILGFVFTL	CAYMTNAGGTSYGKLTF	TRAV38-2DV8	TRAJ52	CASSEGSYGYTF	TRBV19	TRBJ1-2
25028	CAE AEN END NDH DHN HNN NNN NND NDM DMR MRF	CAS ASS SSL SLV LVG VGS GSA SAS ASG SGY GYN YNS NSP SPL PLH LHF	GILGFVFTL	CAENDHNNNDMRF	TRAV13-2	TRAJ43	CASSLVGSASGYNSPLHF	TRBV11-3	TRBJ1-6
31365	CAG AGA GAV AVG VGG GGF GFG FGN GNV NVL VLH LHC	CAS ASS SSI SIY IYS YSN SNQ NQP QPQ PQH QHF	GILGFVFTL	CAGAVGGFGNVLHC	TRAV27	TRAJ35	CASSIYSNQPQHF	TRBV19	TRBJ1-5
31852	CAM AMR MRE RED EDP DPG PGG GGT GTS TSY SYG YGK GKL KLT LTF	CAS ASS SST STY TYS YSN SNQ NQP QPQ PQH QHF	GILGFVFTL	CAMREDPGGTSYGKLTF	TRAV14DV4	TRAJ52	CASSTYSNQPQHF	TRBV19	TRBJ1-5
34513	CAV AVV VVA VAN ANN NNA NAR ARL RLM LMF	CAS ASA SAG AGP GPE PEA EAF AFF	KLGGALQAK	CAVVANNARLMF	TRAV22	TRAJ31	CASAGPEAFF	TRBV5-5	TRBJ1-1
5555	CAG AGN GNY NYG YGG GGS GSQ SQG QGN GNL NLI LIF	CAS ASS SSA SAR ARS RST STG TGE GEL ELF LFF	GILGFVFTL	CAGNYGGSQGNLIF	TRAV25	TRAJ42	CASSARSTGELFF	TRBV19	TRBJ2-2
2282	CAA AAA AAE AET ETS TSY SYD YDK DKV KVI VIF	CAS ASS SSL SLF LFS FSG SGP GPP PPY PYE YEQ EQY QYF	RAKFKQLL	CAAAETSYDKVIF	TRAV13-1	TRAJ50	CASSLFSGPPYEQYF	TRBV5-5	TRBJ2-7
5250	CAE AET ETP TPS PSS SSG SGK GKL KLI LIF	CSA SAR ARG RGM GME MER ERE REA EAL ALE LET ETQ TQY QYF	RAKFKQLL	CAETPSSGKLIF	TRAV5	TRAJ37	CSARGMEREALETQYF	TRBV20-1	TRBJ2-5
33469	CAV AVA VAG AGG GGT GTS TSY SYG YGK GKL KLT LTF	CAS ASS SSL SLD LDS DSS SSY SYE YEQ EQY QYF	KLGGALQAK	CAVAGGTSYGKLTF	TRAV36DV7	TRAJ52	CASSLDSSYEQYF	TRBV19	TRBJ2-7
31444	CGT GTA TAM AMG MGG GGG GGS GSQ SQG QGN GNL NLI LIF	CAS ASS SSM SMR MRS RST STD TDT DTQ TQY QYF	GILGFVFTL	CGTAMGGGSQGNLIF	TRAV30	TRAJ42	CASSMRSTDTQYF	TRBV19	TRBJ2-3
12702	CAM AMR MRE RET ETN TNQ NQA QAG AGT GTA TAL ALI LIF	CAS ASS SSF SFS FSG SGN GNT NTG TGE GEL ELF LFF	RAKFKQLL	CAMRETNQAGTALIF	TRAV14DV4	TRAJ15	CASSFSGNTGELFF	TRBV12-3	TRBJ2-2
13925	CAV AVG VGG GGS GSQ SQG QGN GNL NLI LIF	CAS ASS SSL SLG LGH GHL HLI LIS ISS SSN SNQ NQP QPQ PQH QHF	GILGFVFTL	CAVGGSQGNLIF	TRAV8-6	TRAJ42	CASSLGHLISSNQPQHF	TRBV12-3	TRBJ1-5
26499	CAL ALS LSV SVF VFS FSG SGG GGG GGA GAD ADG DGL GLT LTF	CSA SAR ARW RWG WGG GGG GGT GTD TDT DTQ TQY QYF	KLGGALQAK	CALSVFSGGGADGLTF	TRAV19	TRAJ45	CSARWGGGTDTQYF	TRBV20-1	TRBJ2-3
15117	CVV VVS VSG SGE GEG EGW GWA WAA AAG AGT GTA TAL ALI LIF	CAS ASS SSL SLL LLW LWA WAE AEY EYN YNE NEQ EQF QFF	RAKFKQLL	CVVSGEGWAAGTALIF	TRAV8-2	TRAJ15	CASSLLWAEYNEQFF	TRBV4-1	TRBJ2-1
34894	CLV LVG VGD GDP DPV PVG VGT GTY TYK YKY KYI YIF	CAS ASR SRR RRI RIG IGD GDT DTQ TQY QYF	KLGGALQAK	CLVGDPVGTYKYIF	TRAV4	TRAJ40	CASRRIGDTQYF	TRBV10-2	TRBJ2-3
35306	CLV LVA VAG AGG GGG GGA GAT ATN TNK NKL KLI LIF	CAS ASS SSS SSG SGT GTG TGF GFP FPH PHN HNT NTE TEA EAF AFF	KLGGALQAK	CLVAGGGATNKLIF	TRAV4	TRAJ32	CASSSGTGFPHNTEAFF	TRBV7-6	TRBJ1-1
31840	CAL ALS LSE SEP EPP PPG PGK GKS KSS SSA SAS ASK SKI KII IIF	CAS ASS SST STT TTS TSG SGG GGL GLN LNE NEQ EQF QFF	GILGFVFTL	CALSEPPGKSSASKIIF	TRAV19	TRAJ3	CASSTTSGGLNEQFF	TRBV19	TRBJ2-1
7059	CGT GTE TEM EMG MGG GGG GGS GSQ SQG QGN GNL NLI LIF	CAS ASS SSI SIR IRS RST STD TDT DTQ TQY QYF	GILGFVFTL	CGTEMGGGSQGNLIF	TRAV30	TRAJ42	CASSIRSTDTQYF	TRBV19	TRBJ2-3
35339	CAG AGP GPG PGD GDT DTG TGN GNQ NQF QFY FYF	CAW AWS WSV SVQ VQR QRG RGS GSE SEA EAF AFF	KLGGALQAK	CAGPGDTGNQFYF	TRAV25	TRAJ49	CAWSVQRGSEAFF	TRBV30	TRBJ1-1
7079	CAG AGH GHQ HQG QGN GNN NNA NAG AGN GNM NML MLT LTF	CAS ASS SSM SMP MPG PGL GLV LVF VFP FPG PGE GEL ELF LFF	KLGGALQAK	CAGHQGNNAGNMLTF	TRAV25	TRAJ39	CASSMPGLVFPGELFF	TRBV19	TRBJ2-2
11402	CAA AAG AGS GSA SAN ANT NTG TGN GNQ NQF QFY FYF	CAS ASS SSF SFS FSG SGN GNT NTG TGE GEL ELF LFF	RAKFKQLL	CAAGSANTGNQFYF	TRAV13-1	TRAJ49	CASSFSGNTGELFF	TRBV12-3	TRBJ2-2
35407	CAM AMR MRE REY EYD YDR DRG RGS GST STL TLG LGR GRL RLY LYF	CSA SAP APG PGQ GQG QGV GVY VYN YNE NEQ EQF QFF	KLGGALQAK	CAMREYDRGSTLGRLYF	TRAV14DV4	TRAJ18	CSAPGQGVYNEQFF	TRBV20-1	TRBJ2-1
7348	CIL ILR LRE RET ETS TSY SYD YDK DKV KVI VIF	CAS ASA SAL ALL LLS LSS SSY SYN YNS NSP SPL PLH LHF	RAKFKQLL	CILRETSYDKVIF	TRAV26-2	TRAJ50	CASALLSSYNSPLHF	TRBV12-5	TRBJ1-6
5077	CAV AVE VES ESS SSD SDM DMR MRF	CAS ASS SSP SPG PGQ GQG QGI GIT ITG TGE GEL ELF LFF	KLGGALQAK	CAVESSDMRF	TRAV12-2	TRAJ43	CASSPGQGITGELFF	TRBV7-9	TRBJ2-2
29610	CAE AET ETH THS HSG SGG GGS GSN SNY NYK YKL KLT LTF	CAS ASS SSA SAR ARS RSS SSY SYE YEQ EQY QYF	GILGFVFTL	CAETHSGGSNYKLTF	TRAV13-2	TRAJ53	CASSARSSYEQYF	TRBV19	TRBJ2-7
35218	CAT ATT TTN TND NDY DYK YKL KLS LSF	CAS ASS SSG SGA GAL ALQ LQD QDS DSN SNQ NQP QPQ PQH QHF	KLGGALQAK	CATTNDYKLSF	TRAV17	TRAJ20	CASSGALQDSNQPQHF	TRBV7-9	TRBJ1-5
35912	CAL ALS LSE SEA EAG AGE GET ETS TSG SGS GSR SRL RLT LTF	CAS ASS SSP SPF PFA FAG AGG GGM GMS MST STD TDT DTQ TQY QYF	KLGGALQAK	CALSEAGETSGSRLTF	TRAV19	TRAJ58	CASSPFAGGMSTDTQYF	TRBV19	TRBJ2-3
14239	CAA AAT ATE TET ETS TSY SYD YDK DKV KVI VIF	CAS ASS SSY SYT YTG TGS GSS SSN SNS NSP SPL PLH LHF	RAKFKQLL	CAATETSYDKVIF	TRAV13-1	TRAJ50	CASSYTGSSNSPLHF	TRBV12-3	TRBJ1-6
36065	CAV AVD VDL DLM LMK MKT KTS TSY SYD YDK DKV KVI VIF	CAS ASS SSL SLT LTL TLN LNT NTE TEA EAF AFF	IVTDFSVIK	CAVDLMKTSYDKVIF	TRAV21	TRAJ50	CASSLTLNTEAFF	TRBV12-4	TRBJ1-1
28707	CAL ALS LSG SGY GYY YYG YGG GGS GSQ SQG QGN GNL NLI LIF	CAS ASS SSG SGV GVG VGR GRQ RQT QTY TYE YEQ EQY QYF	GILGFVFTL	CALSGYYGGSQGNLIF	TRAV19	TRAJ42	CASSGVGRQTYEQYF	TRBV6-1	TRBJ2-7
26126	CAV AVS VSD SDS DSN SNY NYQ YQL QLI LIW	CSA SAG AGN GNS NSG SGG GGY GYN YNE NEQ EQF QFF	KLGGALQAK	CAVSDSNYQLIW	TRAV1-2	TRAJ33	CSAGNSGGYNEQFF	TRBV20-1	TRBJ2-1
32661	CGY GYG YGG GGS GSQ SQG QGN GNL NLI LIF	CAS ASS SSI SIR IRS RSS SSY SYE YEQ EQY QYF	GILGFVFTL	CGYGGSQGNLIF	TRAV27	TRAJ42	CASSIRSSYEQYF	TRBV19	TRBJ2-7
35315	CAV AVE VEQ EQD QDS DSN SNY NYQ YQL QLI LIW	CAW AWA WAL ALP LPP PPG PGA GAN ANV NVL VLT LTF	KLGGALQAK	CAVEQDSNYQLIW	TRAV22	TRAJ33	CAWALPPGANVLTF	TRBV30	TRBJ2-6
23019	CAL ALI LIR IRA RAG AGG GGQ GQN QNF NFV FVF	CAS ASS SSL SLG LGT GTA TAN ANY NYG YGY GYT YTF	KLGGALQAK	CALIRAGGQNFVF	TRAV19	TRAJ26	CASSLGTANYGYTF	TRBV5-4	TRBJ1-2
29962	CAV AVG VGV GVE VEE EET ETS TSG SGS GSR SRL RLT LTF	CAS ASS SSI SIF IFY FYR YRA RAE AEA EAF AFF	GILGFVFTL	CAVGVEETSGSRLTF	TRAV41	TRAJ58	CASSIFYRAEAFF	TRBV19	TRBJ1-1
28588	CAD ADS DSG SGG GGG GGA GAD ADG DGL GLT LTF	CAS ASS SSY SYS YSV SVL VLR LRT RTS TSG SGP GPR PRG RGG GGQ GQY QYF	RAKFKQLL	CADSGGGADGLTF	TRAV13-2	TRAJ45	CASSYSVLRTSGPRGGQYF	TRBV6-5	TRBJ2-3
20584	CAA AAS ASG SGY GYD YDY DYK YKL KLS LSF	CAS ASS SSL SLR LRD RDG DGS GSE SEA EAF AFF	RAKFKQLL	CAASGYDYKLSF	TRAV13-1	TRAJ20	CASSLRDGSEAFF	TRBV5-6	TRBJ1-1
18262	CAE AEM EME MEG EGG GGS GSY SYI YIP IPT PTF	CAS ASS SSL SLR LRD RDG DGS GSE SEA EAF AFF	RAKFKQLL	CAEMEGGSYIPTF	TRAV5	TRAJ6	CASSLRDGSEAFF	TRBV5-6	TRBJ1-1
13891	CAA AAS ASE SET ETS TSY SYD YDK DKV KVI VIF	CAS ASS SSL SLA LAH AHN HNQ NQP QPQ PQH QHF	RAKFKQLL	CAASETSYDKVIF	TRAV13-1	TRAJ50	CASSLAHNQPQHF	TRBV12-3	TRBJ1-5
5175	CAV AVN VNV NVN VNQ NQA QAG AGT GTA TAL ALI LIF	CSA SAR ARE REG EGT GTG TGG GGT GTT TTG TGE GEL ELF LFF	KLGGALQAK	CAVNVNQAGTALIF	TRAV8-1	TRAJ15	CSAREGTGGTTGELFF	TRBV20-1	TRBJ2-2
17038	CAV AVI VIQ IQA QAR ARL RLM LMF	CAS ASS SSQ SQD QDT DTS TSG SGL GLY LYN YNE NEQ EQF QFF	KLGGALQAK	CAVIQARLMF	TRAV12-2	TRAJ31	CASSQDTSGLYNEQFF	TRBV3-1	TRBJ2-1
17866	CAG AGP GPR PRR RRS RSG SGG GGG GGA GAD ADG DGL GLT LTF	CAS ASS SSV SVV VVA VAR ARE REQ EQF QFF	KLGGALQAK	CAGPRRSGGGADGLTF	TRAV35	TRAJ45	CASSVVAREQFF	TRBV9	TRBJ2-1
32323	CAM AMS MSG SGD GDG DGG GGS GSQ SQG QGN GNL NLI LIF	CAS ASS SSH SHR HRS RSN SNQ NQP QPQ PQH QHF	GILGFVFTL	CAMSGDGGSQGNLIF	TRAV12-3	TRAJ42	CASSHRSNQPQHF	TRBV19	TRBJ1-5
35219	CAV AVL VLR LRT RTS TSG SGG GGS GSY SYI YIP IPT PTF	CAS ASS SSG SGR GRA RAG AGG GGP GPS PSE SEF EFF	KLGGALQAK	CAVLRTSGGSYIPTF	TRAV8-1	TRAJ6	CASSGRAGGPSEFF	TRBV7-9	TRBJ2-1
34714	CAM AMR MRP RPL PLL LLG LGG GGS GSN SNY NYK YKL KLT LTF	CAS ASY SYP YPG PGT GTE TEN ENN NNS NSP SPL PLH LHF	KLGGALQAK	CAMRPLLGGSNYKLTF	TRAV14DV4	TRAJ53	CASYPGTENNSPLHF	TRBV27	TRBJ1-6
684	CAV AVG VGD GDN DNF NFN FNK NKF KFY FYF	CAS ASS SSL SLR LRS RSA SAA AAG AGW GWP WPF PFF	AVFDRKSDAK	CAVGDNFNKFYF	TRAV8-3	TRAJ21	CASSLRSAAGWPFF	TRBV28	TRBJ1-1
25270	CAA AAS ASE SET ETS TSY SYD YDK DKV KVI VIF	CAS ASL SLR LRL RLG LGI GID IDQ DQE QET ETQ TQY QYF	RAKFKQLL	CAASETSYDKVIF	TRAV13-1	TRAJ50	CASLRLGIDQETQYF	TRBV7-9	TRBJ2-5
35731	CAA AAS ASI SIR IRA RAA AAG AGN GNK NKL KLT LTF	CAS ASS SSY SYH YHE HEM EMT MTG TGT GTV TVE VEQ EQF QFF	KLGGALQAK	CAASIRAAGNKLTF	TRAV23DV6	TRAJ17	CASSYHEMTGTVEQFF	TRBV6-3	TRBJ2-1
34808	CAY AYM YMW MWG WGG GGT GTS TSY SYG YGK GKL KLT LTF	CAS ASR SRW RWD WDS DSY SYN YNQ NQP QPQ PQH QHF	KLGGALQAK	CAYMWGGTSYGKLTF	TRAV38-2DV8	TRAJ52	CASRWDSYNQPQHF	TRBV12-4	TRBJ1-5
20662	CAD ADS DSG SGG GGS GSA SAD ADG DGL GLT LTF	CAS ASS SSL SLR LRD RDG DGS GSE SEA EAF AFF	RAKFKQLL	CADSGGSADGLTF	TRAV13-2	TRAJ45	CASSLRDGSEAFF	TRBV5-6	TRBJ1-1
31276	CAV AVS VSL SLG LGG GGG GGS GSQ SQG QGN GNL NLI LIF	CAS ASS SSI SIR IRS RST STD TDT DTQ TQY QYF	GILGFVFTL	CAVSLGGGSQGNLIF	TRAV12-2	TRAJ42	CASSIRSTDTQYF	TRBV19	TRBJ2-3
34708	CAV AVE VEG EGT GTI TIQ IQG QGA GAQ AQK QKL KLV LVF	CAS ASS SSY SYK YKQ KQG QGY GYE YEQ EQY QYF	KLGGALQAK	CAVEGTIQGAQKLVF	TRAV22	TRAJ54	CASSYKQGYEQYF	TRBV27	TRBJ2-7
36215	CIV IVS VSG SGG GGG GGA GAD ADG DGL GLT LTF	CAS ASN SNP NPT PTG TGV GVG VGD GDE DEK EKL KLF LFF	KLGGALQAK	CIVSGGGADGLTF	TRAV26-1	TRAJ45	CASNPTGVGDEKLFF	TRBV11-2	TRBJ1-4
34906	CAA AAP APL PLD LDK DKL KLI LIF	CAS ASS SSP SPG PGT GTG TGG GGF GFQ FQP QPQ PQH QHF	KLGGALQAK	CAAPLDKLIF	TRAV29DV5	TRAJ34	CASSPGTGGFQPQHF	TRBV10-2	TRBJ1-5
28362	CAY AYG YGG GGS GSQ SQG QGN GNL NLI LIF	CAS ASL SLP LPT PTP TPD PDT DTE TEA EAF AFF	GILGFVFTL	CAYGGSQGNLIF	TRAV13-1	TRAJ42	CASLPTPDTEAFF	TRBV13	TRBJ1-1
26520	CAG AGG GGD GDD DDK DKI KII IIF	CSA SAS ASR SRT RTG TGL GLG LGQ GQP QPQ PQH QHF	ELAGIGILTV	CAGGDDKIIF	TRAV12-2	TRAJ30	CSASRTGLGQPQHF	TRBV20-1	TRBJ1-5
35441	CAV AVM VMD MDS DSN SNY NYQ YQL QLI LIW	CSA SAR ARL RLA LAG AGG GGP GPE PET ETQ TQY QYF	KLGGALQAK	CAVMDSNYQLIW	TRAV1-2	TRAJ33	CSARLAGGPETQYF	TRBV20-1	TRBJ2-5
8151	CVG VGY GYT YTN TNA NAG AGK GKS KST STF	CAS ASS SSF SFS FSG SGN GNT NTG TGE GEL ELF LFF	RAKFKQLL	CVGYTNAGKSTF	TRAV10	TRAJ27	CASSFSGNTGELFF	TRBV12-3	TRBJ2-2
15569	CAV AVE VER ERS RSY SYS YSG SGG GGG GGA GAD ADG DGL GLT LTF	CAS ASS SSQ SQV QVE VEG EGL GLG LGT GTE TEA EAF AFF	KLGGALQAK	CAVERSYSGGGADGLTF	TRAV22	TRAJ45	CASSQVEGLGTEAFF	TRBV4-1	TRBJ1-1
33799	CAM AMN MNY NYG YGG GGS GSQ SQG QGN GNL NLI LIF	CAS ASS SST STR TRS RST STD TDT DTQ TQY QYF	GILGFVFTL	CAMNYGGSQGNLIF	TRAV25	TRAJ42	CASSTRSTDTQYF	TRBV19	TRBJ2-3
34064	CAL ALS LSE SEA EAG AGG GGS GSG SGA GAG AGS GSY SYQ YQL QLT LTF	CAS ASS SSM SMT MTG TGN GNQ NQE QET ETQ TQY QYF	KLGGALQAK	CALSEAGGSGAGSYQLTF	TRAV19	TRAJ28	CASSMTGNQETQYF	TRBV12-3	TRBJ2-5
35864	CAM AMR MRE REG EGA GAG AGY GYA YAL ALN LNF	CAS ASS SSI SIL ILA LAG AGY GYY YYN YNE NEQ EQF QFF	KLGGALQAK	CAMREGAGYALNF	TRAV14DV4	TRAJ41	CASSILAGYYNEQFF	TRBV19	TRBJ2-1
34731	CAV AVS VSP SPD PDD DDF DFG FGN GNE NEK EKL KLT LTF	CAS AST STT TTQ TQG QGP GPP PPV PVT VTP TPD PDT DTQ TQY QYF	KLGGALQAK	CAVSPDDFGNEKLTF	TRAV41	TRAJ48	CASTTQGPPVTPDTQYF	TRBV12-4	TRBJ2-3
2460	CAV AVD VDD DDS DSD SDK DKL KLI LIF	CAS ASS SSH SHS HSG SGG GGT GTD TDT DTQ TQY QYF	KLGGALQAK	CAVDDSDKLIF	TRAV39	TRAJ34	CASSHSGGTDTQYF	TRBV12-4	TRBJ2-3
35668	CAA AAF AFT FTS TSG SGT GTY TYK YKY KYI YIF	CAS ASS SSY SYV YVG VGG GGP GPG PGD GDT DTQ TQY QYF	KLGGALQAK	CAAFTSGTYKYIF	TRAV8-3	TRAJ40	CASSYVGGPGDTQYF	TRBV6-5	TRBJ2-3
36220	CAM AMR MRE REG EGA GAG AGG GGN GND NDY DYK YKL KLS LSF	CAS ASS SSL SLG LGT GTG TGA GAR ARG RGY GYT YTF	IVTDFSVIK	CAMREGAGGNDYKLSF	TRAV14DV4	TRAJ20	CASSLGTGARGYTF	TRBV11-2	TRBJ1-2
2809	CAV AVT VTR TRD RDD DDK DKI KII IIF	CAS ASS SSW SWG WGG GGG GGS GSH SHY HYG YGY GYT YTF	IVTDFSVIK	CAVTRDDKIIF	TRAV8-3	TRAJ30	CASSWGGGSHYGYTF	TRBV11-2	TRBJ1-2
161	CAV AVR VRG RGT GTY TYN YNT NTD TDK DKL KLI LIF	CAS ASS SSQ SQG QGV GVI VIT ITE TEA EAF AFF	KLGGALQAK	CAVRGTYNTDKLIF	TRAV20	TRAJ34	CASSQGVITEAFF	TRBV4-1	TRBJ1-1
34271	CAM AMS MSR SRL RLE LEG EGD GDK DKL KLI LIF	CAS ASS SSQ SQE QEG EGG GGF GFT FTD TDT DTQ TQY QYF	KLGGALQAK	CAMSRLEGDKLIF	TRAV12-3	TRAJ34	CASSQEGGFTDTQYF	TRBV4-3	TRBJ2-3
25392	CAD ADE DES ESG SGG GGS GSQ SQG QGN GNL NLI LIF	CAS ASS SSL SLA LAT ATT TTD TDG DGG GGG GGK GKL KLF LFF	RAKFKQLL	CADESGGSQGNLIF	TRAV12-2	TRAJ42	CASSLATTDGGGKLFF	TRBV7-9	TRBJ1-4
