34578	CAV AVG VGR GRF RFR FRG RGG GGS GSN SNY NYK YKL KLT LTF	CAT ATS TSS SSL SLA LAG AGD GDW DWN WNE NEQ EQF QFF	KLGGALQAK	CAVGRFRGGSNYKLTF	TRAV36DV7	TRAJ53	CATSSLAGDWNEQFF	TRBV15	TRBJ2-1
23006	CAW AWN WNP NPD PDN DNY NYG YGQ GQN QNF NFV FVF	CAS ASS SSF SFN FNG NGV GVR VRE RET ETQ TQY QYF	KLGGALQAK	CAWNPDNYGQNFVF	TRAV25	TRAJ26	CASSFNGVRETQYF	TRBV5-4	TRBJ2-5
36257	CAL ALS LSV SVI VIK IKA KAA AAG AGN GNK NKL KLT LTF	CAW AWK WKN KNL NLF LFP FPR PRT RTD TDT DTQ TQY QYF	KLGGALQAK	CALSVIKAAGNKLTF	TRAV19	TRAJ17	CAWKNLFPRTDTQYF	TRBV30	TRBJ2-3
1168	CAA AAM AMD MDS DSN SNY NYQ YQL QLI LIW	CAS ASS SSL SLY LYS YSA SAT ATG TGE GEL ELF LFF	AVFDRKSDAK	CAAMDSNYQLIW	TRAV1-2	TRAJ33	CASSLYSATGELFF	TRBV28	TRBJ2-2
7167	CAG AGA GAL ALG LGS GSS SSN SNT NTG TGK GKL KLI LIF	CAS ASS SSS SSR SRS RSA SAY AYE YEQ EQY QYF	GILGFVFTL	CAGALGSSNTGKLIF	TRAV27	TRAJ37	CASSSRSAYEQYF	TRBV19	TRBJ2-7
34294	CAL ALN LNM NMS MSS SSP SPP PPR PRA RAG AGN GNN NNR NRK RKL KLI LIW	CAS ASS SSL SLI LIS ISG SGH GHH HHL HLM LMN MNT NTE TEA EAF AFF	KLGGALQAK	CALNMSSPPRAGNNRKLIW	TRAV19	TRAJ38	CASSLISGHHLMNTEAFF	TRBV3-1	TRBJ1-1
35194	CIL ILR LRD RDV DVE VED EDM DMR MRF	CAS ASE SES ESD SDG DGT GTD TDE DEY EYS YSN SNQ NQP QPQ PQH QHF	KLGGALQAK	CILRDVEDMRF	TRAV26-2	TRAJ43	CASESDGTDEYSNQPQHF	TRBV7-9	TRBJ1-5
35215	CAL ALG LGE GEL ELF LFS FSA SAS ASK SKI KII IIF	CAS ASS SSF SFN FNG NGA GAP APD PDH DHG HGY GYT YTF	KLGGALQAK	CALGELFSASKIIF	TRDV1	TRAJ3	CASSFNGAPDHGYTF	TRBV7-9	TRBJ1-2
16935	CAL ALS LSE SEF EFE FEG EGA GAG AGN GNN NNR NRK RKL KLI LIW	CAS ASS SSR SRL RLG LGD GDT DTQ TQY QYF	KLGGALQAK	CALSEFEGAGNNRKLIW	TRAV19	TRAJ38	CASSRLGDTQYF	TRBV4-2	TRBJ2-3
6548	CAL ALA LAN ANT NTG TGG GGT GTS TSY SYG YGK GKL KLT LTF	CAS AST STI TII IIP IPG PGL GLA LAG AGP GPR PRE REE EET ETQ TQY QYF	KLGGALQAK	CALANTGGTSYGKLTF	TRAV16	TRAJ52	CASTIIPGLAGPREETQYF	TRBV19	TRBJ2-5
169	CVV VVN VNG NGN GNS NSG SGG GGY GYQ YQK QKV KVT VTF	CAS ASS SSD SDL DLA LAG AGD GDP DPT PTD TDT DTQ TQY QYF	GILGFVFTL	CVVNGNSGGYQKVTF	TRAV12-1	TRAJ13	CASSDLAGDPTDTQYF	TRBV4-2	TRBJ2-3
36244	CAL ALE LEG EGF GFP FPN PNY NYK YKY KYI YIF	CAS ASS SSP SPR PRG RGV GVT VTE TEA EAF AFF	AVFDRKSDAK	CALEGFPNYKYIF	TRAV6	TRAJ40	CASSPRGVTEAFF	TRBV7-9	TRBJ1-1
18088	CAL ALL LLE LEM EMV MVI VIK IKA KAA AAG AGN GNK NKL KLT LTF	CAS ASS SST STD TDR DRA RAA AAQ AQP QPQ PQH QHF	RAKFKQLL	CALLEMVIKAAGNKLTF	TRAV6	TRAJ17	CASSTDRAAQPQHF	TRBV28	TRBJ1-5
4968	CAG AGG GGN GNT NTG TGK GKL KLI LIF	CAS ASS SSL SLG LGQ GQG QGA GAS ASQ SQP QPQ PQH QHF	KLGGALQAK	CAGGNTGKLIF	TRAV3	TRAJ37	CASSLGQGASQPQHF	TRBV7-2	TRBJ1-5
5649	CAE AEI EIS ISF SFR FRD RDD DDK DKI KII IIF	CAS ASS SSI SIN INR NRD RDG DGD GDE DEQ EQF QFF	RAKFKQLL	CAEISFRDDKIIF	TRAV5	TRAJ30	CASSINRDGDEQFF	TRBV19	TRBJ2-1
65	CAL ALS LSL SLK LKY KYN YNF NFN FNK NKF KFY FYF	CAS ASS SSL SLA LAR ART RTE TED EDN DNY NYE YEQ EQY QYF	KLGGALQAK	CALSLKYNFNKFYF	TRAV19	TRAJ21	CASSLARTEDNYEQYF	TRBV12-3	TRBJ2-7
28771	CAE AET ETF TFN FNA NAR ARL RLM LMF	CAS ASS SSY SYG YGF GFP FPT PTS TSG SGG GGN GNT NTG TGE GEL ELF LFF	RAKFKQLL	CAETFNARLMF	TRAV5	TRAJ31	CASSYGFPTSGGNTGELFF	TRBV6-6	TRBJ2-2
16002	CAE AEM EME MEG EGG GGS GSY SYI YIP IPT PTF	CAS ASS SSQ SQE QEG EGQ GQI QIN INQ NQP QPQ PQH QHF	RAKFKQLL	CAEMEGGSYIPTF	TRAV5	TRAJ6	CASSQEGQINQPQHF	TRBV4-2	TRBJ1-5
17965	CAV AVG VGD GDN DNF NFN FNK NKF KFY FYF	CAS ASS SSV SVA VAV AVG VGT GTG TGS GSG SGA GAN ANV NVL VLT LTF	AVFDRKSDAK	CAVGDNFNKFYF	TRAV8-3	TRAJ21	CASSVAVGTGSGANVLTF	TRBV9	TRBJ2-6
24986	CLV LVG VGD GDI DIR IRT RTG TGA GAN ANN NNL NLF LFF	CAS ASS SSL SLV LVF VFT FTG TGG GGA GAG AGN GNE NEQ EQF QFF	KLGGALQAK	CLVGDIRTGANNLFF	TRAV4	TRAJ36	CASSLVFTGGAGNEQFF	TRBV11-2	TRBJ2-1
158	CAV AVG VGA GAR ARR RRN RNS NSG SGA GAG AGS GSY SYQ YQL QLT LTF	CAS ASS SSQ SQE QEP EPL PLT LTD TDT DTQ TQY QYF	KLGGALQAK	CAVGARRNSGAGSYQLTF	TRAV8-3	TRAJ28	CASSQEPLTDTQYF	TRBV4-1	TRBJ2-3
33116	CAF AFM FMI MIG IGA GAG AGG GGT GTS TSY SYG YGK GKL KLT LTF	CAS ASS SSI SIR IRS RSS SSY SYE YEQ EQY QYF	GILGFVFTL	CAFMIGAGGTSYGKLTF	TRAV38-1	TRAJ52	CASSIRSSYEQYF	TRBV19	TRBJ2-7
70	CAA AAG AGD GDD DDK DKI KII IIF	CAS ASS SSP SPR PRG RGE GEK EKL KLF LFF	KLGGALQAK	CAAGDDKIIF	TRAV13-1	TRAJ30	CASSPRGEKLFF	TRBV12-3	TRBJ1-4
38421	CAV AVR VRD RDG DGD GDR DRD RDD DDK DKI KII IIF	CAS ASS SSY SYL YLG LGQ GQG QGD GDA DAY AYG YGY GYT YTF	KLGGALQAK	CAVRDGDRDDKIIF	TRAV1-1	TRAJ30	CASSYLGQGDAYGYTF	TRBV6-3	TRBJ1-2
2368	CAE AEM EME MEG EGG GGS GSY SYI YIP IPT PTF	CAS ASS SSL SLR LRG RGD GDR DRG RGD GDT DTQ TQY QYF	KLGGALQAK	CAEMEGGSYIPTF	TRAV5	TRAJ6	CASSLRGDRGDTQYF	TRBV27	TRBJ2-3
35447	CAL ALL LLD LDS DSW SWG WGK GKL KLQ LQF	CSA SAR ARR RRG RGE GEK EKE KET ETQ TQY QYF	KLGGALQAK	CALLDSWGKLQF	TRAV1-1	TRAJ24	CSARRGEKETQYF	TRBV20-1	TRBJ2-5
35320	CAA AAT ATV TVT VTG TGN GNQ NQF QFY FYF	CAW AWK WKL KLL LLV LVS VST STG TGE GEL ELF LFF	KLGGALQAK	CAATVTGNQFYF	TRAV29DV5	TRAJ49	CAWKLLVSTGELFF	TRBV30	TRBJ2-2
34287	CAV AVN VNA NAQ AQV QVS VSW SWG WGK GKL KLQ LQF	CAS ASS SSR SRE RET ETG TGG GGA GAK AKN KNI NIQ IQY QYF	KLGGALQAK	CAVNAQVSWGKLQF	TRAV8-1	TRAJ24	CASSRETGGAKNIQYF	TRBV4-3	TRBJ2-4
35265	CAE AES ESI SIA IAG AGY GYQ YQK QKV KVT VTF	CAS ASS SSS SSG SGR GRD RDT DTE TEA EAF AFF	KLGGALQAK	CAESIAGYQKVTF	TRAV5	TRAJ13	CASSSGRDTEAFF	TRBV7-9	TRBJ1-1
2305	CAG AGV GVE VEY EYG YGG GGS GSQ SQG QGN GNL NLI LIF	CAT ATS TSR SRD RDR DRA RAG AGG GGA GAN ANY NYG YGY GYT YTF	KLGGALQAK	CAGVEYGGSQGNLIF	TRAV27	TRAJ42	CATSRDRAGGANYGYTF	TRBV15	TRBJ1-2
28606	CAE AET ETT TTG TGA GAL ALY LYS YSG SGA GAG AGS GSY SYQ YQL QLT LTF	CAS ASS SSD SDT DTE TET ETG TGG GGL GLE LET ETQ TQY QYF	ELAGIGILTV	CAETTGALYSGAGSYQLTF	TRAV5	TRAJ28	CASSDTETGGLETQYF	TRBV6-1	TRBJ2-5
16053	CAV AVG VGA GAE AET ETS TSY SYD YDK DKV KVI VIF	CAS ASS SSQ SQR QRP RPS PSE SEV EVG VGE GEL ELF LFF	RAKFKQLL	CAVGAETSYDKVIF	TRAV8-3	TRAJ50	CASSQRPSEVGELFF	TRBV4-2	TRBJ2-2
19789	CAV AVI VIR IRW RWG WGD GDM DMR MRF	CAS ASS SSL SLR LRD RDG DGS GSE SEA EAF AFF	RAKFKQLL	CAVIRWGDMRF	TRAV3	TRAJ43	CASSLRDGSEAFF	TRBV5-6	TRBJ1-1
5070	CIL ILA LAE AET ETS TSY SYD YDK DKV KVI VIF	CAS ASS SSL SLT LTF TFS FSG SGA GAN ANV NVL VLT LTF	RAKFKQLL	CILAETSYDKVIF	TRAV26-2	TRAJ50	CASSLTFSGANVLTF	TRBV7-9	TRBJ2-6
25075	CGT GTE TEY EYP YPN PND NDY DYK YKL KLS LSF	CAS ASS SSL SLG LGG GGN GNN NNE NEQ EQF QFF	GLCTLVAML	CGTEYPNDYKLSF	TRAV30	TRAJ20	CASSLGGNNEQFF	TRBV7-8	TRBJ2-1
35737	CIV IVR VRV RVA VAY AYQ YQT QTG TGA GAN ANN NNL NLF LFF	CAS AST STK TKL KLA LAQ AQS QSS SSY SYE YEQ EQY QYF	KLGGALQAK	CIVRVAYQTGANNLFF	TRAV26-1	TRAJ36	CASTKLAQSSYEQYF	TRBV6-3	TRBJ2-7
23222	CAV AVL VLG LGG GGS GSA SAR ARQ RQL QLT LTF	CAS ASS SSH SHF HFP FPP PPP PPY PYE YEQ EQY QYF	KLGGALQAK	CAVLGGSARQLTF	TRAV20	TRAJ22	CASSHFPPPYEQYF	TRBV27	TRBJ2-7
35806	CGT GTF TFD FDR DRG RGS GST STL TLG LGR GRL RLY LYF	CAS ASR SRT RTL TLA LAG AGG GGS GSS SSE SEQ EQF QFF	KLGGALQAK	CGTFDRGSTLGRLYF	TRAV30	TRAJ18	CASRTLAGGSSEQFF	TRBV19	TRBJ2-1
35271	CAV AVF VFN FNQ NQA QAG AGT GTA TAL ALI LIF	CAS ASS SSS SSV SVG VGT GTE TEA EAF AFF	KLGGALQAK	CAVFNQAGTALIF	TRAV12-2	TRAJ15	CASSSVGTEAFF	TRBV7-9	TRBJ1-1
18333	CAV AVN VNA NAV AVS VSN SNQ NQA QAG AGT GTA TAL ALI LIF	CAS ASS SSL SLR LRD RDG DGS GSE SEA EAF AFF	RAKFKQLL	CAVNAVSNQAGTALIF	TRAV8-1	TRAJ15	CASSLRDGSEAFF	TRBV5-6	TRBJ1-1
34401	CVG VGP GPN PNY NYG YGG GGS GSQ SQG QGN GNL NLI LIF	CAS ASS SSV SVE VEA EAG AGW GWD WDE DEQ EQF QFF	KLGGALQAK	CVGPNYGGSQGNLIF	TRAV12-1	TRAJ42	CASSVEAGWDEQFF	TRBV9	TRBJ2-1
36286	CAV AVF VFP FPM PMG MGG GGY GYN YNK NKL KLI LIF	CSA SAR ARR RRG RGD GDT DTD TDT DTQ TQY QYF	KLGGALQAK	CAVFPMGGYNKLIF	TRAV21	TRAJ4	CSARRGDTDTQYF	TRBV20-1	TRBJ2-3
34693	CAL ALT LTH THG HGS GSG SGN GNT NTG TGK GKL KLI LIF	CAS ASS SSS SSN SNP NPP PPE PEA EAV AVY VYG YGY GYT YTF	KLGGALQAK	CALTHGSGNTGKLIF	TRDV1	TRAJ37	CASSSNPPEAVYGYTF	TRBV27	TRBJ1-2
35372	CAV AVK VKD KDN DNY NYG YGQ GQN QNF NFV FVF	CSA SAS ASG SGL GLS LSS SSY SYE YEQ EQY QYV	KLGGALQAK	CAVKDNYGQNFVF	TRAV1-2	TRAJ26	CSASGLSSYEQYV	TRBV20-1	TRBJ2-7
24340	CAG AGA GAR ARG RGG GGS GSG SGA GAG AGS GSY SYQ YQL QLT LTF	CAI AIS ISA SAY AYS YSR SRN RNT NTE TEA EAF AFF	KLGGALQAK	CAGARGGSGAGSYQLTF	TRAV27	TRAJ28	CAISAYSRNTEAFF	TRBV10-3	TRBJ1-1
14623	CAV AVR VRE RET ETS TSY SYD YDK DKV KVI VIF	CAS ASS SSP SPW PWA WAD ADV DVV VVT VTD TDT DTQ TQY QYF	RAKFKQLL	CAVRETSYDKVIF	TRAV8-1	TRAJ50	CASSPWADVVTDTQYF	TRBV18	TRBJ2-3
627	CAV AVG VGV GVQ VQG QGA GAQ AQK QKL KLV LVF	CAS ASS SSV SVD VDS DSG SGA GAG AGT GTE TEA EAF AFF	ELAGIGILTV	CAVGVQGAQKLVF	TRAV12-2	TRAJ54	CASSVDSGAGTEAFF	TRBV9	TRBJ1-1
23233	CAV AVG VGG GGG GGA GAD ADG DGL GLT LTF	CAS ASS SSL SLG LGG GGL GLG LGG GGS GSE SEQ EQY QYF	ELAGIGILTV	CAVGGGADGLTF	TRAV12-2	TRAJ45	CASSLGGLGGSEQYF	TRBV27	TRBJ2-7
104	CGT GTD TDS DSN SND NDY DYK YKL KLS LSF	CAR ARQ RQP QPL PLR LRG RGA GAN ANV NVL VLT LTF	KLGGALQAK	CGTDSNDYKLSF	TRAV30	TRAJ20	CARQPLRGANVLTF	TRBV2	TRBJ2-6
35646	CAL ALG LGN GNS NSG SGN GNT NTP TPL PLV LVF	CAS ASS SSS SSW SWN WNT NTE TEA EAF AFF	KLGGALQAK	CALGNSGNTPLVF	TRDV1	TRAJ29	CASSSWNTEAFF	TRBV6-5	TRBJ1-1
34433	CAV AVL VLS LSA SAS ASV SVS VSN SNY NYK YKL KLT LTF	CAS ASS SSL SLA LAR ARG RGL GLS LSP SPD PDT DTQ TQY QYF	KLGGALQAK	CAVLSASVSNYKLTF	TRAV12-2	TRAJ53	CASSLARGLSPDTQYF	TRBV28	TRBJ2-3
35136	CAV AVV VVS VSN SNN NNN NND NDM DMR MRF	CAS ASS SSD SDS DSY SYS YSY SYG YGY GYT YTF	KLGGALQAK	CAVVSNNNDMRF	TRAV21	TRAJ43	CASSDSYSYGYTF	TRBV7-9	TRBJ1-2
2335	CAL ALP LPS PSG SGG GGY GYN YNK NKL KLI LIF	CAS ASS SSF SFG FGQ GQG QGG GGE GEK EKL KLF LFF	GILGFVFTL	CALPSGGYNKLIF	TRAV9-2	TRAJ4	CASSFGQGGEKLFF	TRBV27	TRBJ1-4
11482	CAE AET ETQ TQD QDS DSN SNY NYQ YQL QLI LIW	CAS ASS SSF SFS FSG SGN GNT NTG TGE GEL ELF LFF	RAKFKQLL	CAETQDSNYQLIW	TRAV5	TRAJ33	CASSFSGNTGELFF	TRBV12-3	TRBJ2-2
35322	CAV AVR VRP RPL PLT LTG TGG GGG GGN GNK NKL KLT LTF	CAW AWN WNP NPG PGP GPS PSY SYG YGE GEQ EQF QFF	KLGGALQAK	CAVRPLTGGGNKLTF	TRAV20	TRAJ10	CAWNPGPSYGEQFF	TRBV30	TRBJ2-1
2440	CAL ALG LGE GEL ELG LGA GAG AGA GAG AGS GSY SYQ YQL QLT LTF	CAS ASS SSL SLG LGQ GQG QGV GVF VFY FYT YTF	IVTDFSVIK	CALGELGAGAGSYQLTF	TRDV1	TRAJ28	CASSLGQGVFYTF	TRBV5-1	TRBJ1-2
34407	CAM AMR MRE REG EGF GFV FVP VPG PGG GGT GTS TSY SYG YGK GKL KLT LTF	CAS ASS SSV SVG VGA GAS ASP SPC PCD CDF DFF	KLGGALQAK	CAMREGFVPGGTSYGKLTF	TRAV14DV4	TRAJ52	CASSVGASPCDFF	TRBV9	TRBJ1-1
26139	CAA AAA AAE AET ETS TSY SYD YDK DKV KVI VIF	CSA SAP APG PGE GEG EGY GYG YGN GNT NTI TIY IYF	RAKFKQLL	CAAAETSYDKVIF	TRAV13-1	TRAJ50	CSAPGEGYGNTIYF	TRBV20-1	TRBJ1-3
24308	CAS ASP SPS PSG SGN GNT NTP TPL PLV LVF	CAS ASS SSE SEV EVV VVL VLA LAG AGG GGQ GQS QSE SEQ EQF QFF	ELAGIGILTV	CASPSGNTPLVF	TRAV12-2	TRAJ29	CASSEVVLAGGQSEQFF	TRBV10-1	TRBJ2-1
5076	CAE AEI EIV IVG VGQ GQL QLT LTF	CAS ASS SSP SPG PGG GGL GLE LEN ENE NEQ EQY QYF	KLGGALQAK	CAEIVGQLTF	TRAV5	TRAJ22	CASSPGGLENEQYF	TRBV7-9	TRBJ2-7
24307	CAE AEN ENK NKG KGG GGG GGS GSQ SQG QGN GNL NLI LIF	CAS ASS SSD SDR DRD RDH DHR HRR RRF RFF	GILGFVFTL	CAENKGGGSQGNLIF	TRAV13-2	TRAJ42	CASSDRDHRRFF	TRBV10-1	TRBJ1-4
5031	CAF AFM FMK MKG KGA GAG AGG GGT GTS TSY SYG YGK GKL KLT LTF	CAS ASS SSP SPG PGH GHP HPS PSS SSY SYN YNE NEQ EQF QFF	GILGFVFTL	CAFMKGAGGTSYGKLTF	TRAV38-1	TRAJ52	CASSPGHPSSYNEQFF	TRBV7-9	TRBJ2-1
23347	CGT GTE TEY EYP YPN PND NDY DYK YKL KLS LSF	CAS ASS SSL SLS LSG SGR GRP RPY PYE YEQ EQY QYF	RAKFKQLL	CGTEYPNDYKLSF	TRAV30	TRAJ20	CASSLSGRPYEQYF	TRBV27	TRBJ2-7
36316	CAM AMS MSR SRG RGG GGG GGA GAD ADG DGL GLT LTF	CAS ASS SST STP TPG PGQ GQG QGA GAG AGE GEQ EQF QFF	KLGGALQAK	CAMSRGGGADGLTF	TRAV12-3	TRAJ45	CASSTPGQGAGEQFF	TRBV6-5	TRBJ2-1
23371	CAY AYR YRV RVD VDN DNA NAR ARL RLM LMF	CAS ASS SSL SLS LSM SMG MGG GGA GAG AGE GEL ELF LFF	KLGGALQAK	CAYRVDNARLMF	TRAV38-2DV8	TRAJ31	CASSLSMGGAGELFF	TRBV27	TRBJ2-2
11815	CAA AAR ARV RVR VRG RGF GFG FGN GNV NVL VLH LHC	CAS ASS SSF SFS FSG SGN GNT NTG TGE GEL ELF LFF	AVFDRKSDAK	CAARVRGFGNVLHC	TRAV13-1	TRAJ35	CASSFSGNTGELFF	TRBV12-3	TRBJ2-2
5021	CAL ALG LGD GDL DLI LIS ISG SGG GGG GGA GAD ADG DGL GLT LTF	CAS ASS SSS SSG SGG GGT GTY TYG YGY GYT YTF	KLGGALQAK	CALGDLISGGGADGLTF	TRDV1	TRAJ45	CASSSGGTYGYTF	TRBV7-2	TRBJ1-2
18065	CAV AVD VDS DSN SNA NAG AGN GNM NML MLT LTF	CAS ASS SSF SFS FSS SSE SET ETQ TQY QYF	KLGGALQAK	CAVDSNAGNMLTF	TRAV12-2	TRAJ39	CASSFSSETQYF	TRBV28	TRBJ2-5
34241	CAV AVR VRD RDR DRS RSQ SQP QPG PGA GAG AGS GSY SYQ YQL QLT LTF	CAS ASS SSR SRT RTK TKG KGG GGK GKE KET ETQ TQY QYF	IVTDFSVIK	CAVRDRSQPGAGSYQLTF	TRAV1-2	TRAJ28	CASSRTKGGKETQYF	TRBV4-2	TRBJ2-5
9790	CAV AVG VGD GDN DNF NFN FNK NKS KSY SYF	CAS ASS SSF SFS FSG SGN GNT NTG TGE GEL ELF LFF	RAKFKQLL	CAVGDNFNKSYF	TRAV8-3	TRAJ21	CASSFSGNTGELFF	TRBV12-3	TRBJ2-2
22985	CIL ILK LKI KIT ITG TGN GNQ NQF QFY FYF	CAS ASS SSL SLE LEL ELN LNS NSA SAT ATN TNE NEK EKL KLF LFF	KLGGALQAK	CILKITGNQFYF	TRAV26-2	TRAJ49	CASSLELNSATNEKLFF	TRBV5-5	TRBJ1-4
14190	CAE AET ETQ TQD QDS DSN SNY NYQ YQL QLI LIW	CAS ASS SSS SSS SSS SST STG TGE GEL ELF LFF	RAKFKQLL	CAETQDSNYQLIW	TRAV5	TRAJ33	CASSSSSTGELFF	TRBV12-3	TRBJ2-2
10972	CAY AYR YRS RSL SLT LTS TSG SGT GTY TYK YKY KYI YIF	CAS ASS SSF SFS FSG SGN GNT NTG TGE GEL ELF LFF	RAKFKQLL	CAYRSLTSGTYKYIF	TRAV38-2DV8	TRAJ40	CASSFSGNTGELFF	TRBV12-3	TRBJ2-2
34544	CAL ALS LSG SGA GAP APS PSG SGT GTY TYK YKY KYI YIF	CAS ASS SSL SLP LPS PSS SSN SNY NYG YGY GYT YTF	KLGGALQAK	CALSGAPSGTYKYIF	TRAV19	TRAJ40	CASSLPSSNYGYTF	TRBV5-4	TRBJ1-2
27070	CVV VVN VNI NID IDN DNA NAR ARL RLM LMF	CST STG TGQ GQG QGP GPY PYE YEQ EQY QYF	RAKFKQLL	CVVNIDNARLMF	TRAV12-1	TRAJ31	CSTGQGPYEQYF	TRBV29-1	TRBJ2-7
279	CAV AVR VRE RER ERD RDY DYK YKL KLS LSF	CAS ASS SSA SAM AMD MDR DRG RGA GAD ADG DGY GYT YTF	KLGGALQAK	CAVRERDYKLSF	TRAV1-2	TRAJ20	CASSAMDRGADGYTF	TRBV9	TRBJ1-2
32755	CAV AVE VED EDR DRD RDN DNY NYG YGQ GQN QNF NFV FVF	CAS ASS SSI SIR IRS RSS SSY SYE YEQ EQY QYF	GILGFVFTL	CAVEDRDNYGQNFVF	TRAV2	TRAJ26	CASSIRSSYEQYF	TRBV19	TRBJ2-7
9392	CAA AAA AAE AET ETS TSY SYD YDK DKV KVI VIF	CAS ASS SSF SFS FSG SGN GNT NTG TGE GEL ELF LFF	RAKFKQLL	CAAAETSYDKVIF	TRAV13-1	TRAJ50	CASSFSGNTGELFF	TRBV12-3	TRBJ2-2
7315	CAA AAR ARE REG EGG GGG GGS GSQ SQG QGN GNL NLI LIF	CAS ASS SSI SIR IRS RSS SSN SNE NEQ EQY QYF	GILGFVFTL	CAAREGGGSQGNLIF	TRAV29DV5	TRAJ42	CASSIRSSNEQYF	TRBV19	TRBJ2-7
34800	CAV AVN VNA NAG AGG GGG GGS GSQ SQG QGN GNL NLI LIF	CAS ASF SFD FDS DSM SMN MNT NTE TEA EAF AFF	KLGGALQAK	CAVNAGGGSQGNLIF	TRAV8-1	TRAJ42	CASFDSMNTEAFF	TRBV12-4	TRBJ1-1
6807	CST STG TGG GGS GSQ SQG QGN GNL NLI LIF	CAS ASS SSI SIR IRS RSS SSY SYE YEQ EQY QYF	GILGFVFTL	CSTGGSQGNLIF	TRAV27	TRAJ42	CASSIRSSYEQYF	TRBV19	TRBJ2-7
16526	CAE AEN ENR NRG RGT GTA TAL ALI LIF	CAS ASS SSQ SQR QRP RPS PSE SEV EVG VGE GEL ELF LFF	RAKFKQLL	CAENRGTALIF	TRAV13-2	TRAJ15	CASSQRPSEVGELFF	TRBV4-2	TRBJ2-2
34133	CAV AVP VPN PNF NFG FGN GNE NEK EKL KLT LTF	CAS ASS SSF SFT FTG TGS GSD SDT DTG TGE GEL ELF LFF	KLGGALQAK	CAVPNFGNEKLTF	TRAV21	TRAJ48	CASSFTGSDTGELFF	TRBV2	TRBJ2-2
28473	CAG AGP GPE PEG EGS GSN SNY NYQ YQL QLI LIW	CAS ASS SSS SSG SGS GSR SRR RRP RPQ PQH QHF	AVFDRKSDAK	CAGPEGSNYQLIW	TRAV25	TRAJ33	CASSSGSRRPQHF	TRBV6-5	TRBJ1-5
35756	CAV AVE VED EDS DSS SSG SGY GYA YAL ALN LNF	CAS ASS SSW SWI WIQ IQR QRP RPD PDY DYG YGY GYT YTF	KLGGALQAK	CAVEDSSGYALNF	TRAV2	TRAJ41	CASSWIQRPDYGYTF	TRBV6-3	TRBJ1-2
24218	CAE AEN ENM NMG MGD GDS DSS SSY SYK YKL KLI LIF	CAS ASR SRP RPL PLG LGG GGT GTE TEE EEQ EQY QYF	KLGGALQAK	CAENMGDSSYKLIF	TRAV13-2	TRAJ12	CASRPLGGTEEQYF	TRBV12-4	TRBJ2-7
35570	CLV LVG VGE GEL ELG LGG GGG GGN GNK NKL KLT LTF	CSV SVP VPS PSS SSN SNT NTE TEA EAF AFF	KLGGALQAK	CLVGELGGGNKLTF	TRAV4	TRAJ10	CSVPSSNTEAFF	TRBV29-1	TRBJ1-1
5238	CIL ILS LSS SSG SGT GTY TYK YKY KYI YIF	CSA SAP APT PTP TPL PLL LLA LAG AGG GGY GYN YNE NEQ EQF QFF	GILGFVFTL	CILSSGTYKYIF	TRAV26-2	TRAJ40	CSAPTPLLAGGYNEQFF	TRBV20-1	TRBJ2-1
33506	CAA AAP APY PYS YSS SSN SNT NTG TGK GKL KLI LIF	CAS ASS SSP SPR PRA RAG AGW GWE WET ETQ TQY QYF	GILGFVFTL	CAAPYSSNTGKLIF	TRAV13-1	TRAJ37	CASSPRAGWETQYF	TRBV19	TRBJ2-5
18072	CAL ALR LRE RET ETS TSY SYD YDK DKV KVI VIF	CAS ASS SSL SLY LYS YSA SAT ATG TGE GEL ELF LFF	RAKFKQLL	CALRETSYDKVIF	TRAV9-2	TRAJ50	CASSLYSATGELFF	TRBV28	TRBJ2-2
30546	CVG VGY GYT YTN TNA NAG AGK GKS KST STF	CAS ASS SSI SIR IRS RSS SSY SYE YEQ EQY QYF	RAKFKQLL	CVGYTNAGKSTF	TRAV10	TRAJ27	CASSIRSSYEQYF	TRBV19	TRBJ2-7
34760	CVA VAL ALD LDS DSN SNY NYQ YQL QLI LIW	CAS ASS SSL SLG LGQ GQG QGP GPD PDG DGY GYT YTF	KLGGALQAK	CVALDSNYQLIW	TRAV12-1	TRAJ33	CASSLGQGPDGYTF	TRBV5-1	TRBJ1-2
34701	CAV AVR VRD RDI DIS ISG SGA GAR ARL RLM LMF	CAS ASS SSV SVR VRT RTS TSG SGG GGQ GQE QET ETQ TQY QYF	KLGGALQAK	CAVRDISGARLMF	TRAV3	TRAJ31	CASSVRTSGGQETQYF	TRBV27	TRBJ2-5
5126	CAY AYR YRG RGS GSD SDS DSG SGN GNT NTP TPL PLV LVF	CAW AWN WNK NKY KYG YGS GSL SLT LTY TYG YGY GYT YTF	RAKFKQLL	CAYRGSDSGNTPLVF	TRAV38-2DV8	TRAJ29	CAWNKYGSLTYGYTF	TRBV30	TRBJ1-2
2531	CAA AAT ATP TPY PYN YNT NTD TDK DKL KLI LIF	CAS ASS SSR SRF RFG FGD GDT DTE TEA EAF AFF	KLGGALQAK	CAATPYNTDKLIF	TRAV13-1	TRAJ34	CASSRFGDTEAFF	TRBV7-3	TRBJ1-1
5262	CAV AVG VGF GFN FNF NFG FGN GNE NEK EKL KLT LTF	CSA SAS ASW SWG WGD GDY DYT YTE TEA EAF AFF	GILGFVFTL	CAVGFNFGNEKLTF	TRAV8-3	TRAJ48	CSASWGDYTEAFF	TRBV20-1	TRBJ1-1
26547	CAV AVT VTR TRP RPM PMG MGA GAG AGS GSY SYQ YQL QLT LTF	CSG SGH GHP HPN PNE NEQ EQF QFF	KLGGALQAK	CAVTRPMGAGSYQLTF	TRAV12-2	TRAJ28	CSGHPNEQFF	TRBV20-1	TRBJ2-1
30542	CVV VVN VNI NIG IGG GGG GGS GSQ SQG QGN GNL NLI LIF	CAS ASS SSI SIR IRS RSS SSY SYE YEQ EQY QYF	GILGFVFTL	CVVNIGGGSQGNLIF	TRAV12-1	TRAJ42	CASSIRSSYEQYF	TRBV19	TRBJ2-7
14333	CAA AAM AME MET ETS TSY SYD YDK DKV KVI VIF	CAS ASS SSP SPR PRK RKD KDS DST STG TGE GEL ELF LFF	RAKFKQLL	CAAMETSYDKVIF	TRAV13-1	TRAJ50	CASSPRKDSTGELFF	TRBV18	TRBJ2-2
35672	CAY AYI YIN INT NTG TGA GAN ANS NSK SKL KLT LTF	CAS ASS SSY SYW YWG WGL GLA LAG AGG GGT GTD TDT DTQ TQY QYF	KLGGALQAK	CAYINTGANSKLTF	TRAV38-2DV8	TRAJ56	CASSYWGLAGGTDTQYF	TRBV6-5	TRBJ2-3
23127	CAV AVN VNA NAG AGN GNM NML MLT LTF	CAT ATS TSR SRG RGQ GQG QGN GNE NEQ EQY QYF	ELAGIGILTV	CAVNAGNMLTF	TRAV12-2	TRAJ39	CATSRGQGNEQYF	TRBV15	TRBJ2-7
33997	CAV AVR VRR RRY RYS YSG SGG GGG GGA GAD ADG DGL GLT LTF	CAT ATS TSG SGL GLS LSA SAS ASG SGG GGY GYT YTF	KLGGALQAK	CAVRRYSGGGADGLTF	TRAV8-4	TRAJ45	CATSGLSASGGYTF	TRBV24-1	TRBJ1-2
12455	CAA AAS ASI SIP IPN PNQ NQA QAG AGT GTA TAL ALI LIF	CAS ASS SSF SFS FSG SGN GNT NTG TGE GEL ELF LFF	RAKFKQLL	CAASIPNQAGTALIF	TRAV13-1	TRAJ15	CASSFSGNTGELFF	TRBV12-3	TRBJ2-2
30413	CAL ALK LKA KAG AGT GTA TAL ALI LIF	CAS ASS SSI SIR IRA RAS ASY SYE YEQ EQY QYF	GILGFVFTL	CALKAGTALIF	TRAV6	TRAJ15	CASSIRASYEQYF	TRBV19	TRBJ2-7
6355	CIV IVF VFY FYN YNQ NQG QGG GGK GKL KLI LIF	CAS ASS SST STR TRS RSS SSY SYE YEQ EQY QYF	GILGFVFTL	CIVFYNQGGKLIF	TRAV26-1	TRAJ23	CASSTRSSYEQYF	TRBV19	TRBJ2-7
36093	CAF AFE FEW EWG WGN GNN NNN NNN NND NDM DMR MRF	CAS ASS SSQ SQG QGG GGQ GQG QGA GAT ATE TEA EAF AFF	KLGGALQAK	CAFEWGNNNNDMRF	TRAV38-1	TRAJ43	CASSQGGQGATEAFF	TRBV4-3	TRBJ1-1
31490	CVP VPV PVT VTL TLG LGV GVN VNR NRD RDD DDK DKI KII IIF	CAS ASS SSQ SQF QFF FFG FGN GNT NTI TIY IYF	GILGFVFTL	CVPVTLGVNRDDKIIF	TRAV20	TRAJ30	CASSQFFGNTIYF	TRBV19	TRBJ1-3
35172	CAV AVR VRM RMD MDY DYK YKL KLS LSF	CAS ASS SSP SPE PED EDG DGP GPY PYN YNE NEQ EQF QFF	KLGGALQAK	CAVRMDYKLSF	TRAV1-2	TRAJ20	CASSPEDGPYNEQFF	TRBV7-9	TRBJ2-1
7680	CAA AAS ASE SET ETS TSY SYD YDK DKV KVI VIF	CAS ASQ SQP QPH PHG HGT GTG TGD GDH DHE HEQ EQY QYF	RAKFKQLL	CAASETSYDKVIF	TRAV13-1	TRAJ50	CASQPHGTGDHEQYF	TRBV12-3	TRBJ2-7
6683	CAG AGA GAG AGV GVG VGY GYG YGG GGS GSQ SQG QGN GNL NLI LIF	CAS ASS SSI SIR IRS RSA SAY AYE YEQ EQY QYF	GILGFVFTL	CAGAGVGYGGSQGNLIF	TRAV27	TRAJ42	CASSIRSAYEQYF	TRBV19	TRBJ2-7
10423	CAA AAS ASG SGY GYD YDY DYK YKL KLS LSF	CAS ASS SSF SFS FSG SGN GNT NTG TGE GEL ELF LFF	RAKFKQLL	CAASGYDYKLSF	TRAV13-1	TRAJ20	CASSFSGNTGELFF	TRBV12-3	TRBJ2-2
34282	CAM AMR MRE RER ERL RLY LYN YNT NTD TDK DKL KLI LIF	CAS ASS SSQ SQP QPS PSS SSV SVE VEQ EQF QFF	KLGGALQAK	CAMRERLYNTDKLIF	TRAV14DV4	TRAJ34	CASSQPSSVEQFF	TRBV4-3	TRBJ2-1
18039	CIL ILW LWV WVA VAA AAG AGN GNK NKL KLT LTF	CAS ASS SSV SVR VRS RSS SSM SMN MNT NTE TEA EAF AFF	AVFDRKSDAK	CILWVAAGNKLTF	TRAV26-1	TRAJ17	CASSVRSSMNTEAFF	TRBV9	TRBJ1-1
35641	CAE AEN ENM NMR MRA RAG AGN GNM NML MLT LTF	CAS ASS SSS SSF SFM FMG MGN GNQ NQP QPQ PQH QHF	KLGGALQAK	CAENMRAGNMLTF	TRAV13-2	TRAJ39	CASSSFMGNQPQHF	TRBV6-5	TRBJ1-5
2423	CAV AVG VGA GAN ANS NSG SGY GYS YST STL TLT LTF	CAS ASS SSL SLE LEG EGQ GQG QGG GGS GSP SPL PLH LHF	ELAGIGILTV	CAVGANSGYSTLTF	TRAV12-2	TRAJ11	CASSLEGQGGSPLHF	TRBV5-1	TRBJ1-6
25016	CAV AVM VMK MKD KDP DPN PNA NAG AGG GGT GTS TSY SYG YGK GKL KLT LTF	CAS ASS SSW SWG WGG GGG GGS GSH SHY HYG YGY GYT YTF	IVTDFSVIK	CAVMKDPNAGGTSYGKLTF	TRAV21	TRAJ52	CASSWGGGSHYGYTF	TRBV11-2	TRBJ1-2
35267	CAS ASG SGS GSN SNY NYK YKL KLT LTF	CAS ASS SSS SSN SND NDR DRY RYG YGT GTE TEA EAF AFF	KLGGALQAK	CASGSNYKLTF	TRAV38-2DV8	TRAJ53	CASSSNDRYGTEAFF	TRBV7-9	TRBJ1-1
35084	CAV AVD VDF DFG FGA GAG AGS GSY SYQ YQL QLT LTF	CAS ASR SRN RNR NRG RGG GGG GGA GAH AHN HNT NTQ TQY QYF	KLGGALQAK	CAVDFGAGSYQLTF	TRAV22	TRAJ28	CASRNRGGGAHNTQYF	TRBV7-2	TRBJ2-3
23492	CAE AEI EIP IPL PLN LNT NTG TGF GFQ FQK QKL KLV LVF	CAS ASS SSP SPH PHF HFQ FQV QVD VDT DTG TGE GEL ELF LFF	RAKFKQLL	CAEIPLNTGFQKLVF	TRAV5	TRAJ8	CASSPHFQVDTGELFF	TRBV27	TRBJ2-2
5672	CAG AGG GGG GGS GSQ SQG QGN GNL NLI LIF	CAS ASS SSI SIR IRA RAS ASY SYE YEQ EQY QYF	GILGFVFTL	CAGGGSQGNLIF	TRAV27	TRAJ42	CASSIRASYEQYF	TRBV19	TRBJ2-7
34157	CAV AVD VDS DSG SGY GYS YST STL TLT LTF	CAS ASS SSP SPP PPD PDS DSY SYE YEQ EQY QYF	KLGGALQAK	CAVDSGYSTLTF	TRAV25	TRAJ11	CASSPPDSYEQYF	TRBV4-1	TRBJ2-7
2404	CVV VVS VSD SDY DYR YRD RDD DDK DKI KII IIF	CAS AST STQ TQN QNR NRE REN ENT NTE TEA EAF AFF	KLGGALQAK	CVVSDYRDDKIIF	TRAV8-2	TRAJ30	CASTQNRENTEAFF	TRBV27	TRBJ1-1
35889	CAF AFM FMN MNY NYG YGG GGS GSQ SQG QGN GNL NLI LIF	CAS ASS SSI SIV IVP VPL PLG LGQ GQG QGL GLG LGT GTL TLH LHF	KLGGALQAK	CAFMNYGGSQGNLIF	TRAV38-1	TRAJ42	CASSIVPLGQGLGTLHF	TRBV19	TRBJ1-6
35263	CAM AMK MKK KKT KTS TSY SYD YDK DKV KVI VIF	CAS ASS SSS SSG SGQ GQG QGA GAK AKT KTE TEA EAF AFF	KLGGALQAK	CAMKKTSYDKVIF	TRAV12-3	TRAJ50	CASSSGQGAKTEAFF	TRBV7-9	TRBJ1-1
26628	CAL ALH LHR HRG RGT GTS TSY SYG YGK GKL KLT LTF	CSA SAG AGG GGN GNT NTE TEA EAF AFF	RAKFKQLL	CALHRGTSYGKLTF	TRAV38-1	TRAJ52	CSAGGNTEAFF	TRBV29-1	TRBJ1-1
26254	CAV AVG VGQ GQN QNN NNA NAR ARL RLM LMF	CSA SAR ARD RDI DIE IER ERT RTG TGE GEL ELF LFF	KLGGALQAK	CAVGQNNARLMF	TRAV39	TRAJ31	CSARDIERTGELFF	TRBV20-1	TRBJ2-2
34926	CAV AVS VSP SPN PNQ NQG QGG GGK GKL KLI LIF	CAI AIG IGN GNS NSW SWR WRT RTN TNT NTG TGE GEL ELF LFF	KLGGALQAK	CAVSPNQGGKLIF	TRAV8-4	TRAJ23	CAIGNSWRTNTGELFF	TRBV10-3	TRBJ2-2
25771	CAA AAE AEE EET ETS TSY SYD YDK DKV KVI VIF	CAS ASS SSR SRL RLG LGQ GQG QGA GAI AIT ITE TEA EAF AFF	RAKFKQLL	CAAEETSYDKVIF	TRAV13-1	TRAJ50	CASSRLGQGAITEAFF	TRBV7-9	TRBJ1-1
33390	CAV AVR VRD RDG DGT GTG TGA GAN ANN NNL NLF LFF	CAS ASS SSI SIT ITS TST STG TGE GEL ELF LFF	GILGFVFTL	CAVRDGTGANNLFF	TRAV3	TRAJ36	CASSITSTGELFF	TRBV19	TRBJ2-2
26220	CAL ALS LSE SEP EPN PNS NSG SGG GGG GGA GAD ADG DGL GLT LTF	CSA SAR ARD RDD DDS DSG SGQ GQG QGF GFG FGF GFL FLE LET ETQ TQY QYF	GLCTLVAML	CALSEPNSGGGADGLTF	TRAV19	TRAJ45	CSARDDSGQGFGFLETQYF	TRBV20-1	TRBJ2-5
35848	CAL ALS LSE SEA EAM AMN MNN NNA NAG AGN GNM NML MLT LTF	CAS ASS SSI SIG IGH GHY HYS YSG SGN GNT NTI TIY IYF	GILGFVFTL	CALSEAMNNAGNMLTF	TRAV19	TRAJ39	CASSIGHYSGNTIYF	TRBV19	TRBJ1-3
35706	CAL ALS LSE SEP EPG PGA GAN ANN NNL NLF LFF	CAS ASS SSV SVR VRD RDS DSF SFY FYE YEQ EQY QYV	KLGGALQAK	CALSEPGANNLFF	TRAV9-2	TRAJ36	CASSVRDSFYEQYV	TRBV6-1	TRBJ2-7
5154	CAV AVF VFN FND NDY DYK YKL KLS LSF	CSA SAP APR PRG RGS GSG SGT GTI TID IDT DTQ TQY QYF	AVFDRKSDAK	CAVFNDYKLSF	TRAV3	TRAJ20	CSAPRGSGTIDTQYF	TRBV20-1	TRBJ2-3
705	CAF AFM FMK MKH KHA HAI AII III IIQ IQG QGA GAQ AQK QKL KLV LVF	CAS ASS SSL SLW LWR WRA RAL ALE LEQ EQY QYF	RAKFKQLL	CAFMKHAIIIQGAQKLVF	TRAV38-1	TRAJ54	CASSLWRALEQYF	TRBV28	TRBJ2-7
4926	CAY AYR YRS RSV SVG VGT GTP TPL PLV LVF	CAS ASS SSL SLG LGA GAG AGK GKV KVT VTD TDT DTQ TQY QYF	KLGGALQAK	CAYRSVGTPLVF	TRAV38-2DV8	TRAJ29	CASSLGAGKVTDTQYF	TRBV11-3	TRBJ2-3
6559	CAE AER ERV RVE VED EDG DGQ GQK QKL KLL LLF	CAS ASG SGF GFG FGT GTV TVN VNE NEQ EQF QFF	AVFDRKSDAK	CAERVEDGQKLLF	TRAV13-2	TRAJ16	CASGFGTVNEQFF	TRBV19	TRBJ2-1
33394	CAY AYR YRS RSL SLP LPM PMD MDS DSN SNY NYQ YQL QLI LIW	CAS ASS SSI SIY IYS YSG SGP GPG PGN GNT NTI TIY IYF	GILGFVFTL	CAYRSLPMDSNYQLIW	TRAV38-2DV8	TRAJ33	CASSIYSGPGNTIYF	TRBV19	TRBJ1-3
5068	CAV AVG VGT GTG TGF GFQ FQK QKL KLV LVF	CAS ASS SSL SLP LPV PVE VEV EVN VNT NTE TEA EAF AFF	KLGGALQAK	CAVGTGFQKLVF	TRAV8-4	TRAJ8	CASSLPVEVNTEAFF	TRBV7-9	TRBJ1-1
36156	CGT GTE TEI EIG IGG GGG GGT GTS TSY SYG YGK GKL KLT LTF	CAS ASG SGT GTE TET ETQ TQY QYF	KLGGALQAK	CGTEIGGGTSYGKLTF	TRAV30	TRAJ52	CASGTETQYF	TRBV27	TRBJ2-5
5549	CDT DTE TEY EYW YWG WGI GIP IPL PLG LGP GPK PKA KAA AAG AGN GNK NKL KLT LTF	CAS ASS SSA SAR ARS RSG SGE GEP EPQ PQH QHF	GILGFVFTL	CDTEYWGIPLGPKAAGNKLTF	TRDV2	TRAJ17	CASSARSGEPQHF	TRBV19	TRBJ1-5
18091	CAE AET ETH THS HSG SGG GGS GSN SNY NYK YKL KLT LTF	CAS AST STG TGG GGY GYY YYQ YQP QPQ PQH QHF	RAKFKQLL	CAETHSGGSNYKLTF	TRAV13-2	TRAJ53	CASTGGYYQPQHF	TRBV28	TRBJ1-5
113	CAA AAS ASA SAS ASN SNQ NQG QGG GGK GKL KLI LIF	CAS ASS SSA SAR ARA RAW AWQ WQP QPQ PQH QHF	RAKFKQLL	CAASASNQGGKLIF	TRAV29DV5	TRAJ23	CASSARAWQPQHF	TRBV2	TRBJ1-5
32537	CAL ALK LKI KIP IPL PLV LVF	CAS ASS SSI SIR IRS RSA SAY AYE YEQ EQY QYF	GILGFVFTL	CALKIPLVF	TRAV16	TRAJ29	CASSIRSAYEQYF	TRBV19	TRBJ2-7
23850	CAV AVM VMT MTT TTD TDS DSW SWG WGK GKL KLQ LQF	CAS ASS SSL SLE LEG EGQ GQT QTN TNG NGE GEL ELF LFF	KLGGALQAK	CAVMTTDSWGKLQF	TRAV21	TRAJ24	CASSLEGQTNGELFF	TRBV5-1	TRBJ2-2
34883	CLV LVG VGP GPP PPQ PQT QTD TDS DSW SWG WGK GKF KFQ FQF	CAS ASG SGT GTS TSG SGD GDT DTG TGE GEL ELF LFF	KLGGALQAK	CLVGPPQTDSWGKFQF	TRAV4	TRAJ24	CASGTSGDTGELFF	TRBV10-2	TRBJ2-2
3846	CAM AMR MRE REG EGS GSG SGG GGS GSN SNY NYK YKL KLT LTF	CAS ASS SSW SWG WGG GGG GGS GSH SHY HYG YGY GYT YTF	IVTDFSVIK	CAMREGSGGSNYKLTF	TRAV12-3	TRAJ53	CASSWGGGSHYGYTF	TRBV11-2	TRBJ1-2
2494	CAL ALG LGF GFY FYT YTY TYS YSG SGA GAG AGS GSY SYQ YQL QLT LTF	CAI AIS ISD SDL DLG LGS GSY SYG YGY GYT YTF	KLGGALQAK	CALGFYTYSGAGSYQLTF	TRDV1	TRAJ28	CAISDLGSYGYTF	TRBV10-3	TRBJ1-2
26569	CAA AAK AKE KEG EGY GYS YST STL TLT LTF	CSA SAG AGG GGN GNT NTE TEA EAF AFF	RAKFKQLL	CAAKEGYSTLTF	TRAV13-1	TRAJ11	CSAGGNTEAFF	TRBV29-1	TRBJ1-1
5182	CAV AVT VTG TGS GSN SNF NFG FGN GNE NEK EKL KLT LTF	CSA SAR ARP RPG PGE GEQ EQG QGG GGD GDG DGY GYT YTF	ELAGIGILTV	CAVTGSNFGNEKLTF	TRAV12-2	TRAJ48	CSARPGEQGGDGYTF	TRBV20-1	TRBJ1-2
34876	CAL ALN LNQ NQG QGG GGK GKL KLI LIF	CAS ASR SRG RGA GAG AGV GVD VDN DNE NEQ EQF QFF	KLGGALQAK	CALNQGGKLIF	TRAV19	TRAJ23	CASRGAGVDNEQFF	TRBV10-1	TRBJ2-1
