26537	CAL ALS LSE SES ESN SNS NSG SGN GNT NTP TPL PLV LVF	CSA SAW AWT WTG TGT GTE TEA EAF AFF	GLCTLVAML	CALSESNSGNTPLVF	TRAV19	TRAJ29	CSAWTGTEAFF	TRBV20-1	TRBJ1-1
34475	CAL ALS LSE SEY EYL YLD LDT DTG TGR GRR RRA RAL ALT LTF	CAS ASS SSL SLE LEL ELG LGP GPD PDT DTQ TQY QYF	KLGGALQAK	CALSEYLDTGRRALTF	TRAV19	TRAJ5	CASSLELGPDTQYF	TRBV5-6	TRBJ2-3
9820	CAL ALS LSG SGA GAD ADS DSG SGA GAG AGS GSY SYQ YQL QLT LTF	CAS ASS SSF SFS FSG SGN GNT NTG TGE GEL ELF LFF	RAKFKQLL	CALSGADSGAGSYQLTF	TRAV19	TRAJ28	CASSFSGNTGELFF	TRBV12-3	TRBJ2-2
15303	CIV IVR VRE REI EIN INN NND NDM DMR MRF	CAS ASS SSP SPT PTP TPT PTA TAN ANY NYG YGY GYT YTF	RAKFKQLL	CIVREINNDMRF	TRAV26-1	TRAJ43	CASSPTPTANYGYTF	TRBV4-1	TRBJ1-2
25750	CAG AGG GGG GGS GSQ SQG QGN GNL NLI LIF	CAS ASS SSP SPV PVT VTG TGG GGG GGS GSG SGA GAN ANV NVL VLT LTF	GILGFVFTL	CAGGGSQGNLIF	TRAV27	TRAJ42	CASSPVTGGGSGANVLTF	TRBV7-9	TRBJ2-6
22358	CAV AVP VPY PYN YNQ NQG QGG GGK GKL KLI LIF	CAS ASS SSG SGP GPG PGG GGV GVD VDE DEQ EQY QYF	RAKFKQLL	CAVPYNQGGKLIF	TRAV2	TRAJ23	CASSGPGGVDEQYF	TRBV5-5	TRBJ2-7
32359	CAY AYS YSA SAN ANA NAG AGG GGT GTS TSY SYG YGK GKL KLT LTF	CAS ASS SSI SIG IGI GIY IYG YGY GYT YTF	GILGFVFTL	CAYSANAGGTSYGKLTF	TRAV38-2DV8	TRAJ52	CASSIGIYGYTF	TRBV19	TRBJ1-2
62	CAV AVG VGD GDN DNF NFN FNK NKF KFY FYF	CAS ASS SSF SFS FSG SGN GNT NTG TGE GEL ELF LFF	AVFDRKSDAK	CAVGDNFNKFYF	TRAV8-3	TRAJ21	CASSFSGNTGELFF	TRBV12-3	TRBJ2-2
36058	CAV AVS VSV SVG VGN GND NDY DYK YKL KLS LSF	CAS ASS SSS SSP SPG PGG GGE GEQ EQF QFF	GLCTLVAML	CAVSVGNDYKLSF	TRAV8-6	TRAJ20	CASSSPGGEQFF	TRBV12-3	TRBJ2-1
5869	CAV AVG VGG GGS GSQ SQG QGN GNL NLI LIF	CAS ASS SSI SIR IRS RSS SSY SYE YEQ EQY QYF	GILGFVFTL	CAVGGSQGNLIF	TRAV8-6	TRAJ42	CASSIRSSYEQYF	TRBV19	TRBJ2-7
5078	CAV AVG VGD GDN DNF NFN FNK NKF KFY FYF	CAS ASS SSP SPV PVT VTG TGG GGG GGS GSG SGA GAN ANV NVL VLT LTF	AVFDRKSDAK	CAVGDNFNKFYF	TRAV8-3	TRAJ21	CASSPVTGGGSGANVLTF	TRBV7-9	TRBJ2-6
23021	CAL ALI LIR IRG RGG GGG GGQ GQN QNF NFV FVF	CAS ASS SSL SLG LGT GTA TAN ANY NYG YGY GYT YTF	KLGGALQAK	CALIRGGGQNFVF	TRAV19	TRAJ26	CASSLGTANYGYTF	TRBV5-4	TRBJ1-2
1	CAA AAS AST STD TDS DSW SWG WGK GKL KLQ LQF	CAS ASS SSI SIR IRG RGA GAY AYE YEQ EQY QYF	GILGFVFTL	CAASTDSWGKLQF	TRAV29DV5	TRAJ24	CASSIRGAYEQYF	TRBV19	TRBJ2-7
35661	CAM AMT MTF TFD FDA DAG AGG GGF GFK FKT KTI TIF	CAS ASS SSY SYS YSN SNL NLE LEG EGE GEE EEN ENT NTI TIY IYF	KLGGALQAK	CAMTFDAGGFKTIF	TRAV12-3	TRAJ9	CASSYSNLEGEENTIYF	TRBV6-5	TRBJ1-3
32610	CAV AVG VGG GGS GSQ SQG QGN GNL NLI LIF	CAS ASS SSI SIR IRS RSS SSL SLE LEQ EQY QYF	GILGFVFTL	CAVGGSQGNLIF	TRAV8-6	TRAJ42	CASSIRSSLEQYF	TRBV19	TRBJ2-7
35971	CAA AAS ASL SLR LRD RDD DDK DKI KII IIF	CAS ASS SSA SAP APR PRG RGP GPG PGT GTN TNE NEQ EQF QFF	KLGGALQAK	CAASLRDDKIIF	TRAV29DV5	TRAJ30	CASSAPRGPGTNEQFF	TRBV11-1	TRBJ2-1
28465	CAM AMP MPG PGA GAN ANS NSK SKL KLT LTF	CAS ASS SSL SLN LNH NHL HLS LSS SSY SYN YNE NEQ EQF QFF	KLGGALQAK	CAMPGANSKLTF	TRAV12-3	TRAJ56	CASSLNHLSSYNEQFF	TRBV6-5	TRBJ2-1
2235	CAV AVN VNT NTY TYS YSG SGA GAG AGS GSY SYQ YQL QLT LTF	CAS ASS SSS SSQ SQG QGV GVG VGN GNT NTI TIY IYF	ELAGIGILTV	CAVNTYSGAGSYQLTF	TRAV12-2	TRAJ28	CASSSQGVGNTIYF	TRBV28	TRBJ1-3
4924	CAV AVA VAL ALW LWA WAR ARL RLM LMF	CAS ASS SSW SWG WGG GGG GGS GSH SHY HYG YGY GYT YTF	IVTDFSVIK	CAVALWARLMF	TRAV36DV7	TRAJ31	CASSWGGGSHYGYTF	TRBV11-2	TRBJ1-2
29776	CAE AEM EME MEG EGG GGS GSY SYI YIP IPT PTF	CAS ASS SSA SAR ARS RSS SSY SYE YEQ EQY QYF	GILGFVFTL	CAEMEGGSYIPTF	TRAV5	TRAJ6	CASSARSSYEQYF	TRBV19	TRBJ2-7
31435	CAG AGA GAG AGG GGG GGS GSQ SQG QGN GNL NLI LIF	CAS ASS SSM SMR MRS RSS SSD SDT DTQ TQY QYF	GILGFVFTL	CAGAGGGSQGNLIF	TRAV27	TRAJ42	CASSMRSSDTQYF	TRBV19	TRBJ2-3
35891	CAV AVH VHL HLN LNA NAG AGG GGT GTS TSY SYG YGK GKL KLT LTF	CAS ASS SSI SIW IWG WGI GIS ISG SGQ GQP QPQ PQH QHF	ELAGIGILTV	CAVHLNAGGTSYGKLTF	TRAV12-2	TRAJ52	CASSIWGISGQPQHF	TRBV19	TRBJ1-5
31943	CVG VGY GYT YTN TNA NAG AGK GKS KST STF	CAS ASR SRA RAG AGR GRE REA EAF AFF	GILGFVFTL	CVGYTNAGKSTF	TRAV10	TRAJ27	CASRAGREAFF	TRBV19	TRBJ1-1
39	CAF AFM FMI MIG IGA GAG AGG GGT GTS TSY SYG YGK GKL KLT LTF	CAS ASS SSV SVP VPN PNP NPR PRP RPA PAK AKS KSG SGA GAN ANV NVL VLT LTF	GILGFVFTL	CAFMIGAGGTSYGKLTF	TRAV38-1	TRAJ52	CASSVPNPRPAKSGANVLTF	TRBV21-1	TRBJ2-6
24846	CAV AVP VPL PLT LTG TGG GGG GGN GNK NKL KLT LTF	CAS ASS SSL SLN LNR NRG RGD GDP DPE PEA EAF AFF	GLCTLVAML	CAVPLTGGGNKLTF	TRAV12-2	TRAJ10	CASSLNRGDPEAFF	TRBV11-2	TRBJ1-1
28823	CAV AVV VVW VWG WGG GGS GSR SRL RLT LTF	CAS ASS SSY SYP YPE PEQ EQG QGT GTS TSN SNE NEK EKL KLF LFF	GILGFVFTL	CAVVWGGSRLTF	TRAV39	TRAJ58	CASSYPEQGTSNEKLFF	TRBV6-6	TRBJ1-4
34941	CAM AMR MRE RED EDP DPN PNF NFG FGN GNE NEK EKL KLT LTF	CAS ASS SSL SLG LGQ GQV QVG VGL GLA LAG AGA GAP APN PNT NTG TGE GEL ELF LFF	KLGGALQAK	CAMREDPNFGNEKLTF	TRAV14DV4	TRAJ48	CASSLGQVGLAGAPNTGELFF	TRBV7-3	TRBJ2-2
5522	CAP APP PPS PSF	CAS ASS SSW SWG WGQ GQG QGS GSP SPL PLH LHF	ELAGIGILTV	CAPPSF	TRAV13-1	TRAJ20	CASSWGQGSPLHF	TRBV6-3	TRBJ1-6
15293	CAS ASQ SQP QPF PFQ FQG QGA GAQ AQK QKL KLV LVF	CAS ASS SSN SNL NLD LDG DGT GTG TGE GEL ELF LFF	RAKFKQLL	CASQPFQGAQKLVF	TRAV38-2DV8	TRAJ54	CASSNLDGTGELFF	TRBV4-1	TRBJ2-2
2385	CAV AVS VSG SGE GED EDN DND NDM DMR MRF	CAS ASS SSP SPK PKG KGG GGR GRT RTN TNY NYG YGY GYT YTF	IVTDFSVIK	CAVSGEDNDMRF	TRAV8-6	TRAJ43	CASSPKGGRTNYGYTF	TRBV27	TRBJ1-2
218	CAL ALS LSE SEA EAP APG PGA GAN ANN NNL NLF LFF	CAS ASS SSQ SQE QEG EGE GES ESN SNY NYG YGY GYT YTF	KLGGALQAK	CALSEAPGANNLFF	TRAV19	TRAJ36	CASSQEGESNYGYTF	TRBV4-3	TRBJ1-2
6610	CAM AMS MSV SVN VNA NAG AGG GGT GTS TSY SYG YGK GKL KLT LTF	CAS ASS SSI SIG IGL GLY LYG YGY GYT YTF	GILGFVFTL	CAMSVNAGGTSYGKLTF	TRAV12-3	TRAJ52	CASSIGLYGYTF	TRBV19	TRBJ1-2
5540	CAL ALS LSD SDR DRY RYG YGG GGA GAT ATN TNK NKL KLI LIF	CAS AST STP TPI PIV IVG VGG GGH GHH HHT HTE TEA EAF AFF	KLGGALQAK	CALSDRYGGATNKLIF	TRAV19	TRAJ32	CASTPIVGGHHTEAFF	TRBV6-3	TRBJ1-1
25708	CAV AVS VSR SRM RMD MDS DSS SSY SYK YKL KLI LIF	CAS ASS SSP SPL PLG LGG GGP GPK PKD KDT DTI TIY IYF	RAKFKQLL	CAVSRMDSSYKLIF	TRAV1-1	TRAJ12	CASSPLGGPKDTIYF	TRBV7-9	TRBJ1-3
14648	CVV VVN VNG NGG GGD GDS DSS SSY SYK YKL KLI LIF	CAS ASS SSE SEG EGQ GQV QVS VSP SPG PGE GEL ELF LFF	GLCTLVAML	CVVNGGDSSYKLIF	TRAV12-1	TRAJ12	CASSEGQVSPGELFF	TRBV2	TRBJ2-2
24428	CAT ATD TDA DAS ASG SGG GGS GSN SNY NYK YKL KLT LTF	CAS ASS SSL SLG LGT GTS TSG SGG GGT GTG TGE GEL ELF LFF	RAKFKQLL	CATDASGGSNYKLTF	TRAV17	TRAJ53	CASSLGTSGGTGELFF	TRBV7-3	TRBJ2-2
7673	CAA AAS ASE SET ETS TSY SYD YDK DKV KVI VIF	CAS ASH SHP HPR PRT RTP TPI PIY IYG YGY GYT YTF	RAKFKQLL	CAASETSYDKVIF	TRAV13-1	TRAJ50	CASHPRTPIYGYTF	TRBV12-3	TRBJ1-2
4939	CAE AEG EGG GGG GGS GSQ SQG QGN GNL NLI LIF	CAS ASS SSL SLA LAG AGL GLA LAG AGG GGE GEL ELF LFF	ELAGIGILTV	CAEGGGSQGNLIF	TRAV12-2	TRAJ42	CASSLAGLAGGELFF	TRBV7-8	TRBJ2-2
34773	CVV VVS VSA SAR ARG RGG GGA GAD ADG DGL GLT LTF	CAS ASS SSL SLP LPL PLA LAG AGG GGS GST STD TDT DTQ TQY QYF	KLGGALQAK	CVVSARGGADGLTF	TRAV10	TRAJ45	CASSLPLAGGSTDTQYF	TRBV5-1	TRBJ2-3
35357	CVV VVS VSE SEI EIR IRV RVG VGA GAT ATN TNK NKL KLI LIF	CSA SAR ARD RDL DLV LVR VRG RGA GAY AYE YEQ EQF QFF	KLGGALQAK	CVVSEIRVGATNKLIF	TRAV8-2	TRAJ32	CSARDLVRGAYEQFF	TRBV20-1	TRBJ2-1
35605	CAL ALM LMR MRG RGT GTG TGG GGF GFK FKT KTI TIF	CAS ASS SSS SSA SAG AGT GTR TRE REE EET ETQ TQY QYF	KLGGALQAK	CALMRGTGGFKTIF	TRAV19	TRAJ9	CASSSAGTREETQYF	TRBV13	TRBJ2-5
56	CAV AVS VSP SPW PWG WGG GGY GYN YNK NKL KLI LIF	CAS ASS SSF SFS FSG SGN GNT NTG TGE GEL ELF LFF	RAKFKQLL	CAVSPWGGYNKLIF	TRAV1-1	TRAJ4	CASSFSGNTGELFF	TRBV12-3	TRBJ2-2
34915	CAG AGA GAF AFD FDT DTN TNA NAG AGK GKS KST STF	CAI AIS ISD SDY DYY YYE YEQ EQY QYF	KLGGALQAK	CAGAFDTNAGKSTF	TRAV27	TRAJ27	CAISDYYEQYF	TRBV10-3	TRBJ2-7
34935	CAA AAA AAG AGS GSQ SQG QGN GNL NLI LIF	CAI AIS ISG SGQ GQG QGE GEY EYT YTE TEA EAF AFF	KLGGALQAK	CAAAGSQGNLIF	TRAV29DV5	TRAJ42	CAISGQGEYTEAFF	TRBV10-3	TRBJ1-1
35362	CAM AMR MRE REG EGD GDI DIG IGN GNQ NQF QFY FYF	CSA SAR ARD RDY DYL YLR LRP RPL PLD LDN DNE NEQ EQF QFF	KLGGALQAK	CAMREGDIGNQFYF	TRAV14DV4	TRAJ49	CSARDYLRPLDNEQFF	TRBV20-1	TRBJ2-1
23376	CAA AAS ASN SNT NTG TGK GKL KLI LIF	CAS ASS SSP SPH PHF HFQ FQV QVD VDT DTG TGE GEL ELF LFF	RAKFKQLL	CAASNTGKLIF	TRAV29DV5	TRAJ37	CASSPHFQVDTGELFF	TRBV27	TRBJ2-2
6602	CAV AVN VNL NLG LGG GGG GGS GSQ SQG QGN GNL NLI LIF	CAS ASS SSH SHR HRS RSS SSY SYE YEQ EQY QYF	GILGFVFTL	CAVNLGGGSQGNLIF	TRAV12-2	TRAJ42	CASSHRSSYEQYF	TRBV19	TRBJ2-7
35830	CAE AEK EKT KTS TSY SYD YDK DKV KVI VIF	CAS ASS SSI SIA IAG AGY GYT YTE TEA EAF AFF	KLGGALQAK	CAEKTSYDKVIF	TRAV9-2	TRAJ50	CASSIAGYTEAFF	TRBV19	TRBJ1-1
24352	CIL ILR LRE REF EFY FYN YND NDM DMR MRF	CAI AIS ISE SES ESN SNK NKG KGT GTP TPG PGY GYT YTF	RAKFKQLL	CILREFYNDMRF	TRAV26-2	TRAJ43	CAISESNKGTPGYTF	TRBV10-3	TRBJ1-2
31460	CAP APA PAG AGD GDG DGG GGS GSQ SQG QGN GNL NLI LIF	CAS ASS SSP SPR PRS RSS SSQ SQP QPQ PQH QHF	GILGFVFTL	CAPAGDGGSQGNLIF	TRAV35	TRAJ42	CASSPRSSQPQHF	TRBV19	TRBJ1-5
7243	CAM AMT MTR TRS RSN SNT NTG TGN GNQ NQF QFY FYF	CAS ASS SSG SGR GRH RHV HVD VDT DTK TKD KDT DTQ TQY QYF	IVTDFSVIK	CAMTRSNTGNQFYF	TRAV14DV4	TRAJ49	CASSGRHVDTKDTQYF	TRBV14	TRBJ2-3
36120	CAV AVD VDG DGN GNQ NQF QFY FYF	CAS ASS SSV SVD VDE DER ERE REQ EQY QYF	KLGGALQAK	CAVDGNQFYF	TRAV39	TRAJ49	CASSVDEREQYF	TRBV9	TRBJ2-7
27088	CIV IVR VRE REV EVG VGD GDK DKL KLI LIF	CSV SVE VEG EGP GPL PLP LPA PAG AGT GTL TLG LGT GTQ TQY QYF	RAKFKQLL	CIVREVGDKLIF	TRAV26-1	TRAJ34	CSVEGPLPAGTLGTQYF	TRBV29-1	TRBJ2-5
16957	CVV VVT VTE TET ETS TSY SYD YDK DKV KVI VIF	CAS ASS SSH SHL HLG LGG GGD GDR DRY RYM YMN MNE NEQ EQF QFF	RAKFKQLL	CVVTETSYDKVIF	TRAV12-1	TRAJ50	CASSHLGGDRYMNEQFF	TRBV3-1	TRBJ2-1
36181	CVV VVN VNP NPT PTN TNR NRG RGS GST STL TLG LGR GRL RLY LYF	CAS ASS SSL SLT LTG TGL GLA LAG AGA GAE AEQ EQY QYF	KLGGALQAK	CVVNPTNRGSTLGRLYF	TRAV12-1	TRAJ18	CASSLTGLAGAEQYF	TRBV27	TRBJ2-7
5284	CAV AVE VED EDG DGG GGF GFQ FQK QKL KLV LVF	CSV SVL VLV LVA VAR ARE REL ELL LLT LTD TDT DTQ TQY QYF	KLGGALQAK	CAVEDGGFQKLVF	TRAV2	TRAJ8	CSVLVARELLTDTQYF	TRBV29-1	TRBJ2-3
87	CAA AAT ATL TLS LSD SDK DKI KII IIF	CAS ASS SSL SLG LGT GTV TVH VHQ HQP QPQ PQH QHF	RAKFKQLL	CAATLSDKIIF	TRAV29DV5	TRAJ30	CASSLGTVHQPQHF	TRBV18	TRBJ1-5
16937	CAE AEM EME MEG EGG GGS GSY SYI YIP IPT PTF	CAS ASS SSQ SQG QGS GSN SNQ NQP QPQ PQH QHF	RAKFKQLL	CAEMEGGSYIPTF	TRAV5	TRAJ6	CASSQGSNQPQHF	TRBV4-2	TRBJ1-5
38426	CAV AVD VDL DLM LMK MKT KTS TSY SYD YDK DKV KVI VIF	CAS ASS SSL SLR LRD RDT DTR TRN RNS NSL SLH LHF	IVTDFSVIK	CAVDLMKTSYDKVIF	TRAV21	TRAJ50	CASSLRDTRNSLHF	TRBV19	TRBJ1-6
5094	CAV AVA VAV AVG VGV GVS VSG SGG GGG GGA GAD ADG DGL GLT LTF	CAS ASS SSS SSG SGL GLA LAG AGV GVN VNE NEQ EQF QFF	GILGFVFTL	CAVAVGVSGGGADGLTF	TRAV12-2	TRAJ45	CASSSGLAGVNEQFF	TRBV7-9	TRBJ2-1
15871	CAL ALN LNN NNN NNA NAR ARL RLM LMF	CAS ASS SST STS TST STG TGT GTG TGY GYG YGY GYT YTF	RAKFKQLL	CALNNNARLMF	TRAV38-2DV8	TRAJ31	CASSTSTGTGYGYTF	TRBV4-1	TRBJ1-2
33588	CAY AYR YRV RVG VGG GGG GGS GSW SWG WGK GKT KTQ TQG QGG GGS GSE SEK EKL KLV LVF	CAS ASS SSS SSS SSG SGG GGA GAG AGE GEL ELF LFF	GILGFVFTL	CAYRVGGGSWGKTQGGSEKLVF	TRAV38-2DV8	TRAJ57	CASSSSGGAGELFF	TRBV19	TRBJ2-2
34102	CAV AVI VIH IHN HNT NTG TGN GNQ NQF QFY FYF	CAS ASM SMG MGL GLT LTL TLR LRD RDT DTQ TQY QYF	ELAGIGILTV	CAVIHNTGNQFYF	TRAV8-6	TRAJ49	CASMGLTLRDTQYF	TRBV2	TRBJ2-3
36106	CAY AYR YRR RRD RDD DDK DKI KII IIF	CAS ASS SSQ SQG QGL GLA LAA AAS ASY SYE YEQ EQY QYF	KLGGALQAK	CAYRRDDKIIF	TRAV38-2DV8	TRAJ30	CASSQGLAASYEQYF	TRBV3-1	TRBJ2-7
10	CAA AAS ASE SEQ EQG QGG GGK GKL KLI LIF	CAT ATS TSD SDR DRT RTG TGT GTG TGI GIQ IQA QAN ANY NYG YGY GYT YTF	ELAGIGILTV	CAASEQGGKLIF	TRAV12-2	TRAJ23	CATSDRTGTGIQANYGYTF	TRBV24-1	TRBJ1-2
7063	CAG AGG GGD GDG DGG GGS GSQ SQG QGN GNL NLI LIF	CAS ASS SSI SIR IRS RST STG TGE GEL ELF LFF	GILGFVFTL	CAGGDGGSQGNLIF	TRAV27	TRAJ42	CASSIRSTGELFF	TRBV19	TRBJ2-2
35588	CAP APL PLD LDF DFD FDD DDY DYK YKL KLS LSF	CAS ASS SSL SLR LRL RLA LAE AEI EIS ISG SGA GAN ANV NVL VLT LTF	KLGGALQAK	CAPLDFDDYKLSF	TRAV6	TRAJ20	CASSLRLAEISGANVLTF	TRBV13	TRBJ2-6
34059	CAV AVS VSG SGG GGS GSY SYI YIP IPT PTF	CAS ASS SSL SLE LEE EEG EGG GGA GAF AFF	KLGGALQAK	CAVSGGSYIPTF	TRAV5	TRAJ6	CASSLEEGGAFF	TRBV12-3	TRBJ1-1
33554	CAG AGA GAG AGS GSQ SQG QGN GNL NLI LIF	CAS ASS SSS SSR SRS RSA SAY AYE YEQ EQY QYF	GILGFVFTL	CAGAGSQGNLIF	TRAV27	TRAJ42	CASSSRSAYEQYF	TRBV19	TRBJ2-7
34394	CAM AMR MRE REM EMM MMT MTT TTD TDS DSW SWG WGK GKL KLQ LQF	CAS ASS SSV SVD VDD DDG DGE GEY EYY YYN YNE NEQ EQF QFF	KLGGALQAK	CAMREMMTTDSWGKLQF	TRAV14DV4	TRAJ24	CASSVDDGEYYNEQFF	TRBV9	TRBJ2-1
35083	CAM AMR MRE REG EGW GWR WRN RNT NTD TDK DKL KLI LIF	CAS ASR SRI RIG IGN GNQ NQP QPQ PQH QHF	KLGGALQAK	CAMREGWRNTDKLIF	TRAV14DV4	TRAJ34	CASRIGNQPQHF	TRBV7-2	TRBJ1-5
36824	CAF AFT FTT TTG TGK GKL KLI LIF	CAS ASR SRT RTG TGL GLA LAS AST STD TDT DTQ TQY QYF	IVTDFSVIK	CAFTTGKLIF	TRAV38-1	TRAJ37	CASRTGLASTDTQYF	TRBV6-6	TRBJ2-3
32385	CAG AGG GGG GGS GSQ SQG QGN GNL NLI LIF	CAS ASS SSI SIG IGS GSY SYG YGY GYT YTF	GILGFVFTL	CAGGGSQGNLIF	TRAV27	TRAJ42	CASSIGSYGYTF	TRBV19	TRBJ1-2
23214	CAV AVS VSD SDY DYI YII IIQ IQG QGA GAQ AQK QKL KLV LVF	CAS ASR SRP RPG PGG GGH GHE HEG EGE GEK EKL KLF LFF	KLGGALQAK	CAVSDYIIQGAQKLVF	TRAV8-6	TRAJ54	CASRPGGHEGEKLFF	TRBV27	TRBJ1-4
644	CVV VVS VSA SAN ANS NSD SDG DGQ GQK QKL KLL LLF	CAS ASS SSV SVV VVS VSG SGA GAN ANV NVL VLT LTF	KLGGALQAK	CVVSANSDGQKLLF	TRAV10	TRAJ16	CASSVVSGANVLTF	TRBV9	TRBJ2-6
5527	CAV AVN VNA NAG AGN GND NDM DMR MRF	CAS ASS SSY SYG YGQ GQG QGW GWG WGY GYT YTF	ELAGIGILTV	CAVNAGNDMRF	TRAV12-2	TRAJ43	CASSYGQGWGYTF	TRBV6-3	TRBJ1-2
15407	CAL ALS LSE SEA EAS ASG SGT GTY TYK YKY KYI YIF	CAS ASS SSQ SQT QTR TRG RGA GAG AGN GNT NTI TIY IYF	RAKFKQLL	CALSEASGTYKYIF	TRAV19	TRAJ40	CASSQTRGAGNTIYF	TRBV4-1	TRBJ1-3
35795	CAL ALS LSV SVW VWN WNG NGN GNK NKL KLV LVF	CAS ASK SKP KPG PGG GGP GPN PNT NTE TEA EAF AFF	KLGGALQAK	CALSVWNGNKLVF	TRAV19	TRAJ47	CASKPGGPNTEAFF	TRBV19	TRBJ1-1
32413	CAM AMR MRE REG EGS GSN SND NDM DMR MRF	CAS ASS SSI SIK IKG KGP GPF PFR FRT RTE TEA EAF AFF	RAKFKQLL	CAMREGSNDMRF	TRAV14DV4	TRAJ43	CASSIKGPFRTEAFF	TRBV19	TRBJ1-1
3038	CAG AGA GAT ATD TDS DSW SWG WGK GKL KLQ LQF	CAS ASS SSW SWG WGG GGG GGS GSH SHY HYG YGY GYT YTF	IVTDFSVIK	CAGATDSWGKLQF	TRAV25	TRAJ24	CASSWGGGSHYGYTF	TRBV11-2	TRBJ1-2
23025	CAG AGG GGT GTG TGT GTY TYK YKY KYI YIF	CAS ASS SSR SRR RRL RLA LAV AVY VYN YNE NEQ EQF QFF	KLGGALQAK	CAGGTGTYKYIF	TRAV27	TRAJ40	CASSRRLAVYNEQFF	TRBV5-4	TRBJ2-1
182	CIL ILR LRD RDR DRD RDD DDK DKI KII IIF	CAS ASS SSQ SQE QEG EGQ GQL QLN LNQ NQP QPQ PQH QHF	KLGGALQAK	CILRDRDDKIIF	TRAV26-2	TRAJ30	CASSQEGQLNQPQHF	TRBV4-2	TRBJ1-5
35881	CIV IVR VRD RDE DEI EIK IKA KAA AAG AGN GNK NKL KLT LTF	CAS ASS SSI SIV IVD VDA DAG AGL GLY LYE YEQ EQY QYF	KLGGALQAK	CIVRDEIKAAGNKLTF	TRAV26-1	TRAJ17	CASSIVDAGLYEQYF	TRBV19	TRBJ2-7
31932	CAY AYM YMS MSN SNA NAG AGG GGT GTS TSY SYG YGK GKL KLT LTF	CAS ASS SSI SIR IRS RSS SSY SYE YEQ EQY QYF	GILGFVFTL	CAYMSNAGGTSYGKLTF	TRAV38-2DV8	TRAJ52	CASSIRSSYEQYF	TRBV19	TRBJ2-7
12586	CAM AMK MKS KST STN TNA NAG AGK GKS KST STF	CAS ASS SSF SFS FSG SGN GNT NTG TGE GEL ELF LFF	RAKFKQLL	CAMKSTNAGKSTF	TRAV12-3	TRAJ27	CASSFSGNTGELFF	TRBV12-3	TRBJ2-2
23245	CAA AAK AKE KEG EGG GGS GSE SEK EKL KLV LVF	CAS ASS SSL SLS LSG SGR GRP RPY PYE YEQ EQY QYF	RAKFKQLL	CAAKEGGSEKLVF	TRAV13-1	TRAJ57	CASSLSGRPYEQYF	TRBV27	TRBJ2-7
5176	CAM AMS MSL SLS LSG SGN GNT NTP TPL PLV LVF	CSA SAR ARE REV EVS VSG SGE GEK EKL KLF LFF	AVFDRKSDAK	CAMSLSGNTPLVF	TRAV12-3	TRAJ29	CSAREVSGEKLFF	TRBV20-1	TRBJ1-4
38419	CAV AVP VPG PGG GGK GKS KST STF	CAS ASS SSY SYG YGG GGN GNQ NQP QPQ PQH QHF	ELAGIGILTV	CAVPGGKSTF	TRAV12-2	TRAJ27	CASSYGGNQPQHF	TRBV6-3	TRBJ1-5
27094	CAG AGR GRL RLN LNS NSG SGN GNT NTP TPL PLV LVF	CSV SVE VET ETG TGL GLG LGY GYE YEQ EQY QYF	KLGGALQAK	CAGRLNSGNTPLVF	TRAV27	TRAJ29	CSVETGLGYEQYF	TRBV29-1	TRBJ2-7
5189	CLV LVG VGD GDG DGW GWE WEY EYG YGN GNK NKL KLV LVF	CSA SAS ASG SGQ GQG QGL GLN LNT NTG TGE GEL ELF LFF	KLGGALQAK	CLVGDGWEYGNKLVF	TRAV4	TRAJ47	CSASGQGLNTGELFF	TRBV20-1	TRBJ2-2
34051	CLV LVG VGD GDM DME MEG EGG GGS GST STL TLG LGR GRL RLY LYF	CAS ASR SRY RYG YGT GTP TPG PGT GTE TEA EAF AFF	KLGGALQAK	CLVGDMEGGSTLGRLYF	TRAV4	TRAJ18	CASRYGTPGTEAFF	TRBV12-3	TRBJ1-1
35367	CAT ATA TAA AAY AYN YNQ NQG QGG GGK GKL KLI LIF	CSA SAR ARG RGK GKI KIS ISG SGT GTY TYN YNE NEQ EQF QFF	KLGGALQAK	CATAAYNQGGKLIF	TRAV17	TRAJ23	CSARGKISGTYNEQFF	TRBV20-1	TRBJ2-1
15307	CVV VVN VNR NRD RDR DRD RDD DDK DKI KII IIF	CAS ASS SSQ SQA QAR ARD RDR DRR RRY RYE YEQ EQY QYF	KLGGALQAK	CVVNRDRDDKIIF	TRAV12-1	TRAJ30	CASSQARDRRYEQYF	TRBV4-1	TRBJ2-7
33841	CAG AGN GNY NYG YGG GGS GSQ SQG QGN GNL NLI LIF	CAS ASS SSV SVR VRS RSS SSD SDT DTQ TQY QYF	GILGFVFTL	CAGNYGGSQGNLIF	TRAV25	TRAJ42	CASSVRSSDTQYF	TRBV19	TRBJ2-3
5279	CVV VVR VRS RST STG TGF GFQ FQK QKL KLV LVF	CSV SVG VGT GTG TGD GDW DWG WGE GEQ EQY QYF	RAKFKQLL	CVVRSTGFQKLVF	TRAV10	TRAJ8	CSVGTGDWGEQYF	TRBV29-1	TRBJ2-7
282	CAV AVN VNG NGG GGE GEF EFY FYF	CAS ASS SSA SAP APG PGG GGT GTS TSY SYN YNE NEQ EQF QFF	KLGGALQAK	CAVNGGEFYF	TRAV12-2	TRAJ21	CASSAPGGTSYNEQFF	TRBV9	TRBJ2-1
32416	CAE AEN ENS NSG SGG GGG GGS GSQ SQG QGN GNL NLI LIF	CAS ASS SSI SIR IRA RAA AAE AET ETQ TQY QYF	GILGFVFTL	CAENSGGGSQGNLIF	TRAV13-2	TRAJ42	CASSIRAAETQYF	TRBV19	TRBJ2-5
38423	CAV AVK VKG KGI GIT ITG TGG GGG GGN GNK NKL KLT LTF	CAS ASS SSY SYS YST STA TAS ASE SEQ EQY QYF	KLGGALQAK	CAVKGITGGGNKLTF	TRAV21	TRAJ10	CASSYSTASEQYF	TRBV6-3	TRBJ2-7
33840	CAE AEN ENM NMG MGG GGG GGS GSQ SQG QGN GNL NLI LIF	CAS ASS SSV SVR VRS RSG SGE GET ETQ TQY QYF	GILGFVFTL	CAENMGGGSQGNLIF	TRAV13-2	TRAJ42	CASSVRSGETQYF	TRBV19	TRBJ2-5
1699	CAV AVT VTA TAG AGG GGT GTS TSY SYG YGK GKL KLT LTF	CAS ASS SSL SLY LYS YSA SAT ATG TGE GEL ELF LFF	AVFDRKSDAK	CAVTAGGTSYGKLTF	TRAV12-2	TRAJ52	CASSLYSATGELFF	TRBV28	TRBJ2-2
34918	CAV AVT VTS TSG SGT GTY TYK YKY KYI YIF	CAI AIS ISE SES ESL SLA LAG AGG GGP GPG PGT GTQ TQY QYF	KLGGALQAK	CAVTSGTYKYIF	TRAV29DV5	TRAJ40	CAISESLAGGPGTQYF	TRBV10-3	TRBJ2-3
35667	CAA AAS ASA SAD ADA DAR ARL RLM LMF	CAS ASS SSY SYV YVA VAG AGG GGQ GQE QET ETQ TQY QYF	KLGGALQAK	CAASADARLMF	TRAV13-1	TRAJ31	CASSYVAGGQETQYF	TRBV6-5	TRBJ2-5
29939	CAM AMS MSG SGG GGG GGG GGS GSQ SQG QGN GNL NLI LIF	CAS ASS SSG SGR GRS RST STD TDT DTQ TQY QYF	GILGFVFTL	CAMSGGGGSQGNLIF	TRAV12-3	TRAJ42	CASSGRSTDTQYF	TRBV19	TRBJ2-3
18062	CAF AFM FMV MVR VRG RGS GST STL TLG LGR GRL RLY LYF	CAS ASS SSF SFL FLA LAG AGT GTD TDT DTQ TQY QYF	KLGGALQAK	CAFMVRGSTLGRLYF	TRAV24	TRAJ18	CASSFLAGTDTQYF	TRBV28	TRBJ2-3
25806	CAA AAM AME MET ETS TSY SYD YDK DKV KVI VIF	CAS ASS SSS SSG SGL GLA LAG AGL GLN LNE NEQ EQF QFF	RAKFKQLL	CAAMETSYDKVIF	TRAV13-1	TRAJ50	CASSSGLAGLNEQFF	TRBV7-9	TRBJ2-1
5592	CAG AGT GTY TYG YGG GGS GSQ SQG QGN GNL NLI LIF	CAS ASS SSG SGR GRS RSS SSQ SQP QPQ PQH QHF	GILGFVFTL	CAGTYGGSQGNLIF	TRAV25	TRAJ42	CASSGRSSQPQHF	TRBV19	TRBJ1-5
118	CAE AER ERA RAG AGT GTA TAS ASK SKL KLT LTF	CAS ASS SSD SDP DPY PYN YNQ NQT QTL TLS LSY SYE YEQ EQY QYF	AVFDRKSDAK	CAERAGTASKLTF	TRAV13-2	TRAJ44	CASSDPYNQTLSYEQYF	TRBV2	TRBJ2-7
24353	CAA AAS ASE SET ETS TSY SYD YDK DKV KVI VIF	CAI AIS ISG SGG GGT GTS TSR SRD RDT DTE TEA EAF AFF	RAKFKQLL	CAASETSYDKVIF	TRAV13-1	TRAJ50	CAISGGTSRDTEAFF	TRBV10-3	TRBJ1-1
36233	CAV AVD VDL DLM LMK MKT KTS TSY SYD YDK DKV KVI VIF	CAS ASS SSA SAR ARG RGA GAL ALA LAG AGG GGS GSY SYE YEQ EQY QYF	IVTDFSVIK	CAVDLMKTSYDKVIF	TRAV21	TRAJ50	CASSARGALAGGSYEQYF	TRBV7-2	TRBJ2-7
31651	CAA AAS ASG SGT GTG TGG GGF GFK FKT KTI TIF	CAS ASS SST STG TGQ GQP QPQ PQH QHF	GILGFVFTL	CAASGTGGFKTIF	TRAV29DV5	TRAJ9	CASSTGQPQHF	TRBV19	TRBJ1-5
32341	CAM AMR MRE REE EEG EGM GMD MDS DSN SNY NYQ YQL QLI LIW	CAS ASS SSI SIF IFS FSG SGK GKP KPQ PQH QHF	GILGFVFTL	CAMREEGMDSNYQLIW	TRAV14DV4	TRAJ33	CASSIFSGKPQHF	TRBV19	TRBJ1-5
35190	CAL ALS LSE SEG EGY GYG YGG GGA GAT ATN TNK NKL KLI LIF	CAS AST STL TLP LPR PRD RDT DTE TEA EAF AFF	KLGGALQAK	CALSEGYGGATNKLIF	TRAV9-2	TRAJ32	CASTLPRDTEAFF	TRBV7-9	TRBJ1-1
25090	CAE AEM EME MEG EGG GGS GSY SYI YIP IPT PTF	CAS ASS SSS SSP SPE PEG EGQ GQP QPL PLN LNT NTG TGE GEL ELF LFF	GLCTLVAML	CAEMEGGSYIPTF	TRAV5	TRAJ6	CASSSPEGQPLNTGELFF	TRBV7-8	TRBJ2-2
23224	CAV AVK VKG KGI GIQ IQG QGA GAQ AQK QKL KLV LVF	CAS ASS SSH SHF HFP FPP PPP PPY PYE YEQ EQY QYF	KLGGALQAK	CAVKGIQGAQKLVF	TRAV12-2	TRAJ54	CASSHFPPPYEQYF	TRBV27	TRBJ2-7
6305	CAF AFM FMT MTN TNA NAG AGG GGT GTS TSY SYG YGK GKL KLT LTF	CAS ASS SSQ SQG QGS GSY SYG YGY GYT YTF	GILGFVFTL	CAFMTNAGGTSYGKLTF	TRAV38-1	TRAJ52	CASSQGSYGYTF	TRBV19	TRBJ1-2
31373	CAM AMS MSG SGD GDG DGG GGS GSQ SQG QGN GNL NLI LIF	CAS ASS SSK SKR KRS RSN SNQ NQP QPQ PQH QHF	GILGFVFTL	CAMSGDGGSQGNLIF	TRAV12-3	TRAJ42	CASSKRSNQPQHF	TRBV19	TRBJ1-5
5149	CAA AAA AAR ARM RMD MDS DSS SSY SYK YKL KLI LIF	CAW AWV WVL VLG LGP GPA PAG AGD GDT DTQ TQY QYF	RAKFKQLL	CAAARMDSSYKLIF	TRAV13-1	TRAJ12	CAWVLGPAGDTQYF	TRBV30	TRBJ2-3
34865	CAA AAS ASV SVG VGG GGG GGS GSQ SQG QGN GNL NLI LIF	CAS ASS SSS SSF SFL FLA LAG AGA GAK AKT KTQ TQY QYF	KLGGALQAK	CAASVGGGSQGNLIF	TRAV29DV5	TRAJ42	CASSSFLAGAKTQYF	TRBV12-4	TRBJ2-5
30095	CAF AFM FMV MVN VNA NAG AGG GGT GTS TSY SYG YGK GKL KLT LTF	CAS ASS SSI SIG IGV GVA VAG AGY GYT YTF	GILGFVFTL	CAFMVNAGGTSYGKLTF	TRAV38-1	TRAJ52	CASSIGVAGYTF	TRBV19	TRBJ1-2
36195	CAM AMR MRV RVS VSG SGY GYS YST STL TLT LTF	CAS ASS SSL SLA LAQ AQF QFN FNE NEQ EQF QFF	KLGGALQAK	CAMRVSGYSTLTF	TRAV14DV4	TRAJ11	CASSLAQFNEQFF	TRBV5-1	TRBJ2-1
7078	CAV AVS VSD SDL DLY LYS YSG SGG GGY GYQ YQK QKV KVT VTF	CAS ASS SSM SMG MGQ GQG QGG GGY GYN YNE NEQ EQF QFF	KLGGALQAK	CAVSDLYSGGYQKVTF	TRAV8-4	TRAJ13	CASSMGQGGYNEQFF	TRBV19	TRBJ2-1
35458	CAT ATA TAR ARY RYN YNQ NQG QGG GGK GKL KLI LIF	CSA SAT ATA TAQ AQD QDT DTY TYN YNE NEQ EQF QFF	KLGGALQAK	CATARYNQGGKLIF	TRAV17	TRAJ23	CSATAQDTYNEQFF	TRBV20-1	TRBJ2-1
35308	CAA AAP APD PDQ DQG QGG GGS GSE SEK EKL KLV LVF	CAS ASS SSW SWG WGQ GQG QGN GNE NEQ EQY QYV	KLGGALQAK	CAAPDQGGSEKLVF	TRAV8-6	TRAJ57	CASSWGQGNEQYV	TRBV7-6	TRBJ2-7
25264	CAV AVR VRD RDM DMG MGT GTG TGG GGF GFK FKT KTI TIF	CAI AIQ IQE QED EDT DTD TDT DTQ TQY QYF	RAKFKQLL	CAVRDMGTGGFKTIF	TRAV3	TRAJ9	CAIQEDTDTQYF	TRBV7-9	TRBJ2-3
6686	CAG AGN GNY NYG YGG GGS GSQ SQG QGN GNL NLI LIF	CAS ASS SSI SIR IRS RSD SDE DEK EKL KLF LFF	GILGFVFTL	CAGNYGGSQGNLIF	TRAV25	TRAJ42	CASSIRSDEKLFF	TRBV19	TRBJ1-4
34907	CAA AAS ASA SAT ATG TGG GGK GKR KRF	CAS ASS SSP SPG PGT GTG TGG GGF GFQ FQP QPQ PQH QHF	KLGGALQAK	CAASATGGKRF	TRAV29DV5	TRAJ43	CASSPGTGGFQPQHF	TRBV10-2	TRBJ1-5
7318	CAG AGE GEG EGG GGG GGS GSQ SQG QGN GNL NLI LIF	CAS ASS SSI SIR IRS RSS SSY SYE YEQ EQY QYF	GILGFVFTL	CAGEGGGSQGNLIF	TRAV27	TRAJ42	CASSIRSSYEQYF	TRBV19	TRBJ2-7
28822	CGT GTE TEY EYP YPN PND NDY DYK YKL KLS LSF	CAS ASS SSY SYL YLD LDE DEQ EQF QFF	GLCTLVAML	CGTEYPNDYKLSF	TRAV30	TRAJ20	CASSYLDEQFF	TRBV6-6	TRBJ2-1
25100	CAL ALS LSP SPY PYS YSG SGA GAG AGS GSY SYQ YQL QLT LTF	CAS ASS SSS SSP SPE PEI EIG IGR GRS RST STD TDT DTQ TQY QYF	KLGGALQAK	CALSPYSGAGSYQLTF	TRAV9-2	TRAJ28	CASSSPEIGRSTDTQYF	TRBV7-8	TRBJ2-3
35397	CVV VVI VIK IKF KFE FET ETS TSG SGT GTY TYK YKY KYI YIF	CSA SAA AAG AGQ GQA QAN ANT NTG TGE GEL ELF LFF	KLGGALQAK	CVVIKFETSGTYKYIF	TRAV12-1	TRAJ40	CSAAGQANTGELFF	TRBV20-1	TRBJ2-2
25382	CAA AAT ATN TNN NNA NAG AGN GNM NML MLT LTF	CAS ASS SSG SGS GSS SSR SRT RTP TPN PNT NTE TEA EAF AFF	GLCTLVAML	CAATNNAGNMLTF	TRAV13-1	TRAJ39	CASSGSSRTPNTEAFF	TRBV7-9	TRBJ1-1
17865	CAV AVR VRD RDA DAH AHN HNN NNA NAG AGN GNM NML MLT LTF	CAS ASS SSV SVT VTS TSS SSR SRG RGG GGT GTD TDT DTQ TQY QYF	KLGGALQAK	CAVRDAHNNAGNMLTF	TRAV1-1	TRAJ39	CASSVTSSRGGTDTQYF	TRBV9	TRBJ2-3
34611	CAV AVD VDS DSN SNY NYQ YQL QLI LIW	CAS ASS SSF SFR FRA RAF AFF	KLGGALQAK	CAVDSNYQLIW	TRAV12-2	TRAJ33	CASSFRAFF	TRBV27	TRBJ1-1
20783	CAS ASS SSM SME MEY EYG YGN GNK NKL KLV LVF	CAS ASS SSL SLR LRD RDG DGS GSE SEA EAF AFF	RAKFKQLL	CASSMEYGNKLVF	TRAV27	TRAJ47	CASSLRDGSEAFF	TRBV5-6	TRBJ1-1
28415	CGT GTG TGF GFT FTQ TQG QGG GGS GSE SEK EKL KLV LVF	CAS ASS SSS SSP SPG PGT GTG TGI GIS ISY SYE YEQ EQY QYF	KLGGALQAK	CGTGFTQGGSEKLVF	TRAV30	TRAJ57	CASSSPGTGISYEQYF	TRBV13	TRBJ2-7
34261	CAL ALS LSE SEG EGT GTG TGR GRR RRA RAL ALT LTF	CAS ASS SSQ SQD QDN DNR NRG RGA GAT ATD TDT DTQ TQY QYF	KLGGALQAK	CALSEGTGRRALTF	TRAV19	TRAJ5	CASSQDNRGATDTQYF	TRBV4-3	TRBJ2-3
30984	CAE AER ERP RPP PPN PNQ NQE QET ETS TSG SGS GSR SRL RLT LTF	CAS ASS SSI SIR IRS RSS SSY SYE YEQ EQY QYF	GILGFVFTL	CAERPPNQETSGSRLTF	TRAV13-2	TRAJ58	CASSIRSSYEQYF	TRBV19	TRBJ2-7
35337	CAF AFN FNT NTG TGN GNQ NQF QFY FYF	CAW AWS WSV SVL VLS LSY SYT YTD TDT DTQ TQY QYF	KLGGALQAK	CAFNTGNQFYF	TRAV38-2DV8	TRAJ49	CAWSVLSYTDTQYF	TRBV30	TRBJ2-3
6335	CAV AVT VTP TPS PSN SNT NTG TGK GKL KLI LIF	CAS ASS SST STR TRA RAG AGG GGV GVG VGQ GQF QFF	GILGFVFTL	CAVTPSNTGKLIF	TRAV12-2	TRAJ37	CASSTRAGGVGQFF	TRBV19	TRBJ2-1
24364	CIL ILR LRE REF EFY FYN YND NDM DMR MRF	CAS ASS SSL SLG LGT GTS TSG SGG GGT GTG TGE GEL ELF LFF	RAKFKQLL	CILREFYNDMRF	TRAV26-2	TRAJ43	CASSLGTSGGTGELFF	TRBV7-3	TRBJ2-2
36263	CAV AVD VDL DLM LMK MKT KTS TSY SYD YDK DKV KVI VIF	CAW AWS WSA SAD ADR DRA RAY AYE YEQ EQY QYF	IVTDFSVIK	CAVDLMKTSYDKVIF	TRAV21	TRAJ50	CAWSADRAYEQYF	TRBV30	TRBJ2-7
23843	CAV AVE VEA EAR ARE REG EGG GGS GSE SEK EKL KLV LVF	CAS ASK SKL KLS LSF SFN FNY NYG YGY GYT YTF	KLGGALQAK	CAVEAREGGSEKLVF	TRAV36DV7	TRAJ57	CASKLSFNYGYTF	TRBV5-1	TRBJ1-2
34374	CAG AGV GVV VVQ VQA QAG AGG GGT GTS TSY SYG YGK GKL KLT LTF	CAS ASS SSG SGV GVA VAY AYN YNE NEQ EQF QFF	KLGGALQAK	CAGVVQAGGTSYGKLTF	TRAV27	TRAJ52	CASSGVAYNEQFF	TRBV9	TRBJ2-1
36330	CAT ATD TDG DGG GGI GIK IKA KAA AAG AGN GNK NKL KLT LTF	CAS ASS SSE SEQ EQY QYT YTE TEA EAF AFF	KLGGALQAK	CATDGGIKAAGNKLTF	TRAV17	TRAJ17	CASSEQYTEAFF	TRBV6-1	TRBJ1-1
2397	CAL ALI LIP IPA PAG AGG GGS GSY SYI YIP IPT PTF	CAS ASS SST STQ TQT QTG TGS GSN SNT NTG TGE GEL ELF LFF	KLGGALQAK	CALIPAGGSYIPTF	TRAV19	TRAJ6	CASSTQTGSNTGELFF	TRBV27	TRBJ2-2
34709	CAG AGP GPQ PQT QTL TLS LSG SGG GGY GYN YNK NKL KLI LIF	CAS ASS SSY SYL YLG LGD GDN DNN NNQ NQP QPQ PQH QHF	KLGGALQAK	CAGPQTLSGGYNKLIF	TRAV8-4	TRAJ4	CASSYLGDNNQPQHF	TRBV27	TRBJ1-5
34987	CAL ALS LSE SEG EGL GLT LTF	CAS ASS SSL SLS LSG SGG GGG GGQ GQS QST STD TDT DTQ TQY QYF	KLGGALQAK	CALSEGLTF	TRAV9-2	TRAJ28	CASSLSGGGQSTDTQYF	TRBV11-2	TRBJ2-3
3835	CAV AVQ VQA QAV AVG VGS GSD SDG DGQ GQK QKL KLL LLF	CAS ASS SSW SWG WGG GGG GGS GSH SHY HYG YGY GYT YTF	IVTDFSVIK	CAVQAVGSDGQKLLF	TRAV20	TRAJ16	CASSWGGGSHYGYTF	TRBV11-2	TRBJ1-2
36208	CAL ALG LGP GPD PDM DMG MGS GSN SNY NYQ YQL QLI LIW	CAT ATK TKD KDG DGE GES ESY SYG YGY GYT YTF	KLGGALQAK	CALGPDMGSNYQLIW	TRDV1	TRAJ33	CATKDGESYGYTF	TRBV10-2	TRBJ1-2
35962	CAV AVM VMD MDR DRD RDD DDK DKI KII IIF	CAT ATG TGQ GQG QGA GAA AAE AEA EAF AFF	KLGGALQAK	CAVMDRDDKIIF	TRAV12-2	TRAJ30	CATGQGAAEAFF	TRBV19	TRBJ1-1
