25730	CAA AAS ASE SET ETS TSY SYD YDK DKV KVI VIF	CAS ASS SSP SPV PVT VTG TGG GGG GGS GSG SGA GAN ANV NVL VLT LTF	RAKFKQLL	CAASETSYDKVIF	TRAV13-1	TRAJ50	CASSPVTGGGSGANVLTF	TRBV7-9	TRBJ2-6
5513	CAA AAP APT PTD TDS DSW SWG WGK GKL KLQ LQF	CAS ASS SSP SPG PGG GGH GHQ HQP QPQ PQH QHF	KLGGALQAK	CAAPTDSWGKLQF	TRAV12-2	TRAJ24	CASSPGGHQPQHF	TRBV6-3	TRBJ1-5
35210	CAG AGA GAP APL PLT LTG TGT GTA TAS ASK SKL KLT LTF	CAS ASS SSA SAS ASS SSG SGG GGA GAY AYY YYT YTQ TQY QYF	KLGGALQAK	CAGAPLTGTASKLTF	TRAV22	TRAJ44	CASSASSGGAYYTQYF	TRBV7-9	TRBJ2-3
5473	CAE AEN ENG NGG GGG GGG GGA GAD ADG DGL GLT LTF	CAS ASS SST STT TTA TAG AGD GDT DTE TEA EAF AFF	KLGGALQAK	CAENGGGGADGLTF	TRAV13-2	TRAJ45	CASSTTAGDTEAFF	TRBV6-6	TRBJ1-1
35898	CAE AET ETP TPG PGS GSS SSN SNT NTG TGK GKL KLI LIF	CAS ASS SSL SLP LPA PAQ AQS QSS SSG SGR GRF RFF FFY FYE YEQ EQF QFF	KLGGALQAK	CAETPGSSNTGKLIF	TRAV5	TRAJ37	CASSLPAQSSGRFFYEQFF	TRBV19	TRBJ2-1
26190	CAA AAS ASA SAT ATR TRG RGT GTD TDK DKL KLI LIF	CSA SAR ARA RAL ALP LPV PVG VGN GNT NTI TIY IYF	GLCTLVAML	CAASATRGTDKLIF	TRAV29DV5	TRAJ34	CSARALPVGNTIYF	TRBV20-1	TRBJ1-3
2293	CAV AVS VSQ SQW QWA WAQ AQK QKL KLV LVF	CAS ASS SSL SLG LGL GLA LAG AGL GLN LNE NEQ EQF QFF	KLGGALQAK	CAVSQWAQKLVF	TRAV8-6	TRAJ54	CASSLGLAGLNEQFF	TRBV5-4	TRBJ2-1
269	CAA AAL ALE LEL ELN LNY NYG YGQ GQN QNF NFV FVF	CAS ASS SST STG TGR GRN RNY NYG YGY GYT YTF	GILGFVFTL	CAALELNYGQNFVF	TRAV25	TRAJ26	CASSTGRNYGYTF	TRBV3-1	TRBJ1-2
36067	CAL ALS LSE SEA EAF AFT FTG TGG GGG GGN GNK NKL KLT LTF	CAS ASS SST STL TLT LTI TIA IAT ATL TLD LDN DNE NEQ EQF QFF	KLGGALQAK	CALSEAFTGGGNKLTF	TRAV19	TRAJ10	CASSTLTIATLDNEQFF	TRBV12-4	TRBJ2-1
26519	CAE AED EDN DNN NNA NAR ARL RLM LMF	CSA SAS ASR SRP RPY PYS YSN SNQ NQP QPQ PQH QHF	GLCTLVAML	CAEDNNARLMF	TRAV5	TRAJ31	CSASRPYSNQPQHF	TRBV20-1	TRBJ1-5
17956	CAE AEW EWG WGS GSG SGN GNT NTG TGK GKL KLI LIF	CAS ASS SSV SVA VAG AGG GGT GTE TEQ EQY QYF	KLGGALQAK	CAEWGSGNTGKLIF	TRAV5	TRAJ37	CASSVAGGTEQYF	TRBV9	TRBJ2-7
34007	CVV VVS VSD SDR DRG RGG GGT GTD TDK DKL KLI LIF	CAT ATS TSD SDG DGR GRL RLW LWI WIK IKQ KQY QYF	KLGGALQAK	CVVSDRGGTDKLIF	TRAV8-2	TRAJ34	CATSDGRLWIKQYF	TRBV24-1	TRBJ2-3
26065	CVV VVS VSA SAG AGL GLG LGK GKT KTS TSY SYD YDK DKV KVI VIF	CRY RYK YKG KGQ GQG QGV GVS VSG SGA GAN ANV NVL VLT LTF	GILGFVFTL	CVVSAGLGKTSYDKVIF	TRAV10	TRAJ50	CRYKGQGVSGANVLTF	TRBV20-1	TRBJ2-6
33988	CAV AVN VNV NVD VDT DTG TGR GRR RRA RAL ALT LTF	CAT ATR TRY RYS YSE SEN ENT NTE TEA EAF AFF	KLGGALQAK	CAVNVDTGRRALTF	TRAV12-2	TRAJ5	CATRYSENTEAFF	TRBV24-1	TRBJ1-1
2422	CAV AVN VNP NPE PEG EGA GAS ASK SKI KII IIF	CAS ASS SSL SLD LDV DVG VGR GRA RAA AAS ASY SYE YEQ EQY QYF	KLGGALQAK	CAVNPEGASKIIF	TRAV8-1	TRAJ3	CASSLDVGRAASYEQYF	TRBV5-1	TRBJ2-7
14251	CAA AAS ASE SET ETS TSY SYD YDK DKV KVI VIF	CAS ASR SRP RPS PSG SGG GGA GAE AET ETQ TQY QYF	RAKFKQLL	CAASETSYDKVIF	TRAV13-1	TRAJ50	CASRPSGGAETQYF	TRBV12-4	TRBJ2-5
655	CVV VVS VSA SAP APH PHT HTD TDK DKL KLI LIF	CAS ASQ SQV QVD VDT DTF TFT FTD TDG DGG GGE GEL ELF LFF	KLGGALQAK	CVVSAPHTDKLIF	TRAV10	TRAJ34	CASQVDTFTDGGELFF	TRBV28	TRBJ2-2
5040	CVG VGR GRG RGD GDM DMR MRF	CAS ASS SSA SAD ADT DTV TVY VYN YNE NEQ EQF QFF	KLGGALQAK	CVGRGDMRF	TRAV17	TRAJ43	CASSADTVYNEQFF	TRBV7-9	TRBJ2-1
7255	CAA AAS ASI SIG IGS GSG SGY GYS YST STL TLT LTF	CAS ASS SSQ SQA QAA AAG AGD GDN DNE NEK EKL KLF LFF	KLGGALQAK	CAASIGSGYSTLTF	TRAV13-1	TRAJ11	CASSQAAGDNEKLFF	TRBV14	TRBJ1-4
35098	CVV VVR VRS RSG SGG GGY GYN YNK NKL KLI LIF	CAS ASS SSR SRM RMG MGA GAR ARD RDG DGY GYT YTF	KLGGALQAK	CVVRSGGYNKLIF	TRAV10	TRAJ4	CASSRMGARDGYTF	TRBV7-2	TRBJ1-2
34311	CAL ALD LDY DYS YSP SPT PTG TGN GNQ NQF QFY FYF	CAS ASS SSQ SQD QDL DLG LGG GGV GVS VSY SYN YNE NEQ EQF QFF	KLGGALQAK	CALDYSPTGNQFYF	TRAV6	TRAJ49	CASSQDLGGVSYNEQFF	TRBV3-1	TRBJ2-1
34812	CAV AVD VDP DPL PLS LSS SSG SGS GSA SAR ARQ RQL QLT LTF	CAS ASS SSF SFG FGG GGS GSG SGN GNQ NQP QPQ PQH QHF	KLGGALQAK	CAVDPLSSGSARQLTF	TRAV2	TRAJ22	CASSFGGSGNQPQHF	TRBV12-4	TRBJ1-5
31901	CAA AAM AME MET ETS TSY SYD YDK DKV KVI VIF	CAS ASS SSW SWL WLS LSN SNQ NQP QPQ PQH QHF	RAKFKQLL	CAAMETSYDKVIF	TRAV13-1	TRAJ50	CASSWLSNQPQHF	TRBV19	TRBJ1-5
2329	CAM AMR MRE REG EGP GPG PGK GKL KLI LIF	CAS ASR SRR RRD RDG DGS GSY SYE YEQ EQY QYF	KLGGALQAK	CAMREGPGKLIF	TRAV14DV4	TRAJ23	CASRRDGSYEQYF	TRBV27	TRBJ2-7
35647	CAV AVR VRG RGE GED EDT DTD TDK DKL KLI LIF	CAS ASS SST STR TRT RTD TDP DPP PPR PRE REQ EQY QYF	KLGGALQAK	CAVRGEDTDKLIF	TRAV1-2	TRAJ34	CASSTRTDPPREQYF	TRBV6-5	TRBJ2-7
25723	CVV VVN VNM NMF MFS FSG SGA GAG AGS GSY SYQ YQL QLT LTF	CAS ASS SSP SPR PRT RTG TGN GNT NTG TGE GEL ELF LFF	IVTDFSVIK	CVVNMFSGAGSYQLTF	TRAV12-1	TRAJ28	CASSPRTGNTGELFF	TRBV7-9	TRBJ2-2
36098	CAV AVD VDL DLM LMK MKT KTS TSY SYD YDK DKV KVI VIF	CAT ATR TRG RGV GVY VYE YEQ EQF QFF	IVTDFSVIK	CAVDLMKTSYDKVIF	TRAV21	TRAJ50	CATRGVYEQFF	TRBV4-3	TRBJ2-1
23839	CAA AAS ASE SEG EGA GAP APD PDK DKL KLI LIF	CAS ASS SSL SLL LLG LGV GVS VSA SAQ AQE QET ETQ TQY QYF	RAKFKQLL	CAASEGAPDKLIF	TRAV13-1	TRAJ34	CASSLLGVSAQETQYF	TRBV12-4	TRBJ2-5
14193	CAA AAM AME MET ETS TSY SYD YDK DKV KVI VIF	CAS ASS SSY SYT YTG TGG GGL GLR LRY RYG YGY GYT YTF	RAKFKQLL	CAAMETSYDKVIF	TRAV13-1	TRAJ50	CASSYTGGLRYGYTF	TRBV12-3	TRBJ1-2
35053	CVV VVN VNV NVE VEY EYG YGN GNK NKL KLV LVF	CAS ASS SSL SLG LGQ GQD QDG DGY GYT YTF	KLGGALQAK	CVVNVEYGNKLVF	TRAV12-1	TRAJ47	CASSLGQDGYTF	TRBV7-8	TRBJ1-2
34137	CAV AVR VRP RPD PDN DNT NTD TDK DKL KLI LIF	CAS ASS SSP SPS PSW SWY WYN YNE NEQ EQF QFF	KLGGALQAK	CAVRPDNTDKLIF	TRAV3	TRAJ34	CASSPSWYNEQFF	TRBV2	TRBJ2-1
2281	CAV AVA VAV AVG VGV GVS VSG SGG GGG GGA GAD ADG DGL GLT LTF	CAS ASS SSG SGI GIW IWD WDF DFT FTD TDT DTQ TQY QYF	GILGFVFTL	CAVAVGVSGGGADGLTF	TRAV12-2	TRAJ45	CASSGIWDFTDTQYF	TRBV5-5	TRBJ2-3
33589	CAF AFM FMV MVD VDA DAG AGG GGT GTS TSY SYG YGK GKL KLT LTF	CAS ASS SST STG TGA GAY AYG YGY GYT YTF	GILGFVFTL	CAFMVDAGGTSYGKLTF	TRAV38-1	TRAJ52	CASSTGAYGYTF	TRBV19	TRBJ1-2
15702	CAY AYR YRS RSD SDS DSG SGT GTY TYK YKY KYI YIF	CAS ASS SST STS TST STG TGT GTG TGY GYG YGY GYT YTF	RAKFKQLL	CAYRSDSGTYKYIF	TRAV38-2DV8	TRAJ40	CASSTSTGTGYGYTF	TRBV4-1	TRBJ1-2
15382	CAA AAS ASE SEV EVP VPQ PQL QLT LTF	CAS ASS SSQ SQT QTG TGT GTL TLN LNT NTE TEA EAF AFF	RAKFKQLL	CAASEVPQLTF	TRAV13-1	TRAJ28	CASSQTGTLNTEAFF	TRBV4-1	TRBJ1-1
25717	CAA AAT ATE TET ETS TSY SYD YDK DKV KVI VIF	CAS ASS SSP SPL PLG LGK GKQ KQE QET ETQ TQY QYF	RAKFKQLL	CAATETSYDKVIF	TRAV13-1	TRAJ50	CASSPLGKQETQYF	TRBV7-9	TRBJ2-5
7080	CAV AVN VNK NKG KGG GGG GGS GSQ SQG QGN GNL NLI LIF	CAS ASS SSM SMR MRA RAS ASY SYE YEQ EQY QYF	GILGFVFTL	CAVNKGGGSQGNLIF	TRAV12-2	TRAJ42	CASSMRASYEQYF	TRBV19	TRBJ2-7
36152	CIT ITG TGG GGG GGA GAD ADG DGL GLT LTF	CAT ATS TSR SRD RDR DRL RLG LGR GRG RGK GKG KGT GTE TEA EAF AFF	KLGGALQAK	CITGGGADGLTF	TRAV26-1	TRAJ45	CATSRDRLGRGKGTEAFF	TRBV15	TRBJ1-1
23804	CAA AAS ASE SET ETS TSY SYD YDK DKV KVI VIF	CAS ASS SSP SPH PHF HFQ FQV QVD VDT DTG TGE GEL ELF LFF	RAKFKQLL	CAASETSYDKVIF	TRAV13-1	TRAJ50	CASSPHFQVDTGELFF	TRBV27	TRBJ2-2
14	CAM AMF MFG FGF GFQ FQK QKL KLV LVF	CAT ATS TSD SDL DLG LGS GSN SNG NGE GEL ELF LFF	KLGGALQAK	CAMFGFQKLVF	TRAV12-3	TRAJ8	CATSDLGSNGELFF	TRBV24-1	TRBJ2-2
2268	CAV AVN VNM NMY MYG YGD GDS DSS SSY SYK YKL KLI LIF	CAS ASS SSS SST STD TDT DTQ TQY QYF	KLGGALQAK	CAVNMYGDSSYKLIF	TRAV12-2	TRAJ12	CASSSTDTQYF	TRBV5-6	TRBJ2-3
34783	CVV VVK VKT KTD TDN DNA NAG AGN GNM NML MLT LTF	CAS ASS SSP SPG PGT GTE TEN ENY NYN YNS NSP SPL PLH LHF	KLGGALQAK	CVVKTDNAGNMLTF	TRAV12-1	TRAJ39	CASSPGTENYNSPLHF	TRBV5-1	TRBJ1-6
34281	CAM AMS MSG SGF GFW FWS WSG SGG GGS GSN SNY NYK YKL KLT LTF	CAS ASS SSQ SQK QKG KGL GLA LAA AAG AGE GEL ELF LFF	KLGGALQAK	CAMSGFWSGGSNYKLTF	TRAV12-3	TRAJ53	CASSQKGLAAGELFF	TRBV4-3	TRBJ2-2
35236	CAA AAR ARI RIT ITG TGT GTA TAS ASK SKL KLT LTF	CAS ASS SSL SLM LMG MGD GDE DEA EAF AFF	KLGGALQAK	CAARITGTASKLTF	TRAV29DV5	TRAJ44	CASSLMGDEAFF	TRBV7-9	TRBJ1-1
18246	CAA AAL ALM LMN MNR NRD RDD DDK DKI KII IIF	CAS ASS SSL SLR LRD RDG DGS GSE SEA EAF AFF	RAKFKQLL	CAALMNRDDKIIF	TRAV13-1	TRAJ30	CASSLRDGSEAFF	TRBV5-6	TRBJ1-1
170	CAV AVN VNG NGG GGN GNQ NQF QFY FYF	CAS ASS SSL SLE LEM EMG MGA GAG AGT GTE TEA EAF AFF	ELAGIGILTV	CAVNGGNQFYF	TRAV12-2	TRAJ49	CASSLEMGAGTEAFF	TRBV4-2	TRBJ1-1
5543	CAV AVG VGG GGT GTG TGK GKL KLI LIF	CAS ASG SGL GLS LSG SGD GDE DEQ EQY QYF	ELAGIGILTV	CAVGGTGKLIF	TRAV12-2	TRAJ37	CASGLSGDEQYF	TRBV19	TRBJ2-7
35363	CAA AAS ASA SAA AAG AGK GKS KST STF	CSA SAR ARE REG EGV GVY VYE YEQ EQF QFF	KLGGALQAK	CAASAAGKSTF	TRAV29DV5	TRAJ27	CSAREGVYEQFF	TRBV20-1	TRBJ2-1
34455	CAM AMS MSY SYS YSN SNF NFG FGN GNE NEK EKL KLT LTF	CAS ASI SIG IGL GLS LSS SSG SGN GNT NTI TIY IYF	ELAGIGILTV	CAMSYSNFGNEKLTF	TRAV12-3	TRAJ48	CASIGLSSGNTIYF	TRBV5-6	TRBJ1-3
35593	CAV AVA VAG AGG GGT GTS TSY SYG YGK GKL KLT LTF	CAS ASS SSS SSG SGQ GQP QPP PPR PRS RSG SGN GNT NTI TIY IYF	KLGGALQAK	CAVAGGTSYGKLTF	TRAV12-2	TRAJ52	CASSSGQPPRSGNTIYF	TRBV13	TRBJ1-3
26059	CVV VVQ VQG QGG GGA GAD ADG DGL GLT LTF	CAW AWS WSW SWD WDR DRG RGY GYN YNE NEQ EQF QFF	KLGGALQAK	CVVQGGADGLTF	TRAV10	TRAJ45	CAWSWDRGYNEQFF	TRBV30	TRBJ2-1
34804	CAA AAS ASE SES ESE SEG EGA GAG AGN GNM NML MLT LTF	CAS ASR SRG RGT GTL TLA LAG AGW GWP WPP PPE PET ETQ TQY QYF	KLGGALQAK	CAASESEGAGNMLTF	TRAV29DV5	TRAJ39	CASRGTLAGWPPETQYF	TRBV12-4	TRBJ2-5
35181	CAV AVG VGA GAY AYS YSG SGA GAG AGS GSY SYQ YQL QLT LTF	CAS ASS SSS SSG SGD GDS DSF SFF FFT FTG TGE GEL ELF LFF	KLGGALQAK	CAVGAYSGAGSYQLTF	TRAV8-3	TRAJ28	CASSSGDSFFTGELFF	TRBV7-9	TRBJ2-2
26022	CAV AVR VRV RVG VGT GTT TTD TDS DSL SLL	CAS ASS SSP SPL PLS LST STD TDT DTQ TQY QYF	GILGFVFTL	CAVRVGTTDSLL	TRAV12-2	TRAJ7	CASSPLSTDTQYF	TRBV19	TRBJ2-3
35456	CVV VVN VNR NRG RGN GNY NYG YGQ GQN QNF NFV FVF	CSA SAS ASS SSG SGG GGG GGY GYE YEQ EQY QYF	KLGGALQAK	CVVNRGNYGQNFVF	TRAV12-1	TRAJ26	CSASSGGGYEQYF	TRBV20-1	TRBJ2-7
35719	CAT ATE TEG EGG GGL GLY LYN YNF NFN FNK NKF KFY FYF	CAS ASS SSY SYG YGG GGQ GQR QRA RAS ASY SYE YEQ EQY QYF	KLGGALQAK	CATEGGLYNFNKFYF	TRAV17	TRAJ21	CASSYGGQRASYEQYF	TRBV6-6	TRBJ2-7
5415	CAV AVS VSD SDR DRR RRS RSA SAS ASK SKI KII IIF	CAS ASS SSY SYE YED EDK DKY KYQ YQP QPQ PQH QHF	IVTDFSVIK	CAVSDRRSASKIIF	TRAV8-6	TRAJ3	CASSYEDKYQPQHF	TRBV6-5	TRBJ1-5
5775	CAG AGG GGN GNY NYG YGG GGS GSQ SQG QGN GNL NLI LIF	CAS ASS SSI SIR IRS RSD SDE DEK EKL KLF LFF	GILGFVFTL	CAGGNYGGSQGNLIF	TRAV35	TRAJ42	CASSIRSDEKLFF	TRBV19	TRBJ1-4
35691	CAE AES ESG SGY GYN YNQ NQG QGG GGK GKL KLI LIF	CAS ASS SSE SEA EAY AYM YMN MNT NTG TGE GEL ELF LFF	KLGGALQAK	CAESGYNQGGKLIF	TRAV5	TRAJ23	CASSEAYMNTGELFF	TRBV6-1	TRBJ2-2
23890	CVV VVS VSE SEA EAG AGG GGY GYN YNK NKL KLI LIF	CAS ASS SSL SLG LGS GSG SGW GWE WEA EAF AFF	KLGGALQAK	CVVSEAGGYNKLIF	TRAV8-2	TRAJ4	CASSLGSGWEAFF	TRBV5-1	TRBJ1-1
21756	CAM AMR MRS RST STG TGN GNQ NQF QFY FYF	CAS ASS SSL SLR LRD RDG DGS GSE SEA EAF AFF	RAKFKQLL	CAMRSTGNQFYF	TRAV14DV4	TRAJ49	CASSLRDGSEAFF	TRBV5-6	TRBJ1-1
5041	CAA AAS ASA SAM AMI MIK IKT KTG TGA GAN ANN NNL NLF LFF	CAS ASS SSD SDI DIL ILA LAG AGV GVG VGE GEQ EQY QYF	KLGGALQAK	CAASAMIKTGANNLFF	TRAV29DV5	TRAJ36	CASSDILAGVGEQYF	TRBV7-9	TRBJ2-7
28417	CAT ATD TDV DVA VAR ARD RDS DSS SSY SYK YKL KLI LIF	CAS ASS SSS SST STM TMG MGD GDT DTI TIY IYF	KLGGALQAK	CATDVARDSSYKLIF	TRAV17	TRAJ12	CASSSTMGDTIYF	TRBV13	TRBJ1-3
29929	CAP APG PGE GET ETG TGA GAN ANN NNL NLF LFF	CAS ASS SSF SFY FYS YSN SNQ NQP QPQ PQH QHF	GILGFVFTL	CAPGETGANNLFF	TRAV8-3	TRAJ36	CASSFYSNQPQHF	TRBV19	TRBJ1-5
5984	CAA AAR ARV RVR VRG RGF GFG FGN GNV NVL VLH LHC	CAS ASS SSI SIR IRS RSS SSY SYE YEQ EQY QYF	GILGFVFTL	CAARVRGFGNVLHC	TRAV13-1	TRAJ35	CASSIRSSYEQYF	TRBV19	TRBJ2-7
28370	CAV AVA VAL ALW LWA WAR ARL RLM LMF	CAS ASS SSL SLG LGG GGQ GQG QGS GSN SNE NEQ EQF QFF	KLGGALQAK	CAVALWARLMF	TRAV36DV7	TRAJ31	CASSLGGQGSNEQFF	TRBV13	TRBJ2-1
24341	CAV AVM VMD MDS DSN SNY NYQ YQL QLI LIW	CAI AIS ISE SEA EAE AEP EPQ PQD QDT DTQ TQY QYF	KLGGALQAK	CAVMDSNYQLIW	TRAV1-2	TRAJ33	CAISEAEPQDTQYF	TRBV10-3	TRBJ2-3
35657	CAL ALM LMN MNY NYG YGG GGS GSQ SQG QGN GNL NLI LIF	CAS ASS SSY SYS YSG SGQ GQG QGY GYN YNE NEQ EQF QFF	KLGGALQAK	CALMNYGGSQGNLIF	TRAV19	TRAJ42	CASSYSGQGYNEQFF	TRBV6-5	TRBJ2-1
5125	CAV AVN VNV NVR VRG RGK GKL KLI LIF	CAW AWG WGG GGV GVQ VQG QGI GIN INE NEQ EQY QYF	ELAGIGILTV	CAVNVRGKLIF	TRAV12-2	TRAJ23	CAWGGVQGINEQYF	TRBV30	TRBJ2-7
32181	CAG AGP GPG PGD GDG DGG GGS GSQ SQG QGN GNL NLI LIF	CAS ASS SSF SFR FRS RSS SSE SET ETQ TQY QYF	GILGFVFTL	CAGPGDGGSQGNLIF	TRAV27	TRAJ42	CASSFRSSETQYF	TRBV19	TRBJ2-5
28577	CAV AVT VTI TIS ISG SGY GYS YST STL TLT LTF	CAS ASS SSY SYR YRL RLT LTV TVN VNT NTG TGE GEL ELF LFF	KLGGALQAK	CAVTISGYSTLTF	TRAV21	TRAJ11	CASSYRLTVNTGELFF	TRBV6-5	TRBJ2-2
23964	CAV AVG VGD GDN DNF NFN FNK NKF KFY FYF	CAS ASS SSY SYG YGT GTG TGE GEN ENT NTE TEA EAF AFF	RAKFKQLL	CAVGDNFNKFYF	TRAV8-3	TRAJ21	CASSYGTGENTEAFF	TRBV5-1	TRBJ1-1
33538	CGT GTS TSG SGA GAG AGS GSY SYQ YQL QLT LTF	CAS ASS SSQ SQR QRS RST STD TDT DTQ TQY QYF	GILGFVFTL	CGTSGAGSYQLTF	TRAV30	TRAJ28	CASSQRSTDTQYF	TRBV19	TRBJ2-3
280	CYS YST STW TWR WRL RLS LSC SCL CLL LLL LLC LCR CRD RDS DSA SAG AGA GAG AGS GSY SYQ YQL QLT LTF	CAS ASS SSA SAN ANR NRD RDT DTE TED EDT DTG TGE GEL ELF LFF	KLGGALQAK	CYSTWRLSCLLLCRDSAGAGSYQLTF	TRAV13-1	TRAJ28	CASSANRDTEDTGELFF	TRBV9	TRBJ2-2
35950	CAV AVA VAR ARE RET ETS TSG SGS GSR SRL RLT LTF	CAS AST STI TIT ITS TSG SGS GSS SSY SYN YNE NEQ EQF QFF	KLGGALQAK	CAVARETSGSRLTF	TRAV17	TRAJ58	CASTITSGSSYNEQFF	TRBV19	TRBJ2-1
29910	CAL ALK LKN KNN NND NDM DMR MRF	CAS ASS SSA SAR ARS RSS SSY SYE YEQ EQY QYF	GILGFVFTL	CALKNNDMRF	TRAV16	TRAJ43	CASSARSSYEQYF	TRBV19	TRBJ2-7
31679	CAM AMS MSG SGE GEG EGG GGS GSQ SQG QGN GNL NLI LIF	CAS ASS SST STR TRS RSN SNQ NQP QPQ PQH QHF	GILGFVFTL	CAMSGEGGSQGNLIF	TRAV12-3	TRAJ42	CASSTRSNQPQHF	TRBV19	TRBJ1-5
2931	CAF AFM FMN MNS NSG SGA GAG AGS GSY SYQ YQL QLT LTF	CAS ASS SSW SWG WGG GGG GGS GSH SHY HYG YGY GYT YTF	IVTDFSVIK	CAFMNSGAGSYQLTF	TRAV38-1	TRAJ28	CASSWGGGSHYGYTF	TRBV11-2	TRBJ1-2
24695	CAV AVS VSG SGR GRK RKI KII IIF	CAS ASS SSF SFA FAG AGD GDR DRG RGL GLG LGS GSY SYG YGY GYT YTF	KLGGALQAK	CAVSGRKIIF	TRAV8-4	TRAJ30	CASSFAGDRGLGSYGYTF	TRBV11-2	TRBJ1-2
34473	CAT ATD TDA DAD ADY DYG YGG GGS GSQ SQG QGN GNL NLI LIF	CAS ASS SSL SLD LDG DGQ GQV QVW VWS WSP SPL PLH LHF	KLGGALQAK	CATDADYGGSQGNLIF	TRAV17	TRAJ42	CASSLDGQVWSPLHF	TRBV5-6	TRBJ1-6
34183	CAV AVT VTG TGF GFQ FQK QKL KLV LVF	CAS ASS SSQ SQE QEG EGV GVA VAG AGG GGY GYN YNE NEQ EQF QFF	KLGGALQAK	CAVTGFQKLVF	TRAV21	TRAJ8	CASSQEGVAGGYNEQFF	TRBV4-1	TRBJ2-1
35184	CAG AGD GDL DLD LDY DYG YGQ GQN QNF NFV FVF	CAS ASS SSS SSR SRS RSR SRE REV EVE VEQ EQF QFF	KLGGALQAK	CAGDLDYGQNFVF	TRAV27	TRAJ26	CASSSRSREVEQFF	TRBV7-9	TRBJ2-1
7979	CVV VVN VNE NEN ENA NAG AGN GNM NML MLT LTF	CAS ASS SSF SFL FLD LDR DRG RGP GPN PNT NTE TEA EAF AFF	RAKFKQLL	CVVNENAGNMLTF	TRAV10	TRAJ39	CASSFLDRGPNTEAFF	TRBV12-3	TRBJ1-1
28604	CAV AVN VND NDL DLS LSG SGG GGS GSY SYI YIP IPT PTF	CAS ASS SSD SDP DPG PGN GNT NTQ TQY QYF	KLGGALQAK	CAVNDLSGGSYIPTF	TRAV8-1	TRAJ6	CASSDPGNTQYF	TRBV6-1	TRBJ2-3
5386	CAV AVG VGD GDN DNY NYG YGQ GQN QNF NFV FVF	CAS ASG SGG GGE GET ETQ TQY QYF	KLGGALQAK	CAVGDNYGQNFVF	TRAV8-3	TRAJ26	CASGGETQYF	TRBV6-5	TRBJ2-5
4980	CAV AVN VNI NIG IGG GGG GGS GSQ SQG QGN GNL NLI LIF	CAS ASS SSL SLY LYE YEQ EQY QYF	GILGFVFTL	CAVNIGGGSQGNLIF	TRAV12-2	TRAJ42	CASSLYEQYF	TRBV7-2	TRBJ2-7
285	CAH AHL HLQ LQG QGA GAQ AQK QKL KLV LVF	CAS ASS SSE SEG EGD GDR DRV RVT VTE TEA EAF AFF	IVTDFSVIK	CAHLQGAQKLVF	TRAV36DV7	TRAJ54	CASSEGDRVTEAFF	TRBV9	TRBJ1-1
35590	CIV IVM VMG MGY GYS YST STL TLT LTF	CAS ASS SSP SPD PDK DKA KAN ANT NTG TGE GEL ELF LFF	KLGGALQAK	CIVMGYSTLTF	TRAV26-1	TRAJ11	CASSPDKANTGELFF	TRBV13	TRBJ2-2
33827	CAG AGA GAG AGQ GQR QRG RGS GSQ SQG QGN GNL NLI LIF	CAS ASS SST STY TYS YSN SNQ NQP QPQ PQH QHF	GILGFVFTL	CAGAGQRGSQGNLIF	TRAV27	TRAJ42	CASSTYSNQPQHF	TRBV19	TRBJ1-5
26259	CAV AVL VLD LDS DSN SNY NYQ YQL QLI LIW	CSA SAR ARD RDL DLS LSG SGG GGS GSY SYN YNE NEQ EQF QFF	KLGGALQAK	CAVLDSNYQLIW	TRAV1-2	TRAJ33	CSARDLSGGSYNEQFF	TRBV20-1	TRBJ2-1
33851	CAA AAG AGE GEY EYG YGN GNK NKL KLV LVF	CAS ASS SSV SVR VRS RSS SSY SYE YEQ EQY QYF	GILGFVFTL	CAAGEYGNKLVF	TRAV29DV5	TRAJ47	CASSVRSSYEQYF	TRBV19	TRBJ2-7
5032	CAP APL PLS LSN SNF NFG FGN GNE NEK EKL KLT LTF	CAG AGA GAR ARV RVD VDT DTQ TQY QYF	KLGGALQAK	CAPLSNFGNEKLTF	TRAV38-2DV8	TRAJ48	CAGARVDTQYF	TRBV7-9	TRBJ2-3
34875	CAT ATD TDF DFK FKA KAN ANN NNL NLF LFF	CAS AST STS TSG SGR GRS RSN SNE NEQ EQF QFF	KLGGALQAK	CATDFKANNLFF	TRAV17	TRAJ36	CASTSGRSNEQFF	TRBV12-4	TRBJ2-1
35090	CAV AVR VRD RDN DNG NGN GNQ NQF QFY FYF	CAS ASS SSL SLD LDS DSA SAH AHE HEQ EQY QYV	KLGGALQAK	CAVRDNGNQFYF	TRAV3	TRAJ49	CASSLDSAHEQYV	TRBV7-2	TRBJ2-7
34986	CAA AAS ASG SGN GNN NNF NFN FNK NKF KFY FYF	CAS ASS SSL SLK LKT KTV TVN VNT NTE TEA EAF AFF	KLGGALQAK	CAASGNNFNKFYF	TRAV29DV5	TRAJ21	CASSLKTVNTEAFF	TRBV11-2	TRBJ1-1
35060	CLV LVG VGG GGG GGQ GQN QNF NFV FVF	CAS ASS SSL SLS LSE SEG EGP GPT PTG TGP GPY PYE YEQ EQY QYV	KLGGALQAK	CLVGGGQNFVF	TRAV4	TRAJ26	CASSLSEGPTGPYEQYV	TRBV7-8	TRBJ2-7
5515	CAV AVN VNG NGG GGG GGA GAD ADG DGL GLT LTF	CAS ASS SSP SPG PGV GVL VLA LAS ASN SNE NEQ EQF QFF	ELAGIGILTV	CAVNGGGADGLTF	TRAV12-2	TRAJ45	CASSPGVLASNEQFF	TRBV6-3	TRBJ2-1
25696	CAA AAA AAR ARM RMD MDS DSS SSY SYK YKL KLI LIF	CAS ASS SSL SLV LVS VSN SNE NEQ EQF QFF	RAKFKQLL	CAAARMDSSYKLIF	TRAV13-1	TRAJ12	CASSLVSNEQFF	TRBV7-9	TRBJ2-1
35553	CAA AAS AST STY TYS YSN SNT NTG TGK GKL KLI LIF	CSV SVE VEE EEW EWG WGR GRL RLG LGY GYG YGY GYT YTF	KLGGALQAK	CAASTYSNTGKLIF	TRAV23DV6	TRAJ37	CSVEEWGRLGYGYTF	TRBV29-1	TRBJ1-2
25008	CAA AAK AKE KEG EGY GYS YST STL TLT LTF	CAS ASS SSW SWG WGG GGG GGS GSH SHY HYG YGY GYT YTF	IVTDFSVIK	CAAKEGYSTLTF	TRAV13-1	TRAJ11	CASSWGGGSHYGYTF	TRBV11-2	TRBJ1-2
34010	CAL ALS LSD SDF DFS FSE SEN ENT NTP TPL PLV LVF	CAT ATS TSD SDL DLQ LQG QGG GGG GGP GPF PFN FNE NEQ EQF QFF	KLGGALQAK	CALSDFSENTPLVF	TRAV9-2	TRAJ29	CATSDLQGGGPFNEQFF	TRBV24-1	TRBJ2-1
34492	CAV AVD VDP DPR PRI RIL ILT LTG TGG GGG GGN GNK NKL KLT LTF	CAS ASS SSP SPG PGG GGP GPY PYF YFT FTD TDT DTQ TQY QYF	KLGGALQAK	CAVDPRILTGGGNKLTF	TRAV8-3	TRAJ10	CASSPGGPYFTDTQYF	TRBV5-6	TRBJ2-3
36092	CVG VGG GGG GGT GTD TDK DKL KLI LIF	CAS ASS SSQ SQE QEG EGR GRG RGI GIY IYG YGY GYT YTF	KLGGALQAK	CVGGGTDKLIF	TRAV10	TRAJ34	CASSQEGRGIYGYTF	TRBV4-3	TRBJ1-2
18230	CAD ADP DPG PGG GGG GGA GAD ADG DGL GLT LTF	CAS ASS SSL SLR LRD RDG DGS GSE SEA EAF AFF	RAKFKQLL	CADPGGGADGLTF	TRAV13-2	TRAJ45	CASSLRDGSEAFF	TRBV5-6	TRBJ1-1
35664	CAL ALS LSE SEG EGY GYN YNT NTD TDK DKL KLI LIF	CAS ASS SSY SYS YST STG TGN GNY NYG YGY GYT YTF	AVFDRKSDAK	CALSEGYNTDKLIF	TRAV19	TRAJ34	CASSYSTGNYGYTF	TRBV6-5	TRBJ1-2
35794	CAL ALS LSG SGS GSP SPD PDA DAG AGG GGT GTS TSY SYG YGK GKL KLT LTF	CAS ASK SKG KGL GLA LAG AGA GAP APG PGE GEL ELF LFF	KLGGALQAK	CALSGSPDAGGTSYGKLTF	TRAV9-2	TRAJ52	CASKGLAGAPGELFF	TRBV19	TRBJ2-2
35833	CAV AVN VNQ NQA QAG AGT GTA TAL ALI LIF	CAS ASS SSI SID IDG DGG GGV GVA VAY AYE YEQ EQY QYF	KLGGALQAK	CAVNQAGTALIF	TRAV12-2	TRAJ15	CASSIDGGVAYEQYF	TRBV19	TRBJ2-7
24685	CAV AVR VRD RDV DVW VWG WGK GKL KLQ LQF	CAI AIR IRR RRT RTG TGE GEA EAF AFF	GLCTLVAML	CAVRDVWGKLQF	TRAV3	TRAJ24	CAIRRTGEAFF	TRBV11-2	TRBJ1-1
35371	CAV AVA VAG AGK GKL KLI LIF	CSA SAS ASD SDW DWG WGD GDS DSN SNQ NQP QPQ PQH QHF	KLGGALQAK	CAVAGKLIF	TRAV12-2	TRAJ23	CSASDWGDSNQPQHF	TRBV20-1	TRBJ1-5
35562	CAV AVS VSP SPV PVS VSS SSG SGS GSA SAR ARQ RQL QLT LTF	CSV SVE VEW EWV WVG VGG GGP GPT PTE TEA EAF AFF	KLGGALQAK	CAVSPVSSGSARQLTF	TRAV21	TRAJ22	CSVEWVGGPTEAFF	TRBV29-1	TRBJ1-1
32699	CAG AGA GAG AGN GNI NIG IGK GKL KLI LIF	CAS ASS SSI SIR IRS RSS SSY SYE YEQ EQY QYF	GILGFVFTL	CAGAGNIGKLIF	TRAV27	TRAJ37	CASSIRSSYEQYF	TRBV19	TRBJ2-7
35374	CAA AAK AKL KLR LRN RNT NTD TDK DKL KLI LIF	CSA SAS ASG SGY GYG YGT GTL TLK LKV KVT VTD TDT DTQ TQY QYF	KLGGALQAK	CAAKLRNTDKLIF	TRAV23DV6	TRAJ34	CSASGYGTLKVTDTQYF	TRBV20-1	TRBJ2-3
36062	CIL ILR LRA RAL ALY LYN YNN NNN NND NDM DMR MRF	CAS ASS SSL SLE LEG EGS GSG SGV GVT VTG TGK GKL KLF LFF	AVFDRKSDAK	CILRALYNNNDMRF	TRAV26-2	TRAJ43	CASSLEGSGVTGKLFF	TRBV12-4	TRBJ1-4
7178	CAF AFM FMV MVG VGA GAG AGG GGT GTS TSY SYG YGK GKL KLT LTF	CAS ASS SST STG TGV GVY VYG YGY GYT YTF	GILGFVFTL	CAFMVGAGGTSYGKLTF	TRAV38-1	TRAJ52	CASSTGVYGYTF	TRBV19	TRBJ1-2
31081	CAF AFM FMV MVG VGA GAG AGG GGT GTS TSY SYG YGK GKL KLT LTF	CAS ASS SSI SIR IRS RSS SSY SYE YEQ EQY QYF	GILGFVFTL	CAFMVGAGGTSYGKLTF	TRAV38-1	TRAJ52	CASSIRSSYEQYF	TRBV19	TRBJ2-7
35468	CAL ALR LRG RGS GSG SGG GGA GAT ATN TNK NKL KLI LIF	CSA SAH AHD HDR DRG RGL GLN LNT NTE TEA EAF AFF	KLGGALQAK	CALRGSGGATNKLIF	TRAV19	TRAJ32	CSAHDRGLNTEAFF	TRBV29-1	TRBJ1-1
34870	CAG AGM GMD MDS DSS SSY SYK YKL KLI LIF	CAS ASS SST STT TTT TTS TSG SGY GYS YST STD TDT DTQ TQY QYF	KLGGALQAK	CAGMDSSYKLIF	TRAV25	TRAJ12	CASSTTTSGYSTDTQYF	TRBV12-4	TRBJ2-3
36008	CAV AVD VDS DSG SGN GNT NTP TPL PLV LVF	CAS ASS SSQ SQE QEY EYP YPG PGQ GQE QET ETQ TQY QYF	KLGGALQAK	CAVDSGNTPLVF	TRAV1-2	TRAJ29	CASSQEYPGQETQYF	TRBV14	TRBJ2-5
16809	CAH AHL HLQ LQG QGA GAQ AQK QKL KLV LVF	CAS ASS SSQ SQR QRP RPS PSE SEV EVG VGE GEL ELF LFF	RAKFKQLL	CAHLQGAQKLVF	TRAV36DV7	TRAJ54	CASSQRPSEVGELFF	TRBV4-2	TRBJ2-2
30545	CAV AVS VSG SGL GLN LNN NNQ NQG QGG GGK GKL KLI LIF	CAS ASS SSI SIR IRS RSS SSY SYE YEQ EQY QYF	GILGFVFTL	CAVSGLNNQGGKLIF	TRAV8-6	TRAJ23	CASSIRSSYEQYF	TRBV19	TRBJ2-7
35981	CAL ALK LKA KAA AAG AGN GNK NKL KLT LTF	CAS ASR SRD RDG DGT GTA TAN ANT NTE TEA EAF AFF	KLGGALQAK	CALKAAGNKLTF	TRAV8-3	TRAJ17	CASRDGTANTEAFF	TRBV25-1	TRBJ1-1
35012	CAA AAP APV PVG VGT GTY TYK YKY KYI YIF	CAS ASR SRT RTP TPL PLD LDT DTQ TQY QYF	KLGGALQAK	CAAPVGTYKYIF	TRAV35	TRAJ40	CASRTPLDTQYF	TRBV11-3	TRBJ2-3
35460	CAM AMR MRD RDS DSY SYT YTG TGG GGF GFK FKT KTI TIF	CSA SAT ATG TGT GTA TAS ASA SAS ASY SYE YEQ EQY QYF	KLGGALQAK	CAMRDSYTGGFKTIF	TRAV14DV4	TRAJ9	CSATGTASASYEQYF	TRBV20-1	TRBJ2-7
5273	CAM AMR MRE REG EGW GWN WNT NTG TGF GFQ FQK QKL KLV LVF	CSV SVE VET ETG TGG GGQ GQG QGA GAW AWD WDT DTQ TQY QYF	KLGGALQAK	CAMREGWNTGFQKLVF	TRAV14DV4	TRAJ8	CSVETGGQGAWDTQYF	TRBV29-1	TRBJ2-3
2232	CAV AVP VPF PFG FGN GNY NYG YGQ GQN QNF NFV FVF	CAS ASS SSP SPT PTG TGV GVG VGQ GQP QPQ PQH QHF	ELAGIGILTV	CAVPFGNYGQNFVF	TRAV12-2	TRAJ26	CASSPTGVGQPQHF	TRBV28	TRBJ1-5
32831	CAG AGA GAV AVG VGS GSS SSN SNT NTG TGK GKL KLI LIF	CAS ASS SSI SIR IRS RSS SSY SYE YEQ EQY QYF	GILGFVFTL	CAGAVGSSNTGKLIF	TRAV27	TRAJ37	CASSIRSSYEQYF	TRBV19	TRBJ2-7
36251	CAE AEK EKD KDT DTG TGG GGF GFK FKT KTI TIF	CAS AST STG TGG GGD GDR DRT RTY TYY YYE YEQ EQY QYF	KLGGALQAK	CAEKDTGGFKTIF	TRAV5	TRAJ9	CASTGGDRTYYEQYF	TRBV7-9	TRBJ2-7
7669	CAL ALS LSE SET ETS TSY SYD YDK DKV KVI VIF	CAS ASG SGP GPG PGQ GQG QGE GEY EYN YNE NEQ EQF QFF	RAKFKQLL	CALSETSYDKVIF	TRAV9-2	TRAJ50	CASGPGQGEYNEQFF	TRBV12-3	TRBJ2-1
35521	CAV AVI VIQ IQI QIN IND NDY DYK YKL KLS LSF	CSV SVD VDL DLE LEA EAN ANY NYG YGY GYT YTF	KLGGALQAK	CAVIQINDYKLSF	TRAV8-4	TRAJ20	CSVDLEANYGYTF	TRBV29-1	TRBJ1-2
14292	CAA AAS ASG SGY GYD YDY DYK YKL KLS LSF	CAS ASS SSP SPS PSS SSS SSY SYE YEQ EQY QYF	RAKFKQLL	CAASGYDYKLSF	TRAV13-1	TRAJ20	CASSPSSSYEQYF	TRBV12-4	TRBJ2-7
34563	CAT ATD TDA DAF AFM FMI MIY IYN YNQ NQG QGG GGK GKL KLI LIF	CAT ATS TSG SGE GEG EGQ GQQ QQQ QQE QET ETQ TQY QYF	KLGGALQAK	CATDAFMIYNQGGKLIF	TRAV17	TRAJ23	CATSGEGQQQETQYF	TRBV15	TRBJ2-5
4260	CAM AMR MRE REG EGQ GQA QAG AGS GSA SAR ARQ RQL QLT LTF	CAS ASS SSW SWG WGG GGG GGS GSH SHY HYG YGY GYT YTF	IVTDFSVIK	CAMREGQAGSARQLTF	TRAV14DV4	TRAJ22	CASSWGGGSHYGYTF	TRBV11-2	TRBJ1-2
6706	CAL ALL LLR LRR RRN RNA NAG AGN GNM NML MLT LTF	CAS ASS SSI SIR IRS RSN SNT NTE TEA EAF AFF	GILGFVFTL	CALLRRNAGNMLTF	TRAV19	TRAJ39	CASSIRSNTEAFF	TRBV19	TRBJ1-1
7368	CAG AGG GGG GGS GSQ SQG QGN GNL NLI LIF	CAS ASG SGN GNK NKD KDI DIH IHN HNE NEQ EQF QFF	GILGFVFTL	CAGGGSQGNLIF	TRAV27	TRAJ42	CASGNKDIHNEQFF	TRBV21-1	TRBJ2-1
31618	CVV VVK VKA KAY AYG YGQ GQN QNF NFV FVF	CAS ASS SSS SSR SRA RAS ASY SYE YEQ EQY QYF	GILGFVFTL	CVVKAYGQNFVF	TRAV12-1	TRAJ26	CASSSRASYEQYF	TRBV19	TRBJ2-7
34914	CAL ALS LSE SEE EEN ENN NNN NND NDM DMR MRF	CAI AIS ISD SDS DSG SGG GGR GRT RTD TDT DTQ TQY QYF	KLGGALQAK	CALSEENNNDMRF	TRAV19	TRAJ43	CAISDSGGRTDTQYF	TRBV10-3	TRBJ2-3
24221	CAE AER ERE RET ETS TSY SYD YDK DKV KVI VIF	CAS ASS SSF SFT FTG TGA GAE AEG EGT GTG TGE GEL ELF LFF	RAKFKQLL	CAERETSYDKVIF	TRAV13-2	TRAJ50	CASSFTGAEGTGELFF	TRBV12-4	TRBJ2-2
36005	CAF AFI FIG IGD GDA DAG AGG GGT GTS TSY SYG YGK GKL KLT LTF	CAS ASS SSQ SQD QDP DPP PPL PLW LWG WGQ GQT QTN TNE NEQ EQF QFF	KLGGALQAK	CAFIGDAGGTSYGKLTF	TRAV24	TRAJ52	CASSQDPPLWGQTNEQFF	TRBV14	TRBJ2-1
5259	CAV AVS VSP SPD PDK DKL KLI LIF	CSA SAS ASA SAG AGN GNQ NQP QPQ PQH QHF	ELAGIGILTV	CAVSPDKLIF	TRAV12-2	TRAJ34	CSASAGNQPQHF	TRBV20-1	TRBJ1-5
10031	CAV AVG VGD GDN DNF NFN FNK NKF KFY FYF	CAS ASS SSF SFS FSG SGN GNT NTG TGE GEL ELF LFF	RAKFKQLL	CAVGDNFNKFYF	TRAV8-3	TRAJ21	CASSFSGNTGELFF	TRBV12-3	TRBJ2-2
24347	CGT GTD TDK DKG KGG GGG GGS GSQ SQG QGN GNL NLI LIF	CAI AIS ISE SED EDI DIA IAG AGD GDY DYQ YQE QET ETQ TQY QYF	GILGFVFTL	CGTDKGGGSQGNLIF	TRAV30	TRAJ42	CAISEDIAGDYQETQYF	TRBV10-3	TRBJ2-5
8379	CAG AGG GGG GGS GSQ SQG QGN GNL NLI LIF	CAS ASS SSF SFS FSG SGN GNT NTG TGE GEL ELF LFF	GILGFVFTL	CAGGGSQGNLIF	TRAV27	TRAJ42	CASSFSGNTGELFF	TRBV12-3	TRBJ2-2
36089	CAS ASY SYY YYN YNT NTD TDK DKL KLI LIF	CAS ASS SSH SHT HTS TSA SAD ADE DEQ EQF QFF	KLGGALQAK	CASYYNTDKLIF	TRAV8-1	TRAJ34	CASSHTSADEQFF	TRBV4-3	TRBJ2-1
10574	CAM AMR MRD RDD DDD DDN DNY NYG YGQ GQN QNF NFV FVF	CAS ASS SSF SFS FSG SGN GNT NTG TGE GEL ELF LFF	RAKFKQLL	CAMRDDDNYGQNFVF	TRAV14DV4	TRAJ26	CASSFSGNTGELFF	TRBV12-3	TRBJ2-2
35624	CAL ALS LSE SEA EAL ALG LGG GGR GRR RRA RAL ALT LTF	CAS ASR SRS RSK SKT KTG TGS GSK SKQ KQP QPQ PQH QHF	IVTDFSVIK	CALSEALGGRRALTF	TRAV19	TRAJ5	CASRSKTGSKQPQHF	TRBV6-5	TRBJ1-5
35558	CAV AVI VII IIQ IQG QGA GAQ AQK QKL KLV LVF	CSV SVE VEQ EQM QMN MNT NTE TEA EAF AFF	KLGGALQAK	CAVIIQGAQKLVF	TRAV12-2	TRAJ54	CSVEQMNTEAFF	TRBV29-1	TRBJ1-1
35568	CAL ALG LGN GNS NSG SGY GYA YAL ALN LNF	CSV SVP VPG PGQ GQS QSS SSY SYE YEQ EQY QYF	KLGGALQAK	CALGNSGYALNF	TRAV38-2DV8	TRAJ41	CSVPGQSSYEQYF	TRBV29-1	TRBJ2-7
23205	CAG AGA GAK AKS KST STS TSG SGT GTY TYK YKY KYI YIF	CAT ATS TSS SSD SDR DRD RDQ DQP QPQ PQH QHF	KLGGALQAK	CAGAKSTSGTYKYIF	TRAV5	TRAJ40	CATSSDRDQPQHF	TRBV15	TRBJ1-5
36159	CAL ALS LSE SEA EAS ASS SSG SGG GGS GSY SYI YIP IPT PTF	CAS ASR SRR RRP RPT PTG TGE GEL ELF LFF	KLGGALQAK	CALSEASSGGSYIPTF	TRAV19	TRAJ6	CASRRPTGELFF	TRBV27	TRBJ2-2
26018	CGT GTE TEP EPK PKR KRG RGG GGA GAD ADG DGL GLT LTF	CAS AST STP TPS PSF SFG FGR GRN RNT NTG TGE GEL ELF LFF	KLGGALQAK	CGTEPKRGGADGLTF	TRAV30	TRAJ45	CASTPSFGRNTGELFF	TRBV7-6	TRBJ2-2
